Keratinocytes were transfected with either HA - tagged Snail ( Snail [ HA]; images on the left) or Snail ( HA) and Ecad ( HA) ( images on the right).	"Snail	55	60	Gene_or_geneproduct"	"Snail	63	68	Gene_or_geneproduct"	"Snail	99	104	Gene_or_geneproduct"	"Ecad	115	119	Gene_or_geneproduct"	"[{""token"": ""Snail"", ""start_span"": 55, ""end_span"": 60, ""type"": ""Gene_or_geneproduct""}, {""token"": ""Snail"", ""start_span"": 63, ""end_span"": 68, ""type"": ""Gene_or_geneproduct""}, {""token"": ""Snail"", ""start_span"": 99, ""end_span"": 104, ""type"": ""Gene_or_geneproduct""}, {""token"": ""Ecad"", ""start_span"": 115, ""end_span"": 119, ""type"": ""Gene_or_geneproduct""}]"
Keratinocytes were transfected with control vector ( K14), or Snail ( HA), or Snail ( HA) + E - cad ( HA).	"K14	53	56	Gene_or_geneproduct"	"Snail	62	67	Gene_or_geneproduct"	"Snail	78	83	Gene_or_geneproduct"	"E - cad	92	99	Gene_or_geneproduct"	"[{""token"": ""K14"", ""start_span"": 53, ""end_span"": 56, ""type"": ""Gene_or_geneproduct""}, {""token"": ""Snail"", ""start_span"": 62, ""end_span"": 67, ""type"": ""Gene_or_geneproduct""}, {""token"": ""Snail"", ""start_span"": 78, ""end_span"": 83, ""type"": ""Gene_or_geneproduct""}, {""token"": ""E - cad"", ""start_span"": 92, ""end_span"": 99, ""type"": ""Gene_or_geneproduct""}]"
Protein extracts were made from skins of P30 Wt and K14 - Snail Tg P30 mice ( blots on the left) and of newborn Wt and K14 - Cre / alpha - catenin ( fl / fl) conditionally null animals ( blots on the right) [ 7].	"K14	52	55	Gene_or_geneproduct"	"Snail	58	63	Gene_or_geneproduct"	"K14	119	122	Gene_or_geneproduct"	"alpha - catenin	131	146	Gene_or_geneproduct"	"[{""token"": ""K14"", ""start_span"": 52, ""end_span"": 55, ""type"": ""Gene_or_geneproduct""}, {""token"": ""Snail"", ""start_span"": 58, ""end_span"": 63, ""type"": ""Gene_or_geneproduct""}, {""token"": ""K14"", ""start_span"": 119, ""end_span"": 122, ""type"": ""Gene_or_geneproduct""}, {""token"": ""alpha - catenin"", ""start_span"": 131, ""end_span"": 146, ""type"": ""Gene_or_geneproduct""}]"
( A - D) Skins from TGF - beta 2 WT or KO E17. 5 embryos were analyzed for expression of TGF - beta 2 protein ( A), which is present in the epidermis and dermis as previously described [ 33] and in the hair bud, pSMAD2 ( B), Snail ( C), and Snail mRNA ( D).	"TGF - beta 2	20	32	Gene_or_geneproduct"	"TGF - beta 2	89	101	Gene_or_geneproduct"	"Snail	225	230	Gene_or_geneproduct"	"Snail	241	246	Gene_or_geneproduct"	"[{""token"": ""TGF - beta 2"", ""start_span"": 20, ""end_span"": 32, ""type"": ""Gene_or_geneproduct""}, {""token"": ""TGF - beta 2"", ""start_span"": 89, ""end_span"": 101, ""type"": ""Gene_or_geneproduct""}, {""token"": ""Snail"", ""start_span"": 225, ""end_span"": 230, ""type"": ""Gene_or_geneproduct""}, {""token"": ""Snail"", ""start_span"": 241, ""end_span"": 246, ""type"": ""Gene_or_geneproduct""}]"
( E) Western blot analyses of Snail expression in the skins of 2 - wk - old K14 - Smad2 transgenic ( SMAD2 TG) and WT littermate ( WT) mice.	"Snail	30	35	Gene_or_geneproduct"	"K14	76	79	Gene_or_geneproduct"	"Smad2	82	87	Gene_or_geneproduct"	"SMAD2	101	106	Gene_or_geneproduct"	"[{""token"": ""Snail"", ""start_span"": 30, ""end_span"": 35, ""type"": ""Gene_or_geneproduct""}, {""token"": ""K14"", ""start_span"": 76, ""end_span"": 79, ""type"": ""Gene_or_geneproduct""}, {""token"": ""Smad2"", ""start_span"": 82, ""end_span"": 87, ""type"": ""Gene_or_geneproduct""}, {""token"": ""SMAD2"", ""start_span"": 101, ""end_span"": 106, ""type"": ""Gene_or_geneproduct""}]"
Wnt and noggin signaling pathways are still intact in the TGF - beta 2 null hair as nuclear LEF - 1 ( I) and nuclear beta - catenin ( J) are still expressed.	"noggin	8	14	Gene_or_geneproduct"	"TGF - beta 2	58	70	Gene_or_geneproduct"	"LEF - 1	92	99	Gene_or_geneproduct"	"beta - catenin	117	131	Gene_or_geneproduct"	"[{""token"": ""noggin"", ""start_span"": 8, ""end_span"": 14, ""type"": ""Gene_or_geneproduct""}, {""token"": ""TGF - beta 2"", ""start_span"": 58, ""end_span"": 70, ""type"": ""Gene_or_geneproduct""}, {""token"": ""LEF - 1"", ""start_span"": 92, ""end_span"": 99, ""type"": ""Gene_or_geneproduct""}, {""token"": ""beta - catenin"", ""start_span"": 117, ""end_span"": 131, ""type"": ""Gene_or_geneproduct""}]"
Peripherin / RDS and ROM - 1 proteins ( localized in disc rims) and the opsin proteins ( localized throughout the discs) have important roles in the structural integrity of mature outer segments ( see [ 39, 29]).	"Peripherin	0	10	Gene_or_geneproduct"	"RDS	13	16	Gene_or_geneproduct"	"ROM - 1	21	28	Gene_or_geneproduct"	"opsin	72	77	Gene_or_geneproduct"	"[{""token"": ""Peripherin"", ""start_span"": 0, ""end_span"": 10, ""type"": ""Gene_or_geneproduct""}, {""token"": ""RDS"", ""start_span"": 13, ""end_span"": 16, ""type"": ""Gene_or_geneproduct""}, {""token"": ""ROM - 1"", ""start_span"": 21, ""end_span"": 28, ""type"": ""Gene_or_geneproduct""}, {""token"": ""opsin"", ""start_span"": 72, ""end_span"": 77, ""type"": ""Gene_or_geneproduct""}]"
Using immunohistochemistry, we examined the expression of common pre - synaptic terminal proteins, including KIF3a, SV2, and synaptophysin, and were unable to observe qualitative differences between Crx - / - and control tissue at P14 ( data not shown).	"KIF3a	109	114	Gene_or_geneproduct"	"SV2	116	119	Gene_or_geneproduct"	"synaptophysin	125	138	Gene_or_geneproduct"	"Crx	199	202	Gene_or_geneproduct"	"[{""token"": ""KIF3a"", ""start_span"": 109, ""end_span"": 114, ""type"": ""Gene_or_geneproduct""}, {""token"": ""SV2"", ""start_span"": 116, ""end_span"": 119, ""type"": ""Gene_or_geneproduct""}, {""token"": ""synaptophysin"", ""start_span"": 125, ""end_span"": 138, ""type"": ""Gene_or_geneproduct""}, {""token"": ""Crx"", ""start_span"": 199, ""end_span"": 202, ""type"": ""Gene_or_geneproduct""}]"
The mRNA for laminin beta2 was not detected in the SAGE study of the relative RNA levels in Crx - / - and Crx + / + and thus we cannot comment on whether the levels of RNA for laminin beta2 were altered.	"laminin beta2	13	26	Gene_or_geneproduct"	"Crx	92	95	Gene_or_geneproduct"	"Crx	106	109	Gene_or_geneproduct"	"laminin beta2	176	189	Gene_or_geneproduct"	"[{""token"": ""laminin beta2"", ""start_span"": 13, ""end_span"": 26, ""type"": ""Gene_or_geneproduct""}, {""token"": ""Crx"", ""start_span"": 92, ""end_span"": 95, ""type"": ""Gene_or_geneproduct""}, {""token"": ""Crx"", ""start_span"": 106, ""end_span"": 109, ""type"": ""Gene_or_geneproduct""}, {""token"": ""laminin beta2"", ""start_span"": 176, ""end_span"": 189, ""type"": ""Gene_or_geneproduct""}]"
First, PGC - 1 alpha activates the transcription of mitochondrial uncoupling protein - 1 ( UCP - 1) in BAT through interactions with the nuclear hormone receptors PPAR gamma and thyroid receptor [ 2].	"PGC - 1 alpha	7	20	Gene_or_geneproduct"	"mitochondrial uncoupling protein - 1	52	88	Gene_or_geneproduct"	"UCP - 1	91	98	Gene_or_geneproduct"	"PPAR gamma	163	173	Gene_or_geneproduct"	"[{""token"": ""PGC - 1 alpha"", ""start_span"": 7, ""end_span"": 20, ""type"": ""Gene_or_geneproduct""}, {""token"": ""mitochondrial uncoupling protein - 1"", ""start_span"": 52, ""end_span"": 88, ""type"": ""Gene_or_geneproduct""}, {""token"": ""UCP - 1"", ""start_span"": 91, ""end_span"": 98, ""type"": ""Gene_or_geneproduct""}, {""token"": ""PPAR gamma"", ""start_span"": 163, ""end_span"": 173, ""type"": ""Gene_or_geneproduct""}]"
Specifically, the fasting - mediated down - regulation of SREBP - 1c and its target gene stearoyl - CoA desaturase ( SCD1), was abolished in PGC - 1 alpha - / - mice ( Table 2).	"SREBP - 1c	58	68	Gene_or_geneproduct"	"stearoyl - CoA desaturase	89	114	Gene_or_geneproduct"	"SCD1	117	121	Gene_or_geneproduct"	"PGC - 1 alpha	141	154	Gene_or_geneproduct"	"[{""token"": ""SREBP - 1c"", ""start_span"": 58, ""end_span"": 68, ""type"": ""Gene_or_geneproduct""}, {""token"": ""stearoyl - CoA desaturase"", ""start_span"": 89, ""end_span"": 114, ""type"": ""Gene_or_geneproduct""}, {""token"": ""SCD1"", ""start_span"": 117, ""end_span"": 121, ""type"": ""Gene_or_geneproduct""}, {""token"": ""PGC - 1 alpha"", ""start_span"": 141, ""end_span"": 154, ""type"": ""Gene_or_geneproduct""}]"
Recent studies have suggested that specific PGC - 1 alpha single nucleotide polymorphisms and haplotypes may influence the development of insulin resistance and diabetes [ 27, 30] and that PGC - 1 activity is diminished in insulin - resistant and diabetic muscle [ 22, 23].	"PGC - 1 alpha	44	57	Gene_or_geneproduct"	"insulin	138	145	Gene_or_geneproduct"	"PGC - 1	189	196	Gene_or_geneproduct"	"insulin	223	230	Gene_or_geneproduct"	"[{""token"": ""PGC - 1 alpha"", ""start_span"": 44, ""end_span"": 57, ""type"": ""Gene_or_geneproduct""}, {""token"": ""insulin"", ""start_span"": 138, ""end_span"": 145, ""type"": ""Gene_or_geneproduct""}, {""token"": ""PGC - 1"", ""start_span"": 189, ""end_span"": 196, ""type"": ""Gene_or_geneproduct""}, {""token"": ""insulin"", ""start_span"": 223, ""end_span"": 230, ""type"": ""Gene_or_geneproduct""}]"
Glucose tolerance testing in 4. 5 - mo - old female PGC - 1 alpha - / - mice revealed that, despite increased body weight [ mean +/- standard error of the mean ( SEM) weight of PGC - 1 alpha + / + mice = 22. 4 +/- 0. 79 g; PGC - 1 alpha - / - mice = 25. 2 +/- 1. 04 g), PGC - 1 alpha - / - mice exhibited similar levels of glucose tolerance compared to WT mice on standard rodent chow ( Figure 9).	"PGC - 1 alpha	52	65	Gene_or_geneproduct"	"PGC - 1 alpha	177	190	Gene_or_geneproduct"	"PGC - 1 alpha	223	236	Gene_or_geneproduct"	"PGC - 1 alpha	270	283	Gene_or_geneproduct"	"[{""token"": ""PGC - 1 alpha"", ""start_span"": 52, ""end_span"": 65, ""type"": ""Gene_or_geneproduct""}, {""token"": ""PGC - 1 alpha"", ""start_span"": 177, ""end_span"": 190, ""type"": ""Gene_or_geneproduct""}, {""token"": ""PGC - 1 alpha"", ""start_span"": 223, ""end_span"": 236, ""type"": ""Gene_or_geneproduct""}, {""token"": ""PGC - 1 alpha"", ""start_span"": 270, ""end_span"": 283, ""type"": ""Gene_or_geneproduct""}]"
For example the nucleocytoplasmic compartmentalization of Annexin A2 is controlled by sequestration of the AnxA2 / p11 complex modulated by phosphorylation and by a nuclear export signal found in the AnxA2 3 - 12 region [ 33].	"Annexin A2	58	68	Gene_or_geneproduct"	"AnxA2	107	112	Gene_or_geneproduct"	"p11	115	118	Gene_or_geneproduct"	"AnxA2	200	205	Gene_or_geneproduct"	"[{""token"": ""Annexin A2"", ""start_span"": 58, ""end_span"": 68, ""type"": ""Gene_or_geneproduct""}, {""token"": ""AnxA2"", ""start_span"": 107, ""end_span"": 112, ""type"": ""Gene_or_geneproduct""}, {""token"": ""p11"", ""start_span"": 115, ""end_span"": 118, ""type"": ""Gene_or_geneproduct""}, {""token"": ""AnxA2"", ""start_span"": 200, ""end_span"": 205, ""type"": ""Gene_or_geneproduct""}]"
Er81, Pea3, and Erm constitute the Pea3 subfamily of ETS transcription factors, show a high degree of amino acid identity, and bind to very similar DNA target sequences [ 17, 18, 19].	"Er81	0	4	Gene_or_geneproduct"	"Pea3	6	10	Gene_or_geneproduct"	"Erm	16	19	Gene_or_geneproduct"	"Pea3	35	39	Gene_or_geneproduct"	"[{""token"": ""Er81"", ""start_span"": 0, ""end_span"": 4, ""type"": ""Gene_or_geneproduct""}, {""token"": ""Pea3"", ""start_span"": 6, ""end_span"": 10, ""type"": ""Gene_or_geneproduct""}, {""token"": ""Erm"", ""start_span"": 16, ""end_span"": 19, ""type"": ""Gene_or_geneproduct""}, {""token"": ""Pea3"", ""start_span"": 35, ""end_span"": 39, ""type"": ""Gene_or_geneproduct""}]"
We found that in a luciferase - enzyme - based cell culture transfection assay, EWS - Pea3 showed stronger transactivation activity than Er81 or Pea3 ( Figure 1J; data not shown), in agreement with previous studies [ 22, 23, 24].	"EWS	80	83	Gene_or_geneproduct"	"Pea3	86	90	Gene_or_geneproduct"	"Er81	137	141	Gene_or_geneproduct"	"Pea3	145	149	Gene_or_geneproduct"	"[{""token"": ""EWS"", ""start_span"": 80, ""end_span"": 83, ""type"": ""Gene_or_geneproduct""}, {""token"": ""Pea3"", ""start_span"": 86, ""end_span"": 90, ""type"": ""Gene_or_geneproduct""}, {""token"": ""Er81"", ""start_span"": 137, ""end_span"": 141, ""type"": ""Gene_or_geneproduct""}, {""token"": ""Pea3"", ""start_span"": 145, ""end_span"": 149, ""type"": ""Gene_or_geneproduct""}]"
To determine the extent of rescue of Ia proprioceptive afferent projections into the ventral spinal cord of Er81 mutant mice achieved by expression of EWS - Pea3, we traced intraspinal afferent projections by axonal labeling of PV ( Figure 2A - 2C).	"Er81	108	112	Gene_or_geneproduct"	"EWS	151	154	Gene_or_geneproduct"	"Pea3	157	161	Gene_or_geneproduct"	"PV	228	230	Gene_or_geneproduct"	"[{""token"": ""Er81"", ""start_span"": 108, ""end_span"": 112, ""type"": ""Gene_or_geneproduct""}, {""token"": ""EWS"", ""start_span"": 151, ""end_span"": 154, ""type"": ""Gene_or_geneproduct""}, {""token"": ""Pea3"", ""start_span"": 157, ""end_span"": 161, ""type"": ""Gene_or_geneproduct""}, {""token"": ""PV"", ""start_span"": 228, ""end_span"": 230, ""type"": ""Gene_or_geneproduct""}]"
We first assessed the influence of EWS - Pea3 expression in early post - mitotic DRG neurons on the establishment of afferent projections into the spinal cord using the TaumGFP / + allele or a Thy1 - promoter - driven synaptophysin green fluorescent protein ( spGFP) with an expression profile restricted to DRG sensory neurons at embryonic day ( E) 13. 5 ( Thy1spGFP; [ 25]) ( Figure 3).	"EWS	35	38	Gene_or_geneproduct"	"Pea3	41	45	Gene_or_geneproduct"	"Thy1	193	197	Gene_or_geneproduct"	"synaptophysin	218	231	Gene_or_geneproduct"	"[{""token"": ""EWS"", ""start_span"": 35, ""end_span"": 38, ""type"": ""Gene_or_geneproduct""}, {""token"": ""Pea3"", ""start_span"": 41, ""end_span"": 45, ""type"": ""Gene_or_geneproduct""}, {""token"": ""Thy1"", ""start_span"": 193, ""end_span"": 197, ""type"": ""Gene_or_geneproduct""}, {""token"": ""synaptophysin"", ""start_span"": 218, ""end_span"": 231, ""type"": ""Gene_or_geneproduct""}]"
We cultured E13. 5 whole DRG explants from wild - type and TauEWS - Pea3 / + Isl1Cre / + embryos in the presence of NGF or NT - 3 or in the absence of neurotrophins and analyzed neuronal survival and neurite outgrowth on matrigel substrate after 48 h in vitro.	"Pea3	68	72	Gene_or_geneproduct"	"NGF	116	119	Gene_or_geneproduct"	"NT - 3	123	129	Gene_or_geneproduct"	"neurotrophins	151	164	Gene_or_geneproduct"	"[{""token"": ""Pea3"", ""start_span"": 68, ""end_span"": 72, ""type"": ""Gene_or_geneproduct""}, {""token"": ""NGF"", ""start_span"": 116, ""end_span"": 119, ""type"": ""Gene_or_geneproduct""}, {""token"": ""NT - 3"", ""start_span"": 123, ""end_span"": 129, ""type"": ""Gene_or_geneproduct""}, {""token"": ""neurotrophins"", ""start_span"": 151, ""end_span"": 164, ""type"": ""Gene_or_geneproduct""}]"
These findings suggest that in addition to mediating neurotrophin - independent neuronal survival, expression of EWS - Pea3 in early post - mitotic neurons also promotes neurite outgrowth in a neurotrophin - independent manner.	"neurotrophin	53	65	Gene_or_geneproduct"	"EWS	113	116	Gene_or_geneproduct"	"Pea3	119	123	Gene_or_geneproduct"	"neurotrophin	193	205	Gene_or_geneproduct"	"[{""token"": ""neurotrophin"", ""start_span"": 53, ""end_span"": 65, ""type"": ""Gene_or_geneproduct""}, {""token"": ""EWS"", ""start_span"": 113, ""end_span"": 116, ""type"": ""Gene_or_geneproduct""}, {""token"": ""Pea3"", ""start_span"": 119, ""end_span"": 123, ""type"": ""Gene_or_geneproduct""}, {""token"": ""neurotrophin"", ""start_span"": 193, ""end_span"": 205, ""type"": ""Gene_or_geneproduct""}]"
We found no significant quantitative changes in the level of Akt / p - Akt or CREB / p - CREB in DRG ( Figure 6O and 6P) both of which have been shown to be key regulators of neuronal survival [ 29].	"Akt	61	64	Gene_or_geneproduct"	"Akt	71	74	Gene_or_geneproduct"	"CREB	78	82	Gene_or_geneproduct"	"CREB	89	93	Gene_or_geneproduct"	"[{""token"": ""Akt"", ""start_span"": 61, ""end_span"": 64, ""type"": ""Gene_or_geneproduct""}, {""token"": ""Akt"", ""start_span"": 71, ""end_span"": 74, ""type"": ""Gene_or_geneproduct""}, {""token"": ""CREB"", ""start_span"": 78, ""end_span"": 82, ""type"": ""Gene_or_geneproduct""}, {""token"": ""CREB"", ""start_span"": 89, ""end_span"": 93, ""type"": ""Gene_or_geneproduct""}]"
Moreover, to rule out the possibility that a differential effect may be due to the different genetic strategies by which expression of EWS - Pea3 in proprioceptive afferents is achieved, we performed this analysis both in Er81EWS - Pea3 / - and TauEWS - Pea3 / + PVCre / + embryos.	"EWS	135	138	Gene_or_geneproduct"	"Pea3	141	145	Gene_or_geneproduct"	"Pea3	232	236	Gene_or_geneproduct"	"Pea3	254	258	Gene_or_geneproduct"	"[{""token"": ""EWS"", ""start_span"": 135, ""end_span"": 138, ""type"": ""Gene_or_geneproduct""}, {""token"": ""Pea3"", ""start_span"": 141, ""end_span"": 145, ""type"": ""Gene_or_geneproduct""}, {""token"": ""Pea3"", ""start_span"": 232, ""end_span"": 236, ""type"": ""Gene_or_geneproduct""}, {""token"": ""Pea3"", ""start_span"": 254, ""end_span"": 258, ""type"": ""Gene_or_geneproduct""}]"
Finally, to assess whether EWS - Pea3 expressed precociously acts exclusively cell - autonomously or whether it may also influence neighboring DRG neurons, we activated expression of EWS - Pea3 using Hb9Cre mice [ 33].	"EWS	27	30	Gene_or_geneproduct"	"Pea3	33	37	Gene_or_geneproduct"	"EWS	183	186	Gene_or_geneproduct"	"Pea3	189	193	Gene_or_geneproduct"	"[{""token"": ""EWS"", ""start_span"": 27, ""end_span"": 30, ""type"": ""Gene_or_geneproduct""}, {""token"": ""Pea3"", ""start_span"": 33, ""end_span"": 37, ""type"": ""Gene_or_geneproduct""}, {""token"": ""EWS"", ""start_span"": 183, ""end_span"": 186, ""type"": ""Gene_or_geneproduct""}, {""token"": ""Pea3"", ""start_span"": 189, ""end_span"": 193, ""type"": ""Gene_or_geneproduct""}]"
The fusion of EWS with Pea3 could circumvent a need for activation through specific cofactors while still maintaining ETS site dependence, thus rendering EWS - Pea3 less sensitive to the cellular context than endogenous ETS transcription factors.	"EWS	14	17	Gene_or_geneproduct"	"Pea3	23	27	Gene_or_geneproduct"	"EWS	154	157	Gene_or_geneproduct"	"Pea3	160	164	Gene_or_geneproduct"	"[{""token"": ""EWS"", ""start_span"": 14, ""end_span"": 17, ""type"": ""Gene_or_geneproduct""}, {""token"": ""Pea3"", ""start_span"": 23, ""end_span"": 27, ""type"": ""Gene_or_geneproduct""}, {""token"": ""EWS"", ""start_span"": 154, ""end_span"": 157, ""type"": ""Gene_or_geneproduct""}, {""token"": ""Pea3"", ""start_span"": 160, ""end_span"": 164, ""type"": ""Gene_or_geneproduct""}]"
EWS - Pea3 represents a fusion gene between the amino terminal of EWS and the ETS domain of Pea3 [ 20].	"EWS	0	3	Gene_or_geneproduct"	"Pea3	6	10	Gene_or_geneproduct"	"EWS	66	69	Gene_or_geneproduct"	"Pea3	92	96	Gene_or_geneproduct"	"[{""token"": ""EWS"", ""start_span"": 0, ""end_span"": 3, ""type"": ""Gene_or_geneproduct""}, {""token"": ""Pea3"", ""start_span"": 6, ""end_span"": 10, ""type"": ""Gene_or_geneproduct""}, {""token"": ""EWS"", ""start_span"": 66, ""end_span"": 69, ""type"": ""Gene_or_geneproduct""}, {""token"": ""Pea3"", ""start_span"": 92, ""end_span"": 96, ""type"": ""Gene_or_geneproduct""}]"
For the generation of TaumGFP and TauEWS - Pea3 mice, lox - STOP - lox - mGFP - IRES - NLS - LacZ - pA and lox - STOP - lox - EWS - Pea3 - IRES - NLS - LacZ - pA targeting cassettes were integrated into exon 2 of the Tau genomic locus ( the endogenous start ATG was removed in the targeting vectors; details available upon request).	"Pea3	43	47	Gene_or_geneproduct"	"EWS	126	129	Gene_or_geneproduct"	"Pea3	132	136	Gene_or_geneproduct"	"Tau	217	220	Gene_or_geneproduct"	"[{""token"": ""Pea3"", ""start_span"": 43, ""end_span"": 47, ""type"": ""Gene_or_geneproduct""}, {""token"": ""EWS"", ""start_span"": 126, ""end_span"": 129, ""type"": ""Gene_or_geneproduct""}, {""token"": ""Pea3"", ""start_span"": 132, ""end_span"": 136, ""type"": ""Gene_or_geneproduct""}, {""token"": ""Tau"", ""start_span"": 217, ""end_span"": 220, ""type"": ""Gene_or_geneproduct""}]"
Individual lumbar DRG were dissected from E13. 5 or E14. 5 embryos and placed on Matrigel ( BD Biosciences, San Jose, California, United States) coated coverslips in DMEM / F12 ( Gibco, San Diego, California, United States), 2 mM L - Gln ( Gibco), N2 ( Gibco), and 1 mg / ml BSA ( Sigma, St. Louis, Missouri, United States) without neurotrophins, or supplemented with either NGF ( 100 ng / ml, Gibco) or NT - 3 ( 20 ng / ml, Sigma).	"BSA	275	278	Gene_or_geneproduct"	"neurotrophins	332	345	Gene_or_geneproduct"	"NGF	375	378	Gene_or_geneproduct"	"NT - 3	404	410	Gene_or_geneproduct"	"[{""token"": ""BSA"", ""start_span"": 275, ""end_span"": 278, ""type"": ""Gene_or_geneproduct""}, {""token"": ""neurotrophins"", ""start_span"": 332, ""end_span"": 345, ""type"": ""Gene_or_geneproduct""}, {""token"": ""NGF"", ""start_span"": 375, ""end_span"": 378, ""type"": ""Gene_or_geneproduct""}, {""token"": ""NT - 3"", ""start_span"": 404, ""end_span"": 410, ""type"": ""Gene_or_geneproduct""}]"
( D - L) Expression of Isl1 ( D, G, and J), EWS - Pea3 ( E and H), GFP ( K), or LacZ ( F, I, and L), in E12 ( D - I) or E13. 5 ( J - L) DRG neurons of wild - type ( D - F), TauEWS - Pea3 / + Isl1Cre / + ( G - I), and TaumGFP / + Isl1Cre / + ( J - L) embryos.	"Isl1	23	27	Gene_or_geneproduct"	"EWS	44	47	Gene_or_geneproduct"	"Pea3	50	54	Gene_or_geneproduct"	"Pea3	182	186	Gene_or_geneproduct"	"[{""token"": ""Isl1"", ""start_span"": 23, ""end_span"": 27, ""type"": ""Gene_or_geneproduct""}, {""token"": ""EWS"", ""start_span"": 44, ""end_span"": 47, ""type"": ""Gene_or_geneproduct""}, {""token"": ""Pea3"", ""start_span"": 50, ""end_span"": 54, ""type"": ""Gene_or_geneproduct""}, {""token"": ""Pea3"", ""start_span"": 182, ""end_span"": 186, ""type"": ""Gene_or_geneproduct""}]"
Immunohistochemical analysis of PV ( A and D), Calretinin ( B and E), and Calbindin ( C and F) expression on E16. 5 lumbar DRG of wild - type ( A - C) and TauEWS - Pea3 / + Isl1Cre / + ( D - F) embryos.	"PV	32	34	Gene_or_geneproduct"	"Calretinin	47	57	Gene_or_geneproduct"	"Calbindin	74	83	Gene_or_geneproduct"	"Pea3	164	168	Gene_or_geneproduct"	"[{""token"": ""PV"", ""start_span"": 32, ""end_span"": 34, ""type"": ""Gene_or_geneproduct""}, {""token"": ""Calretinin"", ""start_span"": 47, ""end_span"": 57, ""type"": ""Gene_or_geneproduct""}, {""token"": ""Calbindin"", ""start_span"": 74, ""end_span"": 83, ""type"": ""Gene_or_geneproduct""}, {""token"": ""Pea3"", ""start_span"": 164, ""end_span"": 168, ""type"": ""Gene_or_geneproduct""}]"
E13. 5 lumbar DRG from wild - type ( A, B, and C), TauEWS - Pea3 / + Isl1Cre / + ( D, E, and F), or Bax - / - ( G, H, and I) embryos cultured for 48 h without neurotrophic support ( A, D, and G) or in the presence of NGF ( B, E, and H) or NT - 3 ( C, F, and I) were stained for expression of neurofilament to visualize axonal extensions.	"Pea3	60	64	Gene_or_geneproduct"	"Bax	100	103	Gene_or_geneproduct"	"NGF	217	220	Gene_or_geneproduct"	"NT - 3	239	245	Gene_or_geneproduct"	"[{""token"": ""Pea3"", ""start_span"": 60, ""end_span"": 64, ""type"": ""Gene_or_geneproduct""}, {""token"": ""Bax"", ""start_span"": 100, ""end_span"": 103, ""type"": ""Gene_or_geneproduct""}, {""token"": ""NGF"", ""start_span"": 217, ""end_span"": 220, ""type"": ""Gene_or_geneproduct""}, {""token"": ""NT - 3"", ""start_span"": 239, ""end_span"": 245, ""type"": ""Gene_or_geneproduct""}]"
( A - C and G - I) In situ hybridization analysis of TrkA ( A and G), TrkB ( B and H), and TrkC ( C and I) expression in E16. 5 lumbar DRG of wild - type ( A - C) and TauEWS - Pea3 / + Isl1Cre / + ( G - I) embryos.	"TrkA	53	57	Gene_or_geneproduct"	"TrkB	70	74	Gene_or_geneproduct"	"TrkC	91	95	Gene_or_geneproduct"	"Pea3	176	180	Gene_or_geneproduct"	"[{""token"": ""TrkA"", ""start_span"": 53, ""end_span"": 57, ""type"": ""Gene_or_geneproduct""}, {""token"": ""TrkB"", ""start_span"": 70, ""end_span"": 74, ""type"": ""Gene_or_geneproduct""}, {""token"": ""TrkC"", ""start_span"": 91, ""end_span"": 95, ""type"": ""Gene_or_geneproduct""}, {""token"": ""Pea3"", ""start_span"": 176, ""end_span"": 180, ""type"": ""Gene_or_geneproduct""}]"
( O) Western blot analysis of protein extracts isolated from lumbar DRG of E16. 5 wild - type ( wt) and TauEWS - Pea3 / + Isl1Cre / + ( mut) embryos using the following antibodies: Akt, p - Akt ( Ser473), CREB, p - CREB ( Ser133), Bax, Bcl2, and Bcl - xl.	"Pea3	113	117	Gene_or_geneproduct"	"Bax	231	234	Gene_or_geneproduct"	"Bcl2	236	240	Gene_or_geneproduct"	"Bcl - xl	246	254	Gene_or_geneproduct"	"[{""token"": ""Pea3"", ""start_span"": 113, ""end_span"": 117, ""type"": ""Gene_or_geneproduct""}, {""token"": ""Bax"", ""start_span"": 231, ""end_span"": 234, ""type"": ""Gene_or_geneproduct""}, {""token"": ""Bcl2"", ""start_span"": 236, ""end_span"": 240, ""type"": ""Gene_or_geneproduct""}, {""token"": ""Bcl - xl"", ""start_span"": 246, ""end_span"": 254, ""type"": ""Gene_or_geneproduct""}]"
( I) Summary diagram illustrating deregulation of TrkC ( red arrows, downregulation) and Calretinin ( green arrows, upregulation) expression upon precocious ( B and F) induction of EWS - Pea3 expression in DRG neurons ( B and F; E10 - E11, i. e., shortly after cell cycle exit, E9. 5 - E10).	"TrkC	50	54	Gene_or_geneproduct"	"Calretinin	89	99	Gene_or_geneproduct"	"EWS	181	184	Gene_or_geneproduct"	"Pea3	187	191	Gene_or_geneproduct"	"[{""token"": ""TrkC"", ""start_span"": 50, ""end_span"": 54, ""type"": ""Gene_or_geneproduct""}, {""token"": ""Calretinin"", ""start_span"": 89, ""end_span"": 99, ""type"": ""Gene_or_geneproduct""}, {""token"": ""EWS"", ""start_span"": 181, ""end_span"": 184, ""type"": ""Gene_or_geneproduct""}, {""token"": ""Pea3"", ""start_span"": 187, ""end_span"": 191, ""type"": ""Gene_or_geneproduct""}]"
