It also is possible that CAII substantially contributes to aqueous humor secretion but that functional mouse CAIV is sufficient to prevent an effect of CAII deficiency on IOP in Car2 mutant mice.	"CAII	25	29	Gene_or_geneproduct"	"mouse CAIV	103	113	Gene_or_geneproduct"	"CAII	152	156	Gene_or_geneproduct"	"Car2	178	182	Gene_or_geneproduct"	"[{""token"": ""CAII"", ""start_span"": 25, ""end_span"": 29, ""type"": ""Gene_or_geneproduct""}, {""token"": ""mouse CAIV"", ""start_span"": 103, ""end_span"": 113, ""type"": ""Gene_or_geneproduct""}, {""token"": ""CAII"", ""start_span"": 152, ""end_span"": 156, ""type"": ""Gene_or_geneproduct""}, {""token"": ""Car2"", ""start_span"": 178, ""end_span"": 182, ""type"": ""Gene_or_geneproduct""}]"
Following the landmark discovery by Scully et al that the homologous recombinase RAD51 colocalizes at subnuclear sites with BRCA1 [ 9], a number of additional results have provided evidence that both BRCA1 and BRCA2 are involved in recombinational repair of DNA damage.	"RAD51	81	86	Gene_or_geneproduct"	"BRCA1	124	129	Gene_or_geneproduct"	"BRCA1	200	205	Gene_or_geneproduct"	"BRCA2	210	215	Gene_or_geneproduct"	"[{""token"": ""RAD51"", ""start_span"": 81, ""end_span"": 86, ""type"": ""Gene_or_geneproduct""}, {""token"": ""BRCA1"", ""start_span"": 124, ""end_span"": 129, ""type"": ""Gene_or_geneproduct""}, {""token"": ""BRCA1"", ""start_span"": 200, ""end_span"": 205, ""type"": ""Gene_or_geneproduct""}, {""token"": ""BRCA2"", ""start_span"": 210, ""end_span"": 215, ""type"": ""Gene_or_geneproduct""}]"
It is possible that RAD51 may alternatively be capable of BRCA2 - independent transport, but mislocalization of BRCA2 to the cytoplasm may sequester RAD51 and block its normal mode of transport.	"RAD51	20	25	Gene_or_geneproduct"	"BRCA2	58	63	Gene_or_geneproduct"	"BRCA2	112	117	Gene_or_geneproduct"	"RAD51	149	154	Gene_or_geneproduct"	"[{""token"": ""RAD51"", ""start_span"": 20, ""end_span"": 25, ""type"": ""Gene_or_geneproduct""}, {""token"": ""BRCA2"", ""start_span"": 58, ""end_span"": 63, ""type"": ""Gene_or_geneproduct""}, {""token"": ""BRCA2"", ""start_span"": 112, ""end_span"": 117, ""type"": ""Gene_or_geneproduct""}, {""token"": ""RAD51"", ""start_span"": 149, ""end_span"": 154, ""type"": ""Gene_or_geneproduct""}]"
Given the elaborate nature of the RAD51 - BRCA2 interaction, it seems somewhat unlikely that the only role of BRCA2 in promoting recombination is to serve as a specific nuclear transporter of RAD51.	"RAD51	34	39	Gene_or_geneproduct"	"BRCA2	42	47	Gene_or_geneproduct"	"BRCA2	110	115	Gene_or_geneproduct"	"RAD51	192	197	Gene_or_geneproduct"	"[{""token"": ""RAD51"", ""start_span"": 34, ""end_span"": 39, ""type"": ""Gene_or_geneproduct""}, {""token"": ""BRCA2"", ""start_span"": 42, ""end_span"": 47, ""type"": ""Gene_or_geneproduct""}, {""token"": ""BRCA2"", ""start_span"": 110, ""end_span"": 115, ""type"": ""Gene_or_geneproduct""}, {""token"": ""RAD51"", ""start_span"": 192, ""end_span"": 197, ""type"": ""Gene_or_geneproduct""}]"
As mentioned previously, the ability of a BRC peptide to repress the RAD51 - BRCA2 interaction could reflect a role of full - length protein in suppressing unwanted RAD51 - BRCA2 interactions.	"RAD51	69	74	Gene_or_geneproduct"	"BRCA2	77	82	Gene_or_geneproduct"	"RAD51	165	170	Gene_or_geneproduct"	"BRCA2	173	178	Gene_or_geneproduct"	"[{""token"": ""RAD51"", ""start_span"": 69, ""end_span"": 74, ""type"": ""Gene_or_geneproduct""}, {""token"": ""BRCA2"", ""start_span"": 77, ""end_span"": 82, ""type"": ""Gene_or_geneproduct""}, {""token"": ""RAD51"", ""start_span"": 165, ""end_span"": 170, ""type"": ""Gene_or_geneproduct""}, {""token"": ""BRCA2"", ""start_span"": 173, ""end_span"": 178, ""type"": ""Gene_or_geneproduct""}]"
BRCA2 - Rad51 interaction is proposed to suppress RAD51 - BRCA2 interactions until DNA damage is present.	"BRCA2	0	5	Gene_or_geneproduct"	"Rad51	8	13	Gene_or_geneproduct"	"RAD51	50	55	Gene_or_geneproduct"	"BRCA2	58	63	Gene_or_geneproduct"	"[{""token"": ""BRCA2"", ""start_span"": 0, ""end_span"": 5, ""type"": ""Gene_or_geneproduct""}, {""token"": ""Rad51"", ""start_span"": 8, ""end_span"": 13, ""type"": ""Gene_or_geneproduct""}, {""token"": ""RAD51"", ""start_span"": 50, ""end_span"": 55, ""type"": ""Gene_or_geneproduct""}, {""token"": ""BRCA2"", ""start_span"": 58, ""end_span"": 63, ""type"": ""Gene_or_geneproduct""}]"
Close examination has revealed that some ' immature ' hair cells form in Brn3c null mutants and express cellular markers such as Myosin VI and VIIa, calretinin and parvalbumin [ 3].	"Brn3c	73	78	Gene_or_geneproduct"	"Myosin VI and VIIa	129	147	Gene_or_geneproduct"	"calretinin	149	159	Gene_or_geneproduct"	"parvalbumin	164	175	Gene_or_geneproduct"	"[{""token"": ""Brn3c"", ""start_span"": 73, ""end_span"": 78, ""type"": ""Gene_or_geneproduct""}, {""token"": ""Myosin VI and VIIa"", ""start_span"": 129, ""end_span"": 147, ""type"": ""Gene_or_geneproduct""}, {""token"": ""calretinin"", ""start_span"": 149, ""end_span"": 159, ""type"": ""Gene_or_geneproduct""}, {""token"": ""parvalbumin"", ""start_span"": 164, ""end_span"": 175, ""type"": ""Gene_or_geneproduct""}]"
The comparatively high level of NT - 3 expression in Brn3c null mutant cochlea, which has been shown to be the neurotrophin most prominently supporting spiral sensory neurons [ 6, 9, 14], is in agreement with the normal development of cochlear innervation in newborn Brn3c null mutants.	"NT - 3	32	38	Gene_or_geneproduct"	"Brn3c	53	58	Gene_or_geneproduct"	"neurotrophin	111	123	Gene_or_geneproduct"	"Brn3c	267	272	Gene_or_geneproduct"	"[{""token"": ""NT - 3"", ""start_span"": 32, ""end_span"": 38, ""type"": ""Gene_or_geneproduct""}, {""token"": ""Brn3c"", ""start_span"": 53, ""end_span"": 58, ""type"": ""Gene_or_geneproduct""}, {""token"": ""neurotrophin"", ""start_span"": 111, ""end_span"": 123, ""type"": ""Gene_or_geneproduct""}, {""token"": ""Brn3c"", ""start_span"": 267, ""end_span"": 272, ""type"": ""Gene_or_geneproduct""}]"
The four Acdp genes ( Acdp1, Acdp2, Acdp3 and Acdp4) contain 3, 631 bp, 3, 244 bp, 2, 684 bp and 2, 743 bp of cDNA sequences, and encode deduced proteins of 951, 874, 713 and 771 amino acids, respectively.	"Acdp1	22	27	Gene_or_geneproduct"	"Acdp2	29	34	Gene_or_geneproduct"	"Acdp3	36	41	Gene_or_geneproduct"	"Acdp4	46	51	Gene_or_geneproduct"	"[{""token"": ""Acdp1"", ""start_span"": 22, ""end_span"": 27, ""type"": ""Gene_or_geneproduct""}, {""token"": ""Acdp2"", ""start_span"": 29, ""end_span"": 34, ""type"": ""Gene_or_geneproduct""}, {""token"": ""Acdp3"", ""start_span"": 36, ""end_span"": 41, ""type"": ""Gene_or_geneproduct""}, {""token"": ""Acdp4"", ""start_span"": 46, ""end_span"": 51, ""type"": ""Gene_or_geneproduct""}]"
For example, EST H3086H12 - 5 corresponds to Acdp1, W98010 for Acdp2, 603299135F1 for Acdp3 and BG083791 for Acdp4.	"Acdp1	45	50	Gene_or_geneproduct"	"Acdp2	63	68	Gene_or_geneproduct"	"Acdp3	86	91	Gene_or_geneproduct"	"Acdp4	109	114	Gene_or_geneproduct"	"[{""token"": ""Acdp1"", ""start_span"": 45, ""end_span"": 50, ""type"": ""Gene_or_geneproduct""}, {""token"": ""Acdp2"", ""start_span"": 63, ""end_span"": 68, ""type"": ""Gene_or_geneproduct""}, {""token"": ""Acdp3"", ""start_span"": 86, ""end_span"": 91, ""type"": ""Gene_or_geneproduct""}, {""token"": ""Acdp4"", ""start_span"": 109, ""end_span"": 114, ""type"": ""Gene_or_geneproduct""}]"
Acdp3 and Acdp4 showed different levels of expression in all tissues tested; the highest expressions for Acdp3 were observed in the brain, kidney, liver and heart, and the highest expressions for Acdp4 were observed in the kidney, small intestine and testis.	"Acdp3	0	5	Gene_or_geneproduct"	"Acdp4	10	15	Gene_or_geneproduct"	"Acdp3	105	110	Gene_or_geneproduct"	"Acdp4	196	201	Gene_or_geneproduct"	"[{""token"": ""Acdp3"", ""start_span"": 0, ""end_span"": 5, ""type"": ""Gene_or_geneproduct""}, {""token"": ""Acdp4"", ""start_span"": 10, ""end_span"": 15, ""type"": ""Gene_or_geneproduct""}, {""token"": ""Acdp3"", ""start_span"": 105, ""end_span"": 110, ""type"": ""Gene_or_geneproduct""}, {""token"": ""Acdp4"", ""start_span"": 196, ""end_span"": 201, ""type"": ""Gene_or_geneproduct""}]"
The sequence data for the Acdp genes have been deposited in GenBank under accession number AF202994 ( Acdp1), AF216961 ( Acdp2), AF216964 ( Acdp3) and AF216963 ( Acdp4).	"Acdp1	102	107	Gene_or_geneproduct"	"Acdp2	121	126	Gene_or_geneproduct"	"Acdp3	140	145	Gene_or_geneproduct"	"Acdp4	162	167	Gene_or_geneproduct"	"[{""token"": ""Acdp1"", ""start_span"": 102, ""end_span"": 107, ""type"": ""Gene_or_geneproduct""}, {""token"": ""Acdp2"", ""start_span"": 121, ""end_span"": 126, ""type"": ""Gene_or_geneproduct""}, {""token"": ""Acdp3"", ""start_span"": 140, ""end_span"": 145, ""type"": ""Gene_or_geneproduct""}, {""token"": ""Acdp4"", ""start_span"": 162, ""end_span"": 167, ""type"": ""Gene_or_geneproduct""}]"
From top to bottom, each band corresponding to Acdp1 ( 115 kD), Acdp2 ( 100 kD), Acdp4 ( 90 kD) and Acdp3 ( 80 kD).	"Acdp1	47	52	Gene_or_geneproduct"	"Acdp2	64	69	Gene_or_geneproduct"	"Acdp4	81	86	Gene_or_geneproduct"	"Acdp3	100	105	Gene_or_geneproduct"	"[{""token"": ""Acdp1"", ""start_span"": 47, ""end_span"": 52, ""type"": ""Gene_or_geneproduct""}, {""token"": ""Acdp2"", ""start_span"": 64, ""end_span"": 69, ""type"": ""Gene_or_geneproduct""}, {""token"": ""Acdp4"", ""start_span"": 81, ""end_span"": 86, ""type"": ""Gene_or_geneproduct""}, {""token"": ""Acdp3"", ""start_span"": 100, ""end_span"": 105, ""type"": ""Gene_or_geneproduct""}]"
The cDNA sequences for the Acdp gene family have already been deposited in gene bank with accession numbers AF202994 ( Acdp1), AF216961 ( Acdp2), AF216964 ( Acdp3) and AF216963 ( Acdp4).	"Acdp1	119	124	Gene_or_geneproduct"	"Acdp2	138	143	Gene_or_geneproduct"	"Acdp3	157	162	Gene_or_geneproduct"	"Acdp4	179	184	Gene_or_geneproduct"	"[{""token"": ""Acdp1"", ""start_span"": 119, ""end_span"": 124, ""type"": ""Gene_or_geneproduct""}, {""token"": ""Acdp2"", ""start_span"": 138, ""end_span"": 143, ""type"": ""Gene_or_geneproduct""}, {""token"": ""Acdp3"", ""start_span"": 157, ""end_span"": 162, ""type"": ""Gene_or_geneproduct""}, {""token"": ""Acdp4"", ""start_span"": 179, ""end_span"": 184, ""type"": ""Gene_or_geneproduct""}]"
Mutations in either of two genes comprising the STSL locus, ATP - binding cassette ( ABC) - transporters ABCG5 ( encoding sterolin - 1) and ABCG8 ( encoding sterolin - 2), result in sitosterolemia, a rare autosomal recessive disorder of sterol trafficking characterized by increased plasma plant sterol levels.	"ABCG5	105	110	Gene_or_geneproduct"	"sterolin - 1	122	134	Gene_or_geneproduct"	"ABCG8	140	145	Gene_or_geneproduct"	"sterolin - 2	157	169	Gene_or_geneproduct"	"[{""token"": ""ABCG5"", ""start_span"": 105, ""end_span"": 110, ""type"": ""Gene_or_geneproduct""}, {""token"": ""sterolin - 1"", ""start_span"": 122, ""end_span"": 134, ""type"": ""Gene_or_geneproduct""}, {""token"": ""ABCG8"", ""start_span"": 140, ""end_span"": 145, ""type"": ""Gene_or_geneproduct""}, {""token"": ""sterolin - 2"", ""start_span"": 157, ""end_span"": 169, ""type"": ""Gene_or_geneproduct""}]"
Based upon the genetics of sitosterolemia, ABCG5 / sterolin - 1 and ABCG8 / sterolin - 2 are hypothesized to function as obligate heterodimers.	"ABCG5	43	48	Gene_or_geneproduct"	"sterolin - 1	51	63	Gene_or_geneproduct"	"ABCG8	68	73	Gene_or_geneproduct"	"sterolin - 2	76	88	Gene_or_geneproduct"	"[{""token"": ""ABCG5"", ""start_span"": 43, ""end_span"": 48, ""type"": ""Gene_or_geneproduct""}, {""token"": ""sterolin - 1"", ""start_span"": 51, ""end_span"": 63, ""type"": ""Gene_or_geneproduct""}, {""token"": ""ABCG8"", ""start_span"": 68, ""end_span"": 73, ""type"": ""Gene_or_geneproduct""}, {""token"": ""sterolin - 2"", ""start_span"": 76, ""end_span"": 88, ""type"": ""Gene_or_geneproduct""}]"
Interestingly, Abcg5 / sterolin - 1 was expressed in both liver and intestine in Abcg8 / sterolin - 2 deficient mice and continued to show an apical expression.	"Abcg5	15	20	Gene_or_geneproduct"	"sterolin - 1	23	35	Gene_or_geneproduct"	"Abcg8	81	86	Gene_or_geneproduct"	"sterolin - 2	89	101	Gene_or_geneproduct"	"[{""token"": ""Abcg5"", ""start_span"": 15, ""end_span"": 20, ""type"": ""Gene_or_geneproduct""}, {""token"": ""sterolin - 1"", ""start_span"": 23, ""end_span"": 35, ""type"": ""Gene_or_geneproduct""}, {""token"": ""Abcg8"", ""start_span"": 81, ""end_span"": 86, ""type"": ""Gene_or_geneproduct""}, {""token"": ""sterolin - 2"", ""start_span"": 89, ""end_span"": 101, ""type"": ""Gene_or_geneproduct""}]"
These data indicate that Abcg8 / sterolin - 2 is necessary for biliary sterol secretion and that loss of Abcg8 / sterolin - 2 has a more profound effect upon biliary cholesterol secretion than sitosterol.	"Abcg8	25	30	Gene_or_geneproduct"	"sterolin - 2	33	45	Gene_or_geneproduct"	"Abcg8	105	110	Gene_or_geneproduct"	"sterolin - 2	113	125	Gene_or_geneproduct"	"[{""token"": ""Abcg8"", ""start_span"": 25, ""end_span"": 30, ""type"": ""Gene_or_geneproduct""}, {""token"": ""sterolin - 2"", ""start_span"": 33, ""end_span"": 45, ""type"": ""Gene_or_geneproduct""}, {""token"": ""Abcg8"", ""start_span"": 105, ""end_span"": 110, ""type"": ""Gene_or_geneproduct""}, {""token"": ""sterolin - 2"", ""start_span"": 113, ""end_span"": 125, ""type"": ""Gene_or_geneproduct""}]"
By using positional cloning procedures or by screening for genes induced by exposure to LXR agonists, two groups identified not one but two genes, ABCG5 and ABCG8, which encode the proteins sterolin - 1 and sterolin - 2, mutations of which cause sitosterolemia [ 14 - 16].	"ABCG5	147	152	Gene_or_geneproduct"	"ABCG8	157	162	Gene_or_geneproduct"	"sterolin - 1	190	202	Gene_or_geneproduct"	"sterolin - 2	207	219	Gene_or_geneproduct"	"[{""token"": ""ABCG5"", ""start_span"": 147, ""end_span"": 152, ""type"": ""Gene_or_geneproduct""}, {""token"": ""ABCG8"", ""start_span"": 157, ""end_span"": 162, ""type"": ""Gene_or_geneproduct""}, {""token"": ""sterolin - 1"", ""start_span"": 190, ""end_span"": 202, ""type"": ""Gene_or_geneproduct""}, {""token"": ""sterolin - 2"", ""start_span"": 207, ""end_span"": 219, ""type"": ""Gene_or_geneproduct""}]"
Does the loss of Abcg8 / sterolin - 2 result in loss of Abcg5 / sterolin - 1 expression, as might be predicted from the genetic studies and more recently from the in vitro and in vivo expression studies?	"Abcg8	17	22	Gene_or_geneproduct"	"sterolin - 2	25	37	Gene_or_geneproduct"	"Abcg5	56	61	Gene_or_geneproduct"	"sterolin - 1	64	76	Gene_or_geneproduct"	"[{""token"": ""Abcg8"", ""start_span"": 17, ""end_span"": 22, ""type"": ""Gene_or_geneproduct""}, {""token"": ""sterolin - 2"", ""start_span"": 25, ""end_span"": 37, ""type"": ""Gene_or_geneproduct""}, {""token"": ""Abcg5"", ""start_span"": 56, ""end_span"": 61, ""type"": ""Gene_or_geneproduct""}, {""token"": ""sterolin - 1"", ""start_span"": 64, ""end_span"": 76, ""type"": ""Gene_or_geneproduct""}]"
Nevertheless, this experiment indicates that the SC antibody can recognize Abcg5 / sterolin - 1 but does not cross - react with Abcg8 / sterolin - 2.	"Abcg5	75	80	Gene_or_geneproduct"	"sterolin - 1	83	95	Gene_or_geneproduct"	"Abcg8	128	133	Gene_or_geneproduct"	"sterolin - 2	136	148	Gene_or_geneproduct"	"[{""token"": ""Abcg5"", ""start_span"": 75, ""end_span"": 80, ""type"": ""Gene_or_geneproduct""}, {""token"": ""sterolin - 1"", ""start_span"": 83, ""end_span"": 95, ""type"": ""Gene_or_geneproduct""}, {""token"": ""Abcg8"", ""start_span"": 128, ""end_span"": 133, ""type"": ""Gene_or_geneproduct""}, {""token"": ""sterolin - 2"", ""start_span"": 136, ""end_span"": 148, ""type"": ""Gene_or_geneproduct""}]"
Serial sections of intestinal tissue were incubated with anti - Abcg5 / sterolin - 1 to determine the cellular location of Abcg5 / sterolin - 1.	"Abcg5	64	69	Gene_or_geneproduct"	"sterolin - 1	72	84	Gene_or_geneproduct"	"Abcg5	123	128	Gene_or_geneproduct"	"sterolin - 1	131	143	Gene_or_geneproduct"	"[{""token"": ""Abcg5"", ""start_span"": 64, ""end_span"": 69, ""type"": ""Gene_or_geneproduct""}, {""token"": ""sterolin - 1"", ""start_span"": 72, ""end_span"": 84, ""type"": ""Gene_or_geneproduct""}, {""token"": ""Abcg5"", ""start_span"": 123, ""end_span"": 128, ""type"": ""Gene_or_geneproduct""}, {""token"": ""sterolin - 1"", ""start_span"": 131, ""end_span"": 143, ""type"": ""Gene_or_geneproduct""}]"
Interestingly, although humans who are heterozygous for genetic defects in either ABCG5 or ABCG8 seem to be phenotypically normal, mice heterozygous for Abcg8 / sterolin - 2 deficiency show that sterol secretion is impaired, but not absent.	"ABCG5	82	87	Gene_or_geneproduct"	"ABCG8	91	96	Gene_or_geneproduct"	"Abcg8	153	158	Gene_or_geneproduct"	"sterolin - 2	161	173	Gene_or_geneproduct"	"[{""token"": ""ABCG5"", ""start_span"": 82, ""end_span"": 87, ""type"": ""Gene_or_geneproduct""}, {""token"": ""ABCG8"", ""start_span"": 91, ""end_span"": 96, ""type"": ""Gene_or_geneproduct""}, {""token"": ""Abcg8"", ""start_span"": 153, ""end_span"": 158, ""type"": ""Gene_or_geneproduct""}, {""token"": ""sterolin - 2"", ""start_span"": 161, ""end_span"": 173, ""type"": ""Gene_or_geneproduct""}]"
We, as well as others, have proposed Abcg5 / sterolin - 1 and Abcg8 / sterolin - 2 to function as obligate heterodimers.	"Abcg5	37	42	Gene_or_geneproduct"	"sterolin - 1	45	57	Gene_or_geneproduct"	"Abcg8	62	67	Gene_or_geneproduct"	"sterolin - 2	70	82	Gene_or_geneproduct"	"[{""token"": ""Abcg5"", ""start_span"": 37, ""end_span"": 42, ""type"": ""Gene_or_geneproduct""}, {""token"": ""sterolin - 1"", ""start_span"": 45, ""end_span"": 57, ""type"": ""Gene_or_geneproduct""}, {""token"": ""Abcg8"", ""start_span"": 62, ""end_span"": 67, ""type"": ""Gene_or_geneproduct""}, {""token"": ""sterolin - 2"", ""start_span"": 70, ""end_span"": 82, ""type"": ""Gene_or_geneproduct""}]"
It has been shown that Abcg8 / sterolin - 2 expression is required for correct apical trafficking of Abcg5 / sterolin - 1 to the apical surface in a polarized cell line and more recently in vivo by over - expression experiments [ 18, 19].	"Abcg8	23	28	Gene_or_geneproduct"	"sterolin - 2	31	43	Gene_or_geneproduct"	"Abcg5	101	106	Gene_or_geneproduct"	"sterolin - 1	109	121	Gene_or_geneproduct"	"[{""token"": ""Abcg8"", ""start_span"": 23, ""end_span"": 28, ""type"": ""Gene_or_geneproduct""}, {""token"": ""sterolin - 2"", ""start_span"": 31, ""end_span"": 43, ""type"": ""Gene_or_geneproduct""}, {""token"": ""Abcg5"", ""start_span"": 101, ""end_span"": 106, ""type"": ""Gene_or_geneproduct""}, {""token"": ""sterolin - 1"", ""start_span"": 109, ""end_span"": 121, ""type"": ""Gene_or_geneproduct""}]"
Therefore, at this time, we can neither exclude the possibility that Abcg5 / sterolin - 1 expression is functional in our Abcg8 / sterolin - 2 deficient mice nor can we rule it out.	"Abcg5	69	74	Gene_or_geneproduct"	"sterolin - 1	77	89	Gene_or_geneproduct"	"Abcg8	122	127	Gene_or_geneproduct"	"sterolin - 2	130	142	Gene_or_geneproduct"	"[{""token"": ""Abcg5"", ""start_span"": 69, ""end_span"": 74, ""type"": ""Gene_or_geneproduct""}, {""token"": ""sterolin - 1"", ""start_span"": 77, ""end_span"": 89, ""type"": ""Gene_or_geneproduct""}, {""token"": ""Abcg8"", ""start_span"": 122, ""end_span"": 127, ""type"": ""Gene_or_geneproduct""}, {""token"": ""sterolin - 2"", ""start_span"": 130, ""end_span"": 142, ""type"": ""Gene_or_geneproduct""}]"
It has been argued that Abcg5 / sterolin - 1 and Abcg8 / sterolin - 2 are dependent upon each other for secretion of hepatic sterols into bile [ 19].	"Abcg5	24	29	Gene_or_geneproduct"	"sterolin - 1	32	44	Gene_or_geneproduct"	"Abcg8	49	54	Gene_or_geneproduct"	"sterolin - 2	57	69	Gene_or_geneproduct"	"[{""token"": ""Abcg5"", ""start_span"": 24, ""end_span"": 29, ""type"": ""Gene_or_geneproduct""}, {""token"": ""sterolin - 1"", ""start_span"": 32, ""end_span"": 44, ""type"": ""Gene_or_geneproduct""}, {""token"": ""Abcg8"", ""start_span"": 49, ""end_span"": 54, ""type"": ""Gene_or_geneproduct""}, {""token"": ""sterolin - 2"", ""start_span"": 57, ""end_span"": 69, ""type"": ""Gene_or_geneproduct""}]"
Taken together, these animal models suggest that Abcg5 / sterolin - 1 and Abcg8 / sterolin - 2 have independent function in vivo or that there are proteins other than the sterolins that can secrete biliary sterols.	"Abcg5	49	54	Gene_or_geneproduct"	"sterolin - 1	57	69	Gene_or_geneproduct"	"Abcg8	74	79	Gene_or_geneproduct"	"sterolin - 2	82	94	Gene_or_geneproduct"	"[{""token"": ""Abcg5"", ""start_span"": 49, ""end_span"": 54, ""type"": ""Gene_or_geneproduct""}, {""token"": ""sterolin - 1"", ""start_span"": 57, ""end_span"": 69, ""type"": ""Gene_or_geneproduct""}, {""token"": ""Abcg8"", ""start_span"": 74, ""end_span"": 79, ""type"": ""Gene_or_geneproduct""}, {""token"": ""sterolin - 2"", ""start_span"": 82, ""end_span"": 94, ""type"": ""Gene_or_geneproduct""}]"
Mouse liver homogenate stained with SC anti - Abcg5 / sterolin - 1 after treatment with Endo - H or PNGaseF shows a 75 kDa band present in both genotypes, which is resistant to deglycosylation ( panel a).	"Abcg5	46	51	Gene_or_geneproduct"	"sterolin - 1	54	66	Gene_or_geneproduct"	"Endo - H	88	96	Gene_or_geneproduct"	"PNGaseF	100	107	Gene_or_geneproduct"	"[{""token"": ""Abcg5"", ""start_span"": 46, ""end_span"": 51, ""type"": ""Gene_or_geneproduct""}, {""token"": ""sterolin - 1"", ""start_span"": 54, ""end_span"": 66, ""type"": ""Gene_or_geneproduct""}, {""token"": ""Endo - H"", ""start_span"": 88, ""end_span"": 96, ""type"": ""Gene_or_geneproduct""}, {""token"": ""PNGaseF"", ""start_span"": 100, ""end_span"": 107, ""type"": ""Gene_or_geneproduct""}]"
We investigated the relationship between pendrin and deafness using mice that have ( Slc26a4 + / +) or lack a complete Slc26a4 gene ( Slc26a4 - / -).	"pendrin	41	48	Gene_or_geneproduct"	"Slc26a4	85	92	Gene_or_geneproduct"	"Slc26a4	119	126	Gene_or_geneproduct"	"Slc26a4	134	141	Gene_or_geneproduct"	"[{""token"": ""pendrin"", ""start_span"": 41, ""end_span"": 48, ""type"": ""Gene_or_geneproduct""}, {""token"": ""Slc26a4"", ""start_span"": 85, ""end_span"": 92, ""type"": ""Gene_or_geneproduct""}, {""token"": ""Slc26a4"", ""start_span"": 119, ""end_span"": 126, ""type"": ""Gene_or_geneproduct""}, {""token"": ""Slc26a4"", ""start_span"": 134, ""end_span"": 141, ""type"": ""Gene_or_geneproduct""}]"
Endolymphatic K + concentrations were normal and membrane proteins necessary for K + secretion were present, including the K + channel KCNQ1 and KCNE1, Na + / 2Cl - / K + cotransporter SLC12A2 and the gap junction GJB2.	"KCNQ1	135	140	Gene_or_geneproduct"	"KCNE1	145	150	Gene_or_geneproduct"	"SLC12A2	185	192	Gene_or_geneproduct"	"GJB2	214	218	Gene_or_geneproduct"	"[{""token"": ""KCNQ1"", ""start_span"": 135, ""end_span"": 140, ""type"": ""Gene_or_geneproduct""}, {""token"": ""KCNE1"", ""start_span"": 145, ""end_span"": 150, ""type"": ""Gene_or_geneproduct""}, {""token"": ""SLC12A2"", ""start_span"": 185, ""end_span"": 192, ""type"": ""Gene_or_geneproduct""}, {""token"": ""GJB2"", ""start_span"": 214, ""end_span"": 218, ""type"": ""Gene_or_geneproduct""}]"
Transcripts of 18S rRNA and mRNA for the K + channels KCNJ10, KCNQ1 and KCNQ4 were amplified using gene - specific primers ( Table 1).	"18S rRNA	15	23	Gene_or_geneproduct"	"KCNJ10	54	60	Gene_or_geneproduct"	"KCNQ1	62	67	Gene_or_geneproduct"	"KCNQ4	72	77	Gene_or_geneproduct"	"[{""token"": ""18S rRNA"", ""start_span"": 15, ""end_span"": 23, ""type"": ""Gene_or_geneproduct""}, {""token"": ""KCNJ10"", ""start_span"": 54, ""end_span"": 60, ""type"": ""Gene_or_geneproduct""}, {""token"": ""KCNQ1"", ""start_span"": 62, ""end_span"": 67, ""type"": ""Gene_or_geneproduct""}, {""token"": ""KCNQ4"", ""start_span"": 72, ""end_span"": 77, ""type"": ""Gene_or_geneproduct""}]"
Dual labeling with KCNQ1 demonstrated that pendrin expression was clearly limited to vestibular transitional cells and did not extend to other non - sensory cells such as vestibular dark cells, which were clearly identified by the expression of KCNQ1 and KCNE1 in their apical membranes.	"KCNQ1	19	24	Gene_or_geneproduct"	"pendrin	43	50	Gene_or_geneproduct"	"KCNQ1	245	250	Gene_or_geneproduct"	"KCNE1	255	260	Gene_or_geneproduct"	"[{""token"": ""KCNQ1"", ""start_span"": 19, ""end_span"": 24, ""type"": ""Gene_or_geneproduct""}, {""token"": ""pendrin"", ""start_span"": 43, ""end_span"": 50, ""type"": ""Gene_or_geneproduct""}, {""token"": ""KCNQ1"", ""start_span"": 245, ""end_span"": 250, ""type"": ""Gene_or_geneproduct""}, {""token"": ""KCNE1"", ""start_span"": 255, ""end_span"": 260, ""type"": ""Gene_or_geneproduct""}]"
No significant differences between Slc26a4 + / + and Slc26a4 - / - mice were found in perilymphatic ( Fig. 2a) or plasma K + concentrations ( Slc26a4 + / +, 4. 9 +/- 0. 3 mM, n = 6; Slc26a4 - / -, 5. 1 +/- 0. 3 mM, n = 6).	"Slc26a4	35	42	Gene_or_geneproduct"	"Slc26a4	53	60	Gene_or_geneproduct"	"Slc26a4	142	149	Gene_or_geneproduct"	"Slc26a4	182	189	Gene_or_geneproduct"	"[{""token"": ""Slc26a4"", ""start_span"": 35, ""end_span"": 42, ""type"": ""Gene_or_geneproduct""}, {""token"": ""Slc26a4"", ""start_span"": 53, ""end_span"": 60, ""type"": ""Gene_or_geneproduct""}, {""token"": ""Slc26a4"", ""start_span"": 142, ""end_span"": 149, ""type"": ""Gene_or_geneproduct""}, {""token"": ""Slc26a4"", ""start_span"": 182, ""end_span"": 189, ""type"": ""Gene_or_geneproduct""}]"
