The data herein show tissues with a decrease of RanBP2 and HKI levels mirror a reduction in the ATP levels.	"RanBP2	48	54	Gene_or_geneproduct"	"HKI	59	62	Gene_or_geneproduct"	"[{""token"": ""RanBP2"", ""start_span"": 48, ""end_span"": 54, ""type"": ""Gene_or_geneproduct""}, {""token"": ""HKI"", ""start_span"": 59, ""end_span"": 62, ""type"": ""Gene_or_geneproduct""}]"
Hence, RanBP2 and its partners emerge as key players and target genes in mediating neuropathophysiological mechanisms implicated in various genetic and environmental lesions to the CNS, as in patients with Parkinson, diabetes with insulin - resistance, and other neuropathies and neurodegenerative diseases, often linked to aging manifestations.	"RanBP2	7	13	Gene_or_geneproduct"	"insulin	231	238	Gene_or_geneproduct"	"[{""token"": ""RanBP2"", ""start_span"": 7, ""end_span"": 13, ""type"": ""Gene_or_geneproduct""}, {""token"": ""insulin"", ""start_span"": 231, ""end_span"": 238, ""type"": ""Gene_or_geneproduct""}]"
Finally, RanBP2 appears to join other nucleoporins, such as Nup96 [ 58], in novel physiological functions that are vital for complex organisms and that were not anticipated from cell - based studies.	"RanBP2	9	15	Gene_or_geneproduct"	"Nup96	60	65	Gene_or_geneproduct"	"[{""token"": ""RanBP2"", ""start_span"": 9, ""end_span"": 15, ""type"": ""Gene_or_geneproduct""}, {""token"": ""Nup96"", ""start_span"": 60, ""end_span"": 65, ""type"": ""Gene_or_geneproduct""}]"
GST - LDZIP alone comprised residues 447 - 483 of human RanBP2.	"GST	0	3	Gene_or_geneproduct"	"human RanBP2	50	62	Gene_or_geneproduct"	"[{""token"": ""GST"", ""start_span"": 0, ""end_span"": 3, ""type"": ""Gene_or_geneproduct""}, {""token"": ""human RanBP2"", ""start_span"": 50, ""end_span"": 62, ""type"": ""Gene_or_geneproduct""}]"
GST pull - down assays were carried out with 0. 5 - 2. 2 mu M of GST - fused proteins [ 65].	"GST	0	3	Gene_or_geneproduct"	"GST	65	68	Gene_or_geneproduct"	"[{""token"": ""GST"", ""start_span"": 0, ""end_span"": 3, ""type"": ""Gene_or_geneproduct""}, {""token"": ""GST"", ""start_span"": 65, ""end_span"": 68, ""type"": ""Gene_or_geneproduct""}]"
Unfolded and partially denatured Cox11 were generated by incubating recombinant and native Cox11 overnight with 5. 6 and 7 M guanidine hydrochloride and urea, respectively.	"Cox11	33	38	Gene_or_geneproduct"	"Cox11	91	96	Gene_or_geneproduct"	"[{""token"": ""Cox11"", ""start_span"": 33, ""end_span"": 38, ""type"": ""Gene_or_geneproduct""}, {""token"": ""Cox11"", ""start_span"": 91, ""end_span"": 96, ""type"": ""Gene_or_geneproduct""}]"
The Cox11 conformers were then diluted ~ 20 - fold in CHAPS - binding buffer containing GST - LD.	"Cox11	4	9	Gene_or_geneproduct"	"GST	88	91	Gene_or_geneproduct"	"[{""token"": ""Cox11"", ""start_span"": 4, ""end_span"": 9, ""type"": ""Gene_or_geneproduct""}, {""token"": ""GST"", ""start_span"": 88, ""end_span"": 91, ""type"": ""Gene_or_geneproduct""}]"
Hexokinase I activity was determined spectrophotometrically at 25 degrees C by the method of coupling the glucose - 6 - phosphate production via glucose - 6 - phosphate dehydrogenase with the change in the absorbance of NADPH at 340 nm and as described by [ 66].	"Hexokinase I	0	12	Gene_or_geneproduct"	"glucose - 6 - phosphate dehydrogenase	145	182	Gene_or_geneproduct"	"[{""token"": ""Hexokinase I"", ""start_span"": 0, ""end_span"": 12, ""type"": ""Gene_or_geneproduct""}, {""token"": ""glucose - 6 - phosphate dehydrogenase"", ""start_span"": 145, ""end_span"": 182, ""type"": ""Gene_or_geneproduct""}]"
The reaction was started by the addition of purified brain hexokinase I ( 0. 24 mu g) ( gift from J. Wilson) to 1. 0 ml of reaction mixture containing 0. 05 M Tris - HCl ( pH 8. 5), 7. 4 mM MgCl2, 6. 6 mM ATP, 0. 65 mM NADP, 11. 1 mM monothioglycerol, and 1 unit of glucose 6 - phosphate dehydrogenase.	"brain hexokinase I	53	71	Gene_or_geneproduct"	"glucose 6 - phosphate dehydrogenase	266	301	Gene_or_geneproduct"	"[{""token"": ""brain hexokinase I"", ""start_span"": 53, ""end_span"": 71, ""type"": ""Gene_or_geneproduct""}, {""token"": ""glucose 6 - phosphate dehydrogenase"", ""start_span"": 266, ""end_span"": 301, ""type"": ""Gene_or_geneproduct""}]"
In the case of hexokinase activity measured in the presence of Cox11 and LD, the purified HKI was incubated with the recombinant proteins for 15 min at 4 degrees C before measurement of the activity.	"Cox11	63	68	Gene_or_geneproduct"	"HKI	90	93	Gene_or_geneproduct"	"[{""token"": ""Cox11"", ""start_span"": 63, ""end_span"": 68, ""type"": ""Gene_or_geneproduct""}, {""token"": ""HKI"", ""start_span"": 90, ""end_span"": 93, ""type"": ""Gene_or_geneproduct""}]"
Generation of a mouse line with a disrupted RanBP2 locus and histological analysis of trapped RanBP2 mice.	"RanBP2	44	50	Gene_or_geneproduct"	"RanBP2	94	100	Gene_or_geneproduct"	"[{""token"": ""RanBP2"", ""start_span"": 44, ""end_span"": 50, ""type"": ""Gene_or_geneproduct""}, {""token"": ""RanBP2"", ""start_span"": 94, ""end_span"": 100, ""type"": ""Gene_or_geneproduct""}]"
Quantitation of immunoblot bands calibrated against internal marker bands, such as mHsp70 and Nup153, was carried out with Gel Pro Analyzer ( MediaCybernetics, San Diego, California, United States).	"mHsp70	83	89	Gene_or_geneproduct"	"Nup153	94	100	Gene_or_geneproduct"	"[{""token"": ""mHsp70"", ""start_span"": 83, ""end_span"": 89, ""type"": ""Gene_or_geneproduct""}, {""token"": ""Nup153"", ""start_span"": 94, ""end_span"": 100, ""type"": ""Gene_or_geneproduct""}]"
Insulin tolerance test was performed the same way as that described for the glucose tolerance test with the exception that human insulin ( 0. 75 U / kg of body mass) was injected intraperitoneally in non - fasted mice.	"Insulin	0	7	Gene_or_geneproduct"	"human insulin	123	136	Gene_or_geneproduct"	"[{""token"": ""Insulin"", ""start_span"": 0, ""end_span"": 7, ""type"": ""Gene_or_geneproduct""}, {""token"": ""human insulin"", ""start_span"": 123, ""end_span"": 136, ""type"": ""Gene_or_geneproduct""}]"
Five ~ 6 - mo - old male RanBP2 + / + and RanBP2 + / - mice in 129ola background were kept in dim cyclic light ( 10 lux) for 2 wk before electroretinographic responses were recorded.	"RanBP2	25	31	Gene_or_geneproduct"	"RanBP2	42	48	Gene_or_geneproduct"	"[{""token"": ""RanBP2"", ""start_span"": 25, ""end_span"": 31, ""type"": ""Gene_or_geneproduct""}, {""token"": ""RanBP2"", ""start_span"": 42, ""end_span"": 48, ""type"": ""Gene_or_geneproduct""}]"
Note the partial delocalization of HKI to the myoid subcompartment of the inner segment of photoreceptor neurons in + / - mice ( B1) and decreased levels of HKI in the inner plexiform ( synaptic) layer of the retina ( A and B).	"HKI	35	38	Gene_or_geneproduct"	"HKI	157	160	Gene_or_geneproduct"	"[{""token"": ""HKI"", ""start_span"": 35, ""end_span"": 38, ""type"": ""Gene_or_geneproduct""}, {""token"": ""HKI"", ""start_span"": 157, ""end_span"": 160, ""type"": ""Gene_or_geneproduct""}]"
There was no difference in the glucose tolerance test between RanBP2 + / + and RanBP2 + / - mice on a mixed 129Ola / C57Bl6 genetic background ( C).	"RanBP2	62	68	Gene_or_geneproduct"	"RanBP2	79	85	Gene_or_geneproduct"	"[{""token"": ""RanBP2"", ""start_span"": 62, ""end_span"": 68, ""type"": ""Gene_or_geneproduct""}, {""token"": ""RanBP2"", ""start_span"": 79, ""end_span"": 85, ""type"": ""Gene_or_geneproduct""}]"
GST - glutathione - S - transferase	"GST	0	3	Gene_or_geneproduct"	"glutathione - S - transferase	6	35	Gene_or_geneproduct"	"[{""token"": ""GST"", ""start_span"": 0, ""end_span"": 3, ""type"": ""Gene_or_geneproduct""}, {""token"": ""glutathione - S - transferase"", ""start_span"": 6, ""end_span"": 35, ""type"": ""Gene_or_geneproduct""}]"
HKI - hexokinase type I	"HKI	0	3	Gene_or_geneproduct"	"hexokinase type I	6	23	Gene_or_geneproduct"	"[{""token"": ""HKI"", ""start_span"": 0, ""end_span"": 3, ""type"": ""Gene_or_geneproduct""}, {""token"": ""hexokinase type I"", ""start_span"": 6, ""end_span"": 23, ""type"": ""Gene_or_geneproduct""}]"
RanBP2 - Ran - binding protein 2	"RanBP2	0	6	Gene_or_geneproduct"	"Ran - binding protein 2	9	32	Gene_or_geneproduct"	"[{""token"": ""RanBP2"", ""start_span"": 0, ""end_span"": 6, ""type"": ""Gene_or_geneproduct""}, {""token"": ""Ran - binding protein 2"", ""start_span"": 9, ""end_span"": 32, ""type"": ""Gene_or_geneproduct""}]"
We deleted the TGF - beta type I receptor Alk5 specifically in the mouse neural crest cell lineage.	"TGF - beta type I receptor	15	41	Gene_or_geneproduct"	"Alk5	42	46	Gene_or_geneproduct"	"[{""token"": ""TGF - beta type I receptor"", ""start_span"": 15, ""end_span"": 41, ""type"": ""Gene_or_geneproduct""}, {""token"": ""Alk5"", ""start_span"": 42, ""end_span"": 46, ""type"": ""Gene_or_geneproduct""}]"
BMPs 6 and - 7 are required for proper formation of the outflow tract cushions [ 10], while BMP type II receptor is needed for proper development of the conotruncal ridges [ 11].	"BMPs 6 and - 7	0	14	Gene_or_geneproduct"	"BMP type II receptor	92	112	Gene_or_geneproduct"	"[{""token"": ""BMPs 6 and - 7"", ""start_span"": 0, ""end_span"": 14, ""type"": ""Gene_or_geneproduct""}, {""token"": ""BMP type II receptor"", ""start_span"": 92, ""end_span"": 112, ""type"": ""Gene_or_geneproduct""}]"
TGF - beta subfamily ligands signal via a receptor complex composed of two type II receptors and two type I receptors [ 14, 15].	"TGF - beta	0	10	Gene_or_geneproduct"	"type I receptors	101	117	Gene_or_geneproduct"	"[{""token"": ""TGF - beta"", ""start_span"": 0, ""end_span"": 10, ""type"": ""Gene_or_geneproduct""}, {""token"": ""type I receptors"", ""start_span"": 101, ""end_span"": 117, ""type"": ""Gene_or_geneproduct""}]"
Ligand binding leads to phosphorylation and activation of type I receptors, which, in turn, phosphorylate and activate a specific set of downstream signaling molecules called Smads.	"type I receptors	58	74	Gene_or_geneproduct"	"Smads	175	180	Gene_or_geneproduct"	"[{""token"": ""type I receptors"", ""start_span"": 58, ""end_span"": 74, ""type"": ""Gene_or_geneproduct""}, {""token"": ""Smads"", ""start_span"": 175, ""end_span"": 180, ""type"": ""Gene_or_geneproduct""}]"
For instance, growth and differentiation factors ( GDFs) 8 and 9 can bind to Activin type II receptor and ALK5 to activate TGF - beta Smads [ 17, 18].	"ALK5	106	110	Gene_or_geneproduct"	"TGF - beta Smads	123	139	Gene_or_geneproduct"	"[{""token"": ""ALK5"", ""start_span"": 106, ""end_span"": 110, ""type"": ""Gene_or_geneproduct""}, {""token"": ""TGF - beta Smads"", ""start_span"": 123, ""end_span"": 139, ""type"": ""Gene_or_geneproduct""}]"
Therefore, we hypothesized that deletion of Alk5 in a specific cell lineage should reveal phenotypes which cannot be seen in comparable mutants lacking Tgfbr2.	"Alk5	44	48	Gene_or_geneproduct"	"Tgfbr2	152	158	Gene_or_geneproduct"	"[{""token"": ""Alk5"", ""start_span"": 44, ""end_span"": 48, ""type"": ""Gene_or_geneproduct""}, {""token"": ""Tgfbr2"", ""start_span"": 152, ""end_span"": 158, ""type"": ""Gene_or_geneproduct""}]"
Indeed, we recently showed that neural crest cell specific Alk5 mutants display a unique spectrum of craniofacial developmental defects, e. g., cleft snout and severe mandibular hypoplasia [ 19]; these phenotypes were not seen in corresponding Tgfbr2 mutants [ 20].	"Alk5	59	63	Gene_or_geneproduct"	"Tgfbr2	244	250	Gene_or_geneproduct"	"[{""token"": ""Alk5"", ""start_span"": 59, ""end_span"": 63, ""type"": ""Gene_or_geneproduct""}, {""token"": ""Tgfbr2"", ""start_span"": 244, ""end_span"": 250, ""type"": ""Gene_or_geneproduct""}]"
To determine, whether ALK5 would also mediate unique non - redundant signaling events in cardiac neural crest cells, we focused on cardiac and pharyngeal phenotypes of mouse embryos lacking Alk5 specifically in neural crest cells.	"ALK5	22	26	Gene_or_geneproduct"	"Alk5	190	194	Gene_or_geneproduct"	"[{""token"": ""ALK5"", ""start_span"": 22, ""end_span"": 26, ""type"": ""Gene_or_geneproduct""}, {""token"": ""Alk5"", ""start_span"": 190, ""end_span"": 194, ""type"": ""Gene_or_geneproduct""}]"
We discovered that in Alk5 / Wnt1 - Cre mutants, pharyngeal organs ( thymus and parathyroid) fail to migrate appropriately.	"Alk5	22	26	Gene_or_geneproduct"	"Wnt1	29	33	Gene_or_geneproduct"	"[{""token"": ""Alk5"", ""start_span"": 22, ""end_span"": 26, ""type"": ""Gene_or_geneproduct""}, {""token"": ""Wnt1"", ""start_span"": 29, ""end_span"": 33, ""type"": ""Gene_or_geneproduct""}]"
When embryos were harvested during the last day of gestation, an expected number ( 25%) of Alk5 / Wnt1 - Cre mutants were recovered.	"Alk5	91	95	Gene_or_geneproduct"	"Wnt1	98	102	Gene_or_geneproduct"	"[{""token"": ""Alk5"", ""start_span"": 91, ""end_span"": 95, ""type"": ""Gene_or_geneproduct""}, {""token"": ""Wnt1"", ""start_span"": 98, ""end_span"": 102, ""type"": ""Gene_or_geneproduct""}]"
To determine, if ALK5 - mediated TGF - beta - signaling had a role in development of the OFT and large vessels of the aortic arch, we performed casting dye experiments on E17 embryos ( Fig. 1A - D).	"ALK5	17	21	Gene_or_geneproduct"	"TGF - beta	33	43	Gene_or_geneproduct"	"[{""token"": ""ALK5"", ""start_span"": 17, ""end_span"": 21, ""type"": ""Gene_or_geneproduct""}, {""token"": ""TGF - beta"", ""start_span"": 33, ""end_span"": 43, ""type"": ""Gene_or_geneproduct""}]"
In contrast, Alk5 / Wnt1Cre mutant embryos consistently displayed a single prominent arterial trunk ( Fig. 1C - D), while corresponding Tgfbr2 mutant embryos ( Fig. 1B) displayed interrupted aortic arch, as reported earlier [ 8].	"Alk5	13	17	Gene_or_geneproduct"	"Tgfbr2	136	142	Gene_or_geneproduct"	"[{""token"": ""Alk5"", ""start_span"": 13, ""end_span"": 17, ""type"": ""Gene_or_geneproduct""}, {""token"": ""Tgfbr2"", ""start_span"": 136, ""end_span"": 142, ""type"": ""Gene_or_geneproduct""}]"
In Alk5 / Wnt1 - Cre mutants ( I - P) the conotruncal septum fails to form, and either left - sided ( I - L) or right - sided ( M - P) aortic arch can be seen.	"Alk5	3	7	Gene_or_geneproduct"	"Wnt1	10	14	Gene_or_geneproduct"	"[{""token"": ""Alk5"", ""start_span"": 3, ""end_span"": 7, ""type"": ""Gene_or_geneproduct""}, {""token"": ""Wnt1"", ""start_span"": 10, ""end_span"": 14, ""type"": ""Gene_or_geneproduct""}]"
While at E10, Alk5 / Wnt1 - Cre mutants did not show obvious differences in the PAAs, abnormal remodeling became obvious in mutants a day later at E11 ( Fig. 2).	"Alk5	14	18	Gene_or_geneproduct"	"Wnt1	21	25	Gene_or_geneproduct"	"[{""token"": ""Alk5"", ""start_span"": 14, ""end_span"": 18, ""type"": ""Gene_or_geneproduct""}, {""token"": ""Wnt1"", ""start_span"": 21, ""end_span"": 25, ""type"": ""Gene_or_geneproduct""}]"
In Alk5 / Wnt1 - Cre mutants, the 3rd and 4th pairs of PAAs were bilaterally hypoplastic, whereas the 6th pair of PAAs was notably hyperplastic ( Fig. 2B).	"Alk5	3	7	Gene_or_geneproduct"	"Wnt1	10	14	Gene_or_geneproduct"	"[{""token"": ""Alk5"", ""start_span"": 3, ""end_span"": 7, ""type"": ""Gene_or_geneproduct""}, {""token"": ""Wnt1"", ""start_span"": 10, ""end_span"": 14, ""type"": ""Gene_or_geneproduct""}]"
Abnormal patterning of the PAAs in Alk5 / Wnt1 - Cre mutants.	"Alk5	35	39	Gene_or_geneproduct"	"Wnt1	42	46	Gene_or_geneproduct"	"[{""token"": ""Alk5"", ""start_span"": 35, ""end_span"": 39, ""type"": ""Gene_or_geneproduct""}, {""token"": ""Wnt1"", ""start_span"": 42, ""end_span"": 46, ""type"": ""Gene_or_geneproduct""}]"
Left lateral view after intracardiac ink injections to visualize the developing PAAs at E11. 0 ( A, B), E12. 0 ( C, D) and E13. 0 ( E, F) in controls ( A, C, E) and Alk5 / Wnt1 - Cre mutants ( B, D, F).	"Alk5	165	169	Gene_or_geneproduct"	"Wnt1	172	176	Gene_or_geneproduct"	"[{""token"": ""Alk5"", ""start_span"": 165, ""end_span"": 169, ""type"": ""Gene_or_geneproduct""}, {""token"": ""Wnt1"", ""start_span"": 172, ""end_span"": 176, ""type"": ""Gene_or_geneproduct""}]"
In Alk5 / Wnt1 - Cre mutants, the T - shaped aortic sac failed to form ( Fig. 3B, D).	"Alk5	3	7	Gene_or_geneproduct"	"Wnt1	10	14	Gene_or_geneproduct"	"[{""token"": ""Alk5"", ""start_span"": 3, ""end_span"": 7, ""type"": ""Gene_or_geneproduct""}, {""token"": ""Wnt1"", ""start_span"": 10, ""end_span"": 14, ""type"": ""Gene_or_geneproduct""}]"
Abnormal Aortic Sac in Alk5 / Wnt1 - Cre mutants.	"Alk5	23	27	Gene_or_geneproduct"	"Wnt1	30	34	Gene_or_geneproduct"	"[{""token"": ""Alk5"", ""start_span"": 23, ""end_span"": 27, ""type"": ""Gene_or_geneproduct""}, {""token"": ""Wnt1"", ""start_span"": 30, ""end_span"": 34, ""type"": ""Gene_or_geneproduct""}]"
Alk5 / Wnt1 - Cre mutants ( B, D) fail to form the typical T - shaped structure of the aortic sac seen in controls at E11. 5.	"Alk5	0	4	Gene_or_geneproduct"	"Wnt1	7	11	Gene_or_geneproduct"	"[{""token"": ""Alk5"", ""start_span"": 0, ""end_span"": 4, ""type"": ""Gene_or_geneproduct""}, {""token"": ""Wnt1"", ""start_span"": 7, ""end_span"": 11, ""type"": ""Gene_or_geneproduct""}]"
Briefly, Alk5Flox / Flox mice were crossed with the ROSA26 Cre reporter mice, and subsequently Alk5Flox / Flox; R26R ( + / +) females were crossed with Alk5KO / WT; Wnt1 - Cre males.	"ROSA26	52	58	Gene_or_geneproduct"	"Wnt1	165	169	Gene_or_geneproduct"	"[{""token"": ""ROSA26"", ""start_span"": 52, ""end_span"": 58, ""type"": ""Gene_or_geneproduct""}, {""token"": ""Wnt1"", ""start_span"": 165, ""end_span"": 169, ""type"": ""Gene_or_geneproduct""}]"
To conclude, the observed phenotypes in Alk5 / Wnt1 - Cre mutants were certainly not due to defective migration of CNCCs to the pharyngeal and outflow tract regions.	"Alk5	40	44	Gene_or_geneproduct"	"Wnt1	47	51	Gene_or_geneproduct"	"[{""token"": ""Alk5"", ""start_span"": 40, ""end_span"": 44, ""type"": ""Gene_or_geneproduct""}, {""token"": ""Wnt1"", ""start_span"": 47, ""end_span"": 51, ""type"": ""Gene_or_geneproduct""}]"
Normal cardiac NCC migration in Alk5 / Wnt1 - Cre mutants.	"Alk5	32	36	Gene_or_geneproduct"	"Wnt1	39	43	Gene_or_geneproduct"	"[{""token"": ""Alk5"", ""start_span"": 32, ""end_span"": 36, ""type"": ""Gene_or_geneproduct""}, {""token"": ""Wnt1"", ""start_span"": 39, ""end_span"": 43, ""type"": ""Gene_or_geneproduct""}]"
The OFT of controls ( A, C, E) and Alk5 / Wnt1 - Cre mutants ( B, D, F) display similar staining patterns when analyzed using the R26R lineage tracing assay at E11. 0.	"Alk5	35	39	Gene_or_geneproduct"	"Wnt1	42	46	Gene_or_geneproduct"	"[{""token"": ""Alk5"", ""start_span"": 35, ""end_span"": 39, ""type"": ""Gene_or_geneproduct""}, {""token"": ""Wnt1"", ""start_span"": 42, ""end_span"": 46, ""type"": ""Gene_or_geneproduct""}]"
In contrast, in Alk5 / Wnt1 - Cre mutants the outflow tract appeared unusually straight, failing to demonstrate the distinct conotruncal transition ( Fig. 5B, D).	"Alk5	16	20	Gene_or_geneproduct"	"Wnt1	23	27	Gene_or_geneproduct"	"[{""token"": ""Alk5"", ""start_span"": 16, ""end_span"": 20, ""type"": ""Gene_or_geneproduct""}, {""token"": ""Wnt1"", ""start_span"": 23, ""end_span"": 27, ""type"": ""Gene_or_geneproduct""}]"
In Alk5 / Wnt1 - Cre mutants the characteristic rotation of the aortic sac and truncal OFT fails to take place ( Fig. 6G - L), and a properly formed AP - septum was not detectable ( Fig. 6G, H).	"Alk5	3	7	Gene_or_geneproduct"	"Wnt1	10	14	Gene_or_geneproduct"	"[{""token"": ""Alk5"", ""start_span"": 3, ""end_span"": 7, ""type"": ""Gene_or_geneproduct""}, {""token"": ""Wnt1"", ""start_span"": 10, ""end_span"": 14, ""type"": ""Gene_or_geneproduct""}]"
Recently, we showed that the NC - specific mutants of the related type I receptor, Alk2, display PTA as well [ 12].	"type I receptor	66	81	Gene_or_geneproduct"	"Alk2	83	87	Gene_or_geneproduct"	"[{""token"": ""type I receptor"", ""start_span"": 66, ""end_span"": 81, ""type"": ""Gene_or_geneproduct""}, {""token"": ""Alk2"", ""start_span"": 83, ""end_span"": 87, ""type"": ""Gene_or_geneproduct""}]"
To conclude, while both Alk2 and Alk5 mutants demonstrate a failure in both the rotation of the aortic sac and the truncal OFT, and in the formation of the AP septum, the pathogenetic mechanisms behind these defects appear remarkably different.	"Alk2	24	28	Gene_or_geneproduct"	"Alk5	33	37	Gene_or_geneproduct"	"[{""token"": ""Alk2"", ""start_span"": 24, ""end_span"": 28, ""type"": ""Gene_or_geneproduct""}, {""token"": ""Alk5"", ""start_span"": 33, ""end_span"": 37, ""type"": ""Gene_or_geneproduct""}]"
The truncal OFT fails to rotate in Alk5 / Wnt1 - Cre mutants.	"Alk5	35	39	Gene_or_geneproduct"	"Wnt1	42	46	Gene_or_geneproduct"	"[{""token"": ""Alk5"", ""start_span"": 35, ""end_span"": 39, ""type"": ""Gene_or_geneproduct""}, {""token"": ""Wnt1"", ""start_span"": 42, ""end_span"": 46, ""type"": ""Gene_or_geneproduct""}]"
Signaling via ALK5 and ALK2 controls different aspects of aortico - pulmonary septation.	"ALK5	14	18	Gene_or_geneproduct"	"ALK2	23	27	Gene_or_geneproduct"	"[{""token"": ""ALK5"", ""start_span"": 14, ""end_span"": 18, ""type"": ""Gene_or_geneproduct""}, {""token"": ""ALK2"", ""start_span"": 23, ""end_span"": 27, ""type"": ""Gene_or_geneproduct""}]"
Alk5 / Wnt1 - Cre mutants display increased apoptosis of post - migratory neural crest cells	"Alk5	0	4	Gene_or_geneproduct"	"Wnt1	7	11	Gene_or_geneproduct"	"[{""token"": ""Alk5"", ""start_span"": 0, ""end_span"": 4, ""type"": ""Gene_or_geneproduct""}, {""token"": ""Wnt1"", ""start_span"": 7, ""end_span"": 11, ""type"": ""Gene_or_geneproduct""}]"
As described above, Alk5 / Wnt1 - Cre mutants displayed an inadequate amount of AP - septal tissue in the base of the aortic sac between the origins of 4th and 6th PAAs.	"Alk5	20	24	Gene_or_geneproduct"	"Wnt1	27	31	Gene_or_geneproduct"	"[{""token"": ""Alk5"", ""start_span"": 20, ""end_span"": 24, ""type"": ""Gene_or_geneproduct""}, {""token"": ""Wnt1"", ""start_span"": 27, ""end_span"": 31, ""type"": ""Gene_or_geneproduct""}]"
Thus, we compared apoptosis patterns also on the more proximal level, but found no detectable differences at E11. 0 between Alk5 / Wnt1 - Cre mutants and controls ( Fig. 7D, E).	"Alk5	124	128	Gene_or_geneproduct"	"Wnt1	131	135	Gene_or_geneproduct"	"[{""token"": ""Alk5"", ""start_span"": 124, ""end_span"": 128, ""type"": ""Gene_or_geneproduct""}, {""token"": ""Wnt1"", ""start_span"": 131, ""end_span"": 135, ""type"": ""Gene_or_geneproduct""}]"
Aberrant apoptosis of NCCs in Alk5 / Wnt1 - Cre mutants.	"Alk5	30	34	Gene_or_geneproduct"	"Wnt1	37	41	Gene_or_geneproduct"	"[{""token"": ""Alk5"", ""start_span"": 30, ""end_span"": 34, ""type"": ""Gene_or_geneproduct""}, {""token"": ""Wnt1"", ""start_span"": 37, ""end_span"": 41, ""type"": ""Gene_or_geneproduct""}]"
To conclude, our results suggest that in Alk5 / Wnt1 - Cre mutants a noticeable increase in apoptosis coincides with the abnormal patterning of the PAAs and the aortic sac, and with the failed AP - septation.	"Alk5	41	45	Gene_or_geneproduct"	"Wnt1	48	52	Gene_or_geneproduct"	"[{""token"": ""Alk5"", ""start_span"": 41, ""end_span"": 45, ""type"": ""Gene_or_geneproduct""}, {""token"": ""Wnt1"", ""start_span"": 48, ""end_span"": 52, ""type"": ""Gene_or_geneproduct""}]"
Pharyngeal organs fail to migrate in Alk5 / Wnt1 - Cre mutants	"Alk5	37	41	Gene_or_geneproduct"	"Wnt1	44	48	Gene_or_geneproduct"	"[{""token"": ""Alk5"", ""start_span"": 37, ""end_span"": 41, ""type"": ""Gene_or_geneproduct""}, {""token"": ""Wnt1"", ""start_span"": 44, ""end_span"": 48, ""type"": ""Gene_or_geneproduct""}]"
In addition to the cardiac OFT, development of pharyngeal organs, i. e., the parathyroid glands and the thymus was also abnormal in Alk5 / Wnt1 - Cre mutants ( see Figs. 1 and 8).	"Alk5	132	136	Gene_or_geneproduct"	"Wnt1	139	143	Gene_or_geneproduct"	"[{""token"": ""Alk5"", ""start_span"": 132, ""end_span"": 136, ""type"": ""Gene_or_geneproduct""}, {""token"": ""Wnt1"", ""start_span"": 139, ""end_span"": 143, ""type"": ""Gene_or_geneproduct""}]"
Likewise the parathyroid glands failed to migrate normally in Alk5 / Wnt1 - Cre mutants.	"Alk5	62	66	Gene_or_geneproduct"	"Wnt1	69	73	Gene_or_geneproduct"	"[{""token"": ""Alk5"", ""start_span"": 62, ""end_span"": 66, ""type"": ""Gene_or_geneproduct""}, {""token"": ""Wnt1"", ""start_span"": 69, ""end_span"": 73, ""type"": ""Gene_or_geneproduct""}]"
To conclude, the observed pharyngeal organ phenotypes were also in striking contrast to those seen in Tgfbr2 / Wnt1 - Cre mutants [ 8, 9].	"Tgfbr2	102	108	Gene_or_geneproduct"	"Wnt1	111	115	Gene_or_geneproduct"	"[{""token"": ""Tgfbr2"", ""start_span"": 102, ""end_span"": 108, ""type"": ""Gene_or_geneproduct""}, {""token"": ""Wnt1"", ""start_span"": 111, ""end_span"": 115, ""type"": ""Gene_or_geneproduct""}]"
Pharyngeal organs fail to migrate in Alk5 / Wnt1 - Cre mutants.	"Alk5	37	41	Gene_or_geneproduct"	"Wnt1	44	48	Gene_or_geneproduct"	"[{""token"": ""Alk5"", ""start_span"": 37, ""end_span"": 41, ""type"": ""Gene_or_geneproduct""}, {""token"": ""Wnt1"", ""start_span"": 44, ""end_span"": 48, ""type"": ""Gene_or_geneproduct""}]"
However, both controls and mutants expressed parathyroid hormone ( PTH) at comparable levels ( blue staining in C and F).	"parathyroid hormone	45	64	Gene_or_geneproduct"	"PTH	67	70	Gene_or_geneproduct"	"[{""token"": ""parathyroid hormone"", ""start_span"": 45, ""end_span"": 64, ""type"": ""Gene_or_geneproduct""}, {""token"": ""PTH"", ""start_span"": 67, ""end_span"": 70, ""type"": ""Gene_or_geneproduct""}]"
Moreover, the Alk5 / Wnt1 - Cre mutants display an abnormal patterning of the aortic sac and defective AP septation leading to PTA, reminiscent of type A2 ( = truncus artriosus with no main pulmonary artery segment present [ 30]).	"Alk5	14	18	Gene_or_geneproduct"	"Wnt1	21	25	Gene_or_geneproduct"	"[{""token"": ""Alk5"", ""start_span"": 14, ""end_span"": 18, ""type"": ""Gene_or_geneproduct""}, {""token"": ""Wnt1"", ""start_span"": 21, ""end_span"": 25, ""type"": ""Gene_or_geneproduct""}]"
