Homozygosity for a null allele of the carbonic anhydrase II gene ( Car2n) does not alter IOP while homozygosity for a mutation in the leptin receptor gene ( Leprdb) that causes obesity and diabetes results in increased IOP.	"carbonic anhydrase II	38	59	Gene_or_geneproduct"	"leptin receptor	134	149	Gene_or_geneproduct"	"[{""token"": ""carbonic anhydrase II"", ""start_span"": 38, ""end_span"": 59, ""type"": ""Gene_or_geneproduct""}, {""token"": ""leptin receptor"", ""start_span"": 134, ""end_span"": 149, ""type"": ""Gene_or_geneproduct""}]"
Mutations in two of the assessed candidate genes ( Lepr and Tyr) result in increased IOP.	"Lepr	51	55	Gene_or_geneproduct"	"Tyr	60	63	Gene_or_geneproduct"	"[{""token"": ""Lepr"", ""start_span"": 51, ""end_span"": 55, ""type"": ""Gene_or_geneproduct""}, {""token"": ""Tyr"", ""start_span"": 60, ""end_span"": 63, ""type"": ""Gene_or_geneproduct""}]"
Mutations in the myocilin gene ( MYOC) cause human glaucoma.	"myocilin	17	25	Gene_or_geneproduct"	"MYOC	33	37	Gene_or_geneproduct"	"[{""token"": ""myocilin"", ""start_span"": 17, ""end_span"": 25, ""type"": ""Gene_or_geneproduct""}, {""token"": ""MYOC"", ""start_span"": 33, ""end_span"": 37, ""type"": ""Gene_or_geneproduct""}]"
To test if deficiency of carbonic anhydrase II leads to decreased IOP, we analyzed mice of a B6 background that were genetically similar but with normal or mutant alleles of the Car2 gene [ 25, 26].	"carbonic anhydrase II	25	46	Gene_or_geneproduct"	"Car2	178	182	Gene_or_geneproduct"	"[{""token"": ""carbonic anhydrase II"", ""start_span"": 25, ""end_span"": 46, ""type"": ""Gene_or_geneproduct""}, {""token"": ""Car2"", ""start_span"": 178, ""end_span"": 182, ""type"": ""Gene_or_geneproduct""}]"
Our experiments show that a genetic deficiency of CAII in mice homozygous for a mutation in the Car2 gene does not alter IOP.	"CAII	50	54	Gene_or_geneproduct"	"Car2	96	100	Gene_or_geneproduct"	"[{""token"": ""CAII"", ""start_span"": 50, ""end_span"": 54, ""type"": ""Gene_or_geneproduct""}, {""token"": ""Car2"", ""start_span"": 96, ""end_span"": 100, ""type"": ""Gene_or_geneproduct""}]"
We also thank Jane Barker for the Car2 mice, Marianna Mertts for her help with analysis of Myoc alleles, and members of the John laboratory, Tatyana Golovkina, Edward Leiter and Timothy O ' Brien for critical reading of the manuscript.	"Car2	34	38	Gene_or_geneproduct"	"Myoc	91	95	Gene_or_geneproduct"	"[{""token"": ""Car2"", ""start_span"": 34, ""end_span"": 38, ""type"": ""Gene_or_geneproduct""}, {""token"": ""Myoc"", ""start_span"": 91, ""end_span"": 95, ""type"": ""Gene_or_geneproduct""}]"
BRCA2 appears to function in recombination via interactions with the major eukaryotic recombinase RAD51 [ 1, 2, 3].	"BRCA2	0	5	Gene_or_geneproduct"	"RAD51	98	103	Gene_or_geneproduct"	"[{""token"": ""BRCA2"", ""start_span"": 0, ""end_span"": 5, ""type"": ""Gene_or_geneproduct""}, {""token"": ""RAD51"", ""start_span"": 98, ""end_span"": 103, ""type"": ""Gene_or_geneproduct""}]"
We briefly review the context in which the two studies were carried out, we comment on the results presented, and we discuss models designed to account for the role of BRCA2 in RAD51 - mediated repair.	"BRCA2	168	173	Gene_or_geneproduct"	"RAD51	177	182	Gene_or_geneproduct"	"[{""token"": ""BRCA2"", ""start_span"": 168, ""end_span"": 173, ""type"": ""Gene_or_geneproduct""}, {""token"": ""RAD51"", ""start_span"": 177, ""end_span"": 182, ""type"": ""Gene_or_geneproduct""}]"
BRCA1 and BRCA2 form discrete nuclear foci during the S phase and after exposure to DNA damaging agents [ 9, 10, 11].	"BRCA1	0	5	Gene_or_geneproduct"	"BRCA2	10	15	Gene_or_geneproduct"	"[{""token"": ""BRCA1"", ""start_span"": 0, ""end_span"": 5, ""type"": ""Gene_or_geneproduct""}, {""token"": ""BRCA2"", ""start_span"": 10, ""end_span"": 15, ""type"": ""Gene_or_geneproduct""}]"
Cell lines defective in either BRCA1 or BRCA2 are sensitive to damaging agents that form double - strand breaks ( DSBs), as are other cell lines defective in recombinational repair ( reviewed in [ 15]).	"BRCA1	31	36	Gene_or_geneproduct"	"BRCA2	40	45	Gene_or_geneproduct"	"[{""token"": ""BRCA1"", ""start_span"": 31, ""end_span"": 36, ""type"": ""Gene_or_geneproduct""}, {""token"": ""BRCA2"", ""start_span"": 40, ""end_span"": 45, ""type"": ""Gene_or_geneproduct""}]"
BRCA2 interacts with the RAD51 recombinase via direct protein - protein contacts [ 16, 17, 18, 19].	"BRCA2	0	5	Gene_or_geneproduct"	"RAD51 recombinase	25	42	Gene_or_geneproduct"	"[{""token"": ""BRCA2"", ""start_span"": 0, ""end_span"": 5, ""type"": ""Gene_or_geneproduct""}, {""token"": ""RAD51 recombinase"", ""start_span"": 25, ""end_span"": 42, ""type"": ""Gene_or_geneproduct""}]"
Biochemical analysis also showed interaction between BRCA1 and RAD51, although these detected interactions may have been indirect [ 9].	"BRCA1	53	58	Gene_or_geneproduct"	"RAD51	63	68	Gene_or_geneproduct"	"[{""token"": ""BRCA1"", ""start_span"": 53, ""end_span"": 58, ""type"": ""Gene_or_geneproduct""}, {""token"": ""RAD51"", ""start_span"": 63, ""end_span"": 68, ""type"": ""Gene_or_geneproduct""}]"
The BRC repeats of BRCA2 are responsible for direct RAD51 interaction.	"BRCA2	19	24	Gene_or_geneproduct"	"RAD51	52	57	Gene_or_geneproduct"	"[{""token"": ""BRCA2"", ""start_span"": 19, ""end_span"": 24, ""type"": ""Gene_or_geneproduct""}, {""token"": ""RAD51"", ""start_span"": 52, ""end_span"": 57, ""type"": ""Gene_or_geneproduct""}]"
Cells lacking BRCA1 / 2 fail to form damage - induced subnuclear RAD51 foci with normal efficiency, suggesting that these proteins are required for the formation of recombinase complexes at the sites of DNA damage [ 20, 21].	"BRCA1	14	19	Gene_or_geneproduct"	"RAD51	65	70	Gene_or_geneproduct"	"[{""token"": ""BRCA1"", ""start_span"": 14, ""end_span"": 19, ""type"": ""Gene_or_geneproduct""}, {""token"": ""RAD51"", ""start_span"": 65, ""end_span"": 70, ""type"": ""Gene_or_geneproduct""}]"
Moynahan et al [ 24] have used such a GFP recombination substrate to demonstrate that cells with defective BRCA2 protein are deficient in their ability to repair the I - SceI - induced DSB through homologous recombination.	"BRCA2	107	112	Gene_or_geneproduct"	"I - SceI	166	174	Gene_or_geneproduct"	"[{""token"": ""BRCA2"", ""start_span"": 107, ""end_span"": 112, ""type"": ""Gene_or_geneproduct""}, {""token"": ""I - SceI"", ""start_span"": 166, ""end_span"": 174, ""type"": ""Gene_or_geneproduct""}]"
The authors indicate that the level of I - SceI - induced recombination in CAPAN - 1 is over 100 - fold less than that seen using other ( BRCA2 +) human tumor cell lines.	"I - SceI	39	47	Gene_or_geneproduct"	"BRCA2	138	143	Gene_or_geneproduct"	"[{""token"": ""I - SceI"", ""start_span"": 39, ""end_span"": 47, ""type"": ""Gene_or_geneproduct""}, {""token"": ""BRCA2"", ""start_span"": 138, ""end_span"": 143, ""type"": ""Gene_or_geneproduct""}]"
In these experiments, the derivative expressing full - length BRCA2 yielded 10 - fold more recombinants than controls expressing only truncated BRCA2 ( S. Powell, personal communication, 2001).	"BRCA2	62	67	Gene_or_geneproduct"	"BRCA2	144	149	Gene_or_geneproduct"	"[{""token"": ""BRCA2"", ""start_span"": 62, ""end_span"": 67, ""type"": ""Gene_or_geneproduct""}, {""token"": ""BRCA2"", ""start_span"": 144, ""end_span"": 149, ""type"": ""Gene_or_geneproduct""}]"
Conversely, the BRCA2 defect in CAPAN - 1 could be fully responsible for the 100 - fold defect in recombination if the level of BRCA2 complementation observed by Powell was incomplete.	"BRCA2	16	21	Gene_or_geneproduct"	"BRCA2	128	133	Gene_or_geneproduct"	"[{""token"": ""BRCA2"", ""start_span"": 16, ""end_span"": 21, ""type"": ""Gene_or_geneproduct""}, {""token"": ""BRCA2"", ""start_span"": 128, ""end_span"": 133, ""type"": ""Gene_or_geneproduct""}]"
The function of BRCA2 - RAD51 interaction	"BRCA2	16	21	Gene_or_geneproduct"	"RAD51	24	29	Gene_or_geneproduct"	"[{""token"": ""BRCA2"", ""start_span"": 16, ""end_span"": 21, ""type"": ""Gene_or_geneproduct""}, {""token"": ""RAD51"", ""start_span"": 24, ""end_span"": 29, ""type"": ""Gene_or_geneproduct""}]"
The second paper providing evidence, by Davies et al [ 26], is a biochemical study of the interaction between the homologous recombinase RAD51 and a peptide consisting of one of the eight BRC repeats from human BRCA2.	"RAD51	137	142	Gene_or_geneproduct"	"human BRCA2	205	216	Gene_or_geneproduct"	"[{""token"": ""RAD51"", ""start_span"": 137, ""end_span"": 142, ""type"": ""Gene_or_geneproduct""}, {""token"": ""human BRCA2"", ""start_span"": 205, ""end_span"": 216, ""type"": ""Gene_or_geneproduct""}]"
These experiments raise the possibility that the full - length BRCA2 protein could act as a negative regulator of inappropriate RAD51 - DNA interaction.	"BRCA2	63	68	Gene_or_geneproduct"	"RAD51	128	133	Gene_or_geneproduct"	"[{""token"": ""BRCA2"", ""start_span"": 63, ""end_span"": 68, ""type"": ""Gene_or_geneproduct""}, {""token"": ""RAD51"", ""start_span"": 128, ""end_span"": 133, ""type"": ""Gene_or_geneproduct""}]"
The final experiment reported by Davies et al [ 26] is particularly important with respect to understanding the mechanism ( s) through which BRCA2 promotes RAD51 - dependent recombination.	"BRCA2	141	146	Gene_or_geneproduct"	"RAD51	156	161	Gene_or_geneproduct"	"[{""token"": ""BRCA2"", ""start_span"": 141, ""end_span"": 146, ""type"": ""Gene_or_geneproduct""}, {""token"": ""RAD51"", ""start_span"": 156, ""end_span"": 161, ""type"": ""Gene_or_geneproduct""}]"
In the absence of this interaction with BRCA2, RAD51 might exist in a form that is not capable of being recruited into a functional repair complex when damage occurs.	"BRCA2	40	45	Gene_or_geneproduct"	"RAD51	47	52	Gene_or_geneproduct"	"[{""token"": ""BRCA2"", ""start_span"": 40, ""end_span"": 45, ""type"": ""Gene_or_geneproduct""}, {""token"": ""RAD51"", ""start_span"": 47, ""end_span"": 52, ""type"": ""Gene_or_geneproduct""}]"
Alternatively, or in addition, suppression of RAD51 - ssDNA interaction might be important for preventing RAD51 from binding to the regions of ssDNA that form during normal DNA replication.	"RAD51	46	51	Gene_or_geneproduct"	"RAD51	106	111	Gene_or_geneproduct"	"[{""token"": ""RAD51"", ""start_span"": 46, ""end_span"": 51, ""type"": ""Gene_or_geneproduct""}, {""token"": ""RAD51"", ""start_span"": 106, ""end_span"": 111, ""type"": ""Gene_or_geneproduct""}]"
Several proteins that interact with RAD51 are thought to ' mediate ' assembly of RAD51 at sites of DNA damage ( reviewed in [ 30]).	"RAD51	36	41	Gene_or_geneproduct"	"RAD51	81	86	Gene_or_geneproduct"	"[{""token"": ""RAD51"", ""start_span"": 36, ""end_span"": 41, ""type"": ""Gene_or_geneproduct""}, {""token"": ""RAD51"", ""start_span"": 81, ""end_span"": 86, ""type"": ""Gene_or_geneproduct""}]"
Finally, it is important to note that the two models for the function of the BRCA2 - RAD51 interaction shown in Figure 2 are not mutually exclusive.	"BRCA2	77	82	Gene_or_geneproduct"	"RAD51	85	90	Gene_or_geneproduct"	"[{""token"": ""BRCA2"", ""start_span"": 77, ""end_span"": 82, ""type"": ""Gene_or_geneproduct""}, {""token"": ""RAD51"", ""start_span"": 85, ""end_span"": 90, ""type"": ""Gene_or_geneproduct""}]"
Further experiments are clearly required to clarify the functional interactions between BRCA2 and RAD51 during recombinational repair.	"BRCA2	88	93	Gene_or_geneproduct"	"RAD51	98	103	Gene_or_geneproduct"	"[{""token"": ""BRCA2"", ""start_span"": 88, ""end_span"": 93, ""type"": ""Gene_or_geneproduct""}, {""token"": ""RAD51"", ""start_span"": 98, ""end_span"": 103, ""type"": ""Gene_or_geneproduct""}]"
It should be relatively straightforward to determine whether the role of BRCA2 is limited to transporting RAD51 to the nucleus.	"BRCA2	73	78	Gene_or_geneproduct"	"RAD51	106	111	Gene_or_geneproduct"	"[{""token"": ""BRCA2"", ""start_span"": 73, ""end_span"": 78, ""type"": ""Gene_or_geneproduct""}, {""token"": ""RAD51"", ""start_span"": 106, ""end_span"": 111, ""type"": ""Gene_or_geneproduct""}]"
However, several technical obstacles, including the large size of BRCA2, promise to make biochemical characterization of BRCA2 function difficult.	"BRCA2	66	71	Gene_or_geneproduct"	"BRCA2	121	126	Gene_or_geneproduct"	"[{""token"": ""BRCA2"", ""start_span"": 66, ""end_span"": 71, ""type"": ""Gene_or_geneproduct""}, {""token"": ""BRCA2"", ""start_span"": 121, ""end_span"": 126, ""type"": ""Gene_or_geneproduct""}]"
Potential roles of BRCA2 in promoting assembly of Rad51 at sites of DNA damage.	"BRCA2	19	24	Gene_or_geneproduct"	"Rad51	50	55	Gene_or_geneproduct"	"[{""token"": ""BRCA2"", ""start_span"": 19, ""end_span"": 24, ""type"": ""Gene_or_geneproduct""}, {""token"": ""Rad51"", ""start_span"": 50, ""end_span"": 55, ""type"": ""Gene_or_geneproduct""}]"
Chromosomal DNA is shown as pairs of straight lines, Rad51 as open circles, and BRCA2 as grey bars.	"Rad51	53	58	Gene_or_geneproduct"	"BRCA2	80	85	Gene_or_geneproduct"	"[{""token"": ""Rad51"", ""start_span"": 53, ""end_span"": 58, ""type"": ""Gene_or_geneproduct""}, {""token"": ""BRCA2"", ""start_span"": 80, ""end_span"": 85, ""type"": ""Gene_or_geneproduct""}]"
In this model, BRCA2 is not required for assembly of functional complexes at damaged sites, only to prevent a substantial fraction of Rad51 from being sequestered in a nonfunctional form.	"BRCA2	15	20	Gene_or_geneproduct"	"Rad51	134	139	Gene_or_geneproduct"	"[{""token"": ""BRCA2"", ""start_span"": 15, ""end_span"": 20, ""type"": ""Gene_or_geneproduct""}, {""token"": ""Rad51"", ""start_span"": 134, ""end_span"": 139, ""type"": ""Gene_or_geneproduct""}]"
In a BRCA2 - defective cell, mutant Rad51 becomes associated with DNA at random sites and is therefore not readily recruited to sites of damage.	"BRCA2	5	10	Gene_or_geneproduct"	"Rad51	36	41	Gene_or_geneproduct"	"[{""token"": ""BRCA2"", ""start_span"": 5, ""end_span"": 10, ""type"": ""Gene_or_geneproduct""}, {""token"": ""Rad51"", ""start_span"": 36, ""end_span"": 41, ""type"": ""Gene_or_geneproduct""}]"
BRCA2 is proposed to be required for Rad51 to assemble into functional recombinational repair complexes at sites of damage.	"BRCA2	0	5	Gene_or_geneproduct"	"Rad51	37	42	Gene_or_geneproduct"	"[{""token"": ""BRCA2"", ""start_span"": 0, ""end_span"": 5, ""type"": ""Gene_or_geneproduct""}, {""token"": ""Rad51"", ""start_span"": 37, ""end_span"": 42, ""type"": ""Gene_or_geneproduct""}]"
In BRCA - defective cells, Rad51 fails to associate with sites of damage due to lack of an assembly factor.	"BRCA	3	7	Gene_or_geneproduct"	"Rad51	27	32	Gene_or_geneproduct"	"[{""token"": ""BRCA"", ""start_span"": 3, ""end_span"": 7, ""type"": ""Gene_or_geneproduct""}, {""token"": ""Rad51"", ""start_span"": 27, ""end_span"": 32, ""type"": ""Gene_or_geneproduct""}]"
pCAGGS contains the chicken beta - actin promoter and first intron coupled to the CMV immediate early enhancer, and rabbit beta - globin polyadenylation signal.	"chicken beta - actin	20	40	Gene_or_geneproduct"	"rabbit beta - globin	116	136	Gene_or_geneproduct"	"[{""token"": ""chicken beta - actin"", ""start_span"": 20, ""end_span"": 40, ""type"": ""Gene_or_geneproduct""}, {""token"": ""rabbit beta - globin"", ""start_span"": 116, ""end_span"": 136, ""type"": ""Gene_or_geneproduct""}]"
The limited expression of neurotrophins in the cochlea of Brn3c null mice suffices to support many sensory neurons, particularly in the cochlea, until birth.	"neurotrophins	26	39	Gene_or_geneproduct"	"Brn3c	58	63	Gene_or_geneproduct"	"[{""token"": ""neurotrophins"", ""start_span"": 26, ""end_span"": 39, ""type"": ""Gene_or_geneproduct""}, {""token"": ""Brn3c"", ""start_span"": 58, ""end_span"": 63, ""type"": ""Gene_or_geneproduct""}]"
The initial development and partial differentiation of hair cells in Brn3c mutants could possibly lead to some neurotrophin expression in these cells to sustain sensory neurons through embryonic development and beyond.	"Brn3c	69	74	Gene_or_geneproduct"	"neurotrophin	111	123	Gene_or_geneproduct"	"[{""token"": ""Brn3c"", ""start_span"": 69, ""end_span"": 74, ""type"": ""Gene_or_geneproduct""}, {""token"": ""neurotrophin"", ""start_span"": 111, ""end_span"": 123, ""type"": ""Gene_or_geneproduct""}]"
Data on various single and compound neurotrophin null mutants have shown that the loss of a specific neurotrophin leads to topologically restricted loss of sensory neurons in the embryonic ear [ 4, 5].	"neurotrophin	36	48	Gene_or_geneproduct"	"neurotrophin	101	113	Gene_or_geneproduct"	"[{""token"": ""neurotrophin"", ""start_span"": 36, ""end_span"": 48, ""type"": ""Gene_or_geneproduct""}, {""token"": ""neurotrophin"", ""start_span"": 101, ""end_span"": 113, ""type"": ""Gene_or_geneproduct""}]"
Such selective loss in Brn3c null mutants would therefore indicate reduction of a specific neurotrophin in immature hair cells.	"Brn3c	23	28	Gene_or_geneproduct"	"neurotrophin	91	103	Gene_or_geneproduct"	"[{""token"": ""Brn3c"", ""start_span"": 23, ""end_span"": 28, ""type"": ""Gene_or_geneproduct""}, {""token"": ""neurotrophin"", ""start_span"": 91, ""end_span"": 103, ""type"": ""Gene_or_geneproduct""}]"
This information could be important for an in - depth evaluation of the human deafness related to the Pou4f3 gene, DFNA15 [ 12].	"Pou4f3	102	108	Gene_or_geneproduct"	"DFNA15	115	121	Gene_or_geneproduct"	"[{""token"": ""Pou4f3"", ""start_span"": 102, ""end_span"": 108, ""type"": ""Gene_or_geneproduct""}, {""token"": ""DFNA15"", ""start_span"": 115, ""end_span"": 121, ""type"": ""Gene_or_geneproduct""}]"
Null mutants of BDNF or its receptor trkB lose all innervation to the semicircular canals and have a reduced innervation to the utricle, saccule and apical turn of the cochlea.	"BDNF	16	20	Gene_or_geneproduct"	"trkB	37	41	Gene_or_geneproduct"	"[{""token"": ""BDNF"", ""start_span"": 16, ""end_span"": 20, ""type"": ""Gene_or_geneproduct""}, {""token"": ""trkB"", ""start_span"": 37, ""end_span"": 41, ""type"": ""Gene_or_geneproduct""}]"
In contrast, null mutations of either NT - 3 or its receptor trkC result in loss of spiral neurons in the basal turn with formation of an inner spiral bundle of afferents extending to the basal tip.	"NT - 3	38	44	Gene_or_geneproduct"	"trkC	61	65	Gene_or_geneproduct"	"[{""token"": ""NT - 3"", ""start_span"": 38, ""end_span"": 44, ""type"": ""Gene_or_geneproduct""}, {""token"": ""trkC"", ""start_span"": 61, ""end_span"": 65, ""type"": ""Gene_or_geneproduct""}]"
Our null hypothesis for this study would be that Brn3c null mice show severe compromised production of these neurotrophins and should therefore show a comparable pattern of nerve fiber loss.	"Brn3c	49	54	Gene_or_geneproduct"	"neurotrophins	109	122	Gene_or_geneproduct"	"[{""token"": ""Brn3c"", ""start_span"": 49, ""end_span"": 54, ""type"": ""Gene_or_geneproduct""}, {""token"": ""neurotrophins"", ""start_span"": 109, ""end_span"": 122, ""type"": ""Gene_or_geneproduct""}]"
There is no specific loss of all afferent and efferent innervation to the canal crista ( Fig. 2a), a hallmark of both BDNF and trkB null mutations [ 13, 15].	"BDNF	118	122	Gene_or_geneproduct"	"trkB	127	131	Gene_or_geneproduct"	"[{""token"": ""BDNF"", ""start_span"": 118, ""end_span"": 122, ""type"": ""Gene_or_geneproduct""}, {""token"": ""trkB"", ""start_span"": 127, ""end_span"": 131, ""type"": ""Gene_or_geneproduct""}]"
No loss in specific areas, comparable to that in BDNF null mutant mice, is apparent in the saccule or utricle of Brn3c null mice.	"BDNF	49	53	Gene_or_geneproduct"	"Brn3c	113	118	Gene_or_geneproduct"	"[{""token"": ""BDNF"", ""start_span"": 49, ""end_span"": 53, ""type"": ""Gene_or_geneproduct""}, {""token"": ""Brn3c"", ""start_span"": 113, ""end_span"": 118, ""type"": ""Gene_or_geneproduct""}]"
The limited qualitative effect of Brn3c null mutations on fiber loss is particularly obvious in the P8 Brn3c null mutant apical turn ( Fig. 3g).	"Brn3c	34	39	Gene_or_geneproduct"	"Brn3c	103	108	Gene_or_geneproduct"	"[{""token"": ""Brn3c"", ""start_span"": 34, ""end_span"": 39, ""type"": ""Gene_or_geneproduct""}, {""token"": ""Brn3c"", ""start_span"": 103, ""end_span"": 108, ""type"": ""Gene_or_geneproduct""}]"
Nerve fibers can be traced into the sensory epithelium of P0 and P8 Brn3c null mutants past the habenula perforata and there is a normal location of spiral sensory neurons in Rosenthal ' s canal in the apex of P8 Brn3c null mutants ( Fig. 3d, 3g).	"Brn3c	68	73	Gene_or_geneproduct"	"Brn3c	213	218	Gene_or_geneproduct"	"[{""token"": ""Brn3c"", ""start_span"": 68, ""end_span"": 73, ""type"": ""Gene_or_geneproduct""}, {""token"": ""Brn3c"", ""start_span"": 213, ""end_span"": 218, ""type"": ""Gene_or_geneproduct""}]"
The distribution of hair cells as identified with MyoVII immunocytochemistry is shown for 7 - day old whole mounted cochlea ( a - d) and the appearance of cytological differentiation is shown as revealed with epoxy resin sections in 7 - day old ( e - g) and 6 - month old ( h) control ( a, c, e) and Brn3c mutant cochleae ( b, d, f - h).	"MyoVII	50	56	Gene_or_geneproduct"	"Brn3c	300	305	Gene_or_geneproduct"	"[{""token"": ""MyoVII"", ""start_span"": 50, ""end_span"": 56, ""type"": ""Gene_or_geneproduct""}, {""token"": ""Brn3c"", ""start_span"": 300, ""end_span"": 305, ""type"": ""Gene_or_geneproduct""}]"
We did not analyze neurotrophin expression in 6 - month old animals as neurotrophins are downregulated in neonates [ 20] and no expression can be found even in normal animals [ 4].	"neurotrophin	19	31	Gene_or_geneproduct"	"neurotrophins	71	84	Gene_or_geneproduct"	"[{""token"": ""neurotrophin"", ""start_span"": 19, ""end_span"": 31, ""type"": ""Gene_or_geneproduct""}, {""token"": ""neurotrophins"", ""start_span"": 71, ""end_span"": 84, ""type"": ""Gene_or_geneproduct""}]"
The BDNF signal in the utricle was clearly centered on the hair cells in the control animal but some aggregation of silver grains appeared also in the Brn3c null mutants ( data not shown).	"BDNF	4	8	Gene_or_geneproduct"	"Brn3c	151	156	Gene_or_geneproduct"	"[{""token"": ""BDNF"", ""start_span"": 4, ""end_span"": 8, ""type"": ""Gene_or_geneproduct""}, {""token"": ""Brn3c"", ""start_span"": 151, ""end_span"": 156, ""type"": ""Gene_or_geneproduct""}]"
The expression of BDNF and NT - 3 mRNA is shown in the P0 vestibular sensory epithelia.	"BDNF	18	22	Gene_or_geneproduct"	"NT - 3	27	33	Gene_or_geneproduct"	"[{""token"": ""BDNF"", ""start_span"": 18, ""end_span"": 22, ""type"": ""Gene_or_geneproduct""}, {""token"": ""NT - 3"", ""start_span"": 27, ""end_span"": 33, ""type"": ""Gene_or_geneproduct""}]"
Note the prominent BDNF expression in the hair cell region ( HaC) of control canal ( b) and saccule ( d) and low levels of expression in the Brn3c null mice ( a, c) over immature hair cells ( iHC).	"BDNF	19	23	Gene_or_geneproduct"	"Brn3c	141	146	Gene_or_geneproduct"	"[{""token"": ""BDNF"", ""start_span"": 19, ""end_span"": 23, ""type"": ""Gene_or_geneproduct""}, {""token"": ""Brn3c"", ""start_span"": 141, ""end_span"": 146, ""type"": ""Gene_or_geneproduct""}]"
The NT - 3 expression is much more diffuse in both control and Brn3c mutant littermates.	"NT - 3	4	10	Gene_or_geneproduct"	"Brn3c	63	68	Gene_or_geneproduct"	"[{""token"": ""NT - 3"", ""start_span"": 4, ""end_span"": 10, ""type"": ""Gene_or_geneproduct""}, {""token"": ""Brn3c"", ""start_span"": 63, ""end_span"": 68, ""type"": ""Gene_or_geneproduct""}]"
In the cochlea, the BDNF signal was very weak in the base in both the control ( Fig. 9b) and the Brn3c null littermates ( Fig. 9a).	"BDNF	20	24	Gene_or_geneproduct"	"Brn3c	97	102	Gene_or_geneproduct"	"[{""token"": ""BDNF"", ""start_span"": 20, ""end_span"": 24, ""type"": ""Gene_or_geneproduct""}, {""token"": ""Brn3c"", ""start_span"": 97, ""end_span"": 102, ""type"": ""Gene_or_geneproduct""}]"
However, there was a surprisingly strong NT - 3 signal over the organ of Corti in the apex of Brn3c null littermates ( Fig. 9c) that closely matched the signal found in the control littermates ( Fig. 9d).	"NT - 3	41	47	Gene_or_geneproduct"	"Brn3c	94	99	Gene_or_geneproduct"	"[{""token"": ""NT - 3"", ""start_span"": 41, ""end_span"": 47, ""type"": ""Gene_or_geneproduct""}, {""token"": ""Brn3c"", ""start_span"": 94, ""end_span"": 99, ""type"": ""Gene_or_geneproduct""}]"
The NT - 3 signal in the area of the cochlea that corresponds to the IHC ' s persisted at least until P8 in the apex of Brn3c null mice ( Fig. 9e, 9f).	"NT - 3	4	10	Gene_or_geneproduct"	"Brn3c	120	125	Gene_or_geneproduct"	"[{""token"": ""NT - 3"", ""start_span"": 4, ""end_span"": 10, ""type"": ""Gene_or_geneproduct""}, {""token"": ""Brn3c"", ""start_span"": 120, ""end_span"": 125, ""type"": ""Gene_or_geneproduct""}]"
Note the limited expression of BDNF in the basal turn of both wildtype and mutant littermates ( a, b) and the much stronger expression of NT - 3 in the apex over the region of the inner hair cells in both wildtype and control littermates ( c, d).	"BDNF	31	35	Gene_or_geneproduct"	"NT - 3	138	144	Gene_or_geneproduct"	"[{""token"": ""BDNF"", ""start_span"": 31, ""end_span"": 35, ""type"": ""Gene_or_geneproduct""}, {""token"": ""NT - 3"", ""start_span"": 138, ""end_span"": 144, ""type"": ""Gene_or_geneproduct""}]"
NT - 3 expression persists at least until P8 in the apex of Brn3c null mice in an area that topologically compares to the inner hair cells of control animals ( e, f, arrows).	"NT - 3	0	6	Gene_or_geneproduct"	"Brn3c	60	65	Gene_or_geneproduct"	"[{""token"": ""NT - 3"", ""start_span"": 0, ""end_span"": 6, ""type"": ""Gene_or_geneproduct""}, {""token"": ""Brn3c"", ""start_span"": 60, ""end_span"": 65, ""type"": ""Gene_or_geneproduct""}]"
