Results expressed as the mean +/- SD showed significant differences ( p < 0. 01) between 4 - month - old Sam68 + / + mice ( solid black) and 12 - month - old Sam68 + / + mice ( hatched black) but not between 4 - month - old Sam68 - / - mice ( solid white) and 12 - month - old Sam68 - / - mice ( stippled white).	"Sam68	105	110	Gene_or_geneproduct"	"Sam68	158	163	Gene_or_geneproduct"	"Sam68	224	229	Gene_or_geneproduct"	"Sam68	277	282	Gene_or_geneproduct"	"[{""token"": ""Sam68"", ""start_span"": 105, ""end_span"": 110, ""type"": ""Gene_or_geneproduct""}, {""token"": ""Sam68"", ""start_span"": 158, ""end_span"": 163, ""type"": ""Gene_or_geneproduct""}, {""token"": ""Sam68"", ""start_span"": 224, ""end_span"": 229, ""type"": ""Gene_or_geneproduct""}, {""token"": ""Sam68"", ""start_span"": 277, ""end_span"": 282, ""type"": ""Gene_or_geneproduct""}]"
Solid black = 4 - month - old Sam68 + / +; hatched black = 12 - month - old Sam68 + / +; solid red = 4 - month - old Sam68 - / -; stippled red = 12 - month - old Sam68 - / -.	"Sam68	30	35	Gene_or_geneproduct"	"Sam68	76	81	Gene_or_geneproduct"	"Sam68	117	122	Gene_or_geneproduct"	"Sam68	162	167	Gene_or_geneproduct"	"[{""token"": ""Sam68"", ""start_span"": 30, ""end_span"": 35, ""type"": ""Gene_or_geneproduct""}, {""token"": ""Sam68"", ""start_span"": 76, ""end_span"": 81, ""type"": ""Gene_or_geneproduct""}, {""token"": ""Sam68"", ""start_span"": 117, ""end_span"": 122, ""type"": ""Gene_or_geneproduct""}, {""token"": ""Sam68"", ""start_span"": 162, ""end_span"": 167, ""type"": ""Gene_or_geneproduct""}]"
Staining patterns were similar in 4 - month - old Sam68 + / + ( A and B), 4 - month - old Sam68 - / - ( C and D), and 12 - month - old Sam68 - / - ( G and H) mice compared with 12 - month - old Sam68 + / + mice ( E and F).	"Sam68	50	55	Gene_or_geneproduct"	"Sam68	90	95	Gene_or_geneproduct"	"Sam68	135	140	Gene_or_geneproduct"	"Sam68	194	199	Gene_or_geneproduct"	"[{""token"": ""Sam68"", ""start_span"": 50, ""end_span"": 55, ""type"": ""Gene_or_geneproduct""}, {""token"": ""Sam68"", ""start_span"": 90, ""end_span"": 95, ""type"": ""Gene_or_geneproduct""}, {""token"": ""Sam68"", ""start_span"": 135, ""end_span"": 140, ""type"": ""Gene_or_geneproduct""}, {""token"": ""Sam68"", ""start_span"": 194, ""end_span"": 199, ""type"": ""Gene_or_geneproduct""}]"
To assess the level of osteogenic differentiation in these cells, expression of late osteoblast marker, osteocalcin ( OCN), was analyzed by RT - PCR and compared with beta - actin and GAPDH controls.	"osteocalcin	104	115	Gene_or_geneproduct"	"OCN	118	121	Gene_or_geneproduct"	"beta - actin	167	179	Gene_or_geneproduct"	"GAPDH	184	189	Gene_or_geneproduct"	"[{""token"": ""osteocalcin"", ""start_span"": 104, ""end_span"": 115, ""type"": ""Gene_or_geneproduct""}, {""token"": ""OCN"", ""start_span"": 118, ""end_span"": 121, ""type"": ""Gene_or_geneproduct""}, {""token"": ""beta - actin"", ""start_span"": 167, ""end_span"": 179, ""type"": ""Gene_or_geneproduct""}, {""token"": ""GAPDH"", ""start_span"": 184, ""end_span"": 189, ""type"": ""Gene_or_geneproduct""}]"
In these crosses the ratios of Capn2 + / + to Capn2 + / - animals among males or females compared well with the ratio in the combined populations; 77% of males and 69% of females were Capn2 + / - when the mutant allele came from the mother, and 62% of males and 55% of females were Capn2 + / - when the mutant allele came from the father.	"Capn2	31	36	Gene_or_geneproduct"	"Capn2	46	51	Gene_or_geneproduct"	"Capn2	184	189	Gene_or_geneproduct"	"Capn2	282	287	Gene_or_geneproduct"	"[{""token"": ""Capn2"", ""start_span"": 31, ""end_span"": 36, ""type"": ""Gene_or_geneproduct""}, {""token"": ""Capn2"", ""start_span"": 46, ""end_span"": 51, ""type"": ""Gene_or_geneproduct""}, {""token"": ""Capn2"", ""start_span"": 184, ""end_span"": 189, ""type"": ""Gene_or_geneproduct""}, {""token"": ""Capn2"", ""start_span"": 282, ""end_span"": 287, ""type"": ""Gene_or_geneproduct""}]"
Furthermore, some of the proteins known to be involved in cell cycle progression, such as p53, p107, cyclin D1, and p27kip1 are reputed to be calpain substrates [ 3].	"p53	90	93	Gene_or_geneproduct"	"p107	95	99	Gene_or_geneproduct"	"cyclin D1	101	110	Gene_or_geneproduct"	"p27kip1	116	123	Gene_or_geneproduct"	"[{""token"": ""p53"", ""start_span"": 90, ""end_span"": 93, ""type"": ""Gene_or_geneproduct""}, {""token"": ""p107"", ""start_span"": 95, ""end_span"": 99, ""type"": ""Gene_or_geneproduct""}, {""token"": ""cyclin D1"", ""start_span"": 101, ""end_span"": 110, ""type"": ""Gene_or_geneproduct""}, {""token"": ""p27kip1"", ""start_span"": 116, ""end_span"": 123, ""type"": ""Gene_or_geneproduct""}]"
In contrast, the functions of ADAM8, ADAM9, ADAM12 and ADAM15 are not essential for embryogenesis, suggesting a possible functional redundancy with other protease [ 7 - 10].	"ADAM8	30	35	Gene_or_geneproduct"	"ADAM9	37	42	Gene_or_geneproduct"	"ADAM12	44	50	Gene_or_geneproduct"	"ADAM15	55	61	Gene_or_geneproduct"	"[{""token"": ""ADAM8"", ""start_span"": 30, ""end_span"": 35, ""type"": ""Gene_or_geneproduct""}, {""token"": ""ADAM9"", ""start_span"": 37, ""end_span"": 42, ""type"": ""Gene_or_geneproduct""}, {""token"": ""ADAM12"", ""start_span"": 44, ""end_span"": 50, ""type"": ""Gene_or_geneproduct""}, {""token"": ""ADAM15"", ""start_span"": 55, ""end_span"": 61, ""type"": ""Gene_or_geneproduct""}]"
Since the primary function of Socs2 is to negatively regulate growth hormone ( Gh) [ 23], it is likely these background effects are the result of polymorphism influencing interactions between members of the Gh signaling pathway.	"Socs2	30	35	Gene_or_geneproduct"	"growth hormone	62	76	Gene_or_geneproduct"	"Gh	79	81	Gene_or_geneproduct"	"Gh	207	209	Gene_or_geneproduct"	"[{""token"": ""Socs2"", ""start_span"": 30, ""end_span"": 35, ""type"": ""Gene_or_geneproduct""}, {""token"": ""growth hormone"", ""start_span"": 62, ""end_span"": 76, ""type"": ""Gene_or_geneproduct""}, {""token"": ""Gh"", ""start_span"": 79, ""end_span"": 81, ""type"": ""Gene_or_geneproduct""}, {""token"": ""Gh"", ""start_span"": 207, ""end_span"": 209, ""type"": ""Gene_or_geneproduct""}]"
Four of the nine genes ( Ubr1, Ptpns1, Ubce7ip5 and Mmp9; all of which are on MMU2) are of particular interest.	"Ubr1	25	29	Gene_or_geneproduct"	"Ptpns1	31	37	Gene_or_geneproduct"	"Ubce7ip5	39	47	Gene_or_geneproduct"	"Mmp9	52	56	Gene_or_geneproduct"	"[{""token"": ""Ubr1"", ""start_span"": 25, ""end_span"": 29, ""type"": ""Gene_or_geneproduct""}, {""token"": ""Ptpns1"", ""start_span"": 31, ""end_span"": 37, ""type"": ""Gene_or_geneproduct""}, {""token"": ""Ubce7ip5"", ""start_span"": 39, ""end_span"": 47, ""type"": ""Gene_or_geneproduct""}, {""token"": ""Mmp9"", ""start_span"": 52, ""end_span"": 56, ""type"": ""Gene_or_geneproduct""}]"
c In the linkage analysis performed in [ 24], the peak location for Wg2, Carp1, Cara1 and Feml1 was 59 - 63 cM ( 115 - 120 Mbp) in hg / hg F2 mice and 78 - 83 cM ( 135 - 150 Mbp) in + / + F2 mice.	"Wg2	68	71	Gene_or_geneproduct"	"Carp1	73	78	Gene_or_geneproduct"	"Cara1	80	85	Gene_or_geneproduct"	"Feml1	90	95	Gene_or_geneproduct"	"[{""token"": ""Wg2"", ""start_span"": 68, ""end_span"": 71, ""type"": ""Gene_or_geneproduct""}, {""token"": ""Carp1"", ""start_span"": 73, ""end_span"": 78, ""type"": ""Gene_or_geneproduct""}, {""token"": ""Cara1"", ""start_span"": 80, ""end_span"": 85, ""type"": ""Gene_or_geneproduct""}, {""token"": ""Feml1"", ""start_span"": 90, ""end_span"": 95, ""type"": ""Gene_or_geneproduct""}]"
Surprisingly, loss of Wnt4 in XX gonads is sufficient to up - regulate Fgf9 and Sox9 in the absence of Sry.	"Wnt4	22	26	Gene_or_geneproduct"	"Fgf9	71	75	Gene_or_geneproduct"	"Sox9	80	84	Gene_or_geneproduct"	"Sry	103	106	Gene_or_geneproduct"	"[{""token"": ""Wnt4"", ""start_span"": 22, ""end_span"": 26, ""type"": ""Gene_or_geneproduct""}, {""token"": ""Fgf9"", ""start_span"": 71, ""end_span"": 75, ""type"": ""Gene_or_geneproduct""}, {""token"": ""Sox9"", ""start_span"": 80, ""end_span"": 84, ""type"": ""Gene_or_geneproduct""}, {""token"": ""Sry"", ""start_span"": 103, ""end_span"": 106, ""type"": ""Gene_or_geneproduct""}]"
To integrate these findings, we investigated the genetic relationship of Sry, Sox9, Fgf9, and Wnt4 in the regulatory network that governs the gonadal field.	"Sry	73	76	Gene_or_geneproduct"	"Sox9	78	82	Gene_or_geneproduct"	"Fgf9	84	88	Gene_or_geneproduct"	"Wnt4	94	98	Gene_or_geneproduct"	"[{""token"": ""Sry"", ""start_span"": 73, ""end_span"": 76, ""type"": ""Gene_or_geneproduct""}, {""token"": ""Sox9"", ""start_span"": 78, ""end_span"": 82, ""type"": ""Gene_or_geneproduct""}, {""token"": ""Fgf9"", ""start_span"": 84, ""end_span"": 88, ""type"": ""Gene_or_geneproduct""}, {""token"": ""Wnt4"", ""start_span"": 94, ""end_span"": 98, ""type"": ""Gene_or_geneproduct""}]"
The expression of the EGFP reporter was detected in Fgf9 - / - XY gonads comparable to Fgf9 + / - littermate controls ( Figure 2A and 2B), suggesting that transcriptional regulation of Sry is independent of Fgf9.	"Fgf9	52	56	Gene_or_geneproduct"	"Fgf9	87	91	Gene_or_geneproduct"	"Sry	185	188	Gene_or_geneproduct"	"Fgf9	207	211	Gene_or_geneproduct"	"[{""token"": ""Fgf9"", ""start_span"": 52, ""end_span"": 56, ""type"": ""Gene_or_geneproduct""}, {""token"": ""Fgf9"", ""start_span"": 87, ""end_span"": 91, ""type"": ""Gene_or_geneproduct""}, {""token"": ""Sry"", ""start_span"": 185, ""end_span"": 188, ""type"": ""Gene_or_geneproduct""}, {""token"": ""Fgf9"", ""start_span"": 207, ""end_span"": 211, ""type"": ""Gene_or_geneproduct""}]"
As results indicated that Fgf9 functioned downstream of, or in parallel with Sry, we investigated whether Fgf9 was involved in the up - regulation of Sox9 expression.	"Fgf9	26	30	Gene_or_geneproduct"	"Sry	77	80	Gene_or_geneproduct"	"Fgf9	106	110	Gene_or_geneproduct"	"Sox9	150	154	Gene_or_geneproduct"	"[{""token"": ""Fgf9"", ""start_span"": 26, ""end_span"": 30, ""type"": ""Gene_or_geneproduct""}, {""token"": ""Sry"", ""start_span"": 77, ""end_span"": 80, ""type"": ""Gene_or_geneproduct""}, {""token"": ""Fgf9"", ""start_span"": 106, ""end_span"": 110, ""type"": ""Gene_or_geneproduct""}, {""token"": ""Sox9"", ""start_span"": 150, ""end_span"": 154, ""type"": ""Gene_or_geneproduct""}]"
Taken together, these in vitro data demonstrate that ectopic FGF9 signaling can induce SOX9 expression in XX gonadal cells, suggesting a positive interaction between Fgf9 and Sox9.	"FGF9	61	65	Gene_or_geneproduct"	"SOX9	87	91	Gene_or_geneproduct"	"Fgf9	166	170	Gene_or_geneproduct"	"Sox9	175	179	Gene_or_geneproduct"	"[{""token"": ""FGF9"", ""start_span"": 61, ""end_span"": 65, ""type"": ""Gene_or_geneproduct""}, {""token"": ""SOX9"", ""start_span"": 87, ""end_span"": 91, ""type"": ""Gene_or_geneproduct""}, {""token"": ""Fgf9"", ""start_span"": 166, ""end_span"": 170, ""type"": ""Gene_or_geneproduct""}, {""token"": ""Sox9"", ""start_span"": 175, ""end_span"": 179, ""type"": ""Gene_or_geneproduct""}]"
Somatic cells within Fgf9 - / - gonads were positive for SOX9 at 11. 5 dpc, the earliest stages examined, demonstrating that initial expression and up - regulation of SOX9 were not disrupted in Fgf9 - / - mutant XY gonads prior to 12. 0 dpc.	"Fgf9	21	25	Gene_or_geneproduct"	"SOX9	57	61	Gene_or_geneproduct"	"SOX9	167	171	Gene_or_geneproduct"	"Fgf9	194	198	Gene_or_geneproduct"	"[{""token"": ""Fgf9"", ""start_span"": 21, ""end_span"": 25, ""type"": ""Gene_or_geneproduct""}, {""token"": ""SOX9"", ""start_span"": 57, ""end_span"": 61, ""type"": ""Gene_or_geneproduct""}, {""token"": ""SOX9"", ""start_span"": 167, ""end_span"": 171, ""type"": ""Gene_or_geneproduct""}, {""token"": ""Fgf9"", ""start_span"": 194, ""end_span"": 198, ""type"": ""Gene_or_geneproduct""}]"
The expression of Fgf9 was significantly decreased or absent in XY Sox9 Delta / Delta gonads at 11. 5 dpc ( Figure 3J), while Sry expression was similar to wild - type ( Figure 3G and 3H), as previously reported [ 20], suggesting that Fgf9 expression in wild - type XY gonads is dependent on the expression of Sox9.	"Fgf9	18	22	Gene_or_geneproduct"	"Sry	126	129	Gene_or_geneproduct"	"Fgf9	235	239	Gene_or_geneproduct"	"Sox9	310	314	Gene_or_geneproduct"	"[{""token"": ""Fgf9"", ""start_span"": 18, ""end_span"": 22, ""type"": ""Gene_or_geneproduct""}, {""token"": ""Sry"", ""start_span"": 126, ""end_span"": 129, ""type"": ""Gene_or_geneproduct""}, {""token"": ""Fgf9"", ""start_span"": 235, ""end_span"": 239, ""type"": ""Gene_or_geneproduct""}, {""token"": ""Sox9"", ""start_span"": 310, ""end_span"": 314, ""type"": ""Gene_or_geneproduct""}]"
Therefore, we conclude that Sox9 is essential for Fgf9 expression, and Fgf9, in return, maintains Sox9 expression, generating a positive feed - forward loop between these two genes in XY gonads.	"Sox9	28	32	Gene_or_geneproduct"	"Fgf9	50	54	Gene_or_geneproduct"	"Fgf9	71	75	Gene_or_geneproduct"	"Sox9	98	102	Gene_or_geneproduct"	"[{""token"": ""Sox9"", ""start_span"": 28, ""end_span"": 32, ""type"": ""Gene_or_geneproduct""}, {""token"": ""Fgf9"", ""start_span"": 50, ""end_span"": 54, ""type"": ""Gene_or_geneproduct""}, {""token"": ""Fgf9"", ""start_span"": 71, ""end_span"": 75, ""type"": ""Gene_or_geneproduct""}, {""token"": ""Sox9"", ""start_span"": 98, ""end_span"": 102, ""type"": ""Gene_or_geneproduct""}]"
The residual level of Amh suggested that the transient expression of SOX9 in Fgf9 - / - gonads at 11. 5 dpc was sufficient to activate Amh, a direct downstream target.	"Amh	22	25	Gene_or_geneproduct"	"SOX9	69	73	Gene_or_geneproduct"	"Fgf9	77	81	Gene_or_geneproduct"	"Amh	135	138	Gene_or_geneproduct"	"[{""token"": ""Amh"", ""start_span"": 22, ""end_span"": 25, ""type"": ""Gene_or_geneproduct""}, {""token"": ""SOX9"", ""start_span"": 69, ""end_span"": 73, ""type"": ""Gene_or_geneproduct""}, {""token"": ""Fgf9"", ""start_span"": 77, ""end_span"": 81, ""type"": ""Gene_or_geneproduct""}, {""token"": ""Amh"", ""start_span"": 135, ""end_span"": 138, ""type"": ""Gene_or_geneproduct""}]"
The initial specification of Sertoli cell precursors was not affected by the loss of Fgf9, as evidenced by normal Sry and Sox9 expression in Fgf9 - / - gonads at 11. 5 dpc ( Figures 2 and 3D).	"Fgf9	85	89	Gene_or_geneproduct"	"Sry	114	117	Gene_or_geneproduct"	"Sox9	122	126	Gene_or_geneproduct"	"Fgf9	141	145	Gene_or_geneproduct"	"[{""token"": ""Fgf9"", ""start_span"": 85, ""end_span"": 89, ""type"": ""Gene_or_geneproduct""}, {""token"": ""Sry"", ""start_span"": 114, ""end_span"": 117, ""type"": ""Gene_or_geneproduct""}, {""token"": ""Sox9"", ""start_span"": 122, ""end_span"": 126, ""type"": ""Gene_or_geneproduct""}, {""token"": ""Fgf9"", ""start_span"": 141, ""end_span"": 145, ""type"": ""Gene_or_geneproduct""}]"
These data suggested that the loss of SOX9 expression in Fgf9 - / - XY gonads was not caused by cell death but by the disruption of FGF9 / SOX9 feed - forward regulation.	"SOX9	38	42	Gene_or_geneproduct"	"Fgf9	57	61	Gene_or_geneproduct"	"FGF9	132	136	Gene_or_geneproduct"	"SOX9	139	143	Gene_or_geneproduct"	"[{""token"": ""SOX9"", ""start_span"": 38, ""end_span"": 42, ""type"": ""Gene_or_geneproduct""}, {""token"": ""Fgf9"", ""start_span"": 57, ""end_span"": 61, ""type"": ""Gene_or_geneproduct""}, {""token"": ""FGF9"", ""start_span"": 132, ""end_span"": 136, ""type"": ""Gene_or_geneproduct""}, {""token"": ""SOX9"", ""start_span"": 139, ""end_span"": 143, ""type"": ""Gene_or_geneproduct""}]"
To test whether exogenous FGF9 could down - regulate expression of Wnt4, we cultured the XX gonad / mesonephros complex with or without FGF9 protein, and examined Wnt4 expression by whole - mount in situ hybridization.	"FGF9	26	30	Gene_or_geneproduct"	"Wnt4	67	71	Gene_or_geneproduct"	"FGF9	136	140	Gene_or_geneproduct"	"Wnt4	163	167	Gene_or_geneproduct"	"[{""token"": ""FGF9"", ""start_span"": 26, ""end_span"": 30, ""type"": ""Gene_or_geneproduct""}, {""token"": ""Wnt4"", ""start_span"": 67, ""end_span"": 71, ""type"": ""Gene_or_geneproduct""}, {""token"": ""FGF9"", ""start_span"": 136, ""end_span"": 140, ""type"": ""Gene_or_geneproduct""}, {""token"": ""Wnt4"", ""start_span"": 163, ""end_span"": 167, ""type"": ""Gene_or_geneproduct""}]"
We reasoned that if FGF9 and WNT4 do act as opposing signals, then reduction in the dose of Wnt4 might render the XX gonad more susceptible to the male - promoting effects of exogenous FGF9.	"FGF9	20	24	Gene_or_geneproduct"	"WNT4	29	33	Gene_or_geneproduct"	"Wnt4	92	96	Gene_or_geneproduct"	"FGF9	185	189	Gene_or_geneproduct"	"[{""token"": ""FGF9"", ""start_span"": 20, ""end_span"": 24, ""type"": ""Gene_or_geneproduct""}, {""token"": ""WNT4"", ""start_span"": 29, ""end_span"": 33, ""type"": ""Gene_or_geneproduct""}, {""token"": ""Wnt4"", ""start_span"": 92, ""end_span"": 96, ""type"": ""Gene_or_geneproduct""}, {""token"": ""FGF9"", ""start_span"": 185, ""end_span"": 189, ""type"": ""Gene_or_geneproduct""}]"
To test this possibility, XX Wnt4 + / - and Wnt4 + / + gonads were cultured in medium with or without FGF9, and were examined for SOX9 expression ( Figure 5D - 5G).	"Wnt4	29	33	Gene_or_geneproduct"	"Wnt4	44	48	Gene_or_geneproduct"	"FGF9	102	106	Gene_or_geneproduct"	"SOX9	130	134	Gene_or_geneproduct"	"[{""token"": ""Wnt4"", ""start_span"": 29, ""end_span"": 33, ""type"": ""Gene_or_geneproduct""}, {""token"": ""Wnt4"", ""start_span"": 44, ""end_span"": 48, ""type"": ""Gene_or_geneproduct""}, {""token"": ""FGF9"", ""start_span"": 102, ""end_span"": 106, ""type"": ""Gene_or_geneproduct""}, {""token"": ""SOX9"", ""start_span"": 130, ""end_span"": 134, ""type"": ""Gene_or_geneproduct""}]"
We found that FGF9 induced SOX9 up - regulation in XX Wnt4 + / - gonads, but not in Wnt4 + / + XX gonads ( Figure 5F and 5G).	"FGF9	14	18	Gene_or_geneproduct"	"SOX9	27	31	Gene_or_geneproduct"	"Wnt4	54	58	Gene_or_geneproduct"	"Wnt4	84	88	Gene_or_geneproduct"	"[{""token"": ""FGF9"", ""start_span"": 14, ""end_span"": 18, ""type"": ""Gene_or_geneproduct""}, {""token"": ""SOX9"", ""start_span"": 27, ""end_span"": 31, ""type"": ""Gene_or_geneproduct""}, {""token"": ""Wnt4"", ""start_span"": 54, ""end_span"": 58, ""type"": ""Gene_or_geneproduct""}, {""token"": ""Wnt4"", ""start_span"": 84, ""end_span"": 88, ""type"": ""Gene_or_geneproduct""}]"
Using an antibody against FGF9, we found that FGF9 was expressed in Wnt4 - / - XX gonads but not in Wnt4 + / - XX controls ( Figure 6B and 6C).	"FGF9	26	30	Gene_or_geneproduct"	"FGF9	46	50	Gene_or_geneproduct"	"Wnt4	68	72	Gene_or_geneproduct"	"Wnt4	100	104	Gene_or_geneproduct"	"[{""token"": ""FGF9"", ""start_span"": 26, ""end_span"": 30, ""type"": ""Gene_or_geneproduct""}, {""token"": ""FGF9"", ""start_span"": 46, ""end_span"": 50, ""type"": ""Gene_or_geneproduct""}, {""token"": ""Wnt4"", ""start_span"": 68, ""end_span"": 72, ""type"": ""Gene_or_geneproduct""}, {""token"": ""Wnt4"", ""start_span"": 100, ""end_span"": 104, ""type"": ""Gene_or_geneproduct""}]"
Nevertheless, it is noteworthy that up - regulation of SOX9 occurs in this case in the absence of Sry, by eliminating the antagonistic effect of Wnt4 and up - regulating FGF9, supporting our hypothesis that sex determination occurs by tipping the balance between these two opposing signals.	"SOX9	55	59	Gene_or_geneproduct"	"Sry	98	101	Gene_or_geneproduct"	"Wnt4	145	149	Gene_or_geneproduct"	"FGF9	170	174	Gene_or_geneproduct"	"[{""token"": ""SOX9"", ""start_span"": 55, ""end_span"": 59, ""type"": ""Gene_or_geneproduct""}, {""token"": ""Sry"", ""start_span"": 98, ""end_span"": 101, ""type"": ""Gene_or_geneproduct""}, {""token"": ""Wnt4"", ""start_span"": 145, ""end_span"": 149, ""type"": ""Gene_or_geneproduct""}, {""token"": ""FGF9"", ""start_span"": 170, ""end_span"": 174, ""type"": ""Gene_or_geneproduct""}]"
The current study reveals that ectopic FGF9 can induce SOX9 under conditions in which XX cells are dissociated ( Figure 2F), when an FGF9 - coated bead is directly applied to the XX gonad ( Figure 2K), or when the dose of Wnt4 is reduced ( Figure 5G).	"FGF9	39	43	Gene_or_geneproduct"	"SOX9	55	59	Gene_or_geneproduct"	"FGF9	133	137	Gene_or_geneproduct"	"Wnt4	222	226	Gene_or_geneproduct"	"[{""token"": ""FGF9"", ""start_span"": 39, ""end_span"": 43, ""type"": ""Gene_or_geneproduct""}, {""token"": ""SOX9"", ""start_span"": 55, ""end_span"": 59, ""type"": ""Gene_or_geneproduct""}, {""token"": ""FGF9"", ""start_span"": 133, ""end_span"": 137, ""type"": ""Gene_or_geneproduct""}, {""token"": ""Wnt4"", ""start_span"": 222, ""end_span"": 226, ""type"": ""Gene_or_geneproduct""}]"
We show that Sry can initially up - regulate SOX9 in the absence of Fgf9, suggesting that FGF9 is not necessary for this step.	"Sry	13	16	Gene_or_geneproduct"	"SOX9	45	49	Gene_or_geneproduct"	"Fgf9	68	72	Gene_or_geneproduct"	"FGF9	90	94	Gene_or_geneproduct"	"[{""token"": ""Sry"", ""start_span"": 13, ""end_span"": 16, ""type"": ""Gene_or_geneproduct""}, {""token"": ""SOX9"", ""start_span"": 45, ""end_span"": 49, ""type"": ""Gene_or_geneproduct""}, {""token"": ""Fgf9"", ""start_span"": 68, ""end_span"": 72, ""type"": ""Gene_or_geneproduct""}, {""token"": ""FGF9"", ""start_span"": 90, ""end_span"": 94, ""type"": ""Gene_or_geneproduct""}]"
SOX9 up - regulates Fgf9, which initiates a Sox9 / Fgf9 feed - forward loop that accelerates commitment to the male pathway.	"SOX9	0	4	Gene_or_geneproduct"	"Fgf9	20	24	Gene_or_geneproduct"	"Sox9	44	48	Gene_or_geneproduct"	"Fgf9	51	55	Gene_or_geneproduct"	"[{""token"": ""SOX9"", ""start_span"": 0, ""end_span"": 4, ""type"": ""Gene_or_geneproduct""}, {""token"": ""Fgf9"", ""start_span"": 20, ""end_span"": 24, ""type"": ""Gene_or_geneproduct""}, {""token"": ""Sox9"", ""start_span"": 44, ""end_span"": 48, ""type"": ""Gene_or_geneproduct""}, {""token"": ""Fgf9"", ""start_span"": 51, ""end_span"": 55, ""type"": ""Gene_or_geneproduct""}]"
Probes used for in situ hybridization were: Amh [ 58], Dhh [ 20], Wnt4 [ 8], and Fgf9 [ 59].	"Amh	44	47	Gene_or_geneproduct"	"Dhh	55	58	Gene_or_geneproduct"	"Wnt4	66	70	Gene_or_geneproduct"	"Fgf9	81	85	Gene_or_geneproduct"	"[{""token"": ""Amh"", ""start_span"": 44, ""end_span"": 47, ""type"": ""Gene_or_geneproduct""}, {""token"": ""Dhh"", ""start_span"": 55, ""end_span"": 58, ""type"": ""Gene_or_geneproduct""}, {""token"": ""Wnt4"", ""start_span"": 66, ""end_span"": 70, ""type"": ""Gene_or_geneproduct""}, {""token"": ""Fgf9"", ""start_span"": 81, ""end_span"": 85, ""type"": ""Gene_or_geneproduct""}]"
Antibodies used in whole - mount immunocytochemistry were: mouse monoclonal anti - N - MYC ( Cell Signaling Technology, Beverly, Massachusetts, United States; 1: 100), rabbit anti - SOX9 ( gift of F. Poulat; 1: 1, 000), rat anti - PECAM ( Pharmingen, San Diego, California, United States; 1: 500), rabbit anti - caspase - 3 fragment ( BD Bioscience, San Diego, California, United States; 1: 100), and rabbit anti - phosphorylated histone H3 ( Cell Signaling; 1: 250).	"N - MYC	83	90	Gene_or_geneproduct"	"SOX9	182	186	Gene_or_geneproduct"	"PECAM	231	236	Gene_or_geneproduct"	"caspase - 3	312	323	Gene_or_geneproduct"	"[{""token"": ""N - MYC"", ""start_span"": 83, ""end_span"": 90, ""type"": ""Gene_or_geneproduct""}, {""token"": ""SOX9"", ""start_span"": 182, ""end_span"": 186, ""type"": ""Gene_or_geneproduct""}, {""token"": ""PECAM"", ""start_span"": 231, ""end_span"": 236, ""type"": ""Gene_or_geneproduct""}, {""token"": ""caspase - 3"", ""start_span"": 312, ""end_span"": 323, ""type"": ""Gene_or_geneproduct""}]"
Whole - mount in situ hybridization for Sox9 detected Sox9 expression in 11. 5 dpc Wnt4 + / - XY controls and Wnt4 - / - XX gonads.	"Sox9	40	44	Gene_or_geneproduct"	"Sox9	54	58	Gene_or_geneproduct"	"Wnt4	83	87	Gene_or_geneproduct"	"Wnt4	110	114	Gene_or_geneproduct"	"[{""token"": ""Sox9"", ""start_span"": 40, ""end_span"": 44, ""type"": ""Gene_or_geneproduct""}, {""token"": ""Sox9"", ""start_span"": 54, ""end_span"": 58, ""type"": ""Gene_or_geneproduct""}, {""token"": ""Wnt4"", ""start_span"": 83, ""end_span"": 87, ""type"": ""Gene_or_geneproduct""}, {""token"": ""Wnt4"", ""start_span"": 110, ""end_span"": 114, ""type"": ""Gene_or_geneproduct""}]"
( G - J) mRNA whole - mount in situ hybridization for Sry and Fgf9 in Sox9flox / Delta and Sox9 Delta / Delta XY gonads shows that Sox9 is required for Fgf9 expression.	"Sry	54	57	Gene_or_geneproduct"	"Fgf9	62	66	Gene_or_geneproduct"	"Sox9	70	74	Gene_or_geneproduct"	"Fgf9	152	156	Gene_or_geneproduct"	"[{""token"": ""Sry"", ""start_span"": 54, ""end_span"": 57, ""type"": ""Gene_or_geneproduct""}, {""token"": ""Fgf9"", ""start_span"": 62, ""end_span"": 66, ""type"": ""Gene_or_geneproduct""}, {""token"": ""Sox9"", ""start_span"": 70, ""end_span"": 74, ""type"": ""Gene_or_geneproduct""}, {""token"": ""Fgf9"", ""start_span"": 152, ""end_span"": 156, ""type"": ""Gene_or_geneproduct""}]"
Sox9 up - regulates Fgf9, and Fgf9 maintains Sox9, forming a positive feed - forward loop in XY gonads.	"Sox9	0	4	Gene_or_geneproduct"	"Fgf9	20	24	Gene_or_geneproduct"	"Fgf9	30	34	Gene_or_geneproduct"	"Sox9	45	49	Gene_or_geneproduct"	"[{""token"": ""Sox9"", ""start_span"": 0, ""end_span"": 4, ""type"": ""Gene_or_geneproduct""}, {""token"": ""Fgf9"", ""start_span"": 20, ""end_span"": 24, ""type"": ""Gene_or_geneproduct""}, {""token"": ""Fgf9"", ""start_span"": 30, ""end_span"": 34, ""type"": ""Gene_or_geneproduct""}, {""token"": ""Sox9"", ""start_span"": 45, ""end_span"": 49, ""type"": ""Gene_or_geneproduct""}]"
