For example, the cyclophilin - like domain ( CLD), the internal repeat ( W1W2 / IR), and zinc - finger rich ( ZnF) domains of RanBP2 associate specifically with components of the 19S cap of the proteasome [ 14], the E2 SUMO - 1 - conjugating enzyme ( Ubc9) [ 15], and the nuclear export receptor, CRM1 / exportin - 1 [ 16], respectively.	"RanBP2	126	132	Gene_or_geneproduct"	"SUMO - 1	219	227	Gene_or_geneproduct"	"Ubc9	251	255	Gene_or_geneproduct"	"CRM1	297	301	Gene_or_geneproduct"	"exportin - 1	304	316	Gene_or_geneproduct"	"[{""token"": ""RanBP2"", ""start_span"": 126, ""end_span"": 132, ""type"": ""Gene_or_geneproduct""}, {""token"": ""SUMO - 1"", ""start_span"": 219, ""end_span"": 227, ""type"": ""Gene_or_geneproduct""}, {""token"": ""Ubc9"", ""start_span"": 251, ""end_span"": 255, ""type"": ""Gene_or_geneproduct""}, {""token"": ""CRM1"", ""start_span"": 297, ""end_span"": 301, ""type"": ""Gene_or_geneproduct""}, {""token"": ""exportin - 1"", ""start_span"": 304, ""end_span"": 316, ""type"": ""Gene_or_geneproduct""}]"
This association was highly specific toward the HKI isoform, because HKII, HKIII, and glucokinase did not interact with the LD of RanBP2 ( unpublished data).	"HKI	48	51	Gene_or_geneproduct"	"HKII	69	73	Gene_or_geneproduct"	"HKIII	75	80	Gene_or_geneproduct"	"glucokinase	86	97	Gene_or_geneproduct"	"RanBP2	130	136	Gene_or_geneproduct"	"[{""token"": ""HKI"", ""start_span"": 48, ""end_span"": 51, ""type"": ""Gene_or_geneproduct""}, {""token"": ""HKII"", ""start_span"": 69, ""end_span"": 73, ""type"": ""Gene_or_geneproduct""}, {""token"": ""HKIII"", ""start_span"": 75, ""end_span"": 80, ""type"": ""Gene_or_geneproduct""}, {""token"": ""glucokinase"", ""start_span"": 86, ""end_span"": 97, ""type"": ""Gene_or_geneproduct""}, {""token"": ""RanBP2"", ""start_span"": 130, ""end_span"": 136, ""type"": ""Gene_or_geneproduct""}]"
Cox 11 Inhibits HKI Activity and the LD of RanBP2 Reverses the Inhibition of Cox11 over HKI	"Cox 11	0	6	Gene_or_geneproduct"	"HKI	16	19	Gene_or_geneproduct"	"RanBP2	43	49	Gene_or_geneproduct"	"Cox11	77	82	Gene_or_geneproduct"	"HKI	88	91	Gene_or_geneproduct"	"[{""token"": ""Cox 11"", ""start_span"": 0, ""end_span"": 6, ""type"": ""Gene_or_geneproduct""}, {""token"": ""HKI"", ""start_span"": 16, ""end_span"": 19, ""type"": ""Gene_or_geneproduct""}, {""token"": ""RanBP2"", ""start_span"": 43, ""end_span"": 49, ""type"": ""Gene_or_geneproduct""}, {""token"": ""Cox11"", ""start_span"": 77, ""end_span"": 82, ""type"": ""Gene_or_geneproduct""}, {""token"": ""HKI"", ""start_span"": 88, ""end_span"": 91, ""type"": ""Gene_or_geneproduct""}]"
As shown in Figure 2C, the LD domain sharply reversed the inhibitory effect of Cox11 on HKI activity in a concentration - dependent manner, but under saturating ( and stochiometric) amounts of LD, the velocity of the reaction did not reach that observed for HKI activity in the absence of Cox11 ( Figure 2A), suggesting the LD by itself may also have an effect on HKI activity.	"Cox11	79	84	Gene_or_geneproduct"	"HKI	88	91	Gene_or_geneproduct"	"HKI	258	261	Gene_or_geneproduct"	"Cox11	289	294	Gene_or_geneproduct"	"HKI	364	367	Gene_or_geneproduct"	"[{""token"": ""Cox11"", ""start_span"": 79, ""end_span"": 84, ""type"": ""Gene_or_geneproduct""}, {""token"": ""HKI"", ""start_span"": 88, ""end_span"": 91, ""type"": ""Gene_or_geneproduct""}, {""token"": ""HKI"", ""start_span"": 258, ""end_span"": 261, ""type"": ""Gene_or_geneproduct""}, {""token"": ""Cox11"", ""start_span"": 289, ""end_span"": 294, ""type"": ""Gene_or_geneproduct""}, {""token"": ""HKI"", ""start_span"": 364, ""end_span"": 367, ""type"": ""Gene_or_geneproduct""}]"
We extended the subcellular colocalization studies on RanBP2 and its novel partners by immunocytochemistry to determine if RanBP2, Cox11, HKI, and mHsp70 colocalize in hippocampal neurons ( Figure 3A - 3C), cerebral cortex neurons ( Figure 3D - 3F), ellipsoid ( mitochondria - rich) subcellular compartments of photosensory neurons of the retina ( Figure 3G - 3O), and dissociated primary glia and neuron cultures from the brain ( Figure 3P - 3Z).	"RanBP2	54	60	Gene_or_geneproduct"	"RanBP2	123	129	Gene_or_geneproduct"	"Cox11	131	136	Gene_or_geneproduct"	"HKI	138	141	Gene_or_geneproduct"	"mHsp70	147	153	Gene_or_geneproduct"	"[{""token"": ""RanBP2"", ""start_span"": 54, ""end_span"": 60, ""type"": ""Gene_or_geneproduct""}, {""token"": ""RanBP2"", ""start_span"": 123, ""end_span"": 129, ""type"": ""Gene_or_geneproduct""}, {""token"": ""Cox11"", ""start_span"": 131, ""end_span"": 136, ""type"": ""Gene_or_geneproduct""}, {""token"": ""HKI"", ""start_span"": 138, ""end_span"": 141, ""type"": ""Gene_or_geneproduct""}, {""token"": ""mHsp70"", ""start_span"": 147, ""end_span"": 153, ""type"": ""Gene_or_geneproduct""}]"
High - resolution images of dissociated primary cerebral neurons and glial cells confirmed that the colocalization of HKI and Cox11 was highly restricted ( P - R), while RanBP2 extensively colocalized with HKI ( S - U) and mHsp70 ( V - Z).	"HKI	118	121	Gene_or_geneproduct"	"Cox11	126	131	Gene_or_geneproduct"	"RanBP2	170	176	Gene_or_geneproduct"	"HKI	206	209	Gene_or_geneproduct"	"mHsp70	223	229	Gene_or_geneproduct"	"[{""token"": ""HKI"", ""start_span"": 118, ""end_span"": 121, ""type"": ""Gene_or_geneproduct""}, {""token"": ""Cox11"", ""start_span"": 126, ""end_span"": 131, ""type"": ""Gene_or_geneproduct""}, {""token"": ""RanBP2"", ""start_span"": 170, ""end_span"": 176, ""type"": ""Gene_or_geneproduct""}, {""token"": ""HKI"", ""start_span"": 206, ""end_span"": 209, ""type"": ""Gene_or_geneproduct""}, {""token"": ""mHsp70"", ""start_span"": 223, ""end_span"": 229, ""type"": ""Gene_or_geneproduct""}]"
( B) Immunoblots with anti - RanBP2 / Nup153 / Nup62 ( mAb414), - HKI, - mHsp70, and - Cox11 antibodies of retinal ( top panel) and hippocampal homogenates of + / + and + / - mice.	"RanBP2	29	35	Gene_or_geneproduct"	"Nup153	38	44	Gene_or_geneproduct"	"Nup62	47	52	Gene_or_geneproduct"	"HKI	66	69	Gene_or_geneproduct"	"Cox11	87	92	Gene_or_geneproduct"	"[{""token"": ""RanBP2"", ""start_span"": 29, ""end_span"": 35, ""type"": ""Gene_or_geneproduct""}, {""token"": ""Nup153"", ""start_span"": 38, ""end_span"": 44, ""type"": ""Gene_or_geneproduct""}, {""token"": ""Nup62"", ""start_span"": 47, ""end_span"": 52, ""type"": ""Gene_or_geneproduct""}, {""token"": ""HKI"", ""start_span"": 66, ""end_span"": 69, ""type"": ""Gene_or_geneproduct""}, {""token"": ""Cox11"", ""start_span"": 87, ""end_span"": 92, ""type"": ""Gene_or_geneproduct""}]"
Cox11 inhibits noncompetitively the activity of HKI with ~ 2 - 3 molecules of Cox11 ( assuming formation of Cox11 dimer) required to inhibit completely the activity of a molecule of HKI ( Figure 2A and 2B).	"Cox11	0	5	Gene_or_geneproduct"	"HKI	48	51	Gene_or_geneproduct"	"Cox11	78	83	Gene_or_geneproduct"	"Cox11	108	113	Gene_or_geneproduct"	"HKI	182	185	Gene_or_geneproduct"	"[{""token"": ""Cox11"", ""start_span"": 0, ""end_span"": 5, ""type"": ""Gene_or_geneproduct""}, {""token"": ""HKI"", ""start_span"": 48, ""end_span"": 51, ""type"": ""Gene_or_geneproduct""}, {""token"": ""Cox11"", ""start_span"": 78, ""end_span"": 83, ""type"": ""Gene_or_geneproduct""}, {""token"": ""Cox11"", ""start_span"": 108, ""end_span"": 113, ""type"": ""Gene_or_geneproduct""}, {""token"": ""HKI"", ""start_span"": 182, ""end_span"": 185, ""type"": ""Gene_or_geneproduct""}]"
These include the enhancement of the biogenesis of red / green opsin by the combination of the RBD4 - CY domains [ 6, 7] and the stabilization by the Ran - binding domains of RanBP2 of the guanosine triphosphate - bound conformational state of RanGTPase and interaction of Ran with importin - beta [ 11, 40, 41].	"red / green opsin	51	68	Gene_or_geneproduct"	"Ran	150	153	Gene_or_geneproduct"	"RanBP2	175	181	Gene_or_geneproduct"	"RanGTPase	244	253	Gene_or_geneproduct"	"Ran	273	276	Gene_or_geneproduct"	"[{""token"": ""red / green opsin"", ""start_span"": 51, ""end_span"": 68, ""type"": ""Gene_or_geneproduct""}, {""token"": ""Ran"", ""start_span"": 150, ""end_span"": 153, ""type"": ""Gene_or_geneproduct""}, {""token"": ""RanBP2"", ""start_span"": 175, ""end_span"": 181, ""type"": ""Gene_or_geneproduct""}, {""token"": ""RanGTPase"", ""start_span"": 244, ""end_span"": 253, ""type"": ""Gene_or_geneproduct""}, {""token"": ""Ran"", ""start_span"": 273, ""end_span"": 276, ""type"": ""Gene_or_geneproduct""}]"
For example, the combination of the CLD of RanBP2 with several subunits of the 19S cap of the proteasome [ 14], and of its neighboring internal repeat, W1W2 / IR with the E3 - ubiquitin ligase, parkin [ 20], and the E2 SUMO - 1 - conjugating protein, Ubc9 [ 15] may contribute to the down - regulation of HKI by 26S proteasome - mediated proteolysis and modulation of the molecular and subcellular partitioning of these partners.	"RanBP2	43	49	Gene_or_geneproduct"	"parkin	194	200	Gene_or_geneproduct"	"SUMO - 1	219	227	Gene_or_geneproduct"	"Ubc9	251	255	Gene_or_geneproduct"	"HKI	305	308	Gene_or_geneproduct"	"[{""token"": ""RanBP2"", ""start_span"": 43, ""end_span"": 49, ""type"": ""Gene_or_geneproduct""}, {""token"": ""parkin"", ""start_span"": 194, ""end_span"": 200, ""type"": ""Gene_or_geneproduct""}, {""token"": ""SUMO - 1"", ""start_span"": 219, ""end_span"": 227, ""type"": ""Gene_or_geneproduct""}, {""token"": ""Ubc9"", ""start_span"": 251, ""end_span"": 255, ""type"": ""Gene_or_geneproduct""}, {""token"": ""HKI"", ""start_span"": 305, ""end_span"": 308, ""type"": ""Gene_or_geneproduct""}]"
In this regard, it will be interesting to probe whether parkin also causes deficits in HKI in dopaminergic neurons, since parkin was reported to modulate RanBP2 turnover [ 20], and parkin loss - of - function also causes energy and growth deficits [ 26 - 29, 42].	"parkin	56	62	Gene_or_geneproduct"	"HKI	87	90	Gene_or_geneproduct"	"parkin	122	128	Gene_or_geneproduct"	"RanBP2	154	160	Gene_or_geneproduct"	"parkin	181	187	Gene_or_geneproduct"	"[{""token"": ""parkin"", ""start_span"": 56, ""end_span"": 62, ""type"": ""Gene_or_geneproduct""}, {""token"": ""HKI"", ""start_span"": 87, ""end_span"": 90, ""type"": ""Gene_or_geneproduct""}, {""token"": ""parkin"", ""start_span"": 122, ""end_span"": 128, ""type"": ""Gene_or_geneproduct""}, {""token"": ""RanBP2"", ""start_span"": 154, ""end_span"": 160, ""type"": ""Gene_or_geneproduct""}, {""token"": ""parkin"", ""start_span"": 181, ""end_span"": 187, ""type"": ""Gene_or_geneproduct""}]"
For example, the unfolding and chaperone activity of components of the 19S cap of the proteasome may be modulated by the CLD of RanBP2 [ 14] and contribute to the selective HKI ( and other substrates) degradation [ 43], while association of nuclear import receptor, importin - beta with the Ran - binding domains of RanBP2 [ 10, 11], may mediate the nuclear translocation of multifunctional substrates, such as glyceraldehyde - 3 - phosphate dehydrogenase.	"RanBP2	128	134	Gene_or_geneproduct"	"HKI	173	176	Gene_or_geneproduct"	"Ran	291	294	Gene_or_geneproduct"	"RanBP2	316	322	Gene_or_geneproduct"	"glyceraldehyde - 3 - phosphate dehydrogenase	411	455	Gene_or_geneproduct"	"[{""token"": ""RanBP2"", ""start_span"": 128, ""end_span"": 134, ""type"": ""Gene_or_geneproduct""}, {""token"": ""HKI"", ""start_span"": 173, ""end_span"": 176, ""type"": ""Gene_or_geneproduct""}, {""token"": ""Ran"", ""start_span"": 291, ""end_span"": 294, ""type"": ""Gene_or_geneproduct""}, {""token"": ""RanBP2"", ""start_span"": 316, ""end_span"": 322, ""type"": ""Gene_or_geneproduct""}, {""token"": ""glyceraldehyde - 3 - phosphate dehydrogenase"", ""start_span"": 411, ""end_span"": 455, ""type"": ""Gene_or_geneproduct""}]"
The resulting mice heterozygous for the Alk5Flox and Alk5KO alleles, which also carried the Wnt1 - Cre transgene, had the Alk5 gene specifically inactivated in NCCs ( herein termed Alk5 / Wnt1 - Cre), while the littermates with remaining allelic combinations were phenotypically normal and served as controls ( Alk5Flox / +, Alk5KO / +; Wnt1 - Cre).	"Wnt1	92	96	Gene_or_geneproduct"	"Alk5	122	126	Gene_or_geneproduct"	"Alk5	181	185	Gene_or_geneproduct"	"Wnt1	188	192	Gene_or_geneproduct"	"Wnt1	337	341	Gene_or_geneproduct"	"[{""token"": ""Wnt1"", ""start_span"": 92, ""end_span"": 96, ""type"": ""Gene_or_geneproduct""}, {""token"": ""Alk5"", ""start_span"": 122, ""end_span"": 126, ""type"": ""Gene_or_geneproduct""}, {""token"": ""Alk5"", ""start_span"": 181, ""end_span"": 185, ""type"": ""Gene_or_geneproduct""}, {""token"": ""Wnt1"", ""start_span"": 188, ""end_span"": 192, ""type"": ""Gene_or_geneproduct""}, {""token"": ""Wnt1"", ""start_span"": 337, ""end_span"": 341, ""type"": ""Gene_or_geneproduct""}]"
While Tgfbr2 / Wnt1 - Cre mutants as well as mice deficient in Tgf - beta 2 display the PTA type A4 ( truncus arteriosus with interrupted aortic arch [ 30]), Alk5 / Wnt1 - Cre mutants reported here demonstrate earlier patterning defects of the PAAs, which is particularly obvious in the 3rd pair of the PAAs.	"Tgfbr2	6	12	Gene_or_geneproduct"	"Wnt1	15	19	Gene_or_geneproduct"	"Tgf - beta 2	63	75	Gene_or_geneproduct"	"Alk5	158	162	Gene_or_geneproduct"	"Wnt1	165	169	Gene_or_geneproduct"	"[{""token"": ""Tgfbr2"", ""start_span"": 6, ""end_span"": 12, ""type"": ""Gene_or_geneproduct""}, {""token"": ""Wnt1"", ""start_span"": 15, ""end_span"": 19, ""type"": ""Gene_or_geneproduct""}, {""token"": ""Tgf - beta 2"", ""start_span"": 63, ""end_span"": 75, ""type"": ""Gene_or_geneproduct""}, {""token"": ""Alk5"", ""start_span"": 158, ""end_span"": 162, ""type"": ""Gene_or_geneproduct""}, {""token"": ""Wnt1"", ""start_span"": 165, ""end_span"": 169, ""type"": ""Gene_or_geneproduct""}]"
Furthermore, a subset of TGF - beta - related growth and differentiation factors ( GDFs), e. g., GDF8, GDF9, GDF11 and GDF15 could induce these events [ 17, 18, 32, 33].	"TGF - beta	25	35	Gene_or_geneproduct"	"GDF8	97	101	Gene_or_geneproduct"	"GDF9	103	107	Gene_or_geneproduct"	"GDF11	109	114	Gene_or_geneproduct"	"GDF15	119	124	Gene_or_geneproduct"	"[{""token"": ""TGF - beta"", ""start_span"": 25, ""end_span"": 35, ""type"": ""Gene_or_geneproduct""}, {""token"": ""GDF8"", ""start_span"": 97, ""end_span"": 101, ""type"": ""Gene_or_geneproduct""}, {""token"": ""GDF9"", ""start_span"": 103, ""end_span"": 107, ""type"": ""Gene_or_geneproduct""}, {""token"": ""GDF11"", ""start_span"": 109, ""end_span"": 114, ""type"": ""Gene_or_geneproduct""}, {""token"": ""GDF15"", ""start_span"": 119, ""end_span"": 124, ""type"": ""Gene_or_geneproduct""}]"
Bone morphogenetic protein ( BMP) family members, including BMP2, BMP4, and BMP7, are expressed throughout limb development.	"Bone morphogenetic protein	0	26	Gene_or_geneproduct"	"BMP	29	32	Gene_or_geneproduct"	"BMP2	60	64	Gene_or_geneproduct"	"BMP4	66	70	Gene_or_geneproduct"	"BMP7	76	80	Gene_or_geneproduct"	"[{""token"": ""Bone morphogenetic protein"", ""start_span"": 0, ""end_span"": 26, ""type"": ""Gene_or_geneproduct""}, {""token"": ""BMP"", ""start_span"": 29, ""end_span"": 32, ""type"": ""Gene_or_geneproduct""}, {""token"": ""BMP2"", ""start_span"": 60, ""end_span"": 64, ""type"": ""Gene_or_geneproduct""}, {""token"": ""BMP4"", ""start_span"": 66, ""end_span"": 70, ""type"": ""Gene_or_geneproduct""}, {""token"": ""BMP7"", ""start_span"": 76, ""end_span"": 80, ""type"": ""Gene_or_geneproduct""}]"
BMP2, BMP4, and BMP7 are all expressed in the interdigital mesenchyme [ 4, 14], and experiments inhibiting BMP signaling in this tissue suggested that differential levels of BMPs in the interdigital mesenchyme might be the relevant factor directing digit morphology [ 15].	"BMP2	0	4	Gene_or_geneproduct"	"BMP4	6	10	Gene_or_geneproduct"	"BMP7	16	20	Gene_or_geneproduct"	"BMP	107	110	Gene_or_geneproduct"	"BMPs	174	178	Gene_or_geneproduct"	"[{""token"": ""BMP2"", ""start_span"": 0, ""end_span"": 4, ""type"": ""Gene_or_geneproduct""}, {""token"": ""BMP4"", ""start_span"": 6, ""end_span"": 10, ""type"": ""Gene_or_geneproduct""}, {""token"": ""BMP7"", ""start_span"": 16, ""end_span"": 20, ""type"": ""Gene_or_geneproduct""}, {""token"": ""BMP"", ""start_span"": 107, ""end_span"": 110, ""type"": ""Gene_or_geneproduct""}, {""token"": ""BMPs"", ""start_span"": 174, ""end_span"": 178, ""type"": ""Gene_or_geneproduct""}]"
To gain further insights into the potential roles of BMP signaling in vertebrate limb patterning and skeletogenesis, we have produced mice simultaneously lacking BMP2 and BMP4 activity or BMP2 and BMP7 activity in the limb mesechyme during limb development.	"BMP	53	56	Gene_or_geneproduct"	"BMP2	162	166	Gene_or_geneproduct"	"BMP4	171	175	Gene_or_geneproduct"	"BMP2	188	192	Gene_or_geneproduct"	"BMP7	197	201	Gene_or_geneproduct"	"[{""token"": ""BMP"", ""start_span"": 53, ""end_span"": 56, ""type"": ""Gene_or_geneproduct""}, {""token"": ""BMP2"", ""start_span"": 162, ""end_span"": 166, ""type"": ""Gene_or_geneproduct""}, {""token"": ""BMP4"", ""start_span"": 171, ""end_span"": 175, ""type"": ""Gene_or_geneproduct""}, {""token"": ""BMP2"", ""start_span"": 188, ""end_span"": 192, ""type"": ""Gene_or_geneproduct""}, {""token"": ""BMP7"", ""start_span"": 197, ""end_span"": 201, ""type"": ""Gene_or_geneproduct""}]"
Neither limbs deficient in BMP2 and BMP7 nor those deficient in BMP2 and BMP4 had defects suggestive of loss of anterior - posterior patterning information, arguing against these factors acting as secondary signals downstream of SHH or acting as interdigital determinants of digit identity.	"BMP2	27	31	Gene_or_geneproduct"	"BMP7	36	40	Gene_or_geneproduct"	"BMP2	64	68	Gene_or_geneproduct"	"BMP4	73	77	Gene_or_geneproduct"	"SHH	229	232	Gene_or_geneproduct"	"[{""token"": ""BMP2"", ""start_span"": 27, ""end_span"": 31, ""type"": ""Gene_or_geneproduct""}, {""token"": ""BMP7"", ""start_span"": 36, ""end_span"": 40, ""type"": ""Gene_or_geneproduct""}, {""token"": ""BMP2"", ""start_span"": 64, ""end_span"": 68, ""type"": ""Gene_or_geneproduct""}, {""token"": ""BMP4"", ""start_span"": 73, ""end_span"": 77, ""type"": ""Gene_or_geneproduct""}, {""token"": ""SHH"", ""start_span"": 229, ""end_span"": 232, ""type"": ""Gene_or_geneproduct""}]"
Compound heterozygous mice, with one functional copy each of Bmp2 and Bmp4 in the limb ( Bmp2 + / C; Bmp4 + / C; Prx1:: cre), show no effect on either limb patterning or skeletogenesis ( unpublished data).	"Bmp2	61	65	Gene_or_geneproduct"	"Bmp4	70	74	Gene_or_geneproduct"	"Bmp2	89	93	Gene_or_geneproduct"	"Bmp4	101	105	Gene_or_geneproduct"	"Prx1	113	117	Gene_or_geneproduct"	"[{""token"": ""Bmp2"", ""start_span"": 61, ""end_span"": 65, ""type"": ""Gene_or_geneproduct""}, {""token"": ""Bmp4"", ""start_span"": 70, ""end_span"": 74, ""type"": ""Gene_or_geneproduct""}, {""token"": ""Bmp2"", ""start_span"": 89, ""end_span"": 93, ""type"": ""Gene_or_geneproduct""}, {""token"": ""Bmp4"", ""start_span"": 101, ""end_span"": 105, ""type"": ""Gene_or_geneproduct""}, {""token"": ""Prx1"", ""start_span"": 113, ""end_span"": 117, ""type"": ""Gene_or_geneproduct""}]"
Similarly, limb skeletons of mice in which both copies of the Bmp4 gene and one copy of the Bmp2 gene have been conditionally removed in the limb ( Bmp2 + / C; Bmp4C / C; Prx1:: cre) are phenotypically normal other than exhibiting the variable penetrance preaxial and postaxial polydactyly seen in mice deficient in BMP4 activity alone ( Figure 1J and 1R).	"Bmp4	62	66	Gene_or_geneproduct"	"Bmp2	92	96	Gene_or_geneproduct"	"Bmp2	148	152	Gene_or_geneproduct"	"Prx1	171	175	Gene_or_geneproduct"	"BMP4	316	320	Gene_or_geneproduct"	"[{""token"": ""Bmp4"", ""start_span"": 62, ""end_span"": 66, ""type"": ""Gene_or_geneproduct""}, {""token"": ""Bmp2"", ""start_span"": 92, ""end_span"": 96, ""type"": ""Gene_or_geneproduct""}, {""token"": ""Bmp2"", ""start_span"": 148, ""end_span"": 152, ""type"": ""Gene_or_geneproduct""}, {""token"": ""Prx1"", ""start_span"": 171, ""end_span"": 175, ""type"": ""Gene_or_geneproduct""}, {""token"": ""BMP4"", ""start_span"": 316, ""end_span"": 320, ""type"": ""Gene_or_geneproduct""}]"
Mice homozygous for removal of Bmp2 and heterozygous for Bmp7 ( Bmp2C / C, Bmp7 + / -; Prx1:: cre) displayed the same subtle scapular defect seen in Bmp2C / C; Prx1:: cre mutants alone ( unpublished data).	"Bmp2	31	35	Gene_or_geneproduct"	"Bmp7	57	61	Gene_or_geneproduct"	"Bmp7	75	79	Gene_or_geneproduct"	"Prx1	87	91	Gene_or_geneproduct"	"Prx1	160	164	Gene_or_geneproduct"	"[{""token"": ""Bmp2"", ""start_span"": 31, ""end_span"": 35, ""type"": ""Gene_or_geneproduct""}, {""token"": ""Bmp7"", ""start_span"": 57, ""end_span"": 61, ""type"": ""Gene_or_geneproduct""}, {""token"": ""Bmp7"", ""start_span"": 75, ""end_span"": 79, ""type"": ""Gene_or_geneproduct""}, {""token"": ""Prx1"", ""start_span"": 87, ""end_span"": 91, ""type"": ""Gene_or_geneproduct""}, {""token"": ""Prx1"", ""start_span"": 160, ""end_span"": 164, ""type"": ""Gene_or_geneproduct""}]"
The skeletal elements that formed in the absence of BMP2, BMP4, or BMP7 or BMP2 and BMP7 all underwent normal chondrogenesis and osteogenesis by a series of criteria.	"BMP2	52	56	Gene_or_geneproduct"	"BMP4	58	62	Gene_or_geneproduct"	"BMP7	67	71	Gene_or_geneproduct"	"BMP2	75	79	Gene_or_geneproduct"	"BMP7	84	88	Gene_or_geneproduct"	"[{""token"": ""BMP2"", ""start_span"": 52, ""end_span"": 56, ""type"": ""Gene_or_geneproduct""}, {""token"": ""BMP4"", ""start_span"": 58, ""end_span"": 62, ""type"": ""Gene_or_geneproduct""}, {""token"": ""BMP7"", ""start_span"": 67, ""end_span"": 71, ""type"": ""Gene_or_geneproduct""}, {""token"": ""BMP2"", ""start_span"": 75, ""end_span"": 79, ""type"": ""Gene_or_geneproduct""}, {""token"": ""BMP7"", ""start_span"": 84, ""end_span"": 88, ""type"": ""Gene_or_geneproduct""}]"
To examine whether the successful execution of chondrogenesis in the BMP2, BMP4 - deficient limbs is a result of compensatory upregulation of other ostegenic BMPs, we carried out in situ hybridization for Bmp6 and Bmp7 in these limbs.	"BMP2	69	73	Gene_or_geneproduct"	"BMP4	75	79	Gene_or_geneproduct"	"BMPs	158	162	Gene_or_geneproduct"	"Bmp6	205	209	Gene_or_geneproduct"	"Bmp7	214	218	Gene_or_geneproduct"	"[{""token"": ""BMP2"", ""start_span"": 69, ""end_span"": 73, ""type"": ""Gene_or_geneproduct""}, {""token"": ""BMP4"", ""start_span"": 75, ""end_span"": 79, ""type"": ""Gene_or_geneproduct""}, {""token"": ""BMPs"", ""start_span"": 158, ""end_span"": 162, ""type"": ""Gene_or_geneproduct""}, {""token"": ""Bmp6"", ""start_span"": 205, ""end_span"": 209, ""type"": ""Gene_or_geneproduct""}, {""token"": ""Bmp7"", ""start_span"": 214, ""end_span"": 218, ""type"": ""Gene_or_geneproduct""}]"
To obtain Bmp2C / C, Bmp7 - / -; Prx1:: cre we crossed Bmp2C / C, Bmp7 - / + females with Bmp2C / +, Bmp7 - / +; Prx1:: cre males.	"Bmp7	21	25	Gene_or_geneproduct"	"Prx1	33	37	Gene_or_geneproduct"	"Bmp7	66	70	Gene_or_geneproduct"	"Bmp7	101	105	Gene_or_geneproduct"	"Prx1	113	117	Gene_or_geneproduct"	"[{""token"": ""Bmp7"", ""start_span"": 21, ""end_span"": 25, ""type"": ""Gene_or_geneproduct""}, {""token"": ""Prx1"", ""start_span"": 33, ""end_span"": 37, ""type"": ""Gene_or_geneproduct""}, {""token"": ""Bmp7"", ""start_span"": 66, ""end_span"": 70, ""type"": ""Gene_or_geneproduct""}, {""token"": ""Bmp7"", ""start_span"": 101, ""end_span"": 105, ""type"": ""Gene_or_geneproduct""}, {""token"": ""Prx1"", ""start_span"": 113, ""end_span"": 117, ""type"": ""Gene_or_geneproduct""}]"
We reasoned that since the main candidate gene of Cia2, complement component C5 ( Hc), was proven to be essential for CIA development and because the FVB / N strain is C5 deficient [ 10, 25], some small - effect QTL might be masked by Cia2.	"Cia2	50	54	Gene_or_geneproduct"	"complement component C5	56	79	Gene_or_geneproduct"	"Hc	82	84	Gene_or_geneproduct"	"C5	168	170	Gene_or_geneproduct"	"Cia2	235	239	Gene_or_geneproduct"	"[{""token"": ""Cia2"", ""start_span"": 50, ""end_span"": 54, ""type"": ""Gene_or_geneproduct""}, {""token"": ""complement component C5"", ""start_span"": 56, ""end_span"": 79, ""type"": ""Gene_or_geneproduct""}, {""token"": ""Hc"", ""start_span"": 82, ""end_span"": 84, ""type"": ""Gene_or_geneproduct""}, {""token"": ""C5"", ""start_span"": 168, ""end_span"": 170, ""type"": ""Gene_or_geneproduct""}, {""token"": ""Cia2"", ""start_span"": 235, ""end_span"": 239, ""type"": ""Gene_or_geneproduct""}]"
Five genes were differentially expressed at all phases of CIA, including H2 - Q10, Mapk14, Pscd1, Kpnb1 and Wdr1.	"H2 - Q10	73	81	Gene_or_geneproduct"	"Mapk14	83	89	Gene_or_geneproduct"	"Pscd1	91	96	Gene_or_geneproduct"	"Kpnb1	98	103	Gene_or_geneproduct"	"Wdr1	108	112	Gene_or_geneproduct"	"[{""token"": ""H2 - Q10"", ""start_span"": 73, ""end_span"": 81, ""type"": ""Gene_or_geneproduct""}, {""token"": ""Mapk14"", ""start_span"": 83, ""end_span"": 89, ""type"": ""Gene_or_geneproduct""}, {""token"": ""Pscd1"", ""start_span"": 91, ""end_span"": 96, ""type"": ""Gene_or_geneproduct""}, {""token"": ""Kpnb1"", ""start_span"": 98, ""end_span"": 103, ""type"": ""Gene_or_geneproduct""}, {""token"": ""Wdr1"", ""start_span"": 108, ""end_span"": 112, ""type"": ""Gene_or_geneproduct""}]"
Microarray analysis showed changed expression of several genes, including Cxcl13, Slc5a2, Klk5, Ren2 and Timeless, which represent candidate Wnt targets in kidney development.	"Cxcl13	74	80	Gene_or_geneproduct"	"Slc5a2	82	88	Gene_or_geneproduct"	"Klk5	90	94	Gene_or_geneproduct"	"Ren2	96	100	Gene_or_geneproduct"	"Timeless	105	113	Gene_or_geneproduct"	"[{""token"": ""Cxcl13"", ""start_span"": 74, ""end_span"": 80, ""type"": ""Gene_or_geneproduct""}, {""token"": ""Slc5a2"", ""start_span"": 82, ""end_span"": 88, ""type"": ""Gene_or_geneproduct""}, {""token"": ""Klk5"", ""start_span"": 90, ""end_span"": 94, ""type"": ""Gene_or_geneproduct""}, {""token"": ""Ren2"", ""start_span"": 96, ""end_span"": 100, ""type"": ""Gene_or_geneproduct""}, {""token"": ""Timeless"", ""start_span"": 105, ""end_span"": 113, ""type"": ""Gene_or_geneproduct""}]"
