BRCA2 may thus promote RAD51 assembly into recombinational repair complexes via a negative regulatory mechanism ( i. e. by blocking RAD51 - BRCA2 interaction until damage has occurred and factors required for ' productive ' assembly of RAD51 at damaged sites are in place).	"BRCA2	0	5	Gene_or_geneproduct"	"RAD51	23	28	Gene_or_geneproduct"	"RAD51	132	137	Gene_or_geneproduct"	"BRCA2	140	145	Gene_or_geneproduct"	"RAD51	236	241	Gene_or_geneproduct"	"[{""token"": ""BRCA2"", ""start_span"": 0, ""end_span"": 5, ""type"": ""Gene_or_geneproduct""}, {""token"": ""RAD51"", ""start_span"": 23, ""end_span"": 28, ""type"": ""Gene_or_geneproduct""}, {""token"": ""RAD51"", ""start_span"": 132, ""end_span"": 137, ""type"": ""Gene_or_geneproduct""}, {""token"": ""BRCA2"", ""start_span"": 140, ""end_span"": 145, ""type"": ""Gene_or_geneproduct""}, {""token"": ""RAD51"", ""start_span"": 236, ""end_span"": 241, ""type"": ""Gene_or_geneproduct""}]"
To exclude the possibility of alternative splicing with the production of a non - functional but truncated Abcg8 / sterolin - 2 protein that may serve as a chaperone for Abcg5 / sterolin - 1, RT - PCR was performed on cDNA reverse transcribed from total liver RNA from Abcg8 - deficient mice.	"Abcg8	107	112	Gene_or_geneproduct"	"sterolin - 2	115	127	Gene_or_geneproduct"	"Abcg5	170	175	Gene_or_geneproduct"	"sterolin - 1	178	190	Gene_or_geneproduct"	"Abcg8	269	274	Gene_or_geneproduct"	"[{""token"": ""Abcg8"", ""start_span"": 107, ""end_span"": 112, ""type"": ""Gene_or_geneproduct""}, {""token"": ""sterolin - 2"", ""start_span"": 115, ""end_span"": 127, ""type"": ""Gene_or_geneproduct""}, {""token"": ""Abcg5"", ""start_span"": 170, ""end_span"": 175, ""type"": ""Gene_or_geneproduct""}, {""token"": ""sterolin - 1"", ""start_span"": 178, ""end_span"": 190, ""type"": ""Gene_or_geneproduct""}, {""token"": ""Abcg8"", ""start_span"": 269, ""end_span"": 274, ""type"": ""Gene_or_geneproduct""}]"
In experiments shown here, using three separately developed anti - Abcg5 / sterolin - 1 antibodies, we have obtained inconsistent data regarding the trafficking of Abcg5 / sterolin - 1 in Abcg8 - / - mice.	"Abcg5	67	72	Gene_or_geneproduct"	"sterolin - 1	75	87	Gene_or_geneproduct"	"Abcg5	164	169	Gene_or_geneproduct"	"sterolin - 1	172	184	Gene_or_geneproduct"	"Abcg8	188	193	Gene_or_geneproduct"	"[{""token"": ""Abcg5"", ""start_span"": 67, ""end_span"": 72, ""type"": ""Gene_or_geneproduct""}, {""token"": ""sterolin - 1"", ""start_span"": 75, ""end_span"": 87, ""type"": ""Gene_or_geneproduct""}, {""token"": ""Abcg5"", ""start_span"": 164, ""end_span"": 169, ""type"": ""Gene_or_geneproduct""}, {""token"": ""sterolin - 1"", ""start_span"": 172, ""end_span"": 184, ""type"": ""Gene_or_geneproduct""}, {""token"": ""Abcg8"", ""start_span"": 188, ""end_span"": 193, ""type"": ""Gene_or_geneproduct""}]"
However, by immunohistochemistry it appears that Abcg5 / sterolin - 1 is apically expressed in the Abcg8 - deficient mice regardless of the anti - Abcg5 / sterolin - 1 antibody used.	"Abcg5	49	54	Gene_or_geneproduct"	"sterolin - 1	57	69	Gene_or_geneproduct"	"Abcg8	99	104	Gene_or_geneproduct"	"Abcg5	147	152	Gene_or_geneproduct"	"sterolin - 1	155	167	Gene_or_geneproduct"	"[{""token"": ""Abcg5"", ""start_span"": 49, ""end_span"": 54, ""type"": ""Gene_or_geneproduct""}, {""token"": ""sterolin - 1"", ""start_span"": 57, ""end_span"": 69, ""type"": ""Gene_or_geneproduct""}, {""token"": ""Abcg8"", ""start_span"": 99, ""end_span"": 104, ""type"": ""Gene_or_geneproduct""}, {""token"": ""Abcg5"", ""start_span"": 147, ""end_span"": 152, ""type"": ""Gene_or_geneproduct""}, {""token"": ""sterolin - 1"", ""start_span"": 155, ""end_span"": 167, ""type"": ""Gene_or_geneproduct""}]"
Panel ( b) shows the enzyme activities for HMG - CoA reductase and CYP7a1 in livers from Abcg8 + / +, Abcg8 + / - and Abcg8 - / - mice.	"HMG - CoA reductase	43	62	Gene_or_geneproduct"	"CYP7a1	67	73	Gene_or_geneproduct"	"Abcg8	89	94	Gene_or_geneproduct"	"Abcg8	102	107	Gene_or_geneproduct"	"Abcg8	118	123	Gene_or_geneproduct"	"[{""token"": ""HMG - CoA reductase"", ""start_span"": 43, ""end_span"": 62, ""type"": ""Gene_or_geneproduct""}, {""token"": ""CYP7a1"", ""start_span"": 67, ""end_span"": 73, ""type"": ""Gene_or_geneproduct""}, {""token"": ""Abcg8"", ""start_span"": 89, ""end_span"": 94, ""type"": ""Gene_or_geneproduct""}, {""token"": ""Abcg8"", ""start_span"": 102, ""end_span"": 107, ""type"": ""Gene_or_geneproduct""}, {""token"": ""Abcg8"", ""start_span"": 118, ""end_span"": 123, ""type"": ""Gene_or_geneproduct""}]"
Abcg5 transfected COS - 1 cells incubated with SC anti - Abcg5 / sterolin - 1 antibody showed a membrane distribution ( panel b), where as Abcg8 transfected cells incubated with SC anti - Abcg5 antibody showed no significant fluorescence ( panel c).	"Abcg5	0	5	Gene_or_geneproduct"	"Abcg5	57	62	Gene_or_geneproduct"	"sterolin - 1	65	77	Gene_or_geneproduct"	"Abcg8	139	144	Gene_or_geneproduct"	"Abcg5	188	193	Gene_or_geneproduct"	"[{""token"": ""Abcg5"", ""start_span"": 0, ""end_span"": 5, ""type"": ""Gene_or_geneproduct""}, {""token"": ""Abcg5"", ""start_span"": 57, ""end_span"": 62, ""type"": ""Gene_or_geneproduct""}, {""token"": ""sterolin - 1"", ""start_span"": 65, ""end_span"": 77, ""type"": ""Gene_or_geneproduct""}, {""token"": ""Abcg8"", ""start_span"": 139, ""end_span"": 144, ""type"": ""Gene_or_geneproduct""}, {""token"": ""Abcg5"", ""start_span"": 188, ""end_span"": 193, ""type"": ""Gene_or_geneproduct""}]"
Abcg5 and Abcg8 co - transfected COS - 1 cells incubated with SC anti - Abcg5 / sterolin - 1 antibody resulted in a fluorescence pattern similar to Abcg5 alone ( panel d).	"Abcg5	0	5	Gene_or_geneproduct"	"Abcg8	10	15	Gene_or_geneproduct"	"Abcg5	72	77	Gene_or_geneproduct"	"sterolin - 1	80	92	Gene_or_geneproduct"	"Abcg5	148	153	Gene_or_geneproduct"	"[{""token"": ""Abcg5"", ""start_span"": 0, ""end_span"": 5, ""type"": ""Gene_or_geneproduct""}, {""token"": ""Abcg8"", ""start_span"": 10, ""end_span"": 15, ""type"": ""Gene_or_geneproduct""}, {""token"": ""Abcg5"", ""start_span"": 72, ""end_span"": 77, ""type"": ""Gene_or_geneproduct""}, {""token"": ""sterolin - 1"", ""start_span"": 80, ""end_span"": 92, ""type"": ""Gene_or_geneproduct""}, {""token"": ""Abcg5"", ""start_span"": 148, ""end_span"": 153, ""type"": ""Gene_or_geneproduct""}]"
Using AMC antibody against Abcg5 / sterolin - 1 ( see text), in both wild - type ( panel l) and Abcg8 knockout liver ( panel m), the pattern of expression was also apical and unchanged although the signal is fainter compared to that for Bsep / Abcb11 ( see text for discussion).	"Abcg5	27	32	Gene_or_geneproduct"	"sterolin - 1	35	47	Gene_or_geneproduct"	"Abcg8	96	101	Gene_or_geneproduct"	"Bsep	237	241	Gene_or_geneproduct"	"Abcb11	244	250	Gene_or_geneproduct"	"[{""token"": ""Abcg5"", ""start_span"": 27, ""end_span"": 32, ""type"": ""Gene_or_geneproduct""}, {""token"": ""sterolin - 1"", ""start_span"": 35, ""end_span"": 47, ""type"": ""Gene_or_geneproduct""}, {""token"": ""Abcg8"", ""start_span"": 96, ""end_span"": 101, ""type"": ""Gene_or_geneproduct""}, {""token"": ""Bsep"", ""start_span"": 237, ""end_span"": 241, ""type"": ""Gene_or_geneproduct""}, {""token"": ""Abcb11"", ""start_span"": 244, ""end_span"": 250, ""type"": ""Gene_or_geneproduct""}]"
Protein localization of pendrin, KCNQ1, ZO - 1 and F actin in cochlea and vestibular labyrinth of Slc26a4 + / + and Slc26a4 - / - mice.	"pendrin	24	31	Gene_or_geneproduct"	"KCNQ1	33	38	Gene_or_geneproduct"	"ZO - 1	40	46	Gene_or_geneproduct"	"Slc26a4	98	105	Gene_or_geneproduct"	"Slc26a4	116	123	Gene_or_geneproduct"	"[{""token"": ""pendrin"", ""start_span"": 24, ""end_span"": 31, ""type"": ""Gene_or_geneproduct""}, {""token"": ""KCNQ1"", ""start_span"": 33, ""end_span"": 38, ""type"": ""Gene_or_geneproduct""}, {""token"": ""ZO - 1"", ""start_span"": 40, ""end_span"": 46, ""type"": ""Gene_or_geneproduct""}, {""token"": ""Slc26a4"", ""start_span"": 98, ""end_span"": 105, ""type"": ""Gene_or_geneproduct""}, {""token"": ""Slc26a4"", ""start_span"": 116, ""end_span"": 123, ""type"": ""Gene_or_geneproduct""}]"
To determine in greater detail the cause of the loss of the endocochlear potential in Slc26a4 - / - mice, we isolated total RNA from stria vascularis and spiral ganglia of young ( 1 - 4 month) Slc26a4 + / + and both young and old ( ~ 12 month) Slc26a4 - / - mice, assessed amounts of isolated tissues by quantification of 18S rRNA, and quantified the expression of KCNJ10 mRNA.	"Slc26a4	86	93	Gene_or_geneproduct"	"Slc26a4	193	200	Gene_or_geneproduct"	"Slc26a4	244	251	Gene_or_geneproduct"	"18S rRNA	322	330	Gene_or_geneproduct"	"KCNJ10	365	371	Gene_or_geneproduct"	"[{""token"": ""Slc26a4"", ""start_span"": 86, ""end_span"": 93, ""type"": ""Gene_or_geneproduct""}, {""token"": ""Slc26a4"", ""start_span"": 193, ""end_span"": 200, ""type"": ""Gene_or_geneproduct""}, {""token"": ""Slc26a4"", ""start_span"": 244, ""end_span"": 251, ""type"": ""Gene_or_geneproduct""}, {""token"": ""18S rRNA"", ""start_span"": 322, ""end_span"": 330, ""type"": ""Gene_or_geneproduct""}, {""token"": ""KCNJ10"", ""start_span"": 365, ""end_span"": 371, ""type"": ""Gene_or_geneproduct""}]"
As we probed more deeply into the underlying mechanisms governing E - cadherin promoter activity, we were intrigued by the close proximity of the LEF - 1 / beta - catenin binding site to a site known to bind the Snail / Slug family of zinc finger transcriptional repressor proteins [ 12, 13, 14, 15].	"E - cadherin	66	78	Gene_or_geneproduct"	"LEF - 1	146	153	Gene_or_geneproduct"	"beta - catenin	156	170	Gene_or_geneproduct"	"Snail	212	217	Gene_or_geneproduct"	"Slug	220	224	Gene_or_geneproduct"	"[{""token"": ""E - cadherin"", ""start_span"": 66, ""end_span"": 78, ""type"": ""Gene_or_geneproduct""}, {""token"": ""LEF - 1"", ""start_span"": 146, ""end_span"": 153, ""type"": ""Gene_or_geneproduct""}, {""token"": ""beta - catenin"", ""start_span"": 156, ""end_span"": 170, ""type"": ""Gene_or_geneproduct""}, {""token"": ""Snail"", ""start_span"": 212, ""end_span"": 217, ""type"": ""Gene_or_geneproduct""}, {""token"": ""Slug"", ""start_span"": 220, ""end_span"": 224, ""type"": ""Gene_or_geneproduct""}]"
Supportive of an underlying ability to fine - tune cadherin expression at the transcriptional level, Snail seems to have an additive effect with LEF - 1 / beta - catenin in negatively modulating E - cadherin promoter activity [ 4].	"cadherin	51	59	Gene_or_geneproduct"	"Snail	101	106	Gene_or_geneproduct"	"LEF - 1	145	152	Gene_or_geneproduct"	"beta - catenin	155	169	Gene_or_geneproduct"	"E - cadherin	195	207	Gene_or_geneproduct"	"[{""token"": ""cadherin"", ""start_span"": 51, ""end_span"": 59, ""type"": ""Gene_or_geneproduct""}, {""token"": ""Snail"", ""start_span"": 101, ""end_span"": 106, ""type"": ""Gene_or_geneproduct""}, {""token"": ""LEF - 1"", ""start_span"": 145, ""end_span"": 152, ""type"": ""Gene_or_geneproduct""}, {""token"": ""beta - catenin"", ""start_span"": 155, ""end_span"": 169, ""type"": ""Gene_or_geneproduct""}, {""token"": ""E - cadherin"", ""start_span"": 195, ""end_span"": 207, ""type"": ""Gene_or_geneproduct""}]"
Although the temporal spike of Snail in the hair bud is reflected at the mRNA level and seems to follow Wnt signaling and BMP inhibition, LEF - 1 / beta - catenin activation does not appear to induce Snail gene expression in embryonic skin keratinocytes.	"Snail	31	36	Gene_or_geneproduct"	"BMP	122	125	Gene_or_geneproduct"	"LEF - 1	138	145	Gene_or_geneproduct"	"beta - catenin	148	162	Gene_or_geneproduct"	"Snail	200	205	Gene_or_geneproduct"	"[{""token"": ""Snail"", ""start_span"": 31, ""end_span"": 36, ""type"": ""Gene_or_geneproduct""}, {""token"": ""BMP"", ""start_span"": 122, ""end_span"": 125, ""type"": ""Gene_or_geneproduct""}, {""token"": ""LEF - 1"", ""start_span"": 138, ""end_span"": 145, ""type"": ""Gene_or_geneproduct""}, {""token"": ""beta - catenin"", ""start_span"": 148, ""end_span"": 162, ""type"": ""Gene_or_geneproduct""}, {""token"": ""Snail"", ""start_span"": 200, ""end_span"": 205, ""type"": ""Gene_or_geneproduct""}]"
Although the failure of Snail - null mice to develop past gastrulation [ 21] precluded our ability to study the loss of Snail function in skin development, a good correlation emerged between the expression of Snail protein and the extension of K5, Ki67, and pMAPK suprabasally ( compare data in Figures 2 and 3).	"Snail	24	29	Gene_or_geneproduct"	"Snail	120	125	Gene_or_geneproduct"	"Snail	209	214	Gene_or_geneproduct"	"K5	244	246	Gene_or_geneproduct"	"Ki67	248	252	Gene_or_geneproduct"	"[{""token"": ""Snail"", ""start_span"": 24, ""end_span"": 29, ""type"": ""Gene_or_geneproduct""}, {""token"": ""Snail"", ""start_span"": 120, ""end_span"": 125, ""type"": ""Gene_or_geneproduct""}, {""token"": ""Snail"", ""start_span"": 209, ""end_span"": 214, ""type"": ""Gene_or_geneproduct""}, {""token"": ""K5"", ""start_span"": 244, ""end_span"": 246, ""type"": ""Gene_or_geneproduct""}, {""token"": ""Ki67"", ""start_span"": 248, ""end_span"": 252, ""type"": ""Gene_or_geneproduct""}]"
If the competition between Grb - 2 / Sos and alpha - catenin for Ajuba is functionally relevant to the hyperproliferative state of a keratinocyte, then overexpression of Ajuba would be expected to bypass the competition and promote activation of the Ras - MAPK pathway in WT keratinocytes.	"Grb - 2	27	34	Gene_or_geneproduct"	"Sos	37	40	Gene_or_geneproduct"	"alpha - catenin	45	60	Gene_or_geneproduct"	"Ajuba	65	70	Gene_or_geneproduct"	"Ajuba	170	175	Gene_or_geneproduct"	"[{""token"": ""Grb - 2"", ""start_span"": 27, ""end_span"": 34, ""type"": ""Gene_or_geneproduct""}, {""token"": ""Sos"", ""start_span"": 37, ""end_span"": 40, ""type"": ""Gene_or_geneproduct""}, {""token"": ""alpha - catenin"", ""start_span"": 45, ""end_span"": 60, ""type"": ""Gene_or_geneproduct""}, {""token"": ""Ajuba"", ""start_span"": 65, ""end_span"": 70, ""type"": ""Gene_or_geneproduct""}, {""token"": ""Ajuba"", ""start_span"": 170, ""end_span"": 175, ""type"": ""Gene_or_geneproduct""}]"
Our functional studies demonstrate that without TGF - beta 2, Snail expression is abolished in the mutant hair buds, and conversely, in K14 - Smad2 skin, Snail is ectopically activated.	"TGF - beta 2	48	60	Gene_or_geneproduct"	"Snail	62	67	Gene_or_geneproduct"	"K14	136	139	Gene_or_geneproduct"	"Smad2	142	147	Gene_or_geneproduct"	"Snail	154	159	Gene_or_geneproduct"	"[{""token"": ""TGF - beta 2"", ""start_span"": 48, ""end_span"": 60, ""type"": ""Gene_or_geneproduct""}, {""token"": ""Snail"", ""start_span"": 62, ""end_span"": 67, ""type"": ""Gene_or_geneproduct""}, {""token"": ""K14"", ""start_span"": 136, ""end_span"": 139, ""type"": ""Gene_or_geneproduct""}, {""token"": ""Smad2"", ""start_span"": 142, ""end_span"": 147, ""type"": ""Gene_or_geneproduct""}, {""token"": ""Snail"", ""start_span"": 154, ""end_span"": 159, ""type"": ""Gene_or_geneproduct""}]"
The marked epidermal hyperproliferation seen in the K14 - Snail Tg skin, coupled with the converse suppression of proliferation and Snail in TGF - beta 2 - null hair buds led us to wonder whether the down - regulation of E - cadherin during follicle morphogenesis might have a direct impact on elevating the proliferative state of these cells.	"K14	52	55	Gene_or_geneproduct"	"Snail	58	63	Gene_or_geneproduct"	"Snail	132	137	Gene_or_geneproduct"	"TGF - beta 2	141	153	Gene_or_geneproduct"	"E - cadherin	221	233	Gene_or_geneproduct"	"[{""token"": ""K14"", ""start_span"": 52, ""end_span"": 55, ""type"": ""Gene_or_geneproduct""}, {""token"": ""Snail"", ""start_span"": 58, ""end_span"": 63, ""type"": ""Gene_or_geneproduct""}, {""token"": ""Snail"", ""start_span"": 132, ""end_span"": 137, ""type"": ""Gene_or_geneproduct""}, {""token"": ""TGF - beta 2"", ""start_span"": 141, ""end_span"": 153, ""type"": ""Gene_or_geneproduct""}, {""token"": ""E - cadherin"", ""start_span"": 221, ""end_span"": 233, ""type"": ""Gene_or_geneproduct""}]"
Protein extracts were prepared from keratinocytes transfected with empty expression vector ( K14), containing the K14 promoter or with the vector driving HA - tagged Snail ( K14 - Snail); or from whole skin from E13. 5 to P5 animals, including newborn ( nb).	"K14	93	96	Gene_or_geneproduct"	"K14	114	117	Gene_or_geneproduct"	"Snail	166	171	Gene_or_geneproduct"	"K14	174	177	Gene_or_geneproduct"	"Snail	180	185	Gene_or_geneproduct"	"[{""token"": ""K14"", ""start_span"": 93, ""end_span"": 96, ""type"": ""Gene_or_geneproduct""}, {""token"": ""K14"", ""start_span"": 114, ""end_span"": 117, ""type"": ""Gene_or_geneproduct""}, {""token"": ""Snail"", ""start_span"": 166, ""end_span"": 171, ""type"": ""Gene_or_geneproduct""}, {""token"": ""K14"", ""start_span"": 174, ""end_span"": 177, ""type"": ""Gene_or_geneproduct""}, {""token"": ""Snail"", ""start_span"": 180, ""end_span"": 185, ""type"": ""Gene_or_geneproduct""}]"
Moreover, since inhibition of GSK - 3 beta results in Snail upregulation and E - cadherin downregulation, Snail and GSK - 3 beta may function at a crossroads in controlling hair bud development.	"GSK - 3 beta	30	42	Gene_or_geneproduct"	"Snail	54	59	Gene_or_geneproduct"	"E - cadherin	77	89	Gene_or_geneproduct"	"Snail	106	111	Gene_or_geneproduct"	"GSK - 3 beta	116	128	Gene_or_geneproduct"	"[{""token"": ""GSK - 3 beta"", ""start_span"": 30, ""end_span"": 42, ""type"": ""Gene_or_geneproduct""}, {""token"": ""Snail"", ""start_span"": 54, ""end_span"": 59, ""type"": ""Gene_or_geneproduct""}, {""token"": ""E - cadherin"", ""start_span"": 77, ""end_span"": 89, ""type"": ""Gene_or_geneproduct""}, {""token"": ""Snail"", ""start_span"": 106, ""end_span"": 111, ""type"": ""Gene_or_geneproduct""}, {""token"": ""GSK - 3 beta"", ""start_span"": 116, ""end_span"": 128, ""type"": ""Gene_or_geneproduct""}]"
Also, similarly in rhodopsin ( Rho) and cyclic nucleotide - gated channel, alpha - 3 ( CNGA3) double knockout mice ( Rho - / -, CNGA3 - / -), synapses are reported to form normally [ 49].	"rhodopsin	19	28	Gene_or_geneproduct"	"Rho	31	34	Gene_or_geneproduct"	"CNGA3	87	92	Gene_or_geneproduct"	"Rho	117	120	Gene_or_geneproduct"	"CNGA3	128	133	Gene_or_geneproduct"	"[{""token"": ""rhodopsin"", ""start_span"": 19, ""end_span"": 28, ""type"": ""Gene_or_geneproduct""}, {""token"": ""Rho"", ""start_span"": 31, ""end_span"": 34, ""type"": ""Gene_or_geneproduct""}, {""token"": ""CNGA3"", ""start_span"": 87, ""end_span"": 92, ""type"": ""Gene_or_geneproduct""}, {""token"": ""Rho"", ""start_span"": 117, ""end_span"": 120, ""type"": ""Gene_or_geneproduct""}, {""token"": ""CNGA3"", ""start_span"": 128, ""end_span"": 133, ""type"": ""Gene_or_geneproduct""}]"
Second, forced expression studies in adipogenic and myogenic mammalian cell lines demonstrated that PGC - 1 alpha activates mitochondrial biogenesis through a group of transcription factor targets including nuclear respiratory factors 1 and 2 ( NRF - 1 and - 2) and mitochondrial transcription factor A ( Tfam), key transcriptional regulators of mitochondrial DNA transcription and replication [ 8].	"PGC - 1 alpha	100	113	Gene_or_geneproduct"	"nuclear respiratory factors 1	207	236	Gene_or_geneproduct"	"NRF - 1	245	252	Gene_or_geneproduct"	"mitochondrial transcription factor A	266	302	Gene_or_geneproduct"	"Tfam	305	309	Gene_or_geneproduct"	"[{""token"": ""PGC - 1 alpha"", ""start_span"": 100, ""end_span"": 113, ""type"": ""Gene_or_geneproduct""}, {""token"": ""nuclear respiratory factors 1"", ""start_span"": 207, ""end_span"": 236, ""type"": ""Gene_or_geneproduct""}, {""token"": ""NRF - 1"", ""start_span"": 245, ""end_span"": 252, ""type"": ""Gene_or_geneproduct""}, {""token"": ""mitochondrial transcription factor A"", ""start_span"": 266, ""end_span"": 302, ""type"": ""Gene_or_geneproduct""}, {""token"": ""Tfam"", ""start_span"": 305, ""end_span"": 309, ""type"": ""Gene_or_geneproduct""}]"
Consistent with a defect in mitochondrial biogenesis, we found a reduction in the expression of nuclear genes encoding proteins involved in mitochondrial electron transport ( cytochrome c and cytochrome oxidase IV) and oxidative phosphorylation ( beta subunit of ATP synthase) in soleus muscle of PGC - 1 alpha - / - mice compared with PGC - 1 alpha + / + controls.	"cytochrome c	175	187	Gene_or_geneproduct"	"cytochrome oxidase IV	192	213	Gene_or_geneproduct"	"beta subunit of ATP synthase	247	275	Gene_or_geneproduct"	"PGC - 1 alpha	297	310	Gene_or_geneproduct"	"PGC - 1 alpha	336	349	Gene_or_geneproduct"	"[{""token"": ""cytochrome c"", ""start_span"": 175, ""end_span"": 187, ""type"": ""Gene_or_geneproduct""}, {""token"": ""cytochrome oxidase IV"", ""start_span"": 192, ""end_span"": 213, ""type"": ""Gene_or_geneproduct""}, {""token"": ""beta subunit of ATP synthase"", ""start_span"": 247, ""end_span"": 275, ""type"": ""Gene_or_geneproduct""}, {""token"": ""PGC - 1 alpha"", ""start_span"": 297, ""end_span"": 310, ""type"": ""Gene_or_geneproduct""}, {""token"": ""PGC - 1 alpha"", ""start_span"": 336, ""end_span"": 349, ""type"": ""Gene_or_geneproduct""}]"
3H - palmitate oxidation rates determined in hepatocytes isolated from PGC - 1 alpha + / + and PGC - 1 alpha - / - mice under cell culture conditions containing BSA or BSA + 50 mu M oleate ( 2: 1 oleate / BSA ratio).	"PGC - 1 alpha	71	84	Gene_or_geneproduct"	"PGC - 1 alpha	95	108	Gene_or_geneproduct"	"BSA	161	164	Gene_or_geneproduct"	"BSA	168	171	Gene_or_geneproduct"	"BSA	205	208	Gene_or_geneproduct"	"[{""token"": ""PGC - 1 alpha"", ""start_span"": 71, ""end_span"": 84, ""type"": ""Gene_or_geneproduct""}, {""token"": ""PGC - 1 alpha"", ""start_span"": 95, ""end_span"": 108, ""type"": ""Gene_or_geneproduct""}, {""token"": ""BSA"", ""start_span"": 161, ""end_span"": 164, ""type"": ""Gene_or_geneproduct""}, {""token"": ""BSA"", ""start_span"": 168, ""end_span"": 171, ""type"": ""Gene_or_geneproduct""}, {""token"": ""BSA"", ""start_span"": 205, ""end_span"": 208, ""type"": ""Gene_or_geneproduct""}]"
To further define DRG neuron differentiation in the presence of EWS - Pea3 in proprioceptive afferents in vivo, we assessed whether replacement of Er81 by EWS - Pea3 had an influence on neuronal survival or on the expression of proprioceptive - afferent - specific genes.	"EWS	64	67	Gene_or_geneproduct"	"Pea3	70	74	Gene_or_geneproduct"	"Er81	147	151	Gene_or_geneproduct"	"EWS	155	158	Gene_or_geneproduct"	"Pea3	161	165	Gene_or_geneproduct"	"[{""token"": ""EWS"", ""start_span"": 64, ""end_span"": 67, ""type"": ""Gene_or_geneproduct""}, {""token"": ""Pea3"", ""start_span"": 70, ""end_span"": 74, ""type"": ""Gene_or_geneproduct""}, {""token"": ""Er81"", ""start_span"": 147, ""end_span"": 151, ""type"": ""Gene_or_geneproduct""}, {""token"": ""EWS"", ""start_span"": 155, ""end_span"": 158, ""type"": ""Gene_or_geneproduct""}, {""token"": ""Pea3"", ""start_span"": 161, ""end_span"": 165, ""type"": ""Gene_or_geneproduct""}]"
To directly compare neurotrophin dependence of DRG neurons expressing EWS - Pea3 from the Tau locus at a precocious versus isochronic time of onset, we generated a strain of mice in which Cre recombinase is expressed from the PV locus ( Figure S4).	"neurotrophin	20	32	Gene_or_geneproduct"	"EWS	70	73	Gene_or_geneproduct"	"Pea3	76	80	Gene_or_geneproduct"	"Tau	90	93	Gene_or_geneproduct"	"PV	226	228	Gene_or_geneproduct"	"[{""token"": ""neurotrophin"", ""start_span"": 20, ""end_span"": 32, ""type"": ""Gene_or_geneproduct""}, {""token"": ""EWS"", ""start_span"": 70, ""end_span"": 73, ""type"": ""Gene_or_geneproduct""}, {""token"": ""Pea3"", ""start_span"": 76, ""end_span"": 80, ""type"": ""Gene_or_geneproduct""}, {""token"": ""Tau"", ""start_span"": 90, ""end_span"": 93, ""type"": ""Gene_or_geneproduct""}, {""token"": ""PV"", ""start_span"": 226, ""end_span"": 228, ""type"": ""Gene_or_geneproduct""}]"
To begin to assess at which step of the neurotrophin signaling cascade DRG neurons from TauEWS - Pea3 / + Isl1Cre / + embryos become unresponsive to the addition of neurotrophins, we assayed the expression of neurotrophin receptors in TauEWS - Pea3 / + Isl1Cre / + embryos ( Figure 6).	"neurotrophin	40	52	Gene_or_geneproduct"	"Pea3	97	101	Gene_or_geneproduct"	"neurotrophins	165	178	Gene_or_geneproduct"	"neurotrophin	209	221	Gene_or_geneproduct"	"Pea3	244	248	Gene_or_geneproduct"	"[{""token"": ""neurotrophin"", ""start_span"": 40, ""end_span"": 52, ""type"": ""Gene_or_geneproduct""}, {""token"": ""Pea3"", ""start_span"": 97, ""end_span"": 101, ""type"": ""Gene_or_geneproduct""}, {""token"": ""neurotrophins"", ""start_span"": 165, ""end_span"": 178, ""type"": ""Gene_or_geneproduct""}, {""token"": ""neurotrophin"", ""start_span"": 209, ""end_span"": 221, ""type"": ""Gene_or_geneproduct""}, {""token"": ""Pea3"", ""start_span"": 244, ""end_span"": 248, ""type"": ""Gene_or_geneproduct""}]"
Calretinin and Calbindin, two different calcium - binding proteins expressed by subpopulations of DRG neurons in wild - type, Er81EWS - Pea3 / -, and TauEWS - Pea3 / + PVCre / + embryos ( Figure 7E, 7G, and 7H; data not shown) [ 31, 32], were induced in more than 95% of all DRG neurons of TauEWS - Pea3 / + Isl1Cre / + embryos ( Figures 7F and S5).	"Calretinin	0	10	Gene_or_geneproduct"	"Calbindin	15	24	Gene_or_geneproduct"	"Pea3	136	140	Gene_or_geneproduct"	"Pea3	159	163	Gene_or_geneproduct"	"Pea3	299	303	Gene_or_geneproduct"	"[{""token"": ""Calretinin"", ""start_span"": 0, ""end_span"": 10, ""type"": ""Gene_or_geneproduct""}, {""token"": ""Calbindin"", ""start_span"": 15, ""end_span"": 24, ""type"": ""Gene_or_geneproduct""}, {""token"": ""Pea3"", ""start_span"": 136, ""end_span"": 140, ""type"": ""Gene_or_geneproduct""}, {""token"": ""Pea3"", ""start_span"": 159, ""end_span"": 163, ""type"": ""Gene_or_geneproduct""}, {""token"": ""Pea3"", ""start_span"": 299, ""end_span"": 303, ""type"": ""Gene_or_geneproduct""}]"
