( A - H) Analysis of TrkC expression by in situ hybridization ( A - D), or Calretinin ( red) and LacZ ( green) expression by immunohistochemistry ( E - H), on E16. 5 lumbar DRG of wild - type ( A and E), TauEWS - Pea3 / + Isl1Cre / + ( B and F), Er81EWS - Pea3 / - ( C and G), and TauEWS - Pea3 / + PVCre / + ( D and H) embryos.	"TrkC	21	25	Gene_or_geneproduct"	"Calretinin	75	85	Gene_or_geneproduct"	"Pea3	213	217	Gene_or_geneproduct"	"Pea3	256	260	Gene_or_geneproduct"	"Pea3	290	294	Gene_or_geneproduct"	"[{""token"": ""TrkC"", ""start_span"": 21, ""end_span"": 25, ""type"": ""Gene_or_geneproduct""}, {""token"": ""Calretinin"", ""start_span"": 75, ""end_span"": 85, ""type"": ""Gene_or_geneproduct""}, {""token"": ""Pea3"", ""start_span"": 213, ""end_span"": 217, ""type"": ""Gene_or_geneproduct""}, {""token"": ""Pea3"", ""start_span"": 256, ""end_span"": 260, ""type"": ""Gene_or_geneproduct""}, {""token"": ""Pea3"", ""start_span"": 290, ""end_span"": 294, ""type"": ""Gene_or_geneproduct""}]"
For example, ADAM17 ( TACE) has been shown to cleave several substrates, including tumour necrosis factor alpha [ 3, 4], heparin - binding epidermal growth factor - like growth factor [ 6, 7] and transforming growth factor alpha [ 8].	"ADAM17	13	19	Gene_or_geneproduct"	"TACE	22	26	Gene_or_geneproduct"	"tumour necrosis factor alpha	83	111	Gene_or_geneproduct"	"heparin - binding epidermal growth factor - like growth factor	121	183	Gene_or_geneproduct"	"transforming growth factor alpha	196	228	Gene_or_geneproduct"	"[{""token"": ""ADAM17"", ""start_span"": 13, ""end_span"": 19, ""type"": ""Gene_or_geneproduct""}, {""token"": ""TACE"", ""start_span"": 22, ""end_span"": 26, ""type"": ""Gene_or_geneproduct""}, {""token"": ""tumour necrosis factor alpha"", ""start_span"": 83, ""end_span"": 111, ""type"": ""Gene_or_geneproduct""}, {""token"": ""heparin - binding epidermal growth factor - like growth factor"", ""start_span"": 121, ""end_span"": 183, ""type"": ""Gene_or_geneproduct""}, {""token"": ""transforming growth factor alpha"", ""start_span"": 196, ""end_span"": 228, ""type"": ""Gene_or_geneproduct""}]"
These mice were bred to obtain mice wild type for both gastrin alleles and either Cftr homozygous wild type [ Cftr ( + / +)] or Cftr homozygous null [ Cftr ( - / -)].	"gastrin	55	62	Gene_or_geneproduct"	"Cftr	82	86	Gene_or_geneproduct"	"Cftr	110	114	Gene_or_geneproduct"	"Cftr	128	132	Gene_or_geneproduct"	"Cftr	151	155	Gene_or_geneproduct"	"[{""token"": ""gastrin"", ""start_span"": 55, ""end_span"": 62, ""type"": ""Gene_or_geneproduct""}, {""token"": ""Cftr"", ""start_span"": 82, ""end_span"": 86, ""type"": ""Gene_or_geneproduct""}, {""token"": ""Cftr"", ""start_span"": 110, ""end_span"": 114, ""type"": ""Gene_or_geneproduct""}, {""token"": ""Cftr"", ""start_span"": 128, ""end_span"": 132, ""type"": ""Gene_or_geneproduct""}, {""token"": ""Cftr"", ""start_span"": 151, ""end_span"": 155, ""type"": ""Gene_or_geneproduct""}]"
By library screening we identified two proteins ( HOMER3 and DNCL1) that interact with the C - terminal peptide and three proteins ( HOMER3, DNCL1 and TRIM11) that interact with the whole PST domain.	"HOMER3	50	56	Gene_or_geneproduct"	"DNCL1	61	66	Gene_or_geneproduct"	"HOMER3	133	139	Gene_or_geneproduct"	"DNCL1	141	146	Gene_or_geneproduct"	"TRIM11	151	157	Gene_or_geneproduct"	"[{""token"": ""HOMER3"", ""start_span"": 50, ""end_span"": 56, ""type"": ""Gene_or_geneproduct""}, {""token"": ""DNCL1"", ""start_span"": 61, ""end_span"": 66, ""type"": ""Gene_or_geneproduct""}, {""token"": ""HOMER3"", ""start_span"": 133, ""end_span"": 139, ""type"": ""Gene_or_geneproduct""}, {""token"": ""DNCL1"", ""start_span"": 141, ""end_span"": 146, ""type"": ""Gene_or_geneproduct""}, {""token"": ""TRIM11"", ""start_span"": 151, ""end_span"": 157, ""type"": ""Gene_or_geneproduct""}]"
PAX6PST, PAX6 PST domain; PAX6PST / Q422R, PAX6 PST domain with the Q422R mutation; PAX6PST / X423L, PAX6 PST domain with the X423L mutation, PAX6PST / 1615del10, PAX6 PST domain with the 1615 del10 mutation; PAX6PST - CT, PAX6 PST domain minus the C - terminal peptide.	"PAX6	0	4	Gene_or_geneproduct"	"PAX6	9	13	Gene_or_geneproduct"	"PAX6	26	30	Gene_or_geneproduct"	"PAX6	43	47	Gene_or_geneproduct"	"PAX6	84	88	Gene_or_geneproduct"	"[{""token"": ""PAX6"", ""start_span"": 0, ""end_span"": 4, ""type"": ""Gene_or_geneproduct""}, {""token"": ""PAX6"", ""start_span"": 9, ""end_span"": 13, ""type"": ""Gene_or_geneproduct""}, {""token"": ""PAX6"", ""start_span"": 26, ""end_span"": 30, ""type"": ""Gene_or_geneproduct""}, {""token"": ""PAX6"", ""start_span"": 43, ""end_span"": 47, ""type"": ""Gene_or_geneproduct""}, {""token"": ""PAX6"", ""start_span"": 84, ""end_span"": 88, ""type"": ""Gene_or_geneproduct""}]"
Having confirmed that HOMER3, DNCL1 and TRIM11 interact with the PAX6 PST domain, we next investigated how the interactions were affected by three C - terminal PAX6 mutations that have been previously described in patients with ocular anomalies.	"HOMER3	22	28	Gene_or_geneproduct"	"DNCL1	30	35	Gene_or_geneproduct"	"TRIM11	40	46	Gene_or_geneproduct"	"PAX6	65	69	Gene_or_geneproduct"	"PAX6	160	164	Gene_or_geneproduct"	"[{""token"": ""HOMER3"", ""start_span"": 22, ""end_span"": 28, ""type"": ""Gene_or_geneproduct""}, {""token"": ""DNCL1"", ""start_span"": 30, ""end_span"": 35, ""type"": ""Gene_or_geneproduct""}, {""token"": ""TRIM11"", ""start_span"": 40, ""end_span"": 46, ""type"": ""Gene_or_geneproduct""}, {""token"": ""PAX6"", ""start_span"": 65, ""end_span"": 69, ""type"": ""Gene_or_geneproduct""}, {""token"": ""PAX6"", ""start_span"": 160, ""end_span"": 164, ""type"": ""Gene_or_geneproduct""}]"
As a control analysis, anti - short - chain acyl - CoA dehydrogenase ( SCAD) antisera revealed no differences in levels of expression of SCAD protein between MCAD + / + and MCAD - / - mice ( Figure 3).	"short - chain acyl - CoA dehydrogenase	30	68	Gene_or_geneproduct"	"SCAD	71	75	Gene_or_geneproduct"	"SCAD	137	141	Gene_or_geneproduct"	"MCAD	158	162	Gene_or_geneproduct"	"MCAD	173	177	Gene_or_geneproduct"	"[{""token"": ""short - chain acyl - CoA dehydrogenase"", ""start_span"": 30, ""end_span"": 68, ""type"": ""Gene_or_geneproduct""}, {""token"": ""SCAD"", ""start_span"": 71, ""end_span"": 75, ""type"": ""Gene_or_geneproduct""}, {""token"": ""SCAD"", ""start_span"": 137, ""end_span"": 141, ""type"": ""Gene_or_geneproduct""}, {""token"": ""MCAD"", ""start_span"": 158, ""end_span"": 162, ""type"": ""Gene_or_geneproduct""}, {""token"": ""MCAD"", ""start_span"": 173, ""end_span"": 177, ""type"": ""Gene_or_geneproduct""}]"
Comparison of MCAD + / + and MCAD - / - mice revealed no significant differences in total serum carnitine concentrations between MCAD + / + and MCAD - / - mice, but MCAD - / - mice had a 5 - to 6 - fold elevation of serum decenoylcarnitine evident in the acylcarnitine profile ( Figure 4A).	"MCAD	14	18	Gene_or_geneproduct"	"MCAD	29	33	Gene_or_geneproduct"	"MCAD	129	133	Gene_or_geneproduct"	"MCAD	144	148	Gene_or_geneproduct"	"MCAD	165	169	Gene_or_geneproduct"	"[{""token"": ""MCAD"", ""start_span"": 14, ""end_span"": 18, ""type"": ""Gene_or_geneproduct""}, {""token"": ""MCAD"", ""start_span"": 29, ""end_span"": 33, ""type"": ""Gene_or_geneproduct""}, {""token"": ""MCAD"", ""start_span"": 129, ""end_span"": 133, ""type"": ""Gene_or_geneproduct""}, {""token"": ""MCAD"", ""start_span"": 144, ""end_span"": 148, ""type"": ""Gene_or_geneproduct""}, {""token"": ""MCAD"", ""start_span"": 165, ""end_span"": 169, ""type"": ""Gene_or_geneproduct""}]"
Sam68 transcripts encoded by exons 1 to 5 were absent as evidenced by RT - PCR ( Dataset S2), and Sam68 - / - mice were devoid of Sam68 protein, as visualized by immunoblotting with anti - Sam68 AD1 and SC - 333 antibodies or control normal rabbit serum or anti - Sam68 AD1 preabsorbed with peptide ( Figure 2C).	"Sam68	0	5	Gene_or_geneproduct"	"Sam68	98	103	Gene_or_geneproduct"	"Sam68	130	135	Gene_or_geneproduct"	"Sam68	189	194	Gene_or_geneproduct"	"Sam68	264	269	Gene_or_geneproduct"	"[{""token"": ""Sam68"", ""start_span"": 0, ""end_span"": 5, ""type"": ""Gene_or_geneproduct""}, {""token"": ""Sam68"", ""start_span"": 98, ""end_span"": 103, ""type"": ""Gene_or_geneproduct""}, {""token"": ""Sam68"", ""start_span"": 130, ""end_span"": 135, ""type"": ""Gene_or_geneproduct""}, {""token"": ""Sam68"", ""start_span"": 189, ""end_span"": 194, ""type"": ""Gene_or_geneproduct""}, {""token"": ""Sam68"", ""start_span"": 264, ""end_span"": 269, ""type"": ""Gene_or_geneproduct""}]"
The expression of key transcription factors including the PPAR gamma and KLF5 was impaired in Sam68 - / - differentiated MEFs compared with Sam68 + / + MEFs, consistent with impaired adipogenesis in the absence of Sam68 ( Figure 7).	"PPAR gamma	58	68	Gene_or_geneproduct"	"KLF5	73	77	Gene_or_geneproduct"	"Sam68	94	99	Gene_or_geneproduct"	"Sam68	140	145	Gene_or_geneproduct"	"Sam68	214	219	Gene_or_geneproduct"	"[{""token"": ""PPAR gamma"", ""start_span"": 58, ""end_span"": 68, ""type"": ""Gene_or_geneproduct""}, {""token"": ""KLF5"", ""start_span"": 73, ""end_span"": 77, ""type"": ""Gene_or_geneproduct""}, {""token"": ""Sam68"", ""start_span"": 94, ""end_span"": 99, ""type"": ""Gene_or_geneproduct""}, {""token"": ""Sam68"", ""start_span"": 140, ""end_span"": 145, ""type"": ""Gene_or_geneproduct""}, {""token"": ""Sam68"", ""start_span"": 214, ""end_span"": 219, ""type"": ""Gene_or_geneproduct""}]"
Both are heterodimeric enzymes consisting of distinct 80 kDa catalytic subunits, encoded by the Capn1 ( mu - 80 k) and Capn2 ( m - 80 k) genes, respectively, that associate with a common 28 kDa regulatory subunit encoded by the Capn4 gene.	"Capn1	96	101	Gene_or_geneproduct"	"mu - 80 k	104	113	Gene_or_geneproduct"	"Capn2	119	124	Gene_or_geneproduct"	"m - 80 k	127	135	Gene_or_geneproduct"	"Capn4	228	233	Gene_or_geneproduct"	"[{""token"": ""Capn1"", ""start_span"": 96, ""end_span"": 101, ""type"": ""Gene_or_geneproduct""}, {""token"": ""mu - 80 k"", ""start_span"": 104, ""end_span"": 113, ""type"": ""Gene_or_geneproduct""}, {""token"": ""Capn2"", ""start_span"": 119, ""end_span"": 124, ""type"": ""Gene_or_geneproduct""}, {""token"": ""m - 80 k"", ""start_span"": 127, ""end_span"": 135, ""type"": ""Gene_or_geneproduct""}, {""token"": ""Capn4"", ""start_span"": 228, ""end_span"": 233, ""type"": ""Gene_or_geneproduct""}]"
Secondly, Carp2 was found to interact with hg and MMU11 is saturated with genes involved in the central Gh intracellular signaling pathway, such as Gh, Stat5b and Stat5a.	"Carp2	10	15	Gene_or_geneproduct"	"Gh	104	106	Gene_or_geneproduct"	"Gh	148	150	Gene_or_geneproduct"	"Stat5b	152	158	Gene_or_geneproduct"	"Stat5a	163	169	Gene_or_geneproduct"	"[{""token"": ""Carp2"", ""start_span"": 10, ""end_span"": 15, ""type"": ""Gene_or_geneproduct""}, {""token"": ""Gh"", ""start_span"": 104, ""end_span"": 106, ""type"": ""Gene_or_geneproduct""}, {""token"": ""Gh"", ""start_span"": 148, ""end_span"": 150, ""type"": ""Gene_or_geneproduct""}, {""token"": ""Stat5b"", ""start_span"": 152, ""end_span"": 158, ""type"": ""Gene_or_geneproduct""}, {""token"": ""Stat5a"", ""start_span"": 163, ""end_span"": 169, ""type"": ""Gene_or_geneproduct""}]"
In the mouse XY gonad, Sry normally initiates a feed - forward loop between Sox9 and Fgf9, which up - regulates Fgf9 and represses Wnt4 to establish the testis pathway.	"Sry	23	26	Gene_or_geneproduct"	"Sox9	76	80	Gene_or_geneproduct"	"Fgf9	85	89	Gene_or_geneproduct"	"Fgf9	112	116	Gene_or_geneproduct"	"Wnt4	131	135	Gene_or_geneproduct"	"[{""token"": ""Sry"", ""start_span"": 23, ""end_span"": 26, ""type"": ""Gene_or_geneproduct""}, {""token"": ""Sox9"", ""start_span"": 76, ""end_span"": 80, ""type"": ""Gene_or_geneproduct""}, {""token"": ""Fgf9"", ""start_span"": 85, ""end_span"": 89, ""type"": ""Gene_or_geneproduct""}, {""token"": ""Fgf9"", ""start_span"": 112, ""end_span"": 116, ""type"": ""Gene_or_geneproduct""}, {""token"": ""Wnt4"", ""start_span"": 131, ""end_span"": 135, ""type"": ""Gene_or_geneproduct""}]"
Experiments tracing Sry - expressing cells using a stable reporter demonstrated that once testis differentiation is established, all Sertoli cells that express Sox9 are descendants of cells that have expressed Sry [ 16], suggesting that activation of Sox9 is a cell - autonomous effect of Sry.	"Sry	20	23	Gene_or_geneproduct"	"Sox9	160	164	Gene_or_geneproduct"	"Sry	210	213	Gene_or_geneproduct"	"Sox9	251	255	Gene_or_geneproduct"	"Sry	289	292	Gene_or_geneproduct"	"[{""token"": ""Sry"", ""start_span"": 20, ""end_span"": 23, ""type"": ""Gene_or_geneproduct""}, {""token"": ""Sox9"", ""start_span"": 160, ""end_span"": 164, ""type"": ""Gene_or_geneproduct""}, {""token"": ""Sry"", ""start_span"": 210, ""end_span"": 213, ""type"": ""Gene_or_geneproduct""}, {""token"": ""Sox9"", ""start_span"": 251, ""end_span"": 255, ""type"": ""Gene_or_geneproduct""}, {""token"": ""Sry"", ""start_span"": 289, ""end_span"": 292, ""type"": ""Gene_or_geneproduct""}]"
We show that the loss of Fgf9 in homozygous mutant XY gonads does not affect the expression of SRY or the initial up - regulation of SOX9; however, SOX9 expression is not maintained in the Fgf9 - / - mutant gonads, and testis differentiation is aborted.	"Fgf9	25	29	Gene_or_geneproduct"	"SRY	95	98	Gene_or_geneproduct"	"SOX9	133	137	Gene_or_geneproduct"	"SOX9	148	152	Gene_or_geneproduct"	"Fgf9	189	193	Gene_or_geneproduct"	"[{""token"": ""Fgf9"", ""start_span"": 25, ""end_span"": 29, ""type"": ""Gene_or_geneproduct""}, {""token"": ""SRY"", ""start_span"": 95, ""end_span"": 98, ""type"": ""Gene_or_geneproduct""}, {""token"": ""SOX9"", ""start_span"": 133, ""end_span"": 137, ""type"": ""Gene_or_geneproduct""}, {""token"": ""SOX9"", ""start_span"": 148, ""end_span"": 152, ""type"": ""Gene_or_geneproduct""}, {""token"": ""Fgf9"", ""start_span"": 189, ""end_span"": 193, ""type"": ""Gene_or_geneproduct""}]"
To investigate whether Fgf9 is essential for the up - regulation of Sox9 in vivo, we assessed SOX9 expression in loss - of - function Fgf9 + / - and Fgf9 - / - XY gonads at 11. 5 - 12. 5 dpc ( Figure 3A - 3F).	"Fgf9	23	27	Gene_or_geneproduct"	"Sox9	68	72	Gene_or_geneproduct"	"SOX9	94	98	Gene_or_geneproduct"	"Fgf9	134	138	Gene_or_geneproduct"	"Fgf9	149	153	Gene_or_geneproduct"	"[{""token"": ""Fgf9"", ""start_span"": 23, ""end_span"": 27, ""type"": ""Gene_or_geneproduct""}, {""token"": ""Sox9"", ""start_span"": 68, ""end_span"": 72, ""type"": ""Gene_or_geneproduct""}, {""token"": ""SOX9"", ""start_span"": 94, ""end_span"": 98, ""type"": ""Gene_or_geneproduct""}, {""token"": ""Fgf9"", ""start_span"": 134, ""end_span"": 138, ""type"": ""Gene_or_geneproduct""}, {""token"": ""Fgf9"", ""start_span"": 149, ""end_span"": 153, ""type"": ""Gene_or_geneproduct""}]"
We hypothesized that if the linear relationship among the three genes were Sry --> Fgf9 --> Sox9, expression of Fgf9 would be normal in XY gonads in the absence of Sox9.	"Sry	75	78	Gene_or_geneproduct"	"Fgf9	83	87	Gene_or_geneproduct"	"Sox9	92	96	Gene_or_geneproduct"	"Fgf9	112	116	Gene_or_geneproduct"	"Sox9	164	168	Gene_or_geneproduct"	"[{""token"": ""Sry"", ""start_span"": 75, ""end_span"": 78, ""type"": ""Gene_or_geneproduct""}, {""token"": ""Fgf9"", ""start_span"": 83, ""end_span"": 87, ""type"": ""Gene_or_geneproduct""}, {""token"": ""Sox9"", ""start_span"": 92, ""end_span"": 96, ""type"": ""Gene_or_geneproduct""}, {""token"": ""Fgf9"", ""start_span"": 112, ""end_span"": 116, ""type"": ""Gene_or_geneproduct""}, {""token"": ""Sox9"", ""start_span"": 164, ""end_span"": 168, ""type"": ""Gene_or_geneproduct""}]"
Alternatively, if the relationship were Sry --> Sox9 --> Fgf9, expression of Fgf9 should be reduced or absent in XY gonads in the absence of Sox9.	"Sry	40	43	Gene_or_geneproduct"	"Sox9	48	52	Gene_or_geneproduct"	"Fgf9	57	61	Gene_or_geneproduct"	"Fgf9	77	81	Gene_or_geneproduct"	"Sox9	141	145	Gene_or_geneproduct"	"[{""token"": ""Sry"", ""start_span"": 40, ""end_span"": 43, ""type"": ""Gene_or_geneproduct""}, {""token"": ""Sox9"", ""start_span"": 48, ""end_span"": 52, ""type"": ""Gene_or_geneproduct""}, {""token"": ""Fgf9"", ""start_span"": 57, ""end_span"": 61, ""type"": ""Gene_or_geneproduct""}, {""token"": ""Fgf9"", ""start_span"": 77, ""end_span"": 81, ""type"": ""Gene_or_geneproduct""}, {""token"": ""Sox9"", ""start_span"": 141, ""end_span"": 145, ""type"": ""Gene_or_geneproduct""}]"
We examined Fgf9 expression in Sox9 homozygous mutant ( Sox9 Delta / Delta) XY gonads generated by crossing mice homozygous for a conditional null ( flox) allele of Sox9 ( Sox9flox / flox) with mice carrying germline - specific Cre transgenes, Prm1 - Cre in male and Zp3 - Cre in female [ 22, 37].	"Fgf9	12	16	Gene_or_geneproduct"	"Sox9	31	35	Gene_or_geneproduct"	"Sox9	56	60	Gene_or_geneproduct"	"Prm1	244	248	Gene_or_geneproduct"	"Zp3	267	270	Gene_or_geneproduct"	"[{""token"": ""Fgf9"", ""start_span"": 12, ""end_span"": 16, ""type"": ""Gene_or_geneproduct""}, {""token"": ""Sox9"", ""start_span"": 31, ""end_span"": 35, ""type"": ""Gene_or_geneproduct""}, {""token"": ""Sox9"", ""start_span"": 56, ""end_span"": 60, ""type"": ""Gene_or_geneproduct""}, {""token"": ""Prm1"", ""start_span"": 244, ""end_span"": 248, ""type"": ""Gene_or_geneproduct""}, {""token"": ""Zp3"", ""start_span"": 267, ""end_span"": 270, ""type"": ""Gene_or_geneproduct""}]"
We examined two markers for Sertoli cell differentiation, anti - Mullerian hormone ( Amh) [ 38] and Desert hedgehog ( Dhh) [ 39] in Fgf9 - / - XY gonads using whole - mount in situ hybridization.	"anti - Mullerian hormone	58	82	Gene_or_geneproduct"	"Amh	85	88	Gene_or_geneproduct"	"Desert hedgehog	100	115	Gene_or_geneproduct"	"Dhh	118	121	Gene_or_geneproduct"	"Fgf9	132	136	Gene_or_geneproduct"	"[{""token"": ""anti - Mullerian hormone"", ""start_span"": 58, ""end_span"": 82, ""type"": ""Gene_or_geneproduct""}, {""token"": ""Amh"", ""start_span"": 85, ""end_span"": 88, ""type"": ""Gene_or_geneproduct""}, {""token"": ""Desert hedgehog"", ""start_span"": 100, ""end_span"": 115, ""type"": ""Gene_or_geneproduct""}, {""token"": ""Dhh"", ""start_span"": 118, ""end_span"": 121, ""type"": ""Gene_or_geneproduct""}, {""token"": ""Fgf9"", ""start_span"": 132, ""end_span"": 136, ""type"": ""Gene_or_geneproduct""}]"
Given our finding that FGF9, a positive regulator of Sox9, is derepressed in XX Wnt4 - / - gonads, we asked whether expression of SOX9 might also occur in XX Wnt4 - / - gonads ( Figure 6D - 6L).	"FGF9	23	27	Gene_or_geneproduct"	"Sox9	53	57	Gene_or_geneproduct"	"Wnt4	80	84	Gene_or_geneproduct"	"SOX9	130	134	Gene_or_geneproduct"	"Wnt4	158	162	Gene_or_geneproduct"	"[{""token"": ""FGF9"", ""start_span"": 23, ""end_span"": 27, ""type"": ""Gene_or_geneproduct""}, {""token"": ""Sox9"", ""start_span"": 53, ""end_span"": 57, ""type"": ""Gene_or_geneproduct""}, {""token"": ""Wnt4"", ""start_span"": 80, ""end_span"": 84, ""type"": ""Gene_or_geneproduct""}, {""token"": ""SOX9"", ""start_span"": 130, ""end_span"": 134, ""type"": ""Gene_or_geneproduct""}, {""token"": ""Wnt4"", ""start_span"": 158, ""end_span"": 162, ""type"": ""Gene_or_geneproduct""}]"
Furthermore, although both SRY and SOX9 are initially expressed in Fgf9 - / - XY gonads, Wnt4 is not down - regulated in the absence of Fgf9 ( Figure 4K).	"SRY	27	30	Gene_or_geneproduct"	"SOX9	35	39	Gene_or_geneproduct"	"Fgf9	67	71	Gene_or_geneproduct"	"Wnt4	89	93	Gene_or_geneproduct"	"Fgf9	136	140	Gene_or_geneproduct"	"[{""token"": ""SRY"", ""start_span"": 27, ""end_span"": 30, ""type"": ""Gene_or_geneproduct""}, {""token"": ""SOX9"", ""start_span"": 35, ""end_span"": 39, ""type"": ""Gene_or_geneproduct""}, {""token"": ""Fgf9"", ""start_span"": 67, ""end_span"": 71, ""type"": ""Gene_or_geneproduct""}, {""token"": ""Wnt4"", ""start_span"": 89, ""end_span"": 93, ""type"": ""Gene_or_geneproduct""}, {""token"": ""Fgf9"", ""start_span"": 136, ""end_span"": 140, ""type"": ""Gene_or_geneproduct""}]"
In support of the idea that Wnt4 antagonizes the male pathway, we found that the loss of Wnt4 caused the up - regulation of both SOX9 and FGF9 in XX gonads where Sry is absent.	"Wnt4	28	32	Gene_or_geneproduct"	"Wnt4	89	93	Gene_or_geneproduct"	"SOX9	129	133	Gene_or_geneproduct"	"FGF9	138	142	Gene_or_geneproduct"	"Sry	162	165	Gene_or_geneproduct"	"[{""token"": ""Wnt4"", ""start_span"": 28, ""end_span"": 32, ""type"": ""Gene_or_geneproduct""}, {""token"": ""Wnt4"", ""start_span"": 89, ""end_span"": 93, ""type"": ""Gene_or_geneproduct""}, {""token"": ""SOX9"", ""start_span"": 129, ""end_span"": 133, ""type"": ""Gene_or_geneproduct""}, {""token"": ""FGF9"", ""start_span"": 138, ""end_span"": 142, ""type"": ""Gene_or_geneproduct""}, {""token"": ""Sry"", ""start_span"": 162, ""end_span"": 165, ""type"": ""Gene_or_geneproduct""}]"
( A - F) Immunostaining of SOX9 ( red) in Fgf9 + / - and Fgf9 - / - XY gonads shows that Fgf9 is required for maintenance of SOX9.	"SOX9	27	31	Gene_or_geneproduct"	"Fgf9	42	46	Gene_or_geneproduct"	"Fgf9	57	61	Gene_or_geneproduct"	"Fgf9	89	93	Gene_or_geneproduct"	"SOX9	125	129	Gene_or_geneproduct"	"[{""token"": ""SOX9"", ""start_span"": 27, ""end_span"": 31, ""type"": ""Gene_or_geneproduct""}, {""token"": ""Fgf9"", ""start_span"": 42, ""end_span"": 46, ""type"": ""Gene_or_geneproduct""}, {""token"": ""Fgf9"", ""start_span"": 57, ""end_span"": 61, ""type"": ""Gene_or_geneproduct""}, {""token"": ""Fgf9"", ""start_span"": 89, ""end_span"": 93, ""type"": ""Gene_or_geneproduct""}, {""token"": ""SOX9"", ""start_span"": 125, ""end_span"": 129, ""type"": ""Gene_or_geneproduct""}]"
Immunostaining of SOX9 ( red) shows that addition of FGF9 up - regulates SOX9 expression in heterozygous Wnt4 + / - XX gonads ( G), but not in Wnt4 + / + XX gonads ( F).	"SOX9	18	22	Gene_or_geneproduct"	"FGF9	53	57	Gene_or_geneproduct"	"SOX9	73	77	Gene_or_geneproduct"	"Wnt4	105	109	Gene_or_geneproduct"	"Wnt4	143	147	Gene_or_geneproduct"	"[{""token"": ""SOX9"", ""start_span"": 18, ""end_span"": 22, ""type"": ""Gene_or_geneproduct""}, {""token"": ""FGF9"", ""start_span"": 53, ""end_span"": 57, ""type"": ""Gene_or_geneproduct""}, {""token"": ""SOX9"", ""start_span"": 73, ""end_span"": 77, ""type"": ""Gene_or_geneproduct""}, {""token"": ""Wnt4"", ""start_span"": 105, ""end_span"": 109, ""type"": ""Gene_or_geneproduct""}, {""token"": ""Wnt4"", ""start_span"": 143, ""end_span"": 147, ""type"": ""Gene_or_geneproduct""}]"
a: 5 ' - CCCCGGCCCTCACCCTCATCTTCG - 3 ', from the Pu Delta TK gene, assays targeting of Flox plasmid; b: 5 ' - AACAAAACAAAACAGCAGCAACAA - 3 ', from sequences downstream of the p53 gene and outside Flox sequences, assays targeting of Flox and RMCE with p53GFP or p53 Delta PGFP plasmids; c: 5 ' - TGAAGAGCAAGGGCGTGGTGAAGGA - 3 ', from GFP sequences, assays RMCE with p53GFP orp53 Delta PGFP plasmids; d: 5 ' - CAAAAAATGGAAGGAAATCAGGAACTAA - 3 ', from p53 intron 3, and e: 5 ' - TCTAGACAGAGAAAAAAGAGGCATT - 3 ', from p53 intron 4, assay RMCE with p53 Delta PGFP plasmid; f: 5 ' - ATGGGAGGCTGCCAGTCCTAACCC and g: 5 ' - GTGTTTCATTAGTTCCCCACCTTGAC - 3 ' amplify the WT p53 allele according to Taconic ' s procedures, h: 5 ' - TTTACGGAGCCCTGGCGCTCGATGT - 3 ' and i: 5 ' - GTGGGAGGGACAAAAGTTCGAGGCC - 3 ' amplify the Neo marker in the p53 KO allele according to Taconic ' s procedures.	"p53	176	179	Gene_or_geneproduct"	"p53	252	255	Gene_or_geneproduct"	"p53	262	265	Gene_or_geneproduct"	"p53	366	369	Gene_or_geneproduct"	"p53	375	378	Gene_or_geneproduct"	"[{""token"": ""p53"", ""start_span"": 176, ""end_span"": 179, ""type"": ""Gene_or_geneproduct""}, {""token"": ""p53"", ""start_span"": 252, ""end_span"": 255, ""type"": ""Gene_or_geneproduct""}, {""token"": ""p53"", ""start_span"": 262, ""end_span"": 265, ""type"": ""Gene_or_geneproduct""}, {""token"": ""p53"", ""start_span"": 366, ""end_span"": 369, ""type"": ""Gene_or_geneproduct""}, {""token"": ""p53"", ""start_span"": 375, ""end_span"": 378, ""type"": ""Gene_or_geneproduct""}]"
Cox11 is a strong inhibitor of HKI, and RanBP2 suppresses the inhibitory activity of Cox11 over HKI.	"Cox11	0	5	Gene_or_geneproduct"	"HKI	31	34	Gene_or_geneproduct"	"RanBP2	40	46	Gene_or_geneproduct"	"Cox11	85	90	Gene_or_geneproduct"	"HKI	96	99	Gene_or_geneproduct"	"[{""token"": ""Cox11"", ""start_span"": 0, ""end_span"": 5, ""type"": ""Gene_or_geneproduct""}, {""token"": ""HKI"", ""start_span"": 31, ""end_span"": 34, ""type"": ""Gene_or_geneproduct""}, {""token"": ""RanBP2"", ""start_span"": 40, ""end_span"": 46, ""type"": ""Gene_or_geneproduct""}, {""token"": ""Cox11"", ""start_span"": 85, ""end_span"": 90, ""type"": ""Gene_or_geneproduct""}, {""token"": ""HKI"", ""start_span"": 96, ""end_span"": 99, ""type"": ""Gene_or_geneproduct""}]"
In addition, the combination of the C - terminal domains, RBD4 and CY ( of RanBP2), associates with a subset of G protein - coupled receptors, the red / green opsin, expressed in photosensory neurons and enhances opsin functional production [ 6, 7], while the interaction of the KBD of RanBP2 with a subset of the conventional microtubule - based motor proteins, the kinesins, KIF5B and KIF5C, occurs selectively in the central nervous system ( CNS) [ 13].	"RanBP2	75	81	Gene_or_geneproduct"	"red / green opsin	147	164	Gene_or_geneproduct"	"RanBP2	286	292	Gene_or_geneproduct"	"KIF5B	377	382	Gene_or_geneproduct"	"KIF5C	387	392	Gene_or_geneproduct"	"[{""token"": ""RanBP2"", ""start_span"": 75, ""end_span"": 81, ""type"": ""Gene_or_geneproduct""}, {""token"": ""red / green opsin"", ""start_span"": 147, ""end_span"": 164, ""type"": ""Gene_or_geneproduct""}, {""token"": ""RanBP2"", ""start_span"": 286, ""end_span"": 292, ""type"": ""Gene_or_geneproduct""}, {""token"": ""KIF5B"", ""start_span"": 377, ""end_span"": 382, ""type"": ""Gene_or_geneproduct""}, {""token"": ""KIF5C"", ""start_span"": 387, ""end_span"": 392, ""type"": ""Gene_or_geneproduct""}]"
