The absence of ADAM22 protein in the Adam22 - / - mice was confirmed by Western blot analysis.	"ADAM22	15	21	Gene_or_geneproduct"	"Adam22	37	43	Gene_or_geneproduct"	"[{""token"": ""ADAM22"", ""start_span"": 15, ""end_span"": 21, ""type"": ""Gene_or_geneproduct""}, {""token"": ""Adam22"", ""start_span"": 37, ""end_span"": 43, ""type"": ""Gene_or_geneproduct""}]"
monoclonal mouse anti - calbindin 28 K ( Sigma, 1: 200); monoclonal mouse anti - MBP ( SMI - 99, Sternberger Monoclonals Inc., 1: 50); monoclonal mouse anti - Neu N ( CHEMICON, 1: 100); rabbit anti - S100 polyclonal ( DAKO, 1: 200).	"calbindin 28 K	24	38	Gene_or_geneproduct"	"MBP	81	84	Gene_or_geneproduct"	"[{""token"": ""calbindin 28 K"", ""start_span"": 24, ""end_span"": 38, ""type"": ""Gene_or_geneproduct""}, {""token"": ""MBP"", ""start_span"": 81, ""end_span"": 84, ""type"": ""Gene_or_geneproduct""}]"
Sagittal sections of the cerebellum from wild - type mice ( A, C, E, G) and homozygous mutants ( B, D, F, H) at postnatal day 13 were stained for calbindin ( C and D; green) or MBP ( G and H; green), and were counterstained with DAPI ( A, B, E, F; blue).	"calbindin	146	155	Gene_or_geneproduct"	"MBP	177	180	Gene_or_geneproduct"	"[{""token"": ""calbindin"", ""start_span"": 146, ""end_span"": 155, ""type"": ""Gene_or_geneproduct""}, {""token"": ""MBP"", ""start_span"": 177, ""end_span"": 180, ""type"": ""Gene_or_geneproduct""}]"
Electron micrographs of the sciatic nerves from Adam22 + / - ( A) and Adam22 - / - ( B) mice at postnatal day 10 are shown.	"Adam22	48	54	Gene_or_geneproduct"	"Adam22	70	76	Gene_or_geneproduct"	"[{""token"": ""Adam22"", ""start_span"": 48, ""end_span"": 54, ""type"": ""Gene_or_geneproduct""}, {""token"": ""Adam22"", ""start_span"": 70, ""end_span"": 76, ""type"": ""Gene_or_geneproduct""}]"
Although cystic fibrosis is caused by mutations in the cystic fibrosis transmembrane conductance regulator ( CFTR) gene, the severity of disease is highly variable indicating the influence of modifier genes.	"cystic fibrosis transmembrane conductance regulator	55	106	Gene_or_geneproduct"	"CFTR	109	113	Gene_or_geneproduct"	"[{""token"": ""cystic fibrosis transmembrane conductance regulator"", ""start_span"": 55, ""end_span"": 106, ""type"": ""Gene_or_geneproduct""}, {""token"": ""CFTR"", ""start_span"": 109, ""end_span"": 113, ""type"": ""Gene_or_geneproduct""}]"
Cystic fibrosis ( CF) is caused by mutations in the cystic fibrosis transmembrane conductance regulator ( CFTR) gene [ 1].	"cystic fibrosis transmembrane conductance regulator	52	103	Gene_or_geneproduct"	"CFTR	106	110	Gene_or_geneproduct"	"[{""token"": ""cystic fibrosis transmembrane conductance regulator"", ""start_span"": 52, ""end_span"": 103, ""type"": ""Gene_or_geneproduct""}, {""token"": ""CFTR"", ""start_span"": 106, ""end_span"": 110, ""type"": ""Gene_or_geneproduct""}]"
On the other hand, the effects of CF on organs including the airways and intestines is less well correlated with specific CFTR mutations and their effects on CFTR protein function [ 4 - 8].	"CFTR	122	126	Gene_or_geneproduct"	"CFTR	158	162	Gene_or_geneproduct"	"[{""token"": ""CFTR"", ""start_span"": 122, ""end_span"": 126, ""type"": ""Gene_or_geneproduct""}, {""token"": ""CFTR"", ""start_span"": 158, ""end_span"": 162, ""type"": ""Gene_or_geneproduct""}]"
Mast cell protease 2 ( Mcpt2) is a marker of differentiated mast cells [ 22] and mast cells are more abundant in the B6 CF mouse intestine.	"Mast cell protease 2	0	20	Gene_or_geneproduct"	"Mcpt2	23	28	Gene_or_geneproduct"	"[{""token"": ""Mast cell protease 2"", ""start_span"": 0, ""end_span"": 20, ""type"": ""Gene_or_geneproduct""}, {""token"": ""Mcpt2"", ""start_span"": 23, ""end_span"": 28, ""type"": ""Gene_or_geneproduct""}]"
Leucine - rich alpha 2 glycoprotein ( Lrg1, [ 23]) is a marker of differentiating neutrophils, which are more numerous in the B6 CF mouse intestine.	"Leucine - rich alpha 2 glycoprotein	0	35	Gene_or_geneproduct"	"Lrg1	38	42	Gene_or_geneproduct"	"[{""token"": ""Leucine - rich alpha 2 glycoprotein"", ""start_span"": 0, ""end_span"": 35, ""type"": ""Gene_or_geneproduct""}, {""token"": ""Lrg1"", ""start_span"": 38, ""end_span"": 42, ""type"": ""Gene_or_geneproduct""}]"
The same gene is also known as leucine - rich high endothelial cell glycoprotein ( Lrhg) and has been shown to be a marker of high endothelial venules ( HEV) [ 24] which increase in tissues during inflammation [ 25, 26].	"leucine - rich high endothelial cell glycoprotein	31	80	Gene_or_geneproduct"	"Lrhg	83	87	Gene_or_geneproduct"	"[{""token"": ""leucine - rich high endothelial cell glycoprotein"", ""start_span"": 31, ""end_span"": 80, ""type"": ""Gene_or_geneproduct""}, {""token"": ""Lrhg"", ""start_span"": 83, ""end_span"": 87, ""type"": ""Gene_or_geneproduct""}]"
Hematopoietic cell transcript 1 ( HemT1, [ 27]) is a marker of blood cell proliferation and its expression is strongly elevated in the B6 CF mouse small intestine.	"Hematopoietic cell transcript 1	0	31	Gene_or_geneproduct"	"HemT1	34	39	Gene_or_geneproduct"	"[{""token"": ""Hematopoietic cell transcript 1"", ""start_span"": 0, ""end_span"": 31, ""type"": ""Gene_or_geneproduct""}, {""token"": ""HemT1"", ""start_span"": 34, ""end_span"": 39, ""type"": ""Gene_or_geneproduct""}]"
Serum amyloid A3 ( SAA3, [ 28]) is an acute phase gene and its expression in villus epithelial cells is increased in the B6 CF intestine.	"Serum amyloid A3	0	16	Gene_or_geneproduct"	"SAA3	19	23	Gene_or_geneproduct"	"[{""token"": ""Serum amyloid A3"", ""start_span"": 0, ""end_span"": 16, ""type"": ""Gene_or_geneproduct""}, {""token"": ""SAA3"", ""start_span"": 19, ""end_span"": 23, ""type"": ""Gene_or_geneproduct""}]"
Muclin ( also known as dmbt1, [ 30]) expression is upregulated in the B6 CF intestine; it is a cell surface glycoprotein postulated to be an epithelial protective molecule [ 21, 31].	"Muclin	0	6	Gene_or_geneproduct"	"dmbt1	23	28	Gene_or_geneproduct"	"[{""token"": ""Muclin"", ""start_span"": 0, ""end_span"": 6, ""type"": ""Gene_or_geneproduct""}, {""token"": ""dmbt1"", ""start_span"": 23, ""end_span"": 28, ""type"": ""Gene_or_geneproduct""}]"
Lrg1 / Lrhg expression was increased more than 20 - fold in CF mice on the B6 background compared to wild type, but there was no significant difference between CF and wild type on the mixed background ( Fig. 2B).	"Lrg1	0	4	Gene_or_geneproduct"	"Lrhg	7	11	Gene_or_geneproduct"	"[{""token"": ""Lrg1"", ""start_span"": 0, ""end_span"": 4, ""type"": ""Gene_or_geneproduct""}, {""token"": ""Lrhg"", ""start_span"": 7, ""end_span"": 11, ""type"": ""Gene_or_geneproduct""}]"
In wild type intestine, B6 mice had 0. 079 + / - 0. 024 copies of Muc2 / GAPDH ( n = 8), and on the mixed background the level was 0. 077 + / - 0. 012 ( n = 11).	"Muc2	66	70	Gene_or_geneproduct"	"GAPDH	73	78	Gene_or_geneproduct"	"[{""token"": ""Muc2"", ""start_span"": 66, ""end_span"": 70, ""type"": ""Gene_or_geneproduct""}, {""token"": ""GAPDH"", ""start_span"": 73, ""end_span"": 78, ""type"": ""Gene_or_geneproduct""}]"
CF mice on the B6 background had 0. 059 + / - 0. 024 copies of Muc2 mRNA per GAPDH ( n = 11), and on the mixed background the level was 0. 056 + / - 0. 010 ( n = 11).	"Muc2	63	67	Gene_or_geneproduct"	"GAPDH	77	82	Gene_or_geneproduct"	"[{""token"": ""Muc2"", ""start_span"": 63, ""end_span"": 67, ""type"": ""Gene_or_geneproduct""}, {""token"": ""GAPDH"", ""start_span"": 77, ""end_span"": 82, ""type"": ""Gene_or_geneproduct""}]"
Distribution of Cftr genotypes in female offspring from breeding Cftr heterozygotes on the B6 and mixed backgrounds.	"Cftr	16	20	Gene_or_geneproduct"	"Cftr	65	69	Gene_or_geneproduct"	"[{""token"": ""Cftr"", ""start_span"": 16, ""end_span"": 20, ""type"": ""Gene_or_geneproduct""}, {""token"": ""Cftr"", ""start_span"": 65, ""end_span"": 69, ""type"": ""Gene_or_geneproduct""}]"
Distribution of Cftr genotypes in male offspring from breeding Cftr heterozygotes on the B6 and mixed backgrounds.	"Cftr	16	20	Gene_or_geneproduct"	"Cftr	63	67	Gene_or_geneproduct"	"[{""token"": ""Cftr"", ""start_span"": 16, ""end_span"": 20, ""type"": ""Gene_or_geneproduct""}, {""token"": ""Cftr"", ""start_span"": 63, ""end_span"": 67, ""type"": ""Gene_or_geneproduct""}]"
The Kitl gene is crucial for differentiation of mast cells, and CF mice on the mixed background have much fewer mature mast cells than on the B6 background as revealed by less expression of Mcpt2.	"Kitl	4	8	Gene_or_geneproduct"	"Mcpt2	190	195	Gene_or_geneproduct"	"[{""token"": ""Kitl"", ""start_span"": 4, ""end_span"": 8, ""type"": ""Gene_or_geneproduct""}, {""token"": ""Mcpt2"", ""start_span"": 190, ""end_span"": 195, ""type"": ""Gene_or_geneproduct""}]"
The gastrin ( + / -) mice were then crossed for six generations with Cftr ( + / -) mice congenic on the B6 background.	"gastrin	4	11	Gene_or_geneproduct"	"Cftr	69	73	Gene_or_geneproduct"	"[{""token"": ""gastrin"", ""start_span"": 4, ""end_span"": 11, ""type"": ""Gene_or_geneproduct""}, {""token"": ""Cftr"", ""start_span"": 69, ""end_span"": 73, ""type"": ""Gene_or_geneproduct""}]"
Therefore, this QTL interval can be conservatively defined as that portion of mouse chromosome 6 that lies between D6Mit254 and D6Mit374, but is most likely restricted to the region between D6Mit61 and D6Mit374.	"D6Mit374	128	136	Gene_or_geneproduct"	"D6Mit374	202	210	Gene_or_geneproduct"	"[{""token"": ""D6Mit374"", ""start_span"": 128, ""end_span"": 136, ""type"": ""Gene_or_geneproduct""}, {""token"": ""D6Mit374"", ""start_span"": 202, ""end_span"": 210, ""type"": ""Gene_or_geneproduct""}]"
The Tas2rs are found in two subclusters on either side of the polymorphic marker D6Mit13 ( red) and two genes encoding proline - rich salivary proteins ( Prp2 and Prh1; red).	"Prp2	154	158	Gene_or_geneproduct"	"Prh1	163	167	Gene_or_geneproduct"	"[{""token"": ""Prp2"", ""start_span"": 154, ""end_span"": 158, ""type"": ""Gene_or_geneproduct""}, {""token"": ""Prh1"", ""start_span"": 163, ""end_span"": 167, ""type"": ""Gene_or_geneproduct""}]"
Comparisons of the sequences of B6 and D2 orthologues revealed that only two of the twenty - four Tas2r alleles examined, Tas2r106 and Tas2r124, were identical across strains at the amino acid level ( data not shown).	"Tas2r106	122	130	Gene_or_geneproduct"	"Tas2r124	135	143	Gene_or_geneproduct"	"[{""token"": ""Tas2r106"", ""start_span"": 122, ""end_span"": 130, ""type"": ""Gene_or_geneproduct""}, {""token"": ""Tas2r124"", ""start_span"": 135, ""end_span"": 143, ""type"": ""Gene_or_geneproduct""}]"
Two D2 alleles, Tas2r103 and Tas2r117, contained numerous missense mutations and small deletions that create frame shifts and premature termination; these two genes may be pseudogenes in this strain.	"Tas2r103	16	24	Gene_or_geneproduct"	"Tas2r117	29	37	Gene_or_geneproduct"	"[{""token"": ""Tas2r103"", ""start_span"": 16, ""end_span"": 24, ""type"": ""Gene_or_geneproduct""}, {""token"": ""Tas2r117"", ""start_span"": 29, ""end_span"": 37, ""type"": ""Gene_or_geneproduct""}]"
At least 60 other genes also lie within this interval, including two genes that encode proline - rich salivary proteins, Prp2 and Prh1; these proteins appear to play no direct role in bitter taste [ 48].	"Prp2	121	125	Gene_or_geneproduct"	"Prh1	130	134	Gene_or_geneproduct"	"[{""token"": ""Prp2"", ""start_span"": 121, ""end_span"": 125, ""type"": ""Gene_or_geneproduct""}, {""token"": ""Prh1"", ""start_span"": 130, ""end_span"": 134, ""type"": ""Gene_or_geneproduct""}]"
Little is known about the interactions of PAX6 with other proteins, so we carried out a systematic screen for proteins that interact with PAX6.	"PAX6	42	46	Gene_or_geneproduct"	"PAX6	138	142	Gene_or_geneproduct"	"[{""token"": ""PAX6"", ""start_span"": 42, ""end_span"": 46, ""type"": ""Gene_or_geneproduct""}, {""token"": ""PAX6"", ""start_span"": 138, ""end_span"": 142, ""type"": ""Gene_or_geneproduct""}]"
Although PAX6 is clearly involved in multiple developmental processes, common themes are now emerging concerning the role of PAX6 in neural tissues.	"PAX6	9	13	Gene_or_geneproduct"	"PAX6	125	129	Gene_or_geneproduct"	"[{""token"": ""PAX6"", ""start_span"": 9, ""end_span"": 13, ""type"": ""Gene_or_geneproduct""}, {""token"": ""PAX6"", ""start_span"": 125, ""end_span"": 129, ""type"": ""Gene_or_geneproduct""}]"
It is also involved in the differentiation of neural cell types from multipotent precursors in the retina [ 16] and the cerebral cortex [ 9] through activation of bHLH genes such as Ngn2 and Mash1.	"Ngn2	182	186	Gene_or_geneproduct"	"Mash1	191	196	Gene_or_geneproduct"	"[{""token"": ""Ngn2"", ""start_span"": 182, ""end_span"": 186, ""type"": ""Gene_or_geneproduct""}, {""token"": ""Mash1"", ""start_span"": 191, ""end_span"": 196, ""type"": ""Gene_or_geneproduct""}]"
These studies provide a clear link between PAX6 function in the retina and the brain, and are of particular relevance to the neurological phenotypes of individuals with PAX6 mutations.	"PAX6	43	47	Gene_or_geneproduct"	"PAX6	169	173	Gene_or_geneproduct"	"[{""token"": ""PAX6"", ""start_span"": 43, ""end_span"": 47, ""type"": ""Gene_or_geneproduct""}, {""token"": ""PAX6"", ""start_span"": 169, ""end_span"": 173, ""type"": ""Gene_or_geneproduct""}]"
The interaction between PAX6 and these proteins was disrupted by naturally occurring C - terminal PAX6 mutations.	"PAX6	24	28	Gene_or_geneproduct"	"PAX6	98	102	Gene_or_geneproduct"	"[{""token"": ""PAX6"", ""start_span"": 24, ""end_span"": 28, ""type"": ""Gene_or_geneproduct""}, {""token"": ""PAX6"", ""start_span"": 98, ""end_span"": 102, ""type"": ""Gene_or_geneproduct""}]"
Homer3 ( 6 clones) and Dncl1 ( 2 clones) were identified in the C - terminal peptide screen.	"Homer3	0	6	Gene_or_geneproduct"	"Dncl1	23	28	Gene_or_geneproduct"	"[{""token"": ""Homer3"", ""start_span"": 0, ""end_span"": 6, ""type"": ""Gene_or_geneproduct""}, {""token"": ""Dncl1"", ""start_span"": 23, ""end_span"": 28, ""type"": ""Gene_or_geneproduct""}]"
DNCL1 is a subunit of two motor protein complexes, dynein and myosin - Va, both of which are involved in intracellular trafficking of proteins and organelles in neurons [ 36, 37].	"DNCL1	0	5	Gene_or_geneproduct"	"myosin - Va	62	73	Gene_or_geneproduct"	"[{""token"": ""DNCL1"", ""start_span"": 0, ""end_span"": 5, ""type"": ""Gene_or_geneproduct""}, {""token"": ""myosin - Va"", ""start_span"": 62, ""end_span"": 73, ""type"": ""Gene_or_geneproduct""}]"
Gapdh and Atp5a1 both show strong constitutive expression in a variety of tissues including the brain [ 29, 30].	"Gapdh	0	5	Gene_or_geneproduct"	"Atp5a1	10	16	Gene_or_geneproduct"	"[{""token"": ""Gapdh"", ""start_span"": 0, ""end_span"": 5, ""type"": ""Gene_or_geneproduct""}, {""token"": ""Atp5a1"", ""start_span"": 10, ""end_span"": 16, ""type"": ""Gene_or_geneproduct""}]"
Atp5a1 ( 415 bp) and Gapdh ( 450 bp), which are highly expressed in the brain, are included for comparison.	"Atp5a1	0	6	Gene_or_geneproduct"	"Gapdh	21	26	Gene_or_geneproduct"	"[{""token"": ""Atp5a1"", ""start_span"": 0, ""end_span"": 6, ""type"": ""Gene_or_geneproduct""}, {""token"": ""Gapdh"", ""start_span"": 21, ""end_span"": 26, ""type"": ""Gene_or_geneproduct""}]"
In contrast the interaction between the C - terminal peptide and HOMER3 or DNCL1 could not be confirmed with pairwise tests ( Table 1).	"HOMER3	65	71	Gene_or_geneproduct"	"DNCL1	75	80	Gene_or_geneproduct"	"[{""token"": ""HOMER3"", ""start_span"": 65, ""end_span"": 71, ""type"": ""Gene_or_geneproduct""}, {""token"": ""DNCL1"", ""start_span"": 75, ""end_span"": 80, ""type"": ""Gene_or_geneproduct""}]"
However we were able to confirm that the C - terminal peptide is important for the interaction with HOMER3 and DNCL1 because interaction with the PAX6PST - CT construct, which lacks the final 32 amino acids, was completely abolished ( Figure 3, Table 1).	"HOMER3	100	106	Gene_or_geneproduct"	"DNCL1	111	116	Gene_or_geneproduct"	"[{""token"": ""HOMER3"", ""start_span"": 100, ""end_span"": 106, ""type"": ""Gene_or_geneproduct""}, {""token"": ""DNCL1"", ""start_span"": 111, ""end_span"": 116, ""type"": ""Gene_or_geneproduct""}]"
' Truncated HOMER3 ' is HOMER3 lacking the N - terminal 70 amino acids.	"HOMER3	12	18	Gene_or_geneproduct"	"HOMER3	24	30	Gene_or_geneproduct"	"[{""token"": ""HOMER3"", ""start_span"": 12, ""end_span"": 18, ""type"": ""Gene_or_geneproduct""}, {""token"": ""HOMER3"", ""start_span"": 24, ""end_span"": 30, ""type"": ""Gene_or_geneproduct""}]"
The most subtle mutation ( Q422R) caused a reduction in the interaction with HOMER3 and DNCL1 ( Figure 3, Table 1).	"HOMER3	77	83	Gene_or_geneproduct"	"DNCL1	88	93	Gene_or_geneproduct"	"[{""token"": ""HOMER3"", ""start_span"": 77, ""end_span"": 83, ""type"": ""Gene_or_geneproduct""}, {""token"": ""DNCL1"", ""start_span"": 88, ""end_span"": 93, ""type"": ""Gene_or_geneproduct""}]"
The C - terminal extension mutations X423L and1615del10 mutations both dramatically reduced or abolished the interaction with HOMER3 and DNCL1 ( Figure 3, Table 1).	"HOMER3	126	132	Gene_or_geneproduct"	"DNCL1	137	142	Gene_or_geneproduct"	"[{""token"": ""HOMER3"", ""start_span"": 126, ""end_span"": 132, ""type"": ""Gene_or_geneproduct""}, {""token"": ""DNCL1"", ""start_span"": 137, ""end_span"": 142, ""type"": ""Gene_or_geneproduct""}]"
None of the three mutations affected the interaction with TRIM11 which again is consistent with the hypothesis that TRIM11 interacts with a more N - terminal part of the PST domain.	"TRIM11	58	64	Gene_or_geneproduct"	"TRIM11	116	122	Gene_or_geneproduct"	"[{""token"": ""TRIM11"", ""start_span"": 58, ""end_span"": 64, ""type"": ""Gene_or_geneproduct""}, {""token"": ""TRIM11"", ""start_span"": 116, ""end_span"": 122, ""type"": ""Gene_or_geneproduct""}]"
DNCL1 is a subunit of two intracellular transport protein complexes, dynein and myosin Va [ 36].	"DNCL1	0	5	Gene_or_geneproduct"	"myosin Va	80	89	Gene_or_geneproduct"	"[{""token"": ""DNCL1"", ""start_span"": 0, ""end_span"": 5, ""type"": ""Gene_or_geneproduct""}, {""token"": ""myosin Va"", ""start_span"": 80, ""end_span"": 89, ""type"": ""Gene_or_geneproduct""}]"
TRIM11 interacts with Humanin, a protein that suppresses the neurotoxicity associated with Alzheimer ' s disease [ 46].	"TRIM11	0	6	Gene_or_geneproduct"	"Humanin	22	29	Gene_or_geneproduct"	"[{""token"": ""TRIM11"", ""start_span"": 0, ""end_span"": 6, ""type"": ""Gene_or_geneproduct""}, {""token"": ""Humanin"", ""start_span"": 22, ""end_span"": 29, ""type"": ""Gene_or_geneproduct""}]"
We propose that PAX6 is sequestered in the PSD by binding to HOMER3.	"PAX6	16	20	Gene_or_geneproduct"	"HOMER3	61	67	Gene_or_geneproduct"	"[{""token"": ""PAX6"", ""start_span"": 16, ""end_span"": 20, ""type"": ""Gene_or_geneproduct""}, {""token"": ""HOMER3"", ""start_span"": 61, ""end_span"": 67, ""type"": ""Gene_or_geneproduct""}]"
Since receptor activation causes dissociation of HOMER proteins [ 35], PAX6 may be released as a result of synaptic activity, allowing it to interact with DNCL1.	"PAX6	71	75	Gene_or_geneproduct"	"DNCL1	155	160	Gene_or_geneproduct"	"[{""token"": ""PAX6"", ""start_span"": 71, ""end_span"": 75, ""type"": ""Gene_or_geneproduct""}, {""token"": ""DNCL1"", ""start_span"": 155, ""end_span"": 160, ""type"": ""Gene_or_geneproduct""}]"
Since TRIM11 is implicated in protein degradation [ 46], it may play a role in PAX6 protein turnover.	"TRIM11	6	12	Gene_or_geneproduct"	"PAX6	79	83	Gene_or_geneproduct"	"[{""token"": ""TRIM11"", ""start_span"": 6, ""end_span"": 12, ""type"": ""Gene_or_geneproduct""}, {""token"": ""PAX6"", ""start_span"": 79, ""end_span"": 83, ""type"": ""Gene_or_geneproduct""}]"
DNCL1 and TRIM11 both have wide expression domains that include the brain [ 44, 38].	"DNCL1	0	5	Gene_or_geneproduct"	"TRIM11	10	16	Gene_or_geneproduct"	"[{""token"": ""DNCL1"", ""start_span"": 0, ""end_span"": 5, ""type"": ""Gene_or_geneproduct""}, {""token"": ""TRIM11"", ""start_span"": 10, ""end_span"": 16, ""type"": ""Gene_or_geneproduct""}]"
The X423L and 1615del10 mutations severely reduced or completely abolished the interaction with HOMER3 and DNCL1.	"HOMER3	96	102	Gene_or_geneproduct"	"DNCL1	107	112	Gene_or_geneproduct"	"[{""token"": ""HOMER3"", ""start_span"": 96, ""end_span"": 102, ""type"": ""Gene_or_geneproduct""}, {""token"": ""DNCL1"", ""start_span"": 107, ""end_span"": 112, ""type"": ""Gene_or_geneproduct""}]"
There is evidence that signalling and transport mechanisms that were initially characterized in the brain may also be conserved in the retina, suggesting that impaired PAX6 protein - protein interactions may also have implications for the retinal defects observed in individuals with PAX6 mutations [ 53, 54].	"PAX6	168	172	Gene_or_geneproduct"	"PAX6	284	288	Gene_or_geneproduct"	"[{""token"": ""PAX6"", ""start_span"": 168, ""end_span"": 172, ""type"": ""Gene_or_geneproduct""}, {""token"": ""PAX6"", ""start_span"": 284, ""end_span"": 288, ""type"": ""Gene_or_geneproduct""}]"
All cDNA and amino acid numbering is based on the human PAX6 cDNA and protein reference sequences available from the Human PAX6 Allelic Variant Database web site [ 27].	"human PAX6	50	60	Gene_or_geneproduct"	"Human PAX6	117	127	Gene_or_geneproduct"	"[{""token"": ""human PAX6"", ""start_span"": 50, ""end_span"": 60, ""type"": ""Gene_or_geneproduct""}, {""token"": ""Human PAX6"", ""start_span"": 117, ""end_span"": 127, ""type"": ""Gene_or_geneproduct""}]"
Standard PCR and subcloning techniques were used to make three PAX6 cDNA constructs in the pDBLeu expression vector ( ProQuest Two - Hybrid System, Invitrogen), which generates a protein fused to the yeast GAL4 DNA binding domain.	"PAX6	63	67	Gene_or_geneproduct"	"yeast GAL4	200	210	Gene_or_geneproduct"	"[{""token"": ""PAX6"", ""start_span"": 63, ""end_span"": 67, ""type"": ""Gene_or_geneproduct""}, {""token"": ""yeast GAL4"", ""start_span"": 200, ""end_span"": 210, ""type"": ""Gene_or_geneproduct""}]"
The system uses three GAL4 - activated reporter genes, HIS3, URA3 and lacZ, to identify positive interactions.	"GAL4	22	26	Gene_or_geneproduct"	"URA3	61	65	Gene_or_geneproduct"	"[{""token"": ""GAL4"", ""start_span"": 22, ""end_span"": 26, ""type"": ""Gene_or_geneproduct""}, {""token"": ""URA3"", ""start_span"": 61, ""end_span"": 65, ""type"": ""Gene_or_geneproduct""}]"
Weak URA3 activation suppresses growth on plates containing 5 - fluro - orotic acid while strong URA3 activation permits growth on plates lacking uracil.	"URA3	5	9	Gene_or_geneproduct"	"URA3	97	101	Gene_or_geneproduct"	"[{""token"": ""URA3"", ""start_span"": 5, ""end_span"": 9, ""type"": ""Gene_or_geneproduct""}, {""token"": ""URA3"", ""start_span"": 97, ""end_span"": 101, ""type"": ""Gene_or_geneproduct""}]"
Medium - chain acyl - CoA dehydrogenase ( MCAD) deficiency is the most common inherited disorder of mitochondrial fatty acid beta - oxidation in humans.	"Medium - chain acyl - CoA dehydrogenase	0	39	Gene_or_geneproduct"	"MCAD	42	46	Gene_or_geneproduct"	"[{""token"": ""Medium - chain acyl - CoA dehydrogenase"", ""start_span"": 0, ""end_span"": 39, ""type"": ""Gene_or_geneproduct""}, {""token"": ""MCAD"", ""start_span"": 42, ""end_span"": 46, ""type"": ""Gene_or_geneproduct""}]"
To better understand the pathogenesis of this disease, we developed a mouse model for MCAD deficiency ( MCAD - / -) by gene targeting in embryonic stem ( ES) cells.	"MCAD	86	90	Gene_or_geneproduct"	"MCAD	104	108	Gene_or_geneproduct"	"[{""token"": ""MCAD"", ""start_span"": 86, ""end_span"": 90, ""type"": ""Gene_or_geneproduct""}, {""token"": ""MCAD"", ""start_span"": 104, ""end_span"": 108, ""type"": ""Gene_or_geneproduct""}]"
The sporadic cardiac lesions seen in MCAD - / - mice have not been reported in human MCAD patients.	"MCAD	37	41	Gene_or_geneproduct"	"human MCAD	79	89	Gene_or_geneproduct"	"[{""token"": ""MCAD"", ""start_span"": 37, ""end_span"": 41, ""type"": ""Gene_or_geneproduct""}, {""token"": ""human MCAD"", ""start_span"": 79, ""end_span"": 89, ""type"": ""Gene_or_geneproduct""}]"
There was significant neonatal mortality of MCAD - / - pups demonstrating similarities to patterns of clinical episodes and mortality in MCAD - deficient patients.	"MCAD	44	48	Gene_or_geneproduct"	"MCAD	137	141	Gene_or_geneproduct"	"[{""token"": ""MCAD"", ""start_span"": 44, ""end_span"": 48, ""type"": ""Gene_or_geneproduct""}, {""token"": ""MCAD"", ""start_span"": 137, ""end_span"": 141, ""type"": ""Gene_or_geneproduct""}]"
The MCAD - deficient mouse reproduced important aspects of human MCAD deficiency and is a valuable model for further analysis of the roles of fatty acid oxidation and pathogenesis of human diseases involving fatty acid oxidation.	"MCAD	4	8	Gene_or_geneproduct"	"human MCAD	59	69	Gene_or_geneproduct"	"[{""token"": ""MCAD"", ""start_span"": 4, ""end_span"": 8, ""type"": ""Gene_or_geneproduct""}, {""token"": ""human MCAD"", ""start_span"": 59, ""end_span"": 69, ""type"": ""Gene_or_geneproduct""}]"
Medium - chain acyl - CoA dehydrogenase ( MCAD) deficiency is one of the most common inherited disorders of metabolism.	"Medium - chain acyl - CoA dehydrogenase	0	39	Gene_or_geneproduct"	"MCAD	42	46	Gene_or_geneproduct"	"[{""token"": ""Medium - chain acyl - CoA dehydrogenase"", ""start_span"": 0, ""end_span"": 39, ""type"": ""Gene_or_geneproduct""}, {""token"": ""MCAD"", ""start_span"": 42, ""end_span"": 46, ""type"": ""Gene_or_geneproduct""}]"
An animal model for MCAD deficiency is essential to better understand the pathogenesis of MCAD deficiency and to develop better management regimens for human patients.	"MCAD	20	24	Gene_or_geneproduct"	"MCAD	90	94	Gene_or_geneproduct"	"[{""token"": ""MCAD"", ""start_span"": 20, ""end_span"": 24, ""type"": ""Gene_or_geneproduct""}, {""token"": ""MCAD"", ""start_span"": 90, ""end_span"": 94, ""type"": ""Gene_or_geneproduct""}]"
