The temporal spike of Snail mRNA expression in the hair bud prompted us to consider what factor ( s) may be regulating the Snail gene.	"Snail	22	27	Gene_or_geneproduct"	"Snail	123	128	Gene_or_geneproduct"	"[{""token"": ""Snail"", ""start_span"": 22, ""end_span"": 27, ""type"": ""Gene_or_geneproduct""}, {""token"": ""Snail"", ""start_span"": 123, ""end_span"": 128, ""type"": ""Gene_or_geneproduct""}]"
Thus, despite essential roles for Wnts and noggin in hair follicle specification [ 4, 29, 30], our studies did not support an essential role for these signals in governing Snail expression in keratinocytes.	"noggin	43	49	Gene_or_geneproduct"	"Snail	172	177	Gene_or_geneproduct"	"[{""token"": ""noggin"", ""start_span"": 43, ""end_span"": 49, ""type"": ""Gene_or_geneproduct""}, {""token"": ""Snail"", ""start_span"": 172, ""end_span"": 177, ""type"": ""Gene_or_geneproduct""}]"
TGF - beta 1 has been shown to induce Snail family members in hepatocytes and heart [ 15, 31].	"TGF - beta 1	0	12	Gene_or_geneproduct"	"Snail	38	43	Gene_or_geneproduct"	"[{""token"": ""TGF - beta 1"", ""start_span"": 0, ""end_span"": 12, ""type"": ""Gene_or_geneproduct""}, {""token"": ""Snail"", ""start_span"": 38, ""end_span"": 43, ""type"": ""Gene_or_geneproduct""}]"
Of the loss - of - function mutations generated in each of the TGF - beta genes, only the TGF - beta 2 null state blocked follicle development at the hair bud stage [ 32].	"TGF - beta	63	73	Gene_or_geneproduct"	"TGF - beta 2	90	102	Gene_or_geneproduct"	"[{""token"": ""TGF - beta"", ""start_span"": 63, ""end_span"": 73, ""type"": ""Gene_or_geneproduct""}, {""token"": ""TGF - beta 2"", ""start_span"": 90, ""end_span"": 102, ""type"": ""Gene_or_geneproduct""}]"
Thus, we turned towards addressing whether TGF - beta 2 might be involved in regulating Snail expression in keratinocytes isolated from the basal layer of the epidermis.	"TGF - beta 2	43	55	Gene_or_geneproduct"	"Snail	88	93	Gene_or_geneproduct"	"[{""token"": ""TGF - beta 2"", ""start_span"": 43, ""end_span"": 55, ""type"": ""Gene_or_geneproduct""}, {""token"": ""Snail"", ""start_span"": 88, ""end_span"": 93, ""type"": ""Gene_or_geneproduct""}]"
Interestingly, treatment of cultured keratinocytes with as little as 5 ng / ml of TGF - beta 2 caused a rapid and transient induction of Snail ( Figure 5B).	"TGF - beta 2	82	94	Gene_or_geneproduct"	"Snail	137	142	Gene_or_geneproduct"	"[{""token"": ""TGF - beta 2"", ""start_span"": 82, ""end_span"": 94, ""type"": ""Gene_or_geneproduct""}, {""token"": ""Snail"", ""start_span"": 137, ""end_span"": 142, ""type"": ""Gene_or_geneproduct""}]"
The induction of Snail appeared to be specific for the active form of the growth factor, as pretreatment of TGF - beta 2 for 10 min at 100 degrees C obliterated the response [ Figure 5B, lanes marked ( -)].	"Snail	17	22	Gene_or_geneproduct"	"TGF - beta 2	108	120	Gene_or_geneproduct"	"[{""token"": ""Snail"", ""start_span"": 17, ""end_span"": 22, ""type"": ""Gene_or_geneproduct""}, {""token"": ""TGF - beta 2"", ""start_span"": 108, ""end_span"": 120, ""type"": ""Gene_or_geneproduct""}]"
Thus, although Snail expression correlated with phosphorylated SMAD2 ( pSMAD2) induction, its decline seemed to rely on secondary downstream events.	"Snail	15	20	Gene_or_geneproduct"	"SMAD2	63	68	Gene_or_geneproduct"	"[{""token"": ""Snail"", ""start_span"": 15, ""end_span"": 20, ""type"": ""Gene_or_geneproduct""}, {""token"": ""SMAD2"", ""start_span"": 63, ""end_span"": 68, ""type"": ""Gene_or_geneproduct""}]"
At 2 d after transient transfection, keratinocytes were treated with TGF - beta 2 ( t = 0) and then assayed for transgene activity over the same time course in which we had observed Snail protein induction.	"TGF - beta 2	69	81	Gene_or_geneproduct"	"Snail	182	187	Gene_or_geneproduct"	"[{""token"": ""TGF - beta 2"", ""start_span"": 69, ""end_span"": 81, ""type"": ""Gene_or_geneproduct""}, {""token"": ""Snail"", ""start_span"": 182, ""end_span"": 187, ""type"": ""Gene_or_geneproduct""}]"
Within 0. 5 h of TGF - beta 2 treatment, Snail promoter activity had increased 3 - fold, and by 2 h, it peaked to approximately 10 - fold over control levels ( Figure 5D).	"TGF - beta 2	17	29	Gene_or_geneproduct"	"Snail	41	46	Gene_or_geneproduct"	"[{""token"": ""TGF - beta 2"", ""start_span"": 17, ""end_span"": 29, ""type"": ""Gene_or_geneproduct""}, {""token"": ""Snail"", ""start_span"": 41, ""end_span"": 46, ""type"": ""Gene_or_geneproduct""}]"
The kinetics of Snail promoter activity closely paralleled those observed for Snail protein induction.	"Snail	16	21	Gene_or_geneproduct"	"Snail	78	83	Gene_or_geneproduct"	"[{""token"": ""Snail"", ""start_span"": 16, ""end_span"": 21, ""type"": ""Gene_or_geneproduct""}, {""token"": ""Snail"", ""start_span"": 78, ""end_span"": 83, ""type"": ""Gene_or_geneproduct""}]"
Moreover, the downstream effector of TGF - beta 2 signaling, pSMAD2, was also expressed in WT, but not TGF - beta 2 - null, hair buds ( Figure 6B).	"TGF - beta 2	37	49	Gene_or_geneproduct"	"TGF - beta 2	103	115	Gene_or_geneproduct"	"[{""token"": ""TGF - beta 2"", ""start_span"": 37, ""end_span"": 49, ""type"": ""Gene_or_geneproduct""}, {""token"": ""TGF - beta 2"", ""start_span"": 103, ""end_span"": 115, ""type"": ""Gene_or_geneproduct""}]"
As judged by immunohistochemistry, Snail protein was absent from E17. 5 skin of TGF - beta 2 - null embryos but not from that of control littermates ( Figure 6C).	"Snail	35	40	Gene_or_geneproduct"	"TGF - beta 2	80	92	Gene_or_geneproduct"	"[{""token"": ""Snail"", ""start_span"": 35, ""end_span"": 40, ""type"": ""Gene_or_geneproduct""}, {""token"": ""TGF - beta 2"", ""start_span"": 80, ""end_span"": 92, ""type"": ""Gene_or_geneproduct""}]"
This effect appeared to be exerted at the transcriptional level, since Snail mRNAs were also not found in TGF - beta 2 null hair buds under conditions in which the signal was readily detected in the hair buds of littermate skin ( Figure 6D).	"Snail	71	76	Gene_or_geneproduct"	"TGF - beta 2	106	118	Gene_or_geneproduct"	"[{""token"": ""Snail"", ""start_span"": 71, ""end_span"": 76, ""type"": ""Gene_or_geneproduct""}, {""token"": ""TGF - beta 2"", ""start_span"": 106, ""end_span"": 118, ""type"": ""Gene_or_geneproduct""}]"
Taken together, these results provide compelling evidence that TGF - beta 2 is functionally important for inducing Snail gene expression in a pSMAD - dependent manner in developing hair buds.	"TGF - beta 2	63	75	Gene_or_geneproduct"	"Snail	115	120	Gene_or_geneproduct"	"[{""token"": ""TGF - beta 2"", ""start_span"": 63, ""end_span"": 75, ""type"": ""Gene_or_geneproduct""}, {""token"": ""Snail"", ""start_span"": 115, ""end_span"": 120, ""type"": ""Gene_or_geneproduct""}]"
Consistent with this notion, basement membrane remodeling still took place in the TGF - beta 2 - null buds, as judged by immunofluorescence with antibodies against beta 4 integrin, an integral component of keratinocyte - mediated adhesion to its underlying basement membrane ( Figure 6F).	"TGF - beta 2	82	94	Gene_or_geneproduct"	"beta 4 integrin	164	179	Gene_or_geneproduct"	"[{""token"": ""TGF - beta 2"", ""start_span"": 82, ""end_span"": 94, ""type"": ""Gene_or_geneproduct""}, {""token"": ""beta 4 integrin"", ""start_span"": 164, ""end_span"": 179, ""type"": ""Gene_or_geneproduct""}]"
In contrast, TGF - beta 2 signaling appeared to be an important factor for the early proliferation that occurs in the developing hair buds, as judged by anti - Ki67 and anti - pMAPK immunofluorescence ( Figure 6F and 6G).	"TGF - beta 2	13	25	Gene_or_geneproduct"	"Ki67	160	164	Gene_or_geneproduct"	"[{""token"": ""TGF - beta 2"", ""start_span"": 13, ""end_span"": 25, ""type"": ""Gene_or_geneproduct""}, {""token"": ""Ki67"", ""start_span"": 160, ""end_span"": 164, ""type"": ""Gene_or_geneproduct""}]"
These data suggest that during hair follicle morphogenesis, TGF - beta 2 functions subsequently to Wnt / noggin - mediated determination of hair fate.	"TGF - beta 2	60	72	Gene_or_geneproduct"	"noggin	105	111	Gene_or_geneproduct"	"[{""token"": ""TGF - beta 2"", ""start_span"": 60, ""end_span"": 72, ""type"": ""Gene_or_geneproduct""}, {""token"": ""noggin"", ""start_span"": 105, ""end_span"": 111, ""type"": ""Gene_or_geneproduct""}]"
However, in contrast to TGF - beta 1 - null skin, which exhibits an extended growing phase of postnatal hair follicles, TGF - beta 2 - null skin displays an embryonic block in follicle bud progression [ 32].	"TGF - beta 1	24	36	Gene_or_geneproduct"	"TGF - beta 2	120	132	Gene_or_geneproduct"	"[{""token"": ""TGF - beta 1"", ""start_span"": 24, ""end_span"": 36, ""type"": ""Gene_or_geneproduct""}, {""token"": ""TGF - beta 2"", ""start_span"": 120, ""end_span"": 132, ""type"": ""Gene_or_geneproduct""}]"
An additional point worth mentioning is that prolonged expression of Tg Snail in postnatal skin resulted in morphological and biochemical signs of epithelial to mesenchymal transitions ( unpublished data), underscoring why transient Snail expression may be so important during normal hair follicle morphogenesis [ 18].	"Snail	72	77	Gene_or_geneproduct"	"Snail	233	238	Gene_or_geneproduct"	"[{""token"": ""Snail"", ""start_span"": 72, ""end_span"": 77, ""type"": ""Gene_or_geneproduct""}, {""token"": ""Snail"", ""start_span"": 233, ""end_span"": 238, ""type"": ""Gene_or_geneproduct""}]"
At first glance, the sparsity in hair coat of K14 - Snail Tg mice seemed indicative of a defect in follicle formation ( see Figure 2A).	"K14	46	49	Gene_or_geneproduct"	"Snail	52	57	Gene_or_geneproduct"	"[{""token"": ""K14"", ""start_span"": 46, ""end_span"": 49, ""type"": ""Gene_or_geneproduct""}, {""token"": ""Snail"", ""start_span"": 52, ""end_span"": 57, ""type"": ""Gene_or_geneproduct""}]"
The K14 promoter is also less active in the ORS than epidermis and hence this might also account for the lack of apparent response of the ORS to ectopic Snail.	"K14	4	7	Gene_or_geneproduct"	"Snail	153	158	Gene_or_geneproduct"	"[{""token"": ""K14"", ""start_span"": 4, ""end_span"": 7, ""type"": ""Gene_or_geneproduct""}, {""token"": ""Snail"", ""start_span"": 153, ""end_span"": 158, ""type"": ""Gene_or_geneproduct""}]"
In the course of these studies, we also noted that Snail can also contribute to this process in keratinocytes in vitro, and our present studies revealed that Snail is expressed at the right place and time to be physiologically relevant in the process.	"Snail	51	56	Gene_or_geneproduct"	"Snail	158	163	Gene_or_geneproduct"	"[{""token"": ""Snail"", ""start_span"": 51, ""end_span"": 56, ""type"": ""Gene_or_geneproduct""}, {""token"": ""Snail"", ""start_span"": 158, ""end_span"": 163, ""type"": ""Gene_or_geneproduct""}]"
The corresponding failure of E - cadherin down - regulation underscores the importance of Wnt / noggin signaling in regulating this event in follicle morphogenesis [ 4].	"E - cadherin	29	41	Gene_or_geneproduct"	"noggin	96	102	Gene_or_geneproduct"	"[{""token"": ""E - cadherin"", ""start_span"": 29, ""end_span"": 41, ""type"": ""Gene_or_geneproduct""}, {""token"": ""noggin"", ""start_span"": 96, ""end_span"": 102, ""type"": ""Gene_or_geneproduct""}]"
Conditional gene targeting studies will be necessary to establish whether Snail family members also contribute to the down - regulation in E - cadherin gene expression that occurs during follicle formation.	"Snail	74	79	Gene_or_geneproduct"	"E - cadherin	139	151	Gene_or_geneproduct"	"[{""token"": ""Snail"", ""start_span"": 74, ""end_span"": 79, ""type"": ""Gene_or_geneproduct""}, {""token"": ""E - cadherin"", ""start_span"": 139, ""end_span"": 151, ""type"": ""Gene_or_geneproduct""}]"
Our Tg studies suggested that, at least in part through its regulation of E - cadherin, Snail is able to influence the subcellular localization of a variety of AJ - associated proteins.	"E - cadherin	74	86	Gene_or_geneproduct"	"Snail	88	93	Gene_or_geneproduct"	"[{""token"": ""E - cadherin"", ""start_span"": 74, ""end_span"": 86, ""type"": ""Gene_or_geneproduct""}, {""token"": ""Snail"", ""start_span"": 88, ""end_span"": 93, ""type"": ""Gene_or_geneproduct""}]"
One of these appears to be Ajuba, which was previously shown to have the dual capacity to bind Grb - 2 as well as alpha - catenin [ 9, 10].	"Ajuba	27	32	Gene_or_geneproduct"	"Grb - 2	95	102	Gene_or_geneproduct"	"[{""token"": ""Ajuba"", ""start_span"": 27, ""end_span"": 32, ""type"": ""Gene_or_geneproduct""}, {""token"": ""Grb - 2"", ""start_span"": 95, ""end_span"": 102, ""type"": ""Gene_or_geneproduct""}]"
While our in vivo studies are consistent with a role for Snail in motility and epithelial remodeling, they differ with respect to Snail ' s apparent proliferative effects.	"Snail	57	62	Gene_or_geneproduct"	"Snail	130	135	Gene_or_geneproduct"	"[{""token"": ""Snail"", ""start_span"": 57, ""end_span"": 62, ""type"": ""Gene_or_geneproduct""}, {""token"": ""Snail"", ""start_span"": 130, ""end_span"": 135, ""type"": ""Gene_or_geneproduct""}]"
The K14 - Smad 2 Tg mouse was reported in Ito et al., 2001.	"K14	4	7	Gene_or_geneproduct"	"Smad 2	10	16	Gene_or_geneproduct"	"[{""token"": ""K14"", ""start_span"": 4, ""end_span"": 7, ""type"": ""Gene_or_geneproduct""}, {""token"": ""Smad 2"", ""start_span"": 10, ""end_span"": 16, ""type"": ""Gene_or_geneproduct""}]"
BMP - bone morphogenic protein	"BMP	0	3	Gene_or_geneproduct"	"bone morphogenic protein	6	30	Gene_or_geneproduct"	"[{""token"": ""BMP"", ""start_span"": 0, ""end_span"": 3, ""type"": ""Gene_or_geneproduct""}, {""token"": ""bone morphogenic protein"", ""start_span"": 6, ""end_span"": 30, ""type"": ""Gene_or_geneproduct""}]"
Grb - 2 - growth factor receptor - bound protein - 2	"Grb - 2	0	7	Gene_or_geneproduct"	"growth factor receptor - bound protein - 2	10	52	Gene_or_geneproduct"	"[{""token"": ""Grb - 2"", ""start_span"": 0, ""end_span"": 7, ""type"": ""Gene_or_geneproduct""}, {""token"": ""growth factor receptor - bound protein - 2"", ""start_span"": 10, ""end_span"": 52, ""type"": ""Gene_or_geneproduct""}]"
K1 - keratin 1	"K1	0	2	Gene_or_geneproduct"	"keratin 1	5	14	Gene_or_geneproduct"	"[{""token"": ""K1"", ""start_span"": 0, ""end_span"": 2, ""type"": ""Gene_or_geneproduct""}, {""token"": ""keratin 1"", ""start_span"": 5, ""end_span"": 14, ""type"": ""Gene_or_geneproduct""}]"
K5 - keratin 5	"K5	0	2	Gene_or_geneproduct"	"keratin 5	5	14	Gene_or_geneproduct"	"[{""token"": ""K5"", ""start_span"": 0, ""end_span"": 2, ""type"": ""Gene_or_geneproduct""}, {""token"": ""keratin 5"", ""start_span"": 5, ""end_span"": 14, ""type"": ""Gene_or_geneproduct""}]"
LEF - 1 - lymphoid enhancer factor - 1	"LEF - 1	0	7	Gene_or_geneproduct"	"lymphoid enhancer factor - 1	10	38	Gene_or_geneproduct"	"[{""token"": ""LEF - 1"", ""start_span"": 0, ""end_span"": 7, ""type"": ""Gene_or_geneproduct""}, {""token"": ""lymphoid enhancer factor - 1"", ""start_span"": 10, ""end_span"": 38, ""type"": ""Gene_or_geneproduct""}]"
Shh - sonic hedgehog	"Shh	0	3	Gene_or_geneproduct"	"sonic hedgehog	6	20	Gene_or_geneproduct"	"[{""token"": ""Shh"", ""start_span"": 0, ""end_span"": 3, ""type"": ""Gene_or_geneproduct""}, {""token"": ""sonic hedgehog"", ""start_span"": 6, ""end_span"": 20, ""type"": ""Gene_or_geneproduct""}]"
SMADs - small phenotype - and mothers against decapentaplegic - related proteins	"SMADs	0	5	Gene_or_geneproduct"	"small phenotype - and mothers against decapentaplegic - related proteins	8	80	Gene_or_geneproduct"	"[{""token"": ""SMADs"", ""start_span"": 0, ""end_span"": 5, ""type"": ""Gene_or_geneproduct""}, {""token"": ""small phenotype - and mothers against decapentaplegic - related proteins"", ""start_span"": 8, ""end_span"": 80, ""type"": ""Gene_or_geneproduct""}]"
Sos - son of sevenless	"Sos	0	3	Gene_or_geneproduct"	"son of sevenless	6	22	Gene_or_geneproduct"	"[{""token"": ""Sos"", ""start_span"": 0, ""end_span"": 3, ""type"": ""Gene_or_geneproduct""}, {""token"": ""son of sevenless"", ""start_span"": 6, ""end_span"": 22, ""type"": ""Gene_or_geneproduct""}]"
TGF - beta - transforming growth factor beta	"TGF - beta	0	10	Gene_or_geneproduct"	"transforming growth factor beta	13	44	Gene_or_geneproduct"	"[{""token"": ""TGF - beta"", ""start_span"": 0, ""end_span"": 10, ""type"": ""Gene_or_geneproduct""}, {""token"": ""transforming growth factor beta"", ""start_span"": 13, ""end_span"": 44, ""type"": ""Gene_or_geneproduct""}]"
Anti - beta 4 int labeling reveals the presence of the hemidesmosomal integrin beta 4, restricted to the base of cells adhering to the underlying basement membrane.	"beta 4 int	7	17	Gene_or_geneproduct"	"integrin beta 4	70	85	Gene_or_geneproduct"	"[{""token"": ""beta 4 int"", ""start_span"": 7, ""end_span"": 17, ""type"": ""Gene_or_geneproduct""}, {""token"": ""integrin beta 4"", ""start_span"": 70, ""end_span"": 85, ""type"": ""Gene_or_geneproduct""}]"
( H) Immunofluorescence with anti - laminin 5 ( lam5), which demarcates the basement membrane, and anti - E - cadherin ( E - cad), a component of AJs.	"E - cadherin	106	118	Gene_or_geneproduct"	"E - cad	121	128	Gene_or_geneproduct"	"[{""token"": ""E - cadherin"", ""start_span"": 106, ""end_span"": 118, ""type"": ""Gene_or_geneproduct""}, {""token"": ""E - cad"", ""start_span"": 121, ""end_span"": 128, ""type"": ""Gene_or_geneproduct""}]"
Three different surviving Tg founder mice harbored a K14 - Snail transgene that was integrated into a locus that resulted in inheritable, mosaic expression of the transgene in skin epidermis.	"K14	53	56	Gene_or_geneproduct"	"Snail	59	64	Gene_or_geneproduct"	"[{""token"": ""K14"", ""start_span"": 53, ""end_span"": 56, ""type"": ""Gene_or_geneproduct""}, {""token"": ""Snail"", ""start_span"": 59, ""end_span"": 64, ""type"": ""Gene_or_geneproduct""}]"
( A) P16 WT and K14 - Snail Tg mice.	"K14	16	19	Gene_or_geneproduct"	"Snail	22	27	Gene_or_geneproduct"	"[{""token"": ""K14"", ""start_span"": 16, ""end_span"": 19, ""type"": ""Gene_or_geneproduct""}, {""token"": ""Snail"", ""start_span"": 22, ""end_span"": 27, ""type"": ""Gene_or_geneproduct""}]"
Double arrows demarcate the border of mosaic anti - Snail ( green), revealing Snail expression coincident with regions of hyperthickened epidermis ( at left) and absent in regions of normal epidermis ( at right).	"Snail	52	57	Gene_or_geneproduct"	"Snail	78	83	Gene_or_geneproduct"	"[{""token"": ""Snail"", ""start_span"": 52, ""end_span"": 57, ""type"": ""Gene_or_geneproduct""}, {""token"": ""Snail"", ""start_span"": 78, ""end_span"": 83, ""type"": ""Gene_or_geneproduct""}]"
Insets in the panels for beta - catenin and Ajuba staining are magnified views of the boxed areas.	"beta - catenin	25	39	Gene_or_geneproduct"	"Ajuba	44	49	Gene_or_geneproduct"	"[{""token"": ""beta - catenin"", ""start_span"": 25, ""end_span"": 39, ""type"": ""Gene_or_geneproduct""}, {""token"": ""Ajuba"", ""start_span"": 44, ""end_span"": 49, ""type"": ""Gene_or_geneproduct""}]"
Arrows mark membrane localization of the protein and asterisks mark cells with elevated levels of cytoplasmic beta - catenin or Ajuba.	"beta - catenin	110	124	Gene_or_geneproduct"	"Ajuba	128	133	Gene_or_geneproduct"	"[{""token"": ""beta - catenin"", ""start_span"": 110, ""end_span"": 124, ""type"": ""Gene_or_geneproduct""}, {""token"": ""Ajuba"", ""start_span"": 128, ""end_span"": 133, ""type"": ""Gene_or_geneproduct""}]"
Antibodies are as in ( A) except anti - P - cad, which detects P - cadherin, whose expression in the hair follicle was not affected, and anti - tubulin, which detects tubulin, a control for equal protein loadings.	"P - cad	40	47	Gene_or_geneproduct"	"P - cadherin	63	75	Gene_or_geneproduct"	"[{""token"": ""P - cad"", ""start_span"": 40, ""end_span"": 47, ""type"": ""Gene_or_geneproduct""}, {""token"": ""P - cadherin"", ""start_span"": 63, ""end_span"": 75, ""type"": ""Gene_or_geneproduct""}]"
( D) Reintroduction of E - cadherin in keratinocytes expressing Snail returns pMAPK to basal levels.	"E - cadherin	23	35	Gene_or_geneproduct"	"Snail	64	69	Gene_or_geneproduct"	"[{""token"": ""E - cadherin"", ""start_span"": 23, ""end_span"": 35, ""type"": ""Gene_or_geneproduct""}, {""token"": ""Snail"", ""start_span"": 64, ""end_span"": 69, ""type"": ""Gene_or_geneproduct""}]"
After 2 d, cells were serum starved for 4 h and whole cell lysates were made and Western blotted with antibodies to pMAPK, HA to recognize the HA - tagged Snail and E - cadherin protein, 20or tubulin as a loading control.	"Snail	155	160	Gene_or_geneproduct"	"E - cadherin	165	177	Gene_or_geneproduct"	"[{""token"": ""Snail"", ""start_span"": 155, ""end_span"": 160, ""type"": ""Gene_or_geneproduct""}, {""token"": ""E - cadherin"", ""start_span"": 165, ""end_span"": 177, ""type"": ""Gene_or_geneproduct""}]"
Note the presence of Ajuba only under conditions where levels of alpha - catenin and other AJ proteins were aberrantly low or absent.	"Ajuba	21	26	Gene_or_geneproduct"	"alpha - catenin	65	80	Gene_or_geneproduct"	"[{""token"": ""Ajuba"", ""start_span"": 21, ""end_span"": 26, ""type"": ""Gene_or_geneproduct""}, {""token"": ""alpha - catenin"", ""start_span"": 65, ""end_span"": 80, ""type"": ""Gene_or_geneproduct""}]"
48 h posttransfection, protein extracts were prepared and subjected to SDS - PAGE and Western blot analyses with antibodies against pMAPK, total MAPK, Ajuba ( also recognizing the smaller, pre - LIM domain), and Snail.	"Ajuba	151	156	Gene_or_geneproduct"	"Snail	212	217	Gene_or_geneproduct"	"[{""token"": ""Ajuba"", ""start_span"": 151, ""end_span"": 156, ""type"": ""Gene_or_geneproduct""}, {""token"": ""Snail"", ""start_span"": 212, ""end_span"": 217, ""type"": ""Gene_or_geneproduct""}]"
( A) Failure of Wnt and noggin signaling to induce Snail in cultured keratinocytes.	"noggin	24	30	Gene_or_geneproduct"	"Snail	51	56	Gene_or_geneproduct"	"[{""token"": ""noggin"", ""start_span"": 24, ""end_span"": 30, ""type"": ""Gene_or_geneproduct""}, {""token"": ""Snail"", ""start_span"": 51, ""end_span"": 56, ""type"": ""Gene_or_geneproduct""}]"
( B) TGF - beta 2 can induce Snail protein.	"TGF - beta 2	5	17	Gene_or_geneproduct"	"Snail	29	34	Gene_or_geneproduct"	"[{""token"": ""TGF - beta 2"", ""start_span"": 5, ""end_span"": 17, ""type"": ""Gene_or_geneproduct""}, {""token"": ""Snail"", ""start_span"": 29, ""end_span"": 34, ""type"": ""Gene_or_geneproduct""}]"
Note the activation of Snail expression, peaking at 2 h post - TGF - beta 2 treatment and then disappearing thereafter.	"Snail	23	28	Gene_or_geneproduct"	"TGF - beta 2	63	75	Gene_or_geneproduct"	"[{""token"": ""Snail"", ""start_span"": 23, ""end_span"": 28, ""type"": ""Gene_or_geneproduct""}, {""token"": ""TGF - beta 2"", ""start_span"": 63, ""end_span"": 75, ""type"": ""Gene_or_geneproduct""}]"
( C) Snail mRNA expression is transiently induced by TGF - beta 2.	"Snail	5	10	Gene_or_geneproduct"	"TGF - beta 2	53	65	Gene_or_geneproduct"	"[{""token"": ""Snail"", ""start_span"": 5, ""end_span"": 10, ""type"": ""Gene_or_geneproduct""}, {""token"": ""TGF - beta 2"", ""start_span"": 53, ""end_span"": 65, ""type"": ""Gene_or_geneproduct""}]"
RT - PCR was then used with ( +) or without ( -) reverse transcriptase ( RT) and with primer sets specific for Snail and GAPDH mRNAs.	"Snail	111	116	Gene_or_geneproduct"	"GAPDH	121	126	Gene_or_geneproduct"	"[{""token"": ""Snail"", ""start_span"": 111, ""end_span"": 116, ""type"": ""Gene_or_geneproduct""}, {""token"": ""GAPDH"", ""start_span"": 121, ""end_span"": 126, ""type"": ""Gene_or_geneproduct""}]"
Note that Snail mRNA expression also peaked at 2 h, paralleling Snail protein.	"Snail	10	15	Gene_or_geneproduct"	"Snail	64	69	Gene_or_geneproduct"	"[{""token"": ""Snail"", ""start_span"": 10, ""end_span"": 15, ""type"": ""Gene_or_geneproduct""}, {""token"": ""Snail"", ""start_span"": 64, ""end_span"": 69, ""type"": ""Gene_or_geneproduct""}]"
( D) TGF - beta 2 treatment results in enhanced activity of a Snail promoter - beta - galactosidase reporter.	"TGF - beta 2	5	17	Gene_or_geneproduct"	"Snail	62	67	Gene_or_geneproduct"	"[{""token"": ""TGF - beta 2"", ""start_span"": 5, ""end_span"": 17, ""type"": ""Gene_or_geneproduct""}, {""token"": ""Snail"", ""start_span"": 62, ""end_span"": 67, ""type"": ""Gene_or_geneproduct""}]"
At 2 d posttransfection, cells were treated with either TGF - beta or heat - inactivated TGF - beta 2 ( inact) for the times indicated.	"TGF - beta	56	66	Gene_or_geneproduct"	"TGF - beta 2	89	101	Gene_or_geneproduct"	"[{""token"": ""TGF - beta"", ""start_span"": 56, ""end_span"": 66, ""type"": ""Gene_or_geneproduct""}, {""token"": ""TGF - beta 2"", ""start_span"": 89, ""end_span"": 101, ""type"": ""Gene_or_geneproduct""}]"
( F - G) Proliferation markers Ki67 ( F) and pMAPK ( G) are diminished in TGF - beta 2 - null hair relative to its WT counterpart.	"Ki67	31	35	Gene_or_geneproduct"	"TGF - beta 2	74	86	Gene_or_geneproduct"	"[{""token"": ""Ki67"", ""start_span"": 31, ""end_span"": 35, ""type"": ""Gene_or_geneproduct""}, {""token"": ""TGF - beta 2"", ""start_span"": 74, ""end_span"": 86, ""type"": ""Gene_or_geneproduct""}]"
( H - J) TGF - beta 2 - null hair fails to down - regulate E - cadherin ( H).	"TGF - beta 2	9	21	Gene_or_geneproduct"	"E - cadherin	59	71	Gene_or_geneproduct"	"[{""token"": ""TGF - beta 2"", ""start_span"": 9, ""end_span"": 21, ""type"": ""Gene_or_geneproduct""}, {""token"": ""E - cadherin"", ""start_span"": 59, ""end_span"": 71, ""type"": ""Gene_or_geneproduct""}]"
Our results are particularly interesting in light of the recent implication that GSK - 3 beta controls Snail ' s stability and subcellular localization [ 50].	"GSK - 3 beta	81	93	Gene_or_geneproduct"	"Snail	103	108	Gene_or_geneproduct"	"[{""token"": ""GSK - 3 beta"", ""start_span"": 81, ""end_span"": 93, ""type"": ""Gene_or_geneproduct""}, {""token"": ""Snail"", ""start_span"": 103, ""end_span"": 108, ""type"": ""Gene_or_geneproduct""}]"
