In the absence of a feed - forward loop between SOX9 and FGF9 ( e. g., in XX gonads), WNT4 blocks Fgf9, initiating the female pathway.	"SOX9	48	52	Gene_or_geneproduct"	"FGF9	57	61	Gene_or_geneproduct"	"WNT4	86	90	Gene_or_geneproduct"	"Fgf9	98	102	Gene_or_geneproduct"	"[{""token"": ""SOX9"", ""start_span"": 48, ""end_span"": 52, ""type"": ""Gene_or_geneproduct""}, {""token"": ""FGF9"", ""start_span"": 57, ""end_span"": 61, ""type"": ""Gene_or_geneproduct""}, {""token"": ""WNT4"", ""start_span"": 86, ""end_span"": 90, ""type"": ""Gene_or_geneproduct""}, {""token"": ""Fgf9"", ""start_span"": 98, ""end_span"": 102, ""type"": ""Gene_or_geneproduct""}]"
RanBP2 Modulates Cox11 and Hexokinase I Activities and Haploinsufficiency of RanBP2 Causes Deficits in Glucose Metabolism	"RanBP2	0	6	Gene_or_geneproduct"	"Cox11	17	22	Gene_or_geneproduct"	"Hexokinase I	27	39	Gene_or_geneproduct"	"RanBP2	77	83	Gene_or_geneproduct"	"[{""token"": ""RanBP2"", ""start_span"": 0, ""end_span"": 6, ""type"": ""Gene_or_geneproduct""}, {""token"": ""Cox11"", ""start_span"": 17, ""end_span"": 22, ""type"": ""Gene_or_geneproduct""}, {""token"": ""Hexokinase I"", ""start_span"": 27, ""end_span"": 39, ""type"": ""Gene_or_geneproduct""}, {""token"": ""RanBP2"", ""start_span"": 77, ""end_span"": 83, ""type"": ""Gene_or_geneproduct""}]"
RanBP2 associates in vitro and in vivo and colocalizes with the mitochondrial metallochaperone, Cox11, and the pacemaker of glycolysis, hexokinase type I ( HKI) via its leucine - rich domain.	"RanBP2	0	6	Gene_or_geneproduct"	"Cox11	96	101	Gene_or_geneproduct"	"hexokinase type I	136	153	Gene_or_geneproduct"	"HKI	156	159	Gene_or_geneproduct"	"[{""token"": ""RanBP2"", ""start_span"": 0, ""end_span"": 6, ""type"": ""Gene_or_geneproduct""}, {""token"": ""Cox11"", ""start_span"": 96, ""end_span"": 101, ""type"": ""Gene_or_geneproduct""}, {""token"": ""hexokinase type I"", ""start_span"": 136, ""end_span"": 153, ""type"": ""Gene_or_geneproduct""}, {""token"": ""HKI"", ""start_span"": 156, ""end_span"": 159, ""type"": ""Gene_or_geneproduct""}]"
The leucine - rich domain of RanBP2 also exhibits strong chaperone activity toward intermediate and mature folding species of Cox11 supporting a chaperone role of RanBP2 in the cytosol during Cox11 biogenesis.	"RanBP2	29	35	Gene_or_geneproduct"	"Cox11	126	131	Gene_or_geneproduct"	"RanBP2	163	169	Gene_or_geneproduct"	"Cox11	192	197	Gene_or_geneproduct"	"[{""token"": ""RanBP2"", ""start_span"": 29, ""end_span"": 35, ""type"": ""Gene_or_geneproduct""}, {""token"": ""Cox11"", ""start_span"": 126, ""end_span"": 131, ""type"": ""Gene_or_geneproduct""}, {""token"": ""RanBP2"", ""start_span"": 163, ""end_span"": 169, ""type"": ""Gene_or_geneproduct""}, {""token"": ""Cox11"", ""start_span"": 192, ""end_span"": 197, ""type"": ""Gene_or_geneproduct""}]"
Interestingly, the small yeast Ran - binding protein 1 ( RanBP1), Yrb1p, with strong homology to the Ran - binding domains of RanBP2, is also required for cell - cycle regulated protein degradation [ 21].	"yeast Ran - binding protein 1 ( RanBP1	25	63	Gene_or_geneproduct"	"Yrb1p	66	71	Gene_or_geneproduct"	"Ran	101	104	Gene_or_geneproduct"	"RanBP2	126	132	Gene_or_geneproduct"	"[{""token"": ""yeast Ran - binding protein 1 ( RanBP1"", ""start_span"": 25, ""end_span"": 63, ""type"": ""Gene_or_geneproduct""}, {""token"": ""Yrb1p"", ""start_span"": 66, ""end_span"": 71, ""type"": ""Gene_or_geneproduct""}, {""token"": ""Ran"", ""start_span"": 101, ""end_span"": 104, ""type"": ""Gene_or_geneproduct""}, {""token"": ""RanBP2"", ""start_span"": 126, ""end_span"": 132, ""type"": ""Gene_or_geneproduct""}]"
Since RanBP2 exhibits chaperone activity, we assessed whether the interaction between the LD of RanBP2 and Cox11 was direct and the chaperone activity of LD toward folding species of Cox11.	"RanBP2	6	12	Gene_or_geneproduct"	"RanBP2	96	102	Gene_or_geneproduct"	"Cox11	107	112	Gene_or_geneproduct"	"Cox11	183	188	Gene_or_geneproduct"	"[{""token"": ""RanBP2"", ""start_span"": 6, ""end_span"": 12, ""type"": ""Gene_or_geneproduct""}, {""token"": ""RanBP2"", ""start_span"": 96, ""end_span"": 102, ""type"": ""Gene_or_geneproduct""}, {""token"": ""Cox11"", ""start_span"": 107, ""end_span"": 112, ""type"": ""Gene_or_geneproduct""}, {""token"": ""Cox11"", ""start_span"": 183, ""end_span"": 188, ""type"": ""Gene_or_geneproduct""}]"
( E) Coimmunoprecipitation of RanBP2 with antibodies against its molecular partners shows that RanBP2 forms a complex in vivo with HKI ( lanes 1 and 2), mHsp70 ( lane 3), and Cox11 ( lane 4).	"RanBP2	30	36	Gene_or_geneproduct"	"RanBP2	95	101	Gene_or_geneproduct"	"HKI	131	134	Gene_or_geneproduct"	"Cox11	175	180	Gene_or_geneproduct"	"[{""token"": ""RanBP2"", ""start_span"": 30, ""end_span"": 36, ""type"": ""Gene_or_geneproduct""}, {""token"": ""RanBP2"", ""start_span"": 95, ""end_span"": 101, ""type"": ""Gene_or_geneproduct""}, {""token"": ""HKI"", ""start_span"": 131, ""end_span"": 134, ""type"": ""Gene_or_geneproduct""}, {""token"": ""Cox11"", ""start_span"": 175, ""end_span"": 180, ""type"": ""Gene_or_geneproduct""}]"
Cox11 strongly inhibits HKI activity in a concentration - dependent fashion, and at ~ 15 nM of Cox11, HKI activity could not be recorded ( Figure 2A).	"Cox11	0	5	Gene_or_geneproduct"	"HKI	24	27	Gene_or_geneproduct"	"Cox11	95	100	Gene_or_geneproduct"	"HKI	102	105	Gene_or_geneproduct"	"[{""token"": ""Cox11"", ""start_span"": 0, ""end_span"": 5, ""type"": ""Gene_or_geneproduct""}, {""token"": ""HKI"", ""start_span"": 24, ""end_span"": 27, ""type"": ""Gene_or_geneproduct""}, {""token"": ""Cox11"", ""start_span"": 95, ""end_span"": 100, ""type"": ""Gene_or_geneproduct""}, {""token"": ""HKI"", ""start_span"": 102, ""end_span"": 105, ""type"": ""Gene_or_geneproduct""}]"
RanBP2 Colocalizes with HK1, Cox11, and mHsp70 in the Retina and Cultured Neurons	"RanBP2	0	6	Gene_or_geneproduct"	"HK1	24	27	Gene_or_geneproduct"	"Cox11	29	34	Gene_or_geneproduct"	"mHsp70	40	46	Gene_or_geneproduct"	"[{""token"": ""RanBP2"", ""start_span"": 0, ""end_span"": 6, ""type"": ""Gene_or_geneproduct""}, {""token"": ""HK1"", ""start_span"": 24, ""end_span"": 27, ""type"": ""Gene_or_geneproduct""}, {""token"": ""Cox11"", ""start_span"": 29, ""end_span"": 34, ""type"": ""Gene_or_geneproduct""}, {""token"": ""mHsp70"", ""start_span"": 40, ""end_span"": 46, ""type"": ""Gene_or_geneproduct""}]"
Note that while RanBP2 and HKI are widely expressed among and colocalize to hippocampal neurons ( C), HKI expression and localization with RanBP2 is restricted to a subset of cortical neurons ( likely interneurons) ( F).	"RanBP2	16	22	Gene_or_geneproduct"	"HKI	27	30	Gene_or_geneproduct"	"HKI	102	105	Gene_or_geneproduct"	"RanBP2	139	145	Gene_or_geneproduct"	"[{""token"": ""RanBP2"", ""start_span"": 16, ""end_span"": 22, ""type"": ""Gene_or_geneproduct""}, {""token"": ""HKI"", ""start_span"": 27, ""end_span"": 30, ""type"": ""Gene_or_geneproduct""}, {""token"": ""HKI"", ""start_span"": 102, ""end_span"": 105, ""type"": ""Gene_or_geneproduct""}, {""token"": ""RanBP2"", ""start_span"": 139, ""end_span"": 145, ""type"": ""Gene_or_geneproduct""}]"
Genotyping of 299 F2 offspring revealed a RanBP2 + / +: RanBP2 + / -: RanBP2 - / - distribution ( 89: 210: 0) that deviated from the expected Mendelian ratio and supports that the RanBP2 - / - mice were embryonically lethal.	"RanBP2	42	48	Gene_or_geneproduct"	"RanBP2	56	62	Gene_or_geneproduct"	"RanBP2	70	76	Gene_or_geneproduct"	"RanBP2	180	186	Gene_or_geneproduct"	"[{""token"": ""RanBP2"", ""start_span"": 42, ""end_span"": 48, ""type"": ""Gene_or_geneproduct""}, {""token"": ""RanBP2"", ""start_span"": 56, ""end_span"": 62, ""type"": ""Gene_or_geneproduct""}, {""token"": ""RanBP2"", ""start_span"": 70, ""end_span"": 76, ""type"": ""Gene_or_geneproduct""}, {""token"": ""RanBP2"", ""start_span"": 180, ""end_span"": 186, ""type"": ""Gene_or_geneproduct""}]"
Because HKI plays a key role in the production of energy intermediate substrates and HKI is virtually the sole HK isoform expressed in the CNS [ 33, 34], we probed the impact of HKI and RanBP2 reduction in the levels of ATP.	"HKI	8	11	Gene_or_geneproduct"	"HKI	85	88	Gene_or_geneproduct"	"HKI	178	181	Gene_or_geneproduct"	"RanBP2	186	192	Gene_or_geneproduct"	"[{""token"": ""HKI"", ""start_span"": 8, ""end_span"": 11, ""type"": ""Gene_or_geneproduct""}, {""token"": ""HKI"", ""start_span"": 85, ""end_span"": 88, ""type"": ""Gene_or_geneproduct""}, {""token"": ""HKI"", ""start_span"": 178, ""end_span"": 181, ""type"": ""Gene_or_geneproduct""}, {""token"": ""RanBP2"", ""start_span"": 186, ""end_span"": 192, ""type"": ""Gene_or_geneproduct""}]"
In comparison to RanBP2 + / +, RanBP2 + / - mice exhibit a reduction in the expression levels of RanBP2 and HKI but not of other proteins.	"RanBP2	17	23	Gene_or_geneproduct"	"RanBP2	31	37	Gene_or_geneproduct"	"RanBP2	97	103	Gene_or_geneproduct"	"HKI	108	111	Gene_or_geneproduct"	"[{""token"": ""RanBP2"", ""start_span"": 17, ""end_span"": 23, ""type"": ""Gene_or_geneproduct""}, {""token"": ""RanBP2"", ""start_span"": 31, ""end_span"": 37, ""type"": ""Gene_or_geneproduct""}, {""token"": ""RanBP2"", ""start_span"": 97, ""end_span"": 103, ""type"": ""Gene_or_geneproduct""}, {""token"": ""HKI"", ""start_span"": 108, ""end_span"": 111, ""type"": ""Gene_or_geneproduct""}]"
( C) Fasted 6 - to 8 - mo - old RanBP2 + / + and RanBP2 + / - mice have no difference in insulin - mediated glucose uptake as assayed by insulin tolerance test ( n = 5).	"RanBP2	32	38	Gene_or_geneproduct"	"RanBP2	49	55	Gene_or_geneproduct"	"insulin	89	96	Gene_or_geneproduct"	"insulin	137	144	Gene_or_geneproduct"	"[{""token"": ""RanBP2"", ""start_span"": 32, ""end_span"": 38, ""type"": ""Gene_or_geneproduct""}, {""token"": ""RanBP2"", ""start_span"": 49, ""end_span"": 55, ""type"": ""Gene_or_geneproduct""}, {""token"": ""insulin"", ""start_span"": 89, ""end_span"": 96, ""type"": ""Gene_or_geneproduct""}, {""token"": ""insulin"", ""start_span"": 137, ""end_span"": 144, ""type"": ""Gene_or_geneproduct""}]"
Cox11 sequesters HKI by binding to HKI at a site that is distinct from the active site and effectively reduces the availability of [ HKI] tot for catalysis.	"Cox11	0	5	Gene_or_geneproduct"	"HKI	17	20	Gene_or_geneproduct"	"HKI	35	38	Gene_or_geneproduct"	"HKI	133	136	Gene_or_geneproduct"	"[{""token"": ""Cox11"", ""start_span"": 0, ""end_span"": 5, ""type"": ""Gene_or_geneproduct""}, {""token"": ""HKI"", ""start_span"": 17, ""end_span"": 20, ""type"": ""Gene_or_geneproduct""}, {""token"": ""HKI"", ""start_span"": 35, ""end_span"": 38, ""type"": ""Gene_or_geneproduct""}, {""token"": ""HKI"", ""start_span"": 133, ""end_span"": 136, ""type"": ""Gene_or_geneproduct""}]"
The inhibitory property of Cox11 over HKI is suppressed by RanBP2 ( Figure 2C), which by itself has a weak but significant inhibitory activity over HKI ( Figure 2D).	"Cox11	27	32	Gene_or_geneproduct"	"HKI	38	41	Gene_or_geneproduct"	"RanBP2	59	65	Gene_or_geneproduct"	"HKI	148	151	Gene_or_geneproduct"	"[{""token"": ""Cox11"", ""start_span"": 27, ""end_span"": 32, ""type"": ""Gene_or_geneproduct""}, {""token"": ""HKI"", ""start_span"": 38, ""end_span"": 41, ""type"": ""Gene_or_geneproduct""}, {""token"": ""RanBP2"", ""start_span"": 59, ""end_span"": 65, ""type"": ""Gene_or_geneproduct""}, {""token"": ""HKI"", ""start_span"": 148, ""end_span"": 151, ""type"": ""Gene_or_geneproduct""}]"
The data support that the ultimate pathophysiological outcome in HKI, caused by a reduction in RanBP2 levels and its chaperone activity, is the selective degradation of HKI as reflected by the reduced levels of HKI ( and ATP) but not of other mitochondrial and NPC components ( Figure 5).	"HKI	65	68	Gene_or_geneproduct"	"RanBP2	95	101	Gene_or_geneproduct"	"HKI	169	172	Gene_or_geneproduct"	"HKI	211	214	Gene_or_geneproduct"	"[{""token"": ""HKI"", ""start_span"": 65, ""end_span"": 68, ""type"": ""Gene_or_geneproduct""}, {""token"": ""RanBP2"", ""start_span"": 95, ""end_span"": 101, ""type"": ""Gene_or_geneproduct""}, {""token"": ""HKI"", ""start_span"": 169, ""end_span"": 172, ""type"": ""Gene_or_geneproduct""}, {""token"": ""HKI"", ""start_span"": 211, ""end_span"": 214, ""type"": ""Gene_or_geneproduct""}]"
A deficit ( haploinsufficiency) in RanBP2 disturbs the equilibrium between RanBP2, HKI, and Cox11.	"RanBP2	35	41	Gene_or_geneproduct"	"RanBP2	75	81	Gene_or_geneproduct"	"HKI	83	86	Gene_or_geneproduct"	"Cox11	92	97	Gene_or_geneproduct"	"[{""token"": ""RanBP2"", ""start_span"": 35, ""end_span"": 41, ""type"": ""Gene_or_geneproduct""}, {""token"": ""RanBP2"", ""start_span"": 75, ""end_span"": 81, ""type"": ""Gene_or_geneproduct""}, {""token"": ""HKI"", ""start_span"": 83, ""end_span"": 86, ""type"": ""Gene_or_geneproduct""}, {""token"": ""Cox11"", ""start_span"": 92, ""end_span"": 97, ""type"": ""Gene_or_geneproduct""}]"
GST - JX2 ( 2. 2 mu M) was incubated with different tissue extracts ( ~ 2. 0 mg) and the GST - JX2 coprecipitates from seven different tissues were analyzed by Western blot with the antibodies against HKI and Cox11.	"GST	0	3	Gene_or_geneproduct"	"GST	89	92	Gene_or_geneproduct"	"HKI	201	204	Gene_or_geneproduct"	"Cox11	209	214	Gene_or_geneproduct"	"[{""token"": ""GST"", ""start_span"": 0, ""end_span"": 3, ""type"": ""Gene_or_geneproduct""}, {""token"": ""GST"", ""start_span"": 89, ""end_span"": 92, ""type"": ""Gene_or_geneproduct""}, {""token"": ""HKI"", ""start_span"": 201, ""end_span"": 204, ""type"": ""Gene_or_geneproduct""}, {""token"": ""Cox11"", ""start_span"": 209, ""end_span"": 214, ""type"": ""Gene_or_geneproduct""}]"
Moreover, neural crest - specific deletion of the BMP type I receptors Alk2 and Alk3 has been shown to lead to defective aortico - pulmonary septation, among other cardiac defects [ 12, 13].	"BMP	50	53	Gene_or_geneproduct"	"type I receptors	54	70	Gene_or_geneproduct"	"Alk2	71	75	Gene_or_geneproduct"	"Alk3	80	84	Gene_or_geneproduct"	"[{""token"": ""BMP"", ""start_span"": 50, ""end_span"": 53, ""type"": ""Gene_or_geneproduct""}, {""token"": ""type I receptors"", ""start_span"": 54, ""end_span"": 70, ""type"": ""Gene_or_geneproduct""}, {""token"": ""Alk2"", ""start_span"": 71, ""end_span"": 75, ""type"": ""Gene_or_geneproduct""}, {""token"": ""Alk3"", ""start_span"": 80, ""end_span"": 84, ""type"": ""Gene_or_geneproduct""}]"
To inactivate Alk5 in cardiac NCCs, mice homozygous for the floxed Alk5 allele ( Alk5Flox / Flox) [ 21] were crossed with transgenic Wnt1 - Cre mice [ 22], which were also heterozygous for the Alk5 knockout allele ( Alk5KO) allele.	"Alk5	14	18	Gene_or_geneproduct"	"Alk5	67	71	Gene_or_geneproduct"	"Wnt1	133	137	Gene_or_geneproduct"	"Alk5	193	197	Gene_or_geneproduct"	"[{""token"": ""Alk5"", ""start_span"": 14, ""end_span"": 18, ""type"": ""Gene_or_geneproduct""}, {""token"": ""Alk5"", ""start_span"": 67, ""end_span"": 71, ""type"": ""Gene_or_geneproduct""}, {""token"": ""Wnt1"", ""start_span"": 133, ""end_span"": 137, ""type"": ""Gene_or_geneproduct""}, {""token"": ""Alk5"", ""start_span"": 193, ""end_span"": 197, ""type"": ""Gene_or_geneproduct""}]"
To conclude, Alk5 / Wnt1 - Cre mutants consistently displayed PTA, which differed significantly from the characteristic interrupted aortic arch phenotype seen in Tgfbr2 / Wnt1 - Cre mutants [ 8, 9].	"Alk5	13	17	Gene_or_geneproduct"	"Wnt1	20	24	Gene_or_geneproduct"	"Tgfbr2	162	168	Gene_or_geneproduct"	"Wnt1	171	175	Gene_or_geneproduct"	"[{""token"": ""Alk5"", ""start_span"": 13, ""end_span"": 17, ""type"": ""Gene_or_geneproduct""}, {""token"": ""Wnt1"", ""start_span"": 20, ""end_span"": 24, ""type"": ""Gene_or_geneproduct""}, {""token"": ""Tgfbr2"", ""start_span"": 162, ""end_span"": 168, ""type"": ""Gene_or_geneproduct""}, {""token"": ""Wnt1"", ""start_span"": 171, ""end_span"": 175, ""type"": ""Gene_or_geneproduct""}]"
Control ( A), Tgfbr2 / Wnt1 - Cre mutant [ 8] ( B) demonstrating the PTA type A4 ( = truncus arteriosus with interrupted aortic arch [ 30]) and Alk5 / Wnt1 - Cre mutants demonstrating the right - sided ( C) and left - sided ( D) arches of the truncus.	"Tgfbr2	14	20	Gene_or_geneproduct"	"Wnt1	23	27	Gene_or_geneproduct"	"Alk5	144	148	Gene_or_geneproduct"	"Wnt1	151	155	Gene_or_geneproduct"	"[{""token"": ""Tgfbr2"", ""start_span"": 14, ""end_span"": 20, ""type"": ""Gene_or_geneproduct""}, {""token"": ""Wnt1"", ""start_span"": 23, ""end_span"": 27, ""type"": ""Gene_or_geneproduct""}, {""token"": ""Alk5"", ""start_span"": 144, ""end_span"": 148, ""type"": ""Gene_or_geneproduct""}, {""token"": ""Wnt1"", ""start_span"": 151, ""end_span"": 155, ""type"": ""Gene_or_geneproduct""}]"
In Alk2 / Wnt1 - Cre mutants, the rotation of the aortic sac and truncal OFT failed to occur ( Fig. 6M - R) as seen in Alk5 / Wnt1 - Cre mutants.	"Alk2	3	7	Gene_or_geneproduct"	"Wnt1	10	14	Gene_or_geneproduct"	"Alk5	119	123	Gene_or_geneproduct"	"Wnt1	126	130	Gene_or_geneproduct"	"[{""token"": ""Alk2"", ""start_span"": 3, ""end_span"": 7, ""type"": ""Gene_or_geneproduct""}, {""token"": ""Wnt1"", ""start_span"": 10, ""end_span"": 14, ""type"": ""Gene_or_geneproduct""}, {""token"": ""Alk5"", ""start_span"": 119, ""end_span"": 123, ""type"": ""Gene_or_geneproduct""}, {""token"": ""Wnt1"", ""start_span"": 126, ""end_span"": 130, ""type"": ""Gene_or_geneproduct""}]"
However, in Alk2 mutants the 6th pair of the PAAs was grossly hypoplastic, and while the Alk2 / Wnt1 - Cre mutants displayed a noticeable amount of septal tissue between the 4th and 6th PAAs ( Fig. 6M, N), the condensed septal mesenchyme lacking Alk2 failed to extend the prongs into the truncal cushions and to form the AP septum.	"Alk2	12	16	Gene_or_geneproduct"	"Alk2	89	93	Gene_or_geneproduct"	"Wnt1	96	100	Gene_or_geneproduct"	"Alk2	246	250	Gene_or_geneproduct"	"[{""token"": ""Alk2"", ""start_span"": 12, ""end_span"": 16, ""type"": ""Gene_or_geneproduct""}, {""token"": ""Alk2"", ""start_span"": 89, ""end_span"": 93, ""type"": ""Gene_or_geneproduct""}, {""token"": ""Wnt1"", ""start_span"": 96, ""end_span"": 100, ""type"": ""Gene_or_geneproduct""}, {""token"": ""Alk2"", ""start_span"": 246, ""end_span"": 250, ""type"": ""Gene_or_geneproduct""}]"
Frontal sections from distal ( top row) to proximal ( bottom row) of the control ( A - F), Alk5 / Wnt1 - Cre mutant ( G - L) and Alk2 / Wnt1 - Cre mutant ( M - R) samples ( E11. 5).	"Alk5	91	95	Gene_or_geneproduct"	"Wnt1	98	102	Gene_or_geneproduct"	"Alk2	129	133	Gene_or_geneproduct"	"Wnt1	136	140	Gene_or_geneproduct"	"[{""token"": ""Alk5"", ""start_span"": 91, ""end_span"": 95, ""type"": ""Gene_or_geneproduct""}, {""token"": ""Wnt1"", ""start_span"": 98, ""end_span"": 102, ""type"": ""Gene_or_geneproduct""}, {""token"": ""Alk2"", ""start_span"": 129, ""end_span"": 133, ""type"": ""Gene_or_geneproduct""}, {""token"": ""Wnt1"", ""start_span"": 136, ""end_span"": 140, ""type"": ""Gene_or_geneproduct""}]"
In Alk5 / Wnt1 - Cre mutants, the parathyroids remained associated with the thymic primordia, and despite this abnormal rostral location, expression of parathyroid hormone was indistinguishable between Alk5 mutants and controls at E14 ( Fig. 8C, F).	"Alk5	3	7	Gene_or_geneproduct"	"Wnt1	10	14	Gene_or_geneproduct"	"parathyroid hormone	152	171	Gene_or_geneproduct"	"Alk5	202	206	Gene_or_geneproduct"	"[{""token"": ""Alk5"", ""start_span"": 3, ""end_span"": 7, ""type"": ""Gene_or_geneproduct""}, {""token"": ""Wnt1"", ""start_span"": 10, ""end_span"": 14, ""type"": ""Gene_or_geneproduct""}, {""token"": ""parathyroid hormone"", ""start_span"": 152, ""end_span"": 171, ""type"": ""Gene_or_geneproduct""}, {""token"": ""Alk5"", ""start_span"": 202, ""end_span"": 206, ""type"": ""Gene_or_geneproduct""}]"
Our present results suggest that while TGF - beta signaling in cardiac NCCs is predominantly mediated via the ALK5 / TGF - beta RII receptor complex, ALK5 also mediates signaling of other related ligands, which are either directly or indirectly required for appropriate NCC survival.	"TGF - beta	39	49	Gene_or_geneproduct"	"ALK5	110	114	Gene_or_geneproduct"	"TGF - beta RII	117	131	Gene_or_geneproduct"	"ALK5	150	154	Gene_or_geneproduct"	"[{""token"": ""TGF - beta"", ""start_span"": 39, ""end_span"": 49, ""type"": ""Gene_or_geneproduct""}, {""token"": ""ALK5"", ""start_span"": 110, ""end_span"": 114, ""type"": ""Gene_or_geneproduct""}, {""token"": ""TGF - beta RII"", ""start_span"": 117, ""end_span"": 131, ""type"": ""Gene_or_geneproduct""}, {""token"": ""ALK5"", ""start_span"": 150, ""end_span"": 154, ""type"": ""Gene_or_geneproduct""}]"
In fact, it has been shown that, besides TGF - beta RII, ALK5 can also form a complex with the Activin type IIB receptor to activate downstream Smads 2 / 3 [ 18, 31].	"TGF - beta RII	41	55	Gene_or_geneproduct"	"ALK5	57	61	Gene_or_geneproduct"	"Activin type IIB receptor	95	120	Gene_or_geneproduct"	"Smads 2 / 3	144	155	Gene_or_geneproduct"	"[{""token"": ""TGF - beta RII"", ""start_span"": 41, ""end_span"": 55, ""type"": ""Gene_or_geneproduct""}, {""token"": ""ALK5"", ""start_span"": 57, ""end_span"": 61, ""type"": ""Gene_or_geneproduct""}, {""token"": ""Activin type IIB receptor"", ""start_span"": 95, ""end_span"": 120, ""type"": ""Gene_or_geneproduct""}, {""token"": ""Smads 2 / 3"", ""start_span"": 144, ""end_span"": 155, ""type"": ""Gene_or_geneproduct""}]"
The cardiac and pharyngeal defects observed in the NC - specific Alk5 mutants differ significantly from those seen in corresponding mutants lacking the TGF - beta type II receptor, suggesting that signaling mediated by ALK5 is not limited to the classical TGF - beta ligands during cardiac / pharyngeal development.	"Alk5	65	69	Gene_or_geneproduct"	"TGF - beta type II receptor	152	179	Gene_or_geneproduct"	"ALK5	219	223	Gene_or_geneproduct"	"TGF - beta	256	266	Gene_or_geneproduct"	"[{""token"": ""Alk5"", ""start_span"": 65, ""end_span"": 69, ""type"": ""Gene_or_geneproduct""}, {""token"": ""TGF - beta type II receptor"", ""start_span"": 152, ""end_span"": 179, ""type"": ""Gene_or_geneproduct""}, {""token"": ""ALK5"", ""start_span"": 219, ""end_span"": 223, ""type"": ""Gene_or_geneproduct""}, {""token"": ""TGF - beta"", ""start_span"": 256, ""end_span"": 266, ""type"": ""Gene_or_geneproduct""}]"
However, due to complications associated with early embryonic lethality, particularly for Bmp2 and Bmp4, and with functional redundancy among BMP molecules, it has been difficult to decipher the specific roles of these BMP molecules during different stages of limb development.	"Bmp2	90	94	Gene_or_geneproduct"	"Bmp4	99	103	Gene_or_geneproduct"	"BMP	142	145	Gene_or_geneproduct"	"BMP	219	222	Gene_or_geneproduct"	"[{""token"": ""Bmp2"", ""start_span"": 90, ""end_span"": 94, ""type"": ""Gene_or_geneproduct""}, {""token"": ""Bmp4"", ""start_span"": 99, ""end_span"": 103, ""type"": ""Gene_or_geneproduct""}, {""token"": ""BMP"", ""start_span"": 142, ""end_span"": 145, ""type"": ""Gene_or_geneproduct""}, {""token"": ""BMP"", ""start_span"": 219, ""end_span"": 222, ""type"": ""Gene_or_geneproduct""}]"
However, in the condensations that do form, subsequent chondrogenic differentiation proceeds normally even in the absence of BMP2 and BMP7 or BMP2 and BMP4.	"BMP2	125	129	Gene_or_geneproduct"	"BMP7	134	138	Gene_or_geneproduct"	"BMP2	142	146	Gene_or_geneproduct"	"BMP4	151	155	Gene_or_geneproduct"	"[{""token"": ""BMP2"", ""start_span"": 125, ""end_span"": 129, ""type"": ""Gene_or_geneproduct""}, {""token"": ""BMP7"", ""start_span"": 134, ""end_span"": 138, ""type"": ""Gene_or_geneproduct""}, {""token"": ""BMP2"", ""start_span"": 142, ""end_span"": 146, ""type"": ""Gene_or_geneproduct""}, {""token"": ""BMP4"", ""start_span"": 151, ""end_span"": 155, ""type"": ""Gene_or_geneproduct""}]"
We have therefore improved on this type of analysis by removing pairs of these factors ( BMP2 and BMP4 or BMP2 and BMP7) specifically from the developing limb.	"BMP2	89	93	Gene_or_geneproduct"	"BMP4	98	102	Gene_or_geneproduct"	"BMP2	106	110	Gene_or_geneproduct"	"BMP7	115	119	Gene_or_geneproduct"	"[{""token"": ""BMP2"", ""start_span"": 89, ""end_span"": 93, ""type"": ""Gene_or_geneproduct""}, {""token"": ""BMP4"", ""start_span"": 98, ""end_span"": 102, ""type"": ""Gene_or_geneproduct""}, {""token"": ""BMP2"", ""start_span"": 106, ""end_span"": 110, ""type"": ""Gene_or_geneproduct""}, {""token"": ""BMP7"", ""start_span"": 115, ""end_span"": 119, ""type"": ""Gene_or_geneproduct""}]"
If indeed the long - range effects of SHH are indirectly mediated by local production of secondary signals, the leading candidates have been two members of the BMP family, BMP2 and BMP7.	"SHH	38	41	Gene_or_geneproduct"	"BMP	160	163	Gene_or_geneproduct"	"BMP2	172	176	Gene_or_geneproduct"	"BMP7	181	185	Gene_or_geneproduct"	"[{""token"": ""SHH"", ""start_span"": 38, ""end_span"": 41, ""type"": ""Gene_or_geneproduct""}, {""token"": ""BMP"", ""start_span"": 160, ""end_span"": 163, ""type"": ""Gene_or_geneproduct""}, {""token"": ""BMP2"", ""start_span"": 172, ""end_span"": 176, ""type"": ""Gene_or_geneproduct""}, {""token"": ""BMP7"", ""start_span"": 181, ""end_span"": 185, ""type"": ""Gene_or_geneproduct""}]"
BMP2 [ 8] and BMP7 [ 7] can be induced by ectopic SHH and their expression is greatly diminished in the absence of SHH activity [ 9].	"BMP2	0	4	Gene_or_geneproduct"	"BMP7	14	18	Gene_or_geneproduct"	"SHH	50	53	Gene_or_geneproduct"	"SHH	115	118	Gene_or_geneproduct"	"[{""token"": ""BMP2"", ""start_span"": 0, ""end_span"": 4, ""type"": ""Gene_or_geneproduct""}, {""token"": ""BMP7"", ""start_span"": 14, ""end_span"": 18, ""type"": ""Gene_or_geneproduct""}, {""token"": ""SHH"", ""start_span"": 50, ""end_span"": 53, ""type"": ""Gene_or_geneproduct""}, {""token"": ""SHH"", ""start_span"": 115, ""end_span"": 118, ""type"": ""Gene_or_geneproduct""}]"
