Little is known about genetic factors affecting intraocular pressure ( IOP) in mice and other mammals.	"genetic	22	29	Sequence"	"mice	79	83	Organism"	"mammals	94	101	Organism"	"[{""token"": ""genetic"", ""start_span"": 22, ""end_span"": 29, ""type"": ""Sequence""}, {""token"": ""mice"", ""start_span"": 79, ""end_span"": 83, ""type"": ""Organism""}, {""token"": ""mammals"", ""start_span"": 94, ""end_span"": 101, ""type"": ""Organism""}]"
It is becoming increasingly clear that many forms of glaucoma have a genetic component [ 6, 7], and much current research is focused on identifying chromosomal regions and genes that contribute to glaucoma [ 8 - 10].	"genetic	69	76	Sequence"	"chromosomal regions	148	167	Sequence"	"genes	172	177	Sequence"	"[{""token"": ""genetic"", ""start_span"": 69, ""end_span"": 76, ""type"": ""Sequence""}, {""token"": ""chromosomal regions"", ""start_span"": 148, ""end_span"": 167, ""type"": ""Sequence""}, {""token"": ""genes"", ""start_span"": 172, ""end_span"": 177, ""type"": ""Sequence""}]"
Sequencing identified two alleles of Myoc in these mouse strains ( see text).	"alleles	26	33	Sequence"	"Myoc	37	41	Gene_or_geneproduct"	"mouse	51	56	Organism"	"[{""token"": ""alleles"", ""start_span"": 26, ""end_span"": 33, ""type"": ""Sequence""}, {""token"": ""Myoc"", ""start_span"": 37, ""end_span"": 41, ""type"": ""Gene_or_geneproduct""}, {""token"": ""mouse"", ""start_span"": 51, ""end_span"": 56, ""type"": ""Organism""}]"
In contrast to pigmented B6 mice ( Figure 6), the IOPs of the albino B6 mice were not increased at measurement during the dark compared to light period of the day ( P = 0. 6, Figure 10B).	"pigmented	15	24	Chemical"	"mice	28	32	Organism"	"mice	72	76	Organism"	"[{""token"": ""pigmented"", ""start_span"": 15, ""end_span"": 24, ""type"": ""Chemical""}, {""token"": ""mice"", ""start_span"": 28, ""end_span"": 32, ""type"": ""Organism""}, {""token"": ""mice"", ""start_span"": 72, ""end_span"": 76, ""type"": ""Organism""}]"
The molecular mechanisms underlying the diurnal rhythm are not defined but increased aqueous humor production or flow occurs during the period of increased IOP in both rabbits and humans [ 63 - 65].	"molecular	4	13	Chemical"	"rabbits	168	175	Organism"	"humans	180	186	Organism"	"[{""token"": ""molecular"", ""start_span"": 4, ""end_span"": 13, ""type"": ""Chemical""}, {""token"": ""rabbits"", ""start_span"": 168, ""end_span"": 175, ""type"": ""Organism""}, {""token"": ""humans"", ""start_span"": 180, ""end_span"": 186, ""type"": ""Organism""}]"
Previously, a rise of IOP was reported to occur before onset of the dark period in rats [ 21], and rats and rabbits were shown to have higher IOP during the dark period compared to the light period [ 21, 68, 69].	"rats	83	87	Organism"	"rats	99	103	Organism"	"rabbits	108	115	Organism"	"[{""token"": ""rats"", ""start_span"": 83, ""end_span"": 87, ""type"": ""Organism""}, {""token"": ""rats"", ""start_span"": 99, ""end_span"": 103, ""type"": ""Organism""}, {""token"": ""rabbits"", ""start_span"": 108, ""end_span"": 115, ""type"": ""Organism""}]"
In agreement with this finding, circadian regulation of wheel running by light was previously reported in mice lacking rods and cones [ 70].	"mice	106	110	Organism"	"rods	119	123	Cell"	"cones	128	133	Cell"	"[{""token"": ""mice"", ""start_span"": 106, ""end_span"": 110, ""type"": ""Organism""}, {""token"": ""rods"", ""start_span"": 119, ""end_span"": 123, ""type"": ""Cell""}, {""token"": ""cones"", ""start_span"": 128, ""end_span"": 133, ""type"": ""Cell""}]"
There are multiple forms of CA and the CAII isoform is reported to be the predominant form in the ciliary processes [ 71, 72].	"forms	19	24	Sequence"	"CAII	39	43	Gene_or_geneproduct"	"isoform	44	51	Sequence"	"[{""token"": ""forms"", ""start_span"": 19, ""end_span"": 24, ""type"": ""Sequence""}, {""token"": ""CAII"", ""start_span"": 39, ""end_span"": 43, ""type"": ""Gene_or_geneproduct""}, {""token"": ""isoform"", ""start_span"": 44, ""end_span"": 51, ""type"": ""Sequence""}]"
CAIV activity was recently demonstrated in the ciliary processes [ 73] and so our data may support a more substantial role for CAIV compared to CAII in aqueous humor secretion.	"CAIV	0	4	Gene_or_geneproduct"	"CAIV	127	131	Gene_or_geneproduct"	"CAII	144	148	Gene_or_geneproduct"	"[{""token"": ""CAIV"", ""start_span"": 0, ""end_span"": 4, ""type"": ""Gene_or_geneproduct""}, {""token"": ""CAIV"", ""start_span"": 127, ""end_span"": 131, ""type"": ""Gene_or_geneproduct""}, {""token"": ""CAII"", ""start_span"": 144, ""end_span"": 148, ""type"": ""Gene_or_geneproduct""}]"
Tyrosinase is the first enzyme of the pigment production pathway.	"Tyrosinase	0	10	Gene_or_geneproduct"	"enzyme	24	30	Sequence"	"pigment	38	45	Chemical"	"[{""token"": ""Tyrosinase"", ""start_span"": 0, ""end_span"": 10, ""type"": ""Gene_or_geneproduct""}, {""token"": ""enzyme"", ""start_span"": 24, ""end_span"": 30, ""type"": ""Sequence""}, {""token"": ""pigment"", ""start_span"": 38, ""end_span"": 45, ""type"": ""Chemical""}]"
For most experiments, the mice were fed NIH31 ( 6% fat) chow ad libitum, and their water was acidified to pH 2. 8 to 3. 2.	"mice	26	30	Organism"	"chow	56	60	Chemical"	"water	83	88	Chemical"	"[{""token"": ""mice"", ""start_span"": 26, ""end_span"": 30, ""type"": ""Organism""}, {""token"": ""chow"", ""start_span"": 56, ""end_span"": 60, ""type"": ""Chemical""}, {""token"": ""water"", ""start_span"": 83, ""end_span"": 88, ""type"": ""Chemical""}]"
Intraocular pressure ( IOP), C57BL / 6J ( B6), chromosome ( Chr), polymerase chain reaction ( PCR), carbonic anhydrase ( CA)	"chromosome	47	57	GO_ontology"	"Chr	60	63	GO_ontology"	"carbonic	100	108	Chemical"	"[{""token"": ""chromosome"", ""start_span"": 47, ""end_span"": 57, ""type"": ""GO_ontology""}, {""token"": ""Chr"", ""start_span"": 60, ""end_span"": 63, ""type"": ""GO_ontology""}, {""token"": ""carbonic"", ""start_span"": 100, ""end_span"": 108, ""type"": ""Chemical""}]"
Two recent papers provide new evidence relevant to the role of the breast cancer susceptibility gene BRCA2 in DNA repair.	"gene	96	100	Sequence"	"BRCA2	101	106	Gene_or_geneproduct"	"DNA	110	113	Sequence"	"[{""token"": ""gene"", ""start_span"": 96, ""end_span"": 100, ""type"": ""Sequence""}, {""token"": ""BRCA2"", ""start_span"": 101, ""end_span"": 106, ""type"": ""Gene_or_geneproduct""}, {""token"": ""DNA"", ""start_span"": 110, ""end_span"": 113, ""type"": ""Sequence""}]"
BRCA2 appears to function in recombination via interactions with the major eukaryotic recombinase RAD51 [ 1, 2, 3].	"BRCA2	0	5	Gene_or_geneproduct"	"eukaryotic	75	85	Organism"	"RAD51	98	103	Gene_or_geneproduct"	"[{""token"": ""BRCA2"", ""start_span"": 0, ""end_span"": 5, ""type"": ""Gene_or_geneproduct""}, {""token"": ""eukaryotic"", ""start_span"": 75, ""end_span"": 85, ""type"": ""Organism""}, {""token"": ""RAD51"", ""start_span"": 98, ""end_span"": 103, ""type"": ""Gene_or_geneproduct""}]"
BRCA2 was the second breast cancer susceptibility gene to be discovered, and was isolated through positional cloning using data from families with inherited breast cancer [ 4].	"BRCA2	0	5	Gene_or_geneproduct"	"gene	50	54	Sequence"	"positional	98	108	Sequence"	"[{""token"": ""BRCA2"", ""start_span"": 0, ""end_span"": 5, ""type"": ""Gene_or_geneproduct""}, {""token"": ""gene"", ""start_span"": 50, ""end_span"": 54, ""type"": ""Sequence""}, {""token"": ""positional"", ""start_span"": 98, ""end_span"": 108, ""type"": ""Sequence""}]"
The BRC repeats of BRCA2 are responsible for direct RAD51 interaction.	"repeats	8	15	Sequence"	"BRCA2	19	24	Gene_or_geneproduct"	"RAD51	52	57	Gene_or_geneproduct"	"[{""token"": ""repeats"", ""start_span"": 8, ""end_span"": 15, ""type"": ""Sequence""}, {""token"": ""BRCA2"", ""start_span"": 19, ""end_span"": 24, ""type"": ""Gene_or_geneproduct""}, {""token"": ""RAD51"", ""start_span"": 52, ""end_span"": 57, ""type"": ""Gene_or_geneproduct""}]"
Transient transfection of an I - SceI expression vector results in the production of a DSB in the first mutated copy of GFP.	"I - SceI	29	37	Gene_or_geneproduct"	"vector	49	55	Sequence"	"mutated	104	111	Sequence"	"[{""token"": ""I - SceI"", ""start_span"": 29, ""end_span"": 37, ""type"": ""Gene_or_geneproduct""}, {""token"": ""vector"", ""start_span"": 49, ""end_span"": 55, ""type"": ""Sequence""}, {""token"": ""mutated"", ""start_span"": 104, ""end_span"": 111, ""type"": ""Sequence""}]"
This raises the possibility that some or even all of the recombinational repair defect seen in CAPAN - 1 could be due to mutations at non - BRCA2 loci.	"mutations	121	130	Sequence"	"BRCA2	140	145	Gene_or_geneproduct"	"loci	146	150	Sequence"	"[{""token"": ""mutations"", ""start_span"": 121, ""end_span"": 130, ""type"": ""Sequence""}, {""token"": ""BRCA2"", ""start_span"": 140, ""end_span"": 145, ""type"": ""Gene_or_geneproduct""}, {""token"": ""loci"", ""start_span"": 146, ""end_span"": 150, ""type"": ""Sequence""}]"
Taken together, the results indicate that BRCA2 is indeed required for high levels of recombinational repair in both human and mouse.	"BRCA2	42	47	Gene_or_geneproduct"	"human	117	122	Organism"	"mouse	127	132	Organism"	"[{""token"": ""BRCA2"", ""start_span"": 42, ""end_span"": 47, ""type"": ""Gene_or_geneproduct""}, {""token"": ""human"", ""start_span"": 117, ""end_span"": 122, ""type"": ""Organism""}, {""token"": ""mouse"", ""start_span"": 127, ""end_span"": 132, ""type"": ""Organism""}]"
Expression of a single BRC repeat ( BRC4) had previously been reported to act as an inhibitor of DNA repair by Chen et al [ 27].	"repeat	27	33	Sequence"	"inhibitor	84	93	Chemical"	"DNA	97	100	Sequence"	"[{""token"": ""repeat"", ""start_span"": 27, ""end_span"": 33, ""type"": ""Sequence""}, {""token"": ""inhibitor"", ""start_span"": 84, ""end_span"": 93, ""type"": ""Chemical""}, {""token"": ""DNA"", ""start_span"": 97, ""end_span"": 100, ""type"": ""Sequence""}]"
A BRC4 peptide was also reported to inhibit the RAD51 - DNA interaction.	"peptide	7	14	Sequence"	"RAD51	48	53	Gene_or_geneproduct"	"DNA	56	59	Sequence"	"[{""token"": ""peptide"", ""start_span"": 7, ""end_span"": 14, ""type"": ""Sequence""}, {""token"": ""RAD51"", ""start_span"": 48, ""end_span"": 53, ""type"": ""Gene_or_geneproduct""}, {""token"": ""DNA"", ""start_span"": 56, ""end_span"": 59, ""type"": ""Sequence""}]"
The localization of RAD51 was examined in CAPAN - 1 cells, the same human tumor line examined by Moynahan et al [ 24].	"RAD51	20	25	Gene_or_geneproduct"	"cells	52	57	Cell"	"human	68	73	Organism"	"[{""token"": ""RAD51"", ""start_span"": 20, ""end_span"": 25, ""type"": ""Gene_or_geneproduct""}, {""token"": ""cells"", ""start_span"": 52, ""end_span"": 57, ""type"": ""Cell""}, {""token"": ""human"", ""start_span"": 68, ""end_span"": 73, ""type"": ""Organism""}]"
Support for the hypothesis that the observed mislocalization of RAD51 is an indirect consequence of the BRCA2 defect requires reintroduction of functional BRCA2 into CAPAN - 1.	"RAD51	64	69	Gene_or_geneproduct"	"BRCA2	104	109	Gene_or_geneproduct"	"BRCA2	155	160	Gene_or_geneproduct"	"[{""token"": ""RAD51"", ""start_span"": 64, ""end_span"": 69, ""type"": ""Gene_or_geneproduct""}, {""token"": ""BRCA2"", ""start_span"": 104, ""end_span"": 109, ""type"": ""Gene_or_geneproduct""}, {""token"": ""BRCA2"", ""start_span"": 155, ""end_span"": 160, ""type"": ""Gene_or_geneproduct""}]"
An attractive alternative, favored by Davies et al [ 26], is that the association of RAD51 - BRCA2 is required to maintain RAD51 in a form that is in a state of ' readiness ' ( Fig. 2a).	"RAD51	85	90	Gene_or_geneproduct"	"BRCA2	93	98	Gene_or_geneproduct"	"RAD51	123	128	Gene_or_geneproduct"	"[{""token"": ""RAD51"", ""start_span"": 85, ""end_span"": 90, ""type"": ""Gene_or_geneproduct""}, {""token"": ""BRCA2"", ""start_span"": 93, ""end_span"": 98, ""type"": ""Gene_or_geneproduct""}, {""token"": ""RAD51"", ""start_span"": 123, ""end_span"": 128, ""type"": ""Gene_or_geneproduct""}]"
In the absence of this interaction with BRCA2, RAD51 might exist in a form that is not capable of being recruited into a functional repair complex when damage occurs.	"BRCA2	40	45	Gene_or_geneproduct"	"RAD51	47	52	Gene_or_geneproduct"	"complex	139	146	GO_ontology"	"[{""token"": ""BRCA2"", ""start_span"": 40, ""end_span"": 45, ""type"": ""Gene_or_geneproduct""}, {""token"": ""RAD51"", ""start_span"": 47, ""end_span"": 52, ""type"": ""Gene_or_geneproduct""}, {""token"": ""complex"", ""start_span"": 139, ""end_span"": 146, ""type"": ""GO_ontology""}]"
This result could mean that regulatory factors, such as BRCA2, are required to suppress RAD51 - dsDNA interactions to prevent sequestration of RAD51 in a nonfunctional form.	"BRCA2	56	61	Gene_or_geneproduct"	"RAD51	88	93	Gene_or_geneproduct"	"RAD51	143	148	Gene_or_geneproduct"	"[{""token"": ""BRCA2"", ""start_span"": 56, ""end_span"": 61, ""type"": ""Gene_or_geneproduct""}, {""token"": ""RAD51"", ""start_span"": 88, ""end_span"": 93, ""type"": ""Gene_or_geneproduct""}, {""token"": ""RAD51"", ""start_span"": 143, ""end_span"": 148, ""type"": ""Gene_or_geneproduct""}]"
It should be relatively straightforward to determine whether the role of BRCA2 is limited to transporting RAD51 to the nucleus.	"BRCA2	73	78	Gene_or_geneproduct"	"RAD51	106	111	Gene_or_geneproduct"	"nucleus	119	126	GO_ontology"	"[{""token"": ""BRCA2"", ""start_span"": 73, ""end_span"": 78, ""type"": ""Gene_or_geneproduct""}, {""token"": ""RAD51"", ""start_span"": 106, ""end_span"": 111, ""type"": ""Gene_or_geneproduct""}, {""token"": ""nucleus"", ""start_span"": 119, ""end_span"": 126, ""type"": ""GO_ontology""}]"
However, biochemical experiments are needed to determine whether full - length BRCA2 blocks or promotes RAD51 - BRCA2 interaction.	"BRCA2	79	84	Gene_or_geneproduct"	"RAD51	104	109	Gene_or_geneproduct"	"BRCA2	112	117	Gene_or_geneproduct"	"[{""token"": ""BRCA2"", ""start_span"": 79, ""end_span"": 84, ""type"": ""Gene_or_geneproduct""}, {""token"": ""RAD51"", ""start_span"": 104, ""end_span"": 109, ""type"": ""Gene_or_geneproduct""}, {""token"": ""BRCA2"", ""start_span"": 112, ""end_span"": 117, ""type"": ""Gene_or_geneproduct""}]"
Chromosomal DNA is shown as pairs of straight lines, Rad51 as open circles, and BRCA2 as grey bars.	"Chromosomal DNA	0	15	Sequence"	"Rad51	53	58	Gene_or_geneproduct"	"BRCA2	80	85	Gene_or_geneproduct"	"[{""token"": ""Chromosomal DNA"", ""start_span"": 0, ""end_span"": 15, ""type"": ""Sequence""}, {""token"": ""Rad51"", ""start_span"": 53, ""end_span"": 58, ""type"": ""Gene_or_geneproduct""}, {""token"": ""BRCA2"", ""start_span"": 80, ""end_span"": 85, ""type"": ""Gene_or_geneproduct""}]"
We have also tested DsRed1, the novel red fluorescent protein reporter recently cloned from the Discostoma coral by virtue of its homology to GFP.	"protein	54	61	Chemical"	"Discostoma coral	96	112	Organism"	"homology	130	138	Sequence"	"[{""token"": ""protein"", ""start_span"": 54, ""end_span"": 61, ""type"": ""Chemical""}, {""token"": ""Discostoma coral"", ""start_span"": 96, ""end_span"": 112, ""type"": ""Organism""}, {""token"": ""homology"", ""start_span"": 130, ""end_span"": 138, ""type"": ""Sequence""}]"
To this end, we have established lines of ES cells together with viable and fertile mice having widespread expression of either the ECFP or EYFP GFP - variant reporters.	"cells	45	50	Cell"	"mice	84	88	Organism"	"variant	151	158	Sequence"	"[{""token"": ""cells"", ""start_span"": 45, ""end_span"": 50, ""type"": ""Cell""}, {""token"": ""mice"", ""start_span"": 84, ""end_span"": 88, ""type"": ""Organism""}, {""token"": ""variant"", ""start_span"": 151, ""end_span"": 158, ""type"": ""Sequence""}]"
Balanced ( diploid < - > diploid) and polarized ( tetraploid < - > diploid) chimeras comprising combinations of the ECFP and EYFP ES cells and / or embryos, demonstrate that populations of cells expressing each individual reporter can be distinguished within a single animal.	"cells	133	138	Cell"	"cells	189	194	Cell"	"animal	268	274	Organism"	"[{""token"": ""cells"", ""start_span"": 133, ""end_span"": 138, ""type"": ""Cell""}, {""token"": ""cells"", ""start_span"": 189, ""end_span"": 194, ""type"": ""Cell""}, {""token"": ""animal"", ""start_span"": 268, ""end_span"": 274, ""type"": ""Organism""}]"
Both directed and random mutagenesis approaches, including the technologies of transgenesis and gene targeting in ES cells, have become commonplace.	"mutagenesis	25	36	Sequence"	"gene	84	88	Sequence"	"cells	117	122	Cell"	"[{""token"": ""mutagenesis"", ""start_span"": 25, ""end_span"": 36, ""type"": ""Sequence""}, {""token"": ""gene"", ""start_span"": 84, ""end_span"": 88, ""type"": ""Sequence""}, {""token"": ""cells"", ""start_span"": 117, ""end_span"": 122, ""type"": ""Cell""}]"
Dual color imaging of several GFP variant proteins is a very attractive prospect and has become a standard procedure in cell biology [ 7, 8].	"variant	34	41	Sequence"	"proteins	42	50	Chemical"	"cell	120	124	Cell"	"[{""token"": ""variant"", ""start_span"": 34, ""end_span"": 41, ""type"": ""Sequence""}, {""token"": ""proteins"", ""start_span"": 42, ""end_span"": 50, ""type"": ""Chemical""}, {""token"": ""cell"", ""start_span"": 120, ""end_span"": 124, ""type"": ""Cell""}]"
We therefore wished to investigate the feasibility of non - invasive multiple reporter imaging in mice, and as a first step we wanted to ascertain whether we could establish viable and fertile mice with widespread expression of GFP variant reporters.	"mice	98	102	Organism"	"mice	193	197	Organism"	"variant	232	239	Sequence"	"[{""token"": ""mice"", ""start_span"": 98, ""end_span"": 102, ""type"": ""Organism""}, {""token"": ""mice"", ""start_span"": 193, ""end_span"": 197, ""type"": ""Organism""}, {""token"": ""variant"", ""start_span"": 232, ""end_span"": 239, ""type"": ""Sequence""}]"
A breakthrough in the availability of spectrally distinct autofluorescent proteins came with the cloning of six anthozoan fluorescent proteins all having 20 - 30% identity to wtGFP [ 12].	"proteins	74	82	Chemical"	"anthozoan	112	121	Organism"	"proteins	134	142	Chemical"	"[{""token"": ""proteins"", ""start_span"": 74, ""end_span"": 82, ""type"": ""Chemical""}, {""token"": ""anthozoan"", ""start_span"": 112, ""end_span"": 121, ""type"": ""Organism""}, {""token"": ""proteins"", ""start_span"": 134, ""end_span"": 142, ""type"": ""Chemical""}]"
We therefore also tested this novel red fluorescent protein ( RFP) in ES cells and mice.	"protein	52	59	Chemical"	"cells	73	78	Cell"	"mice	83	87	Organism"	"[{""token"": ""protein"", ""start_span"": 52, ""end_span"": 59, ""type"": ""Chemical""}, {""token"": ""cells"", ""start_span"": 73, ""end_span"": 78, ""type"": ""Cell""}, {""token"": ""mice"", ""start_span"": 83, ""end_span"": 87, ""type"": ""Organism""}]"
The availability of homozygous animals demonstrated that both reporter gene expression and the site of transgene integration were developmentally neutral.	"animals	31	38	Organism"	"gene	71	75	Sequence"	"site of transgene integration	95	124	Sequence"	"[{""token"": ""animals"", ""start_span"": 31, ""end_span"": 38, ""type"": ""Organism""}, {""token"": ""gene"", ""start_span"": 71, ""end_span"": 75, ""type"": ""Sequence""}, {""token"": ""site of transgene integration"", ""start_span"": 95, ""end_span"": 124, ""type"": ""Sequence""}]"
Transgenic animals are hemizygous for either the CK6 / ECFP or YC5 / EYFP transgenes.	"Transgenic	0	10	Sequence"	"animals	11	18	Organism"	"transgenes	74	84	Sequence"	"[{""token"": ""Transgenic"", ""start_span"": 0, ""end_span"": 10, ""type"": ""Sequence""}, {""token"": ""animals"", ""start_span"": 11, ""end_span"": 18, ""type"": ""Organism""}, {""token"": ""transgenes"", ""start_span"": 74, ""end_span"": 84, ""type"": ""Sequence""}]"
Even though our RFP transgenic ES cell lines failed to maintain strong uniform expression with in vitro passage, we selected three lines exhibiting the most robust expression for making chimeras, in order to ascertain whether we could achieve, or possibly recover, RFP expression in animals.	"transgenic	20	30	Sequence"	"cell	34	38	Cell"	"animals	283	290	Organism"	"[{""token"": ""transgenic"", ""start_span"": 20, ""end_span"": 30, ""type"": ""Sequence""}, {""token"": ""cell"", ""start_span"": 34, ""end_span"": 38, ""type"": ""Cell""}, {""token"": ""animals"", ""start_span"": 283, ""end_span"": 290, ""type"": ""Organism""}]"
Even though they had lost their characteristic ES cell morphology all three RFP + ES cell lines went gemline as detected by coat color and PCR for the DsRed1 transgene ( data not shown).	"cell	50	54	Cell"	"cell	85	89	Cell"	"transgene	158	167	Sequence"	"[{""token"": ""cell"", ""start_span"": 50, ""end_span"": 54, ""type"": ""Cell""}, {""token"": ""cell"", ""start_span"": 85, ""end_span"": 89, ""type"": ""Cell""}, {""token"": ""transgene"", ""start_span"": 158, ""end_span"": 167, ""type"": ""Sequence""}]"
A non - fluorescent morula was aggregated with two clumps of ES cells, one carrying the CK6 / ECFP transgene ( ECFP +) and the other carrying the YC5 / EYFP transgene ( EYFP +).	"cells	64	69	Cell"	"transgene	99	108	Sequence"	"transgene	157	166	Sequence"	"[{""token"": ""cells"", ""start_span"": 64, ""end_span"": 69, ""type"": ""Cell""}, {""token"": ""transgene"", ""start_span"": 99, ""end_span"": 108, ""type"": ""Sequence""}, {""token"": ""transgene"", ""start_span"": 157, ""end_span"": 166, ""type"": ""Sequence""}]"
Since we were unable to obtain ES cells, embryos or mice with widespread expression of a RFP ( DsRed1) we conclude that this reporter is not developmentally neutral or that its expression cannot be sustained at levels high enough for detection, and as such is not as versatile as other gene - based fluorescent reporters.	"cells	34	39	Cell"	"mice	52	56	Organism"	"gene	286	290	Sequence"	"[{""token"": ""cells"", ""start_span"": 34, ""end_span"": 39, ""type"": ""Cell""}, {""token"": ""mice"", ""start_span"": 52, ""end_span"": 56, ""type"": ""Organism""}, {""token"": ""gene"", ""start_span"": 286, ""end_span"": 290, ""type"": ""Sequence""}]"
All 5 ' primers contain a Kozak consensus translation initiation site upstream of the ATG for increased translation efficiency in eukaryotic cells [ 17].	"5 ' primers	4	15	Sequence"	"consensus translation initiation site	32	69	Sequence"	"eukaryotic cells	130	146	Cell"	"[{""token"": ""5 ' primers"", ""start_span"": 4, ""end_span"": 15, ""type"": ""Sequence""}, {""token"": ""consensus translation initiation site"", ""start_span"": 32, ""end_span"": 69, ""type"": ""Sequence""}, {""token"": ""eukaryotic cells"", ""start_span"": 130, ""end_span"": 146, ""type"": ""Cell""}]"
Clones were screened for strong, stable, and homogenous transgene expression during culture in the absence of drug selection.	"Clones	0	6	Sequence"	"transgene	56	65	Sequence"	"drug	110	114	Chemical"	"[{""token"": ""Clones"", ""start_span"": 0, ""end_span"": 6, ""type"": ""Sequence""}, {""token"": ""transgene"", ""start_span"": 56, ""end_span"": 65, ""type"": ""Sequence""}, {""token"": ""drug"", ""start_span"": 110, ""end_span"": 114, ""type"": ""Chemical""}]"
The cyan and yellow fluorescent protein - expressing mice described here have been acquired by, and are available from, the Jackson Laboratory Induced Mutant Resource.	"protein	32	39	Chemical"	"mice	53	57	Organism"	"Mutant	151	157	Sequence"	"[{""token"": ""protein"", ""start_span"": 32, ""end_span"": 39, ""type"": ""Chemical""}, {""token"": ""mice"", ""start_span"": 53, ""end_span"": 57, ""type"": ""Organism""}, {""token"": ""Mutant"", ""start_span"": 151, ""end_span"": 157, ""type"": ""Sequence""}]"
Brn3c null mutant mice show long - term, incomplete retention of some afferent inner ear innervation	"Brn3c	0	5	Gene_or_geneproduct"	"mutant	11	17	Sequence"	"mice	18	22	Organism"	"[{""token"": ""Brn3c"", ""start_span"": 0, ""end_span"": 5, ""type"": ""Gene_or_geneproduct""}, {""token"": ""mutant"", ""start_span"": 11, ""end_span"": 17, ""type"": ""Sequence""}, {""token"": ""mice"", ""start_span"": 18, ""end_span"": 22, ""type"": ""Organism""}]"
This partial development of hair cells could lead to enough neurotrophin expression to sustain sensory neurons through embryonic development.	"hair cells	28	38	Cell"	"neurotrophin	60	72	Gene_or_geneproduct"	"sensory neurons	95	110	Cell"	"[{""token"": ""hair cells"", ""start_span"": 28, ""end_span"": 38, ""type"": ""Cell""}, {""token"": ""neurotrophin"", ""start_span"": 60, ""end_span"": 72, ""type"": ""Gene_or_geneproduct""}, {""token"": ""sensory neurons"", ""start_span"": 95, ""end_span"": 110, ""type"": ""Cell""}]"
We have therefore investigated in these mutants the patterns of innervation and of expression of known neurotrophins.	"mutants	40	47	Sequence"	"known	97	102	Sequence"	"neurotrophins	103	116	Gene_or_geneproduct"	"[{""token"": ""mutants"", ""start_span"": 40, ""end_span"": 47, ""type"": ""Sequence""}, {""token"": ""known"", ""start_span"": 97, ""end_span"": 102, ""type"": ""Sequence""}, {""token"": ""neurotrophins"", ""start_span"": 103, ""end_span"": 116, ""type"": ""Gene_or_geneproduct""}]"
1% of myosin VIIa - positive immature hair cells are present in the mutant cochlea, concentrated in the base.	"myosin VIIa	6	17	Gene_or_geneproduct"	"hair cells	38	48	Cell"	"mutant	68	74	Sequence"	"[{""token"": ""myosin VIIa"", ""start_span"": 6, ""end_span"": 17, ""type"": ""Gene_or_geneproduct""}, {""token"": ""hair cells"", ""start_span"": 38, ""end_span"": 48, ""type"": ""Cell""}, {""token"": ""mutant"", ""start_span"": 68, ""end_span"": 74, ""type"": ""Sequence""}]"
