29 / SvJae ES cells were electroporated with the Flox construct linearized with PmeI, and puromycin resistant clones were analyzed as described ( Figure 2).	"cells	14	19	Cell"	"construct	54	63	Sequence"	"puromycin	90	99	Chemical"	"[{""token"": ""cells"", ""start_span"": 14, ""end_span"": 19, ""type"": ""Cell""}, {""token"": ""construct"", ""start_span"": 54, ""end_span"": 63, ""type"": ""Sequence""}, {""token"": ""puromycin"", ""start_span"": 90, ""end_span"": 99, ""type"": ""Chemical""}]"
p53 + / GFP ES clones were analyzed by western blot with an antibody against p53, and found to express an additional band at the expected size ( ca. 80 kDa).	"p53	0	3	Gene_or_geneproduct"	"antibody	60	68	GO_ontology"	"p53	77	80	Gene_or_geneproduct"	"[{""token"": ""p53"", ""start_span"": 0, ""end_span"": 3, ""type"": ""Gene_or_geneproduct""}, {""token"": ""antibody"", ""start_span"": 60, ""end_span"": 68, ""type"": ""GO_ontology""}, {""token"": ""p53"", ""start_span"": 77, ""end_span"": 80, ""type"": ""Gene_or_geneproduct""}]"
As expected, the PRD deletion correlated with lower expression levels: p53 Delta PGFP was much less abundant than p53WT in all p53 + / Delta PGFP clones ( Figure 3B).	"deletion	21	29	Sequence"	"p53	71	74	Gene_or_geneproduct"	"+	131	132	Sequence"	"[{""token"": ""deletion"", ""start_span"": 21, ""end_span"": 29, ""type"": ""Sequence""}, {""token"": ""p53"", ""start_span"": 71, ""end_span"": 74, ""type"": ""Gene_or_geneproduct""}, {""token"": ""+"", ""start_span"": 131, ""end_span"": 132, ""type"": ""Sequence""}]"
Importantly, this allowed us to generate p53RMCE / - MEFs, which were used to test RMCE at the p53 locus in somatic cells.	"p53	41	44	Gene_or_geneproduct"	"locus	99	104	Sequence"	"cells	116	121	Cell"	"[{""token"": ""p53"", ""start_span"": 41, ""end_span"": 44, ""type"": ""Gene_or_geneproduct""}, {""token"": ""locus"", ""start_span"": 99, ""end_span"": 104, ""type"": ""Sequence""}, {""token"": ""cells"", ""start_span"": 116, ""end_span"": 121, ""type"": ""Cell""}]"
RMCE with p53GFP in ES cells showed that p53GFP is expressed at high levels ( Figure 3A), and as mentioned before, the p53 pathway that can be activated in MEFs is not readily activated in ES cells ( 18).	"cells	23	28	Cell"	"p53	41	44	Gene_or_geneproduct"	"cells	192	197	Cell"	"[{""token"": ""cells"", ""start_span"": 23, ""end_span"": 28, ""type"": ""Cell""}, {""token"": ""p53"", ""start_span"": 41, ""end_span"": 44, ""type"": ""Gene_or_geneproduct""}, {""token"": ""cells"", ""start_span"": 192, ""end_span"": 197, ""type"": ""Cell""}]"
To test this possibility, p53RMCE / - MEFs were electroporated with the p53GFP replacement construct with or without a Cre - expression plasmid, then analyzed by fluorescence microscopy 48 h after electroporation.	"replacement	79	90	Sequence"	"construct	91	100	Sequence"	"plasmid	136	143	Sequence"	"[{""token"": ""replacement"", ""start_span"": 79, ""end_span"": 90, ""type"": ""Sequence""}, {""token"": ""construct"", ""start_span"": 91, ""end_span"": 100, ""type"": ""Sequence""}, {""token"": ""plasmid"", ""start_span"": 136, ""end_span"": 143, ""type"": ""Sequence""}]"
We observed a few fluorescent cells only when the Cre expression plasmid was co - electroporated, suggesting that such cells resulted from RMCE.	"cells	30	35	Cell"	"plasmid	65	72	Sequence"	"cells	119	124	Cell"	"[{""token"": ""cells"", ""start_span"": 30, ""end_span"": 35, ""type"": ""Cell""}, {""token"": ""plasmid"", ""start_span"": 65, ""end_span"": 72, ""type"": ""Sequence""}, {""token"": ""cells"", ""start_span"": 119, ""end_span"": 124, ""type"": ""Cell""}]"
Importantly, the rare fluorescent cells had a flat, ' fried - egg ' appearance typical of senescent cells ( Figure 5A), and when plates were observed 5 days later, the cells had detached.	"cells	34	39	Cell"	"cells	100	105	Cell"	"cells	168	173	Cell"	"[{""token"": ""cells"", ""start_span"": 34, ""end_span"": 39, ""type"": ""Cell""}, {""token"": ""cells"", ""start_span"": 100, ""end_span"": 105, ""type"": ""Cell""}, {""token"": ""cells"", ""start_span"": 168, ""end_span"": 173, ""type"": ""Cell""}]"
Likewise, we found that irradiation doses that arrested p53RMCE / - MEFs ( which express a wild - type p53 from the RMCE - ready locus, see Figure 2) did not arrest p53 Delta PGFP / - MEFs ( Figure 5C).	"wild - type	91	102	Sequence"	"p53	103	106	Gene_or_geneproduct"	"locus	129	134	Sequence"	"[{""token"": ""wild - type"", ""start_span"": 91, ""end_span"": 102, ""type"": ""Sequence""}, {""token"": ""p53"", ""start_span"": 103, ""end_span"": 106, ""type"": ""Gene_or_geneproduct""}, {""token"": ""locus"", ""start_span"": 129, ""end_span"": 134, ""type"": ""Sequence""}]"
Bradley for the Puro Delta TK gene and SNLPuro - 7 / 4 cells, P Soriano for the DTA gene, G.	"gene	30	34	Sequence"	"cells	55	60	Cell"	"gene	84	88	Sequence"	"[{""token"": ""gene"", ""start_span"": 30, ""end_span"": 34, ""type"": ""Sequence""}, {""token"": ""cells"", ""start_span"": 55, ""end_span"": 60, ""type"": ""Cell""}, {""token"": ""gene"", ""start_span"": 84, ""end_span"": 88, ""type"": ""Sequence""}]"
Generating ES cells with a p53 RMCE - ready locus.	"cells	14	19	Cell"	"p53	27	30	Gene_or_geneproduct"	"locus	44	49	Sequence"	"[{""token"": ""cells"", ""start_span"": 14, ""end_span"": 19, ""type"": ""Cell""}, {""token"": ""p53"", ""start_span"": 27, ""end_span"": 30, ""type"": ""Gene_or_geneproduct""}, {""token"": ""locus"", ""start_span"": 44, ""end_span"": 49, ""type"": ""Sequence""}]"
The absence of bands of aberrant size in Southerns also indicated that the exchange plasmid was neither rearranged nor inserted at ectopic sites.	"plasmid	84	91	Sequence"	"inserted	119	127	Sequence"	"sites	139	144	Sequence"	"[{""token"": ""plasmid"", ""start_span"": 84, ""end_span"": 91, ""type"": ""Sequence""}, {""token"": ""inserted"", ""start_span"": 119, ""end_span"": 127, ""type"": ""Sequence""}, {""token"": ""sites"", ""start_span"": 139, ""end_span"": 144, ""type"": ""Sequence""}]"
p53RMCE / + ES cells were injected into blastocysts to generate chimeric mice.	"+	10	11	Sequence"	"cells	15	20	Cell"	"mice	73	77	Organism"	"[{""token"": ""+"", ""start_span"": 10, ""end_span"": 11, ""type"": ""Sequence""}, {""token"": ""cells"", ""start_span"": 15, ""end_span"": 20, ""type"": ""Cell""}, {""token"": ""mice"", ""start_span"": 73, ""end_span"": 77, ""type"": ""Organism""}]"
Chimeras ( > 80%) were then mated with p53 + / - mice ( Taconic) and MEFs were prepared.	"p53	39	42	Gene_or_geneproduct"	"+	43	44	Sequence"	"mice	49	53	Organism"	"[{""token"": ""p53"", ""start_span"": 39, ""end_span"": 42, ""type"": ""Gene_or_geneproduct""}, {""token"": ""+"", ""start_span"": 43, ""end_span"": 44, ""type"": ""Sequence""}, {""token"": ""mice"", ""start_span"": 49, ""end_span"": 53, ""type"": ""Organism""}]"
( A) RMCE with the p53GFP plasmid leads to the transient observation of cells with intense nuclear fluorescence.	"plasmid	26	33	Sequence"	"cells	72	77	Cell"	"nuclear	91	98	GO_ontology"	"[{""token"": ""plasmid"", ""start_span"": 26, ""end_span"": 33, ""type"": ""Sequence""}, {""token"": ""cells"", ""start_span"": 72, ""end_span"": 77, ""type"": ""Cell""}, {""token"": ""nuclear"", ""start_span"": 91, ""end_span"": 98, ""type"": ""GO_ontology""}]"
PCR with primers d and e ( Figure 3B) indicated that 9 / 22 ganciclovir - resistant clones integrated the Delta P mutation [ top row, a representative analysis of 10 clones ( Q - Z) is shown].	"primers	9	16	Sequence"	"integrated	91	101	Sequence"	"mutation	114	122	Sequence"	"[{""token"": ""primers"", ""start_span"": 9, ""end_span"": 16, ""type"": ""Sequence""}, {""token"": ""integrated"", ""start_span"": 91, ""end_span"": 101, ""type"": ""Sequence""}, {""token"": ""mutation"", ""start_span"": 114, ""end_span"": 122, ""type"": ""Sequence""}]"
Note that the p53RMCE locus encodes a WT p53.	"locus	22	27	Sequence"	"WT	38	40	Sequence"	"p53	41	44	Gene_or_geneproduct"	"[{""token"": ""locus"", ""start_span"": 22, ""end_span"": 27, ""type"": ""Sequence""}, {""token"": ""WT"", ""start_span"": 38, ""end_span"": 40, ""type"": ""Sequence""}, {""token"": ""p53"", ""start_span"": 41, ""end_span"": 44, ""type"": ""Gene_or_geneproduct""}]"
Importantly, a phenotypic read - out of the p53 Delta PGFP mutation in MEFs, if it had been performed after targeting in fibroblasts by homologous recombination, would have required two rounds of inefficient targeting to target both p53 alleles.	"mutation	59	67	Sequence"	"p53	233	236	Gene_or_geneproduct"	"alleles	237	244	Sequence"	"[{""token"": ""mutation"", ""start_span"": 59, ""end_span"": 67, ""type"": ""Sequence""}, {""token"": ""p53"", ""start_span"": 233, ""end_span"": 236, ""type"": ""Gene_or_geneproduct""}, {""token"": ""alleles"", ""start_span"": 237, ""end_span"": 244, ""type"": ""Sequence""}]"
The Ran - binding protein 2 ( RanBP2) is a large multimodular and pleiotropic protein.	"Ran - binding protein 2	4	27	Gene_or_geneproduct"	"RanBP2	30	36	Gene_or_geneproduct"	"protein	78	85	Chemical"	"[{""token"": ""Ran - binding protein 2"", ""start_span"": 4, ""end_span"": 27, ""type"": ""Gene_or_geneproduct""}, {""token"": ""RanBP2"", ""start_span"": 30, ""end_span"": 36, ""type"": ""Gene_or_geneproduct""}, {""token"": ""protein"", ""start_span"": 78, ""end_span"": 85, ""type"": ""Chemical""}]"
Several molecular partners with distinct functions interacting specifically with selective modules of RanBP2 have been identified.	"molecular	8	17	Chemical"	"modules	91	98	Sequence"	"RanBP2	102	108	Gene_or_geneproduct"	"[{""token"": ""molecular"", ""start_span"": 8, ""end_span"": 17, ""type"": ""Chemical""}, {""token"": ""modules"", ""start_span"": 91, ""end_span"": 98, ""type"": ""Sequence""}, {""token"": ""RanBP2"", ""start_span"": 102, ""end_span"": 108, ""type"": ""Gene_or_geneproduct""}]"
Here, we report the identification of two novel partners of RanBP2 and a novel physiological role of RanBP2 in a mouse model.	"RanBP2	60	66	Gene_or_geneproduct"	"RanBP2	101	107	Gene_or_geneproduct"	"mouse	113	118	Organism"	"[{""token"": ""RanBP2"", ""start_span"": 60, ""end_span"": 66, ""type"": ""Gene_or_geneproduct""}, {""token"": ""RanBP2"", ""start_span"": 101, ""end_span"": 107, ""type"": ""Gene_or_geneproduct""}, {""token"": ""mouse"", ""start_span"": 113, ""end_span"": 118, ""type"": ""Organism""}]"
Cox11 partially colocalizes with HKI, thus supporting additional and distinct roles in cell function.	"Cox11	0	5	Gene_or_geneproduct"	"HKI	33	36	Gene_or_geneproduct"	"cell	87	91	Cell"	"[{""token"": ""Cox11"", ""start_span"": 0, ""end_span"": 5, ""type"": ""Gene_or_geneproduct""}, {""token"": ""HKI"", ""start_span"": 33, ""end_span"": 36, ""type"": ""Gene_or_geneproduct""}, {""token"": ""cell"", ""start_span"": 87, ""end_span"": 91, ""type"": ""Cell""}]"
The authors found that RanBP2 exhibits chaperone activity toward HKI and Cox11.	"RanBP2	23	29	Gene_or_geneproduct"	"HKI	65	68	Gene_or_geneproduct"	"Cox11	73	78	Gene_or_geneproduct"	"[{""token"": ""RanBP2"", ""start_span"": 23, ""end_span"": 29, ""type"": ""Gene_or_geneproduct""}, {""token"": ""HKI"", ""start_span"": 65, ""end_span"": 68, ""type"": ""Gene_or_geneproduct""}, {""token"": ""Cox11"", ""start_span"": 73, ""end_span"": 78, ""type"": ""Gene_or_geneproduct""}]"
RanBP2 and Cox11 profoundly modulate HKI activity.	"RanBP2	0	6	Gene_or_geneproduct"	"Cox11	11	16	Gene_or_geneproduct"	"HKI	37	40	Gene_or_geneproduct"	"[{""token"": ""RanBP2"", ""start_span"": 0, ""end_span"": 6, ""type"": ""Gene_or_geneproduct""}, {""token"": ""Cox11"", ""start_span"": 11, ""end_span"": 16, ""type"": ""Gene_or_geneproduct""}, {""token"": ""HKI"", ""start_span"": 37, ""end_span"": 40, ""type"": ""Gene_or_geneproduct""}]"
The specific interaction of RanBP2 with a diverse set of partners likely reflects a pleiotropic role of RanBP2 in cell function, possibly through the integration of multiple pathways.	"RanBP2	28	34	Gene_or_geneproduct"	"RanBP2	104	110	Gene_or_geneproduct"	"cell	114	118	Cell"	"[{""token"": ""RanBP2"", ""start_span"": 28, ""end_span"": 34, ""type"": ""Gene_or_geneproduct""}, {""token"": ""RanBP2"", ""start_span"": 104, ""end_span"": 110, ""type"": ""Gene_or_geneproduct""}, {""token"": ""cell"", ""start_span"": 114, ""end_span"": 118, ""type"": ""Cell""}]"
These data suggest that deficits in RanBP2 and parkin may share ( patho) physiological pathways and support a multifaceted role of RanBP2.	"RanBP2	36	42	Gene_or_geneproduct"	"parkin	47	53	Gene_or_geneproduct"	"RanBP2	131	137	Gene_or_geneproduct"	"[{""token"": ""RanBP2"", ""start_span"": 36, ""end_span"": 42, ""type"": ""Gene_or_geneproduct""}, {""token"": ""parkin"", ""start_span"": 47, ""end_span"": 53, ""type"": ""Gene_or_geneproduct""}, {""token"": ""RanBP2"", ""start_span"": 131, ""end_span"": 137, ""type"": ""Gene_or_geneproduct""}]"
Yet clear functions of RanBP2 in animal and cell physiology remain elusive.	"RanBP2	23	29	Gene_or_geneproduct"	"animal	33	39	Organism"	"cell	44	48	Cell"	"[{""token"": ""RanBP2"", ""start_span"": 23, ""end_span"": 29, ""type"": ""Gene_or_geneproduct""}, {""token"": ""animal"", ""start_span"": 33, ""end_span"": 39, ""type"": ""Organism""}, {""token"": ""cell"", ""start_span"": 44, ""end_span"": 48, ""type"": ""Cell""}]"
The LD of RanBP2 Interacts with Cox11 and HKI	"RanBP2	10	16	Gene_or_geneproduct"	"Cox11	32	37	Gene_or_geneproduct"	"HKI	42	45	Gene_or_geneproduct"	"[{""token"": ""RanBP2"", ""start_span"": 10, ""end_span"": 16, ""type"": ""Gene_or_geneproduct""}, {""token"": ""Cox11"", ""start_span"": 32, ""end_span"": 37, ""type"": ""Gene_or_geneproduct""}, {""token"": ""HKI"", ""start_span"": 42, ""end_span"": 45, ""type"": ""Gene_or_geneproduct""}]"
The LD of RanBP2 Interacts with Cox11 and HKI	"RanBP2	10	16	Gene_or_geneproduct"	"Cox11	32	37	Gene_or_geneproduct"	"HKI	42	45	Gene_or_geneproduct"	"[{""token"": ""RanBP2"", ""start_span"": 10, ""end_span"": 16, ""type"": ""Gene_or_geneproduct""}, {""token"": ""Cox11"", ""start_span"": 32, ""end_span"": 37, ""type"": ""Gene_or_geneproduct""}, {""token"": ""HKI"", ""start_span"": 42, ""end_span"": 45, ""type"": ""Gene_or_geneproduct""}]"
( B) Sequence alignment of murine and yeast Cox11.	"Sequence	5	13	Sequence"	"murine	27	33	Organism"	"yeast Cox11	38	49	Gene_or_geneproduct"	"[{""token"": ""Sequence"", ""start_span"": 5, ""end_span"": 13, ""type"": ""Sequence""}, {""token"": ""murine"", ""start_span"": 27, ""end_span"": 33, ""type"": ""Organism""}, {""token"": ""yeast Cox11"", ""start_span"": 38, ""end_span"": 49, ""type"": ""Gene_or_geneproduct""}]"
The yeast Cox11 C - and N - terminal domains are poorly conserved.	"yeast Cox11	4	15	Gene_or_geneproduct"	"C - and N - terminal domains	16	44	Sequence"	"conserved	56	65	Sequence"	"[{""token"": ""yeast Cox11"", ""start_span"": 4, ""end_span"": 15, ""type"": ""Gene_or_geneproduct""}, {""token"": ""C - and N - terminal domains"", ""start_span"": 16, ""end_span"": 44, ""type"": ""Sequence""}, {""token"": ""conserved"", ""start_span"": 56, ""end_span"": 65, ""type"": ""Sequence""}]"
Optimal interaction between the LD and Cox11 occurred in the presence of constructs comprising both the complete LD and Cox11.	"Cox11	39	44	Gene_or_geneproduct"	"constructs	73	83	Sequence"	"Cox11	120	125	Gene_or_geneproduct"	"[{""token"": ""Cox11"", ""start_span"": 39, ""end_span"": 44, ""type"": ""Gene_or_geneproduct""}, {""token"": ""constructs"", ""start_span"": 73, ""end_span"": 83, ""type"": ""Sequence""}, {""token"": ""Cox11"", ""start_span"": 120, ""end_span"": 125, ""type"": ""Gene_or_geneproduct""}]"
Lanes 5, 6, and 7 are control immunoprecipitation reactions with different antibodies against the RanBP2 domains, KBD, ZnF, and XAFXFG of nucleoporins.	"antibodies	75	85	GO_ontology"	"RanBP2	98	104	Gene_or_geneproduct"	"domains	105	112	Sequence"	"[{""token"": ""antibodies"", ""start_span"": 75, ""end_span"": 85, ""type"": ""GO_ontology""}, {""token"": ""RanBP2"", ""start_span"": 98, ""end_span"": 104, ""type"": ""Gene_or_geneproduct""}, {""token"": ""domains"", ""start_span"": 105, ""end_span"": 112, ""type"": ""Sequence""}]"
( F) Reciprocal coimmunoprecipitation of HKI with antibodies against RanBP2 ( used and shown in ( E)).	"HKI	41	44	Gene_or_geneproduct"	"antibodies	50	60	GO_ontology"	"RanBP2	69	75	Gene_or_geneproduct"	"[{""token"": ""HKI"", ""start_span"": 41, ""end_span"": 44, ""type"": ""Gene_or_geneproduct""}, {""token"": ""antibodies"", ""start_span"": 50, ""end_span"": 60, ""type"": ""GO_ontology""}, {""token"": ""RanBP2"", ""start_span"": 69, ""end_span"": 75, ""type"": ""Gene_or_geneproduct""}]"
Then, we evaluated the effect of the LD of RanBP2 on the HK activity in the presence of a fixed inhibitory concentration of Cox11, saturating concentration of glucose substrate, and increasing concentrations of LD.	"RanBP2	43	49	Gene_or_geneproduct"	"Cox11	124	129	Gene_or_geneproduct"	"glucose	159	166	Chemical"	"[{""token"": ""RanBP2"", ""start_span"": 43, ""end_span"": 49, ""type"": ""Gene_or_geneproduct""}, {""token"": ""Cox11"", ""start_span"": 124, ""end_span"": 129, ""type"": ""Gene_or_geneproduct""}, {""token"": ""glucose"", ""start_span"": 159, ""end_span"": 166, ""type"": ""Chemical""}]"
Effect of Cox11 and RanBP2 on HKI Activity	"Cox11	10	15	Gene_or_geneproduct"	"RanBP2	20	26	Gene_or_geneproduct"	"HKI	30	33	Gene_or_geneproduct"	"[{""token"": ""Cox11"", ""start_span"": 10, ""end_span"": 15, ""type"": ""Gene_or_geneproduct""}, {""token"": ""RanBP2"", ""start_span"": 20, ""end_span"": 26, ""type"": ""Gene_or_geneproduct""}, {""token"": ""HKI"", ""start_span"": 30, ""end_span"": 33, ""type"": ""Gene_or_geneproduct""}]"
( A) Saturation kinetics, rate versus glucose of HKI ( 0. 24 mu g) in the absence ( solid circles) and presence of Cox11 ( open circles, 0. 25 nM; solid triangles, 7. 5 nM).	"glucose	38	45	Chemical"	"HKI	49	52	Gene_or_geneproduct"	"Cox11	115	120	Gene_or_geneproduct"	"[{""token"": ""glucose"", ""start_span"": 38, ""end_span"": 45, ""type"": ""Chemical""}, {""token"": ""HKI"", ""start_span"": 49, ""end_span"": 52, ""type"": ""Gene_or_geneproduct""}, {""token"": ""Cox11"", ""start_span"": 115, ""end_span"": 120, ""type"": ""Gene_or_geneproduct""}]"
( C) HKI rate is plotted as a function of LD concentration at saturating glucose and fixed Cox11 ( 7. 5 nM) concentrations.	"HKI	5	8	Gene_or_geneproduct"	"glucose	73	80	Chemical"	"Cox11	91	96	Gene_or_geneproduct"	"[{""token"": ""HKI"", ""start_span"": 5, ""end_span"": 8, ""type"": ""Gene_or_geneproduct""}, {""token"": ""glucose"", ""start_span"": 73, ""end_span"": 80, ""type"": ""Chemical""}, {""token"": ""Cox11"", ""start_span"": 91, ""end_span"": 96, ""type"": ""Gene_or_geneproduct""}]"
Note that increasing concentrations of the LD of RanBP2 reverse the inhibition of HKI activity by Cox11.	"RanBP2	49	55	Gene_or_geneproduct"	"HKI	82	85	Gene_or_geneproduct"	"Cox11	98	103	Gene_or_geneproduct"	"[{""token"": ""RanBP2"", ""start_span"": 49, ""end_span"": 55, ""type"": ""Gene_or_geneproduct""}, {""token"": ""HKI"", ""start_span"": 82, ""end_span"": 85, ""type"": ""Gene_or_geneproduct""}, {""token"": ""Cox11"", ""start_span"": 98, ""end_span"": 103, ""type"": ""Gene_or_geneproduct""}]"
A half - maximal effect of the LD of RanBP2 on HKI activity in the presence of 7. 5 nM of Cox11 was observed at a concentration of ~ 0. 05 nM of LD.	"RanBP2	37	43	Gene_or_geneproduct"	"HKI	47	50	Gene_or_geneproduct"	"Cox11	90	95	Gene_or_geneproduct"	"[{""token"": ""RanBP2"", ""start_span"": 37, ""end_span"": 43, ""type"": ""Gene_or_geneproduct""}, {""token"": ""HKI"", ""start_span"": 47, ""end_span"": 50, ""type"": ""Gene_or_geneproduct""}, {""token"": ""Cox11"", ""start_span"": 90, ""end_span"": 95, ""type"": ""Gene_or_geneproduct""}]"
In addition to its presence at the vicinity of NPCs, we have shown previously that RanBP2 is localized to and abundant in the mitochondria - rich ellipsoid subcellular compartment of photosensory ( photoreceptor) neurons of the retina [ 19].	"NPCs	47	51	GO_ontology"	"RanBP2	83	89	Gene_or_geneproduct"	"mitochondria	126	138	GO_ontology"	"[{""token"": ""NPCs"", ""start_span"": 47, ""end_span"": 51, ""type"": ""GO_ontology""}, {""token"": ""RanBP2"", ""start_span"": 83, ""end_span"": 89, ""type"": ""Gene_or_geneproduct""}, {""token"": ""mitochondria"", ""start_span"": 126, ""end_span"": 138, ""type"": ""GO_ontology""}]"
Double immunostaining with antibodies against these proteins showed that they colocalize to the mitochondria ( Figure 3A - 3Z).	"antibodies	27	37	GO_ontology"	"proteins	52	60	Chemical"	"mitochondria	96	108	GO_ontology"	"[{""token"": ""antibodies"", ""start_span"": 27, ""end_span"": 37, ""type"": ""GO_ontology""}, {""token"": ""proteins"", ""start_span"": 52, ""end_span"": 60, ""type"": ""Chemical""}, {""token"": ""mitochondria"", ""start_span"": 96, ""end_span"": 108, ""type"": ""GO_ontology""}]"
( A - F) are thin cryosections of an area of the hipocampus ( CA1 neurons) and cerebral cortex, respectively, immunostained against HKI ( A and D), RanBP2 ( B and E), and merged images thereof ( C and F).	"neurons	66	73	Cell"	"HKI	132	135	Gene_or_geneproduct"	"RanBP2	148	154	Gene_or_geneproduct"	"[{""token"": ""neurons"", ""start_span"": 66, ""end_span"": 73, ""type"": ""Cell""}, {""token"": ""HKI"", ""start_span"": 132, ""end_span"": 135, ""type"": ""Gene_or_geneproduct""}, {""token"": ""RanBP2"", ""start_span"": 148, ""end_span"": 154, ""type"": ""Gene_or_geneproduct""}]"
Haploinsufficiency of RanBP2 Causes Decreased Levels of HKI and Partial Mislocalization of HKI	"RanBP2	22	28	Gene_or_geneproduct"	"HKI	56	59	Gene_or_geneproduct"	"HKI	91	94	Gene_or_geneproduct"	"[{""token"": ""RanBP2"", ""start_span"": 22, ""end_span"": 28, ""type"": ""Gene_or_geneproduct""}, {""token"": ""HKI"", ""start_span"": 56, ""end_span"": 59, ""type"": ""Gene_or_geneproduct""}, {""token"": ""HKI"", ""start_span"": 91, ""end_span"": 94, ""type"": ""Gene_or_geneproduct""}]"
The bicistronic transcript produces two proteins under regulation of RanBP2.	"bicistronic transcript	4	26	Sequence"	"proteins	40	48	Chemical"	"RanBP2	69	75	Gene_or_geneproduct"	"[{""token"": ""bicistronic transcript"", ""start_span"": 4, ""end_span"": 26, ""type"": ""Sequence""}, {""token"": ""proteins"", ""start_span"": 40, ""end_span"": 48, ""type"": ""Chemical""}, {""token"": ""RanBP2"", ""start_span"": 69, ""end_span"": 75, ""type"": ""Gene_or_geneproduct""}]"
PLAP expression is found throughout the plexiform / synaptic layers and outer segment of photoreceptors ( E).	"PLAP	0	4	Gene_or_geneproduct"	"synaptic	52	60	GO_ontology"	"outer segment of photoreceptors	72	103	GO_ontology"	"[{""token"": ""PLAP"", ""start_span"": 0, ""end_span"": 4, ""type"": ""Gene_or_geneproduct""}, {""token"": ""synaptic"", ""start_span"": 52, ""end_span"": 60, ""type"": ""GO_ontology""}, {""token"": ""outer segment of photoreceptors"", ""start_span"": 72, ""end_span"": 103, ""type"": ""GO_ontology""}]"
Hence, we focused our analysis on the inbred RanBP2 + / - 129Ola mouse line.	"RanBP2	45	51	Gene_or_geneproduct"	"+	52	53	Sequence"	"mouse	65	70	Organism"	"[{""token"": ""RanBP2"", ""start_span"": 45, ""end_span"": 51, ""type"": ""Gene_or_geneproduct""}, {""token"": ""+"", ""start_span"": 52, ""end_span"": 53, ""type"": ""Sequence""}, {""token"": ""mouse"", ""start_span"": 65, ""end_span"": 70, ""type"": ""Organism""}]"
There is ~ 2 - and 4 - fold reduction of RanBP2 and HKI in heterozygote mice.	"RanBP2	41	47	Gene_or_geneproduct"	"HKI	52	55	Gene_or_geneproduct"	"mice	72	76	Organism"	"[{""token"": ""RanBP2"", ""start_span"": 41, ""end_span"": 47, ""type"": ""Gene_or_geneproduct""}, {""token"": ""HKI"", ""start_span"": 52, ""end_span"": 55, ""type"": ""Gene_or_geneproduct""}, {""token"": ""mice"", ""start_span"": 72, ""end_span"": 76, ""type"": ""Organism""}]"
RanBP2 + / - Mice on High - Fat Diet Exhibit Deficits in Growth	"RanBP2	0	6	Gene_or_geneproduct"	"+	7	8	Sequence"	"Mice	13	17	Organism"	"[{""token"": ""RanBP2"", ""start_span"": 0, ""end_span"": 6, ""type"": ""Gene_or_geneproduct""}, {""token"": ""+"", ""start_span"": 7, ""end_span"": 8, ""type"": ""Sequence""}, {""token"": ""Mice"", ""start_span"": 13, ""end_span"": 17, ""type"": ""Organism""}]"
This deficit was rescued in RanBP2 + / - mice of mixed C57BL / 6J / 129Ola background ( Figure S3).	"RanBP2	28	34	Gene_or_geneproduct"	"+	35	36	Sequence"	"mice	41	45	Organism"	"[{""token"": ""RanBP2"", ""start_span"": 28, ""end_span"": 34, ""type"": ""Gene_or_geneproduct""}, {""token"": ""+"", ""start_span"": 35, ""end_span"": 36, ""type"": ""Sequence""}, {""token"": ""mice"", ""start_span"": 41, ""end_span"": 45, ""type"": ""Organism""}]"
Glucose clearance was not affected due to a disturbance in insulin - mediated glucose uptake ( Figure 7C).	"Glucose	0	7	Chemical"	"insulin	59	66	Gene_or_geneproduct"	"glucose	78	85	Chemical"	"[{""token"": ""Glucose"", ""start_span"": 0, ""end_span"": 7, ""type"": ""Chemical""}, {""token"": ""insulin"", ""start_span"": 59, ""end_span"": 66, ""type"": ""Gene_or_geneproduct""}, {""token"": ""glucose"", ""start_span"": 78, ""end_span"": 85, ""type"": ""Chemical""}]"
Metabolic Phenotypes of RanBP2 + / - Inbred Mice on High - Fat Diet	"RanBP2	24	30	Gene_or_geneproduct"	"+	31	32	Sequence"	"Mice	44	48	Organism"	"[{""token"": ""RanBP2"", ""start_span"": 24, ""end_span"": 30, ""type"": ""Gene_or_geneproduct""}, {""token"": ""+"", ""start_span"": 31, ""end_span"": 32, ""type"": ""Sequence""}, {""token"": ""Mice"", ""start_span"": 44, ""end_span"": 48, ""type"": ""Organism""}]"
Anesthetics, particularly ketamine, can cause sustained elevation of glucose in mice, which in turn affects electroretinogram responses [ 39].	"Anesthetics	0	11	Chemical"	"glucose	69	76	Chemical"	"mice	80	84	Organism"	"[{""token"": ""Anesthetics"", ""start_span"": 0, ""end_span"": 11, ""type"": ""Chemical""}, {""token"": ""glucose"", ""start_span"": 69, ""end_span"": 76, ""type"": ""Chemical""}, {""token"": ""mice"", ""start_span"": 80, ""end_span"": 84, ""type"": ""Organism""}]"
