The cellular growth media did not contain altered levels of cathepsin D, indicating enzyme secretion was not affected.	"cellular	4	12	Cell"	"cathepsin D	60	71	Gene_or_geneproduct"	"enzyme	84	90	Sequence"	"[{""token"": ""cellular"", ""start_span"": 4, ""end_span"": 12, ""type"": ""Cell""}, {""token"": ""cathepsin D"", ""start_span"": 60, ""end_span"": 71, ""type"": ""Gene_or_geneproduct""}, {""token"": ""enzyme"", ""start_span"": 84, ""end_span"": 90, ""type"": ""Sequence""}]"
Heterozygous Cln3 Delta ex7 / 8 mice and CbCln3 Delta ex7 / 8 cells were indistinguishable from wild - type, as expected for a recessive disease phenotype ( data not shown).	"mice	32	36	Organism"	"cells	62	67	Cell"	"wild - type	96	107	Sequence"	"[{""token"": ""mice"", ""start_span"": 32, ""end_span"": 36, ""type"": ""Organism""}, {""token"": ""cells"", ""start_span"": 62, ""end_span"": 67, ""type"": ""Cell""}, {""token"": ""wild - type"", ""start_span"": 96, ""end_span"": 107, ""type"": ""Sequence""}]"
Cathepsin D localization and processing in wild - type and homozygous CbCln3 Delta ex7 / 8 cells a.	"Cathepsin D	0	11	Gene_or_geneproduct"	"wild - type	43	54	Sequence"	"cells	91	96	Cell"	"[{""token"": ""Cathepsin D"", ""start_span"": 0, ""end_span"": 11, ""type"": ""Gene_or_geneproduct""}, {""token"": ""wild - type"", ""start_span"": 43, ""end_span"": 54, ""type"": ""Sequence""}, {""token"": ""cells"", ""start_span"": 91, ""end_span"": 96, ""type"": ""Cell""}]"
alpha - Cathepsin D - probed immunoblots of total wild - type versus homozygous Cln3 Delta ex7 / 8 knock - in tissue or CbCln3 Delta ex7 / 8 cellular extracts are shown.	"Cathepsin D	8	19	Gene_or_geneproduct"	"wild - type	50	61	Sequence"	"cellular	141	149	Cell"	"[{""token"": ""Cathepsin D"", ""start_span"": 8, ""end_span"": 19, ""type"": ""Gene_or_geneproduct""}, {""token"": ""wild - type"", ""start_span"": 50, ""end_span"": 61, ""type"": ""Sequence""}, {""token"": ""cellular"", ""start_span"": 141, ""end_span"": 149, ""type"": ""Cell""}]"
Thus, cathepsin D transport and processing are disrupted in homozygous CbCln3 Delta ex7 / 8 cells in a manner such that enzymatic activity appears to be relatively unaffected.	"cathepsin D	6	17	Gene_or_geneproduct"	"cells	92	97	Cell"	"enzymatic	120	129	Sequence"	"[{""token"": ""cathepsin D"", ""start_span"": 6, ""end_span"": 17, ""type"": ""Gene_or_geneproduct""}, {""token"": ""cells"", ""start_span"": 92, ""end_span"": 97, ""type"": ""Cell""}, {""token"": ""enzymatic"", ""start_span"": 120, ""end_span"": 129, ""type"": ""Sequence""}]"
Mitochondrial morphology and function in wild - type, heterozygous and homozygous CbCln3 Delta ex7 / 8 cells a.	"Mitochondrial	0	13	GO_ontology"	"wild - type	41	52	Sequence"	"cells	103	108	Cell"	"[{""token"": ""Mitochondrial"", ""start_span"": 0, ""end_span"": 13, ""type"": ""GO_ontology""}, {""token"": ""wild - type"", ""start_span"": 41, ""end_span"": 52, ""type"": ""Sequence""}, {""token"": ""cells"", ""start_span"": 103, ""end_span"": 108, ""type"": ""Cell""}]"
Wild - type and heterozygous CbCln3 Delta ex7 / 8 cellular ATP levels were not statistically different from each other ( p > 0. 4).	"Wild - type	0	11	Sequence"	"cellular	50	58	Cell"	"ATP	59	62	Chemical"	"[{""token"": ""Wild - type"", ""start_span"": 0, ""end_span"": 11, ""type"": ""Sequence""}, {""token"": ""cellular"", ""start_span"": 50, ""end_span"": 58, ""type"": ""Cell""}, {""token"": ""ATP"", ""start_span"": 59, ""end_span"": 62, ""type"": ""Chemical""}]"
CbCln3 Delta ex7 / 8 cerebellar precursor cells represent the first genetically accurate neuron - derived culture model of JNCL.	"cells	42	47	Cell"	"genetically	68	79	Sequence"	"neuron	89	95	Cell"	"[{""token"": ""cells"", ""start_span"": 42, ""end_span"": 47, ""type"": ""Cell""}, {""token"": ""genetically"", ""start_span"": 68, ""end_span"": 79, ""type"": ""Sequence""}, {""token"": ""neuron"", ""start_span"": 89, ""end_span"": 95, ""type"": ""Cell""}]"
Moreover, this is the first study to indicate recessive endosomal / lysosomal membrane trafficking defects and mitochondrial dysfunction that precedes subunit c deposition in an accurate JNCL model.	"endosomal / lysosomal membrane	56	86	GO_ontology"	"mitochondrial	111	124	GO_ontology"	"subunit c	151	160	Gene_or_geneproduct"	"[{""token"": ""endosomal / lysosomal membrane"", ""start_span"": 56, ""end_span"": 86, ""type"": ""GO_ontology""}, {""token"": ""mitochondrial"", ""start_span"": 111, ""end_span"": 124, ""type"": ""GO_ontology""}, {""token"": ""subunit c"", ""start_span"": 151, ""end_span"": 160, ""type"": ""Gene_or_geneproduct""}]"
Aging of homozygous CbCln3 Delta ex7 / 8 cells at confluency is necessary to induce significantly accumulated subunit c protein.	"cells	41	46	Cell"	"subunit c	110	119	Gene_or_geneproduct"	"protein	120	127	Chemical"	"[{""token"": ""cells"", ""start_span"": 41, ""end_span"": 46, ""type"": ""Cell""}, {""token"": ""subunit c"", ""start_span"": 110, ""end_span"": 119, ""type"": ""Gene_or_geneproduct""}, {""token"": ""protein"", ""start_span"": 120, ""end_span"": 127, ""type"": ""Chemical""}]"
However, membrane organelle disruptions precede subunit c accumulation in homozygous CbCln3 Delta ex7 / 8 cells, since they are observed without aging at confluency.	"membrane organelle	9	27	GO_ontology"	"subunit c	48	57	Gene_or_geneproduct"	"cells	106	111	Cell"	"[{""token"": ""membrane organelle"", ""start_span"": 9, ""end_span"": 27, ""type"": ""GO_ontology""}, {""token"": ""subunit c"", ""start_span"": 48, ""end_span"": 57, ""type"": ""Gene_or_geneproduct""}, {""token"": ""cells"", ""start_span"": 106, ""end_span"": 111, ""type"": ""Cell""}]"
Lysosomal and endosomal size and distribution are altered, and mitochondria are abnormally elongated and functionally compromised in sub - confluent homozygous CbCln3 Delta ex7 / 8 cultures.	"Lysosomal	0	9	GO_ontology"	"endosomal	14	23	GO_ontology"	"mitochondria	63	75	GO_ontology"	"[{""token"": ""Lysosomal"", ""start_span"": 0, ""end_span"": 9, ""type"": ""GO_ontology""}, {""token"": ""endosomal"", ""start_span"": 14, ""end_span"": 23, ""type"": ""GO_ontology""}, {""token"": ""mitochondria"", ""start_span"": 63, ""end_span"": 75, ""type"": ""GO_ontology""}]"
Mitochondrial abnormalities, which have also been reported in JNCL patients and other animal models [ 21 - 23], may result from ineffective turnover by autophagy, a lysosomal - targeted pathway [ 24].	"Mitochondrial	0	13	GO_ontology"	"animal	86	92	Organism"	"lysosomal	165	174	GO_ontology"	"[{""token"": ""Mitochondrial"", ""start_span"": 0, ""end_span"": 13, ""type"": ""GO_ontology""}, {""token"": ""animal"", ""start_span"": 86, ""end_span"": 92, ""type"": ""Organism""}, {""token"": ""lysosomal"", ""start_span"": 165, ""end_span"": 174, ""type"": ""GO_ontology""}]"
Neurotransmission heavily relies on membrane vesicle transport, and a high - energy metabolism may further sensitize neurons to the loss of battenin activity.	"membrane vesicle	36	52	GO_ontology"	"neurons	117	124	Cell"	"battenin	140	148	Gene_or_geneproduct"	"[{""token"": ""membrane vesicle"", ""start_span"": 36, ""end_span"": 52, ""type"": ""GO_ontology""}, {""token"": ""neurons"", ""start_span"": 117, ""end_span"": 124, ""type"": ""Cell""}, {""token"": ""battenin"", ""start_span"": 140, ""end_span"": 148, ""type"": ""Gene_or_geneproduct""}]"
Thus, our panel of wild - type, heterozygous, and homozygous CbCln3 Delta ex7 / 8 cerebellar cells provide an ideal model system to further elucidate battenin function and JNCL pathogenesis.	"wild - type	19	30	Sequence"	"cells	93	98	Cell"	"battenin	150	158	Gene_or_geneproduct"	"[{""token"": ""wild - type"", ""start_span"": 19, ""end_span"": 30, ""type"": ""Sequence""}, {""token"": ""cells"", ""start_span"": 93, ""end_span"": 98, ""type"": ""Cell""}, {""token"": ""battenin"", ""start_span"": 150, ""end_span"": 158, ""type"": ""Gene_or_geneproduct""}]"
Antibody and cell staining reagents	"Antibody	0	8	GO_ontology"	"cell	13	17	Cell"	"reagents	27	35	Chemical"	"[{""token"": ""Antibody"", ""start_span"": 0, ""end_span"": 8, ""type"": ""GO_ontology""}, {""token"": ""cell"", ""start_span"": 13, ""end_span"": 17, ""type"": ""Cell""}, {""token"": ""reagents"", ""start_span"": 27, ""end_span"": 35, ""type"": ""Chemical""}]"
Trypsin / EDTA ( 10 mg / ml, Sigma) and DNase I ( 100 mu g / ml, Sigma), suspended in HBSS, helped dissociate cerebella for primary culture plating onto 0. 01% poly - ornithine ( Sigma) coated 100 mm dishes.	"EDTA	10	14	Chemical"	"DNase I	40	47	Gene_or_geneproduct"	"ornithine	167	176	Chemical"	"[{""token"": ""EDTA"", ""start_span"": 10, ""end_span"": 14, ""type"": ""Chemical""}, {""token"": ""DNase I"", ""start_span"": 40, ""end_span"": 47, ""type"": ""Gene_or_geneproduct""}, {""token"": ""ornithine"", ""start_span"": 167, ""end_span"": 176, ""type"": ""Chemical""}]"
CbCln3 cell lines were maintained on 0. 01% poly - ornithine coated dishes at 30 - 90% confluency, in 33 degrees C and 5% CO2 atmosphere.	"cell	7	11	Cell"	"ornithine	51	60	Chemical"	"CO2	122	125	Chemical"	"[{""token"": ""cell"", ""start_span"": 7, ""end_span"": 11, ""type"": ""Cell""}, {""token"": ""ornithine"", ""start_span"": 51, ""end_span"": 60, ""type"": ""Chemical""}, {""token"": ""CO2"", ""start_span"": 122, ""end_span"": 125, ""type"": ""Chemical""}]"
Total RNA isolation and Cln3 RT - PCR primers and procedures have been previously described [ 12].	"RNA	6	9	Sequence"	"Cln3	24	28	Gene_or_geneproduct"	"primers	38	45	Sequence"	"[{""token"": ""RNA"", ""start_span"": 6, ""end_span"": 9, ""type"": ""Sequence""}, {""token"": ""Cln3"", ""start_span"": 24, ""end_span"": 28, ""type"": ""Gene_or_geneproduct""}, {""token"": ""primers"", ""start_span"": 38, ""end_span"": 45, ""type"": ""Sequence""}]"
Typically, 20 - 40 mu g of protein ( determined by Bio - rad Dc Protein Assay) was separated by SDS - PAGE, for subsequent immunoblotting, as described [ 12].	"protein	27	34	Chemical"	"Protein	64	71	Chemical"	"SDS	96	99	Chemical"	"[{""token"": ""protein"", ""start_span"": 27, ""end_span"": 34, ""type"": ""Chemical""}, {""token"": ""Protein"", ""start_span"": 64, ""end_span"": 71, ""type"": ""Chemical""}, {""token"": ""SDS"", ""start_span"": 96, ""end_span"": 99, ""type"": ""Chemical""}]"
100 mm tissue culture dishes, which were approximately 80 - 90% confluent, were washed briefly with ice - cold PBS, and total protein extracts were isolated by scraping cells into 10 mM Tris, pH 7. 4, 0. 1% Triton X - 100 followed by incubation on ice, for 20 minutes.	"protein	126	133	Chemical"	"cells	169	174	Cell"	"Tris	186	190	Chemical"	"[{""token"": ""protein"", ""start_span"": 126, ""end_span"": 133, ""type"": ""Chemical""}, {""token"": ""cells"", ""start_span"": 169, ""end_span"": 174, ""type"": ""Cell""}, {""token"": ""Tris"", ""start_span"": 186, ""end_span"": 190, ""type"": ""Chemical""}]"
The insoluble material was centrifuged at 14, 000 g, the supernatant was isolated, and protein concentration was determined using the Bio - rad Dc Protein Assay.	"insoluble material	4	22	GO_ontology"	"protein	87	94	Chemical"	"Protein	147	154	Chemical"	"[{""token"": ""insoluble material"", ""start_span"": 4, ""end_span"": 22, ""type"": ""GO_ontology""}, {""token"": ""protein"", ""start_span"": 87, ""end_span"": 94, ""type"": ""Chemical""}, {""token"": ""Protein"", ""start_span"": 147, ""end_span"": 154, ""type"": ""Chemical""}]"
50 - 70 mu g of total protein extract were used to measure cathepsin D activity using the Fluorogenic Innozyme (TM) Cathepsin D Immunocapture Activity Assay Kit ( EMD Biosciences) according to the manufacturer ' s recommendations.	"protein	22	29	Chemical"	"cathepsin D	59	70	Gene_or_geneproduct"	"Cathepsin D	116	127	Gene_or_geneproduct"	"[{""token"": ""protein"", ""start_span"": 22, ""end_span"": 29, ""type"": ""Chemical""}, {""token"": ""cathepsin D"", ""start_span"": 59, ""end_span"": 70, ""type"": ""Gene_or_geneproduct""}, {""token"": ""Cathepsin D"", ""start_span"": 116, ""end_span"": 127, ""type"": ""Gene_or_geneproduct""}]"
Following labeling, cells were immediately placed on ice and washed for 10 minutes in ice - cold dye - free media, and fixed with 4% formaldehyde in PBS, for 20 minutes on ice.	"cells	20	25	Cell"	"dye	97	100	Chemical"	"formaldehyde	133	145	Chemical"	"[{""token"": ""cells"", ""start_span"": 20, ""end_span"": 25, ""type"": ""Cell""}, {""token"": ""dye"", ""start_span"": 97, ""end_span"": 100, ""type"": ""Chemical""}, {""token"": ""formaldehyde"", ""start_span"": 133, ""end_span"": 145, ""type"": ""Chemical""}]"
Cells were incubated in the presence of hydrogen peroxide for 24 hours, at 33 degrees C, and viability was measured using the CellTiter - 96 (R) AQueous Non - Radioactive Cell Proliferation Assay ( Promega), according to the manufacturer ' s specifications.	"Cells	0	5	Cell"	"hydrogen peroxide	40	57	Chemical"	"Cell	126	130	Cell"	"[{""token"": ""Cells"", ""start_span"": 0, ""end_span"": 5, ""type"": ""Cell""}, {""token"": ""hydrogen peroxide"", ""start_span"": 40, ""end_span"": 57, ""type"": ""Chemical""}, {""token"": ""Cell"", ""start_span"": 126, ""end_span"": 130, ""type"": ""Cell""}]"
We found that transforming growth factor beta 2 signaling is necessary to transiently induce the transcription factor Snail and activate the Ras - mitogen - activated protein kinase ( MAPK) pathway in the bud.	"transforming growth factor beta 2	14	47	Gene_or_geneproduct"	"Snail	118	123	Gene_or_geneproduct"	"protein	167	174	Chemical"	"[{""token"": ""transforming growth factor beta 2"", ""start_span"": 14, ""end_span"": 47, ""type"": ""Gene_or_geneproduct""}, {""token"": ""Snail"", ""start_span"": 118, ""end_span"": 123, ""type"": ""Gene_or_geneproduct""}, {""token"": ""protein"", ""start_span"": 167, ""end_span"": 174, ""type"": ""Chemical""}]"
When E - cadherin is transcriptionally down - regulated, associated adhesion proteins with dual functions in signaling are released from cell - cell contacts, a process which we demonstrate leads to Ras - MAPK activation.	"E - cadherin	5	17	Gene_or_geneproduct"	"proteins	77	85	Chemical"	"cell - cell contacts	137	157	GO_ontology"	"[{""token"": ""E - cadherin"", ""start_span"": 5, ""end_span"": 17, ""type"": ""Gene_or_geneproduct""}, {""token"": ""proteins"", ""start_span"": 77, ""end_span"": 85, ""type"": ""Chemical""}, {""token"": ""cell - cell contacts"", ""start_span"": 137, ""end_span"": 157, ""type"": ""GO_ontology""}]"
Thus, extracellular epithelial - mesenchymal crosstalk must be intricately orchestrated to couple the determination of distinct cell fates with the contemporaneous remodeling of the physical and structural properties of the cell.	"extracellular	6	19	GO_ontology"	"cell	128	132	Cell"	"cell	224	228	Cell"	"[{""token"": ""extracellular"", ""start_span"": 6, ""end_span"": 19, ""type"": ""GO_ontology""}, {""token"": ""cell"", ""start_span"": 128, ""end_span"": 132, ""type"": ""Cell""}, {""token"": ""cell"", ""start_span"": 224, ""end_span"": 228, ""type"": ""Cell""}]"
Like LEF - 1, E - cadherin also binds to beta - catenin.	"LEF - 1	5	12	Gene_or_geneproduct"	"E - cadherin	14	26	Gene_or_geneproduct"	"beta - catenin	41	55	Gene_or_geneproduct"	"[{""token"": ""LEF - 1"", ""start_span"": 5, ""end_span"": 12, ""type"": ""Gene_or_geneproduct""}, {""token"": ""E - cadherin"", ""start_span"": 14, ""end_span"": 26, ""type"": ""Gene_or_geneproduct""}, {""token"": ""beta - catenin"", ""start_span"": 41, ""end_span"": 55, ""type"": ""Gene_or_geneproduct""}]"
In the absence of TGF - beta 2 signaling and Snail gene expression, hair placodes can form, but further follicle down - growth is blocked.	"TGF - beta 2	18	30	Gene_or_geneproduct"	"Snail	45	50	Gene_or_geneproduct"	"gene	51	55	Sequence"	"[{""token"": ""TGF - beta 2"", ""start_span"": 18, ""end_span"": 30, ""type"": ""Gene_or_geneproduct""}, {""token"": ""Snail"", ""start_span"": 45, ""end_span"": 50, ""type"": ""Gene_or_geneproduct""}, {""token"": ""gene"", ""start_span"": 51, ""end_span"": 55, ""type"": ""Sequence""}]"
Snail mRNA and Protein Are Expressed Transiently at the Hair Bud Stage of Follicle Morphogenesis	"Snail	0	5	Gene_or_geneproduct"	"mRNA	6	10	Chemical"	"Protein	15	22	Chemical"	"[{""token"": ""Snail"", ""start_span"": 0, ""end_span"": 5, ""type"": ""Gene_or_geneproduct""}, {""token"": ""mRNA"", ""start_span"": 6, ""end_span"": 10, ""type"": ""Chemical""}, {""token"": ""Protein"", ""start_span"": 15, ""end_span"": 22, ""type"": ""Chemical""}]"
Consistent with the Western blot data, immunohistochemical analysis did not detect Snail in single - layered E13. 5 epidermis ( Figure 1C) nor in the placode, which is the earliest morphological sign of the commitment of multipotent cells of the embryonic ectoderm to a hair cell fate ( Figure 1D).	"Snail	83	88	Gene_or_geneproduct"	"cells of the embryonic ectoderm	233	264	Cell"	"hair cell	270	279	Cell"	"[{""token"": ""Snail"", ""start_span"": 83, ""end_span"": 88, ""type"": ""Gene_or_geneproduct""}, {""token"": ""cells of the embryonic ectoderm"", ""start_span"": 233, ""end_span"": 264, ""type"": ""Cell""}, {""token"": ""hair cell"", ""start_span"": 270, ""end_span"": 279, ""type"": ""Cell""}]"
Taken together, the anti - Snail antibody appeared to be specific for its target protein.	"Snail	27	32	Gene_or_geneproduct"	"antibody	33	41	GO_ontology"	"protein	81	88	Chemical"	"[{""token"": ""Snail"", ""start_span"": 27, ""end_span"": 32, ""type"": ""Gene_or_geneproduct""}, {""token"": ""antibody"", ""start_span"": 33, ""end_span"": 41, ""type"": ""GO_ontology""}, {""token"": ""protein"", ""start_span"": 81, ""end_span"": 88, ""type"": ""Chemical""}]"
Sustained Expression of Snail Results in Epidermal Hyperproliferation and Differentiation Defects in Tg Mouse Skin	"Snail	24	29	Gene_or_geneproduct"	"Tg	101	103	Sequence"	"Mouse	104	109	Organism"	"[{""token"": ""Snail"", ""start_span"": 24, ""end_span"": 29, ""type"": ""Gene_or_geneproduct""}, {""token"": ""Tg"", ""start_span"": 101, ""end_span"": 103, ""type"": ""Sequence""}, {""token"": ""Mouse"", ""start_span"": 104, ""end_span"": 109, ""type"": ""Organism""}]"
The striking spike of Snail expression coincident with hair bud formation and enhanced proliferation prompted us to examine the consequences of ectopically expressing Snail elsewhere in mouse skin epidermis.	"Snail	22	27	Gene_or_geneproduct"	"Snail	167	172	Gene_or_geneproduct"	"mouse	186	191	Organism"	"[{""token"": ""Snail"", ""start_span"": 22, ""end_span"": 27, ""type"": ""Gene_or_geneproduct""}, {""token"": ""Snail"", ""start_span"": 167, ""end_span"": 172, ""type"": ""Gene_or_geneproduct""}, {""token"": ""mouse"", ""start_span"": 186, ""end_span"": 191, ""type"": ""Organism""}]"
As Snail Tg animals grew, they became distinguished by their small size, short tails, and flaky skin ( Figure 2A).	"Snail	3	8	Gene_or_geneproduct"	"Tg	9	11	Sequence"	"animals	12	19	Organism"	"[{""token"": ""Snail"", ""start_span"": 3, ""end_span"": 8, ""type"": ""Gene_or_geneproduct""}, {""token"": ""Tg"", ""start_span"": 9, ""end_span"": 11, ""type"": ""Sequence""}, {""token"": ""animals"", ""start_span"": 12, ""end_span"": 19, ""type"": ""Organism""}]"
These hyperthickened areas were marked by excessive proliferation, as revealed by antibodies against the proliferating nuclear antigen Ki67 ( Figure 2D and 2E).	"antibodies	82	92	GO_ontology"	"nuclear	119	126	GO_ontology"	"Ki67	135	139	Gene_or_geneproduct"	"[{""token"": ""antibodies"", ""start_span"": 82, ""end_span"": 92, ""type"": ""GO_ontology""}, {""token"": ""nuclear"", ""start_span"": 119, ""end_span"": 126, ""type"": ""GO_ontology""}, {""token"": ""Ki67"", ""start_span"": 135, ""end_span"": 139, ""type"": ""Gene_or_geneproduct""}]"
Activated, pMAPK - positive cells were also prevalent in these areas ( Figure 2F and 2G), as were cells expressing keratin 6, a keratin induced in the suprabasal layers of hyperproliferative skin ( Figure 2H and 2I).	"cells	28	33	Cell"	"cells	98	103	Cell"	"keratin 6	115	124	Gene_or_geneproduct"	"[{""token"": ""cells"", ""start_span"": 28, ""end_span"": 33, ""type"": ""Cell""}, {""token"": ""cells"", ""start_span"": 98, ""end_span"": 103, ""type"": ""Cell""}, {""token"": ""keratin 6"", ""start_span"": 115, ""end_span"": 124, ""type"": ""Gene_or_geneproduct""}]"
Interestingly, similar types of alterations occur in the basement membrane in the hair bud of embryonic and newborn mice when Snail is normally expressed.	"basement membrane	57	74	GO_ontology"	"mice	116	120	Organism"	"Snail	126	131	Gene_or_geneproduct"	"[{""token"": ""basement membrane"", ""start_span"": 57, ""end_span"": 74, ""type"": ""GO_ontology""}, {""token"": ""mice"", ""start_span"": 116, ""end_span"": 120, ""type"": ""Organism""}, {""token"": ""Snail"", ""start_span"": 126, ""end_span"": 131, ""type"": ""Gene_or_geneproduct""}]"
The fact that the basement membrane separating the epidermis from the dermis is altered only in the adult Tg animals suggests the involvement of intermediary factors not as readily available in the epidermis as they are in the follicle.	"basement membrane	18	35	GO_ontology"	"Tg	106	108	Sequence"	"animals	109	116	Organism"	"[{""token"": ""basement membrane"", ""start_span"": 18, ""end_span"": 35, ""type"": ""GO_ontology""}, {""token"": ""Tg"", ""start_span"": 106, ""end_span"": 108, ""type"": ""Sequence""}, {""token"": ""animals"", ""start_span"": 109, ""end_span"": 116, ""type"": ""Organism""}]"
The ability to restore alpha - catenin expression and localization under these conditions argues against the notion that Snail transcriptionally represses alpha - catenin.	"alpha - catenin	23	38	Gene_or_geneproduct"	"Snail	121	126	Gene_or_geneproduct"	"alpha - catenin	155	170	Gene_or_geneproduct"	"[{""token"": ""alpha - catenin"", ""start_span"": 23, ""end_span"": 38, ""type"": ""Gene_or_geneproduct""}, {""token"": ""Snail"", ""start_span"": 121, ""end_span"": 126, ""type"": ""Gene_or_geneproduct""}, {""token"": ""alpha - catenin"", ""start_span"": 155, ""end_span"": 170, ""type"": ""Gene_or_geneproduct""}]"
Consistent with our in vivo observations, transfected keratinocytes expressing Snail exhibited a substantial increase in pMAPK levels relative to control cells ( Figure 4D).	"keratinocytes	54	67	Cell"	"Snail	79	84	Gene_or_geneproduct"	"cells	154	159	Cell"	"[{""token"": ""keratinocytes"", ""start_span"": 54, ""end_span"": 67, ""type"": ""Cell""}, {""token"": ""Snail"", ""start_span"": 79, ""end_span"": 84, ""type"": ""Gene_or_geneproduct""}, {""token"": ""cells"", ""start_span"": 154, ""end_span"": 159, ""type"": ""Cell""}]"
Given the increase in pMAPK staining in Tg skin, we examined the possibility that Ajuba might have changed its binding partner in Snail - expressing epidermis.	"Tg	40	42	Sequence"	"Ajuba	82	87	Gene_or_geneproduct"	"Snail	130	135	Gene_or_geneproduct"	"[{""token"": ""Tg"", ""start_span"": 40, ""end_span"": 42, ""type"": ""Sequence""}, {""token"": ""Ajuba"", ""start_span"": 82, ""end_span"": 87, ""type"": ""Gene_or_geneproduct""}, {""token"": ""Snail"", ""start_span"": 130, ""end_span"": 135, ""type"": ""Gene_or_geneproduct""}]"
As expected, the small peptide inhibitor that interrupts the Grb - 2 / Sos association blocked the effects.	"peptide	23	30	Sequence"	"inhibitor	31	40	Chemical"	"Grb - 2	61	68	Gene_or_geneproduct"	"[{""token"": ""peptide"", ""start_span"": 23, ""end_span"": 30, ""type"": ""Sequence""}, {""token"": ""inhibitor"", ""start_span"": 31, ""end_span"": 40, ""type"": ""Chemical""}, {""token"": ""Grb - 2"", ""start_span"": 61, ""end_span"": 68, ""type"": ""Gene_or_geneproduct""}]"
Probing the Regulation of Snail Gene Expression Reveals an Essential Link to TGF - beta 2 Signaling in the Developing Hair Bud	"Snail	26	31	Gene_or_geneproduct"	"Gene	32	36	Sequence"	"TGF - beta 2	77	89	Gene_or_geneproduct"	"[{""token"": ""Snail"", ""start_span"": 26, ""end_span"": 31, ""type"": ""Gene_or_geneproduct""}, {""token"": ""Gene"", ""start_span"": 32, ""end_span"": 36, ""type"": ""Sequence""}, {""token"": ""TGF - beta 2"", ""start_span"": 77, ""end_span"": 89, ""type"": ""Gene_or_geneproduct""}]"
Thus, despite essential roles for Wnts and noggin in hair follicle specification [ 4, 29, 30], our studies did not support an essential role for these signals in governing Snail expression in keratinocytes.	"noggin	43	49	Gene_or_geneproduct"	"Snail	172	177	Gene_or_geneproduct"	"keratinocytes	192	205	Cell"	"[{""token"": ""noggin"", ""start_span"": 43, ""end_span"": 49, ""type"": ""Gene_or_geneproduct""}, {""token"": ""Snail"", ""start_span"": 172, ""end_span"": 177, ""type"": ""Gene_or_geneproduct""}, {""token"": ""keratinocytes"", ""start_span"": 192, ""end_span"": 205, ""type"": ""Cell""}]"
TGF - beta 1 has been shown to induce Snail family members in hepatocytes and heart [ 15, 31].	"TGF - beta 1	0	12	Gene_or_geneproduct"	"Snail	38	43	Gene_or_geneproduct"	"hepatocytes	62	73	Cell"	"[{""token"": ""TGF - beta 1"", ""start_span"": 0, ""end_span"": 12, ""type"": ""Gene_or_geneproduct""}, {""token"": ""Snail"", ""start_span"": 38, ""end_span"": 43, ""type"": ""Gene_or_geneproduct""}, {""token"": ""hepatocytes"", ""start_span"": 62, ""end_span"": 73, ""type"": ""Cell""}]"
In keratinocytes, however, TGF - beta 1 inhibits keratinocyte growth and seems to be involved in triggering the destructive phase of the cycling hair follicle [ 32].	"keratinocytes	3	16	Cell"	"TGF - beta 1	27	39	Gene_or_geneproduct"	"keratinocyte	49	61	Cell"	"[{""token"": ""keratinocytes"", ""start_span"": 3, ""end_span"": 16, ""type"": ""Cell""}, {""token"": ""TGF - beta 1"", ""start_span"": 27, ""end_span"": 39, ""type"": ""Gene_or_geneproduct""}, {""token"": ""keratinocyte"", ""start_span"": 49, ""end_span"": 61, ""type"": ""Cell""}]"
