Electron micrographs of the sciatic nerves from Adam22 + / - ( A) and Adam22 - / - ( B) mice at postnatal day 10 are shown.	"Electron	0	8	Chemical"	"Adam22	48	54	Gene_or_geneproduct"	"+	55	56	Sequence"	"Adam22	70	76	Gene_or_geneproduct"	"mice	88	92	Organism"	"[{""token"": ""Electron"", ""start_span"": 0, ""end_span"": 8, ""type"": ""Chemical""}, {""token"": ""Adam22"", ""start_span"": 48, ""end_span"": 54, ""type"": ""Gene_or_geneproduct""}, {""token"": ""+"", ""start_span"": 55, ""end_span"": 56, ""type"": ""Sequence""}, {""token"": ""Adam22"", ""start_span"": 70, ""end_span"": 76, ""type"": ""Gene_or_geneproduct""}, {""token"": ""mice"", ""start_span"": 88, ""end_span"": 92, ""type"": ""Organism""}]"
The G01 transcript ( orthologous to the human ADAM22 isoform 1 transcript) is composed of grey boxes.	"transcript	8	18	Sequence"	"orthologous	21	32	Sequence"	"human ADAM22	40	52	Gene_or_geneproduct"	"isoform	53	60	Sequence"	"transcript	63	73	Sequence"	"[{""token"": ""transcript"", ""start_span"": 8, ""end_span"": 18, ""type"": ""Sequence""}, {""token"": ""orthologous"", ""start_span"": 21, ""end_span"": 32, ""type"": ""Sequence""}, {""token"": ""human ADAM22"", ""start_span"": 40, ""end_span"": 52, ""type"": ""Gene_or_geneproduct""}, {""token"": ""isoform"", ""start_span"": 53, ""end_span"": 60, ""type"": ""Sequence""}, {""token"": ""transcript"", ""start_span"": 63, ""end_span"": 73, ""type"": ""Sequence""}]"
Although cystic fibrosis is caused by mutations in the cystic fibrosis transmembrane conductance regulator ( CFTR) gene, the severity of disease is highly variable indicating the influence of modifier genes.	"mutations	38	47	Sequence"	"cystic fibrosis transmembrane conductance regulator	55	106	Gene_or_geneproduct"	"CFTR	109	113	Gene_or_geneproduct"	"gene	115	119	Sequence"	"genes	201	206	Sequence"	"[{""token"": ""mutations"", ""start_span"": 38, ""end_span"": 47, ""type"": ""Sequence""}, {""token"": ""cystic fibrosis transmembrane conductance regulator"", ""start_span"": 55, ""end_span"": 106, ""type"": ""Gene_or_geneproduct""}, {""token"": ""CFTR"", ""start_span"": 109, ""end_span"": 113, ""type"": ""Gene_or_geneproduct""}, {""token"": ""gene"", ""start_span"": 115, ""end_span"": 119, ""type"": ""Sequence""}, {""token"": ""genes"", ""start_span"": 201, ""end_span"": 206, ""type"": ""Sequence""}]"
Different mutations have a range of effects on the levels of CFTR protein and its proper functioning in epithelial transport of Cl - and HCO3 - [ 2, 3].	"mutations	10	19	Sequence"	"CFTR	61	65	Gene_or_geneproduct"	"protein	66	73	Chemical"	"Cl -	128	132	Chemical"	"HCO3 -	137	143	Chemical"	"[{""token"": ""mutations"", ""start_span"": 10, ""end_span"": 19, ""type"": ""Sequence""}, {""token"": ""CFTR"", ""start_span"": 61, ""end_span"": 65, ""type"": ""Gene_or_geneproduct""}, {""token"": ""protein"", ""start_span"": 66, ""end_span"": 73, ""type"": ""Chemical""}, {""token"": ""Cl -"", ""start_span"": 128, ""end_span"": 132, ""type"": ""Chemical""}, {""token"": ""HCO3 -"", ""start_span"": 137, ""end_span"": 143, ""type"": ""Chemical""}]"
Previous work using human patients and genetically altered mice has identified some modifier genes and have advanced our understanding of CF pathophysiology [ 4].	"human	20	25	Organism"	"genetically	39	50	Sequence"	"altered	51	58	Sequence"	"mice	59	63	Organism"	"genes	93	98	Sequence"	"[{""token"": ""human"", ""start_span"": 20, ""end_span"": 25, ""type"": ""Organism""}, {""token"": ""genetically"", ""start_span"": 39, ""end_span"": 50, ""type"": ""Sequence""}, {""token"": ""altered"", ""start_span"": 51, ""end_span"": 58, ""type"": ""Sequence""}, {""token"": ""mice"", ""start_span"": 59, ""end_span"": 63, ""type"": ""Organism""}, {""token"": ""genes"", ""start_span"": 93, ""end_span"": 98, ""type"": ""Sequence""}]"
Mast cell protease 2 ( Mcpt2) is a marker of differentiated mast cells [ 22] and mast cells are more abundant in the B6 CF mouse intestine.	"Mast cell protease 2	0	20	Gene_or_geneproduct"	"Mcpt2	23	28	Gene_or_geneproduct"	"mast cells	60	70	Cell"	"mast cells	81	91	Cell"	"mouse	123	128	Organism"	"[{""token"": ""Mast cell protease 2"", ""start_span"": 0, ""end_span"": 20, ""type"": ""Gene_or_geneproduct""}, {""token"": ""Mcpt2"", ""start_span"": 23, ""end_span"": 28, ""type"": ""Gene_or_geneproduct""}, {""token"": ""mast cells"", ""start_span"": 60, ""end_span"": 70, ""type"": ""Cell""}, {""token"": ""mast cells"", ""start_span"": 81, ""end_span"": 91, ""type"": ""Cell""}, {""token"": ""mouse"", ""start_span"": 123, ""end_span"": 128, ""type"": ""Organism""}]"
Suppressor of cytokine signaling 3 ( SOCS3, [ 29]) is an anti - inflammatory gene that interacts with the JAK - STAT pathway and its expression in increased in the B6 CF intestine.	"Suppressor of cytokine signaling 3	0	34	Gene_or_geneproduct"	"SOCS3	37	42	Gene_or_geneproduct"	"gene	77	81	Sequence"	"JAK	106	109	Gene_or_geneproduct"	"STAT	112	116	Gene_or_geneproduct"	"[{""token"": ""Suppressor of cytokine signaling 3"", ""start_span"": 0, ""end_span"": 34, ""type"": ""Gene_or_geneproduct""}, {""token"": ""SOCS3"", ""start_span"": 37, ""end_span"": 42, ""type"": ""Gene_or_geneproduct""}, {""token"": ""gene"", ""start_span"": 77, ""end_span"": 81, ""type"": ""Sequence""}, {""token"": ""JAK"", ""start_span"": 106, ""end_span"": 109, ""type"": ""Gene_or_geneproduct""}, {""token"": ""STAT"", ""start_span"": 112, ""end_span"": 116, ""type"": ""Gene_or_geneproduct""}]"
Lrg1 / Lrhg expression was increased more than 20 - fold in CF mice on the B6 background compared to wild type, but there was no significant difference between CF and wild type on the mixed background ( Fig. 2B).	"Lrg1	0	4	Gene_or_geneproduct"	"Lrhg	7	11	Gene_or_geneproduct"	"mice	63	67	Organism"	"wild type	101	110	Sequence"	"wild type	167	176	Sequence"	"[{""token"": ""Lrg1"", ""start_span"": 0, ""end_span"": 4, ""type"": ""Gene_or_geneproduct""}, {""token"": ""Lrhg"", ""start_span"": 7, ""end_span"": 11, ""type"": ""Gene_or_geneproduct""}, {""token"": ""mice"", ""start_span"": 63, ""end_span"": 67, ""type"": ""Organism""}, {""token"": ""wild type"", ""start_span"": 101, ""end_span"": 110, ""type"": ""Sequence""}, {""token"": ""wild type"", ""start_span"": 167, ""end_span"": 176, ""type"": ""Sequence""}]"
To determine if the difference could be accounted for by altered mucin gene expression, quantitative RT - PCR was used to measure mRNA expression of the intestinal goblet cell mucin gene, Muc2.	"gene	71	75	Sequence"	"mRNA	130	134	Chemical"	"goblet cell	164	175	Cell"	"gene	182	186	Sequence"	"Muc2	188	192	Gene_or_geneproduct"	"[{""token"": ""gene"", ""start_span"": 71, ""end_span"": 75, ""type"": ""Sequence""}, {""token"": ""mRNA"", ""start_span"": 130, ""end_span"": 134, ""type"": ""Chemical""}, {""token"": ""goblet cell"", ""start_span"": 164, ""end_span"": 175, ""type"": ""Cell""}, {""token"": ""gene"", ""start_span"": 182, ""end_span"": 186, ""type"": ""Sequence""}, {""token"": ""Muc2"", ""start_span"": 188, ""end_span"": 192, ""type"": ""Gene_or_geneproduct""}]"
Because the CF mouse intestinal phenotype is characterized by an innate type immune response, with increases in mast cells and neutrophils, the genes that affect these cells are of special interest.	"mouse	15	20	Organism"	"mast cells	112	122	Cell"	"neutrophils	127	138	Cell"	"genes	144	149	Sequence"	"cells	168	173	Cell"	"[{""token"": ""mouse"", ""start_span"": 15, ""end_span"": 20, ""type"": ""Organism""}, {""token"": ""mast cells"", ""start_span"": 112, ""end_span"": 122, ""type"": ""Cell""}, {""token"": ""neutrophils"", ""start_span"": 127, ""end_span"": 138, ""type"": ""Cell""}, {""token"": ""genes"", ""start_span"": 144, ""end_span"": 149, ""type"": ""Sequence""}, {""token"": ""cells"", ""start_span"": 168, ""end_span"": 173, ""type"": ""Cell""}]"
However, there is also evidence for hypersecretion of mucus in CF [ 12], and it is likely that effector molecules released by mast cells and neutrophils ( histamine, proteases, prostaglandins) have an important role in stimulating mucus secretion.	"effector molecules	95	113	Chemical"	"mast cells	126	136	Cell"	"neutrophils	141	152	Cell"	"histamine	155	164	Chemical"	"prostaglandins	177	191	Chemical"	"[{""token"": ""effector molecules"", ""start_span"": 95, ""end_span"": 113, ""type"": ""Chemical""}, {""token"": ""mast cells"", ""start_span"": 126, ""end_span"": 136, ""type"": ""Cell""}, {""token"": ""neutrophils"", ""start_span"": 141, ""end_span"": 152, ""type"": ""Cell""}, {""token"": ""histamine"", ""start_span"": 155, ""end_span"": 164, ""type"": ""Chemical""}, {""token"": ""prostaglandins"", ""start_span"": 177, ""end_span"": 191, ""type"": ""Chemical""}]"
Because of the inflammation of the CF small intestine, and the possible effects of immune cells on mucus secretion, the genes in the identified regions which are involved in mast cell and neutrophil differentiation and behavior are of special interest as potential CF modifiers.	"immune cells	83	95	Cell"	"genes	120	125	Sequence"	"regions	144	151	Sequence"	"mast cell	174	183	Cell"	"neutrophil	188	198	Cell"	"[{""token"": ""immune cells"", ""start_span"": 83, ""end_span"": 95, ""type"": ""Cell""}, {""token"": ""genes"", ""start_span"": 120, ""end_span"": 125, ""type"": ""Sequence""}, {""token"": ""regions"", ""start_span"": 144, ""end_span"": 151, ""type"": ""Sequence""}, {""token"": ""mast cell"", ""start_span"": 174, ""end_span"": 183, ""type"": ""Cell""}, {""token"": ""neutrophil"", ""start_span"": 188, ""end_span"": 198, ""type"": ""Cell""}]"
Pieces of mouse tail were sent to The Jackson Laboratory for simple sequence length polymorphism ( SSLP) PCR analysis with the DMit primers specific for B6 and 129 strain alleles.	"mouse	10	15	Organism"	"simple sequence length polymorphism	61	96	Sequence"	"SSLP	99	103	Sequence"	"primers	132	139	Sequence"	"alleles	171	178	Sequence"	"[{""token"": ""mouse"", ""start_span"": 10, ""end_span"": 15, ""type"": ""Organism""}, {""token"": ""simple sequence length polymorphism"", ""start_span"": 61, ""end_span"": 96, ""type"": ""Sequence""}, {""token"": ""SSLP"", ""start_span"": 99, ""end_span"": 103, ""type"": ""Sequence""}, {""token"": ""primers"", ""start_span"": 132, ""end_span"": 139, ""type"": ""Sequence""}, {""token"": ""alleles"", ""start_span"": 171, ""end_span"": 178, ""type"": ""Sequence""}]"
Each of these QTL map to mouse distal chromosome 6 and are linked to the marker D6Mit13, which lies within a cluster of 24 intact Tas2rs in the C57BL / 6 genome ( e. g., [ 16, 27, 28]).	"QTL	14	17	Sequence"	"mouse	25	30	Organism"	"chromosome	38	48	GO_ontology"	"cluster	109	116	Sequence"	"genome	154	160	Sequence"	"[{""token"": ""QTL"", ""start_span"": 14, ""end_span"": 17, ""type"": ""Sequence""}, {""token"": ""mouse"", ""start_span"": 25, ""end_span"": 30, ""type"": ""Organism""}, {""token"": ""chromosome"", ""start_span"": 38, ""end_span"": 48, ""type"": ""GO_ontology""}, {""token"": ""cluster"", ""start_span"": 109, ""end_span"": 116, ""type"": ""Sequence""}, {""token"": ""genome"", ""start_span"": 154, ""end_span"": 160, ""type"": ""Sequence""}]"
Using 17 BXD lines that were genotyped at 762 informative chromosomal markers, we mapped a major QTL for QHCl taste to a ~ 5 Mb interval on distal chromosome 6 that contains all 24 of the Tas2r genes in the distal cluster.	"chromosomal	58	69	GO_ontology"	"QTL	97	100	Sequence"	"interval on distal chromosome	128	157	Sequence"	"genes	194	199	Sequence"	"cluster	214	221	Sequence"	"[{""token"": ""chromosomal"", ""start_span"": 58, ""end_span"": 69, ""type"": ""GO_ontology""}, {""token"": ""QTL"", ""start_span"": 97, ""end_span"": 100, ""type"": ""Sequence""}, {""token"": ""interval on distal chromosome"", ""start_span"": 128, ""end_span"": 157, ""type"": ""Sequence""}, {""token"": ""genes"", ""start_span"": 194, ""end_span"": 199, ""type"": ""Sequence""}, {""token"": ""cluster"", ""start_span"": 214, ""end_span"": 221, ""type"": ""Sequence""}]"
( Top panel) The interval map ( see Methods) shows a significant QTL on chromosome 6 ( green) and a suggestive QTL on chromosome 8 ( yellow) affecting taste responses to 1 mM QHCl.	"interval map	17	29	Sequence"	"QTL	65	68	Sequence"	"chromosome	72	82	GO_ontology"	"QTL	111	114	Sequence"	"chromosome	118	128	GO_ontology"	"[{""token"": ""interval map"", ""start_span"": 17, ""end_span"": 29, ""type"": ""Sequence""}, {""token"": ""QTL"", ""start_span"": 65, ""end_span"": 68, ""type"": ""Sequence""}, {""token"": ""chromosome"", ""start_span"": 72, ""end_span"": 82, ""type"": ""GO_ontology""}, {""token"": ""QTL"", ""start_span"": 111, ""end_span"": 114, ""type"": ""Sequence""}, {""token"": ""chromosome"", ""start_span"": 118, ""end_span"": 128, ""type"": ""GO_ontology""}]"
Therefore, this QTL interval can be conservatively defined as that portion of mouse chromosome 6 that lies between D6Mit254 and D6Mit374, but is most likely restricted to the region between D6Mit61 and D6Mit374.	"QTL interval	16	28	Sequence"	"portion of mouse chromosome	67	94	Sequence"	"D6Mit374	128	136	Gene_or_geneproduct"	"region	175	181	Sequence"	"D6Mit374	202	210	Gene_or_geneproduct"	"[{""token"": ""QTL interval"", ""start_span"": 16, ""end_span"": 28, ""type"": ""Sequence""}, {""token"": ""portion of mouse chromosome"", ""start_span"": 67, ""end_span"": 94, ""type"": ""Sequence""}, {""token"": ""D6Mit374"", ""start_span"": 128, ""end_span"": 136, ""type"": ""Gene_or_geneproduct""}, {""token"": ""region"", ""start_span"": 175, ""end_span"": 181, ""type"": ""Sequence""}, {""token"": ""D6Mit374"", ""start_span"": 202, ""end_span"": 210, ""type"": ""Gene_or_geneproduct""}]"
Physical positions of the polymorphic markers are given in Mb, and are based on the May, 2004 build of the B6 mouse genome.	"positions	9	18	Sequence"	"polymorphic	26	37	Sequence"	"build	94	99	Sequence"	"mouse	110	115	Organism"	"genome	116	122	Sequence"	"[{""token"": ""positions"", ""start_span"": 9, ""end_span"": 18, ""type"": ""Sequence""}, {""token"": ""polymorphic"", ""start_span"": 26, ""end_span"": 37, ""type"": ""Sequence""}, {""token"": ""build"", ""start_span"": 94, ""end_span"": 99, ""type"": ""Sequence""}, {""token"": ""mouse"", ""start_span"": 110, ""end_span"": 115, ""type"": ""Organism""}, {""token"": ""genome"", ""start_span"": 116, ""end_span"": 122, ""type"": ""Sequence""}]"
Map positions, in Mb, represent chromosome 6 positions in the May, 2004 assembly of the B6 genome.	"Map	0	3	Sequence"	"positions	4	13	Sequence"	"chromosome 6 positions	32	54	Sequence"	"assembly	72	80	Sequence"	"genome	91	97	Sequence"	"[{""token"": ""Map"", ""start_span"": 0, ""end_span"": 3, ""type"": ""Sequence""}, {""token"": ""positions"", ""start_span"": 4, ""end_span"": 13, ""type"": ""Sequence""}, {""token"": ""chromosome 6 positions"", ""start_span"": 32, ""end_span"": 54, ""type"": ""Sequence""}, {""token"": ""assembly"", ""start_span"": 72, ""end_span"": 80, ""type"": ""Sequence""}, {""token"": ""genome"", ""start_span"": 91, ""end_span"": 97, ""type"": ""Sequence""}]"
A third, Tas2r120, could not be amplified from D2 genomic DNA ( Figure 5) using either of two pairs of oligonucleotides ( Additional file 2), suggesting that this Tas2r is deleted in D2 mice.	"Tas2r120	9	17	Gene_or_geneproduct"	"genomic DNA	50	61	Sequence"	"oligonucleotides	103	119	Sequence"	"deleted	172	179	Sequence"	"mice	186	190	Organism"	"[{""token"": ""Tas2r120"", ""start_span"": 9, ""end_span"": 17, ""type"": ""Gene_or_geneproduct""}, {""token"": ""genomic DNA"", ""start_span"": 50, ""end_span"": 61, ""type"": ""Sequence""}, {""token"": ""oligonucleotides"", ""start_span"": 103, ""end_span"": 119, ""type"": ""Sequence""}, {""token"": ""deleted"", ""start_span"": 172, ""end_span"": 179, ""type"": ""Sequence""}, {""token"": ""mice"", ""start_span"": 186, ""end_span"": 190, ""type"": ""Organism""}]"
Using 17 RI lines and 762 chromosomal markers, we have restricted the quinine taste QTL to a < 5 Mb region on distal chromosome 6 that contains 24 Tas2r genes.	"chromosomal	26	37	GO_ontology"	"quinine	70	77	Chemical"	"QTL	84	87	Sequence"	"region on distal chromosome	100	127	Sequence"	"genes	153	158	Sequence"	"[{""token"": ""chromosomal"", ""start_span"": 26, ""end_span"": 37, ""type"": ""GO_ontology""}, {""token"": ""quinine"", ""start_span"": 70, ""end_span"": 77, ""type"": ""Chemical""}, {""token"": ""QTL"", ""start_span"": 84, ""end_span"": 87, ""type"": ""Sequence""}, {""token"": ""region on distal chromosome"", ""start_span"": 100, ""end_span"": 127, ""type"": ""Sequence""}, {""token"": ""genes"", ""start_span"": 153, ""end_span"": 158, ""type"": ""Sequence""}]"
However, several physiological studies have suggested that quinine can directly activate G proteins or cationic conductances, or can block K + channels in taste receptor cells [ 34 - 36].	"quinine	59	66	Chemical"	"proteins	91	99	Chemical"	"cationic	103	111	Chemical"	"K +	139	142	Chemical"	"taste receptor cells	155	175	Cell"	"[{""token"": ""quinine"", ""start_span"": 59, ""end_span"": 66, ""type"": ""Chemical""}, {""token"": ""proteins"", ""start_span"": 91, ""end_span"": 99, ""type"": ""Chemical""}, {""token"": ""cationic"", ""start_span"": 103, ""end_span"": 111, ""type"": ""Chemical""}, {""token"": ""K +"", ""start_span"": 139, ""end_span"": 142, ""type"": ""Chemical""}, {""token"": ""taste receptor cells"", ""start_span"": 155, ""end_span"": 175, ""type"": ""Cell""}]"
It is somewhat puzzling that 22 of the 24 Tas2rs examined encode variant proteins in B6 and D2 mice even though these strains exhibit similar taste responses to bitter compounds such as DB or cyclohexamide [ 47].	"variant	65	72	Sequence"	"proteins	73	81	Chemical"	"mice	95	99	Organism"	"compounds	168	177	Chemical"	"cyclohexamide	192	205	Chemical"	"[{""token"": ""variant"", ""start_span"": 65, ""end_span"": 72, ""type"": ""Sequence""}, {""token"": ""proteins"", ""start_span"": 73, ""end_span"": 81, ""type"": ""Chemical""}, {""token"": ""mice"", ""start_span"": 95, ""end_span"": 99, ""type"": ""Organism""}, {""token"": ""compounds"", ""start_span"": 168, ""end_span"": 177, ""type"": ""Chemical""}, {""token"": ""cyclohexamide"", ""start_span"": 192, ""end_span"": 205, ""type"": ""Chemical""}]"
Lick ratios for individual mice to sucrose were generally ~ 1. 0 ( data not shown), indicating that either concentration of this compound was licked at a similar rate to water by these thirsty animals.	"mice	27	31	Organism"	"sucrose	35	42	Chemical"	"compound	129	137	Chemical"	"water	170	175	Chemical"	"animals	193	200	Organism"	"[{""token"": ""mice"", ""start_span"": 27, ""end_span"": 31, ""type"": ""Organism""}, {""token"": ""sucrose"", ""start_span"": 35, ""end_span"": 42, ""type"": ""Chemical""}, {""token"": ""compound"", ""start_span"": 129, ""end_span"": 137, ""type"": ""Chemical""}, {""token"": ""water"", ""start_span"": 170, ""end_span"": 175, ""type"": ""Chemical""}, {""token"": ""animals"", ""start_span"": 193, ""end_span"": 200, ""type"": ""Organism""}]"
This method evaluates the association between trait values ( lick ratios) and expected genotype of a hypothetical quantitative trait locus ( QTL) at multiple analysis points between each pair of adjacent marker loci.	"expected	78	86	Sequence"	"genotype	87	95	Sequence"	"quantitative trait locus	114	138	Sequence"	"QTL	141	144	Sequence"	"loci	211	215	Sequence"	"[{""token"": ""expected"", ""start_span"": 78, ""end_span"": 86, ""type"": ""Sequence""}, {""token"": ""genotype"", ""start_span"": 87, ""end_span"": 95, ""type"": ""Sequence""}, {""token"": ""quantitative trait locus"", ""start_span"": 114, ""end_span"": 138, ""type"": ""Sequence""}, {""token"": ""QTL"", ""start_span"": 141, ""end_span"": 144, ""type"": ""Sequence""}, {""token"": ""loci"", ""start_span"": 211, ""end_span"": 215, ""type"": ""Sequence""}]"
We used bioinformatics techniques to characterise a highly conserved peptide at the C - terminus of the PAX6 protein.	"conserved	59	68	Sequence"	"peptide	69	76	Sequence"	"C - terminus	84	96	Sequence"	"PAX6	104	108	Gene_or_geneproduct"	"protein	109	116	Chemical"	"[{""token"": ""conserved"", ""start_span"": 59, ""end_span"": 68, ""type"": ""Sequence""}, {""token"": ""peptide"", ""start_span"": 69, ""end_span"": 76, ""type"": ""Sequence""}, {""token"": ""C - terminus"", ""start_span"": 84, ""end_span"": 96, ""type"": ""Sequence""}, {""token"": ""PAX6"", ""start_span"": 104, ""end_span"": 108, ""type"": ""Gene_or_geneproduct""}, {""token"": ""protein"", ""start_span"": 109, ""end_span"": 116, ""type"": ""Chemical""}]"
We and others [ 31 - 33] noted that there is significant sequence conservation at the C - terminal end of the PAX6 protein.	"sequence	57	65	Sequence"	"conservation	66	78	Sequence"	"C - terminal end	86	102	Sequence"	"PAX6	110	114	Gene_or_geneproduct"	"protein	115	122	Chemical"	"[{""token"": ""sequence"", ""start_span"": 57, ""end_span"": 65, ""type"": ""Sequence""}, {""token"": ""conservation"", ""start_span"": 66, ""end_span"": 78, ""type"": ""Sequence""}, {""token"": ""C - terminal end"", ""start_span"": 86, ""end_span"": 102, ""type"": ""Sequence""}, {""token"": ""PAX6"", ""start_span"": 110, ""end_span"": 114, ""type"": ""Gene_or_geneproduct""}, {""token"": ""protein"", ""start_span"": 115, ""end_span"": 122, ""type"": ""Chemical""}]"
Strong conservation was seen in distantly related species such as axolotl ( Ambystoma mexicanum) and sea urchin ( Paracentrotus lividus) ( Figure 1a).	"conservation	7	19	Sequence"	"axolotl	66	73	Organism"	"Ambystoma mexicanum	76	95	Organism"	"sea urchin	101	111	Organism"	"Paracentrotus lividus	114	135	Organism"	"[{""token"": ""conservation"", ""start_span"": 7, ""end_span"": 19, ""type"": ""Sequence""}, {""token"": ""axolotl"", ""start_span"": 66, ""end_span"": 73, ""type"": ""Organism""}, {""token"": ""Ambystoma mexicanum"", ""start_span"": 76, ""end_span"": 95, ""type"": ""Organism""}, {""token"": ""sea urchin"", ""start_span"": 101, ""end_span"": 111, ""type"": ""Organism""}, {""token"": ""Paracentrotus lividus"", ""start_span"": 114, ""end_span"": 135, ""type"": ""Organism""}]"
HOMER3 is a member of the HOMER family of neuronal post - synaptic density ( PSD) proteins [ 35].	"HOMER3	0	6	Gene_or_geneproduct"	"neuronal	42	50	Cell"	"post - synaptic density	51	74	GO_ontology"	"PSD	77	80	GO_ontology"	"proteins	82	90	Chemical"	"[{""token"": ""HOMER3"", ""start_span"": 0, ""end_span"": 6, ""type"": ""Gene_or_geneproduct""}, {""token"": ""neuronal"", ""start_span"": 42, ""end_span"": 50, ""type"": ""Cell""}, {""token"": ""post - synaptic density"", ""start_span"": 51, ""end_span"": 74, ""type"": ""GO_ontology""}, {""token"": ""PSD"", ""start_span"": 77, ""end_span"": 80, ""type"": ""GO_ontology""}, {""token"": ""proteins"", ""start_span"": 82, ""end_span"": 90, ""type"": ""Chemical""}]"
This is consistent with the idea that they were pulled out because the encoded proteins interact specifically with the C - terminal peptide or PST domain of PAX6.	"proteins	79	87	Chemical"	"C - terminal	119	131	Sequence"	"peptide	132	139	Sequence"	"domain	147	153	Sequence"	"PAX6	157	161	Gene_or_geneproduct"	"[{""token"": ""proteins"", ""start_span"": 79, ""end_span"": 87, ""type"": ""Chemical""}, {""token"": ""C - terminal"", ""start_span"": 119, ""end_span"": 131, ""type"": ""Sequence""}, {""token"": ""peptide"", ""start_span"": 132, ""end_span"": 139, ""type"": ""Sequence""}, {""token"": ""domain"", ""start_span"": 147, ""end_span"": 153, ""type"": ""Sequence""}, {""token"": ""PAX6"", ""start_span"": 157, ""end_span"": 161, ""type"": ""Gene_or_geneproduct""}]"
We conducted pairwise tests between specific constructs to confirm the interactions identified in the library screen and to further investigate the interaction between PAX6 and HOMER3, DNCL1 and TRIM11.	"constructs	45	55	Sequence"	"PAX6	168	172	Gene_or_geneproduct"	"HOMER3	177	183	Gene_or_geneproduct"	"DNCL1	185	190	Gene_or_geneproduct"	"TRIM11	195	201	Gene_or_geneproduct"	"[{""token"": ""constructs"", ""start_span"": 45, ""end_span"": 55, ""type"": ""Sequence""}, {""token"": ""PAX6"", ""start_span"": 168, ""end_span"": 172, ""type"": ""Gene_or_geneproduct""}, {""token"": ""HOMER3"", ""start_span"": 177, ""end_span"": 183, ""type"": ""Gene_or_geneproduct""}, {""token"": ""DNCL1"", ""start_span"": 185, ""end_span"": 190, ""type"": ""Gene_or_geneproduct""}, {""token"": ""TRIM11"", ""start_span"": 195, ""end_span"": 201, ""type"": ""Gene_or_geneproduct""}]"
The missing coding region was inserted into the truncated Homer3 cDNA to give a full - length expression construct ( see Methods).	"coding region	12	25	Sequence"	"inserted	30	38	Sequence"	"Homer3	58	64	Gene_or_geneproduct"	"cDNA	65	69	Sequence"	"construct	105	114	Sequence"	"[{""token"": ""coding region"", ""start_span"": 12, ""end_span"": 25, ""type"": ""Sequence""}, {""token"": ""inserted"", ""start_span"": 30, ""end_span"": 38, ""type"": ""Sequence""}, {""token"": ""Homer3"", ""start_span"": 58, ""end_span"": 64, ""type"": ""Gene_or_geneproduct""}, {""token"": ""cDNA"", ""start_span"": 65, ""end_span"": 69, ""type"": ""Sequence""}, {""token"": ""construct"", ""start_span"": 105, ""end_span"": 114, ""type"": ""Sequence""}]"
The C - terminal extension mutations X423L and1615del10 mutations both dramatically reduced or abolished the interaction with HOMER3 and DNCL1 ( Figure 3, Table 1).	"C - terminal	4	16	Sequence"	"mutations	27	36	Sequence"	"mutations	56	65	Sequence"	"HOMER3	126	132	Gene_or_geneproduct"	"DNCL1	137	142	Gene_or_geneproduct"	"[{""token"": ""C - terminal"", ""start_span"": 4, ""end_span"": 16, ""type"": ""Sequence""}, {""token"": ""mutations"", ""start_span"": 27, ""end_span"": 36, ""type"": ""Sequence""}, {""token"": ""mutations"", ""start_span"": 56, ""end_span"": 65, ""type"": ""Sequence""}, {""token"": ""HOMER3"", ""start_span"": 126, ""end_span"": 132, ""type"": ""Gene_or_geneproduct""}, {""token"": ""DNCL1"", ""start_span"": 137, ""end_span"": 142, ""type"": ""Gene_or_geneproduct""}]"
