Pigment filled macrophages that resemble human clump cells were often located in the angle of CBA / CaJ mice but were never sufficient to block drainage.	"Pigment	0	7	Chemical"	"macrophages	15	26	Cell"	"human	41	46	Organism"	"cells	53	58	Cell"	"mice	104	108	Organism"	"[{""token"": ""Pigment"", ""start_span"": 0, ""end_span"": 7, ""type"": ""Chemical""}, {""token"": ""macrophages"", ""start_span"": 15, ""end_span"": 26, ""type"": ""Cell""}, {""token"": ""human"", ""start_span"": 41, ""end_span"": 46, ""type"": ""Organism""}, {""token"": ""cells"", ""start_span"": 53, ""end_span"": 58, ""type"": ""Cell""}, {""token"": ""mice"", ""start_span"": 104, ""end_span"": 108, ""type"": ""Organism""}]"
Mutations in the myocilin gene ( MYOC) cause human glaucoma.	"Mutations	0	9	Sequence"	"myocilin	17	25	Gene_or_geneproduct"	"gene	26	30	Sequence"	"MYOC	33	37	Gene_or_geneproduct"	"human	45	50	Organism"	"[{""token"": ""Mutations"", ""start_span"": 0, ""end_span"": 9, ""type"": ""Sequence""}, {""token"": ""myocilin"", ""start_span"": 17, ""end_span"": 25, ""type"": ""Gene_or_geneproduct""}, {""token"": ""gene"", ""start_span"": 26, ""end_span"": 30, ""type"": ""Sequence""}, {""token"": ""MYOC"", ""start_span"": 33, ""end_span"": 37, ""type"": ""Gene_or_geneproduct""}, {""token"": ""human"", ""start_span"": 45, ""end_span"": 50, ""type"": ""Organism""}]"
To determine if allelic variation in the mouse Myoc gene associated with IOP in mouse strains, we analyzed the gene in an assortment of strains with different IOPs.	"allelic	16	23	Sequence"	"mouse Myoc	41	51	Gene_or_geneproduct"	"gene	52	56	Sequence"	"mouse	80	85	Organism"	"gene	111	115	Sequence"	"[{""token"": ""allelic"", ""start_span"": 16, ""end_span"": 23, ""type"": ""Sequence""}, {""token"": ""mouse Myoc"", ""start_span"": 41, ""end_span"": 51, ""type"": ""Gene_or_geneproduct""}, {""token"": ""gene"", ""start_span"": 52, ""end_span"": 56, ""type"": ""Sequence""}, {""token"": ""mouse"", ""start_span"": 80, ""end_span"": 85, ""type"": ""Organism""}, {""token"": ""gene"", ""start_span"": 111, ""end_span"": 115, ""type"": ""Sequence""}]"
To test if genetic perturbations that cause obesity and diabetes can alter IOP, we compared mice that were genetically similar but were either homozygous or heterozygous for a leptin receptor mutation ( db) that results in obesity and diabetes before 4 months of age on the C57BLKS / J strain background used [ 27].	"genetic	11	18	Sequence"	"mice	92	96	Organism"	"genetically	107	118	Sequence"	"leptin receptor	176	191	Gene_or_geneproduct"	"mutation	192	200	Sequence"	"[{""token"": ""genetic"", ""start_span"": 11, ""end_span"": 18, ""type"": ""Sequence""}, {""token"": ""mice"", ""start_span"": 92, ""end_span"": 96, ""type"": ""Organism""}, {""token"": ""genetically"", ""start_span"": 107, ""end_span"": 118, ""type"": ""Sequence""}, {""token"": ""leptin receptor"", ""start_span"": 176, ""end_span"": 191, ""type"": ""Gene_or_geneproduct""}, {""token"": ""mutation"", ""start_span"": 192, ""end_span"": 200, ""type"": ""Sequence""}]"
The albino mice were homozygous and coisogenic for a mutant allele of tyrosinase ( Tyrc - 2J) that arose on the otherwise pigmented B6 background.	"mice	11	15	Organism"	"mutant	53	59	Sequence"	"allele	60	66	Sequence"	"tyrosinase	70	80	Gene_or_geneproduct"	"pigmented	122	131	Chemical"	"[{""token"": ""mice"", ""start_span"": 11, ""end_span"": 15, ""type"": ""Organism""}, {""token"": ""mutant"", ""start_span"": 53, ""end_span"": 59, ""type"": ""Sequence""}, {""token"": ""allele"", ""start_span"": 60, ""end_span"": 66, ""type"": ""Sequence""}, {""token"": ""tyrosinase"", ""start_span"": 70, ""end_span"": 80, ""type"": ""Gene_or_geneproduct""}, {""token"": ""pigmented"", ""start_span"": 122, ""end_span"": 131, ""type"": ""Chemical""}]"
To test if genetic perturbations that cause obesity and diabetes can alter IOP, we compared groups of mice that were genetically similar except that they were either homozygous or heterozygous for a leptin receptor mutation ( db) that results in early onset obesity and diabetes.	"genetic	11	18	Sequence"	"mice	102	106	Organism"	"genetically	117	128	Sequence"	"leptin receptor	199	214	Gene_or_geneproduct"	"mutation	215	223	Sequence"	"[{""token"": ""genetic"", ""start_span"": 11, ""end_span"": 18, ""type"": ""Sequence""}, {""token"": ""mice"", ""start_span"": 102, ""end_span"": 106, ""type"": ""Organism""}, {""token"": ""genetically"", ""start_span"": 117, ""end_span"": 128, ""type"": ""Sequence""}, {""token"": ""leptin receptor"", ""start_span"": 199, ""end_span"": 214, ""type"": ""Gene_or_geneproduct""}, {""token"": ""mutation"", ""start_span"": 215, ""end_span"": 223, ""type"": ""Sequence""}]"
Here, we show increased IOP in mice lacking tyrosinase activity compared to otherwise genetically identical pigmented B6 mice.	"mice	31	35	Organism"	"tyrosinase	44	54	Gene_or_geneproduct"	"genetically	86	97	Sequence"	"pigmented	108	117	Chemical"	"mice	121	125	Organism"	"[{""token"": ""mice"", ""start_span"": 31, ""end_span"": 35, ""type"": ""Organism""}, {""token"": ""tyrosinase"", ""start_span"": 44, ""end_span"": 54, ""type"": ""Gene_or_geneproduct""}, {""token"": ""genetically"", ""start_span"": 86, ""end_span"": 97, ""type"": ""Sequence""}, {""token"": ""pigmented"", ""start_span"": 108, ""end_span"": 117, ""type"": ""Chemical""}, {""token"": ""mice"", ""start_span"": 121, ""end_span"": 125, ""type"": ""Organism""}]"
In agreement with this result, mice with albino eyes that are homozygous for tyrosinase or pink eye dilution mutations have altered diurnal rhythms compared to pigmented mice [ 75].	"mice	31	35	Organism"	"tyrosinase	77	87	Gene_or_geneproduct"	"mutations	109	118	Sequence"	"pigmented	160	169	Chemical"	"mice	170	174	Organism"	"[{""token"": ""mice"", ""start_span"": 31, ""end_span"": 35, ""type"": ""Organism""}, {""token"": ""tyrosinase"", ""start_span"": 77, ""end_span"": 87, ""type"": ""Gene_or_geneproduct""}, {""token"": ""mutations"", ""start_span"": 109, ""end_span"": 118, ""type"": ""Sequence""}, {""token"": ""pigmented"", ""start_span"": 160, ""end_span"": 169, ""type"": ""Chemical""}, {""token"": ""mice"", ""start_span"": 170, ""end_span"": 174, ""type"": ""Organism""}]"
Eyes from at least 2 mice of the listed strains were fixed ( 4% paraformaldehyde or Fekete ' s acid - alcohol - formalin fixative) processed, paraffin embedded and sectioned as previously reported [ 15, 79], except that the paraformaldehyde was buffered with 0. 1 M phosphate buffer.	"mice	21	25	Organism"	"acid	95	99	Chemical"	"alcohol	102	109	Chemical"	"buffered	245	253	Chemical"	"phosphate	266	275	Chemical"	"[{""token"": ""mice"", ""start_span"": 21, ""end_span"": 25, ""type"": ""Organism""}, {""token"": ""acid"", ""start_span"": 95, ""end_span"": 99, ""type"": ""Chemical""}, {""token"": ""alcohol"", ""start_span"": 102, ""end_span"": 109, ""type"": ""Chemical""}, {""token"": ""buffered"", ""start_span"": 245, ""end_span"": 253, ""type"": ""Chemical""}, {""token"": ""phosphate"", ""start_span"": 266, ""end_span"": 275, ""type"": ""Chemical""}]"
Following the landmark discovery by Scully et al that the homologous recombinase RAD51 colocalizes at subnuclear sites with BRCA1 [ 9], a number of additional results have provided evidence that both BRCA1 and BRCA2 are involved in recombinational repair of DNA damage.	"RAD51	81	86	Gene_or_geneproduct"	"BRCA1	124	129	Gene_or_geneproduct"	"BRCA1	200	205	Gene_or_geneproduct"	"BRCA2	210	215	Gene_or_geneproduct"	"DNA	258	261	Sequence"	"[{""token"": ""RAD51"", ""start_span"": 81, ""end_span"": 86, ""type"": ""Gene_or_geneproduct""}, {""token"": ""BRCA1"", ""start_span"": 124, ""end_span"": 129, ""type"": ""Gene_or_geneproduct""}, {""token"": ""BRCA1"", ""start_span"": 200, ""end_span"": 205, ""type"": ""Gene_or_geneproduct""}, {""token"": ""BRCA2"", ""start_span"": 210, ""end_span"": 215, ""type"": ""Gene_or_geneproduct""}, {""token"": ""DNA"", ""start_span"": 258, ""end_span"": 261, ""type"": ""Sequence""}]"
Cell lines defective in either BRCA1 or BRCA2 are sensitive to damaging agents that form double - strand breaks ( DSBs), as are other cell lines defective in recombinational repair ( reviewed in [ 15]).	"Cell	0	4	Cell"	"BRCA1	31	36	Gene_or_geneproduct"	"BRCA2	40	45	Gene_or_geneproduct"	"double - strand	89	104	Sequence"	"cell	134	138	Cell"	"[{""token"": ""Cell"", ""start_span"": 0, ""end_span"": 4, ""type"": ""Cell""}, {""token"": ""BRCA1"", ""start_span"": 31, ""end_span"": 36, ""type"": ""Gene_or_geneproduct""}, {""token"": ""BRCA2"", ""start_span"": 40, ""end_span"": 45, ""type"": ""Gene_or_geneproduct""}, {""token"": ""double - strand"", ""start_span"": 89, ""end_span"": 104, ""type"": ""Sequence""}, {""token"": ""cell"", ""start_span"": 134, ""end_span"": 138, ""type"": ""Cell""}]"
CAPAN - 1 cells carry a deletion of BRCA2 on one homolog and codes for a protein truncated at amino acid 1981 on the other homolog.	"cells	10	15	Cell"	"deletion	24	32	Sequence"	"BRCA2	36	41	Gene_or_geneproduct"	"protein	73	80	Chemical"	"amino acid	94	104	Chemical"	"[{""token"": ""cells"", ""start_span"": 10, ""end_span"": 15, ""type"": ""Cell""}, {""token"": ""deletion"", ""start_span"": 24, ""end_span"": 32, ""type"": ""Sequence""}, {""token"": ""BRCA2"", ""start_span"": 36, ""end_span"": 41, ""type"": ""Gene_or_geneproduct""}, {""token"": ""protein"", ""start_span"": 73, ""end_span"": 80, ""type"": ""Chemical""}, {""token"": ""amino acid"", ""start_span"": 94, ""end_span"": 104, ""type"": ""Chemical""}]"
The authors indicate that the level of I - SceI - induced recombination in CAPAN - 1 is over 100 - fold less than that seen using other ( BRCA2 +) human tumor cell lines.	"I - SceI	39	47	Gene_or_geneproduct"	"BRCA2	138	143	Gene_or_geneproduct"	"+	144	145	Sequence"	"human	147	152	Organism"	"cell	159	163	Cell"	"[{""token"": ""I - SceI"", ""start_span"": 39, ""end_span"": 47, ""type"": ""Gene_or_geneproduct""}, {""token"": ""BRCA2"", ""start_span"": 138, ""end_span"": 143, ""type"": ""Gene_or_geneproduct""}, {""token"": ""+"", ""start_span"": 144, ""end_span"": 145, ""type"": ""Sequence""}, {""token"": ""human"", ""start_span"": 147, ""end_span"": 152, ""type"": ""Organism""}, {""token"": ""cell"", ""start_span"": 159, ""end_span"": 163, ""type"": ""Cell""}]"
The different lines examined, however, are very likely to differ genetically from CAPAN - 1 cells not only at the BRCA2 locus, but also at a very large number of additional loci.	"genetically	65	76	Sequence"	"cells	92	97	Cell"	"BRCA2	114	119	Gene_or_geneproduct"	"locus	120	125	Sequence"	"loci	173	177	Sequence"	"[{""token"": ""genetically"", ""start_span"": 65, ""end_span"": 76, ""type"": ""Sequence""}, {""token"": ""cells"", ""start_span"": 92, ""end_span"": 97, ""type"": ""Cell""}, {""token"": ""BRCA2"", ""start_span"": 114, ""end_span"": 119, ""type"": ""Gene_or_geneproduct""}, {""token"": ""locus"", ""start_span"": 120, ""end_span"": 125, ""type"": ""Sequence""}, {""token"": ""loci"", ""start_span"": 173, ""end_span"": 177, ""type"": ""Sequence""}]"
It is possible that RAD51 may alternatively be capable of BRCA2 - independent transport, but mislocalization of BRCA2 to the cytoplasm may sequester RAD51 and block its normal mode of transport.	"RAD51	20	25	Gene_or_geneproduct"	"BRCA2	58	63	Gene_or_geneproduct"	"BRCA2	112	117	Gene_or_geneproduct"	"cytoplasm	125	134	GO_ontology"	"RAD51	149	154	Gene_or_geneproduct"	"[{""token"": ""RAD51"", ""start_span"": 20, ""end_span"": 25, ""type"": ""Gene_or_geneproduct""}, {""token"": ""BRCA2"", ""start_span"": 58, ""end_span"": 63, ""type"": ""Gene_or_geneproduct""}, {""token"": ""BRCA2"", ""start_span"": 112, ""end_span"": 117, ""type"": ""Gene_or_geneproduct""}, {""token"": ""cytoplasm"", ""start_span"": 125, ""end_span"": 134, ""type"": ""GO_ontology""}, {""token"": ""RAD51"", ""start_span"": 149, ""end_span"": 154, ""type"": ""Gene_or_geneproduct""}]"
Given the elaborate nature of the RAD51 - BRCA2 interaction, it seems somewhat unlikely that the only role of BRCA2 in promoting recombination is to serve as a specific nuclear transporter of RAD51.	"RAD51	34	39	Gene_or_geneproduct"	"BRCA2	42	47	Gene_or_geneproduct"	"BRCA2	110	115	Gene_or_geneproduct"	"nuclear	169	176	GO_ontology"	"RAD51	192	197	Gene_or_geneproduct"	"[{""token"": ""RAD51"", ""start_span"": 34, ""end_span"": 39, ""type"": ""Gene_or_geneproduct""}, {""token"": ""BRCA2"", ""start_span"": 42, ""end_span"": 47, ""type"": ""Gene_or_geneproduct""}, {""token"": ""BRCA2"", ""start_span"": 110, ""end_span"": 115, ""type"": ""Gene_or_geneproduct""}, {""token"": ""nuclear"", ""start_span"": 169, ""end_span"": 176, ""type"": ""GO_ontology""}, {""token"": ""RAD51"", ""start_span"": 192, ""end_span"": 197, ""type"": ""Gene_or_geneproduct""}]"
For example, previous studies indicated that RAD51 shows little binding preference for single - strand DNA ( ssDNA) over double - strand DNA ( dsDNA) [ 3, 29].	"RAD51	45	50	Gene_or_geneproduct"	"single - strand	87	102	Sequence"	"DNA	103	106	Sequence"	"double - strand	121	136	Sequence"	"DNA	137	140	Sequence"	"[{""token"": ""RAD51"", ""start_span"": 45, ""end_span"": 50, ""type"": ""Gene_or_geneproduct""}, {""token"": ""single - strand"", ""start_span"": 87, ""end_span"": 102, ""type"": ""Sequence""}, {""token"": ""DNA"", ""start_span"": 103, ""end_span"": 106, ""type"": ""Sequence""}, {""token"": ""double - strand"", ""start_span"": 121, ""end_span"": 136, ""type"": ""Sequence""}, {""token"": ""DNA"", ""start_span"": 137, ""end_span"": 140, ""type"": ""Sequence""}]"
Several proteins that interact with RAD51 are thought to ' mediate ' assembly of RAD51 at sites of DNA damage ( reviewed in [ 30]).	"proteins	8	16	Chemical"	"RAD51	36	41	Gene_or_geneproduct"	"RAD51	81	86	Gene_or_geneproduct"	"sites	90	95	Sequence"	"DNA	99	102	Sequence"	"[{""token"": ""proteins"", ""start_span"": 8, ""end_span"": 16, ""type"": ""Chemical""}, {""token"": ""RAD51"", ""start_span"": 36, ""end_span"": 41, ""type"": ""Gene_or_geneproduct""}, {""token"": ""RAD51"", ""start_span"": 81, ""end_span"": 86, ""type"": ""Gene_or_geneproduct""}, {""token"": ""sites"", ""start_span"": 90, ""end_span"": 95, ""type"": ""Sequence""}, {""token"": ""DNA"", ""start_span"": 99, ""end_span"": 102, ""type"": ""Sequence""}]"
BRCA2 - Rad51 interaction is proposed to suppress RAD51 - BRCA2 interactions until DNA damage is present.	"BRCA2	0	5	Gene_or_geneproduct"	"Rad51	8	13	Gene_or_geneproduct"	"RAD51	50	55	Gene_or_geneproduct"	"BRCA2	58	63	Gene_or_geneproduct"	"DNA	83	86	Sequence"	"[{""token"": ""BRCA2"", ""start_span"": 0, ""end_span"": 5, ""type"": ""Gene_or_geneproduct""}, {""token"": ""Rad51"", ""start_span"": 8, ""end_span"": 13, ""type"": ""Gene_or_geneproduct""}, {""token"": ""RAD51"", ""start_span"": 50, ""end_span"": 55, ""type"": ""Gene_or_geneproduct""}, {""token"": ""BRCA2"", ""start_span"": 58, ""end_span"": 63, ""type"": ""Gene_or_geneproduct""}, {""token"": ""DNA"", ""start_span"": 83, ""end_span"": 86, ""type"": ""Sequence""}]"
The ease of manipulating its genome has helped establish the mouse as the premier model organism for mammalian genetic studies.	"genome	29	35	Sequence"	"mouse	61	66	Organism"	"organism	88	96	Organism"	"mammalian	101	110	Organism"	"genetic	111	118	Sequence"	"[{""token"": ""genome"", ""start_span"": 29, ""end_span"": 35, ""type"": ""Sequence""}, {""token"": ""mouse"", ""start_span"": 61, ""end_span"": 66, ""type"": ""Organism""}, {""token"": ""organism"", ""start_span"": 88, ""end_span"": 96, ""type"": ""Organism""}, {""token"": ""mammalian"", ""start_span"": 101, ""end_span"": 110, ""type"": ""Organism""}, {""token"": ""genetic"", ""start_span"": 111, ""end_span"": 118, ""type"": ""Sequence""}]"
Genetically manipulated mice, often incorporating gene - based reporters, are frequently being used to model and understand mammalian development and disease processes.	"Genetically	0	11	Sequence"	"mice	24	28	Organism"	"incorporating	36	49	Sequence"	"gene	50	54	Sequence"	"mammalian	124	133	Organism"	"[{""token"": ""Genetically"", ""start_span"": 0, ""end_span"": 11, ""type"": ""Sequence""}, {""token"": ""mice"", ""start_span"": 24, ""end_span"": 28, ""type"": ""Organism""}, {""token"": ""incorporating"", ""start_span"": 36, ""end_span"": 49, ""type"": ""Sequence""}, {""token"": ""gene"", ""start_span"": 50, ""end_span"": 54, ""type"": ""Sequence""}, {""token"": ""mammalian"", ""start_span"": 124, ""end_span"": 133, ""type"": ""Organism""}]"
An ES cell - mediated transgenic approach was used to evaluate the Enhanced Cyan Fluorescent Protein ( ECFP) and Enhanced Yellow Fluorescent Protein ( EYFP) wtGFP spectral variants [ 4, 11].	"cell	6	10	Cell"	"transgenic	22	32	Sequence"	"Protein	93	100	Chemical"	"Protein	141	148	Chemical"	"variants	172	180	Sequence"	"[{""token"": ""cell"", ""start_span"": 6, ""end_span"": 10, ""type"": ""Cell""}, {""token"": ""transgenic"", ""start_span"": 22, ""end_span"": 32, ""type"": ""Sequence""}, {""token"": ""Protein"", ""start_span"": 93, ""end_span"": 100, ""type"": ""Chemical""}, {""token"": ""Protein"", ""start_span"": 141, ""end_span"": 148, ""type"": ""Chemical""}, {""token"": ""variants"", ""start_span"": 172, ""end_span"": 180, ""type"": ""Sequence""}]"
Of these, DsRed1 ( referred to as drFP585 by Matz et al., [ 12]), a 28 kDa protein isolated from the IndoPacific sea anemone Discosoma sp, posseses the longest excitation ( 558 nm) and emission ( 583 nm) wavelength maxima known for a wild - type autofluorescent protein.	"protein	75	82	Chemical"	"sea anemone	113	124	Organism"	"Discosoma	125	134	Organism"	"wild - type	234	245	Sequence"	"protein	262	269	Chemical"	"[{""token"": ""protein"", ""start_span"": 75, ""end_span"": 82, ""type"": ""Chemical""}, {""token"": ""sea anemone"", ""start_span"": 113, ""end_span"": 124, ""type"": ""Organism""}, {""token"": ""Discosoma"", ""start_span"": 125, ""end_span"": 134, ""type"": ""Organism""}, {""token"": ""wild - type"", ""start_span"": 234, ""end_span"": 245, ""type"": ""Sequence""}, {""token"": ""protein"", ""start_span"": 262, ""end_span"": 269, ""type"": ""Chemical""}]"
Plasmids were constructed for driving widespread expression of each of the gene - based fluorescent protein ( FP) reporters and were tested in ES cell - mediated transgenics as described previously [ 2].	"Plasmids	0	8	Sequence"	"gene	75	79	Sequence"	"protein	100	107	Chemical"	"cell	146	150	Cell"	"transgenics	162	173	Sequence"	"[{""token"": ""Plasmids"", ""start_span"": 0, ""end_span"": 8, ""type"": ""Sequence""}, {""token"": ""gene"", ""start_span"": 75, ""end_span"": 79, ""type"": ""Sequence""}, {""token"": ""protein"", ""start_span"": 100, ""end_span"": 107, ""type"": ""Chemical""}, {""token"": ""cell"", ""start_span"": 146, ""end_span"": 150, ""type"": ""Cell""}, {""token"": ""transgenics"", ""start_span"": 162, ""end_span"": 173, ""type"": ""Sequence""}]"
( e - h) two transgenic ( TG / +) E13. 5 embryos dissected free of their extraembryonic membranes, one is blue / cyan fluorescent ( CK6 / ECFP transgenic, left) and the other is yellow / green fluorescent ( 7YC5 / EYFP transgenic, right).	"transgenic	13	23	Sequence"	"TG	26	28	Sequence"	"+	31	32	Sequence"	"transgenic	143	153	Sequence"	"transgenic	219	229	Sequence"	"[{""token"": ""transgenic"", ""start_span"": 13, ""end_span"": 23, ""type"": ""Sequence""}, {""token"": ""TG"", ""start_span"": 26, ""end_span"": 28, ""type"": ""Sequence""}, {""token"": ""+"", ""start_span"": 31, ""end_span"": 32, ""type"": ""Sequence""}, {""token"": ""transgenic"", ""start_span"": 143, ""end_span"": 153, ""type"": ""Sequence""}, {""token"": ""transgenic"", ""start_span"": 219, ""end_span"": 229, ""type"": ""Sequence""}]"
This promoter / enhancer combination has previously been shown to drive strong and widespread transgene expression in ES cells, embryos and adult mice [ 18, 19].	"promoter	5	13	Sequence"	"enhancer	16	24	Sequence"	"transgene	94	103	Sequence"	"cells	121	126	Cell"	"mice	146	150	Organism"	"[{""token"": ""promoter"", ""start_span"": 5, ""end_span"": 13, ""type"": ""Sequence""}, {""token"": ""enhancer"", ""start_span"": 16, ""end_span"": 24, ""type"": ""Sequence""}, {""token"": ""transgene"", ""start_span"": 94, ""end_span"": 103, ""type"": ""Sequence""}, {""token"": ""cells"", ""start_span"": 121, ""end_span"": 126, ""type"": ""Cell""}, {""token"": ""mice"", ""start_span"": 146, ""end_span"": 150, ""type"": ""Organism""}]"
ES cell lines exhibiting robust transgene expression in vitro were assessed in vivo for the spatiotemporal extent of transgene expression and their developmental potential in chimeras produced by aggregation with wild type tetraploid ICR embryos so as to produce completely ES cell - derived embryos, as described previously [ 20, 23].	"cell	3	7	Cell"	"transgene	32	41	Sequence"	"transgene	117	126	Sequence"	"wild type	213	222	Sequence"	"cell	277	281	Cell"	"[{""token"": ""cell"", ""start_span"": 3, ""end_span"": 7, ""type"": ""Cell""}, {""token"": ""transgene"", ""start_span"": 32, ""end_span"": 41, ""type"": ""Sequence""}, {""token"": ""transgene"", ""start_span"": 117, ""end_span"": 126, ""type"": ""Sequence""}, {""token"": ""wild type"", ""start_span"": 213, ""end_span"": 222, ""type"": ""Sequence""}, {""token"": ""cell"", ""start_span"": 277, ""end_span"": 281, ""type"": ""Cell""}]"
At birth there is a limited expression of BDNF and NT - 3 in the mutant sensory epithelia and DiI tracing shows no specific reduction of afferents or efferents that resembles neurotrophin null mutations.	"BDNF	42	46	Gene_or_geneproduct"	"NT - 3	51	57	Gene_or_geneproduct"	"mutant	65	71	Sequence"	"neurotrophin	175	187	Gene_or_geneproduct"	"mutations	193	202	Sequence"	"[{""token"": ""BDNF"", ""start_span"": 42, ""end_span"": 46, ""type"": ""Gene_or_geneproduct""}, {""token"": ""NT - 3"", ""start_span"": 51, ""end_span"": 57, ""type"": ""Gene_or_geneproduct""}, {""token"": ""mutant"", ""start_span"": 65, ""end_span"": 71, ""type"": ""Sequence""}, {""token"": ""neurotrophin"", ""start_span"": 175, ""end_span"": 187, ""type"": ""Gene_or_geneproduct""}, {""token"": ""mutations"", ""start_span"": 193, ""end_span"": 202, ""type"": ""Sequence""}]"
To appreciate the effects of the Brn3c null mutation on the pattern of the inner ear innervation, we first want to present the effects of BDNF and NT - 3 null mutations at birth [ 6, 13, 14].	"Brn3c	33	38	Gene_or_geneproduct"	"mutation	44	52	Sequence"	"BDNF	138	142	Gene_or_geneproduct"	"NT - 3	147	153	Gene_or_geneproduct"	"mutations	159	168	Sequence"	"[{""token"": ""Brn3c"", ""start_span"": 33, ""end_span"": 38, ""type"": ""Gene_or_geneproduct""}, {""token"": ""mutation"", ""start_span"": 44, ""end_span"": 52, ""type"": ""Sequence""}, {""token"": ""BDNF"", ""start_span"": 138, ""end_span"": 142, ""type"": ""Gene_or_geneproduct""}, {""token"": ""NT - 3"", ""start_span"": 147, ""end_span"": 153, ""type"": ""Gene_or_geneproduct""}, {""token"": ""mutations"", ""start_span"": 159, ""end_span"": 168, ""type"": ""Sequence""}]"
Vestibular ganglia are smaller in Brn3c null mutants ( Fig. 1b) than in control littermates ( Fig. 1a), but larger than in BDNF or trkB null mutants of the same age [ 13, 15].	"Brn3c	34	39	Gene_or_geneproduct"	"mutants	45	52	Sequence"	"BDNF	123	127	Gene_or_geneproduct"	"trkB	131	135	Gene_or_geneproduct"	"mutants	141	148	Sequence"	"[{""token"": ""Brn3c"", ""start_span"": 34, ""end_span"": 39, ""type"": ""Gene_or_geneproduct""}, {""token"": ""mutants"", ""start_span"": 45, ""end_span"": 52, ""type"": ""Sequence""}, {""token"": ""BDNF"", ""start_span"": 123, ""end_span"": 127, ""type"": ""Gene_or_geneproduct""}, {""token"": ""trkB"", ""start_span"": 131, ""end_span"": 135, ""type"": ""Gene_or_geneproduct""}, {""token"": ""mutants"", ""start_span"": 141, ""end_span"": 148, ""type"": ""Sequence""}]"
No loss in specific areas, comparable to that in BDNF null mutant mice, is apparent in the saccule or utricle of Brn3c null mice.	"BDNF	49	53	Gene_or_geneproduct"	"mutant	59	65	Sequence"	"mice	66	70	Organism"	"Brn3c	113	118	Gene_or_geneproduct"	"mice	124	128	Organism"	"[{""token"": ""BDNF"", ""start_span"": 49, ""end_span"": 53, ""type"": ""Gene_or_geneproduct""}, {""token"": ""mutant"", ""start_span"": 59, ""end_span"": 65, ""type"": ""Sequence""}, {""token"": ""mice"", ""start_span"": 66, ""end_span"": 70, ""type"": ""Organism""}, {""token"": ""Brn3c"", ""start_span"": 113, ""end_span"": 118, ""type"": ""Gene_or_geneproduct""}, {""token"": ""mice"", ""start_span"": 124, ""end_span"": 128, ""type"": ""Organism""}]"
No selective loss of spiral neurons is observed in Brn3c null mutants in the basal turn, a feature of either NT - 3 or trkC loss [ 6, 9, 14].	"neurons	28	35	Cell"	"Brn3c	51	56	Gene_or_geneproduct"	"mutants	62	69	Sequence"	"NT - 3	109	115	Gene_or_geneproduct"	"trkC	119	123	Gene_or_geneproduct"	"[{""token"": ""neurons"", ""start_span"": 28, ""end_span"": 35, ""type"": ""Cell""}, {""token"": ""Brn3c"", ""start_span"": 51, ""end_span"": 56, ""type"": ""Gene_or_geneproduct""}, {""token"": ""mutants"", ""start_span"": 62, ""end_span"": 69, ""type"": ""Sequence""}, {""token"": ""NT - 3"", ""start_span"": 109, ""end_span"": 115, ""type"": ""Gene_or_geneproduct""}, {""token"": ""trkC"", ""start_span"": 119, ""end_span"": 123, ""type"": ""Gene_or_geneproduct""}]"
