Neuronal ADAM22 mRNA expression in the CNS.	"Neuronal	0	8	Cell"	"ADAM22	9	15	Gene_or_geneproduct"	"mRNA	16	20	Chemical"	"[{""token"": ""Neuronal"", ""start_span"": 0, ""end_span"": 8, ""type"": ""Cell""}, {""token"": ""ADAM22"", ""start_span"": 9, ""end_span"": 15, ""type"": ""Gene_or_geneproduct""}, {""token"": ""mRNA"", ""start_span"": 16, ""end_span"": 20, ""type"": ""Chemical""}]"
Using the antisense probe ( A, C), strong signals were obtained, especially in the hippocampus and the cerebellum, while no signals was detected by the sense probe ( B, D).	"antisense	10	19	Sequence"	"probe	20	25	Sequence"	"probe	158	163	Sequence"	"[{""token"": ""antisense"", ""start_span"": 10, ""end_span"": 19, ""type"": ""Sequence""}, {""token"": ""probe"", ""start_span"": 20, ""end_span"": 25, ""type"": ""Sequence""}, {""token"": ""probe"", ""start_span"": 158, ""end_span"": 163, ""type"": ""Sequence""}]"
Adam22 gene structure and tissue specific transcripts.	"Adam22	0	6	Gene_or_geneproduct"	"gene	7	11	Sequence"	"transcripts	42	53	Sequence"	"[{""token"": ""Adam22"", ""start_span"": 0, ""end_span"": 6, ""type"": ""Gene_or_geneproduct""}, {""token"": ""gene"", ""start_span"": 7, ""end_span"": 11, ""type"": ""Sequence""}, {""token"": ""transcripts"", ""start_span"": 42, ""end_span"": 53, ""type"": ""Sequence""}]"
Amplified DNA fragments were analysed by 1% agarose gel electrophoresis.	"DNA	10	13	Sequence"	"fragments	14	23	Sequence"	"agarose	44	51	Chemical"	"[{""token"": ""DNA"", ""start_span"": 10, ""end_span"": 13, ""type"": ""Sequence""}, {""token"": ""fragments"", ""start_span"": 14, ""end_span"": 23, ""type"": ""Sequence""}, {""token"": ""agarose"", ""start_span"": 44, ""end_span"": 51, ""type"": ""Chemical""}]"
Potential genetic modifiers of the cystic fibrosis intestinal inflammatory phenotype on mouse chromosomes 1, 9, and 10	"genetic	10	17	Sequence"	"mouse	88	93	Organism"	"chromosomes	94	105	GO_ontology"	"[{""token"": ""genetic"", ""start_span"": 10, ""end_span"": 17, ""type"": ""Sequence""}, {""token"": ""mouse"", ""start_span"": 88, ""end_span"": 93, ""type"": ""Organism""}, {""token"": ""chromosomes"", ""start_span"": 94, ""end_span"": 105, ""type"": ""GO_ontology""}]"
The intestines of Cftr deficient mice ( CF mice: Cftrtm1Unc) are prone to obstruction by excessive mucus accumulation and are used as a model of meconium ileus and distal intestinal obstruction syndrome.	"Cftr	18	22	Gene_or_geneproduct"	"mice	33	37	Organism"	"mice	43	47	Organism"	"[{""token"": ""Cftr"", ""start_span"": 18, ""end_span"": 22, ""type"": ""Gene_or_geneproduct""}, {""token"": ""mice"", ""start_span"": 33, ""end_span"": 37, ""type"": ""Organism""}, {""token"": ""mice"", ""start_span"": 43, ""end_span"": 47, ""type"": ""Organism""}]"
On the C57Bl / 6 background, the majority of CF mice cannot survive on solid mouse chow, have inflammation of the small intestine, and are about 30% smaller than wild type littermates.	"mice	48	52	Organism"	"mouse	77	82	Organism"	"wild type	162	171	Sequence"	"[{""token"": ""mice"", ""start_span"": 48, ""end_span"": 52, ""type"": ""Organism""}, {""token"": ""mouse"", ""start_span"": 77, ""end_span"": 82, ""type"": ""Organism""}, {""token"": ""wild type"", ""start_span"": 162, ""end_span"": 171, ""type"": ""Sequence""}]"
CF mice on a mixed genetic background ( 95% C57Bl / 6 and 5% 129Sv) were compared to CF mice congenic on the C57Bl / 6 background for several parameters of the intestinal CF phenotype.	"mice	3	7	Organism"	"genetic	19	26	Sequence"	"mice	88	92	Organism"	"[{""token"": ""mice"", ""start_span"": 3, ""end_span"": 7, ""type"": ""Organism""}, {""token"": ""genetic"", ""start_span"": 19, ""end_span"": 26, ""type"": ""Sequence""}, {""token"": ""mice"", ""start_span"": 88, ""end_span"": 92, ""type"": ""Organism""}]"
CF mice on the mixed background exhibit significantly greater survival when fed dry mouse chow, have reduced intestinal inflammation as measured by quantitative RT - PCR for marker genes, have near normal body weight gain, and have reduced mucus accumulation in the intestinal crypts.	"mice	3	7	Organism"	"mouse	84	89	Organism"	"genes	181	186	Sequence"	"[{""token"": ""mice"", ""start_span"": 3, ""end_span"": 7, ""type"": ""Organism""}, {""token"": ""mouse"", ""start_span"": 84, ""end_span"": 89, ""type"": ""Organism""}, {""token"": ""genes"", ""start_span"": 181, ""end_span"": 186, ""type"": ""Sequence""}]"
By a preliminary genome - wide PCR allele scanning, three regions were found to be potentially associated with the milder phenotype.	"genome	17	23	Sequence"	"allele	35	41	Sequence"	"regions	58	65	Sequence"	"[{""token"": ""genome"", ""start_span"": 17, ""end_span"": 23, ""type"": ""Sequence""}, {""token"": ""allele"", ""start_span"": 35, ""end_span"": 41, ""type"": ""Sequence""}, {""token"": ""regions"", ""start_span"": 58, ""end_span"": 65, ""type"": ""Sequence""}]"
Potential modifier regions were found that have a positive impact on the inflammatory phenotype of the CF mouse small intestine and animal survival.	"regions	19	26	Sequence"	"mouse	106	111	Organism"	"animal	132	138	Organism"	"[{""token"": ""regions"", ""start_span"": 19, ""end_span"": 26, ""type"": ""Sequence""}, {""token"": ""mouse"", ""start_span"": 106, ""end_span"": 111, ""type"": ""Organism""}, {""token"": ""animal"", ""start_span"": 132, ""end_span"": 138, ""type"": ""Organism""}]"
The severity of the pancreatic phenotype in human CF is well correlated with the extent of impaired CFTR function caused by specific mutations.	"human	44	49	Organism"	"CFTR	100	104	Gene_or_geneproduct"	"mutations	133	142	Sequence"	"[{""token"": ""human"", ""start_span"": 44, ""end_span"": 49, ""type"": ""Organism""}, {""token"": ""CFTR"", ""start_span"": 100, ""end_span"": 104, ""type"": ""Gene_or_geneproduct""}, {""token"": ""mutations"", ""start_span"": 133, ""end_span"": 142, ""type"": ""Sequence""}]"
Nutritional problems can persist even with adequate oral enzyme supplementation [ 9] and neutralization of gastric acid to improve lipase function [ 10], and may involve both impaired digestion and absorption of nutrients [ 11].	"enzyme	57	63	Sequence"	"acid	115	119	Chemical"	"nutrients	212	221	Chemical"	"[{""token"": ""enzyme"", ""start_span"": 57, ""end_span"": 63, ""type"": ""Sequence""}, {""token"": ""acid"", ""start_span"": 115, ""end_span"": 119, ""type"": ""Chemical""}, {""token"": ""nutrients"", ""start_span"": 212, ""end_span"": 221, ""type"": ""Chemical""}]"
Marker haplotypes of the syntenic region of human chromosome 19q13 were also shown to be associated with the risk of MI in CF patients [ 18].	"haplotypes	7	17	Sequence"	"syntenic	25	33	Sequence"	"region of human chromosome	34	60	Sequence"	"[{""token"": ""haplotypes"", ""start_span"": 7, ""end_span"": 17, ""type"": ""Sequence""}, {""token"": ""syntenic"", ""start_span"": 25, ""end_span"": 33, ""type"": ""Sequence""}, {""token"": ""region of human chromosome"", ""start_span"": 34, ""end_span"": 60, ""type"": ""Sequence""}]"
Genome wide allele scanning was used to begin identification of regions associated with the less severe intestinal phenotype.	"Genome	0	6	Sequence"	"allele	12	18	Sequence"	"regions	64	71	Sequence"	"[{""token"": ""Genome"", ""start_span"": 0, ""end_span"": 6, ""type"": ""Sequence""}, {""token"": ""allele"", ""start_span"": 12, ""end_span"": 18, ""type"": ""Sequence""}, {""token"": ""regions"", ""start_span"": 64, ""end_span"": 71, ""type"": ""Sequence""}]"
On the B6 background, female and male mice are about 30% smaller than wild type mice at both 4 and 8 weeks of age ( Fig. 1A, B).	"mice	38	42	Organism"	"wild type	70	79	Sequence"	"mice	80	84	Organism"	"[{""token"": ""mice"", ""start_span"": 38, ""end_span"": 42, ""type"": ""Organism""}, {""token"": ""wild type"", ""start_span"": 70, ""end_span"": 79, ""type"": ""Sequence""}, {""token"": ""mice"", ""start_span"": 80, ""end_span"": 84, ""type"": ""Organism""}]"
By comparison, female CF mice on the mixed background were not significantly smaller than wild type mice at 4 weeks of age ( Fig. 1A).	"mice	25	29	Organism"	"wild type	90	99	Sequence"	"mice	100	104	Organism"	"[{""token"": ""mice"", ""start_span"": 25, ""end_span"": 29, ""type"": ""Organism""}, {""token"": ""wild type"", ""start_span"": 90, ""end_span"": 99, ""type"": ""Sequence""}, {""token"": ""mice"", ""start_span"": 100, ""end_span"": 104, ""type"": ""Organism""}]"
Male CF mice on the mixed background at 4 weeks of age were significantly smaller than wild type and not significantly larger than CF mice congenic on the B6 background ( Fig. 1B).	"mice	8	12	Organism"	"wild type	87	96	Sequence"	"mice	134	138	Organism"	"[{""token"": ""mice"", ""start_span"": 8, ""end_span"": 12, ""type"": ""Organism""}, {""token"": ""wild type"", ""start_span"": 87, ""end_span"": 96, ""type"": ""Sequence""}, {""token"": ""mice"", ""start_span"": 134, ""end_span"": 138, ""type"": ""Organism""}]"
To determine whether the mixed genetic background affected expression of inflammatory marker genes, quantitative, real - time RT - PCR was used to measure gene expression.	"genetic	31	38	Sequence"	"genes	93	98	Sequence"	"gene	155	159	Sequence"	"[{""token"": ""genetic"", ""start_span"": 31, ""end_span"": 38, ""type"": ""Sequence""}, {""token"": ""genes"", ""start_span"": 93, ""end_span"": 98, ""type"": ""Sequence""}, {""token"": ""gene"", ""start_span"": 155, ""end_span"": 159, ""type"": ""Sequence""}]"
The same gene is also known as leucine - rich high endothelial cell glycoprotein ( Lrhg) and has been shown to be a marker of high endothelial venules ( HEV) [ 24] which increase in tissues during inflammation [ 25, 26].	"gene	9	13	Sequence"	"leucine - rich high endothelial cell glycoprotein	31	80	Gene_or_geneproduct"	"Lrhg	83	87	Gene_or_geneproduct"	"[{""token"": ""gene"", ""start_span"": 9, ""end_span"": 13, ""type"": ""Sequence""}, {""token"": ""leucine - rich high endothelial cell glycoprotein"", ""start_span"": 31, ""end_span"": 80, ""type"": ""Gene_or_geneproduct""}, {""token"": ""Lrhg"", ""start_span"": 83, ""end_span"": 87, ""type"": ""Gene_or_geneproduct""}]"
Consistent with previous results, Mcpt2 was increased in CF mice on the B6 background by over 9 - fold compared to wild type ( Fig. 2A).	"Mcpt2	34	39	Gene_or_geneproduct"	"mice	60	64	Organism"	"wild type	115	124	Sequence"	"[{""token"": ""Mcpt2"", ""start_span"": 34, ""end_span"": 39, ""type"": ""Gene_or_geneproduct""}, {""token"": ""mice"", ""start_span"": 60, ""end_span"": 64, ""type"": ""Organism""}, {""token"": ""wild type"", ""start_span"": 115, ""end_span"": 124, ""type"": ""Sequence""}]"
Muclin is overexpressed almost 3 - fold in the CF intestine on the B6 background, but on the mixed background the expression level in CF mice was not significantly different than wild type ( Fig. 2E).	"Muclin	0	6	Gene_or_geneproduct"	"mice	137	141	Organism"	"wild type	179	188	Sequence"	"[{""token"": ""Muclin"", ""start_span"": 0, ""end_span"": 6, ""type"": ""Gene_or_geneproduct""}, {""token"": ""mice"", ""start_span"": 137, ""end_span"": 141, ""type"": ""Organism""}, {""token"": ""wild type"", ""start_span"": 179, ""end_span"": 188, ""type"": ""Sequence""}]"
Effect of genetic background on inflammatory gene expression in CF mouse small intestine.	"genetic	10	17	Sequence"	"gene	45	49	Sequence"	"mouse	67	72	Organism"	"[{""token"": ""genetic"", ""start_span"": 10, ""end_span"": 17, ""type"": ""Sequence""}, {""token"": ""gene"", ""start_span"": 45, ""end_span"": 49, ""type"": ""Sequence""}, {""token"": ""mouse"", ""start_span"": 67, ""end_span"": 72, ""type"": ""Organism""}]"
RNA expression levels were determined by quantitative real - time RT - PCR using gene - specific primers.	"RNA	0	3	Sequence"	"gene	81	85	Sequence"	"primers	97	104	Sequence"	"[{""token"": ""RNA"", ""start_span"": 0, ""end_span"": 3, ""type"": ""Sequence""}, {""token"": ""gene"", ""start_span"": 81, ""end_span"": 85, ""type"": ""Sequence""}, {""token"": ""primers"", ""start_span"": 97, ""end_span"": 104, ""type"": ""Sequence""}]"
The amount of mucus in CF mice on the mixed background was variable from mouse to mouse.	"mice	26	30	Organism"	"mouse	73	78	Organism"	"mouse	82	87	Organism"	"[{""token"": ""mice"", ""start_span"": 26, ""end_span"": 30, ""type"": ""Organism""}, {""token"": ""mouse"", ""start_span"": 73, ""end_span"": 78, ""type"": ""Organism""}, {""token"": ""mouse"", ""start_span"": 82, ""end_span"": 87, ""type"": ""Organism""}]"
Histological appearance of the small intestine of wild type and CF mice on the different genetic backgrounds.	"wild type	50	59	Sequence"	"mice	67	71	Organism"	"genetic	89	96	Sequence"	"[{""token"": ""wild type"", ""start_span"": 50, ""end_span"": 59, ""type"": ""Sequence""}, {""token"": ""mice"", ""start_span"": 67, ""end_span"": 71, ""type"": ""Organism""}, {""token"": ""genetic"", ""start_span"": 89, ""end_span"": 96, ""type"": ""Sequence""}]"
Distribution of Cftr genotypes in female offspring from breeding Cftr heterozygotes on the B6 and mixed backgrounds.	"Cftr	16	20	Gene_or_geneproduct"	"genotypes	21	30	Sequence"	"Cftr	65	69	Gene_or_geneproduct"	"[{""token"": ""Cftr"", ""start_span"": 16, ""end_span"": 20, ""type"": ""Gene_or_geneproduct""}, {""token"": ""genotypes"", ""start_span"": 21, ""end_span"": 30, ""type"": ""Sequence""}, {""token"": ""Cftr"", ""start_span"": 65, ""end_span"": 69, ""type"": ""Gene_or_geneproduct""}]"
( *) P - value if the sample size for the B6 mice is adjusted to be equal to that of the mixed background mice, assuming the same distribution of genotypes.	"mice	45	49	Organism"	"mice	106	110	Organism"	"genotypes	146	155	Sequence"	"[{""token"": ""mice"", ""start_span"": 45, ""end_span"": 49, ""type"": ""Organism""}, {""token"": ""mice"", ""start_span"": 106, ""end_span"": 110, ""type"": ""Organism""}, {""token"": ""genotypes"", ""start_span"": 146, ""end_span"": 155, ""type"": ""Sequence""}]"
Distribution of Cftr genotypes in male offspring from breeding Cftr heterozygotes on the B6 and mixed backgrounds.	"Cftr	16	20	Gene_or_geneproduct"	"genotypes	21	30	Sequence"	"Cftr	63	67	Gene_or_geneproduct"	"[{""token"": ""Cftr"", ""start_span"": 16, ""end_span"": 20, ""type"": ""Gene_or_geneproduct""}, {""token"": ""genotypes"", ""start_span"": 21, ""end_span"": 30, ""type"": ""Sequence""}, {""token"": ""Cftr"", ""start_span"": 63, ""end_span"": 67, ""type"": ""Gene_or_geneproduct""}]"
( *) P - value if the sample size for the B6 mice is adjusted to be equal to that of the mixed background mice, assuming the same distribution of genotypes.	"mice	45	49	Organism"	"mice	106	110	Organism"	"genotypes	146	155	Sequence"	"[{""token"": ""mice"", ""start_span"": 45, ""end_span"": 49, ""type"": ""Organism""}, {""token"": ""mice"", ""start_span"": 106, ""end_span"": 110, ""type"": ""Organism""}, {""token"": ""genotypes"", ""start_span"": 146, ""end_span"": 155, ""type"": ""Sequence""}]"
The major cause of death in CF mice is intestinal obstruction, and intestinal obstruction is worsened when the mice are fed standard solid mouse chow [ 35].	"mice	31	35	Organism"	"mice	111	115	Organism"	"mouse	139	144	Organism"	"[{""token"": ""mice"", ""start_span"": 31, ""end_span"": 35, ""type"": ""Organism""}, {""token"": ""mice"", ""start_span"": 111, ""end_span"": 115, ""type"": ""Organism""}, {""token"": ""mouse"", ""start_span"": 139, ""end_span"": 144, ""type"": ""Organism""}]"
By log - rank test, CF mice on the mixed background had significantly earlier death compared to wild type ( P = 0. 035), and significantly later death than CF mice on the B6 background ( P = 0. 025).	"mice	23	27	Organism"	"wild type	96	105	Sequence"	"mice	159	163	Organism"	"[{""token"": ""mice"", ""start_span"": 23, ""end_span"": 27, ""type"": ""Organism""}, {""token"": ""wild type"", ""start_span"": 96, ""end_span"": 105, ""type"": ""Sequence""}, {""token"": ""mice"", ""start_span"": 159, ""end_span"": 163, ""type"": ""Organism""}]"
A second group of 8 CF mice was analyzed and the markers used were refined to focus on the chromosomal regions showing variations from the B6 strain.	"mice	23	27	Organism"	"chromosomal regions	91	110	Sequence"	"variations	119	129	Sequence"	"[{""token"": ""mice"", ""start_span"": 23, ""end_span"": 27, ""type"": ""Organism""}, {""token"": ""chromosomal regions"", ""start_span"": 91, ""end_span"": 110, ""type"": ""Sequence""}, {""token"": ""variations"", ""start_span"": 119, ""end_span"": 129, ""type"": ""Sequence""}]"
The table shows the distribution of B6 and 129 alleles in mice from the two genetic backgrounds.	"alleles	47	54	Sequence"	"mice	58	62	Organism"	"genetic	76	83	Sequence"	"[{""token"": ""alleles"", ""start_span"": 47, ""end_span"": 54, ""type"": ""Sequence""}, {""token"": ""mice"", ""start_span"": 58, ""end_span"": 62, ""type"": ""Organism""}, {""token"": ""genetic"", ""start_span"": 76, ""end_span"": 83, ""type"": ""Sequence""}]"
None of the known chloride channels that might substitute for the missing CFTR are in the regions of the three chromosomes associated with the milder phenotype.	"chloride	18	26	Chemical"	"CFTR	74	78	Gene_or_geneproduct"	"regions of the three chromosomes	90	122	Sequence"	"[{""token"": ""chloride"", ""start_span"": 18, ""end_span"": 26, ""type"": ""Chemical""}, {""token"": ""CFTR"", ""start_span"": 74, ""end_span"": 78, ""type"": ""Gene_or_geneproduct""}, {""token"": ""regions of the three chromosomes"", ""start_span"": 90, ""end_span"": 122, ""type"": ""Sequence""}]"
All gene names are from the Mouse Genome Informatics website.	"gene	4	8	Sequence"	"Mouse	28	33	Organism"	"Genome	34	40	Sequence"	"[{""token"": ""gene"", ""start_span"": 4, ""end_span"": 8, ""type"": ""Sequence""}, {""token"": ""Mouse"", ""start_span"": 28, ""end_span"": 33, ""type"": ""Organism""}, {""token"": ""Genome"", ""start_span"": 34, ""end_span"": 40, ""type"": ""Sequence""}]"
Future work should focus on narrowing down these regions and determining if there are polymorphisms that affect expression of specific genes that make the CF intestinal phenotype less severe.	"regions	49	56	Sequence"	"polymorphisms	86	99	Sequence"	"genes	135	140	Sequence"	"[{""token"": ""regions"", ""start_span"": 49, ""end_span"": 56, ""type"": ""Sequence""}, {""token"": ""polymorphisms"", ""start_span"": 86, ""end_span"": 99, ""type"": ""Sequence""}, {""token"": ""genes"", ""start_span"": 135, ""end_span"": 140, ""type"": ""Sequence""}]"
However, there is evidence for both receptor - dependent and - independent transduction mechanisms for a number of bitter stimuli, including quinine hydrochloride ( QHCl) and denatonium benzoate ( DB).	"quinine	141	148	Chemical"	"hydrochloride	149	162	Chemical"	"benzoate	186	194	Chemical"	"[{""token"": ""quinine"", ""start_span"": 141, ""end_span"": 148, ""type"": ""Chemical""}, {""token"": ""hydrochloride"", ""start_span"": 149, ""end_span"": 162, ""type"": ""Chemical""}, {""token"": ""benzoate"", ""start_span"": 186, ""end_span"": 194, ""type"": ""Chemical""}]"
We used brief - access behavioral taste testing of BXD / Ty recombinant inbred ( RI) mouse strains to map the major quantitative trait locus ( QTL) for taste sensitivity to QHCl.	"mouse	85	90	Organism"	"quantitative trait locus	116	140	Sequence"	"QTL	143	146	Sequence"	"[{""token"": ""mouse"", ""start_span"": 85, ""end_span"": 90, ""type"": ""Organism""}, {""token"": ""quantitative trait locus"", ""start_span"": 116, ""end_span"": 140, ""type"": ""Sequence""}, {""token"": ""QTL"", ""start_span"": 143, ""end_span"": 146, ""type"": ""Sequence""}]"
This QTL is restricted to a ~ 5 Mb interval on chromosome 6 that includes 24 genes encoding T2Rs ( Tas2rs).	"QTL	5	8	Sequence"	"interval on chromosome	35	57	Sequence"	"genes	77	82	Sequence"	"[{""token"": ""QTL"", ""start_span"": 5, ""end_span"": 8, ""type"": ""Sequence""}, {""token"": ""interval on chromosome"", ""start_span"": 35, ""end_span"": 57, ""type"": ""Sequence""}, {""token"": ""genes"", ""start_span"": 77, ""end_span"": 82, ""type"": ""Sequence""}]"
Thus, the entire Tas2r cluster comprises a large haplotype that correlates with quinine taster status.	"cluster	23	30	Sequence"	"haplotype	49	58	Sequence"	"quinine	80	87	Chemical"	"[{""token"": ""cluster"", ""start_span"": 23, ""end_span"": 30, ""type"": ""Sequence""}, {""token"": ""haplotype"", ""start_span"": 49, ""end_span"": 58, ""type"": ""Sequence""}, {""token"": ""quinine"", ""start_span"": 80, ""end_span"": 87, ""type"": ""Chemical""}]"
These studies, the first using a taste - salient assay to map the major QTL for quinine taste, indicate that a T2R - dependent transduction cascade is responsible for the majority of strain variance in quinine taste sensitivity.	"QTL	72	75	Sequence"	"quinine	80	87	Chemical"	"quinine	202	209	Chemical"	"[{""token"": ""QTL"", ""start_span"": 72, ""end_span"": 75, ""type"": ""Sequence""}, {""token"": ""quinine"", ""start_span"": 80, ""end_span"": 87, ""type"": ""Chemical""}, {""token"": ""quinine"", ""start_span"": 202, ""end_span"": 209, ""type"": ""Chemical""}]"
Furthermore, the large number of polymorphisms within coding exons of the Tas2r cluster, coupled with evidence that inbred strains exhibit largely similar bitter taste phenotypes, suggest that T2R receptors are quite tolerant to variation.	"polymorphisms	33	46	Sequence"	"coding exons	54	66	Sequence"	"cluster	80	87	Sequence"	"[{""token"": ""polymorphisms"", ""start_span"": 33, ""end_span"": 46, ""type"": ""Sequence""}, {""token"": ""coding exons"", ""start_span"": 54, ""end_span"": 66, ""type"": ""Sequence""}, {""token"": ""cluster"", ""start_span"": 80, ""end_span"": 87, ""type"": ""Sequence""}]"
For example, sweet - tasting foods may have a high caloric content and are preferred, while bitter - tasting foods often contain toxic substances, and are generally avoided.	"foods	29	34	Chemical"	"foods	109	114	Chemical"	"toxic substances	129	145	Chemical"	"[{""token"": ""foods"", ""start_span"": 29, ""end_span"": 34, ""type"": ""Chemical""}, {""token"": ""foods"", ""start_span"": 109, ""end_span"": 114, ""type"": ""Chemical""}, {""token"": ""toxic substances"", ""start_span"": 129, ""end_span"": 145, ""type"": ""Chemical""}]"
Two families of G protein - coupled receptors ( GPCRs) expressed in subpopulations of taste receptor cells ( TRCs) of the gustatory epithelium have been implicated in the detection and transduction of sweet, bitter and umami ( i. e., glutamate) taste: T1Rs for sweet - and umami - tasting stimuli [ 1 - 8], and T2Rs for bitter - tasting compounds [ 9 - 11].	"protein	18	25	Chemical"	"glutamate	234	243	Chemical"	"compounds	337	346	Chemical"	"[{""token"": ""protein"", ""start_span"": 18, ""end_span"": 25, ""type"": ""Chemical""}, {""token"": ""glutamate"", ""start_span"": 234, ""end_span"": 243, ""type"": ""Chemical""}, {""token"": ""compounds"", ""start_span"": 337, ""end_span"": 346, ""type"": ""Chemical""}]"
In mice, the majority of Tas2rs lie within a single cluster on distal chromosome 6.	"mice	3	7	Organism"	"cluster	52	59	Sequence"	"chromosome	70	80	GO_ontology"	"[{""token"": ""mice"", ""start_span"": 3, ""end_span"": 7, ""type"": ""Organism""}, {""token"": ""cluster"", ""start_span"": 52, ""end_span"": 59, ""type"": ""Sequence""}, {""token"": ""chromosome"", ""start_span"": 70, ""end_span"": 80, ""type"": ""GO_ontology""}]"
First, the density of chromosomal markers and number of recombinant inbred ( RI) strains used in these earlier studies did not permit the physical definition of the intervals containing each QTL.	"chromosomal	22	33	GO_ontology"	"intervals	165	174	Sequence"	"QTL	191	194	Sequence"	"[{""token"": ""chromosomal"", ""start_span"": 22, ""end_span"": 33, ""type"": ""GO_ontology""}, {""token"": ""intervals"", ""start_span"": 165, ""end_span"": 174, ""type"": ""Sequence""}, {""token"": ""QTL"", ""start_span"": 191, ""end_span"": 194, ""type"": ""Sequence""}]"
This analysis revealed that all 24 genes are polymorphic between the two strains, and that these 24 Tas2rs comprise a single haplotype that correlates with QHCl taste sensitivity.	"genes	35	40	Sequence"	"polymorphic	45	56	Sequence"	"haplotype	125	134	Sequence"	"[{""token"": ""genes"", ""start_span"": 35, ""end_span"": 40, ""type"": ""Sequence""}, {""token"": ""polymorphic"", ""start_span"": 45, ""end_span"": 56, ""type"": ""Sequence""}, {""token"": ""haplotype"", ""start_span"": 125, ""end_span"": 134, ""type"": ""Sequence""}]"
"No significant QTLs were identified for DB taste sensitivity, although several associations with markers on chromosomes 2, 8 and 12 were "" suggestive "" ( LRS > 9. 4, genome - wide p = 0. 65; see Additional File 1)."	"QTLs	15	19	Sequence"	"chromosomes	108	119	GO_ontology"	"genome	166	172	Sequence"	"[{""token"": ""QTLs"", ""start_span"": 15, ""end_span"": 19, ""type"": ""Sequence""}, {""token"": ""chromosomes"", ""start_span"": 108, ""end_span"": 119, ""type"": ""GO_ontology""}, {""token"": ""genome"", ""start_span"": 166, ""end_span"": 172, ""type"": ""Sequence""}]"
A major QTL for QHCl taste on mouse chromosome 6.	"QTL	8	11	Sequence"	"mouse	30	35	Organism"	"chromosome	36	46	GO_ontology"	"[{""token"": ""QTL"", ""start_span"": 8, ""end_span"": 11, ""type"": ""Sequence""}, {""token"": ""mouse"", ""start_span"": 30, ""end_span"": 35, ""type"": ""Organism""}, {""token"": ""chromosome"", ""start_span"": 36, ""end_span"": 46, ""type"": ""GO_ontology""}]"
Physical mapping of the single linked marker, D6Mit13, and the two closest unlinked markers, D6Mit61and D6Mit374, was performed in silico based on the May, 2004 build of the public B6 genome.	"D6Mit374	104	112	Gene_or_geneproduct"	"build	161	166	Sequence"	"genome	184	190	Sequence"	"[{""token"": ""D6Mit374"", ""start_span"": 104, ""end_span"": 112, ""type"": ""Gene_or_geneproduct""}, {""token"": ""build"", ""start_span"": 161, ""end_span"": 166, ""type"": ""Sequence""}, {""token"": ""genome"", ""start_span"": 184, ""end_span"": 190, ""type"": ""Sequence""}]"
