SpeB ( encoded by spy2039) is a multifunctional cysteine protease implicated in numerous infection strategies [ 28, 29].	"SpeB	0	4	Protein"	"spy2039	18	25	Protein"	"cysteine protease	48	65	Protein"	"[{""token"": ""SpeB"", ""start_span"": 0, ""end_span"": 4, ""type"": ""Protein""}, {""token"": ""spy2039"", ""start_span"": 18, ""end_span"": 25, ""type"": ""Protein""}, {""token"": ""cysteine protease"", ""start_span"": 48, ""end_span"": 65, ""type"": ""Protein""}]"
Although the delineation of genes influenced by RopB ( or any identified transcriptional regulator) is beyond the scope of this study, our initial analysis did identify the upregulation of a two - component regulatory system, encoded by spy1236 - 1237.	"RopB	48	52	Protein"	"spy1236	237	244	Protein"	"1237	247	251	Protein"	"[{""token"": ""RopB"", ""start_span"": 48, ""end_span"": 52, ""type"": ""Protein""}, {""token"": ""spy1236"", ""start_span"": 237, ""end_span"": 244, ""type"": ""Protein""}, {""token"": ""1237"", ""start_span"": 247, ""end_span"": 251, ""type"": ""Protein""}]"
For example, the nine - gene operon that spans genes spy0738 - 0746 encodes streptolysin S, a potent cytolytic toxin that promotes internalization and host tissue dissemination [ 25, 44].	"spy0738	53	60	Protein"	"0746	63	67	Protein"	"streptolysin S	76	90	Protein"	"[{""token"": ""spy0738"", ""start_span"": 53, ""end_span"": 60, ""type"": ""Protein""}, {""token"": ""0746"", ""start_span"": 63, ""end_span"": 67, ""type"": ""Protein""}, {""token"": ""streptolysin S"", ""start_span"": 76, ""end_span"": 90, ""type"": ""Protein""}]"
Furthermore, the spy0128 - encoded protein is the structural backbone of the pili, and the gene product of spy0130 may be involved in stabilizing the structure [ 36].	"spy0128	17	24	Protein"	"gene product	91	103	Protein"	"spy0130	107	114	Protein"	"[{""token"": ""spy0128"", ""start_span"": 17, ""end_span"": 24, ""type"": ""Protein""}, {""token"": ""gene product"", ""start_span"": 91, ""end_span"": 103, ""type"": ""Protein""}, {""token"": ""spy0130"", ""start_span"": 107, ""end_span"": 114, ""type"": ""Protein""}]"
Although operon - modeling methods exist [ 54, 55], we inspected clusters in silico for upstream regulatory elements and identified 17 candidates, including clusters such as streptolysin S that have been previously confirmed as operons [ 56]; the spy0127 - 0130 grouping, which was confirmed as an operon in this study; and others that have yet to be verified ( Table S6).	"streptolysin S	174	188	Protein"	"spy0127	247	254	Protein"	"0130	257	261	Protein"	"[{""token"": ""streptolysin S"", ""start_span"": 174, ""end_span"": 188, ""type"": ""Protein""}, {""token"": ""spy0127"", ""start_span"": 247, ""end_span"": 254, ""type"": ""Protein""}, {""token"": ""0130"", ""start_span"": 257, ""end_span"": 261, ""type"": ""Protein""}]"
Expression of the fimA gene is tightly controlled by a two - component system ( FimS / FimR) through a cascade regulation.	"fimA	18	22	Protein"	"FimS	80	84	Protein"	"FimR	87	91	Protein"	"[{""token"": ""fimA"", ""start_span"": 18, ""end_span"": 22, ""type"": ""Protein""}, {""token"": ""FimS"", ""start_span"": 80, ""end_span"": 84, ""type"": ""Protein""}, {""token"": ""FimR"", ""start_span"": 87, ""end_span"": 91, ""type"": ""Protein""}]"
To investigate effects of FimR on expression of the mfa1 gene, an insertional fimR mutant was constructed by allelic replacement.	"FimR	26	30	Protein"	"mfa1	52	56	Protein"	"fimR	78	82	Protein"	"[{""token"": ""FimR"", ""start_span"": 26, ""end_span"": 30, ""type"": ""Protein""}, {""token"": ""mfa1"", ""start_span"": 52, ""end_span"": 56, ""type"": ""Protein""}, {""token"": ""fimR"", ""start_span"": 78, ""end_span"": 82, ""type"": ""Protein""}]"
Expression of fimA and mfa1 in the fimR - mutant was determined using real - time PCR analysis.	"fimA	14	18	Protein"	"mfa1	23	27	Protein"	"fimR	35	39	Protein"	"[{""token"": ""fimA"", ""start_span"": 14, ""end_span"": 18, ""type"": ""Protein""}, {""token"": ""mfa1"", ""start_span"": 23, ""end_span"": 27, ""type"": ""Protein""}, {""token"": ""fimR"", ""start_span"": 35, ""end_span"": 39, ""type"": ""Protein""}]"
The striking finding is that expression of the mfa1 gene was also repressed threefold in the fimR - mutant, although not to the degree observed with the fimA expression.	"mfa1	47	51	Protein"	"fimR	93	97	Protein"	"fimA	153	157	Protein"	"[{""token"": ""mfa1"", ""start_span"": 47, ""end_span"": 51, ""type"": ""Protein""}, {""token"": ""fimR"", ""start_span"": 93, ""end_span"": 97, ""type"": ""Protein""}, {""token"": ""fimA"", ""start_span"": 153, ""end_span"": 157, ""type"": ""Protein""}]"
However, the fimR - mutation had no effect on expression of rgpA, a gene encoding the arginine - specific protease, or the P. gingivalis 16S RNA gene.	"fimR	13	17	Protein"	"rgpA	60	64	Protein"	"16S RNA	137	144	Protein"	"[{""token"": ""fimR"", ""start_span"": 13, ""end_span"": 17, ""type"": ""Protein""}, {""token"": ""rgpA"", ""start_span"": 60, ""end_span"": 64, ""type"": ""Protein""}, {""token"": ""16S RNA"", ""start_span"": 137, ""end_span"": 144, ""type"": ""Protein""}]"
This analysis suggests the FimS / FimR system is required for expression of both major and minor fimbriae.	"FimS	27	31	Protein"	"FimR	34	38	Protein"	"minor fimbriae	91	105	Protein"	"[{""token"": ""FimS"", ""start_span"": 27, ""end_span"": 31, ""type"": ""Protein""}, {""token"": ""FimR"", ""start_span"": 34, ""end_span"": 38, ""type"": ""Protein""}, {""token"": ""minor fimbriae"", ""start_span"": 91, ""end_span"": 105, ""type"": ""Protein""}]"
Similarly, there was no apparent change in RgpA production in the fimR - mutant, which was detected by anti - RgpA serum.	"RgpA	43	47	Protein"	"fimR	66	70	Protein"	"RgpA	110	114	Protein"	"[{""token"": ""RgpA"", ""start_span"": 43, ""end_span"": 47, ""type"": ""Protein""}, {""token"": ""fimR"", ""start_span"": 66, ""end_span"": 70, ""type"": ""Protein""}, {""token"": ""RgpA"", ""start_span"": 110, ""end_span"": 114, ""type"": ""Protein""}]"
One possibility is that FimR modulates mfa1 expression by directly binding to the promoter region of mfa1.	"FimR	24	28	Protein"	"mfa1	39	43	Protein"	"mfa1	101	105	Protein"	"[{""token"": ""FimR"", ""start_span"": 24, ""end_span"": 28, ""type"": ""Protein""}, {""token"": ""mfa1"", ""start_span"": 39, ""end_span"": 43, ""type"": ""Protein""}, {""token"": ""mfa1"", ""start_span"": 101, ""end_span"": 105, ""type"": ""Protein""}]"
The mfa1 promoter ( positioned from + 18 to - 138), fimA promoter ( positioned from - 22 to - 190) ( Xie & Lamont, 1999) and mfa1 coding DNA ( positioned from + 1253 to + 1373) were generated by PCR with the 5 ' biotin - labeled primers ( Table 1).	"mfa1	4	8	Protein"	"fimA	52	56	Protein"	"mfa1	125	129	Protein"	"[{""token"": ""mfa1"", ""start_span"": 4, ""end_span"": 8, ""type"": ""Protein""}, {""token"": ""fimA"", ""start_span"": 52, ""end_span"": 56, ""type"": ""Protein""}, {""token"": ""mfa1"", ""start_span"": 125, ""end_span"": 129, ""type"": ""Protein""}]"
Retarded mfa1 promoter - rFimR complex was detected with as little as 10 pmol muL - 1 rFimR ( Fig. 3).	"mfa1	9	13	Protein"	"rFimR	25	30	Protein"	"rFimR	86	91	Protein"	"[{""token"": ""mfa1"", ""start_span"": 9, ""end_span"": 13, ""type"": ""Protein""}, {""token"": ""rFimR"", ""start_span"": 25, ""end_span"": 30, ""type"": ""Protein""}, {""token"": ""rFimR"", ""start_span"": 86, ""end_span"": 91, ""type"": ""Protein""}]"
The unlabeled mfa1 promoter fragments effectively competed with the labeled fragment, suggesting a specific interaction between rFimA and the mfa1 promoter.	"mfa1	14	18	Protein"	"rFimA	128	133	Protein"	"mfa1	142	146	Protein"	"[{""token"": ""mfa1"", ""start_span"": 14, ""end_span"": 18, ""type"": ""Protein""}, {""token"": ""rFimA"", ""start_span"": 128, ""end_span"": 133, ""type"": ""Protein""}, {""token"": ""mfa1"", ""start_span"": 142, ""end_span"": 146, ""type"": ""Protein""}]"
To investigate the role of phosphorylation of FimR in its binding to the mfa1 promoter region, EMSA experiments were also performed with the phosphorylated rFimR.	"FimR	46	50	Protein"	"mfa1	73	77	Protein"	"rFimR	156	161	Protein"	"[{""token"": ""FimR"", ""start_span"": 46, ""end_span"": 50, ""type"": ""Protein""}, {""token"": ""mfa1"", ""start_span"": 73, ""end_span"": 77, ""type"": ""Protein""}, {""token"": ""rFimR"", ""start_span"": 156, ""end_span"": 161, ""type"": ""Protein""}]"
These data clearly show that FimR protein can bind specifically to the mfa1 promoter region, acting as an activator of mfa1 transcription.	"FimR	29	33	Protein"	"mfa1	71	75	Protein"	"mfa1	119	123	Protein"	"[{""token"": ""FimR"", ""start_span"": 29, ""end_span"": 33, ""type"": ""Protein""}, {""token"": ""mfa1"", ""start_span"": 71, ""end_span"": 75, ""type"": ""Protein""}, {""token"": ""mfa1"", ""start_span"": 119, ""end_span"": 123, ""type"": ""Protein""}]"
The biotin - labeled DNA fragment corresponding to this promoter region did not shift in the presence of the rFimA protein ( data not shown), suggesting that only the promoter identified here is involved for mfa1 expression mediated by FimR.	"rFimA	109	114	Protein"	"mfa1	208	212	Protein"	"FimR	236	240	Protein"	"[{""token"": ""rFimA"", ""start_span"": 109, ""end_span"": 114, ""type"": ""Protein""}, {""token"": ""mfa1"", ""start_span"": 208, ""end_span"": 212, ""type"": ""Protein""}, {""token"": ""FimR"", ""start_span"": 236, ""end_span"": 240, ""type"": ""Protein""}]"
Although most target genes of P. gingivalis two - component systems are unknown, the role of the FimS / FimR in expression of the fimA gene is well defined.	"FimS	97	101	Protein"	"FimR	104	108	Protein"	"fimA	130	134	Protein"	"[{""token"": ""FimS"", ""start_span"": 97, ""end_span"": 101, ""type"": ""Protein""}, {""token"": ""FimR"", ""start_span"": 104, ""end_span"": 108, ""type"": ""Protein""}, {""token"": ""fimA"", ""start_span"": 130, ""end_span"": 134, ""type"": ""Protein""}]"
Expression of minor fimbriae ( mfa1) in a fimR mutanthas been investigated.	"minor fimbriae	14	28	Protein"	"mfa1	31	35	Protein"	"fimR	42	46	Protein"	"[{""token"": ""minor fimbriae"", ""start_span"": 14, ""end_span"": 28, ""type"": ""Protein""}, {""token"": ""mfa1"", ""start_span"": 31, ""end_span"": 35, ""type"": ""Protein""}, {""token"": ""fimR"", ""start_span"": 42, ""end_span"": 46, ""type"": ""Protein""}]"
It has also been reported previously that the transcriptional activity of fimA was reduced in the fimA mutant, indicating multiple levels of control of fimA expression in P. gingivalis ( Xie et al., 2000a).	"fimA	74	78	Protein"	"fimA	98	102	Protein"	"fimA	152	156	Protein"	"[{""token"": ""fimA"", ""start_span"": 74, ""end_span"": 78, ""type"": ""Protein""}, {""token"": ""fimA"", ""start_span"": 98, ""end_span"": 102, ""type"": ""Protein""}, {""token"": ""fimA"", ""start_span"": 152, ""end_span"": 156, ""type"": ""Protein""}]"
The observations that FimR binds only to the upstream promoter region of the mfa1 gene and that activity of the downstream promoter is inhibited by S. gordonii, S. sanguinis and S. mitis ( Park et al., 2006) imply the complexity of regulation of mfa1 expression.	"FimR	22	26	Protein"	"mfa1	77	81	Protein"	"mfa1	246	250	Protein"	"[{""token"": ""FimR"", ""start_span"": 22, ""end_span"": 26, ""type"": ""Protein""}, {""token"": ""mfa1"", ""start_span"": 77, ""end_span"": 81, ""type"": ""Protein""}, {""token"": ""mfa1"", ""start_span"": 246, ""end_span"": 250, ""type"": ""Protein""}]"
By this approach we obtained appropriately complemented transformants for the SNPs in genes fadE5, rpsL, and phoP ( Table S1), using cosmids I230, I563, and I36, respectively.	"fadE5	92	97	Protein"	"rpsL	99	103	Protein"	"phoP	109	113	Protein"	"[{""token"": ""fadE5"", ""start_span"": 92, ""end_span"": 97, ""type"": ""Protein""}, {""token"": ""rpsL"", ""start_span"": 99, ""end_span"": 103, ""type"": ""Protein""}, {""token"": ""phoP"", ""start_span"": 109, ""end_span"": 113, ""type"": ""Protein""}]"
Whereas H37Ra:: fadE5 ( Figure 1) and H37Ra:: rpsL ( unpublished data) showed very little or no growth over the 7 - d period, the H37Ra:: phoP mutant grew more vigorously, with a 7. 5 - fold increase in colony - forming units ( CFU) over the 7 - d period.	"fadE5	16	21	Protein"	"rpsL	46	50	Protein"	"phoP	138	142	Protein"	"[{""token"": ""fadE5"", ""start_span"": 16, ""end_span"": 21, ""type"": ""Protein""}, {""token"": ""rpsL"", ""start_span"": 46, ""end_span"": 50, ""type"": ""Protein""}, {""token"": ""phoP"", ""start_span"": 138, ""end_span"": 142, ""type"": ""Protein""}]"
Groups of C57BL / 6 mice were subcutaneously inoculated with H37Rv, H37Ra, or one of three recombinant H37Ra strains complemented with phoP, fadE5, or rpsL, respectively.	"phoP	135	139	Protein"	"fadE5	141	146	Protein"	"rpsL	151	155	Protein"	"[{""token"": ""phoP"", ""start_span"": 135, ""end_span"": 139, ""type"": ""Protein""}, {""token"": ""fadE5"", ""start_span"": 141, ""end_span"": 146, ""type"": ""Protein""}, {""token"": ""rpsL"", ""start_span"": 151, ""end_span"": 155, ""type"": ""Protein""}]"
However, in H37Ra the presence of this cosmid could not increase the weak ESAT - 6 and CFP - 10 T cell responses ( Figure 3B) in the splenocyte IFN - gamma assay.	"ESAT - 6	74	82	Protein"	"CFP - 10	87	95	Protein"	"IFN - gamma	144	155	Protein"	"[{""token"": ""ESAT - 6"", ""start_span"": 74, ""end_span"": 82, ""type"": ""Protein""}, {""token"": ""CFP - 10"", ""start_span"": 87, ""end_span"": 95, ""type"": ""Protein""}, {""token"": ""IFN - gamma"", ""start_span"": 144, ""end_span"": 155, ""type"": ""Protein""}]"
Altogether, our data obtained from multiple replicate experiments indicate that a direct link exists between a fully functional PhoP and the ability to generate T cell responses against ESAT - 6 and CFP - 10.	"PhoP	128	132	Protein"	"ESAT - 6	186	194	Protein"	"CFP - 10	199	207	Protein"	"[{""token"": ""PhoP"", ""start_span"": 128, ""end_span"": 132, ""type"": ""Protein""}, {""token"": ""ESAT - 6"", ""start_span"": 186, ""end_span"": 194, ""type"": ""Protein""}, {""token"": ""CFP - 10"", ""start_span"": 199, ""end_span"": 207, ""type"": ""Protein""}]"
The identification of the amino acid change S219L in the predicted DNA binding region of the C - terminal effector domain of PhoP [ 15, 22] in H37Ra was therefore a particularly exciting finding that has the potential to explain part of the attenuation of the H37Ra strain and to elucidate the PhoP / PhoR associated complex regulatory network in M. tuberculosis.	"PhoP	125	129	Protein"	"PhoP	294	298	Protein"	"PhoR	301	305	Protein"	"[{""token"": ""PhoP"", ""start_span"": 125, ""end_span"": 129, ""type"": ""Protein""}, {""token"": ""PhoP"", ""start_span"": 294, ""end_span"": 298, ""type"": ""Protein""}, {""token"": ""PhoR"", ""start_span"": 301, ""end_span"": 305, ""type"": ""Protein""}]"
Closer inspection of the data published in the corresponding supplemental materials showed that rv3612c - rv3616c were strongly downregulated in the H37Rv phoP ko mutant as well as in H37Ra [ 12, 21].	"rv3612c	96	103	Protein"	"rv3616c	106	113	Protein"	"phoP	155	159	Protein"	"[{""token"": ""rv3612c"", ""start_span"": 96, ""end_span"": 103, ""type"": ""Protein""}, {""token"": ""rv3616c"", ""start_span"": 106, ""end_span"": 113, ""type"": ""Protein""}, {""token"": ""phoP"", ""start_span"": 155, ""end_span"": 159, ""type"": ""Protein""}]"
These transcriptome data corroborate our results obtained by quantitative RT - PCR using probe rv3614c, which showed that gene rv3614c was definitely expressed much lower in H37Ra than in H37Rv and H37Ra:: phoP strains ( Figure 6).	"rv3614c	95	102	Protein"	"rv3614c	127	134	Protein"	"phoP	206	210	Protein"	"[{""token"": ""rv3614c"", ""start_span"": 95, ""end_span"": 102, ""type"": ""Protein""}, {""token"": ""rv3614c"", ""start_span"": 127, ""end_span"": 134, ""type"": ""Protein""}, {""token"": ""phoP"", ""start_span"": 206, ""end_span"": 210, ""type"": ""Protein""}]"
However, upregulation of phoP and rv3614c - rv3616c was observed after incubation of M. tuberculosis in 5mM H2O2 [ 37].	"phoP	25	29	Protein"	"rv3614c	34	41	Protein"	"rv3616c	44	51	Protein"	"[{""token"": ""phoP"", ""start_span"": 25, ""end_span"": 29, ""type"": ""Protein""}, {""token"": ""rv3614c"", ""start_span"": 34, ""end_span"": 41, ""type"": ""Protein""}, {""token"": ""rv3616c"", ""start_span"": 44, ""end_span"": 51, ""type"": ""Protein""}]"
Regulation by AHL - LuxR - like receptors Virulence, bioluminescence, mutualism, antibiotic production and biofilm formation are often regulated by LuxI / LuxR quorum sensing systems in Gram - negative bacteria.	"LuxR	20	24	Protein"	"LuxI	148	152	Protein"	"LuxR	155	159	Protein"	"[{""token"": ""LuxR"", ""start_span"": 20, ""end_span"": 24, ""type"": ""Protein""}, {""token"": ""LuxI"", ""start_span"": 148, ""end_span"": 152, ""type"": ""Protein""}, {""token"": ""LuxR"", ""start_span"": 155, ""end_span"": 159, ""type"": ""Protein""}]"
One of them is autoinductor 2 ( AI - 2), furanosyl borate diester, which is synthesized by the luxS product [ 39, 40] of which homologues are present in P. luminescens and Y. enterocolitica ( plu1253, ye0839).	"luxS	95	99	Protein"	"plu1253	192	199	Protein"	"ye0839	201	207	Protein"	"[{""token"": ""luxS"", ""start_span"": 95, ""end_span"": 99, ""type"": ""Protein""}, {""token"": ""plu1253"", ""start_span"": 192, ""end_span"": 199, ""type"": ""Protein""}, {""token"": ""ye0839"", ""start_span"": 201, ""end_span"": 207, ""type"": ""Protein""}]"
Interestingly, eleven of those LuxR - like receptors are present in Y. enterocolitica of which five are located in a cluster ( ye0035 - 0039).	"LuxR	31	35	Protein"	"ye0035	127	133	Protein"	"0039	136	140	Protein"	"[{""token"": ""LuxR"", ""start_span"": 31, ""end_span"": 35, ""type"": ""Protein""}, {""token"": ""ye0035"", ""start_span"": 127, ""end_span"": 133, ""type"": ""Protein""}, {""token"": ""0039"", ""start_span"": 136, ""end_span"": 140, ""type"": ""Protein""}]"
The methoprene - tolerant gene ( met, also called Resistance to Juvenile Hormone Rst1JH) of D. melanogaster encodes a helix - loop - helix transcriptional regulator combined with a PAS _ 3 domain [ 45].	"met	4	7	Protein"	"Rst1JH	81	87	Protein"	"PAS _ 3	181	188	Protein"	"[{""token"": ""met"", ""start_span"": 4, ""end_span"": 7, ""type"": ""Protein""}, {""token"": ""Rst1JH"", ""start_span"": 81, ""end_span"": 87, ""type"": ""Protein""}, {""token"": ""PAS _ 3"", ""start_span"": 181, ""end_span"": 188, ""type"": ""Protein""}]"
Homologues of these proteins are also present in P. aeruginosa, namely PA4352 and PA3309, a tandem - type Usp protein and a UspA - like protein, respectively.	"PA4352	71	77	Protein"	"PA3309	82	88	Protein"	"UspA	124	128	Protein"	"[{""token"": ""PA4352"", ""start_span"": 71, ""end_span"": 77, ""type"": ""Protein""}, {""token"": ""PA3309"", ""start_span"": 82, ""end_span"": 88, ""type"": ""Protein""}, {""token"": ""UspA"", ""start_span"": 124, ""end_span"": 128, ""type"": ""Protein""}]"
In P. luminescens, expression of UspA has been shown to be under control of the AstS / AstR TCS, which is important for the correct timing of phase variant switching [ 28].	"UspA	33	37	Protein"	"AstS	80	84	Protein"	"AstR	87	91	Protein"	"[{""token"": ""UspA"", ""start_span"": 33, ""end_span"": 37, ""type"": ""Protein""}, {""token"": ""AstS"", ""start_span"": 80, ""end_span"": 84, ""type"": ""Protein""}, {""token"": ""AstR"", ""start_span"": 87, ""end_span"": 91, ""type"": ""Protein""}]"
Because Y. enterocolitica produces the corresponding TCS BvgS / BvgR, but is not known to switch to another phenotypic variant, the possible role of UspA in global regulation still remains to be elucidated.	"BvgS	57	61	Protein"	"BvgR	64	68	Protein"	"UspA	149	153	Protein"	"[{""token"": ""BvgS"", ""start_span"": 57, ""end_span"": 61, ""type"": ""Protein""}, {""token"": ""BvgR"", ""start_span"": 64, ""end_span"": 68, ""type"": ""Protein""}, {""token"": ""UspA"", ""start_span"": 149, ""end_span"": 153, ""type"": ""Protein""}]"
In Y. enterocolitica, the transcriptional repressor RovM ( YE1343) is similar to HexA of P. luminescens ( 61% identity and 75% homology), and has only recently been shown to control cell invasion, virulence and motility in Y. pseudotuberculosis, Y. pestis and Y. enterocolitica [ 51 - 53].	"RovM	52	56	Protein"	"YE1343	59	65	Protein"	"HexA	81	85	Protein"	"[{""token"": ""RovM"", ""start_span"": 52, ""end_span"": 56, ""type"": ""Protein""}, {""token"": ""YE1343"", ""start_span"": 59, ""end_span"": 65, ""type"": ""Protein""}, {""token"": ""HexA"", ""start_span"": 81, ""end_span"": 85, ""type"": ""Protein""}]"
A GroEL homologue is present in P. luminescens ( Plu4134) which the P. luminescens UspG homologues might interact with.	"GroEL	2	7	Protein"	"Plu4134	49	56	Protein"	"UspG	83	87	Protein"	"[{""token"": ""GroEL"", ""start_span"": 2, ""end_span"": 7, ""type"": ""Protein""}, {""token"": ""Plu4134"", ""start_span"": 49, ""end_span"": 56, ""type"": ""Protein""}, {""token"": ""UspG"", ""start_span"": 83, ""end_span"": 87, ""type"": ""Protein""}]"
In contrast to P. luminescens, Y. enterocolitica encodes another member of the UspA subfamily, the UspC homologue YE2583 ( Tab. 2), which is not present in P. luminescens.	"UspA	79	83	Protein"	"UspC	99	103	Protein"	"YE2583	114	120	Protein"	"[{""token"": ""UspA"", ""start_span"": 79, ""end_span"": 83, ""type"": ""Protein""}, {""token"": ""UspC"", ""start_span"": 99, ""end_span"": 103, ""type"": ""Protein""}, {""token"": ""YE2583"", ""start_span"": 114, ""end_span"": 120, ""type"": ""Protein""}]"
The UspA and the UspE homologues are predicted here to be relevant for insect infection, whereas UspC is assumed be more important for Y. enterocolitica in other environments / hosts.	"UspA	4	8	Protein"	"UspE	17	21	Protein"	"UspC	97	101	Protein"	"[{""token"": ""UspA"", ""start_span"": 4, ""end_span"": 8, ""type"": ""Protein""}, {""token"": ""UspE"", ""start_span"": 17, ""end_span"": 21, ""type"": ""Protein""}, {""token"": ""UspC"", ""start_span"": 97, ""end_span"": 101, ""type"": ""Protein""}]"
The expression and activity of those GGDEF and EAL domain containing proteins is regulated by factors with a PilZ domain that binds c - di - GMP.	"GGDEF	37	42	Protein"	"EAL	47	50	Protein"	"PilZ	109	113	Protein"	"[{""token"": ""GGDEF"", ""start_span"": 37, ""end_span"": 42, ""type"": ""Protein""}, {""token"": ""EAL"", ""start_span"": 47, ""end_span"": 50, ""type"": ""Protein""}, {""token"": ""PilZ"", ""start_span"": 109, ""end_span"": 113, ""type"": ""Protein""}]"
The PilZ domain is found as a stand - alone domain or in combination with GGDEF, EAL and other domains, thus assumed to function also as an allosteric domain to control other regulatory enzymes [ 58, 59].	"PilZ	4	8	Protein"	"GGDEF	74	79	Protein"	"EAL	81	84	Protein"	"[{""token"": ""PilZ"", ""start_span"": 4, ""end_span"": 8, ""type"": ""Protein""}, {""token"": ""GGDEF"", ""start_span"": 74, ""end_span"": 79, ""type"": ""Protein""}, {""token"": ""EAL"", ""start_span"": 81, ""end_span"": 84, ""type"": ""Protein""}]"
The expression of two of those EAL - domain containing proteins, YE4063 and YE1324, is induced at low temperature ( Tab. 1).	"EAL	31	34	Protein"	"YE4063	65	71	Protein"	"YE1324	76	82	Protein"	"[{""token"": ""EAL"", ""start_span"": 31, ""end_span"": 34, ""type"": ""Protein""}, {""token"": ""YE4063"", ""start_span"": 65, ""end_span"": 71, ""type"": ""Protein""}, {""token"": ""YE1324"", ""start_span"": 76, ""end_span"": 82, ""type"": ""Protein""}]"
P. luminescens contains no protein with GGDEF, EAL or PilZ domain.	"GGDEF	40	45	Protein"	"EAL	47	50	Protein"	"PilZ	54	58	Protein"	"[{""token"": ""GGDEF"", ""start_span"": 40, ""end_span"": 45, ""type"": ""Protein""}, {""token"": ""EAL"", ""start_span"": 47, ""end_span"": 50, ""type"": ""Protein""}, {""token"": ""PilZ"", ""start_span"": 54, ""end_span"": 58, ""type"": ""Protein""}]"
Although it can not be excluded that the hemolysins of Y. enterocolitica act on the immune systems of both the insect and the mammalian host, the genetic overlap of this group of virulence factor between both pathogens, and the low - temperature expression of YE0479 / YE0480 and fhaC, indicates the presence of insect - specific hemolysins in the genome of Y. enterocolitica.	"YE0479	260	266	Protein"	"YE0480	269	275	Protein"	"fhaC	280	284	Protein"	"[{""token"": ""YE0479"", ""start_span"": 260, ""end_span"": 266, ""type"": ""Protein""}, {""token"": ""YE0480"", ""start_span"": 269, ""end_span"": 275, ""type"": ""Protein""}, {""token"": ""fhaC"", ""start_span"": 280, ""end_span"": 284, ""type"": ""Protein""}]"
In addition, neither the crystal proteins encoded by cipA and cipB in P. luminescens nor a Bt - like toxin ( plu1537) could be found in Y. enterocolitica.	"cipA	53	57	Protein"	"cipB	62	66	Protein"	"plu1537	109	116	Protein"	"[{""token"": ""cipA"", ""start_span"": 53, ""end_span"": 57, ""type"": ""Protein""}, {""token"": ""cipB"", ""start_span"": 62, ""end_span"": 66, ""type"": ""Protein""}, {""token"": ""plu1537"", ""start_span"": 109, ""end_span"": 116, ""type"": ""Protein""}]"
Remarkably, yplA is induced at low temperature ( Table 1), and its expression is known to be regulated by the master regulator FlhDC [ 94], indicating that YplA plays a role in pathogenicity both against human and insect hosts.	"yplA	12	16	Protein"	"FlhDC	127	132	Protein"	"YplA	156	160	Protein"	"[{""token"": ""yplA"", ""start_span"": 12, ""end_span"": 16, ""type"": ""Protein""}, {""token"": ""FlhDC"", ""start_span"": 127, ""end_span"": 132, ""type"": ""Protein""}, {""token"": ""YplA"", ""start_span"": 156, ""end_span"": 160, ""type"": ""Protein""}]"
