Among them is PrtA ( Plu0655 / YE4052), a zinc metalloprotease that is involved in the immunosuppressive activity of X. nematophila [ 96], and that has also been shown to be involved in insect gut colonization of P. luminescens [ 97].	"PrtA	14	18	Protein"	"Plu0655	21	28	Protein"	"YE4052	31	37	Protein"	"[{""token"": ""PrtA"", ""start_span"": 14, ""end_span"": 18, ""type"": ""Protein""}, {""token"": ""Plu0655"", ""start_span"": 21, ""end_span"": 28, ""type"": ""Protein""}, {""token"": ""YE4052"", ""start_span"": 31, ""end_span"": 37, ""type"": ""Protein""}]"
The gene clusters for cobalamin synthesis and propanediol degradation are located on a 40 - kb genomic island ( ye2707 - 2750), but the eutABC operon is missing.	"ye2707	112	118	Protein"	"2750	121	125	Protein"	"eutABC	136	142	Protein"	"[{""token"": ""ye2707"", ""start_span"": 112, ""end_span"": 118, ""type"": ""Protein""}, {""token"": ""2750"", ""start_span"": 121, ""end_span"": 125, ""type"": ""Protein""}, {""token"": ""eutABC"", ""start_span"": 136, ""end_span"": 142, ""type"": ""Protein""}]"
Moreover, several genes induced at lower temperature such as inv, yst or yplA affect the virulence properties of Y. enterocolitica in mice [ 87].	"inv	61	64	Protein"	"yst	66	69	Protein"	"yplA	73	77	Protein"	"[{""token"": ""inv"", ""start_span"": 61, ""end_span"": 64, ""type"": ""Protein""}, {""token"": ""yst"", ""start_span"": 66, ""end_span"": 69, ""type"": ""Protein""}, {""token"": ""yplA"", ""start_span"": 73, ""end_span"": 77, ""type"": ""Protein""}]"
Dissecting the genomes of Y. enterocolitica and P. luminescens for putative key regulators, we identified factor groups ( AI - 2, PAS - 4 / LuxR like receptors) possibly involved in pathogen - insect association only, those with members contributing to either insect or mammalian pathogenicity ( QS, TKS, Usp), and c - di - GMP signalling probably not involved in regulation of activities against insects.	"AI - 2	122	128	Protein"	"PAS - 4	130	137	Protein"	"LuxR	140	144	Protein"	"[{""token"": ""AI - 2"", ""start_span"": 122, ""end_span"": 128, ""type"": ""Protein""}, {""token"": ""PAS - 4"", ""start_span"": 130, ""end_span"": 137, ""type"": ""Protein""}, {""token"": ""LuxR"", ""start_span"": 140, ""end_span"": 144, ""type"": ""Protein""}]"
Results To determine the impact of the GraRS regulatory system on resistance to antimicrobial host defense mechanisms and virulence of S. aureus, we compared inactivation of S. aureus SA113 wild type and its isogenic graRS deletion mutant by the human cathelicidin LL - 37 or human neutrophil granulocytes in vitro, and the ability to cause infection in vivo.	"GraRS	39	44	Protein"	"graRS	217	222	Protein"	"LL - 37	265	272	Protein"	"[{""token"": ""GraRS"", ""start_span"": 39, ""end_span"": 44, ""type"": ""Protein""}, {""token"": ""graRS"", ""start_span"": 217, ""end_span"": 222, ""type"": ""Protein""}, {""token"": ""LL - 37"", ""start_span"": 265, ""end_span"": 272, ""type"": ""Protein""}]"
Deletion of the graRS genes in the dlt mutant background did not lead to further increased binding of cytochrome c compared to the dltA mutant ( Fig. 1B).	"graRS	16	21	Protein"	"cytochrome c	102	114	Protein"	"dltA	131	135	Protein"	"[{""token"": ""graRS"", ""start_span"": 16, ""end_span"": 21, ""type"": ""Protein""}, {""token"": ""cytochrome c"", ""start_span"": 102, ""end_span"": 114, ""type"": ""Protein""}, {""token"": ""dltA"", ""start_span"": 131, ""end_span"": 135, ""type"": ""Protein""}]"
This finding indicates that the increased binding of cytochrome c by the graRS mutant is due to decreased alanylation of teichoic acids and that the resulting surface charge alteration does not result from other regulatory effects mediated by GraRS.	"cytochrome c	53	65	Protein"	"graRS	73	78	Protein"	"GraRS	243	248	Protein"	"[{""token"": ""cytochrome c"", ""start_span"": 53, ""end_span"": 65, ""type"": ""Protein""}, {""token"": ""graRS"", ""start_span"": 73, ""end_span"": 78, ""type"": ""Protein""}, {""token"": ""GraRS"", ""start_span"": 243, ""end_span"": 248, ""type"": ""Protein""}]"
The amounts of LPG from WT and graRS mutant were indistinguishable ( data not shown), which corroborates recent findings that mprF is not among the graRS - regulated genes in S. aureus SA113 [ 10].	"graRS	31	36	Protein"	"mprF	126	130	Protein"	"graRS	148	153	Protein"	"[{""token"": ""graRS"", ""start_span"": 31, ""end_span"": 36, ""type"": ""Protein""}, {""token"": ""mprF"", ""start_span"": 126, ""end_span"": 130, ""type"": ""Protein""}, {""token"": ""graRS"", ""start_span"": 148, ""end_span"": 153, ""type"": ""Protein""}]"
However, GAS which lack either SLO or ScpC exhibit much less mortality than the csrS - mutated parent invasive GAS isolate to the infected mice.	"SLO	31	34	Protein"	"ScpC	38	42	Protein"	"csrS	80	84	Protein"	"[{""token"": ""SLO"", ""start_span"": 31, ""end_span"": 34, ""type"": ""Protein""}, {""token"": ""ScpC"", ""start_span"": 38, ""end_span"": 42, ""type"": ""Protein""}, {""token"": ""csrS"", ""start_span"": 80, ""end_span"": 84, ""type"": ""Protein""}]"
The strains of emm1 genotype, among more than 100 emm genes encoding the serotype - determinant M protein, are the predominant cause of severe GAS infections in Japan [ 7].	"emm1	15	19	Protein"	"emm	50	53	Protein"	"M protein	96	105	Protein"	"[{""token"": ""emm1"", ""start_span"": 15, ""end_span"": 19, ""type"": ""Protein""}, {""token"": ""emm"", ""start_span"": 50, ""end_span"": 53, ""type"": ""Protein""}, {""token"": ""M protein"", ""start_span"": 96, ""end_span"": 105, ""type"": ""Protein""}]"
Furthermore, an SLO deficient mutant from a STSS isolate NIH230 ( NIH230slo) lost the killing activity for PMN ( Figure 3A), thereby, strongly suggesting that SLO is a key element for PMN killing mediated by invasive GAS.	"SLO	16	19	Protein"	"NIH230slo	66	75	Protein"	"SLO	159	162	Protein"	"[{""token"": ""SLO"", ""start_span"": 16, ""end_span"": 19, ""type"": ""Protein""}, {""token"": ""NIH230slo"", ""start_span"": 66, ""end_span"": 75, ""type"": ""Protein""}, {""token"": ""SLO"", ""start_span"": 159, ""end_span"": 162, ""type"": ""Protein""}]"
Contrarily, SLS - deficient mutant from NIH230 strain ( NIH230sagA) killed PMN, as efficiently as did parent strain, indicating that SLS is dispensable for killing of PMN mediated by invasive GAS.	"SLS	12	15	Protein"	"NIH230sagA	56	66	Protein"	"SLS	133	136	Protein"	"[{""token"": ""SLS"", ""start_span"": 12, ""end_span"": 15, ""type"": ""Protein""}, {""token"": ""NIH230sagA"", ""start_span"": 56, ""end_span"": 66, ""type"": ""Protein""}, {""token"": ""SLS"", ""start_span"": 133, ""end_span"": 136, ""type"": ""Protein""}]"
Although NIH230slo lost the killing activity for PMN, migration of PMN in response to IL - 8 in a transwell system was not restored in the presence of this mutant ( Figure 4A), thereby, suggesting that severe invasive GAS blocks PMN migration by influence on IL - 8 activity.	"NIH230slo	9	18	Protein"	"IL - 8	86	92	Protein"	"IL - 8	259	265	Protein"	"[{""token"": ""NIH230slo"", ""start_span"": 9, ""end_span"": 18, ""type"": ""Protein""}, {""token"": ""IL - 8"", ""start_span"": 86, ""end_span"": 92, ""type"": ""Protein""}, {""token"": ""IL - 8"", ""start_span"": 259, ""end_span"": 265, ""type"": ""Protein""}]"
The results showed that NIH230scpC neither digested IL - 8, like 1566 strain, ( Figure 4B) nor abrogated the migration of PMN in response to IL - 8, comparable to 1566 strain ( Figure 4A), whereas the mutant killed the migrated PMN as well as the parent strain NIH230 ( data not shown).	"NIH230scpC	24	34	Protein"	"IL - 8	52	58	Protein"	"IL - 8	141	147	Protein"	"[{""token"": ""NIH230scpC"", ""start_span"": 24, ""end_span"": 34, ""type"": ""Protein""}, {""token"": ""IL - 8"", ""start_span"": 52, ""end_span"": 58, ""type"": ""Protein""}, {""token"": ""IL - 8"", ""start_span"": 141, ""end_span"": 147, ""type"": ""Protein""}]"
Enhanced expression of the slo and the scpC genes in severe invasive GAS is attributed to mutation of a transcriptional regulator CsrS	"slo	27	30	Protein"	"scpC	39	43	Protein"	"CsrS	130	134	Protein"	"[{""token"": ""slo"", ""start_span"": 27, ""end_span"": 30, ""type"": ""Protein""}, {""token"": ""scpC"", ""start_span"": 39, ""end_span"": 43, ""type"": ""Protein""}, {""token"": ""CsrS"", ""start_span"": 130, ""end_span"": 134, ""type"": ""Protein""}]"
GAS isolates from mice with severe invasive disease had mutations in csrS, raising the notion that CsrR / S function is important in modulating gene expression during infection.	"csrS	69	73	Protein"	"CsrR	99	103	Protein"	"S	106	107	Protein"	"[{""token"": ""csrS"", ""start_span"": 69, ""end_span"": 73, ""type"": ""Protein""}, {""token"": ""CsrR"", ""start_span"": 99, ""end_span"": 103, ""type"": ""Protein""}, {""token"": ""S"", ""start_span"": 106, ""end_span"": 107, ""type"": ""Protein""}]"
Therefore, we analyzed the linkage between the csrS and / or csrR genes and the property of invasive GAS infection by sequencing these genes in the emm49 strains used in this study.	"csrS	47	51	Protein"	"csrR	61	65	Protein"	"emm49	148	153	Protein"	"[{""token"": ""csrS"", ""start_span"": 47, ""end_span"": 51, ""type"": ""Protein""}, {""token"": ""csrR"", ""start_span"": 61, ""end_span"": 65, ""type"": ""Protein""}, {""token"": ""emm49"", ""start_span"": 148, ""end_span"": 153, ""type"": ""Protein""}]"
The csrS - introduced severe invasive GAS reduced the expression levels of the slo and the scpC genes, comparable to those detected in the non - invasive GAS.	"csrS	4	8	Protein"	"slo	79	82	Protein"	"scpC	91	95	Protein"	"[{""token"": ""csrS"", ""start_span"": 4, ""end_span"": 8, ""type"": ""Protein""}, {""token"": ""slo"", ""start_span"": 79, ""end_span"": 82, ""type"": ""Protein""}, {""token"": ""scpC"", ""start_span"": 91, ""end_span"": 95, ""type"": ""Protein""}]"
Subcutaneous inoculation of NIH230scpC and NIH230slo yielded the local infected lesions with area comparable to those of 1566 and NIH230:: csrS + during the course of infection ( Figure 7D).	"NIH230scpC	28	38	Protein"	"NIH230slo	43	52	Protein"	"csrS +	139	145	Protein"	"[{""token"": ""NIH230scpC"", ""start_span"": 28, ""end_span"": 38, ""type"": ""Protein""}, {""token"": ""NIH230slo"", ""start_span"": 43, ""end_span"": 52, ""type"": ""Protein""}, {""token"": ""csrS +"", ""start_span"": 139, ""end_span"": 145, ""type"": ""Protein""}]"
The csrS mutations enhanced the expression of scpC and slo, associated with the evasion of PMN functions and in vivo virulence.	"csrS	4	8	Protein"	"scpC	46	50	Protein"	"slo	55	58	Protein"	"[{""token"": ""csrS"", ""start_span"": 4, ""end_span"": 8, ""type"": ""Protein""}, {""token"": ""scpC"", ""start_span"": 46, ""end_span"": 50, ""type"": ""Protein""}, {""token"": ""slo"", ""start_span"": 55, ""end_span"": 58, ""type"": ""Protein""}]"
Then we further examined whether severe invasive isolates of other than emm49 genotype have the mutation of the csrS and the csrR genes.	"emm49	72	77	Protein"	"csrS	112	116	Protein"	"csrR	125	129	Protein"	"[{""token"": ""emm49"", ""start_span"": 72, ""end_span"": 77, ""type"": ""Protein""}, {""token"": ""csrS"", ""start_span"": 112, ""end_span"": 116, ""type"": ""Protein""}, {""token"": ""csrR"", ""start_span"": 125, ""end_span"": 129, ""type"": ""Protein""}]"
Furthermore, the expression of some human invasive disease - associated genes [ 5] including slo was enhanced in the csrS mutant ( Figure 5B), but not in the csrR mutant [ 20].	"slo	93	96	Protein"	"csrS	117	121	Protein"	"csrR	158	162	Protein"	"[{""token"": ""slo"", ""start_span"": 93, ""end_span"": 96, ""type"": ""Protein""}, {""token"": ""csrS"", ""start_span"": 117, ""end_span"": 121, ""type"": ""Protein""}, {""token"": ""csrR"", ""start_span"": 158, ""end_span"": 162, ""type"": ""Protein""}]"
Furthermore, SLS hemolytic activity of invasive GAS is significantly decreased as compared with non - invasive strains ( data not shown) and SLS - deletion in invasive GAS did not affect PMN survival at all, excluding the possibility for the role of SLS in PMN necrosis seen in this study.	"SLS	13	16	Protein"	"SLS	141	144	Protein"	"SLS	250	253	Protein"	"[{""token"": ""SLS"", ""start_span"": 13, ""end_span"": 16, ""type"": ""Protein""}, {""token"": ""SLS"", ""start_span"": 141, ""end_span"": 144, ""type"": ""Protein""}, {""token"": ""SLS"", ""start_span"": 250, ""end_span"": 253, ""type"": ""Protein""}]"
Extracellular deoxyribonuclease ( DNase) is a virulence factor that protects emm1 type GAS against neutrophil killing by degrading the DNA framework of neutrophil extracelluar traps ( NETs) [ 25], [ 26].	"Extracellular deoxyribonuclease	0	31	Protein"	"DNase	34	39	Protein"	"emm1	77	81	Protein"	"[{""token"": ""Extracellular deoxyribonuclease"", ""start_span"": 0, ""end_span"": 31, ""type"": ""Protein""}, {""token"": ""DNase"", ""start_span"": 34, ""end_span"": 39, ""type"": ""Protein""}, {""token"": ""emm1"", ""start_span"": 77, ""end_span"": 81, ""type"": ""Protein""}]"
A study has demonstrated SLO from invasive GAS lyse PMN [ 27], however this effect is likely due to complement activation by SLO [ 28] or PMN activation [ 29] but not due to cytotoxity of SLO itself as judged by their flow cytometry profiles which are distinct from ours ( Figure 2A).	"SLO	25	28	Protein"	"SLO	125	128	Protein"	"SLO	188	191	Protein"	"[{""token"": ""SLO"", ""start_span"": 25, ""end_span"": 28, ""type"": ""Protein""}, {""token"": ""SLO"", ""start_span"": 125, ""end_span"": 128, ""type"": ""Protein""}, {""token"": ""SLO"", ""start_span"": 188, ""end_span"": 191, ""type"": ""Protein""}]"
In contrast to the previous view [ 18], we observed that both of ScpC and SLO together, but not each of them, mediated sufficient in vivo virulence ( Table 1), thus compatible with the notion that plural virulence - associated factors under the regulation of csrS abrogate PMN bactericidal functions and induce invasive diseases in in vivo animal model.	"ScpC	65	69	Protein"	"SLO	74	77	Protein"	"csrS	259	263	Protein"	"[{""token"": ""ScpC"", ""start_span"": 65, ""end_span"": 69, ""type"": ""Protein""}, {""token"": ""SLO"", ""start_span"": 74, ""end_span"": 77, ""type"": ""Protein""}, {""token"": ""csrS"", ""start_span"": 259, ""end_span"": 263, ""type"": ""Protein""}]"
Additionally, the hybrid sensor kinases, LadS and RetS appear to work upstream of GacA to possibly control the switch to a biofilm lifestyle [ 34], [ 35].	"LadS	41	45	Protein"	"RetS	50	54	Protein"	"GacA	82	86	Protein"	"[{""token"": ""LadS"", ""start_span"": 41, ""end_span"": 45, ""type"": ""Protein""}, {""token"": ""RetS"", ""start_span"": 50, ""end_span"": 54, ""type"": ""Protein""}, {""token"": ""GacA"", ""start_span"": 82, ""end_span"": 86, ""type"": ""Protein""}]"
In P. aeruginosa, the PhoPQ and PmrAB - controlled response to magnesium limitation includes the induction of the PA3552 and its neighbouring genes.	"PhoPQ	22	27	Protein"	"PmrAB	32	37	Protein"	"PA3552	114	120	Protein"	"[{""token"": ""PhoPQ"", ""start_span"": 22, ""end_span"": 27, ""type"": ""Protein""}, {""token"": ""PmrAB"", ""start_span"": 32, ""end_span"": 37, ""type"": ""Protein""}, {""token"": ""PA3552"", ""start_span"": 114, ""end_span"": 120, ""type"": ""Protein""}]"
The differences observed between CAP and aminoglycoside resistance in PA3553:: lux suggests that DNA - induced resistance to aminoglycosides is not limited to PA3553 induction.	"PA3553	70	76	Protein"	"lux	79	82	Protein"	"PA3553	159	165	Protein"	"[{""token"": ""PA3553"", ""start_span"": 70, ""end_span"": 76, ""type"": ""Protein""}, {""token"": ""lux"", ""start_span"": 79, ""end_span"": 82, ""type"": ""Protein""}, {""token"": ""PA3553"", ""start_span"": 159, ""end_span"": 165, ""type"": ""Protein""}]"
Previous reports have documented the involvement of P. aeruginosa PmrAB [ 49] and the E. coli PmrAB homologs BasRS [ 69] in regulating the formation of an antimicrobial peptide - tolerant subpopulation within biofilms.	"PmrAB	66	71	Protein"	"PmrAB	94	99	Protein"	"BasRS	109	114	Protein"	"[{""token"": ""PmrAB"", ""start_span"": 66, ""end_span"": 71, ""type"": ""Protein""}, {""token"": ""PmrAB"", ""start_span"": 94, ""end_span"": 99, ""type"": ""Protein""}, {""token"": ""BasRS"", ""start_span"": 109, ""end_span"": 114, ""type"": ""Protein""}]"
It is also known that CF airway fluid contains high levels of neutrophil defensins [ 77] and that sub - lethal doses of CAPs induce PA3553 gene expression, although independently of PhoPQ and PmrAB [ 45].	"PA3553	132	138	Protein"	"PhoPQ	182	187	Protein"	"PmrAB	192	197	Protein"	"[{""token"": ""PA3553"", ""start_span"": 132, ""end_span"": 138, ""type"": ""Protein""}, {""token"": ""PhoPQ"", ""start_span"": 182, ""end_span"": 187, ""type"": ""Protein""}, {""token"": ""PmrAB"", ""start_span"": 192, ""end_span"": 197, ""type"": ""Protein""}]"
We found that the vicK deletion attenuated S. equi virulence in mouse models of subcutaneous and intranasal infections and that infection with a vicK deletion mutant confers protection against subsequent infection with wild - type S. equi and induces production of mucosal and systemic immunoglobins to SeM in nasal infection.	"vicK	18	22	Protein"	"vicK	145	149	Protein"	"SeM	303	306	Protein"	"[{""token"": ""vicK"", ""start_span"": 18, ""end_span"": 22, ""type"": ""Protein""}, {""token"": ""vicK"", ""start_span"": 145, ""end_span"": 149, ""type"": ""Protein""}, {""token"": ""SeM"", ""start_span"": 303, ""end_span"": 306, ""type"": ""Protein""}]"
S. equi vicK Deletion Mutant The S. equi vicRK genes were found by blasting the S. equi genome database ( http: / / www. sanger. ac. uk / Projects / S _ equi) with the S. pyogenes vicRK sequence.	"vicK	8	12	Protein"	"vicRK	41	46	Protein"	"vicRK	180	185	Protein"	"[{""token"": ""vicK"", ""start_span"": 8, ""end_span"": 12, ""type"": ""Protein""}, {""token"": ""vicRK"", ""start_span"": 41, ""end_span"": 46, ""type"": ""Protein""}, {""token"": ""vicRK"", ""start_span"": 180, ""end_span"": 185, ""type"": ""Protein""}]"
The two upstream and downstream flanking fragments of the internal vicK fragment from Tyr151 to Ser427 to be deleted were cloned at the upstream and downstream ends of the aad gene, respectively, resulting in suicide plasmid pGRV - DeltavicK.	"vicK	67	71	Protein"	"aad	172	175	Protein"	"DeltavicK	232	241	Protein"	"[{""token"": ""vicK"", ""start_span"": 67, ""end_span"": 71, ""type"": ""Protein""}, {""token"": ""aad"", ""start_span"": 172, ""end_span"": 175, ""type"": ""Protein""}, {""token"": ""DeltavicK"", ""start_span"": 232, ""end_span"": 241, ""type"": ""Protein""}]"
Double crossoverat both of the flanking fragments would lead to the replacement of the vicK internal fragment with the aad gene, resulting in vicK deletion strains with resistance only to spectinomycin.	"vicK	87	91	Protein"	"aad	119	122	Protein"	"vicK	142	146	Protein"	"[{""token"": ""vicK"", ""start_span"": 87, ""end_span"": 91, ""type"": ""Protein""}, {""token"": ""aad"", ""start_span"": 119, ""end_span"": 122, ""type"": ""Protein""}, {""token"": ""vicK"", ""start_span"": 142, ""end_span"": 146, ""type"": ""Protein""}]"
FITC - labeled wild - type S. equi, DeltavicK mutant, and S. pyogenes spy1718:: aad mutant were incubated with heparinized horse or rabbit blood for 5 and 15 min, and percentages of PMNs associated with fluorescent bacteria were quantified using flow cytometry analysis.	"DeltavicK	36	45	Protein"	"spy1718	70	77	Protein"	"aad	80	83	Protein"	"[{""token"": ""DeltavicK"", ""start_span"": 36, ""end_span"": 45, ""type"": ""Protein""}, {""token"": ""spy1718"", ""start_span"": 70, ""end_span"": 77, ""type"": ""Protein""}, {""token"": ""aad"", ""start_span"": 80, ""end_span"": 83, ""type"": ""Protein""}]"
Similarly, these 4 mice with higher IgA levels also had higher levels of SeM - specific systemic IgG ( Fig. 5B).	"IgA	36	39	Protein"	"SeM	73	76	Protein"	"IgG	97	100	Protein"	"[{""token"": ""IgA"", ""start_span"": 36, ""end_span"": 39, ""type"": ""Protein""}, {""token"": ""SeM"", ""start_span"": 73, ""end_span"": 76, ""type"": ""Protein""}, {""token"": ""IgG"", ""start_span"": 97, ""end_span"": 100, ""type"": ""Protein""}]"
The wild - type sera and 5 of the 8 DeltavicK samples had strong immunoreactions with SeM38 - 260 in Western blotting analysis ( Fig. 5C).	"DeltavicK	36	45	Protein"	"SeM38	86	91	Protein"	"260	94	97	Protein"	"[{""token"": ""DeltavicK"", ""start_span"": 36, ""end_span"": 45, ""type"": ""Protein""}, {""token"": ""SeM38"", ""start_span"": 86, ""end_span"": 91, ""type"": ""Protein""}, {""token"": ""260"", ""start_span"": 94, ""end_span"": 97, ""type"": ""Protein""}]"
The phenotypes of the S. equi DeltavicK mutant are similar to those of the S. pyogenes DeltavicK mutant [ 6], suggesting that the growth defect phenotype may be a common feature of the vicRK mutants of various Gram - positive pathogens.	"DeltavicK	30	39	Protein"	"DeltavicK	87	96	Protein"	"vicRK	185	190	Protein"	"[{""token"": ""DeltavicK"", ""start_span"": 30, ""end_span"": 39, ""type"": ""Protein""}, {""token"": ""DeltavicK"", ""start_span"": 87, ""end_span"": 96, ""type"": ""Protein""}, {""token"": ""vicRK"", ""start_span"": 185, ""end_span"": 190, ""type"": ""Protein""}]"
These experiments validated the regulatory model and showed that the response regulator SsrB and the MarR type regulator, SlyA, are the terminal regulators in a cascade that integrates multiple signals.	"SsrB	88	92	Protein"	"MarR	101	105	Protein"	"SlyA	122	126	Protein"	"[{""token"": ""SsrB"", ""start_span"": 88, ""end_span"": 92, ""type"": ""Protein""}, {""token"": ""MarR"", ""start_span"": 101, ""end_span"": 105, ""type"": ""Protein""}, {""token"": ""SlyA"", ""start_span"": 122, ""end_span"": 126, ""type"": ""Protein""}]"
Small differences in intracellular growth were observed for ssrA / ssrB and slyA compared to the parent although larger differences have been observed previously [ 43] - [ 45] perhaps reflecting BMDM preparation techniques, bacterial strain differences, or opsonization differences [ 46].	"ssrA	60	64	Protein"	"ssrB	67	71	Protein"	"slyA	76	80	Protein"	"[{""token"": ""ssrA"", ""start_span"": 60, ""end_span"": 64, ""type"": ""Protein""}, {""token"": ""ssrB"", ""start_span"": 67, ""end_span"": 71, ""type"": ""Protein""}, {""token"": ""slyA"", ""start_span"": 76, ""end_span"": 80, ""type"": ""Protein""}]"
The three exceptions were spvR, fruR, and rpoS.	"spvR	26	30	Protein"	"fruR	32	36	Protein"	"rpoS	42	46	Protein"	"[{""token"": ""spvR"", ""start_span"": 26, ""end_span"": 30, ""type"": ""Protein""}, {""token"": ""fruR"", ""start_span"": 32, ""end_span"": 36, ""type"": ""Protein""}, {""token"": ""rpoS"", ""start_span"": 42, ""end_span"": 46, ""type"": ""Protein""}]"
The network suggests that both slyA and ssrA / ssrB could coordinate regulation of SPI - 2 and other virulence factors by integrating signals from multiple regulators as was tested next.	"slyA	31	35	Protein"	"ssrA	40	44	Protein"	"ssrB	47	51	Protein"	"[{""token"": ""slyA"", ""start_span"": 31, ""end_span"": 35, ""type"": ""Protein""}, {""token"": ""ssrA"", ""start_span"": 40, ""end_span"": 44, ""type"": ""Protein""}, {""token"": ""ssrB"", ""start_span"": 47, ""end_span"": 51, ""type"": ""Protein""}]"
Surprisingly, the expression of SPI - 2 genes depended upon slyA even in an ssrA / ssrB deleted strain.	"slyA	60	64	Protein"	"ssrA	76	80	Protein"	"ssrB	83	87	Protein"	"[{""token"": ""slyA"", ""start_span"": 60, ""end_span"": 64, ""type"": ""Protein""}, {""token"": ""ssrA"", ""start_span"": 76, ""end_span"": 80, ""type"": ""Protein""}, {""token"": ""ssrB"", ""start_span"": 83, ""end_span"": 87, ""type"": ""Protein""}]"
Examples of such genes include sifA and the operon STM3117 - 3120.	"sifA	31	35	Protein"	"STM3117	51	58	Protein"	"3120	61	65	Protein"	"[{""token"": ""sifA"", ""start_span"": 31, ""end_span"": 35, ""type"": ""Protein""}, {""token"": ""STM3117"", ""start_span"": 51, ""end_span"": 58, ""type"": ""Protein""}, {""token"": ""3120"", ""start_span"": 61, ""end_span"": 65, ""type"": ""Protein""}]"
The signal ( s) received by SsrA, the sensor of the SsrA / SsrB system, is not yet established.	"SsrA	28	32	Protein"	"SsrA	52	56	Protein"	"SsrB	59	63	Protein"	"[{""token"": ""SsrA"", ""start_span"": 28, ""end_span"": 32, ""type"": ""Protein""}, {""token"": ""SsrA"", ""start_span"": 52, ""end_span"": 56, ""type"": ""Protein""}, {""token"": ""SsrB"", ""start_span"": 59, ""end_span"": 63, ""type"": ""Protein""}]"
SlyA and SsrA / SsrB together activate transcription of the SPI - 2 encoded secretion apparatus	"SlyA	0	4	Protein"	"SsrA	9	13	Protein"	"SsrB	16	20	Protein"	"[{""token"": ""SlyA"", ""start_span"": 0, ""end_span"": 4, ""type"": ""Protein""}, {""token"": ""SsrA"", ""start_span"": 9, ""end_span"": 13, ""type"": ""Protein""}, {""token"": ""SsrB"", ""start_span"": 16, ""end_span"": 20, ""type"": ""Protein""}]"
SlyA is a DNA - binding protein with high affinity for inverted repeat sequences [ 79] and the binding ability of SlyA to the ssrA promoter region was previously reported [ 62].	"SlyA	0	4	Protein"	"SlyA	114	118	Protein"	"ssrA	126	130	Protein"	"[{""token"": ""SlyA"", ""start_span"": 0, ""end_span"": 4, ""type"": ""Protein""}, {""token"": ""SlyA"", ""start_span"": 114, ""end_span"": 118, ""type"": ""Protein""}, {""token"": ""ssrA"", ""start_span"": 126, ""end_span"": 130, ""type"": ""Protein""}]"
Together, the results indicate that i) M. tuberculosis Rv2623 regulates mycobacterial growth in vitro and in vivo, and ii) Rv2623 is required for the entry of the tubercle bacillus into the chronic phase of infection in the host; in addition, iii) Rv2623 binds ATP; and iv) the growth - regulatory attribute of this USP is dependent on its ATP - binding activity.	"Rv2623	55	61	Protein"	"Rv2623	123	129	Protein"	"Rv2623	248	254	Protein"	"[{""token"": ""Rv2623"", ""start_span"": 55, ""end_span"": 61, ""type"": ""Protein""}, {""token"": ""Rv2623"", ""start_span"": 123, ""end_span"": 129, ""type"": ""Protein""}, {""token"": ""Rv2623"", ""start_span"": 248, ""end_span"": 254, ""type"": ""Protein""}]"
