The leukemia cell lines K562 and HL - 60 had no detectable TGF - beta RII mRNA.	"leukemia cell lines K562	4	28	Cell"	"HL - 60	33	40	Cell"	"[{""token"": ""leukemia cell lines K562"", ""start_span"": 4, ""end_span"": 28, ""type"": ""Cell""}, {""token"": ""HL - 60"", ""start_span"": 33, ""end_span"": 40, ""type"": ""Cell""}]"
Decreased expression of TGF - beta RII in CML cells and leukemia cell lines raises the possibility that altered expression of the receptor may play a role in the initiation and / or maintenance of the disease state.	"CML cells	42	51	Cell"	"leukemia cell lines	56	75	Cell"	"[{""token"": ""CML cells"", ""start_span"": 42, ""end_span"": 51, ""type"": ""Cell""}, {""token"": ""leukemia cell lines"", ""start_span"": 56, ""end_span"": 75, ""type"": ""Cell""}]"
Conditioned media from insulin - treated RPE cells were assayed for VEGF protein and capillary endothelial cell proliferation.	"RPE cells	41	50	Cell"	"capillary endothelial cell	85	111	Cell"	"[{""token"": ""RPE cells"", ""start_span"": 41, ""end_span"": 50, ""type"": ""Cell""}, {""token"": ""capillary endothelial cell"", ""start_span"": 85, ""end_span"": 111, ""type"": ""Cell""}]"
The insulin - conditioned RPE cell media stimulated capillary endothelial cell proliferation, an effect that was completely blocked by anti - VEGF neutralizing antibody.	"RPE cell	26	34	Cell"	"capillary endothelial cell	52	78	Cell"	"[{""token"": ""RPE cell"", ""start_span"": 26, ""end_span"": 34, ""type"": ""Cell""}, {""token"": ""capillary endothelial cell"", ""start_span"": 52, ""end_span"": 78, ""type"": ""Cell""}]"
LMP1 of Epstein - Barr virus induces proliferation of primary mouse embryonic fibroblasts and cooperatively transforms the cells with a p16 - insensitive CDK4 oncogene.	"embryonic fibroblasts	68	89	Cell"	"cells	123	128	Cell"	"[{""token"": ""embryonic fibroblasts"", ""start_span"": 68, ""end_span"": 89, ""type"": ""Cell""}, {""token"": ""cells"", ""start_span"": 123, ""end_span"": 128, ""type"": ""Cell""}]"
Previous work demonstrates that the LMP1 gene of EBV is sufficient to transform certain established rodent fibroblast cell lines and to induce the tumorigenicity of some human epithelial cell lines.	"fibroblast cell lines	107	128	Cell"	"epithelial cell lines	176	197	Cell"	"[{""token"": ""fibroblast cell lines"", ""start_span"": 107, ""end_span"": 128, ""type"": ""Cell""}, {""token"": ""epithelial cell lines"", ""start_span"": 176, ""end_span"": 197, ""type"": ""Cell""}]"
In addition, LMP1 plays pleiotropic roles in cell growth arrest, differentiation, and apoptosis, depending on the background of the target cells.	"cell	45	49	Cell"	"cells	139	144	Cell"	"[{""token"": ""cell"", ""start_span"": 45, ""end_span"": 49, ""type"": ""Cell""}, {""token"": ""cells"", ""start_span"": 139, ""end_span"": 144, ""type"": ""Cell""}]"
To examine the roles of LMP1 in cell proliferation and growth regulation in primary culture cells, we constructed a recombinant retrovirus containing an LMP1 gene.	"cell	32	36	Cell"	"primary culture cells	76	97	Cell"	"[{""token"": ""cell"", ""start_span"": 32, ""end_span"": 36, ""type"": ""Cell""}, {""token"": ""primary culture cells"", ""start_span"": 76, ""end_span"": 97, ""type"": ""Cell""}]"
With this retrovirus, LMP1 was shown to stimulate the proliferation of primary mouse embryonic fibroblasts ( MEF cells).	"embryonic fibroblasts	85	106	Cell"	"MEF cells	109	118	Cell"	"[{""token"": ""embryonic fibroblasts"", ""start_span"": 85, ""end_span"": 106, ""type"": ""Cell""}, {""token"": ""MEF cells"", ""start_span"": 109, ""end_span"": 118, ""type"": ""Cell""}]"
It has a mitogenic activity for MEF cells, as demonstrated by an immediate induction of cell doubling time.	"MEF cells	32	41	Cell"	"cell	88	92	Cell"	"[{""token"": ""MEF cells"", ""start_span"": 32, ""end_span"": 41, ""type"": ""Cell""}, {""token"": ""cell"", ""start_span"": 88, ""end_span"": 92, ""type"": ""Cell""}]"
In addition, it significantly extends the passage number of MEF cells to more than 30 after retroviral infection, compared with less than 5 for uninfected MEF cells.	"MEF cells	60	69	Cell"	"MEF cells	155	164	Cell"	"[{""token"": ""MEF cells"", ""start_span"": 60, ""end_span"": 69, ""type"": ""Cell""}, {""token"": ""MEF cells"", ""start_span"": 155, ""end_span"": 164, ""type"": ""Cell""}]"
The ras - transformed, ATX - secreting subclones had enhanced motility to ATX as chemoattractant, but there was little difference in the motility responses of NIH3T3 cells transfected with atx, an inactive mutant gene, or empty vector.	"subclones	39	48	Cell"	"NIH3T3 cells	159	171	Cell"	"[{""token"": ""subclones"", ""start_span"": 39, ""end_span"": 48, ""type"": ""Cell""}, {""token"": ""NIH3T3 cells"", ""start_span"": 159, ""end_span"": 171, ""type"": ""Cell""}]"
Combination of ATX expression with ras transformation produced cells with greatly amplified tumorigenesis and metastatic potential compared to ras - transformed controls.	"cells	63	68	Cell"	"controls	161	169	Cell"	"[{""token"": ""cells"", ""start_span"": 63, ""end_span"": 68, ""type"": ""Cell""}, {""token"": ""controls"", ""start_span"": 161, ""end_span"": 169, ""type"": ""Cell""}]"
Here we describe a 185 - kDa tandem duplication mutant ( TDM) that is expressed in KE and A - 1235 glioma cells, along with certain functional characteristics of the mutants.	"KE	83	85	Cell"	"A - 1235 glioma cells	90	111	Cell"	"[{""token"": ""KE"", ""start_span"": 83, ""end_span"": 85, ""type"": ""Cell""}, {""token"": ""A - 1235 glioma cells"", ""start_span"": 90, ""end_span"": 111, ""type"": ""Cell""}]"
The corresponding transcripts in KE and A - 1235 cells contain 1053 additional nucleotides representing an in - frame duplication of exons 18 through 25 which encode the entire TK region and a portion of the CAIN domain.	"KE	33	35	Cell"	"A - 1235 cells	40	54	Cell"	"[{""token"": ""KE"", ""start_span"": 33, ""end_span"": 35, ""type"": ""Cell""}, {""token"": ""A - 1235 cells"", ""start_span"": 40, ""end_span"": 54, ""type"": ""Cell""}]"
This is primarily based on limited in vitro studies on tumor cells derived from transitional cell carcinoma of the bladder that revealed a dose - and time - dependent inhibition of cell growth by ciprofloxacin at concentrations that are easily attainable in the urine of patients.	"tumor cells	55	66	Cell"	"cell	93	97	Cell"	"[{""token"": ""tumor cells"", ""start_span"": 55, ""end_span"": 66, ""type"": ""Cell""}, {""token"": ""cell"", ""start_span"": 93, ""end_span"": 97, ""type"": ""Cell""}]"
Hence, the down - regulation of p21WAF1, together with the alterations in Bax and cdk2 as observed in our studies, may define a novel mechanism by which ciprofloxacin inhibits tumor cell growth and induces apoptotic cell death.	"tumor cell	176	186	Cell"	"cell	216	220	Cell"	"[{""token"": ""tumor cell"", ""start_span"": 176, ""end_span"": 186, ""type"": ""Cell""}, {""token"": ""cell"", ""start_span"": 216, ""end_span"": 220, ""type"": ""Cell""}]"
MATERIALS AND METHODS: Human neuroblastoma cells and human Chang hepatocytes are grown in a noncontact, coculture system.	"neuroblastoma cells	29	48	Cell"	"Chang hepatocytes	59	76	Cell"	"[{""token"": ""neuroblastoma cells"", ""start_span"": 29, ""end_span"": 48, ""type"": ""Cell""}, {""token"": ""Chang hepatocytes"", ""start_span"": 59, ""end_span"": 76, ""type"": ""Cell""}]"
Neuroblastoma cells and Chang hepatocytes are then plated separately with the conditioned medium and their own standard growth medium as controls.	"Neuroblastoma cells	0	19	Cell"	"Chang hepatocytes	24	41	Cell"	"[{""token"": ""Neuroblastoma cells"", ""start_span"": 0, ""end_span"": 19, ""type"": ""Cell""}, {""token"": ""Chang hepatocytes"", ""start_span"": 24, ""end_span"": 41, ""type"": ""Cell""}]"
Previously we demonstrated that N1 ( ic) and N2 ( ic) could transform E1A immortalized baby rat kidney cells ( RKE) in vitro.	"kidney cells	96	108	Cell"	"RKE	111	114	Cell"	"[{""token"": ""kidney cells"", ""start_span"": 96, ""end_span"": 108, ""type"": ""Cell""}, {""token"": ""RKE"", ""start_span"": 111, ""end_span"": 114, ""type"": ""Cell""}]"
Here we show that expression of TEL in Ras - transformed NIH 3T3 cells inhibits cell growth in soft agar and in normal cultures.	"NIH 3T3 cells	57	70	Cell"	"cell	80	84	Cell"	"[{""token"": ""NIH 3T3 cells"", ""start_span"": 57, ""end_span"": 70, ""type"": ""Cell""}, {""token"": ""cell"", ""start_span"": 80, ""end_span"": 84, ""type"": ""Cell""}]"
When BB - 94, a matrix metalloproteinase inhibitor, was added to the culture medium of Ras - expressing cells, it caused a cell aggregation phenotype similar to that caused by TEL expression.	"cells	104	109	Cell"	"cell	123	127	Cell"	"[{""token"": ""cells"", ""start_span"": 104, ""end_span"": 109, ""type"": ""Cell""}, {""token"": ""cell"", ""start_span"": 123, ""end_span"": 127, ""type"": ""Cell""}]"
These data provide a mechanism whereby VASP can influence endothelial migration and organization during capillary formation and modulate vascular permeability via effects on endothelial cell contractility.	"endothelial	58	69	Cell"	"endothelial cell	174	190	Cell"	"[{""token"": ""endothelial"", ""start_span"": 58, ""end_span"": 69, ""type"": ""Cell""}, {""token"": ""endothelial cell"", ""start_span"": 174, ""end_span"": 190, ""type"": ""Cell""}]"
The formation of functional units with these various proteins allows the uPAR to mediate the focused proteolysis required for cell migration and invasion and to contribute both directly and indirectly to cell adhesive processes in a non - proteolytic fashion.	"cell	126	130	Cell"	"cell	204	208	Cell"	"[{""token"": ""cell"", ""start_span"": 126, ""end_span"": 130, ""type"": ""Cell""}, {""token"": ""cell"", ""start_span"": 204, ""end_span"": 208, ""type"": ""Cell""}]"
The p75 receptor belongs to the tumor necrosis factor ( TNF) family of death receptors and has been suggested as a receptor that mediates apoptosis in neuronal and NB cells.	"neuronal	151	159	Cell"	"NB cells	164	172	Cell"	"[{""token"": ""neuronal"", ""start_span"": 151, ""end_span"": 159, ""type"": ""Cell""}, {""token"": ""NB cells"", ""start_span"": 164, ""end_span"": 172, ""type"": ""Cell""}]"
PROCEDURE: To investigate the effect of p75 expression in NB, we transfected the p75 cDNA into SH - SY5Y cells, an NB cell line lacking expression of both p75 and TrkA.	"SH - SY5Y cells	95	110	Cell"	"NB cell line	115	127	Cell"	"[{""token"": ""SH - SY5Y cells"", ""start_span"": 95, ""end_span"": 110, ""type"": ""Cell""}, {""token"": ""NB cell line"", ""start_span"": 115, ""end_span"": 127, ""type"": ""Cell""}]"
The present study shows that a mutant with an LMP1 site - specific mutation at TES2, LMP1 ( TRADD), initially stimulates cell growth and significantly extends the life span of MEF.	"cell	121	125	Cell"	"MEF	176	179	Cell"	"[{""token"": ""cell"", ""start_span"": 121, ""end_span"": 125, ""type"": ""Cell""}, {""token"": ""MEF"", ""start_span"": 176, ""end_span"": 179, ""type"": ""Cell""}]"
The migration of vascular endothelial cells ( ECs) plays an important role in vascular remodeling.	"vascular endothelial cells	17	43	Cell"	"ECs	46	49	Cell"	"[{""token"": ""vascular endothelial cells"", ""start_span"": 17, ""end_span"": 43, ""type"": ""Cell""}, {""token"": ""ECs"", ""start_span"": 46, ""end_span"": 49, ""type"": ""Cell""}]"
Invasion of the human melanoma cell line, BLM, was also attenuated by the anti - PAI - 1 monoclonal antibody MAI - 12.	"melanoma cell line	22	40	Cell"	"BLM	42	45	Cell"	"[{""token"": ""melanoma cell line"", ""start_span"": 22, ""end_span"": 40, ""type"": ""Cell""}, {""token"": ""BLM"", ""start_span"": 42, ""end_span"": 45, ""type"": ""Cell""}]"
Addition of exogenous PAI - 1, however, prevented HT1080 cell adhesion ( IC50 180 nM) and promoted cell detachment from vitronectin.	"HT1080 cell	50	61	Cell"	"cell	99	103	Cell"	"[{""token"": ""HT1080 cell"", ""start_span"": 50, ""end_span"": 61, ""type"": ""Cell""}, {""token"": ""cell"", ""start_span"": 99, ""end_span"": 103, ""type"": ""Cell""}]"
Inhibition of PDGF - stimulated and matrix - mediated proliferation of human vascular smooth muscle cells by SPARC is independent of changes in cell shape or cyclin - dependent kinase inhibitors.	"vascular smooth muscle cells	77	105	Cell"	"cell	144	148	Cell"	"[{""token"": ""vascular smooth muscle cells"", ""start_span"": 77, ""end_span"": 105, ""type"": ""Cell""}, {""token"": ""cell"", ""start_span"": 144, ""end_span"": 148, ""type"": ""Cell""}]"
What was observed, however, was the multistep acquisition of aberrant cellular genetic changes in marrow cells from patients who transformed, including activating ras oncogene mutations, clonal cytogenetic abnormalities, and G - CSF receptor mutations.	"cellular	70	78	Cell"	"marrow cells	98	110	Cell"	"[{""token"": ""cellular"", ""start_span"": 70, ""end_span"": 78, ""type"": ""Cell""}, {""token"": ""marrow cells"", ""start_span"": 98, ""end_span"": 110, ""type"": ""Cell""}]"
Since congenital neutropenia and SDS are inherited forms of bone marrow failure, G - CSF may accelerate the propensity for MDS / AML in the genetically altered stem and progenitor cells, especially in those with G - CSF receptor and ras mutations ( 82% and 50% of patients who transform, respectively).	"stem	160	164	Cell"	"progenitor cells	169	185	Cell"	"[{""token"": ""stem"", ""start_span"": 160, ""end_span"": 164, ""type"": ""Cell""}, {""token"": ""progenitor cells"", ""start_span"": 169, ""end_span"": 185, ""type"": ""Cell""}]"
Cancer cells secrete soluble factors which can induce proliferation and migration of capillary endothelial cells.	"Cancer cells	0	12	Cell"	"capillary endothelial cells	85	112	Cell"	"[{""token"": ""Cancer cells"", ""start_span"": 0, ""end_span"": 12, ""type"": ""Cell""}, {""token"": ""capillary endothelial cells"", ""start_span"": 85, ""end_span"": 112, ""type"": ""Cell""}]"
The results showed that the expression of full - length T antigen rendered rat embryo fibroblasts ( REF) sensitive to 5 - FU - induced apoptosis.	"embryo fibroblasts	79	97	Cell"	"REF	100	103	Cell"	"[{""token"": ""embryo fibroblasts"", ""start_span"": 79, ""end_span"": 97, ""type"": ""Cell""}, {""token"": ""REF"", ""start_span"": 100, ""end_span"": 103, ""type"": ""Cell""}]"
Treatment of REF or REF expressing full - length T antigen, an N - terminal segment, or T251 - 708 resulted in increased expression of the p53 - responsive MDM2 gene; apoptosis occurred through a p53 - dependent pathway, as p53 - null cells expressing these T antigens were resistant to 5 - FU - induced apoptosis.	"REF	13	16	Cell"	"REF	20	23	Cell"	"[{""token"": ""REF"", ""start_span"": 13, ""end_span"": 16, ""type"": ""Cell""}, {""token"": ""REF"", ""start_span"": 20, ""end_span"": 23, ""type"": ""Cell""}]"
In contrast, pellets from the CLA - fed animals contained fewer infiltrating cells, which formed limited branching cellular networks, the majority of which had collapsed lumen and no RBCs.	"cells	77	82	Cell"	"RBCs	183	187	Cell"	"[{""token"": ""cells"", ""start_span"": 77, ""end_span"": 82, ""type"": ""Cell""}, {""token"": ""RBCs"", ""start_span"": 183, ""end_span"": 187, ""type"": ""Cell""}]"
ELISA found the presence of vascular endothelial growth factors ( VEGF) both in the tested oral cancer cells and NOK.	"oral cancer cells	91	108	Cell"	"NOK	113	116	Cell"	"[{""token"": ""oral cancer cells"", ""start_span"": 91, ""end_span"": 108, ""type"": ""Cell""}, {""token"": ""NOK"", ""start_span"": 113, ""end_span"": 116, ""type"": ""Cell""}]"
We have used retroviral - mediated gene delivery to effect sustained autocrine expression of TIMP - 3 in murine neuroblastoma and melanoma tumor cells in order to further examine the ability of TIMPs to inhibit angiogenesis in vivo.	"neuroblastoma	112	125	Cell"	"melanoma tumor cells	130	150	Cell"	"[{""token"": ""neuroblastoma"", ""start_span"": 112, ""end_span"": 125, ""type"": ""Cell""}, {""token"": ""melanoma tumor cells"", ""start_span"": 130, ""end_span"": 150, ""type"": ""Cell""}]"
Histologic evaluation revealed that although tumors overexpressing TIMP - 3 had an increased number of CD31 ( +) endothelial cells, these endothelial cells had not formed functional tubules, as evidenced by decreased vessel continuity and minimal pericyte recruitment.	"endothelial cells	113	130	Cell"	"pericyte	247	255	Cell"	"[{""token"": ""endothelial cells"", ""start_span"": 113, ""end_span"": 130, ""type"": ""Cell""}, {""token"": ""pericyte"", ""start_span"": 247, ""end_span"": 255, ""type"": ""Cell""}]"
The initial step of adhesion was mediated by sialyl Lewis ( x) ( Le ( x)) and sialyl Le ( a), the carbohydrate determinants expressed on the cancer cells, and E - selectin expressed constitutively on F - 2 cells.	"cancer cells	141	153	Cell"	"F - 2 cells	200	211	Cell"	"[{""token"": ""cancer cells"", ""start_span"": 141, ""end_span"": 153, ""type"": ""Cell""}, {""token"": ""F - 2 cells"", ""start_span"": 200, ""end_span"": 211, ""type"": ""Cell""}]"
This in vitro morphogenesis was inhibited by the addition of anti - sialyl Le ( x) / Le ( a) or anti - beta ( 1) - integrin antibodies, which led to the formation of cancer cell aggregates that were independent from the F - 2 cell networks.	"cancer cell aggregates	166	188	Cell"	"F - 2 cell	220	230	Cell"	"[{""token"": ""cancer cell aggregates"", ""start_span"": 166, ""end_span"": 188, ""type"": ""Cell""}, {""token"": ""F - 2 cell"", ""start_span"": 220, ""end_span"": 230, ""type"": ""Cell""}]"
This in vitro morphological appearance was exactly reproduced in the in vivo tumors, which were formed when the mixture of A431 and F - 2 cells at the ratio of 10: 1 were cotransplanted s. c. into the back of nude rats.	"A431	123	127	Cell"	"F - 2 cells	132	143	Cell"	"[{""token"": ""A431"", ""start_span"": 123, ""end_span"": 127, ""type"": ""Cell""}, {""token"": ""F - 2 cells"", ""start_span"": 132, ""end_span"": 143, ""type"": ""Cell""}]"
Keratinocyte progenitor cells from TPA - treated Tg. AC mice were isolated with fluorescence - activated cell sorting and expression was analyzed using cDNA microarray technology.	"Keratinocyte progenitor cells	0	29	Cell"	"cell	105	109	Cell"	"[{""token"": ""Keratinocyte progenitor cells"", ""start_span"": 0, ""end_span"": 29, ""type"": ""Cell""}, {""token"": ""cell"", ""start_span"": 105, ""end_span"": 109, ""type"": ""Cell""}]"
The purpose of this study was to try to understand why DU145 cells are resistant to CH - 11 and determine the signaling pathway utilized by AdGFPFasL ( TET) to induce apoptosis in these Fas - resistant cells.	"DU145 cells	55	66	Cell"	"cells	202	207	Cell"	"[{""token"": ""DU145 cells"", ""start_span"": 55, ""end_span"": 66, ""type"": ""Cell""}, {""token"": ""cells"", ""start_span"": 202, ""end_span"": 207, ""type"": ""Cell""}]"
Altogether, these results suggest that the glycolytic pathway may be an important target for therapeutic intervention to sensitize tumor cells to selectively toxic soluble death ligands or death ligand - expressing cells of the immune system by facilitating the activation of initiator caspase - 8.	"tumor cells	131	142	Cell"	"cells	215	220	Cell"	"[{""token"": ""tumor cells"", ""start_span"": 131, ""end_span"": 142, ""type"": ""Cell""}, {""token"": ""cells"", ""start_span"": 215, ""end_span"": 220, ""type"": ""Cell""}]"
To determine whether changes in angiogenesis are responsible for the decrease in progesterone synthesis, we measured hemoglobin and CD34 levels in luteinized ovaries following injection of COX inhibitors and measured the relative frequency of cells positive for platelet - endothelial cell adhesion molecule as a specific marker for endothelial cells.	"cells	243	248	Cell"	"endothelial cells	333	350	Cell"	"[{""token"": ""cells"", ""start_span"": 243, ""end_span"": 248, ""type"": ""Cell""}, {""token"": ""endothelial cells"", ""start_span"": 333, ""end_span"": 350, ""type"": ""Cell""}]"
Cell - matrix adhesion assay was used to study the adhesive ability of CNE1 - GL cells.	"Cell	0	4	Cell"	"CNE1 - GL cells	71	86	Cell"	"[{""token"": ""Cell"", ""start_span"": 0, ""end_span"": 4, ""type"": ""Cell""}, {""token"": ""CNE1 - GL cells"", ""start_span"": 71, ""end_span"": 86, ""type"": ""Cell""}]"
The positive rates of expression of MMP - 9 in CNE1 and CNE1 - GL cells were 30. 2% and 98. 2%, respectively ( P < 0. 05).	"CNE1	47	51	Cell"	"CNE1 - GL cells	56	71	Cell"	"[{""token"": ""CNE1"", ""start_span"": 47, ""end_span"": 51, ""type"": ""Cell""}, {""token"": ""CNE1 - GL cells"", ""start_span"": 56, ""end_span"": 71, ""type"": ""Cell""}]"
Invasion assay and migration assay showed that the invasion and migration of CNE1 - GL cell were higher than those of CNE1 cells ( P < 0. 01).	"CNE1 - GL cell	77	91	Cell"	"CNE1 cells	118	128	Cell"	"[{""token"": ""CNE1 - GL cell"", ""start_span"": 77, ""end_span"": 91, ""type"": ""Cell""}, {""token"": ""CNE1 cells"", ""start_span"": 118, ""end_span"": 128, ""type"": ""Cell""}]"
However, how survivin couples to the cell death machinery has remained elusive, and the relevant cellular targets of survivin antagonists have not been completely elucidated.	"cell	37	41	Cell"	"cellular	97	105	Cell"	"[{""token"": ""cell"", ""start_span"": 37, ""end_span"": 41, ""type"": ""Cell""}, {""token"": ""cellular"", ""start_span"": 97, ""end_span"": 105, ""type"": ""Cell""}]"
Experimental Design: Human umbilical vein and dermal microvascular endothelial cells were infected with replication - deficient adenoviruses encoding survivin ( pAd - Survivin), green fluorescent protein ( pAd - GFP), or a phosphorylation - defective survivin Thr ( 34) - - > Ala ( pAd - T34A) dominant negative mutant.	"umbilical vein	27	41	Cell"	"dermal microvascular endothelial cells	46	84	Cell"	"[{""token"": ""umbilical vein"", ""start_span"": 27, ""end_span"": 41, ""type"": ""Cell""}, {""token"": ""dermal microvascular endothelial cells"", ""start_span"": 46, ""end_span"": 84, ""type"": ""Cell""}]"
The cell death pathway initiated by survivin targeting was mapped with respect to cytochrome c release, changes in mitochondrial transmembrane potential, and apoptosome requirements using mouse embryonic fibroblasts deficient in Apaf - 1 or caspase - 9.	"cell	4	8	Cell"	"embryonic fibroblasts	194	215	Cell"	"[{""token"": ""cell"", ""start_span"": 4, ""end_span"": 8, ""type"": ""Cell""}, {""token"": ""embryonic fibroblasts"", ""start_span"": 194, ""end_span"": 215, ""type"": ""Cell""}]"
Conversely, expression of pAd - T34A caused apoptosis in umbilical vein and dermal microvascular endothelial cells and resulted in caspase - 3 activity.	"umbilical vein	57	71	Cell"	"dermal microvascular endothelial cells	76	114	Cell"	"[{""token"": ""umbilical vein"", ""start_span"": 57, ""end_span"": 71, ""type"": ""Cell""}, {""token"": ""dermal microvascular endothelial cells"", ""start_span"": 76, ""end_span"": 114, ""type"": ""Cell""}]"
Cell death induced by survivin targeting exhibited the hallmarks of mitochondrial - dependent apoptosis with release of cytochrome c and loss of mitochondrial transmembrane potential and was suppressed in Apaf - 1 or caspase - 9 knockout mouse embryonic fibroblasts.	"Cell	0	4	Cell"	"embryonic fibroblasts	244	265	Cell"	"[{""token"": ""Cell"", ""start_span"": 0, ""end_span"": 4, ""type"": ""Cell""}, {""token"": ""embryonic fibroblasts"", ""start_span"": 244, ""end_span"": 265, ""type"": ""Cell""}]"
Accumulating evidences indicate that receptor activator of NF - kB ligand ( RANKL) is the ultimate extracellular mediator that stimulates osteoclast differentiation into mature osteoclasts.	"osteoclast	138	148	Cell"	"osteoclasts	177	188	Cell"	"[{""token"": ""osteoclast"", ""start_span"": 138, ""end_span"": 148, ""type"": ""Cell""}, {""token"": ""osteoclasts"", ""start_span"": 177, ""end_span"": 188, ""type"": ""Cell""}]"
These experiments demonstrate that direct interactions between breast cancer and stromal or osteoblastic cells induce osteoclastogenesis in vitro through modulating RANKL expression.	"stromal	81	88	Cell"	"osteoblastic cells	92	110	Cell"	"[{""token"": ""stromal"", ""start_span"": 81, ""end_span"": 88, ""type"": ""Cell""}, {""token"": ""osteoblastic cells"", ""start_span"": 92, ""end_span"": 110, ""type"": ""Cell""}]"
We have recently found that sodium fluoride ( NaF) induced apoptotic cell death in tumor cell lines.	"cell	69	73	Cell"	"tumor cell lines	83	99	Cell"	"[{""token"": ""cell"", ""start_span"": 69, ""end_span"": 73, ""type"": ""Cell""}, {""token"": ""tumor cell lines"", ""start_span"": 83, ""end_span"": 99, ""type"": ""Cell""}]"
TGFbeta1 was initially identified in culture media from transformed cells as part of a factor that could produce a transformed phenotype in a nontransformed cell line.	"transformed cells	56	73	Cell"	"nontransformed cell	142	161	Cell"	"[{""token"": ""transformed cells"", ""start_span"": 56, ""end_span"": 73, ""type"": ""Cell""}, {""token"": ""nontransformed cell"", ""start_span"": 142, ""end_span"": 161, ""type"": ""Cell""}]"
NIH3T3 transfectant containing human K - ras oncogene shows enhanced metastatic activity after in vivo tumor growth or co - culture with fibroblasts.	"NIH3T3 transfectant	0	19	Cell"	"fibroblasts	137	148	Cell"	"[{""token"": ""NIH3T3 transfectant"", ""start_span"": 0, ""end_span"": 19, ""type"": ""Cell""}, {""token"": ""fibroblasts"", ""start_span"": 137, ""end_span"": 148, ""type"": ""Cell""}]"
Six subclones were randomly selected from H - 3 cells which had been subcultured to passage 22.	"subclones	4	13	Cell"	"H - 3 cells	42	53	Cell"	"[{""token"": ""subclones"", ""start_span"": 4, ""end_span"": 13, ""type"": ""Cell""}, {""token"": ""H - 3 cells"", ""start_span"": 42, ""end_span"": 53, ""type"": ""Cell""}]"
