Intraocular pressure in genetically distinct mice: an update and strain survey	"mice	45	49	Organism"	"[{""token"": ""mice"", ""start_span"": 45, ""end_span"": 49, ""type"": ""Organism""}]"
The purpose of this study was to determine the IOPs of genetically distinct mouse strains, assess the effects of factors such as age, sex and time of day on IOP in specific strain backgrounds, and to assess the effects of specific candidate gene mutations on IOP.	"mouse	76	81	Organism"	"[{""token"": ""mouse"", ""start_span"": 76, ""end_span"": 81, ""type"": ""Organism""}]"
Based on over 30 studied mouse strains, average IOP ranges from approximately 10 to 20 mmHg.	"mouse	25	30	Organism"	"[{""token"": ""mouse"", ""start_span"": 25, ""end_span"": 30, ""type"": ""Organism""}]"
Albino C57BL / 6J mice homozygous for a tyrosinase mutation ( Tyrc - 2J) have higher IOPs than their pigmented counterparts.	"mice	18	22	Organism"	"[{""token"": ""mice"", ""start_span"": 18, ""end_span"": 22, ""type"": ""Organism""}]"
Genetically distinct mouse strains housed in the same environment have a broad range of IOPs.	"mouse	21	26	Organism"	"[{""token"": ""mouse"", ""start_span"": 21, ""end_span"": 26, ""type"": ""Organism""}]"
These studies demonstrate that mice are a practical and powerful experimental system to study the genetics of IOP regulation and disease processes that raise IOP to harmful levels.	"mice	31	35	Organism"	"[{""token"": ""mice"", ""start_span"": 31, ""end_span"": 35, ""type"": ""Organism""}]"
Identifying such loci allows screening for individuals with an increased risk of developing glaucoma [ 11].	"individuals	43	54	Organism"	"[{""token"": ""individuals"", ""start_span"": 43, ""end_span"": 54, ""type"": ""Organism""}]"
Identifying genes contributing to elevated IOP and glaucoma is only the first step, however, and animal models will provide systems for subsequent hypothesis testing and experimental dissection of pathogenesis.	"animal	97	103	Organism"	"[{""token"": ""animal"", ""start_span"": 97, ""end_span"": 103, ""type"": ""Organism""}]"
We have focused on developing the mouse system for IOP and glaucoma studies [ 13 - 19].	"mouse	34	39	Organism"	"[{""token"": ""mouse"", ""start_span"": 34, ""end_span"": 39, ""type"": ""Organism""}]"
Mice are expected to be extremely helpful in characterizing genes and mechanisms that affect IOP or the susceptibility of the optic nerve and retina to glaucomatous damage [ 20].	"Mice	0	4	Organism"	"[{""token"": ""Mice"", ""start_span"": 0, ""end_span"": 4, ""type"": ""Organism""}]"
The initial experiments demonstrated that in our hands careful ocular cannulation has a very minor effect on IOP ( average of - 0. 3 mmHg, mode - 0. 5 mmHg) and demonstrated significant differences in intraocular pressure levels between four mouse strains.	"mouse	242	247	Organism"	"[{""token"": ""mouse"", ""start_span"": 242, ""end_span"": 247, ""type"": ""Organism""}]"
Figure 1 shows the average IOP of a number of inbred mouse strains that were housed in the same environmental conditions.	"mouse	53	58	Organism"	"[{""token"": ""mouse"", ""start_span"": 53, ""end_span"": 58, ""type"": ""Organism""}]"
An almost two - fold range of IOP between genetically distinct mouse strains.	"mouse	63	68	Organism"	"[{""token"": ""mouse"", ""start_span"": 63, ""end_span"": 68, ""type"": ""Organism""}]"
Mice of most strains were 6 to 12 months old, except for SEC / 1ReJ and SB / Le that were 2 to 3 months old.	"Mice	0	4	Organism"	"[{""token"": ""Mice"", ""start_span"": 0, ""end_span"": 4, ""type"": ""Organism""}]"
For example, the iridocorneal angle and aqueous humor drainage structures are open to the anterior chamber and have normal morphology in both BALB / cJ and CBA / CaJ mice ( Figure 2).	"mice	166	170	Organism"	"[{""token"": ""mice"", ""start_span"": 166, ""end_span"": 170, ""type"": ""Organism""}]"
We aged a small group of these mice ( n = 4) to 2 years and histologically analyzed their optic nerves and retinas but they did not develop glaucoma.	"mice	31	35	Organism"	"[{""token"": ""mice"", ""start_span"": 31, ""end_span"": 35, ""type"": ""Organism""}]"
For incidence, the numerator indicates the number of mice or eyes affected and the denominator indicates the total number analyzed.	"mice	53	57	Organism"	"[{""token"": ""mice"", ""start_span"": 53, ""end_span"": 57, ""type"": ""Organism""}]"
The mice were 6 to 12 months old at the time of analysis and were not studied at other ages unless indicated.	"mice	4	8	Organism"	"[{""token"": ""mice"", ""start_span"": 4, ""end_span"": 8, ""type"": ""Organism""}]"
Average IOP for age matched mice of the same strain assessed at different times typically differed by no more than 1. 5 mmHg, and the differences were usually smaller.	"mice	28	32	Organism"	"[{""token"": ""mice"", ""start_span"": 28, ""end_span"": 32, ""type"": ""Organism""}]"
The sex [ Male ( M) or Female ( F)], age ( months), and number of mice ( n) analyzed for the CBA strains are listed starting with the earliest measurement and ending with the latest: CBA / CaJ, F, n = 22, age 6 - 7; M, n = 11, age 2; CBA / CaHN, F, n = 16, age 3; M, n = 8, age 3.	"mice	66	70	Organism"	"[{""token"": ""mice"", ""start_span"": 66, ""end_span"": 70, ""type"": ""Organism""}]"
The number of mice analyzed at each time follows: BALB / cJ 8, 10, 11, 15, 18 and 14, C57BL / 6J 10, 14, 21, 40, 40 and 42.	"mice	14	18	Organism"	"[{""token"": ""mice"", ""start_span"": 14, ""end_span"": 18, ""type"": ""Organism""}]"
The IOPs of BALB / cJ mice ( low end of spectrum) were very similar for the past several years, around 11 mmHg.	"mice	22	26	Organism"	"[{""token"": ""mice"", ""start_span"": 22, ""end_span"": 26, ""type"": ""Organism""}]"
The increased IOP in A / J also was reproducible, with the average IOP of mice assessed in the year 2000 being 14. 5 +/- 0. 4 mmHg ( n = 16).	"mice	74	78	Organism"	"[{""token"": ""mice"", ""start_span"": 74, ""end_span"": 78, ""type"": ""Organism""}]"
For example, control mice analyzed at the same time as the 3 month, 12 month and 18 month B6 age groups had IOPs of 13. 0 +/- 0. 2 mmHg ( n = 14), 13. 3 +/- 0. 2 mmHg ( n = 14), 13. 7 +/- 0. 4 mmHg ( n = 12), respectively.	"mice	21	25	Organism"	"[{""token"": ""mice"", ""start_span"": 21, ""end_span"": 25, ""type"": ""Organism""}]"
IOP was even lower in the 24 month B6 mice ( 10. 8 +/- 0. 4 mmHg), and again the average IOP of young controls measured at the same time was not changed ( 13. 5 +/- 0. 2, n = 12).	"mice	38	42	Organism"	"[{""token"": ""mice"", ""start_span"": 38, ""end_span"": 42, ""type"": ""Organism""}]"
The 3 months old C3H / HeJ mice were male while the other ages were composed of males and females.	"mice	27	31	Organism"	"[{""token"": ""mice"", ""start_span"": 27, ""end_span"": 31, ""type"": ""Organism""}]"
The number of mice analyzed at each age, listed from youngest to oldest, follow: C57BL / 6J, 18, 18, 18, 18, 13; 129P3 / J, 18, 15, 16, 14, 21; C3H / HeJ, 15, 23 17 and 16.	"mice	14	18	Organism"	"[{""token"": ""mice"", ""start_span"": 14, ""end_span"": 18, ""type"": ""Organism""}]"
In strain 129P3 / J, IOP did not differ significantly with age between 3 and 14 months but was lower in 18 month old mice ( P < 0. 001 compared to all younger ages, Figure 4).	"mice	117	121	Organism"	"[{""token"": ""mice"", ""start_span"": 117, ""end_span"": 121, ""type"": ""Organism""}]"
Despite a 1 mmHg dip in IOP at 8 months, there were no significant IOP differences between C3H / HeJ mice at each age tested ( P = 0. 2 for age).	"mice	101	105	Organism"	"[{""token"": ""mice"", ""start_span"": 101, ""end_span"": 105, ""type"": ""Organism""}]"
If real, this sporadic sex difference was not dependent on age, sometimes occurring in a group of B6 mice at a particular age and sometimes not occurring in a separate group of the same age.	"mice	101	105	Organism"	"[{""token"": ""mice"", ""start_span"": 101, ""end_span"": 105, ""type"": ""Organism""}]"
Initial experiments suggested that an almost identical dose ( 100 mg / kg ketamine and 9 mg / kg xylazine) of anesthesia had no effect on IOP during the experimental period with IOP being measured as soon as possible after the mouse was unconscious, typically minutes.	"mouse	227	232	Organism"	"[{""token"": ""mouse"", ""start_span"": 227, ""end_span"": 232, ""type"": ""Organism""}]"
To further assess the effects of anesthesia, we measured IOP in groups of genetically identical B6 mice subjected to different doses ( 1X, 1. 5X and 2X) at 5 and 25 minutes after administration ( Figure 5).	"mice	99	103	Organism"	"[{""token"": ""mice"", ""start_span"": 99, ""end_span"": 103, ""type"": ""Organism""}]"
To identify any early window when it may be possible to assess IOP without an obvious anesthetic effect, 195 mice of strain B6 were anesthetized with the 1X dose and IOP was measured at 1 minute time points between 4 and 12 minutes after administration ( Figure 5).	"mice	109	113	Organism"	"[{""token"": ""mice"", ""start_span"": 109, ""end_span"": 113, ""type"": ""Organism""}]"
Similar results were obtained using 161 strain 129P3 / J and 145 strain DBA / 2J mice with the 1X dose ( 129P3 / J, P = 0. 1; DBA / 2J, P = 0. 2).	"mice	81	85	Organism"	"[{""token"": ""mice"", ""start_span"": 81, ""end_span"": 85, ""type"": ""Organism""}]"
A Mean IOP +/- SD is shown for C57BL / 6J mice at 5 and 25 minutes after administration of various doses of anesthetic.	"mice	42	46	Organism"	"[{""token"": ""mice"", ""start_span"": 42, ""end_span"": 46, ""type"": ""Organism""}]"
Approximately thirty 3 to 4 month old mice were analyzed at each dose and time B - D.	"mice	38	42	Organism"	"[{""token"": ""mice"", ""start_span"": 38, ""end_span"": 42, ""type"": ""Organism""}]"
Scatter - plots demonstrating no change in IOP over the 12 minutes following anesthetic administration in three relatively unrelated mouse strains.	"mouse	133	138	Organism"	"[{""token"": ""mouse"", ""start_span"": 133, ""end_span"": 138, ""type"": ""Organism""}]"
The scatter - plots include 195 C57BL / 6J, 161 129P3 / J and 145 DBA / 2J mice.	"mice	75	79	Organism"	"[{""token"": ""mice"", ""start_span"": 75, ""end_span"": 79, ""type"": ""Organism""}]"
All mice were 2 to 4 months old except for CBA / CaJ that were 5 to 6 months old.	"mice	4	8	Organism"	"[{""token"": ""mice"", ""start_span"": 4, ""end_span"": 8, ""type"": ""Organism""}]"
129B6 refers to mice of a mixed 129X1 / SvJ and C57BL / 6J background.	"mice	16	20	Organism"	"[{""token"": ""mice"", ""start_span"": 16, ""end_span"": 20, ""type"": ""Organism""}]"
The number of mice successfully analyzed during the light ( L) or dark ( D) periods follows, DBA / 2J 10L, 10D; C57BL / 6J 32L, 22D; C57BR / cdJ 12L, 10D; SWR / J 16L, 16D; BALB / cByJ 15L, 16D; 129B6 10L, 12D; CBA / CaJ 22L, 16D.	"mice	14	18	Organism"	"[{""token"": ""mice"", ""start_span"": 14, ""end_span"": 18, ""type"": ""Organism""}]"
An initial study of the relationship between blood pressure and IOP in mice did not detect a good correlation ( R2 = 0. 1, Figure 7).	"mice	71	75	Organism"	"[{""token"": ""mice"", ""start_span"": 71, ""end_span"": 75, ""type"": ""Organism""}]"
All mice were female and 2 to 4 months old, with the exception that the female CBA / CaJ used for IOP assessment were 6 to 7 months old.	"mice	4	8	Organism"	"[{""token"": ""mice"", ""start_span"": 4, ""end_span"": 8, ""type"": ""Organism""}]"
If the CBA / CaJ mice are excluded, R2 drops to 0. 01 of ARK / J, C57BL / 6J and SJL / J, strain ARK / J had the lowest IOP.	"mice	17	21	Organism"	"[{""token"": ""mice"", ""start_span"": 17, ""end_span"": 21, ""type"": ""Organism""}]"
Mutations in the myocilin gene ( MYOC) cause human glaucoma.	"human	45	50	Organism"	"[{""token"": ""human"", ""start_span"": 45, ""end_span"": 50, ""type"": ""Organism""}]"
Sequencing identified two alleles of Myoc in these mouse strains ( see text).	"mouse	51	56	Organism"	"[{""token"": ""mouse"", ""start_span"": 51, ""end_span"": 56, ""type"": ""Organism""}]"
Mouse strains homozygous for an allele having a 12 bp insertion in the promoter region are shown as open bars and strains homozygous for the allele without this insertion have filled bars.	"Mouse	0	5	Organism"	"[{""token"": ""Mouse"", ""start_span"": 0, ""end_span"": 5, ""type"": ""Organism""}]"
The Y chromosome has been implicated in strain specific blood pressure differences in rats [ 23, 24].	"rats	86	90	Organism"	"[{""token"": ""rats"", ""start_span"": 86, ""end_span"": 90, ""type"": ""Organism""}]"
No differences in IOP were detected between these groups of mice ( Figure 9, P = 0. 1).	"mice	60	64	Organism"	"[{""token"": ""mice"", ""start_span"": 60, ""end_span"": 64, ""type"": ""Organism""}]"
To test if deficiency of carbonic anhydrase II leads to decreased IOP, we analyzed mice of a B6 background that were genetically similar but with normal or mutant alleles of the Car2 gene [ 25, 26].	"mice	83	87	Organism"	"[{""token"": ""mice"", ""start_span"": 83, ""end_span"": 87, ""type"": ""Organism""}]"
There was no difference in IOP between normal and mutant mice ( Figure 9, P = 0. 5).	"mice	57	61	Organism"	"[{""token"": ""mice"", ""start_span"": 57, ""end_span"": 61, ""type"": ""Organism""}]"
To test if genetic perturbations that cause obesity and diabetes can alter IOP, we compared mice that were genetically similar but were either homozygous or heterozygous for a leptin receptor mutation ( db) that results in obesity and diabetes before 4 months of age on the C57BLKS / J strain background used [ 27].	"mice	92	96	Organism"	"[{""token"": ""mice"", ""start_span"": 92, ""end_span"": 96, ""type"": ""Organism""}]"
To determine if albinism alters IOP, we analyzed B6 mice that were either pigmented or albino.	"mice	52	56	Organism"	"[{""token"": ""mice"", ""start_span"": 52, ""end_span"": 56, ""type"": ""Organism""}]"
The albino mice were homozygous and coisogenic for a mutant allele of tyrosinase ( Tyrc - 2J) that arose on the otherwise pigmented B6 background.	"mice	11	15	Organism"	"[{""token"": ""mice"", ""start_span"": 11, ""end_span"": 15, ""type"": ""Organism""}]"
The same was true for independent cohorts of mice of different ages that were analyzed at different times ( Figure 10A).	"mice	45	49	Organism"	"[{""token"": ""mice"", ""start_span"": 45, ""end_span"": 49, ""type"": ""Organism""}]"
Different cohorts of C57BL / 6J mice that are homozygous for the spontaneous Tyrc - 2J mutation have higher IOP than their normal counterparts at all tested ages.	"mice	32	36	Organism"	"[{""token"": ""mice"", ""start_span"": 32, ""end_span"": 36, ""type"": ""Organism""}]"
All groups consisted of male and female mice.	"mice	40	44	Organism"	"[{""token"": ""mice"", ""start_span"": 40, ""end_span"": 44, ""type"": ""Organism""}]"
The number of mice analyzed during the light period were: 2 month, 28 + / +, 29 c - 2J / c - 2J, 4 month, 20 + / + and 20 c - 2J / c - 2J, 8 month, 15 + / + and 15 c - 2J / c - 2J.	"mice	14	18	Organism"	"[{""token"": ""mice"", ""start_span"": 14, ""end_span"": 18, ""type"": ""Organism""}]"
Fourteen mice of each genotype were successfully analyzed during the dark period of the day.	"mice	9	13	Organism"	"[{""token"": ""mice"", ""start_span"": 9, ""end_span"": 13, ""type"": ""Organism""}]"
We report the IOPs of over 30 genetically different mouse strains that were housed in the same environmental conditions.	"mouse	52	57	Organism"	"[{""token"": ""mouse"", ""start_span"": 52, ""end_span"": 57, ""type"": ""Organism""}]"
Using our method, a trained investigator can measure the IOPs of 10 mice in an hour.	"mice	68	72	Organism"	"[{""token"": ""mice"", ""start_span"": 68, ""end_span"": 72, ""type"": ""Organism""}]"
Thus it is feasible to assess sufficient numbers of mice for quantitative trait locus ( QTL) analysis methods and to use these methods to identify chromosomal regions contributing to strain differences in IOP.	"mice	52	56	Organism"	"[{""token"": ""mice"", ""start_span"": 52, ""end_span"": 56, ""type"": ""Organism""}]"
The relationship between the IOPs we measure and those in conscious mice depends upon the effect of our anesthetic protocol ( intraperitoneal injection of 99 mg / kg ketamine and 9 mg / kg xylazine).	"mice	68	72	Organism"	"[{""token"": ""mice"", ""start_span"": 68, ""end_span"": 72, ""type"": ""Organism""}]"
Similarities and differences to rat studies	"rat	32	35	Organism"	"[{""token"": ""rat"", ""start_span"": 32, ""end_span"": 35, ""type"": ""Organism""}]"
Our results agree with the time course of cardiovascular depression caused by intraperitoneal administration of ketamine and xylazine in rats.	"rats	137	141	Organism"	"[{""token"": ""rats"", ""start_span"": 137, ""end_span"": 141, ""type"": ""Organism""}]"
In contrast, intraperitoneally administered ketamine ( 100 mg / kg) was shown to rapidly decrease IOP in a different rat study [ 36].	"rat	117	120	Organism"	"[{""token"": ""rat"", ""start_span"": 117, ""end_span"": 120, ""type"": ""Organism""}]"
The time 0 measurement in that study was at a very similar state of anesthesia as our 4 and 5 minute time points ( starting as soon as possible and within 20 to 60 seconds of adequate anesthesia), and the 5 minute rat time point was similar to our 9 and 10 minute measurement times.	"rat	214	217	Organism"	"[{""token"": ""rat"", ""start_span"": 214, ""end_span"": 217, ""type"": ""Organism""}]"
In mice, the strain does not appear to be important as no early effect of anesthesia was present in the three distantly related laboratory strains [ 37] we studied in detail, and we have not observed any obvious effect during this period in any analyzed strain.	"mice	3	7	Organism"	"[{""token"": ""mice"", ""start_span"": 3, ""end_span"": 7, ""type"": ""Organism""}]"
Cage cleanliness, changing frequency and housing density can alter drug metabolism and the effect of anesthesia in rats [ 38, 39].	"rats	115	119	Organism"	"[{""token"": ""rats"", ""start_span"": 115, ""end_span"": 119, ""type"": ""Organism""}]"
We use wood shavings for bedding and wood shavings expose the mice to terpenes.	"mice	62	66	Organism"	"[{""token"": ""mice"", ""start_span"": 62, ""end_span"": 66, ""type"": ""Organism""}]"
We evaluated the relationship between these latter factors and IOP in genetically homogeneous mouse strains in a controlled environment.	"mouse	94	99	Organism"	"[{""token"": ""mouse"", ""start_span"": 94, ""end_span"": 99, ""type"": ""Organism""}]"
This decrease was statistically significant compared to young mice measured at the same time.	"mice	62	66	Organism"	"[{""token"": ""mice"", ""start_span"": 62, ""end_span"": 66, ""type"": ""Organism""}]"
The IOP of 129P3 / J mice also decreased with age but only at the oldest age examined ( 18 months).	"mice	21	25	Organism"	"[{""token"": ""mice"", ""start_span"": 21, ""end_span"": 25, ""type"": ""Organism""}]"
Decreasing IOP correlates with increasing age in the human Japanese population [ 50, 51].	"human	53	58	Organism"	"[{""token"": ""human"", ""start_span"": 53, ""end_span"": 58, ""type"": ""Organism""}]"
Further studies of B6 mice may allow experimental investigation of this effect.	"mice	22	26	Organism"	"[{""token"": ""mice"", ""start_span"": 22, ""end_span"": 26, ""type"": ""Organism""}]"
"Additional studies may also identify "" normal "" mouse strains that develop increased IOP with age as generally occurs in Western populations [ 52, 53]."	"mouse	48	53	Organism"	"[{""token"": ""mouse"", ""start_span"": 48, ""end_span"": 53, ""type"": ""Organism""}]"
This is in agreement with a number of human studies, which show that IOP is equal between the sexes [ 52, 53].	"human	38	43	Organism"	"[{""token"": ""human"", ""start_span"": 38, ""end_span"": 43, ""type"": ""Organism""}]"
Of possible relevance, we previously reported that female mice of strains DBA / 2J and AKXD - 28 / Ty develop elevated IOP at an earlier age than males [ 14, 19].	"mice	58	62	Organism"	"[{""token"": ""mice"", ""start_span"": 58, ""end_span"": 62, ""type"": ""Organism""}]"
Some but not all human studies have reported a positive association between IOP and blood pressure [ 48, 52].	"human	17	22	Organism"	"[{""token"": ""human"", ""start_span"": 17, ""end_span"": 22, ""type"": ""Organism""}]"
Further studies are needed to determine if blood pressure correlates with IOP in males, and to determine the relationship between blood pressure and IOP in various mouse strains with age.	"mouse	164	169	Organism"	"[{""token"": ""mouse"", ""start_span"": 164, ""end_span"": 169, ""type"": ""Organism""}]"
To test if genetic perturbations that cause obesity and diabetes can alter IOP, we compared groups of mice that were genetically similar except that they were either homozygous or heterozygous for a leptin receptor mutation ( db) that results in early onset obesity and diabetes.	"mice	102	106	Organism"	"[{""token"": ""mice"", ""start_span"": 102, ""end_span"": 106, ""type"": ""Organism""}]"
The obese, diabetic mice had higher IOPs than their lean, non - diabetic littermates.	"mice	20	24	Organism"	"[{""token"": ""mice"", ""start_span"": 20, ""end_span"": 24, ""type"": ""Organism""}]"
Further experiments with obese non - diabetic or diabetic non - obese mice will help to characterize the separate effects of these risk factors.	"mice	70	74	Organism"	"[{""token"": ""mice"", ""start_span"": 70, ""end_span"": 74, ""type"": ""Organism""}]"
We first suspected IOP changes with time of day when the IOP of a group of B6 mice measured in the hour prior to onset of the dark period appeared to be higher than at other times of day.	"mice	78	82	Organism"	"[{""token"": ""mice"", ""start_span"": 78, ""end_span"": 82, ""type"": ""Organism""}]"
Thus, we compared the IOPs of mice at different times of day and identified several strains with significantly higher IOP during the dark compared to the light period.	"mice	30	34	Organism"	"[{""token"": ""mice"", ""start_span"": 30, ""end_span"": 34, ""type"": ""Organism""}]"
The IOP increase in the dark is not dependent on functional rod and cone photoreceptors since these cells degenerate in SWR / J mice due to homozygosity for the Pde6brd1 mutation.	"mice	128	132	Organism"	"[{""token"": ""mice"", ""start_span"": 128, ""end_span"": 132, ""type"": ""Organism""}]"
In agreement with this finding, circadian regulation of wheel running by light was previously reported in mice lacking rods and cones [ 70].	"mice	106	110	Organism"	"[{""token"": ""mice"", ""start_span"": 106, ""end_span"": 110, ""type"": ""Organism""}]"
Further more detailed studies are needed to define the characteristics of the diurnal rhythm of intraocular pressure in mice, and to determine whether it is lacking or has a different timing in strain CBA / CaJ.	"mice	120	124	Organism"	"[{""token"": ""mice"", ""start_span"": 120, ""end_span"": 124, ""type"": ""Organism""}]"
Analysis of these mouse strains may increase understanding of the molecular mechanisms controlling diurnal rhythms of IOP and that may be relevant to glaucoma.	"mouse	18	23	Organism"	"[{""token"": ""mouse"", ""start_span"": 18, ""end_span"": 23, ""type"": ""Organism""}]"
Our experiments show that a genetic deficiency of CAII in mice homozygous for a mutation in the Car2 gene does not alter IOP.	"mice	58	62	Organism"	"[{""token"": ""mice"", ""start_span"": 58, ""end_span"": 62, ""type"": ""Organism""}]"
It is not known if these abnormalities affect mammalian IOP.	"mammalian	46	55	Organism"	"[{""token"": ""mammalian"", ""start_span"": 46, ""end_span"": 55, ""type"": ""Organism""}]"
Additionally, IOP differences between the light and dark period of the day were detected in the pigmented but not the albino B6 mice.	"mice	128	132	Organism"	"[{""token"": ""mice"", ""start_span"": 128, ""end_span"": 132, ""type"": ""Organism""}]"
Exposing rats to 24 hours of low light abrogates the diurnal fluctuation of IOP and results in constantly elevated IOP [ 36].	"rats	9	13	Organism"	"[{""token"": ""rats"", ""start_span"": 9, ""end_span"": 13, ""type"": ""Organism""}]"
Further experiments will determine the nature of the diurnal rhythm of IOP in the albino B6 mice and if its alteration or other mechanisms result in IOP elevation.	"mice	92	96	Organism"	"[{""token"": ""mice"", ""start_span"": 92, ""end_span"": 96, ""type"": ""Organism""}]"
A broad range of reproducible IOP differences exists between inbred mouse strains and a diurnal rhythm of IOP exists in different strains.	"mouse	68	73	Organism"	"[{""token"": ""mouse"", ""start_span"": 68, ""end_span"": 73, ""type"": ""Organism""}]"
Various factors have been variably associated with risk for increased IOP in humans.	"humans	77	83	Organism"	"[{""token"": ""humans"", ""start_span"": 77, ""end_span"": 83, ""type"": ""Organism""}]"
Genetically uniform, mice can be used to study the effects of these risk factors on IOP.	"mice	21	25	Organism"	"[{""token"": ""mice"", ""start_span"": 21, ""end_span"": 25, ""type"": ""Organism""}]"
Mice have great potential for helping to characterize the molecular mechanisms affecting IOP.	"Mice	0	4	Organism"	"[{""token"": ""Mice"", ""start_span"": 0, ""end_span"": 4, ""type"": ""Organism""}]"
Animal husbandry	"Animal	0	6	Organism"	"[{""token"": ""Animal"", ""start_span"": 0, ""end_span"": 6, ""type"": ""Organism""}]"
All experiments were performed in compliance with the ARVO statement for use of animals in ophthalmic and vision research.	"animals	80	87	Organism"	"[{""token"": ""animals"", ""start_span"": 80, ""end_span"": 87, ""type"": ""Organism""}]"
All mice were bred and maintained at The Jackson Laboratory.	"mice	4	8	Organism"	"[{""token"": ""mice"", ""start_span"": 4, ""end_span"": 8, ""type"": ""Organism""}]"
Mice were housed in cages containing white pine bedding and covered with polyester filters.	"Mice	0	4	Organism"	"[{""token"": ""Mice"", ""start_span"": 0, ""end_span"": 4, ""type"": ""Organism""}]"
