The onset of pendrin expression during development of the mouse inner ear has been determined to be embryonic day ( ED) 13 [ 14].	"mouse	58	63	Organism"	"[{""token"": ""mouse"", ""start_span"": 58, ""end_span"": 63, ""type"": ""Organism""}]"
We hypothesized that a lack of a normal endocochlear potential or an alteration of the endolymphatic K + concentration could account for deafness in Slc26a4 - / - mice.	"mice	163	167	Organism"	"[{""token"": ""mice"", ""start_span"": 163, ""end_span"": 167, ""type"": ""Organism""}]"
No significant differences between Slc26a4 + / + and Slc26a4 - / - mice were found in perilymphatic ( Fig. 2a) or plasma K + concentrations ( Slc26a4 + / +, 4. 9 +/- 0. 3 mM, n = 6; Slc26a4 - / -, 5. 1 +/- 0. 3 mM, n = 6).	"mice	67	71	Organism"	"[{""token"": ""mice"", ""start_span"": 67, ""end_span"": 71, ""type"": ""Organism""}]"
These observations suggest that a primary event leading to deafness in Slc26a4 - / - mice, and potentially in patients suffering from Pendred syndrome, is the loss of the endocochlear potential.	"mice	85	89	Organism"	"[{""token"": ""mice"", ""start_span"": 85, ""end_span"": 89, ""type"": ""Organism""}]"
Potential, K + concentrations and pigmentation of stria vascularis in Slc26a4 + / + and Slc26a4 - / - mice.	"mice	102	106	Organism"	"[{""token"": ""mice"", ""start_span"": 102, ""end_span"": 106, ""type"": ""Organism""}]"
b - d: Pigmentation of stria vascularis in Slc26a4 + / + and Slc26a4 - / - mice.	"mice	75	79	Organism"	"[{""token"": ""mice"", ""start_span"": 75, ""end_span"": 79, ""type"": ""Organism""}]"
c - d: Whole - mounts of stria vascularis isolated from age - matched mice.	"mice	70	74	Organism"	"[{""token"": ""mice"", ""start_span"": 70, ""end_span"": 74, ""type"": ""Organism""}]"
To determine the cause of the loss of the endocochlear potential in Slc26a4 - / - mice, we first determined whether intermediate cells are present in stria vascularis, since a loss of intermediate cells is known to lead to a loss of the endocochlear potential [ 27, 28].	"mice	82	86	Organism"	"[{""token"": ""mice"", ""start_span"": 82, ""end_span"": 86, ""type"": ""Organism""}]"
Pigmentation was present in stria vascularis of Slc26a4 - / - mice ( Fig. 2b), which suggests that intermediate cells are present.	"mice	62	66	Organism"	"[{""token"": ""mice"", ""start_span"": 62, ""end_span"": 66, ""type"": ""Organism""}]"
Interestingly, pigmentation of stria vascularis was much stronger in Slc26a4 - / - than in Slc26a4 + / + mice.	"mice	105	109	Organism"	"[{""token"": ""mice"", ""start_span"": 105, ""end_span"": 109, ""type"": ""Organism""}]"
Quantities of stria vascularis isolated from these different mice were similar, since no significant differences were found in the numbers of 18S rRNA molecules ( log ( rRNA) = 9. 46 +/- 0. 08, n = 17, pooled data).	"mice	61	65	Organism"	"[{""token"": ""mice"", ""start_span"": 61, ""end_span"": 65, ""type"": ""Organism""}]"
Quantification of KCNJ10 and KCNQ1 mRNA expression in stria vascularis and spiral ganglia of Slc26a4 + / + and Slc26a4 - / - mice.	"mice	125	129	Organism"	"[{""token"": ""mice"", ""start_span"": 125, ""end_span"": 129, ""type"": ""Organism""}]"
a: Electropherogram of total RNA isolated from stria vascularis microdissected from one mouse.	"mouse	88	93	Organism"	"[{""token"": ""mouse"", ""start_span"": 88, ""end_span"": 93, ""type"": ""Organism""}]"
Insert: Genotype of Slc26a4 - / - mice was verified by the observation of one or few very large rhomboedric otoconia in the utricular macula ( arrow).	"mice	34	38	Organism"	"[{""token"": ""mice"", ""start_span"": 34, ""end_span"": 38, ""type"": ""Organism""}]"
c: Quantification of KCNJ10 and KCNQ1 mRNA in young Slc26a4 + / + and young and old Slc26a4 - / - mice.	"mice	98	102	Organism"	"[{""token"": ""mice"", ""start_span"": 98, ""end_span"": 102, ""type"": ""Organism""}]"
The presence of KCNJ10 mRNA in stria vascularis of Slc26a4 - / - mice supports the finding that intermediate cells are present.	"mice	65	69	Organism"	"[{""token"": ""mice"", ""start_span"": 65, ""end_span"": 69, ""type"": ""Organism""}]"
Expression of the KCNJ10 protein was assessed in young Slc26a4 - / - mice by confocal immunocytochemistry.	"mice	69	73	Organism"	"[{""token"": ""mice"", ""start_span"": 69, ""end_span"": 73, ""type"": ""Organism""}]"
Protein localization of KCNJ10 in the cochlea of Slc26a4 + / + and Slc26a4 - / - mice.	"mice	81	85	Organism"	"[{""token"": ""mice"", ""start_span"": 81, ""end_span"": 85, ""type"": ""Organism""}]"
Expression of KCNJ10 in Slc26a4 - / - mice was absent in stria vascularis but unchanged in spiral ganglion cells.	"mice	38	42	Organism"	"[{""token"": ""mice"", ""start_span"": 38, ""end_span"": 42, ""type"": ""Organism""}]"
Spiral prominence in Slc26a4 - / - mice was less prominent, spiral ligament thinner and spiral limbus flatter ( Fig. 5).	"mice	35	39	Organism"	"[{""token"": ""mice"", ""start_span"": 35, ""end_span"": 39, ""type"": ""Organism""}]"
Morphometric analysis of cochlear tissue masses in Slc26a4 + / + and Slc26a4 - / - mice.	"mice	83	87	Organism"	"[{""token"": ""mice"", ""start_span"": 83, ""end_span"": 87, ""type"": ""Organism""}]"
Data from 7 - 8 animals contributed to each column.	"animals	16	23	Organism"	"[{""token"": ""animals"", ""start_span"": 16, ""end_span"": 23, ""type"": ""Organism""}]"
Analysis of marginal and basal cell barriers by in Slc26a4 - / - mice.	"mice	65	69	Organism"	"[{""token"": ""mice"", ""start_span"": 65, ""end_span"": 69, ""type"": ""Organism""}]"
Analysis of marginal and basal cell barriers in Slc26a4 + / + and Slc26a4 - / - mice.	"mice	80	84	Organism"	"[{""token"": ""mice"", ""start_span"": 80, ""end_span"": 84, ""type"": ""Organism""}]"
Note the intact marginal cell ( b) and basal cell ( c) barriers in Slc26a4 + / + mice.	"mice	81	85	Organism"	"[{""token"": ""mice"", ""start_span"": 81, ""end_span"": 85, ""type"": ""Organism""}]"
Minimal pigmentation of Slc26a4 + / + mice did not compromise F actin localization.	"mice	38	42	Organism"	"[{""token"": ""mice"", ""start_span"": 38, ""end_span"": 42, ""type"": ""Organism""}]"
Whole - mounts of stria vascularis from Slc26a4 - / - mice were viewed either from the basal cell side ( e - f) or from the marginal cell side ( h - i).	"mice	54	58	Organism"	"[{""token"": ""mice"", ""start_span"": 54, ""end_span"": 58, ""type"": ""Organism""}]"
A discontinuity of this complex junction in Slc26a4 - / - mice would explain the absence of the endocochlear potential.	"mice	58	62	Organism"	"[{""token"": ""mice"", ""start_span"": 58, ""end_span"": 62, ""type"": ""Organism""}]"
The observation that endolymphatic and perilymphatic K + concentrations were normal in Slc26a4 - / - mice suggests that stria vascularis was able to secrete K + in spite of the apparent signs of degeneration.	"mice	101	105	Organism"	"[{""token"": ""mice"", ""start_span"": 101, ""end_span"": 105, ""type"": ""Organism""}]"
The rate of K + secretion necessary to maintain endolymphatic K + concentration, however, may be less than necessary in Slc26a4 + / + mice given the reduced numbers of sensory hair cells, which provide a major pathway for K + exit from endolymph [ 30, 31].	"mice	134	138	Organism"	"[{""token"": ""mice"", ""start_span"": 134, ""end_span"": 138, ""type"": ""Organism""}]"
KCNQ1 and KCNE1, subunits of the secretory K + channel, were co - localized in the apical membrane of strial marginal cells; the Na + / 2Cl - / K + cotransporter SLC12A2, which is located in the basolateral membrane of strial marginal cells, was found in stria vascularis; and the gap junction protein GJB2 was found in spiral ligament of Slc26a4 + / + and Slc26a4 - / - mice ( Fig. 8).	"mice	371	375	Organism"	"[{""token"": ""mice"", ""start_span"": 371, ""end_span"": 375, ""type"": ""Organism""}]"
Expression of KCNQ1 protein in stria vascularis of Slc26a4 - / - mice is consistent with the finding of KCNQ1 mRNA expression ( Fig. 3).	"mice	65	69	Organism"	"[{""token"": ""mice"", ""start_span"": 65, ""end_span"": 69, ""type"": ""Organism""}]"
Protein localization of KCNQ1, KCNE1, SLC12A2 and GJB2 in the cochlear lateral wall of Slc26a4 + / + and Slc26a4 - / - mice.	"mice	119	123	Organism"	"[{""token"": ""mice"", ""start_span"": 119, ""end_span"": 123, ""type"": ""Organism""}]"
We found that Slc26a4 - / - mice lack the endocochlear potential because they do not express KCNJ10 protein.	"mice	28	32	Organism"	"[{""token"": ""mice"", ""start_span"": 28, ""end_span"": 32, ""type"": ""Organism""}]"
Support for the hypothesis of enhanced free radical stress comes from the observed hyperpigmentation in mice lacking pendrin.	"mice	104	108	Organism"	"[{""token"": ""mice"", ""start_span"": 104, ""end_span"": 108, ""type"": ""Organism""}]"
Suppression of the KCNJ10 K + channel in strial intermediate cells, which is essential for the generation of the endocochlear potential, is probably the direct cause of deafness in Slc26a4 - / - mice and patients suffering from Pendred syndrome.	"mice	195	199	Organism"	"[{""token"": ""mice"", ""start_span"": 195, ""end_span"": 199, ""type"": ""Organism""}]"
SMW, LAE, IER and EDG provided the mice and the pendrin - specific antibody.	"mice	35	39	Organism"	"[{""token"": ""mice"", ""start_span"": 35, ""end_span"": 39, ""type"": ""Organism""}]"
We describe the engineering of a mouse capable of continuous running of up to twice the distance of a wild - type littermate.	"mouse	33	38	Organism"	"[{""token"": ""mouse"", ""start_span"": 33, ""end_span"": 38, ""type"": ""Organism""}]"
Treatment of wild - type mice with PPAR delta agonist elicits a similar type I fiber gene expression profile in muscle.	"mice	25	29	Organism"	"[{""token"": ""mice"", ""start_span"": 25, ""end_span"": 29, ""type"": ""Organism""}]"
For instance, rodents that gain the most weight on high - fat diets possess fewer type I fibers ( Abou et al. 1992).	"rodents	14	21	Organism"	"[{""token"": ""rodents"", ""start_span"": 14, ""end_span"": 21, ""type"": ""Organism""}]"
Interestingly, the level of endogenous muscle PPAR delta protein in the transgenic mice was much higher than in the control littermates.	"mice	83	87	Organism"	"[{""token"": ""mice"", ""start_span"": 83, ""end_span"": 87, ""type"": ""Organism""}]"
We found that muscles in the transgenic mice appeared redder ( Figure 2A), which is particularly evident in the mixed type I / II fibers of the hindlimb ( Figure 2B).	"mice	40	44	Organism"	"[{""token"": ""mice"", ""start_span"": 40, ""end_span"": 44, ""type"": ""Organism""}]"
Southern blot analysis detected a substantially higher copy number of the mitochondrial genome - encoded COXII DNA in the transgenic mice ( Figure 3B).	"mice	133	137	Organism"	"[{""token"": ""mice"", ""start_span"": 133, ""end_span"": 137, ""type"": ""Organism""}]"
Mitochondrial DNA was increased 2. 3 - fold in gastrocnemius muscle of the transgenic mice ( Figure 3C).	"mice	86	90	Organism"	"[{""token"": ""mice"", ""start_span"": 86, ""end_span"": 90, ""type"": ""Organism""}]"
A number of previous studies have shown that obese individuals have fewer oxidative fibers, implying that the presence of oxidative fibers alone may play a part in obesity resistance.	"individuals	51	62	Organism"	"[{""token"": ""individuals"", ""start_span"": 51, ""end_span"": 62, ""type"": ""Organism""}]"
To test this possibility, we fed the transgenic mice and their wild - type littermates with a high - fat diet for 97 d.	"mice	48	52	Organism"	"[{""token"": ""mice"", ""start_span"": 48, ""end_span"": 52, ""type"": ""Organism""}]"
The transgenic mice displayed significantly higher oxygen consumption on the high - fat diet than the control littermates ( unpublished data).	"mice	15	19	Organism"	"[{""token"": ""mice"", ""start_span"": 15, ""end_span"": 19, ""type"": ""Organism""}]"
By the end of this experiment, the control littermates became obese, whereas the transgenic mice still maintained a normal body weight and fat mass composition ( Figure 4A).	"mice	92	96	Organism"	"[{""token"": ""mice"", ""start_span"": 92, ""end_span"": 96, ""type"": ""Organism""}]"
A histological analysis of inguinal fat pad revealed a much smaller cell size in the transgenic mice ( Figure 4B), due to the increased muscle oxidative capacity.	"mice	96	100	Organism"	"[{""token"": ""mice"", ""start_span"": 96, ""end_span"": 100, ""type"": ""Organism""}]"
While there was no significant difference in intramuscular glycogen content, the triglyceride content was much less in the transgenic mice ( Figure 4C and 4D), which may explain their improved glucose tolerance ( Figure 4E).	"mice	134	138	Organism"	"[{""token"": ""mice"", ""start_span"": 134, ""end_span"": 138, ""type"": ""Organism""}]"
We also placed wild - type C57BJ6 mice on the high - fat diet and treated them with either vehicle or the PPAR delta agonist GW501516 for 2 mo.	"mice	34	38	Organism"	"[{""token"": ""mice"", ""start_span"": 34, ""end_span"": 38, ""type"": ""Organism""}]"
Mice were run on oxygen - infused, enclosed treadmills until exhaustion.	"Mice	0	4	Organism"	"[{""token"": ""Mice"", ""start_span"": 0, ""end_span"": 4, ""type"": ""Organism""}]"
Strikingly, the running time and distance the transgenic mice were able to sustain were increased by 67% and 92%, respectively ( Figure 6A; also see Videos S1 and S2).	"mice	57	61	Organism"	"[{""token"": ""mice"", ""start_span"": 57, ""end_span"": 61, ""type"": ""Organism""}]"
The transgenic mice ran about 1 h longer than the controls, which translates to nearly a kilometer further.	"mice	15	19	Organism"	"[{""token"": ""mice"", ""start_span"": 15, ""end_span"": 19, ""type"": ""Organism""}]"
No significant differences in muscle mass ( unpublished data) and daily activity ( total counts of activity per hour: 1618 +/- 209 for transgenic versus 1987 +/- 301 for wild - type, p > 0. 35, n = 4) were observed between the transgenic and control mice.	"mice	250	254	Organism"	"[{""token"": ""mice"", ""start_span"": 250, ""end_span"": 254, ""type"": ""Organism""}]"
In the treadmill test, the PPAR delta - null mice could sustain only 38% of the running time and 34% of the distance of their age - and weight - matched wild - type counterparts ( Figure 6B).	"mice	45	49	Organism"	"[{""token"": ""mice"", ""start_span"": 45, ""end_span"": 49, ""type"": ""Organism""}]"
"Our data reveal that a PPAR delta - mediated transcriptional pathway can regulate muscle fiber specification, enabling the generation of a strain of mice with a "" long - distance running "" phenotype."	"mice	149	153	Organism"	"[{""token"": ""mice"", ""start_span"": 149, ""end_span"": 153, ""type"": ""Organism""}]"
The muscle phenotypes described here are remarkably similar to those of transgenic mice expressing either calcineurin, calmodulin - dependent kinase, or PGC - 1 alpha ( Naya et al. 2000; Lin et al. 2002; Wu et al. 2002), indicating that PPAR delta could be one of the hypothetical downstream transcription factors of these pathways.	"mice	83	87	Organism"	"[{""token"": ""mice"", ""start_span"": 83, ""end_span"": 87, ""type"": ""Organism""}]"
We show that mice with increased oxidative fibers are resistant to high - fat - induced obesity and glucose intolerance.	"mice	13	17	Organism"	"[{""token"": ""mice"", ""start_span"": 13, ""end_span"": 17, ""type"": ""Organism""}]"
Animals.	"Animals	0	7	Organism"	"[{""token"": ""Animals"", ""start_span"": 0, ""end_span"": 7, ""type"": ""Organism""}]"
The transactivation domain ( 78 amino acid residues, corresponding to residues 413 - 490) of VP16 was fused in frame with the N - terminus of mouse PPAR delta.	"mouse	142	147	Organism"	"[{""token"": ""mouse"", ""start_span"": 142, ""end_span"": 147, ""type"": ""Organism""}]"
Transgenic mice were backcrossed with C57BL / 6J for two generations.	"mice	11	15	Organism"	"[{""token"": ""mice"", ""start_span"": 11, ""end_span"": 15, ""type"": ""Organism""}]"
On normal chow diet, the transgenic mice and control littermates used here had similar body weights.	"mice	36	40	Organism"	"[{""token"": ""mice"", ""start_span"": 36, ""end_span"": 40, ""type"": ""Organism""}]"
PPAR delta - null mice were previously generated ( Barak et al. 2002).	"mice	18	22	Organism"	"[{""token"": ""mice"", ""start_span"": 18, ""end_span"": 22, ""type"": ""Organism""}]"
Mice were fed either a standard chow with 4% ( w / w) fat content ( Harlan Teklad, Harlan, Indianapolis, Indiana, United States) or a high - fat diet containing 35% ( w / w) fat content ( product F3282, Bioserv, Frenchtown, New Jersey, United States) as indicated.	"Mice	0	4	Organism"	"[{""token"": ""Mice"", ""start_span"": 0, ""end_span"": 4, ""type"": ""Organism""}]"
For ligand experiments, we synthesized the GW501516 compound and mice were orally gavaged daily ( 10 mg / kg or vehicle alone).	"mice	65	69	Organism"	"[{""token"": ""mice"", ""start_span"": 65, ""end_span"": 69, ""type"": ""Organism""}]"
Mouse EST clones were obtained from ATCC ( Manassas, Virginia, United States), verified by sequencing, and used as Northern probes.	"Mouse	0	5	Organism"	"[{""token"": ""Mouse"", ""start_span"": 0, ""end_span"": 5, ""type"": ""Organism""}]"
Prior to the exercise performance test, the mice were accustomed to the treadmill ( Columbus Instruments, Columbus, Ohio, United States) with a 5 - min run at 7 m / min once per day for 2 d.	"mice	44	48	Organism"	"[{""token"": ""mice"", ""start_span"": 44, ""end_span"": 48, ""type"": ""Organism""}]"
Exhaustion was defined when mice were unable to avoid repetitive electrical shocks.	"mice	28	32	Organism"	"[{""token"": ""mice"", ""start_span"": 28, ""end_span"": 32, ""type"": ""Organism""}]"
Number of mice for each group used in experiments is indicated in figure legends.	"mice	10	14	Organism"	"[{""token"": ""mice"", ""start_span"": 10, ""end_span"": 14, ""type"": ""Organism""}]"
This video shows the exercise performance of a representative of the transgenic mice ( right chamber) and a representative of wild - type control littermates ( left chamber) on the treadmill 15 min into the exercise challenge.	"mice	80	84	Organism"	"[{""token"": ""mice"", ""start_span"": 80, ""end_span"": 84, ""type"": ""Organism""}]"
This video shows the exercise performance of a representative of the transgenic mice ( right chamber) and a representative of wild - type control littermates ( left chamber) on the treadmill 90 min into the exercise challenge.	"mice	80	84	Organism"	"[{""token"": ""mice"", ""start_span"": 80, ""end_span"": 84, ""type"": ""Organism""}]"
( A) Pooled RNA isolated from various muscles of five wild - type male C57B6 mice was hybridized with indicated probes.	"mice	77	81	Organism"	"[{""token"": ""mice"", ""start_span"": 77, ""end_span"": 81, ""type"": ""Organism""}]"
( D) Nuclear proteins ( 15 mu g / lane) isolated from gastrocnemius muscle of the transgenic mice ( TG) and the wild - type littermates ( WT) were probed with indicated antibodies.	"mice	93	97	Organism"	"[{""token"": ""mice"", ""start_span"": 93, ""end_span"": 97, ""type"": ""Organism""}]"
Increased Oxidative Type I Fibers in the Transgenic Mice	"Mice	52	56	Organism"	"[{""token"": ""Mice"", ""start_span"": 52, ""end_span"": 56, ""type"": ""Organism""}]"
( C) Equal amounts of gastrocnemius muscle were collected from both transgenic mice and control littermates.	"mice	79	83	Organism"	"[{""token"": ""mice"", ""start_span"": 79, ""end_span"": 83, ""type"": ""Organism""}]"
The relative abundance of mitochondrial DNA in transgenic and wild - type mice is presented.	"mice	74	78	Organism"	"[{""token"": ""mice"", ""start_span"": 74, ""end_span"": 78, ""type"": ""Organism""}]"
( E) Wild - type C57B6 mice were treated with vehicle or PPAR delta agonist GW501516 for 10 d.	"mice	23	27	Organism"	"[{""token"": ""mice"", ""start_span"": 23, ""end_span"": 27, ""type"": ""Organism""}]"
Resistance to High - Fat - Induced Obesity in the Transgenic Mice	"Mice	61	65	Organism"	"[{""token"": ""Mice"", ""start_span"": 61, ""end_span"": 65, ""type"": ""Organism""}]"
Left panel shows net body weight gain, which was calculated for individual mice and then averaged.	"mice	75	79	Organism"	"[{""token"": ""mice"", ""start_span"": 75, ""end_span"": 79, ""type"": ""Organism""}]"
( C and D) Intramuscular glycogen content ( C) and triglyceride content ( D) of mice in ( A) after high - fat feeding ( n = 6).	"mice	80	84	Organism"	"[{""token"": ""mice"", ""start_span"": 80, ""end_span"": 84, ""type"": ""Organism""}]"
Mice in ( A) after high - fat feeding were fasted for 6 h and then injected with glucose at a concentration of 1g / kg body weight.	"Mice	0	4	Organism"	"[{""token"": ""Mice"", ""start_span"": 0, ""end_span"": 4, ""type"": ""Organism""}]"
( A) Eleven - week - old wild - type C57B6 mice were fed a high - fat diet in combination with vehicle or GW501516 for 57 d.	"mice	43	47	Organism"	"[{""token"": ""mice"", ""start_span"": 43, ""end_span"": 47, ""type"": ""Organism""}]"
( C) Various tissue weights for mice in ( A) after treatment. ifat, inguinal fat; rdfat, reproductive fat; retrofat, retroperitoneal fat.	"mice	32	36	Organism"	"[{""token"": ""mice"", ""start_span"": 32, ""end_span"": 36, ""type"": ""Organism""}]"
Mice in ( A) after treatment were fasted for 6 h and then injected with glucose at a concentration of 1g / kg body weight.	"Mice	0	4	Organism"	"[{""token"": ""Mice"", ""start_span"": 0, ""end_span"": 4, ""type"": ""Organism""}]"
( A) Enhanced exercise performance in the transgenic mice.	"mice	53	57	Organism"	"[{""token"": ""mice"", ""start_span"": 53, ""end_span"": 57, ""type"": ""Organism""}]"
( B) Compromised exercise performance in PPAR delta - null mice.	"mice	59	63	Organism"	"[{""token"": ""mice"", ""start_span"": 59, ""end_span"": 63, ""type"": ""Organism""}]"
Two - month - old male PPAR delta - null mice and wild - type controls with similar body weights ( n = 6 for each group) were subjected to a forced treadmill exercise test.	"mice	41	45	Organism"	"[{""token"": ""mice"", ""start_span"": 41, ""end_span"": 45, ""type"": ""Organism""}]"
We previously generated Cln3 Delta ex7 / 8 knock - in mice, which replicate the common JNCL mutation, express mutant battenin and display JNCL - like pathology.	"mice	54	58	Organism"	"[{""token"": ""mice"", ""start_span"": 54, ""end_span"": 58, ""type"": ""Organism""}]"
To elucidate the consequences of the common JNCL mutation in neuronal cells, we used P4 knock - in mouse cerebella to establish conditionally immortalized CbCln3 wild - type, heterozygous, and homozygous neuronal precursor cell lines, which can be differentiated into MAP - 2 and NeuN - positive, neuron - like cells.	"mouse	99	104	Organism"	"[{""token"": ""mouse"", ""start_span"": 99, ""end_span"": 104, ""type"": ""Organism""}]"
Battenin function remains to be elucidated, although studies of btn1, the yeast CLN3 ortholog, have implicated battenin in lysosomal pH homeostasis and amino acid transport [ 10, 11].	"yeast	74	79	Organism"	"[{""token"": ""yeast"", ""start_span"": 74, ""end_span"": 79, ""type"": ""Organism""}]"
To explore JNCL pathogenesis and battenin function, we previously generated a genetically precise JNCL mouse model.	"mouse	103	108	Organism"	"[{""token"": ""mouse"", ""start_span"": 103, ""end_span"": 108, ""type"": ""Organism""}]"
Cln3 Delta ex7 / 8 knock - in mice harbor the ~ 1 kb common JNCL mutation and express a non - truncated mutant battenin isoform that is detectable with antibodies recognizing C - terminal epitopes.	"mice	30	34	Organism"	"[{""token"": ""mice"", ""start_span"": 30, ""end_span"": 34, ""type"": ""Organism""}]"
Homozygous Cln3 Delta ex7 / 8 knock - in mice exhibit a progressive JNCL - like disease, with perinatal onset of subunit c deposition in many cell types and later onset of neuronal dysfunction and behavioral deficits [ 12].	"mice	41	45	Organism"	"[{""token"": ""mice"", ""start_span"": 41, ""end_span"": 45, ""type"": ""Organism""}]"
Therefore, we have established cerebellar neuronal precursor cell lines from Cln3 Delta ex7 / 8 knock - in mice.	"mice	107	111	Organism"	"[{""token"": ""mice"", ""start_span"": 107, ""end_span"": 111, ""type"": ""Organism""}]"
To generate a precise genetic, neuron - derived JNCL cell culture system, we immortalized granule neurons cultured from postnatal day 4 ( P4) cerebella of homozygous and heterozygous Cln3 Delta ex7 / 8 knock - in mice, and wild - type littermates.	"mice	213	217	Organism"	"[{""token"": ""mice"", ""start_span"": 213, ""end_span"": 217, ""type"": ""Organism""}]"
As expected, SV40 large T antigen expression was rapidly lost and cell division ceased when cells were shifted to the non - permissive temperature ( 39 degrees C) ( data not shown).	"SV40	13	17	Organism"	"[{""token"": ""SV40"", ""start_span"": 13, ""end_span"": 17, ""type"": ""Organism""}]"
Homozygous Cln3 Delta ex7 / 8 knock - in mice express multiple Cln3 mRNA splice variants and mutant battenin protein that is detectable by batp1 antibody recognizing C - terminal epitopes [ 12].	"mice	41	45	Organism"	"[{""token"": ""mice"", ""start_span"": 41, ""end_span"": 45, ""type"": ""Organism""}]"
Homozygous CbCln3 Delta ex7 / 8 cells and Cln3 Delta ex7 / 8 knock - in mice process cathepsin D abnormally	"mice	72	76	Organism"	"[{""token"": ""mice"", ""start_span"": 72, ""end_span"": 76, ""type"": ""Organism""}]"
We first tested cathepsin D transport and processing in homozygous CbCln3 Delta ex7 / 8 cells and Cln3 Delta ex7 / 8 mice using anti - cathepsin D antibody that recognizes unprocessed and processed cathepsin D isoforms.	"mice	117	121	Organism"	"[{""token"": ""mice"", ""start_span"": 117, ""end_span"": 121, ""type"": ""Organism""}]"
Heterozygous Cln3 Delta ex7 / 8 mice and CbCln3 Delta ex7 / 8 cells were indistinguishable from wild - type, as expected for a recessive disease phenotype ( data not shown).	"mice	32	36	Organism"	"[{""token"": ""mice"", ""start_span"": 32, ""end_span"": 36, ""type"": ""Organism""}]"
