This time we investigated sections from human parietal cortex of autopsy brain.	"human	40	45	Organism"	"[{""token"": ""human"", ""start_span"": 40, ""end_span"": 45, ""type"": ""Organism""}]"
We therefore favor the hypothesis that Annexin A7 in the sensitive neurons of the human autopsy brain may have similarly translocated to the cellular membrane.	"human	82	87	Organism"	"[{""token"": ""human"", ""start_span"": 82, ""end_span"": 87, ""type"": ""Organism""}]"
Although the inactivation of the annexin A7 gene did not interfere with the viability and development of knock out mice [ 10], their generation allowed us to address the role of Annexin A7 in specific cell types [ 8, 9].	"mice	115	119	Organism"	"[{""token"": ""mice"", ""start_span"": 115, ""end_span"": 119, ""type"": ""Organism""}]"
Indeed, when we analyzed primary astrocytes from an AnxA7 - / - mouse for Ca2 + - dependent signaling processes, we found that they exhibited a significantly increased velocity of mechanically induced astrocytic Ca2 + - waves as compared to wild type [ 9].	"mouse	64	69	Organism"	"[{""token"": ""mouse"", ""start_span"": 64, ""end_span"": 69, ""type"": ""Organism""}]"
The developing gray matter of the rat embryonic spinal cord exhibited primarily nuclear localization of Annexin A11, while immunoreactivity was lost from the nuclei in the adult spinal cord [ 26].	"rat	34	37	Organism"	"[{""token"": ""rat"", ""start_span"": 34, ""end_span"": 37, ""type"": ""Organism""}]"
Studies with human foreskin fibroblasts demonstrated that Annexin A1, A4 and A5 are all present in the nucleus at higher concentration than in the cytosol [ 31].	"human	13	18	Organism"	"[{""token"": ""human"", ""start_span"": 13, ""end_span"": 18, ""type"": ""Organism""}]"
In this article we report the translocation of Annexin A7 to nuclei of differentiating cells in the developing murine brain.	"murine	111	117	Organism"	"[{""token"": ""murine"", ""start_span"": 111, ""end_span"": 117, ""type"": ""Organism""}]"
Animals and tissue preparation	"Animals	0	7	Organism"	"[{""token"": ""Animals"", ""start_span"": 0, ""end_span"": 7, ""type"": ""Organism""}]"
129SV strain mice were used.	"mice	13	17	Organism"	"[{""token"": ""mice"", ""start_span"": 13, ""end_span"": 17, ""type"": ""Organism""}]"
Experiments were performed with four to six animals at each developmental stage.	"animals	44	51	Organism"	"[{""token"": ""animals"", ""start_span"": 44, ""end_span"": 51, ""type"": ""Organism""}]"
The mature brain used was derived from mice of three to four month of age.	"mice	39	43	Organism"	"[{""token"": ""mice"", ""start_span"": 39, ""end_span"": 43, ""type"": ""Organism""}]"
Human brain tissue	"Human	0	5	Organism"	"[{""token"": ""Human"", ""start_span"": 0, ""end_span"": 5, ""type"": ""Organism""}]"
Five human autopsy brains of male and female patients without any neuropathological changes ( age 61 - 77 years; post mortem interval: 12 - 72 h) were fixed in an aqueous solution of formaldehyde for three weeks.	"human	5	10	Organism"	"[{""token"": ""human"", ""start_span"": 5, ""end_span"": 10, ""type"": ""Organism""}]"
For control, sections were incubated only with the secondary antibody or sections obtained from an annexin A7 knockout mouse were used [ 10].	"mouse	119	124	Organism"	"[{""token"": ""mouse"", ""start_span"": 119, ""end_span"": 124, ""type"": ""Organism""}]"
Immunofluorescence microscopy of human brain	"human	33	38	Organism"	"[{""token"": ""human"", ""start_span"": 33, ""end_span"": 38, ""type"": ""Organism""}]"
The paraffin - embedded human brain sections were deparaffinzed likewise.	"human	24	29	Organism"	"[{""token"": ""human"", ""start_span"": 24, ""end_span"": 29, ""type"": ""Organism""}]"
Carbocyanine 2 and 3 labeled anti - mouse IgG secondary antibodies ( Dianova, Hamburg, Germany) were used to detect the primary antibody and showed similar staining patterns.	"mouse	36	41	Organism"	"[{""token"": ""mouse"", ""start_span"": 36, ""end_span"": 41, ""type"": ""Organism""}]"
The presence of Annexin A7 mRNA in mouse ES cells and embryos E7, E11, E15 and E17 was analyzed by northern blot analysis.	"mouse	35	40	Organism"	"[{""token"": ""mouse"", ""start_span"": 35, ""end_span"": 40, ""type"": ""Organism""}]"
It contained approximately 2 mu g of poly ( A) + RNA per lane from four different stages of mouse development.	"mouse	92	97	Organism"	"[{""token"": ""mouse"", ""start_span"": 92, ""end_span"": 97, ""type"": ""Organism""}]"
CH provided polyclonal anti - Annexin A7 antibodies and brain sections of the AnxA7 knock out mouse, and contributed to the analysis of data.	"mouse	94	99	Organism"	"[{""token"": ""mouse"", ""start_span"": 94, ""end_span"": 99, ""type"": ""Organism""}]"
DT provided the sections the human autopsy brain, analyzed them by immunofluorescence, and contributed to the analysis of data.	"human	29	34	Organism"	"[{""token"": ""human"", ""start_span"": 29, ""end_span"": 34, ""type"": ""Organism""}]"
We provide genetic evidence in the mouse that precocious ETS expression in DRG sensory neurons perturbs axonal projections, the acquisition of terminal differentiation markers, and their dependence on neurotrophic support.	"mouse	35	40	Organism"	"[{""token"": ""mouse"", ""start_span"": 35, ""end_span"": 40, ""type"": ""Organism""}]"
In particular, genetic experiments have addressed the survival - independent role of neurotrophic factors during development by exploiting strains of mice defective both in neurotrophin signaling and in the function of the proapoptotic gene Bax [ 8, 9].	"mice	150	154	Organism"	"[{""token"": ""mice"", ""start_span"": 150, ""end_span"": 154, ""type"": ""Organism""}]"
In Drosophila, retrograde BMP signals from the target region control the terminal differentiation of a subpopulation of peptidergic neurons expressing Apterous and Squeeze [ 11, 12].	"Drosophila	3	13	Organism"	"[{""token"": ""Drosophila"", ""start_span"": 3, ""end_span"": 13, ""type"": ""Organism""}]"
In vertebrates, peripheral neurotrophic signals have been shown to direct the onset of expression of the ETS transcription factors Er81 and Pea3 in DRG sensory neurons and motor neuron pools several days after these neurons have become post - mitotic [ 9, 13, 14, 15, 16].	"vertebrates	3	14	Organism"	"[{""token"": ""vertebrates"", ""start_span"": 3, ""end_span"": 14, ""type"": ""Organism""}]"
In this study, we have used mouse genetics to test this general idea, by investigating whether the precise timing of onset of ETS transcription factor signaling is essential for normal sensory neuron development.	"mouse	28	33	Organism"	"[{""token"": ""mouse"", ""start_span"": 28, ""end_span"": 33, ""type"": ""Organism""}]"
These findings prompted us to analyze mice in which we integrated EWS - Pea3, a break - point fusion product between the amino - terminal domain of the Ewing sarcoma ( EWS) gene and the Pea3 DNA binding domain [ 20, 21], into the Er81 locus ( Figure 1).	"mice	38	42	Organism"	"[{""token"": ""mice"", ""start_span"": 38, ""end_span"": 42, ""type"": ""Organism""}]"
Er81EWS - Pea3 / - mice did not differ from wild - type in the number of proprioceptive afferent cell bodies within the DRG of L1 to L5, the expression of several genes normally expressed by proprioceptive afferents, and the lack of expression of genes not normally expressed in proprioceptive afferents ( Figure S1; data not shown).	"mice	19	23	Organism"	"[{""token"": ""mice"", ""start_span"": 19, ""end_span"": 23, ""type"": ""Organism""}]"
To determine the extent of rescue of Ia proprioceptive afferent projections into the ventral spinal cord of Er81 mutant mice achieved by expression of EWS - Pea3, we traced intraspinal afferent projections by axonal labeling of PV ( Figure 2A - 2C).	"mice	120	124	Organism"	"[{""token"": ""mice"", ""start_span"": 120, ""end_span"": 124, ""type"": ""Organism""}]"
Using both assays, we found extensive rescue of the projections into the ventral horn of the spinal cord in Er81EWS - Pea3 / - mice ( Figure 2C and 2F).	"mice	127	131	Organism"	"[{""token"": ""mice"", ""start_span"": 127, ""end_span"": 131, ""type"": ""Organism""}]"
To assess whether synapses between Ia afferents and motor neurons are functional in Er81EWS - Pea3 / - mice, we performed intracellular recordings from identified quadriceps motor neurons after stimulation of nerves innervating the quadriceps muscle group.	"mice	103	107	Organism"	"[{""token"": ""mice"", ""start_span"": 103, ""end_span"": 107, ""type"": ""Organism""}]"
We found no significant difference in the input amplitude to quadriceps motor neurons when comparing wild - type to Er81EWS - Pea3 / - mice ( Figure S2; wild - type, 10. 6 +/- 0. 9 mV, n = 11; Er81EWS - Pea3 / -, 10. 9 +/- 1 mV, n = 8).	"mice	135	139	Organism"	"[{""token"": ""mice"", ""start_span"": 135, ""end_span"": 139, ""type"": ""Organism""}]"
We used a binary mouse genetic system based on Cre - recombinase - mediated excision of a transcriptional stop cassette flanked by loxP sites.	"mouse	17	22	Organism"	"[{""token"": ""mouse"", ""start_span"": 17, ""end_span"": 22, ""type"": ""Organism""}]"
Targeting cassettes were integrated into the Tau locus to generate two strains of mice conditionally expressing either EWS - Pea3 or a membrane - targeted green fluorescent protein ( mGFP) to trace axonal projections of DRG neurons ( Figure S3; [ 25]).	"mice	82	86	Organism"	"[{""token"": ""mice"", ""start_span"": 82, ""end_span"": 86, ""type"": ""Organism""}]"
To directly compare neurotrophin dependence of DRG neurons expressing EWS - Pea3 from the Tau locus at a precocious versus isochronic time of onset, we generated a strain of mice in which Cre recombinase is expressed from the PV locus ( Figure S4).	"mice	174	178	Organism"	"[{""token"": ""mice"", ""start_span"": 174, ""end_span"": 178, ""type"": ""Organism""}]"
We next cultured E14. 5 whole DRG explants from TauEWS - Pea3 / + PVCre / + and TaumGFP / + PVCre / + mice for 48 h in vitro in the presence or absence of NT - 3 ( Figure 5).	"mice	102	106	Organism"	"[{""token"": ""mice"", ""start_span"": 102, ""end_span"": 106, ""type"": ""Organism""}]"
To determine whether neuronal survival of DRG neurons from TauEWS - Pea3 / + Isl1Cre / + embryos in the absence of neurotrophic support is sufficient to explain the observed neuronal outgrowth, we analyzed DRG isolated from mice mutant in the proapoptotic gene Bax [ 27].	"mice	224	228	Organism"	"[{""token"": ""mice"", ""start_span"": 224, ""end_span"": 228, ""type"": ""Organism""}]"
Finally, to assess whether EWS - Pea3 expressed precociously acts exclusively cell - autonomously or whether it may also influence neighboring DRG neurons, we activated expression of EWS - Pea3 using Hb9Cre mice [ 33].	"mice	207	211	Organism"	"[{""token"": ""mice"", ""start_span"": 207, ""end_span"": 211, ""type"": ""Organism""}]"
Elimination of TrkA receptor signaling in Bax mutant mice perturbs establishment of peripheral projections of cutaneous afferents, whereas establishment of central projections does not appear to be affected [ 8].	"mice	53	57	Organism"	"[{""token"": ""mice"", ""start_span"": 53, ""end_span"": 57, ""type"": ""Organism""}]"
Target - derived factors have also been implicated in controlling neuronal maturation of predetermined neurons in Drosophila, in which expression of members of the BMP family in the target region is essential for the induction of mature peptidergic properties in a subpopulation of neurons marked by the coordinate expression of the two transcription factors Apterous and Squeeze [ 11, 12].	"Drosophila	114	124	Organism"	"[{""token"": ""Drosophila"", ""start_span"": 114, ""end_span"": 124, ""type"": ""Organism""}]"
During Drosophila neuroblast generation, the transcription factor Hunchback controls specification and differentiation of early - born neuroblasts [ 38].	"Drosophila	7	17	Organism"	"[{""token"": ""Drosophila"", ""start_span"": 7, ""end_span"": 17, ""type"": ""Organism""}]"
For the generation of TaumGFP and TauEWS - Pea3 mice, lox - STOP - lox - mGFP - IRES - NLS - LacZ - pA and lox - STOP - lox - EWS - Pea3 - IRES - NLS - LacZ - pA targeting cassettes were integrated into exon 2 of the Tau genomic locus ( the endogenous start ATG was removed in the targeting vectors; details available upon request).	"mice	48	52	Organism"	"[{""token"": ""mice"", ""start_span"": 48, ""end_span"": 52, ""type"": ""Organism""}]"
For details on the genomic structure of the mouse PV locus see [ 42].	"mouse	44	49	Organism"	"[{""token"": ""mouse"", ""start_span"": 44, ""end_span"": 49, ""type"": ""Organism""}]"
Recombinant clones were aggregated with morula stage embryos to generate chimeric founder mice that transmitted the mutant alleles.	"mice	90	94	Organism"	"[{""token"": ""mice"", ""start_span"": 90, ""end_span"": 94, ""type"": ""Organism""}]"
In all experiments performed in this study, animals were of mixed genetic background ( 129 / Ola and C57Bl6).	"animals	44	51	Organism"	"[{""token"": ""animals"", ""start_span"": 44, ""end_span"": 51, ""type"": ""Organism""}]"
Thy1spGFP transgenic mice were generated in analogy to De Paola et al.	"mice	21	25	Organism"	"[{""token"": ""mice"", ""start_span"": 21, ""end_span"": 25, ""type"": ""Organism""}]"
[ 25], and for these experiments a strain of mice with early embryonic expression was selected.	"mice	45	49	Organism"	"[{""token"": ""mice"", ""start_span"": 45, ""end_span"": 49, ""type"": ""Organism""}]"
After injection, animals were incubated for 2 - 3 h ( E13. 5) or overnight ( P5).	"animals	17	24	Organism"	"[{""token"": ""animals"", ""start_span"": 17, ""end_span"": 24, ""type"": ""Organism""}]"
Gene Expression Analysis in DRG Neurons of Er81EWS - Pea3 Mice	"Mice	58	62	Organism"	"[{""token"": ""Mice"", ""start_span"": 58, ""end_span"": 62, ""type"": ""Organism""}]"
( A and B) Representative traces from intracellular recordings measuring Ia afferent monosynaptic input to quadriceps motor neurons evoked by suprathreshold stimulation of the quadriceps nerve in wild - type ( A) and Er81EWS - Pea3 / - mutant ( B) animals.	"animals	248	255	Organism"	"[{""token"": ""animals"", ""start_span"": 248, ""end_span"": 255, ""type"": ""Organism""}]"
Generation of Mice Expressing EWS - Pea3 or mGFP in Early Post - Mitotic DRG Neurons	"Mice	14	18	Organism"	"[{""token"": ""Mice"", ""start_span"": 14, ""end_span"": 18, ""type"": ""Organism""}]"
Generation of PVCre Mice	"Mice	20	24	Organism"	"[{""token"": ""Mice"", ""start_span"": 20, ""end_span"": 24, ""type"": ""Organism""}]"
( C and D) Expression of GFP ( green) and LacZ ( red; C) or PV ( red; D) in P0 TaumGFP / + PVCre / + mice.	"mice	101	105	Organism"	"[{""token"": ""mice"", ""start_span"": 101, ""end_span"": 105, ""type"": ""Organism""}]"
The generation and initial characterization of Er81EWS - Pea3 / - mice was performed in the laboratory of Thomas Jessell at Columbia University, with expert assistance from Barbara Hahn and Monica Mendelsohn.	"mice	66	70	Organism"	"[{""token"": ""mice"", ""start_span"": 66, ""end_span"": 70, ""type"": ""Organism""}]"
( A) Generation of Er81EWS - Pea3 mutant mice.	"mice	41	45	Organism"	"[{""token"": ""mice"", ""start_span"": 41, ""end_span"": 45, ""type"": ""Organism""}]"
( A - F) Morphological analysis of central projections at lumbar level L3 of PV + DRG neurons ( A - C) or all DRG sensory afferents after application of fluorescently labeled dextran to individual dorsal roots ( D - F) in P0. 5 ( A - C) or P5 ( D - F) wild - type ( A and D), Er81 - / - ( B and E), and Er81EWS - Pea3 / - ( C and F) mice.	"mice	333	337	Organism"	"[{""token"": ""mice"", ""start_span"": 333, ""end_span"": 337, ""type"": ""Organism""}]"
( G - I) Analysis of vGlut1 immunocytochemistry in the ventral horn of P0. 5 wild - type ( G), Er81 - / - ( H), and Er81EWS - Pea3 / - ( I) mice.	"mice	140	144	Organism"	"[{""token"": ""mice"", ""start_span"": 140, ""end_span"": 144, ""type"": ""Organism""}]"
( J - L) Schematic summary diagrams of the morphological rescue of Ia proprioceptive afferent projections ( blue) into the ventral spinal cord observed in wild - type ( J), Er81 - / - ( K), and Er81EWS - Pea3 / - ( L) mice.	"mice	218	222	Organism"	"[{""token"": ""mice"", ""start_span"": 218, ""end_span"": 222, ""type"": ""Organism""}]"
( A - D) Expression of EWS - Pea3 from the endogenous Er81 locus can rescue anatomical defects observed in Er81 - / - mice, and no change in expression of TrkC ( green) or Calretinin ( CR; grey) is observed in proprioceptive afferents ( A, B, and D).	"mice	118	122	Organism"	"[{""token"": ""mice"", ""start_span"": 118, ""end_span"": 122, ""type"": ""Organism""}]"
Ataxia and peripheral nerve hypomyelination in ADAM22 - deficient mice	"mice	66	70	Organism"	"[{""token"": ""mice"", ""start_span"": 66, ""end_span"": 70, ""type"": ""Organism""}]"
To elucidate the physiological functions of ADAM22, we employed gene targeting to generate ADAM22 knockout mice.	"mice	107	111	Organism"	"[{""token"": ""mice"", ""start_span"": 107, ""end_span"": 111, ""type"": ""Organism""}]"
ADAM22 - deficient mice were produced in a good accordance with the Mendelian ratio and appeared normal at birth.	"mice	19	23	Organism"	"[{""token"": ""mice"", ""start_span"": 19, ""end_span"": 23, ""type"": ""Organism""}]"
Further analysis of ADAM22 will provide clues to understanding the mechanisms of human diseases such as epileptic seizures and peripheral neuropathy.	"human	81	86	Organism"	"[{""token"": ""human"", ""start_span"": 81, ""end_span"": 86, ""type"": ""Organism""}]"
Currently, more than 30 ADAMs have been identified in mammals.	"mammals	54	61	Organism"	"[{""token"": ""mammals"", ""start_span"": 54, ""end_span"": 61, ""type"": ""Organism""}]"
Studies of ADAM17 - null mice have revealed that ADAM17 is critical in embryogenesis and plays an essential role in the supply of growth factors [ 6, 8].	"mice	25	29	Organism"	"[{""token"": ""mice"", ""start_span"": 25, ""end_span"": 29, ""type"": ""Organism""}]"
It has been reported that ADAM23 protein is localised to the cell surface [ 16], interacts with alpha - v beta - 3 integrin heterodimer [ 17] and the disruption of ADAM23 gene in the mouse results in premature death associated with ataxia and tremor [ 18].	"mouse	183	188	Organism"	"[{""token"": ""mouse"", ""start_span"": 183, ""end_span"": 188, ""type"": ""Organism""}]"
Although the cause of death in this mouse is unknown, for these phenotypes, impaired cell - cell or cell - matrix interactions in the nervous system caused by loss of ADAM23 may be responsible.	"mouse	36	41	Organism"	"[{""token"": ""mouse"", ""start_span"": 36, ""end_span"": 41, ""type"": ""Organism""}]"
To determine the physiological functions of ADAM22, we generated and analysed Adam22 gene - targeted mice.	"mice	101	105	Organism"	"[{""token"": ""mice"", ""start_span"": 101, ""end_span"": 105, ""type"": ""Organism""}]"
Generation of ADAM22 - deficient mice	"mice	33	37	Organism"	"[{""token"": ""mice"", ""start_span"": 33, ""end_span"": 37, ""type"": ""Organism""}]"
Mice carrying a targeted mutation in their Adam22 gene were generated by homologous recombination ( Fig. 1A).	"Mice	0	4	Organism"	"[{""token"": ""Mice"", ""start_span"": 0, ""end_span"": 4, ""type"": ""Organism""}]"
Histopathology of ADAM22 - deficient mice	"mice	37	41	Organism"	"[{""token"": ""mice"", ""start_span"": 37, ""end_span"": 41, ""type"": ""Organism""}]"
To determine the distribution of ADAM22 transcript in the adult mouse CNS precisely, in situ hybridisation analysis was performed using 35S - labeled RNA probe.	"mouse	64	69	Organism"	"[{""token"": ""mouse"", ""start_span"": 64, ""end_span"": 69, ""type"": ""Organism""}]"
3, ADAM22 mRNA was expressed throughout the adult mouse CNS.	"mouse	50	55	Organism"	"[{""token"": ""mouse"", ""start_span"": 50, ""end_span"": 55, ""type"": ""Organism""}]"
These results suggest that the ADAM22 mRNA expression is neuronal in the mouse CNS.	"mouse	73	78	Organism"	"[{""token"": ""mouse"", ""start_span"": 73, ""end_span"": 78, ""type"": ""Organism""}]"
Despite the high level of expression of ADAM22 mRNAs in the cerebellar granule cells, granule cell layer was normally formed and Purkinje cell morphology ( calbindin - staining) of the mutant mouse looked intact ( Figs. 4A - D).	"mouse	192	197	Organism"	"[{""token"": ""mouse"", ""start_span"": 192, ""end_span"": 197, ""type"": ""Organism""}]"
These results suggest that neuronal cell migration was not impaired in the mutant mouse.	"mouse	82	87	Organism"	"[{""token"": ""mouse"", ""start_span"": 82, ""end_span"": 87, ""type"": ""Organism""}]"
In summary, we could not find any signs of abnormalities in the mutant mouse brain by the light microscopic examination.	"mouse	71	76	Organism"	"[{""token"": ""mouse"", ""start_span"": 71, ""end_span"": 76, ""type"": ""Organism""}]"
Because no lesions were observed in the spinal cord ( Fig. 5F), it was suggested that Schwann cell specific myelination defect occurred in the homozygous mice.	"mice	154	158	Organism"	"[{""token"": ""mice"", ""start_span"": 154, ""end_span"": 158, ""type"": ""Organism""}]"
In contrast, heterozygous mice showed complete myelination ( Fig. 6A).	"mice	26	30	Organism"	"[{""token"": ""mice"", ""start_span"": 26, ""end_span"": 30, ""type"": ""Organism""}]"
These results suggest that proliferation of the Schwann cells was not impaired but differentiation is severely delayed in the ADAM22 - deficient mice.	"mice	145	149	Organism"	"[{""token"": ""mice"", ""start_span"": 145, ""end_span"": 149, ""type"": ""Organism""}]"
In the case of human ADAM22, isolation of five splicing variants and existence of two terminating exons have been reported [ 13, 20, 21].	"human	15	20	Organism"	"[{""token"": ""human"", ""start_span"": 15, ""end_span"": 20, ""type"": ""Organism""}]"
However, the latter terminating exon ( exon 31) of the mouse species has not been identified yet.	"mouse	55	60	Organism"	"[{""token"": ""mouse"", ""start_span"": 55, ""end_span"": 60, ""type"": ""Organism""}]"
In this contig sequence, we found putative exons 30 and 31, those sequences were quite similar to human ADAM22 isoform 1 ( GenBank # NM _ 021723).	"human	98	103	Organism"	"[{""token"": ""human"", ""start_span"": 98, ""end_span"": 103, ""type"": ""Organism""}]"
To confirm existence of transcripts, we designed primers on the putative exon 31 and performed RT - PCR using mouse cerebellum mRNA as a template.	"mouse	110	115	Organism"	"[{""token"": ""mouse"", ""start_span"": 110, ""end_span"": 115, ""type"": ""Organism""}]"
Next, we performed RT - PCR analysis of mRNAs purified from several adult mouse tissues, such as the spinal cord, dorsal root ganglion ( DRG), sciatic nerve and cultured primary Schwann cells.	"mouse	74	79	Organism"	"[{""token"": ""mouse"", ""start_span"": 74, ""end_span"": 79, ""type"": ""Organism""}]"
In the present study, we examined the function of ADAM22 by generating mice that lacked the Adam22 gene.	"mice	71	75	Organism"	"[{""token"": ""mice"", ""start_span"": 71, ""end_span"": 75, ""type"": ""Organism""}]"
ADAM22 - deficient mice exhibited severe ataxia and premature death.	"mice	19	23	Organism"	"[{""token"": ""mice"", ""start_span"": 19, ""end_span"": 23, ""type"": ""Organism""}]"
This is because convulsive seizures were occasionally observed in homozygotes, after which the suffered mice appeared exhausted and, in most cases, died on the next day.	"mice	104	108	Organism"	"[{""token"": ""mice"", ""start_span"": 104, ""end_span"": 108, ""type"": ""Organism""}]"
For example, mice lacking the neuron - specific activator of cyclin 5, p35, exhibit seizures and a severe neuronal migration defect [ 23].	"mice	13	17	Organism"	"[{""token"": ""mice"", ""start_span"": 13, ""end_span"": 17, ""type"": ""Organism""}]"
However, no marked abnormalities were observed in the mutant mouse brain, ruling out a critical role for ADAM22 in neuronal migration.	"mouse	61	66	Organism"	"[{""token"": ""mouse"", ""start_span"": 61, ""end_span"": 66, ""type"": ""Organism""}]"
For example, the myelin - deficient ( MD) rat, which carries a point mutation in the proteolipid protein ( PLP) gene, exhibits ataxia, tremor, dysmyelination and dies at approximately postnatal day 21.	"rat	42	45	Organism"	"[{""token"": ""rat"", ""start_span"": 42, ""end_span"": 45, ""type"": ""Organism""}]"
In MD rat, early death is caused by the dysfunction of the brain stem which is essential for autonomic control of respiration during hypoxia [ 24].	"rat	6	9	Organism"	"[{""token"": ""rat"", ""start_span"": 6, ""end_span"": 9, ""type"": ""Organism""}]"
Further study is needed to verify the cause of death in ADAM22 - deficient mice.	"mice	75	79	Organism"	"[{""token"": ""mice"", ""start_span"": 75, ""end_span"": 79, ""type"": ""Organism""}]"
Another interesting phenotype observed in ADAM22 - deficient mice was hypomyelinogenesis.	"mice	61	65	Organism"	"[{""token"": ""mice"", ""start_span"": 61, ""end_span"": 65, ""type"": ""Organism""}]"
It was therefore evident that hypomyelinogenesis occurred specifically in the peripheral nerves in the knockout mice, suggesting Schwann cell dysfunction.	"mice	112	116	Organism"	"[{""token"": ""mice"", ""start_span"": 112, ""end_span"": 116, ""type"": ""Organism""}]"
Investigations on why hypomyelinogenesis occurred in ADAM22 - deficient mice centre on integrin.	"mice	72	76	Organism"	"[{""token"": ""mice"", ""start_span"": 72, ""end_span"": 76, ""type"": ""Organism""}]"
In contrast, the phenotype seen in the ADAM22 - deficient mice was quite different: for example, unsorted bundles of axons were not seen in nerves and roots.	"mice	58	62	Organism"	"[{""token"": ""mice"", ""start_span"": 58, ""end_span"": 62, ""type"": ""Organism""}]"
In summary, we generated ADAM22 - deficient mice and proved that ADAM22 plays an essential role in both the CNS and the PNS.	"mice	44	48	Organism"	"[{""token"": ""mice"", ""start_span"": 44, ""end_span"": 48, ""type"": ""Organism""}]"
