Firstly, it was determined that m - calpain plays an indispensable role in murine embryogenesis, possibly related to pre - implantation development.	"murine	75	81	Organism"	"[{""token"": ""murine"", ""start_span"": 75, ""end_span"": 81, ""type"": ""Organism""}]"
The functions of m - calpain during post - implantation embryogenesis and in adult mice remain to be elucidated and will have to be addressed using a conditional gene targeting strategy.	"mice	83	87	Organism"	"[{""token"": ""mice"", ""start_span"": 83, ""end_span"": 87, ""type"": ""Organism""}]"
Cloning and sequencing of the mouse Capn2 locus	"mouse	30	35	Organism"	"[{""token"": ""mouse"", ""start_span"": 30, ""end_span"": 35, ""type"": ""Organism""}]"
The mouse Capn2 gene encodes the 700 amino acids of the m - calpain large subunit ( m - 80 k) and consists of 21 exons extending over 50 - kb on chromosome 1.	"mouse	4	9	Organism"	"[{""token"": ""mouse"", ""start_span"": 4, ""end_span"": 9, ""type"": ""Organism""}]"
A cDNA clone encoding a portion of the mouse m - 80 k subunit was purchased ( dbEST Id, 807416, Image: 606689, Image Consortium, LLNL).	"mouse	39	44	Organism"	"[{""token"": ""mouse"", ""start_span"": 39, ""end_span"": 44, ""type"": ""Organism""}]"
A fragment of this cDNA was subcloned and used to screen a 129Sv mouse genomic library in lambda - Dash II.	"mouse	65	70	Organism"	"[{""token"": ""mouse"", ""start_span"": 65, ""end_span"": 70, ""type"": ""Organism""}]"
Targeting strategy for disruption of the murine Capn2 gene.	"murine	41	47	Organism"	"[{""token"": ""murine"", ""start_span"": 41, ""end_span"": 47, ""type"": ""Organism""}]"
The murine Capn2 gene, encoding the m - 80 k subunit, was disrupted in ES cells by homologous recombination.	"murine	4	10	Organism"	"[{""token"": ""murine"", ""start_span"": 4, ""end_span"": 10, ""type"": ""Organism""}]"
Fetal bovine serum from HyClone Laboratories Inc ( Logan, Utah) was tested for its ability to support ES cell growth.	"bovine	6	12	Organism"	"[{""token"": ""bovine"", ""start_span"": 6, ""end_span"": 12, ""type"": ""Organism""}]"
Generation of targeted mice	"mice	23	27	Organism"	"[{""token"": ""mice"", ""start_span"": 23, ""end_span"": 27, ""type"": ""Organism""}]"
Chimeric animals were identifiable at birth by black eye pigmentation and subsequently by patches of agouti coat colour.	"animals	9	16	Organism"	"[{""token"": ""animals"", ""start_span"": 9, ""end_span"": 16, ""type"": ""Organism""}]"
MEF: Mouse embryonic fibroblast	"Mouse	5	10	Organism"	"[{""token"": ""Mouse"", ""start_span"": 5, ""end_span"": 10, ""type"": ""Organism""}]"
KW performed aggregation chimeras to establish germline chimeric animals.	"animals	65	72	Organism"	"[{""token"": ""animals"", ""start_span"": 65, ""end_span"": 72, ""type"": ""Organism""}]"
TDV established and maintained the knockout mouse colony and performed genotyping analysis.	"mouse	44	49	Organism"	"[{""token"": ""mouse"", ""start_span"": 44, ""end_span"": 49, ""type"": ""Organism""}]"
Genomic DNA was extracted from mouse tail biopsies taken from three - week old weanlings and genotyped by Southern blotting as described in Figure 1.	"mouse	31	36	Organism"	"[{""token"": ""mouse"", ""start_span"": 31, ""end_span"": 36, ""type"": ""Organism""}]"
A 3. 5 - kb BamHI fragment from the wild - type allele was detected in all animals while a 5. 3 - kb BamHI fragment from the mutant allele was observed in a subset of progeny.	"animals	75	82	Organism"	"[{""token"": ""animals"", ""start_span"": 75, ""end_span"": 82, ""type"": ""Organism""}]"
We would like to thank Andras Nagy for providing the R1 ES cell line, Janet Rossant for the 129SvJ mouse genomic DNA library, and Ralph Zirngibl for modification of the pPNT vector.	"mouse	99	104	Organism"	"[{""token"": ""mouse"", ""start_span"": 99, ""end_span"": 104, ""type"": ""Organism""}]"
Deficits in spatial learning and motor coordination in ADAM11 - deficient mice	"mice	74	78	Organism"	"[{""token"": ""mice"", ""start_span"": 74, ""end_span"": 78, ""type"": ""Organism""}]"
To elucidate the physiological functions of ADAM11, we generated ADAM11 - deficient mice by means of gene targeting.	"mice	84	88	Organism"	"[{""token"": ""mice"", ""start_span"": 84, ""end_span"": 88, ""type"": ""Organism""}]"
ADAM11 - deficient mice were apparently normal, and survived more than one year with no major histological abnormalities in the brain or spinal cord.	"mice	19	23	Organism"	"[{""token"": ""mice"", ""start_span"": 19, ""end_span"": 23, ""type"": ""Organism""}]"
Because ADAM11 is highly expressed in the hippocampus and cerebellum, we have examined ADAM11 mutant mice for learning using visual and hidden water maze tasks, and their motor coordination using a rotating rod task.	"mice	101	105	Organism"	"[{""token"": ""mice"", ""start_span"": 101, ""end_span"": 105, ""type"": ""Organism""}]"
Our results showed that their visual water maze task results are normal, but the hidden water maze and rotating rod task skills are impaired in ADAM11 - deficient mice.	"mice	163	167	Organism"	"[{""token"": ""mice"", ""start_span"": 163, ""end_span"": 167, ""type"": ""Organism""}]"
Recent gene - disruption studies in mice have disclosed a physiological role of each ADAM.	"mice	36	40	Organism"	"[{""token"": ""mice"", ""start_span"": 36, ""end_span"": 40, ""type"": ""Organism""}]"
However, the physiological roles of mammalian non - protease - ADAMs are poorly understood in vivo.	"mammalian	36	45	Organism"	"[{""token"": ""mammalian"", ""start_span"": 36, ""end_span"": 45, ""type"": ""Organism""}]"
Genetic deletion studies in mice have shown that both Adam2 - null and Adam3 - null male mutants are infertile and their spermatozoa lack egg - binding abilities [ 14 - 16].	"mice	28	32	Organism"	"[{""token"": ""mice"", ""start_span"": 28, ""end_span"": 32, ""type"": ""Organism""}]"
We have reported severe ataxia, seizures, and death before weaning, accompanied with hypomyelination of the peripheral nervous system in Adam22 - null mutant mice [ 22].	"mice	158	162	Organism"	"[{""token"": ""mice"", ""start_span"": 158, ""end_span"": 162, ""type"": ""Organism""}]"
It has been reported that the disruption of Adam23 gene in the mouse results in premature death associated with ataxia and tremor [ 23].	"mouse	63	68	Organism"	"[{""token"": ""mouse"", ""start_span"": 63, ""end_span"": 68, ""type"": ""Organism""}]"
Is spite of such extreme phenotypes, no histological defects in the brain has been observed in either Adam22 - null nor Adam23 - null mice.	"mice	134	138	Organism"	"[{""token"": ""mice"", ""start_span"": 134, ""end_span"": 138, ""type"": ""Organism""}]"
ADAM11 is the closest paralog of ADAM22 and ADAM23, and its orthologs have been found in vertebrates, but not in invertebrates.	"vertebrates	89	100	Organism"	"[{""token"": ""vertebrates"", ""start_span"": 89, ""end_span"": 100, ""type"": ""Organism""}]"
To determine the physiological functions of ADAM11, we generated and analysed Adam11 gene - targeted mice.	"mice	101	105	Organism"	"[{""token"": ""mice"", ""start_span"": 101, ""end_span"": 105, ""type"": ""Organism""}]"
Generation of ADAM11 - deficient mice	"mice	33	37	Organism"	"[{""token"": ""mice"", ""start_span"": 33, ""end_span"": 37, ""type"": ""Organism""}]"
Mice carrying a targeted mutation in their Adam11 gene were generated by homologous recombination ( Fig. 1A).	"Mice	0	4	Organism"	"[{""token"": ""Mice"", ""start_span"": 0, ""end_span"": 4, ""type"": ""Organism""}]"
ADAM11 - deficient mice are viable and appear normal	"mice	19	23	Organism"	"[{""token"": ""mice"", ""start_span"": 19, ""end_span"": 23, ""type"": ""Organism""}]"
Mating of mice heterozygous for the ADAM11 mutation yielded a near - Mendelian distribution of genotypes in the offspring and the ratio of females and males was the same in all groups ( data not shown).	"mice	10	14	Organism"	"[{""token"": ""mice"", ""start_span"": 10, ""end_span"": 14, ""type"": ""Organism""}]"
For the present experiments, ADAM11 - deficient male mice ( backcrossed generations into C57BL / 6NCrj, n = 14) were used in all behavioural analyses and anatomical - histological studies.	"mice	53	57	Organism"	"[{""token"": ""mice"", ""start_span"": 53, ""end_span"": 57, ""type"": ""Organism""}]"
Homozygous ADAM11 - deficient mice were viable and appeared normal, indicating that the Adam11 gene is not essential to development and survival.	"mice	30	34	Organism"	"[{""token"": ""mice"", ""start_span"": 30, ""end_span"": 34, ""type"": ""Organism""}]"
Spatial learning in ADAM11 - deficient mice	"mice	39	43	Organism"	"[{""token"": ""mice"", ""start_span"": 39, ""end_span"": 43, ""type"": ""Organism""}]"
To study the functions of ADAM11 in the hippocampus, we examined the spatial learning ability of ADAM11 - deficient mice using the Morris Water Maze task [ 27].	"mice	116	120	Organism"	"[{""token"": ""mice"", ""start_span"": 116, ""end_span"": 120, ""type"": ""Organism""}]"
Nonetheless, the ability of ( + / +), ( + / -) and ( - / -) mice to find the hidden platform improved over test sessions ( Fig. 2A).	"mice	60	64	Organism"	"[{""token"": ""mice"", ""start_span"": 60, ""end_span"": 64, ""type"": ""Organism""}]"
We further performed a probe test, in which the platform was removed from the pool after completion of the hidden platform task, and the trained mice were allowed to swim freely for 60 sec.	"mice	145	149	Organism"	"[{""token"": ""mice"", ""start_span"": 145, ""end_span"": 149, ""type"": ""Organism""}]"
The time spent in the target quadrant of ( - / -) is significantly lower than that of ( + / +) mice ( Fig. 2B).	"mice	95	99	Organism"	"[{""token"": ""mice"", ""start_span"": 95, ""end_span"": 99, ""type"": ""Organism""}]"
These results indicate a spatial learning impairment in ( - / -) mice.	"mice	65	69	Organism"	"[{""token"": ""mice"", ""start_span"": 65, ""end_span"": 69, ""type"": ""Organism""}]"
The swimming distance of ( + / +), ( + / -) and ( - / -) mice, however, was similar during the probe trial ( Fig. 2C).	"mice	57	61	Organism"	"[{""token"": ""mice"", ""start_span"": 57, ""end_span"": 61, ""type"": ""Organism""}]"
These results also indicated that ( - / -) mice have normal visible and motor function and the motivation needed in the water maze task.	"mice	43	47	Organism"	"[{""token"": ""mice"", ""start_span"": 43, ""end_span"": 47, ""type"": ""Organism""}]"
Motor function of ADAM11 - deficient mice	"mice	37	41	Organism"	"[{""token"": ""mice"", ""start_span"": 37, ""end_span"": 41, ""type"": ""Organism""}]"
To study the functions of ADAM11 in the cerebellum, we examined the motor function of ADAM11 - deficient mice using a rotating rod task [ 28].	"mice	105	109	Organism"	"[{""token"": ""mice"", ""start_span"": 105, ""end_span"": 109, ""type"": ""Organism""}]"
The retention time was not significantly improved in ( - / -) mice across trials of training at 5, 10 and 15 rpm [ 5 rpm: F ( 3, 15. 3) = 2. 05, p = 0. 15; 10 rpm: F ( 7, 11) = 2. 61, p = 0. 07; 15 rpm: F ( 19, 26. 6) = 1. 57, p = 0. 14] ( Figs. 3B, 3C and 3D).	"mice	62	66	Organism"	"[{""token"": ""mice"", ""start_span"": 62, ""end_span"": 66, ""type"": ""Organism""}]"
In the present study, we examined the function of ADAM11 by generating mice that lacked the Adam11 gene.	"mice	71	75	Organism"	"[{""token"": ""mice"", ""start_span"": 71, ""end_span"": 75, ""type"": ""Organism""}]"
Interestingly, ADAM11 - deficient mice appeared normal and survived more than one year without apparent histological abnormality, including the brain, heart, liver and testis.	"mice	34	38	Organism"	"[{""token"": ""mice"", ""start_span"": 34, ""end_span"": 38, ""type"": ""Organism""}]"
The wild - type mice spent significantly more time searching for the platform in the target quadrant than the other quadrants.	"mice	16	20	Organism"	"[{""token"": ""mice"", ""start_span"": 16, ""end_span"": 20, ""type"": ""Organism""}]"
However, ADAM11 - deficient mice did not search selectively in the target quadrant.	"mice	28	32	Organism"	"[{""token"": ""mice"", ""start_span"": 28, ""end_span"": 32, ""type"": ""Organism""}]"
These results indicated that ADAM11 - deficient mice showed a spatial learning impairment.	"mice	48	52	Organism"	"[{""token"": ""mice"", ""start_span"": 48, ""end_span"": 52, ""type"": ""Organism""}]"
It is widely accepted that the cerebellum is involved in the performance of the rotating rod task, since mice with structural abnormalities in the cerebellum [ 31] or with disruptions in genes enriched in the cerebellum [ 32] exhibit performance deficits in this task.	"mice	105	109	Organism"	"[{""token"": ""mice"", ""start_span"": 105, ""end_span"": 109, ""type"": ""Organism""}]"
These results indicate that ADAM11 - deficient mice have a deficit in motor coordination.	"mice	47	51	Organism"	"[{""token"": ""mice"", ""start_span"": 47, ""end_span"": 51, ""type"": ""Organism""}]"
On the other hand, in the visual platform version of the water maze task, motor ability for swimming in ADAM11 - deficient mice was normal.	"mice	123	127	Organism"	"[{""token"": ""mice"", ""start_span"": 123, ""end_span"": 127, ""type"": ""Organism""}]"
The results in the present study showed that ADAM11 - deficient mice slightly, though not significantly, improved motor learning ability during rotating rod performance.	"mice	64	68	Organism"	"[{""token"": ""mice"", ""start_span"": 64, ""end_span"": 68, ""type"": ""Organism""}]"
However, the deficit of motor learning in ADAM11 - deficient mice was not clear in this study.	"mice	61	65	Organism"	"[{""token"": ""mice"", ""start_span"": 61, ""end_span"": 65, ""type"": ""Organism""}]"
To examine motor learning ability in ADAM11 - deficient mice in detail, we will need to use other cerebellar - dependent learning tasks, such as a classical eyelid conditioning test.	"mice	56	60	Organism"	"[{""token"": ""mice"", ""start_span"": 56, ""end_span"": 60, ""type"": ""Organism""}]"
There was no impairment in the grip strength and wire suspension test in ADAM11 - deficient mice.	"mice	92	96	Organism"	"[{""token"": ""mice"", ""start_span"": 92, ""end_span"": 96, ""type"": ""Organism""}]"
Spontaneous motor activity and walking patterns of ADAM11 - deficient mice were also found to be normal, suggesting that the dysfunction found in the rotating rod test was not derived from muscle weakness or other peripheral disturbances.	"mice	70	74	Organism"	"[{""token"": ""mice"", ""start_span"": 70, ""end_span"": 74, ""type"": ""Organism""}]"
These results suggest that limited brain sites, mainly the hippocampus and cerebellum, might contribute to the dominant phenotype, spatial learning impairment and motor discoordination in ADAM11 - deficient mice.	"mice	207	211	Organism"	"[{""token"": ""mice"", ""start_span"": 207, ""end_span"": 211, ""type"": ""Organism""}]"
It is unlikely that morphological changes during development led to impairment of spatial learning and motor coordination, and morphological alterations in the cytoarchitecture of the hippocampus and cerebellum were not observed in ADAM11 - deficient mice after histological investigation using HE staining.	"mice	251	255	Organism"	"[{""token"": ""mice"", ""start_span"": 251, ""end_span"": 255, ""type"": ""Organism""}]"
It has also been reported that mice lacking NMDA receptor for both NR2A and NR2C subunits showed motor dysfunction and complete loss of both spontaneous and evoked excitatory postsynaptic currents ( EPSCs) in cerebellar granule cells [ 38].	"mice	31	35	Organism"	"[{""token"": ""mice"", ""start_span"": 31, ""end_span"": 35, ""type"": ""Organism""}]"
Therefore, electrophyological studies to enable analysis of synaptic transmission and plasticity in the hippocampus and cerebellum of ADAM11 - deficient mice will be needed.	"mice	153	157	Organism"	"[{""token"": ""mice"", ""start_span"": 153, ""end_span"": 157, ""type"": ""Organism""}]"
ADAM11 - deficient mice remained alive for more than one year without ataxia or tremor, but showed a deficit in spatial learning and motor dysfunction.	"mice	19	23	Organism"	"[{""token"": ""mice"", ""start_span"": 19, ""end_span"": 23, ""type"": ""Organism""}]"
On the other hand, mice lacking the Adam22 gene showed severe ataxia, exhibited marked hypomyelination of the peripheral nerves, and died before weaning [ 22].	"mice	19	23	Organism"	"[{""token"": ""mice"", ""start_span"": 19, ""end_span"": 23, ""type"": ""Organism""}]"
Mice lacking the Adam23 gene showed severe ataxia and tremor and died before weaning [ 23].	"Mice	0	4	Organism"	"[{""token"": ""Mice"", ""start_span"": 0, ""end_span"": 4, ""type"": ""Organism""}]"
Although the precise molecular functions of these ADAMs are still unclear, further investigations will provide clues to understanding the nervous system of higher organisms.	"organisms	163	172	Organism"	"[{""token"": ""organisms"", ""start_span"": 163, ""end_span"": 172, ""type"": ""Organism""}]"
ADAM11 - deficient mice survived more than one year without ataxia or tremor, showed no abnormalities in body weight gain, spontaneous motor activity, muscle strength, or walking patterns, and exhibited no apparent anatomical - histological changes.	"mice	19	23	Organism"	"[{""token"": ""mice"", ""start_span"": 19, ""end_span"": 23, ""type"": ""Organism""}]"
However, hippocampus - dependent spatial learning and cerebellum - dependent motor coordination in ADAM11 - deficient mice were impaired when tested using water maze and rotating rod tasks.	"mice	118	122	Organism"	"[{""token"": ""mice"", ""start_span"": 118, ""end_span"": 122, ""type"": ""Organism""}]"
Our genetically modified mouse strain has the potential to be a useful and sensitive tools for detailed investigation of ADAM proteins ' functions in the nervous system.	"mouse	25	30	Organism"	"[{""token"": ""mouse"", ""start_span"": 25, ""end_span"": 30, ""type"": ""Organism""}]"
To generate a mutation in the mouse Adam11 gene, we inserted a PGKneo cassette into exons 5 - 7 of the Adam11 gene.	"mouse	30	35	Organism"	"[{""token"": ""mouse"", ""start_span"": 30, ""end_span"": 35, ""type"": ""Organism""}]"
Generation of Adam11 deficient mice	"mice	31	35	Organism"	"[{""token"": ""mice"", ""start_span"": 31, ""end_span"": 35, ""type"": ""Organism""}]"
Correctly targeted ES clones were injected into fertilised ICR mouse eggs at the eight - cell stage.	"mouse	63	68	Organism"	"[{""token"": ""mouse"", ""start_span"": 63, ""end_span"": 68, ""type"": ""Organism""}]"
Mouse genomic DNA used for Southern blot analysis was extracted from the liver of each genotype.	"Mouse	0	5	Organism"	"[{""token"": ""Mouse"", ""start_span"": 0, ""end_span"": 5, ""type"": ""Organism""}]"
The absence of ADAM11 protein in the ( - / -) mice was confirmed by Western blot analysis.	"mice	46	50	Organism"	"[{""token"": ""mice"", ""start_span"": 46, ""end_span"": 50, ""type"": ""Organism""}]"
To be brief, the cerebellum was isolated from a six month - old mouse of each genotype and homogenised in cell lysis buffer ( 50 mM Tris - HCl, pH 7. 5, 100 mM NaCl, 1% NP - 40, protease inhibitor cocktail [ Roche Diagnostics]).	"mouse	64	69	Organism"	"[{""token"": ""mouse"", ""start_span"": 64, ""end_span"": 69, ""type"": ""Organism""}]"
Bound antibodies were visualised with horseradish peroxidase - labelled second antibody and an ECL - plus chemiluminescence detection system ( Amersham Biosciences Corp.).	"horseradish	38	49	Organism"	"[{""token"": ""horseradish"", ""start_span"": 38, ""end_span"": 49, ""type"": ""Organism""}]"
For the present experiments, ADAM11 - deficient male mice ( backcrossed generations into C57BL / 6NCrj, n = 14) were used in all behavioural analyses ( 22 - 24 weeks of age).	"mice	53	57	Organism"	"[{""token"": ""mice"", ""start_span"": 53, ""end_span"": 57, ""type"": ""Organism""}]"
All of the behavioural studies were conducted between 10: 00 and 16: 00 by a well - trained experimenter blind to the mouse genotypes.	"mouse	118	123	Organism"	"[{""token"": ""mouse"", ""start_span"": 118, ""end_span"": 123, ""type"": ""Organism""}]"
Locomotor activity in a novel environment was measured by introducing mice ( + / +, + / - and - / -; n = 8, 8 and 8, respectively) for 90 min in a Plexiglas box ( 30 x 20 x 13 cm) using a VERSAMAX equipment and software ( Accuscan, Columbus, OH, USA).	"mice	70	74	Organism"	"[{""token"": ""mice"", ""start_span"": 70, ""end_span"": 74, ""type"": ""Organism""}]"
Spatial learning was assessed by three variants of the Morris water maze task [ 27] adapted for mice.	"mice	96	100	Organism"	"[{""token"": ""mice"", ""start_span"": 96, ""end_span"": 100, ""type"": ""Organism""}]"
Each mouse was allowed to swim for 60 sec and the time required to reach the platform ( escape latency) was recorded in each trial.	"mouse	5	10	Organism"	"[{""token"": ""mouse"", ""start_span"": 5, ""end_span"": 10, ""type"": ""Organism""}]"
Each trial was initiated by randomly placing an animal in one of the four starting locations.	"animal	48	54	Organism"	"[{""token"": ""animal"", ""start_span"": 48, ""end_span"": 54, ""type"": ""Organism""}]"
In this trial, the platform was removed and the movement of each mouse was monitored using a computer - based video tracking system ( BTA - 2; Muromachi Kikai Co., Ltd., Tokyo, Japan).	"mouse	65	70	Organism"	"[{""token"": ""mouse"", ""start_span"": 65, ""end_span"": 70, ""type"": ""Organism""}]"
Each mouse was placed into the northwest quadrant of the pool and allowed to swim for 60 sec.	"mouse	5	10	Organism"	"[{""token"": ""mouse"", ""start_span"": 5, ""end_span"": 10, ""type"": ""Organism""}]"
Visible platform task: In this task, the circular platform was made visible by attaching a black board to it and the mouse was required to locate the visible platform.	"mouse	117	122	Organism"	"[{""token"": ""mouse"", ""start_span"": 117, ""end_span"": 122, ""type"": ""Organism""}]"
The mouse was allowed to swim for 60 sec and this task consisted of four trials per day for three consecutive days ( 1 min inter - trial intervals).	"mouse	4	9	Organism"	"[{""token"": ""mouse"", ""start_span"": 4, ""end_span"": 9, ""type"": ""Organism""}]"
Each trial was initiated by randomly placing an animal in one of the four starting locations.	"animal	48	54	Organism"	"[{""token"": ""animal"", ""start_span"": 48, ""end_span"": 54, ""type"": ""Organism""}]"
The mice were first placed on the stationary rod for 4 successive trials, followed by 4 trials at a rotation speed of 5 rpm, 8 trials at 10 rpm, and 20 trials at 15 rpm in that order.	"mice	4	8	Organism"	"[{""token"": ""mice"", ""start_span"": 4, ""end_span"": 8, ""type"": ""Organism""}]"
Intra - trial intervals for each animal were more than 20 min.	"animal	33	39	Organism"	"[{""token"": ""animal"", ""start_span"": 33, ""end_span"": 39, ""type"": ""Organism""}]"
The grip strength of each mouse was measured with a traction apparatus ( FU - 1, Muromachi Kikai Co., Ltd.).	"mouse	26	31	Organism"	"[{""token"": ""mouse"", ""start_span"": 26, ""end_span"": 31, ""type"": ""Organism""}]"
Each mouse was made to grasp the attached bar ( 2 mm diameter) with the forepaws and was slowly pulled back by the tail.	"mouse	5	10	Organism"	"[{""token"": ""mouse"", ""start_span"": 5, ""end_span"": 10, ""type"": ""Organism""}]"
A mouse was placed on a stainless bar ( 50 cm length, 2 mm diameter, elevated up to 37 cm from a surface) at a point midway between the supports and observed for 30 sec in four separate trials.	"mouse	2	7	Organism"	"[{""token"": ""mouse"", ""start_span"": 2, ""end_span"": 7, ""type"": ""Organism""}]"
Sections of tissues including the brain, spinal cord, heart, lung, liver, kidney, spleen and testis from mice ( + / +, + / - and - / -; n = 7, 7 and 7, respectively) were fixed in 10% buffered formalin and embedded in paraffin.	"mice	105	109	Organism"	"[{""token"": ""mice"", ""start_span"": 105, ""end_span"": 109, ""type"": ""Organism""}]"
ET is also leading this project, performed the generation of knockout mice and behavioural analyses, and wrote the manuscript.	"mice	70	74	Organism"	"[{""token"": ""mice"", ""start_span"": 70, ""end_span"": 74, ""type"": ""Organism""}]"
TO and KY contributed to the generation of knockout mice.	"mice	52	56	Organism"	"[{""token"": ""mice"", ""start_span"": 52, ""end_span"": 56, ""type"": ""Organism""}]"
( B) Southern blot analysis of mouse genomic DNA.	"mouse	31	36	Organism"	"[{""token"": ""mouse"", ""start_span"": 31, ""end_span"": 36, ""type"": ""Organism""}]"
( C) Western blot analysis of ADAM11 expression in the mouse cerebellum.	"mouse	55	60	Organism"	"[{""token"": ""mouse"", ""start_span"": 55, ""end_span"": 60, ""type"": ""Organism""}]"
""" P "" indicates the positive control, HA - tagged mouse ADAM11 protein expressed in HeLa cells."	"mouse	50	55	Organism"	"[{""token"": ""mouse"", ""start_span"": 50, ""end_span"": 55, ""type"": ""Organism""}]"
Morris water maze task of ADAM11 - deficient mice.	"mice	45	49	Organism"	"[{""token"": ""mice"", ""start_span"": 45, ""end_span"": 49, ""type"": ""Organism""}]"
Asterisk: significant ( p < 0. 05) difference from ( + / +) mice.	"mice	60	64	Organism"	"[{""token"": ""mice"", ""start_span"": 60, ""end_span"": 64, ""type"": ""Organism""}]"
Asterisk: significant ( p < 0. 05) difference from ( + / +) mice.	"mice	60	64	Organism"	"[{""token"": ""mice"", ""start_span"": 60, ""end_span"": 64, ""type"": ""Organism""}]"
Retention time of ADAM11 - deficient mice on the rotating rod at speeds of 0 rpm ( stationary), 5, 10 and 15 rpm.	"mice	37	41	Organism"	"[{""token"": ""mice"", ""start_span"": 37, ""end_span"": 41, ""type"": ""Organism""}]"
Asterisk: significant ( p < 0. 05) difference from ( + / +) mice.	"mice	60	64	Organism"	"[{""token"": ""mice"", ""start_span"": 60, ""end_span"": 64, ""type"": ""Organism""}]"
Traction test ( g) of ADAM11 - deficient mice.	"mice	41	45	Organism"	"[{""token"": ""mice"", ""start_span"": 41, ""end_span"": 45, ""type"": ""Organism""}]"
