The activity of the transcription factor NF - kappaB is thought to be regulated mainly through cytoplasmic retention by IkappaB molecules.	"cytoplasmic	95	106	Cellular_component"	"[{""token"": ""cytoplasmic"", ""start_span"": 95, ""end_span"": 106, ""type"": ""Cellular_component""}]"
Overexpressed TRAF2 or TRAF6 activate JNK, p38, or IKK in the absence of extracellular stimulation.	"extracellular	73	86	Cellular_component"	"[{""token"": ""extracellular"", ""start_span"": 73, ""end_span"": 86, ""type"": ""Cellular_component""}]"
Like LPS, sPGN and LTA bind to the glycosylphosphatidylinositol - anchored membrane protein CD14 and induce activation of the transcription factor NF - kappaB in host cells like macrophages.	"membrane	75	83	Cellular_component"	"[{""token"": ""membrane"", ""start_span"": 75, ""end_span"": 83, ""type"": ""Cellular_component""}]"
Coexpression together with membrane CD14 enhances sPGN signal transmission through TLR2.	"membrane	27	35	Cellular_component"	"[{""token"": ""membrane"", ""start_span"": 27, ""end_span"": 35, ""type"": ""Cellular_component""}]"
Glycoprotein reglucosylation and nucleotide sugar utilization in the secretory pathway: identification of a nucleoside diphosphatase in the endoplasmic reticulum.	"endoplasmic reticulum	140	161	Cellular_component"	"[{""token"": ""endoplasmic reticulum"", ""start_span"": 140, ""end_span"": 161, ""type"": ""Cellular_component""}]"
We describe here the identification, purification and characterization of an ER enzyme that hydrolyzes UDP to UMP.	"ER	77	79	Cellular_component"	"[{""token"": ""ER"", ""start_span"": 77, ""end_span"": 79, ""type"": ""Cellular_component""}]"
This nucleoside diphosphatase is a ubiquitously expressed, soluble 45 kDa glycoprotein devoid of transmembrane domains and KDEL - related ER localization sequences.	"ER	138	140	Cellular_component"	"[{""token"": ""ER"", ""start_span"": 138, ""end_span"": 140, ""type"": ""Cellular_component""}]"
By eliminating UDP, which is an inhibitory product of the UDP - Glc: glycoprotein glucosyltransferase, it is likely to promote reglucosylation reactions involved in glycoprotein folding and quality control in the ER.	"ER	213	215	Cellular_component"	"[{""token"": ""ER"", ""start_span"": 213, ""end_span"": 215, ""type"": ""Cellular_component""}]"
Overproduction of human Myt1 kinase induces a G2 cell cycle delay by interfering with the intracellular trafficking of Cdc2 - cyclin B1 complexes.	"intracellular	90	103	Cellular_component"	"[{""token"": ""intracellular"", ""start_span"": 90, ""end_span"": 103, ""type"": ""Cellular_component""}]"
These results suggest that the docking of Cdc2 - cyclin B1 complexes to the COOH terminus of Myt1 facilitates the phosphorylation of Cdc2 by Myt1 and that overproduction of Myt1 perturbs cell cycle progression by sequestering Cdc2 - cyclin B1 complexes in the cytoplasm.	"cytoplasm	260	269	Cellular_component"	"[{""token"": ""cytoplasm"", ""start_span"": 260, ""end_span"": 269, ""type"": ""Cellular_component""}]"
We show that A20 does not inhibit TNF - induced nuclear translocation and DNA binding of NF - kappaB, although it completely prevents the TNF - induced activation of an NF - kappaB - dependent reporter gene, as well as TNF - induced IL - 6 and granulocyte macrophage - colony stimulating factor gene expression.	"nuclear	48	55	Cellular_component"	"[{""token"": ""nuclear"", ""start_span"": 48, ""end_span"": 55, ""type"": ""Cellular_component""}]"
Wnt stabilizes cytosolic beta - catenin, which then binds to TCF and activates gene transcription.	"cytosolic	15	24	Cellular_component"	"[{""token"": ""cytosolic"", ""start_span"": 15, ""end_span"": 24, ""type"": ""Cellular_component""}]"
We report the purification and characterization of a native multisubunit complex ( NuA4) from yeast that acetylates nucleosomal histone H4.	"nucleosomal	116	127	Cellular_component"	"[{""token"": ""nucleosomal"", ""start_span"": 116, ""end_span"": 127, ""type"": ""Cellular_component""}]"
Finally, the ability of NuA4 to stimulate GAL4 - VP16 - driven transcription from chromatin templates in vitro is also lost in the temperature - sensitive esa1 mutant.	"chromatin	82	91	Cellular_component"	"[{""token"": ""chromatin"", ""start_span"": 82, ""end_span"": 91, ""type"": ""Cellular_component""}]"
The function of the essential Esa1 protein as the HAT subunit of NuA4 and the presence of Tra1p, a putative transcription activator - interacting subunit, supports an essential link between nuclear H4 acetylation, transcriptional regulation and cell cycle control.	"nuclear	190	197	Cellular_component"	"[{""token"": ""nuclear"", ""start_span"": 190, ""end_span"": 197, ""type"": ""Cellular_component""}]"
Two co - existing mechanisms for nuclear import of MAP kinase: passive diffusion of a monomer and active transport of a dimer.	"nuclear	33	40	Cellular_component"	"[{""token"": ""nuclear"", ""start_span"": 33, ""end_span"": 40, ""type"": ""Cellular_component""}]"
Here we show evidence that tyrosine ( Tyr190 in Xenopus MPK1 / ERK2) phosphorylation of MAPK by MAPKK is necessary and sufficient for the dissociation of the MAPKK - MAPK complex, and that the dissociation of the complex is required for the nuclear translocation of MAPK.	"nuclear	241	248	Cellular_component"	"[{""token"": ""nuclear"", ""start_span"": 241, ""end_span"": 248, ""type"": ""Cellular_component""}]"
These results suggest that monomeric and dimeric forms of MAPK enter the nucleus by passive diffusion and active transport mechanisms, respectively.	"nucleus	73	80	Cellular_component"	"[{""token"": ""nucleus"", ""start_span"": 73, ""end_span"": 80, ""type"": ""Cellular_component""}]"
Regulated nuclear localisation of the yeast transcription factor Ace2p controls expression of chitinase ( CTS1) in Saccharomyces cerevisiae.	"nuclear	10	17	Cellular_component"	"[{""token"": ""nuclear"", ""start_span"": 10, ""end_span"": 17, ""type"": ""Cellular_component""}]"
Nuclear localisation of Ace2p is restricted to late M and early G phases of the mitotic cell cycle.	"Nuclear	0	7	Cellular_component"	"[{""token"": ""Nuclear"", ""start_span"": 0, ""end_span"": 7, ""type"": ""Cellular_component""}]"
We show here that this nuclear localisation is directly associated with regulation of CTS1 expression.	"nuclear	23	30	Cellular_component"	"[{""token"": ""nuclear"", ""start_span"": 23, ""end_span"": 30, ""type"": ""Cellular_component""}]"
Using a version of Ace2p tagged with a c - myc epitope, we show that the protein is excluded from the nucleus of cells during most phases of the mitotic cell cycle.	"nucleus	102	109	Cellular_component"	"[{""token"": ""nucleus"", ""start_span"": 102, ""end_span"": 109, ""type"": ""Cellular_component""}]"
A mutant derivative in which one threonine and two serine residues, which are candidate phosphorylation sites, were replaced by alanine ( to mimic constitutive dephosphorylation) is localised in the nucleus throughout the cell cycle.	"nucleus	199	206	Cellular_component"	"[{""token"": ""nucleus"", ""start_span"": 199, ""end_span"": 206, ""type"": ""Cellular_component""}]"
Ace2p is therefore controlled throughout the cell cycle at three levels: transcription, nuclear localisation, and proteolysis.	"nuclear	88	95	Cellular_component"	"[{""token"": ""nuclear"", ""start_span"": 88, ""end_span"": 95, ""type"": ""Cellular_component""}]"
In its inactive state, NF - kappaB is constitutively present in the cytoplasm as a p50 - p65 heterodimer bound to its inhibitory protein IkappaB.	"cytoplasm	68	77	Cellular_component"	"[{""token"": ""cytoplasm"", ""start_span"": 68, ""end_span"": 77, ""type"": ""Cellular_component""}]"
Proinflammatory cytokines, such as tumor necrosis factor ( TNF), activate NF - kappaB by stimulating the activity of the IkappaB kinases ( IKKs) which phosphorylate IkappaBalpha on serine residues 32 and 36, targeting it for rapid degradation by the 26 S proteasome.	"26 S proteasome	250	265	Cellular_component"	"[{""token"": ""26 S proteasome"", ""start_span"": 250, ""end_span"": 265, ""type"": ""Cellular_component""}]"
This enables the release and nuclear translocation of the NF - kappaB complex and activation of gene transcription.	"nuclear	29	36	Cellular_component"	"[{""token"": ""nuclear"", ""start_span"": 29, ""end_span"": 36, ""type"": ""Cellular_component""}]"
We cloned a mouse phosphatidylinositol glycan - class N ( Pig - n) gene that encodes a 931amino acid protein expressed in the endoplasmic reticulum, which is homologous to yeast Mcd4p.	"endoplasmic reticulum	126	147	Cellular_component"	"[{""token"": ""endoplasmic reticulum"", ""start_span"": 126, ""end_span"": 147, ""type"": ""Cellular_component""}]"
The surface expression of Thy - 1 was only partially affected, indicating that modification of the first mannose by phosphoethanolamine is not essential for attachment of GPI anchors in mammalian cells.	"surface	4	11	Cellular_component"	"[{""token"": ""surface"", ""start_span"": 4, ""end_span"": 11, ""type"": ""Cellular_component""}]"
An inhibitor of GPI biosynthesis, YW3548 / BE49385A, inhibited transfer of phosphoethanolamine to the first mannose in mammalian cells but only slightly affected the surface expression of GPI - anchored proteins.	"surface	166	173	Cellular_component"	"[{""token"": ""surface"", ""start_span"": 166, ""end_span"": 173, ""type"": ""Cellular_component""}]"
The putative tumor suppressors EXT1 and EXT2 form a stable complex that accumulates in the Golgi apparatus and catalyzes the synthesis of heparan sulfate.	"Golgi apparatus	91	106	Cellular_component"	"[{""token"": ""Golgi apparatus"", ""start_span"": 91, ""end_span"": 106, ""type"": ""Cellular_component""}]"
The proteins encoded by these genes, EXT1 and EXT2, are endoplasmic reticulum - localized type II transmembrane glycoproteins that possess or are tightly associated with glycosyltransferase activities involved in the polymerization of heparan sulfate.	"endoplasmic reticulum	56	77	Cellular_component"	"[{""token"": ""endoplasmic reticulum"", ""start_span"": 56, ""end_span"": 77, ""type"": ""Cellular_component""}]"
Instead, it appears that EXT1 and EXT2 form a hetero - oligomeric complex in vivo that leads to the accumulation of both proteins in the Golgi apparatus.	"Golgi apparatus	137	152	Cellular_component"	"[{""token"": ""Golgi apparatus"", ""start_span"": 137, ""end_span"": 152, ""type"": ""Cellular_component""}]"
Remarkably, the Golgi - localized EXT1 / EXT2 complex possesses substantially higher glycosyltransferase activity than EXT1 or EXT2 alone, which suggests that the complex represents the biologically relevant form of the enzyme ( s).	"Golgi	16	21	Cellular_component"	"[{""token"": ""Golgi"", ""start_span"": 16, ""end_span"": 21, ""type"": ""Cellular_component""}]"
Nuclear sequestration of the exchange factor Cdc24 by Far1 regulates cell polarity during yeast mating.	"Nuclear	0	7	Cellular_component"	"[{""token"": ""Nuclear"", ""start_span"": 0, ""end_span"": 7, ""type"": ""Cellular_component""}]"
Cytoskeletal rearrangements during the cell cycle and in response to signals are regulated by small Rho - type GTPases, but it is not known how these GTPases are activated in a spatial and temporal manner.	"Cytoskeletal	0	12	Cellular_component"	"[{""token"": ""Cytoskeletal"", ""start_span"": 0, ""end_span"": 12, ""type"": ""Cellular_component""}]"
Here we show that Cdc24, the guanine - nucleotide exchange factor for the yeast GTPase Cdc42, is sequestered in the cell nucleus by Far1.	"cell nucleus	116	128	Cellular_component"	"[{""token"": ""cell nucleus"", ""start_span"": 116, ""end_span"": 128, ""type"": ""Cellular_component""}]"
At bud emergence, activation of the G1 cyclin - dependent kinase Cdc28 - Cln triggers degradation of Far1 and, as a result, relocation of Cdc24 to the cytoplasm.	"cytoplasm	151	160	Cellular_component"	"[{""token"": ""cytoplasm"", ""start_span"": 151, ""end_span"": 160, ""type"": ""Cellular_component""}]"
In contrast, in response to mating pheromones, the Far1 - Cdc24 complex is exported from the nucleus by Msn5.	"nucleus	93	100	Cellular_component"	"[{""token"": ""nucleus"", ""start_span"": 93, ""end_span"": 100, ""type"": ""Cellular_component""}]"
Either degradation of Far1 or its nuclear export by Msn5 was sufficient for cell growth, suggesting that the two mechanisms are redundant for cell viability.	"nuclear	34	41	Cellular_component"	"[{""token"": ""nuclear"", ""start_span"": 34, ""end_span"": 41, ""type"": ""Cellular_component""}]"
Taken together, our results indicate that Far1 functions as a nuclear anchor for Cdc24.	"nuclear	62	69	Cellular_component"	"[{""token"": ""nuclear"", ""start_span"": 62, ""end_span"": 69, ""type"": ""Cellular_component""}]"
Translocation of Akt / PKB to the nucleus of osteoblast - like MC3T3 - E1 cells exposed to proliferative growth factors.	"nucleus	34	41	Cellular_component"	"[{""token"": ""nucleus"", ""start_span"": 34, ""end_span"": 41, ""type"": ""Cellular_component""}]"
An active phosphatidylinositol 3 - kinase ( PI3K) has been shown in nuclei of different cell types.	"nuclei	68	74	Cellular_component"	"[{""token"": ""nuclei"", ""start_span"": 68, ""end_span"": 74, ""type"": ""Cellular_component""}]"
Nuclear PI3K translocation has been demonstrated to be related to an analogous translocation of a PtdIns ( 3, 4, 5) P ( 3) activated PKC, the zeta isozyme.	"Nuclear	0	7	Cellular_component"	"[{""token"": ""Nuclear"", ""start_span"": 0, ""end_span"": 7, ""type"": ""Cellular_component""}]"
We have examined the issue of whether or not in the osteoblast - like clonal cell line MC3T3 - E1 there may be observed an insulin - like growth factor - I - ( IGF - I) and platelet - derived growth factor - ( PDGF) dependent nuclear translocation of an active Akt / PKB.	"nuclear	226	233	Cellular_component"	"[{""token"": ""nuclear"", ""start_span"": 226, ""end_span"": 233, ""type"": ""Cellular_component""}]"
Western blot analysis showed a maximal nuclear translocation after 20 min of IGF - I stimulation or after 30 min of PDGF treatment.	"nuclear	39	46	Cellular_component"	"[{""token"": ""nuclear"", ""start_span"": 39, ""end_span"": 46, ""type"": ""Cellular_component""}]"
Both growth factors increased rapidly and transiently the enzyme activity of immunoprecipitable nuclear Akt / PKB on a similar time scale and after 60 min the values were slightly higher than the basal levels.	"nuclear	96	103	Cellular_component"	"[{""token"": ""nuclear"", ""start_span"": 96, ""end_span"": 103, ""type"": ""Cellular_component""}]"
These findings strongly suggest that the intranuclear translocation of Akt / PKB is an important step in signalling pathways that mediate cell proliferation.	"intranuclear	41	53	Cellular_component"	"[{""token"": ""intranuclear"", ""start_span"": 41, ""end_span"": 53, ""type"": ""Cellular_component""}]"
Characterization of a cDNA encoding a novel human Golgi alpha 1, 2 - mannosidase ( IC) involved in N - glycan biosynthesis.	"Golgi	50	55	Cellular_component"	"[{""token"": ""Golgi"", ""start_span"": 50, ""end_span"": 55, ""type"": ""Cellular_component""}]"
A human cDNA encoding a 70. 9 - kDa type II membrane protein with sequence similarity to class I alpha1, 2 - mannosidases was isolated.	"membrane	44	52	Cellular_component"	"[{""token"": ""membrane"", ""start_span"": 44, ""end_span"": 52, ""type"": ""Cellular_component""}]"
This residue is the mannose cleaved from Man ( 9) GlcNAc ( 2) by the endoplasmic reticulum alpha1, 2 - mannosidase I to form Man ( 8) GlcNAc ( 2) isomer B.	"endoplasmic reticulum	69	90	Cellular_component"	"[{""token"": ""endoplasmic reticulum"", ""start_span"": 69, ""end_span"": 90, ""type"": ""Cellular_component""}]"
The order of mannose hydrolysis from either pyridylaminated Man ( 9) GlcNAc ( 2) or Man ( 8) GlcNAc ( 2) isomer B differs from that previously reported for mammalian Golgi alpha1, 2 - mannosidases IA and IB.	"Golgi	166	171	Cellular_component"	"[{""token"": ""Golgi"", ""start_span"": 166, ""end_span"": 171, ""type"": ""Cellular_component""}]"
The full - length alpha1, 2 - mannosidase IC was localized to the Golgi of MDBK and MDCK cells by indirect immunofluorescence.	"Golgi	66	71	Cellular_component"	"[{""token"": ""Golgi"", ""start_span"": 66, ""end_span"": 71, ""type"": ""Cellular_component""}]"
The expression pattern is different from that of human Golgi alpha1, 2 - mannosidases IA and IB.	"Golgi	55	60	Cellular_component"	"[{""token"": ""Golgi"", ""start_span"": 55, ""end_span"": 60, ""type"": ""Cellular_component""}]"
Therefore, the human genome contains at least three differentially regulated Golgi alpha1, 2 - mannosidase genes encoding enzymes with similar, but not identical specificities.	"Golgi	77	82	Cellular_component"	"[{""token"": ""Golgi"", ""start_span"": 77, ""end_span"": 82, ""type"": ""Cellular_component""}]"
In non - stimulated cells NF kappa B is anchored in the cytoplasm via the inhibitory protein I kappa B alpha.	"cytoplasm	56	65	Cellular_component"	"[{""token"": ""cytoplasm"", ""start_span"": 56, ""end_span"": 65, ""type"": ""Cellular_component""}]"
Polyubiquitination of proteins by Cdc34 / SCF complexes targets them for degradation by the 26S proteasome.	"26S proteasome	92	106	Cellular_component"	"[{""token"": ""26S proteasome"", ""start_span"": 92, ""end_span"": 106, ""type"": ""Cellular_component""}]"
Nud1p links astral microtubule organization and the control of exit from mitosis.	"astral microtubule	12	30	Cellular_component"	"[{""token"": ""astral microtubule"", ""start_span"": 12, ""end_span"": 30, ""type"": ""Cellular_component""}]"
Here, we describe that the core SPB component Nud1p is a key protein that functions in both processes.	"SPB	32	35	Cellular_component"	"[{""token"": ""SPB"", ""start_span"": 32, ""end_span"": 35, ""type"": ""Cellular_component""}]"
The astral microtubule organizing function of Nud1p is mediated by its interaction with the gamma - tubulin complex binding protein Spc72p.	"astral microtubule	4	22	Cellular_component"	"[{""token"": ""astral microtubule"", ""start_span"": 4, ""end_span"": 22, ""type"": ""Cellular_component""}]"
In conditional lethal nud1 - 2 cells, the MEN component Tem1p, a GTPase, is mislocalized, whereas the kinase Cdc15p is still associated with the SPB.	"SPB	145	148	Cellular_component"	"[{""token"": ""SPB"", ""start_span"": 145, ""end_span"": 148, ""type"": ""Cellular_component""}]"
Thus, in nud1 - 2 cells the failure of Tem1p to interact with Cdc15p at the SPB probably prevents mitotic exit.	"SPB	76	79	Cellular_component"	"[{""token"": ""SPB"", ""start_span"": 76, ""end_span"": 79, ""type"": ""Cellular_component""}]"
Mammalian Toll - like receptors ( TLRs) are expressed on innate immune cells and respond to the membrane components of Gram - positive or Gram - negative bacteria.	"membrane components	96	115	Cellular_component"	"[{""token"": ""membrane components"", ""start_span"": 96, ""end_span"": 115, ""type"": ""Cellular_component""}]"
However, the intracellular signaling events following TLR activation are largely unknown.	"intracellular	13	26	Cellular_component"	"[{""token"": ""intracellular"", ""start_span"": 13, ""end_span"": 26, ""type"": ""Cellular_component""}]"
S. aureus stimulation causes the recruitment of active Rac1 and phosphatidylinositol - 3 kinase ( PI3K) to the TLR2 cytosolic domain.	"cytosolic	116	125	Cellular_component"	"[{""token"": ""cytosolic"", ""start_span"": 116, ""end_span"": 125, ""type"": ""Cellular_component""}]"
A signaling cascade composed of Rac1, PI3K and Akt targets nuclear p65 transactivation independently of I kappa B alpha degradation.	"nuclear	59	66	Cellular_component"	"[{""token"": ""nuclear"", ""start_span"": 59, ""end_span"": 66, ""type"": ""Cellular_component""}]"
Yeast Mps1p phosphorylates the spindle pole component Spc110p in the N - terminal domain.	"spindle pole	31	43	Cellular_component"	"[{""token"": ""spindle pole"", ""start_span"": 31, ""end_span"": 43, ""type"": ""Cellular_component""}]"
This is the first time that phosphorylation sites of an SPB component have been determined, and these are the first sites of Mps1p phosphorylation identified.	"SPB	56	59	Cellular_component"	"[{""token"": ""SPB"", ""start_span"": 56, ""end_span"": 59, ""type"": ""Cellular_component""}]"
Localization of human Cdc25C is regulated both by nuclear export and 14 - 3 - 3 protein binding.	"nuclear	50	57	Cellular_component"	"[{""token"": ""nuclear"", ""start_span"": 50, ""end_span"": 57, ""type"": ""Cellular_component""}]"
Here we report that 14 - 3 - 3 binding regulates the intracellular trafficking of Cdc25C.	"intracellular	53	66	Cellular_component"	"[{""token"": ""intracellular"", ""start_span"": 53, ""end_span"": 66, ""type"": ""Cellular_component""}]"
A nuclear export signal ( NES) was identified within the amino terminus of Cdc25C.	"nuclear	2	9	Cellular_component"	"[{""token"": ""nuclear"", ""start_span"": 2, ""end_span"": 9, ""type"": ""Cellular_component""}]"
Although mutation of the NES did not effect 14 - 3 - 3 binding, it did cause nuclear accumulation of Cdc25C.	"nuclear	77	84	Cellular_component"	"[{""token"": ""nuclear"", ""start_span"": 77, ""end_span"": 84, ""type"": ""Cellular_component""}]"
These results demonstrate that 14 - 3 - 3 binding is dispensable for the nuclear export of Cdc25C.	"nuclear	73	80	Cellular_component"	"[{""token"": ""nuclear"", ""start_span"": 73, ""end_span"": 80, ""type"": ""Cellular_component""}]"
However, complete nuclear accumulation of Cdc25C required loss of both NES function and 14 - 3 - 3 binding and this was accomplished both pharmacologically and by mutation.	"nuclear	18	25	Cellular_component"	"[{""token"": ""nuclear"", ""start_span"": 18, ""end_span"": 25, ""type"": ""Cellular_component""}]"
The Rb / chromatin connection and epigenetic control: opinion.	"chromatin	9	18	Cellular_component"	"[{""token"": ""chromatin"", ""start_span"": 9, ""end_span"": 18, ""type"": ""Cellular_component""}]"
Rb represses E2F mainly by recruiting chromatin remodeling factors ( histone deacetylases and SWI / SNF complexes), the DNA methyltransferase DNMT1, and a histone methyltransferase.	"chromatin	38	47	Cellular_component"	"[{""token"": ""chromatin"", ""start_span"": 38, ""end_span"": 47, ""type"": ""Cellular_component""}]"
A model in which Rb irreversibly represses E2F - regulated genes in differentiated cells by an epigenetic mechanism linked to heterochromatin, and involving histone H3 and promoter DNA methylation, is discussed.	"heterochromatin	126	141	Cellular_component"	"[{""token"": ""heterochromatin"", ""start_span"": 126, ""end_span"": 141, ""type"": ""Cellular_component""}]"
Finally, P6, a 16 - kDa lipoprotein highly conserved in the outer membrane of all NTHi and H. influenzae type b strains, appears to also activate NF - kappa B via similar signaling pathways.	"outer membrane	60	74	Cellular_component"	"[{""token"": ""outer membrane"", ""start_span"": 60, ""end_span"": 74, ""type"": ""Cellular_component""}]"
Based on the murine MACS1 sequence, we also identified the location and organization of the human MACS1 gene, showing that the human MACS1 and Sa genes are located in the opposite transcriptional direction within a 150 - kilobase region on chromosome 16p13. 1.	"chromosome 16p13	240	256	Cellular_component"	"[{""token"": ""chromosome 16p13"", ""start_span"": 240, ""end_span"": 256, ""type"": ""Cellular_component""}]"
The GPI transamidase mediates GPI anchoring in the endoplasmic reticulum, by replacing a protein ' s C - terminal GPI attachment signal peptide with a pre - assembled GPI.	"endoplasmic reticulum	51	72	Cellular_component"	"[{""token"": ""endoplasmic reticulum"", ""start_span"": 51, ""end_span"": 72, ""type"": ""Cellular_component""}]"
Phosphorylation of I kappa Bs - - the cytoplasmic inhibitors of the NF - kappa B transcription factors - - is the key event which triggers activation of the NF - kappa B cascade.	"cytoplasmic	38	49	Cellular_component"	"[{""token"": ""cytoplasmic"", ""start_span"": 38, ""end_span"": 49, ""type"": ""Cellular_component""}]"
The common core 1 O - glycan structure Galbeta1 - - > 3GalNAc - R is the precursor for many extended mucin - type O - glycan structures in animal cell surface and secreted glycoproteins.	"cell surface	146	158	Cellular_component"	"[{""token"": ""cell surface"", ""start_span"": 146, ""end_span"": 158, ""type"": ""Cellular_component""}]"
The core 1 beta3 - Gal - T predicts a 363 - amino acid type II transmembrane protein.	"transmembrane	63	76	Cellular_component"	"[{""token"": ""transmembrane"", ""start_span"": 63, ""end_span"": 76, ""type"": ""Cellular_component""}]"
In most instances, translation is regulated at the initiation phase, when a ribosome is recruited to the 5 ' end of an mRNA.	"ribosome	76	84	Cellular_component"	"[{""token"": ""ribosome"", ""start_span"": 76, ""end_span"": 84, ""type"": ""Cellular_component""}]"
Subsequent recruitment of several components, including the small ribosomal subunit, is thought to allow migration of initiation complexes and recognition of the initiation codon.	"small ribosomal subunit	60	83	Cellular_component"	"[{""token"": ""small ribosomal subunit"", ""start_span"": 60, ""end_span"": 83, ""type"": ""Cellular_component""}]"
Bub3 interaction with Mad2, Mad3 and Cdc20 is mediated by WD40 repeats and does not require intact kinetochores.	"kinetochores	99	111	Cellular_component"	"[{""token"": ""kinetochores"", ""start_span"": 99, ""end_span"": 111, ""type"": ""Cellular_component""}]"
We suggest that Bub3 could serve as a platform for interactions between kinetochore checkpoint proteins, and its association with Mad2, Mad3 and Cdc20 might be instrumental for checkpoint activation.	"kinetochore	72	83	Cellular_component"	"[{""token"": ""kinetochore"", ""start_span"": 72, ""end_span"": 83, ""type"": ""Cellular_component""}]"
