From these results, we concluded that palmitoylation at the N - terminal cysteine, which is conserved in all alphaherpesvirus UL51 homologs, is required for its membrane association and Golgi localization, and the pUL51 mainly localized to the juxtanuclear region of DEV - infected cells, as well seemed to be incorporated into mature virions as a component of the tegument.	"UL51	126	130	Protein"	"pUL51	214	219	Protein"	"[{""token"": ""UL51"", ""start_span"": 126, ""end_span"": 130, ""type"": ""Protein""}, {""token"": ""pUL51"", ""start_span"": 214, ""end_span"": 219, ""type"": ""Protein""}]"
The research will provide useful clues for DEV pUL51 functional analysis, and will be usefull for further understanding the localization properties of alphaherpesvirus UL51 homologs.	"pUL51	47	52	Protein"	"UL51	168	172	Protein"	"[{""token"": ""pUL51"", ""start_span"": 47, ""end_span"": 52, ""type"": ""Protein""}, {""token"": ""UL51"", ""start_span"": 168, ""end_span"": 172, ""type"": ""Protein""}]"
Recent advances in our understanding of protein tyrosine sulfation have come about owing to the cloning of two human tyrosylprotein sulfotransferases ( TPST - 1 and TPST - 2), the development of novel analytical and synthetic methodologies and detailed studies of proteins and peptides containing sulfotyrosine residues.	"TPST - 1	152	160	Protein"	"TPST - 2	165	173	Protein"	"[{""token"": ""TPST - 1"", ""start_span"": 152, ""end_span"": 160, ""type"": ""Protein""}, {""token"": ""TPST - 2"", ""start_span"": 165, ""end_span"": 173, ""type"": ""Protein""}]"
These results, thus, point to a novel mechanism for regulating PARP - 1 transcription function, and suggest crosstalk between sumoylation and RNF4 - mediated ubiquitination in regulating gene expression in response to heat shock.	"PARP - 1	63	71	Protein"	"RNF4	142	146	Protein"	"[{""token"": ""PARP - 1"", ""start_span"": 63, ""end_span"": 71, ""type"": ""Protein""}, {""token"": ""RNF4"", ""start_span"": 142, ""end_span"": 146, ""type"": ""Protein""}]"
To study the stabilization of proteins within this structure and the contribution of these proteins to the integrity of the PSD, we tagged synaptic proteins with PAGFP ( photoactivatable green fluorescent protein) and used combined two - photon laser - scanning microscopy and two - photon laser photoactivation to measure their rate of turnover in individual spines of rat CA1 pyramidal neurons.	"PAGFP	162	167	Protein"	"green fluorescent protein	187	212	Protein"	"[{""token"": ""PAGFP"", ""start_span"": 162, ""end_span"": 167, ""type"": ""Protein""}, {""token"": ""green fluorescent protein"", ""start_span"": 187, ""end_span"": 212, ""type"": ""Protein""}]"
Analysis of a series of PSD - 95 mutants revealed that distinct domains stabilize PSD - 95 within the PSD and contribute to PSD formation.	"PSD - 95	24	32	Protein"	"PSD - 95	82	90	Protein"	"[{""token"": ""PSD - 95"", ""start_span"": 24, ""end_span"": 32, ""type"": ""Protein""}, {""token"": ""PSD - 95"", ""start_span"": 82, ""end_span"": 90, ""type"": ""Protein""}]"
Stabilization of PSD - 95 within the PSD requires N - terminal palmitoylation and protein interactions mediated by the first and second PDZ domains, whereas formation of a stable lattice of PSD - 95 molecules within the PSD additionally requires the C - terminal SH3 domain.	"PSD - 95	17	25	Protein"	"PSD - 95	190	198	Protein"	"[{""token"": ""PSD - 95"", ""start_span"": 17, ""end_span"": 25, ""type"": ""Protein""}, {""token"": ""PSD - 95"", ""start_span"": 190, ""end_span"": 198, ""type"": ""Protein""}]"
Furthermore, in a PDZ domain 1 and 2 dependent manner, activation of NMDA receptors with a chemical long - term depression protocol rapidly destabilizes PSD - 95 and causes a subset of the PSD - 95 molecules previously anchored in the spine to be released.	"PSD - 95	153	161	Protein"	"PSD - 95	189	197	Protein"	"[{""token"": ""PSD - 95"", ""start_span"": 153, ""end_span"": 161, ""type"": ""Protein""}, {""token"": ""PSD - 95"", ""start_span"": 189, ""end_span"": 197, ""type"": ""Protein""}]"
Thus, through the analysis of rates of exchange of synaptic PSD - 95, we determine separate domains of PSD - 95 that play specific roles in establishing a stable postsynaptic lattice, in allowing proteins to enter this lattice, and in reorganizing this structure in response to plasticity - inducing stimuli.	"PSD - 95	60	68	Protein"	"PSD - 95	103	111	Protein"	"[{""token"": ""PSD - 95"", ""start_span"": 60, ""end_span"": 68, ""type"": ""Protein""}, {""token"": ""PSD - 95"", ""start_span"": 103, ""end_span"": 111, ""type"": ""Protein""}]"
Avidin acylation prevents the complement - dependent lysis of avidin - carrying erythrocytes.	"Avidin	0	6	Protein"	"avidin	62	68	Protein"	"[{""token"": ""Avidin"", ""start_span"": 0, ""end_span"": 6, ""type"": ""Protein""}, {""token"": ""avidin"", ""start_span"": 62, ""end_span"": 68, ""type"": ""Protein""}]"
Complement activation requires a tight contact between avidin and the erythrocyte membrane, since avidin does not in itself activate complement and does not inhibit lysis of sensitized sheep erythrocytes.	"avidin	55	61	Protein"	"avidin	98	104	Protein"	"[{""token"": ""avidin"", ""start_span"": 55, ""end_span"": 61, ""type"": ""Protein""}, {""token"": ""avidin"", ""start_span"": 98, ""end_span"": 104, ""type"": ""Protein""}]"
In addition, growing evidence suggests that regulation of p53 subcellular localization contributes to the biological outcome of the p53 response.	"p53	58	61	Protein"	"p53	132	135	Protein"	"[{""token"": ""p53"", ""start_span"": 58, ""end_span"": 61, ""type"": ""Protein""}, {""token"": ""p53"", ""start_span"": 132, ""end_span"": 135, ""type"": ""Protein""}]"
We present the knowledge - based development and characterization of a potent inhibitor of acyl protein thioesterase 1 ( APT1), a bona fide depalmitoylating enzyme that is, so far, poorly characterized in cells.	"acyl protein thioesterase 1	91	118	Protein"	"APT1	121	125	Protein"	"[{""token"": ""acyl protein thioesterase 1"", ""start_span"": 91, ""end_span"": 118, ""type"": ""Protein""}, {""token"": ""APT1"", ""start_span"": 121, ""end_span"": 125, ""type"": ""Protein""}]"
FRET microscopy shows that assembly of K2P1 and SUMO1 requires Lys274.	"K2P1	39	43	Protein"	"SUMO1	48	53	Protein"	"[{""token"": ""K2P1"", ""start_span"": 39, ""end_span"": 43, ""type"": ""Protein""}, {""token"": ""SUMO1"", ""start_span"": 48, ""end_span"": 53, ""type"": ""Protein""}]"
Single - particle TIRF microscopy shows that wild - type channels in PM have two K2P1 subunits and assemble with two SUMO1 monomers.	"K2P1	81	85	Protein"	"SUMO1	117	122	Protein"	"[{""token"": ""K2P1"", ""start_span"": 81, ""end_span"": 85, ""type"": ""Protein""}, {""token"": ""SUMO1"", ""start_span"": 117, ""end_span"": 122, ""type"": ""Protein""}]"
The K12R mutant of BZLF1, which no longer becomes sumoylated, exhibits stronger transactivation than the wild - type BZLF1 in a reporter assay system as well as in the context of virus genome with nucleosomal structures.	"BZLF1	19	24	Protein"	"BZLF1	117	122	Protein"	"[{""token"": ""BZLF1"", ""start_span"": 19, ""end_span"": 24, ""type"": ""Protein""}, {""token"": ""BZLF1"", ""start_span"": 117, ""end_span"": 122, ""type"": ""Protein""}]"
Immunoprecipitation experiments proved that histone deacetylase 3 preferentially associated with the sumoylated form of BZLF1.	"histone deacetylase 3	44	65	Protein"	"BZLF1	120	125	Protein"	"[{""token"": ""histone deacetylase 3"", ""start_span"": 44, ""end_span"": 65, ""type"": ""Protein""}, {""token"": ""BZLF1"", ""start_span"": 120, ""end_span"": 125, ""type"": ""Protein""}]"
Based on these observations, we conclude that sumoylation of BZLF1 regulates its transcriptional activity through histone modification during Epstein - Barr virus productive replication.	"BZLF1	61	66	Protein"	"histone	114	121	Protein"	"[{""token"": ""BZLF1"", ""start_span"": 61, ""end_span"": 66, ""type"": ""Protein""}, {""token"": ""histone"", ""start_span"": 114, ""end_span"": 121, ""type"": ""Protein""}]"
Additionally, palmitoylation is required for nuclear - membrane localization of BTC - ICD, as demonstrated by the redistribution of non - palmitoylated BTC - ICD mutant to the nucleoplasm.	"BTC	80	83	Protein"	"BTC	152	155	Protein"	"[{""token"": ""BTC"", ""start_span"": 80, ""end_span"": 83, ""type"": ""Protein""}, {""token"": ""BTC"", ""start_span"": 152, ""end_span"": 155, ""type"": ""Protein""}]"
Importantly, a novel receptor - independent role for BTC - ICD signaling is suggested by the ability of BTC - ICD to inhibit cell growth in vitro.	"BTC	53	56	Protein"	"BTC	104	107	Protein"	"[{""token"": ""BTC"", ""start_span"": 53, ""end_span"": 56, ""type"": ""Protein""}, {""token"": ""BTC"", ""start_span"": 104, ""end_span"": 107, ""type"": ""Protein""}]"
Palmitoylation of SARS - CoV S protein is necessary for partitioning into detergent - resistant membranes and cell - cell fusion but not interaction with M protein.	"S protein	29	38	Protein"	"M protein	154	163	Protein"	"[{""token"": ""S protein"", ""start_span"": 29, ""end_span"": 38, ""type"": ""Protein""}, {""token"": ""M protein"", ""start_span"": 154, ""end_span"": 163, ""type"": ""Protein""}]"
Surprisingly, however, palmitoylation of S was not required for interaction with SARS - CoV M protein.	"S	0	1	Protein"	"M protein	92	101	Protein"	"[{""token"": ""S"", ""start_span"": 0, ""end_span"": 1, ""type"": ""Protein""}, {""token"": ""M protein"", ""start_span"": 92, ""end_span"": 101, ""type"": ""Protein""}]"
This contrasts with the requirement for palmitoylation of mouse hepatitis virus S protein for interaction with M protein and may point to important differences in assembly and infectivity of these two coronaviruses.	"S protein	80	89	Protein"	"M protein	111	120	Protein"	"[{""token"": ""S protein"", ""start_span"": 80, ""end_span"": 89, ""type"": ""Protein""}, {""token"": ""M protein"", ""start_span"": 111, ""end_span"": 120, ""type"": ""Protein""}]"
Tyrosine sulfation of Ax21 is required for recognition by rice XA21.	"Ax21	22	26	Protein"	"XA21	63	67	Protein"	"[{""token"": ""Ax21"", ""start_span"": 22, ""end_span"": 26, ""type"": ""Protein""}, {""token"": ""XA21"", ""start_span"": 63, ""end_span"": 67, ""type"": ""Protein""}]"
Ax21 recognition by XA21 at the cell surface induces phosphorylation - mediated events, which are predicted to alter subcellular localization and / or DNA - binding activity of a WRKY family of transcription factors.	"Ax21	0	4	Protein"	"XA21	20	24	Protein"	"[{""token"": ""Ax21"", ""start_span"": 0, ""end_span"": 4, ""type"": ""Protein""}, {""token"": ""XA21"", ""start_span"": 20, ""end_span"": 24, ""type"": ""Protein""}]"
Because XA21 is representative of the large number of predicted pattern recognition receptors ( PRRs) in rice ( n = 328), Arabidopsis ( n = 35) and other plant species, further characterization of XA21 - mediated signalling pathways will contribute to elucidation of these important defence responses.	"XA21	8	12	Protein"	"XA21	197	201	Protein"	"[{""token"": ""XA21"", ""start_span"": 8, ""end_span"": 12, ""type"": ""Protein""}, {""token"": ""XA21"", ""start_span"": 197, ""end_span"": 201, ""type"": ""Protein""}]"
dHIP14 - dependent palmitoylation promotes secretion of the BMP antagonist Sog.	"dHIP14	0	6	Protein"	"Sog	75	78	Protein"	"[{""token"": ""dHIP14"", ""start_span"": 0, ""end_span"": 6, ""type"": ""Protein""}, {""token"": ""Sog"", ""start_span"": 75, ""end_span"": 78, ""type"": ""Protein""}]"
In this study, we examine the regulation of Sog secretion and regulation by dHIP14, the ortholog of a mammalian palmitoylase first identified as Huntington Interacting Protein ( HIP).	"Sog	44	47	Protein"	"dHIP14	76	82	Protein"	"[{""token"": ""Sog"", ""start_span"": 44, ""end_span"": 47, ""type"": ""Protein""}, {""token"": ""dHIP14"", ""start_span"": 76, ""end_span"": 82, ""type"": ""Protein""}]"
Finally, we find that dHIP14 promotes the activity of Sog in vivo.	"dHIP14	22	28	Protein"	"Sog	54	57	Protein"	"[{""token"": ""dHIP14"", ""start_span"": 22, ""end_span"": 28, ""type"": ""Protein""}, {""token"": ""Sog"", ""start_span"": 54, ""end_span"": 57, ""type"": ""Protein""}]"
The covalent attachment of the ubiquitin - like protein Nedd8 is required for cullin activity in animals and plants.	"ubiquitin	31	40	Protein"	"Nedd8	56	61	Protein"	"[{""token"": ""ubiquitin"", ""start_span"": 31, ""end_span"": 40, ""type"": ""Protein""}, {""token"": ""Nedd8"", ""start_span"": 56, ""end_span"": 61, ""type"": ""Protein""}]"
cand - 1 mutants are hypersensitive to the partial loss of cullin activity, suggesting that CAND - 1 facilitates CRL functions.	"cand - 1	0	8	Protein"	"CAND - 1	92	100	Protein"	"[{""token"": ""cand - 1"", ""start_span"": 0, ""end_span"": 8, ""type"": ""Protein""}, {""token"": ""CAND - 1"", ""start_span"": 92, ""end_span"": 100, ""type"": ""Protein""}]"
A transient increase in cAMP accumulation above basal could be evoked by forskolin ( 8 - fold) or by glucagon ( 5 - fold) using insulin - deficient media.	"glucagon	101	109	Protein"	"insulin	128	135	Protein"	"[{""token"": ""glucagon"", ""start_span"": 101, ""end_span"": 109, ""type"": ""Protein""}, {""token"": ""insulin"", ""start_span"": 128, ""end_span"": 135, ""type"": ""Protein""}]"
The prothrombin cDNA modified by site - specific mutagenesis was expressed in Chinese hamster ovary cells using a system that yields functional fully carboxylated prothrombin.	"prothrombin	4	15	Protein"	"prothrombin	163	174	Protein"	"[{""token"": ""prothrombin"", ""start_span"": 4, ""end_span"": 15, ""type"": ""Protein""}, {""token"": ""prothrombin"", ""start_span"": 163, ""end_span"": 174, ""type"": ""Protein""}]"
A 28 - residue peptide, based upon residues - 18 to + 10 of prothrombin, and a 54 - residue peptide, based upon residues - 18 to + 36 of prothrombin, were carboxylated by partially purified bovine carboxylase with similar Km values of 2 - 5 microM.	"prothrombin	60	71	Protein"	"prothrombin	137	148	Protein"	"[{""token"": ""prothrombin"", ""start_span"": 60, ""end_span"": 71, ""type"": ""Protein""}, {""token"": ""prothrombin"", ""start_span"": 137, ""end_span"": 148, ""type"": ""Protein""}]"
Plasmin is rapidly inactivated in plasma by naturally occurring plasma inhibitors so that also upon incubation of acyl - plasmin in plasma only low enzymatic activity is detectable.	"Plasmin	0	7	Protein"	"plasmin	121	128	Protein"	"[{""token"": ""Plasmin"", ""start_span"": 0, ""end_span"": 7, ""type"": ""Protein""}, {""token"": ""plasmin"", ""start_span"": 121, ""end_span"": 128, ""type"": ""Protein""}]"
On the other hand, acyl - plasmins are able either to prevent microthrombosis in the lungs induced by infusion of thrombin or to achieve repatency of the microvasculature after the onset of microthrombosis.	"plasmins	26	34	Protein"	"thrombin	114	122	Protein"	"[{""token"": ""plasmins"", ""start_span"": 26, ""end_span"": 34, ""type"": ""Protein""}, {""token"": ""thrombin"", ""start_span"": 114, ""end_span"": 122, ""type"": ""Protein""}]"
In water, UV difference spectroscopy indicated that the number of Tyr and Trp groups exposed in both APL and d - APL was relatively small and was independent of the molecular size of the perturbant.	"APL	101	104	Protein"	"APL	113	116	Protein"	"[{""token"": ""APL"", ""start_span"": 101, ""end_span"": 104, ""type"": ""Protein""}, {""token"": ""APL"", ""start_span"": 113, ""end_span"": 116, ""type"": ""Protein""}]"
Furthermore, the Trp groups in d - APL were more easily quenched by acrylamide than in APL, indicating that they were more exposed, or in a more hydrophilic environment, following deacylation.	"APL	35	38	Protein"	"APL	87	90	Protein"	"[{""token"": ""APL"", ""start_span"": 35, ""end_span"": 38, ""type"": ""Protein""}, {""token"": ""APL"", ""start_span"": 87, ""end_span"": 90, ""type"": ""Protein""}]"
Protein aggregation appears to be independent of the presence of fatty acids, suggesting that the fluorescence differences between APL and d - APL are related to factors other than aggregation. ( ABSTRACT TRUNCATED AT 250 WORDS)	"APL	131	134	Protein"	"APL	143	146	Protein"	"[{""token"": ""APL"", ""start_span"": 131, ""end_span"": 134, ""type"": ""Protein""}, {""token"": ""APL"", ""start_span"": 143, ""end_span"": 146, ""type"": ""Protein""}]"
Tissue plasminogen activator ( t - PA) is an important initiator of fibrinolysis.	"Tissue plasminogen activator	0	28	Protein"	"t - PA	31	37	Protein"	"[{""token"": ""Tissue plasminogen activator"", ""start_span"": 0, ""end_span"": 28, ""type"": ""Protein""}, {""token"": ""t - PA"", ""start_span"": 31, ""end_span"": 37, ""type"": ""Protein""}]"
Role of variant prealbumin in the pathogenesis of familial amyloidotic polyneuropathy: fate of normal and variant prealbumin in the circulation.	"prealbumin	16	26	Protein"	"prealbumin	114	124	Protein"	"[{""token"": ""prealbumin"", ""start_span"": 16, ""end_span"": 26, ""type"": ""Protein""}, {""token"": ""prealbumin"", ""start_span"": 114, ""end_span"": 124, ""type"": ""Protein""}]"
According to recent studies on protein chemistry and genetic engineering, replacement of the Val30 residue of prealbumin by methionine is believed to play a critical role in the formation of amyloid deposit and the pathogenesis of familial amyloidotic polyneuropathy ( FAP).	"prealbumin	110	120	Protein"	"amyloid	191	198	Protein"	"[{""token"": ""prealbumin"", ""start_span"": 110, ""end_span"": 120, ""type"": ""Protein""}, {""token"": ""amyloid"", ""start_span"": 191, ""end_span"": 198, ""type"": ""Protein""}]"
To obtain the molecular insight into the mechanism of amyloid deposition, it is indispensable to know the fates of normal and variant prealbumin in vivo.	"amyloid	54	61	Protein"	"prealbumin	134	144	Protein"	"[{""token"": ""amyloid"", ""start_span"": 54, ""end_span"": 61, ""type"": ""Protein""}, {""token"": ""prealbumin"", ""start_span"": 134, ""end_span"": 144, ""type"": ""Protein""}]"
These results suggest that factors other than the rate of transfer of the variant form prealbumin from plasma to an extravascular compartment may play a critical role in the pathogenesis of amyloid deposition in FAP patients.	"prealbumin	87	97	Protein"	"amyloid	190	197	Protein"	"[{""token"": ""prealbumin"", ""start_span"": 87, ""end_span"": 97, ""type"": ""Protein""}, {""token"": ""amyloid"", ""start_span"": 190, ""end_span"": 197, ""type"": ""Protein""}]"
Interference of active site specific reagents in plasminogen - streptokinase active site formation.	"plasminogen	49	60	Protein"	"streptokinase	63	76	Protein"	"[{""token"": ""plasminogen"", ""start_span"": 49, ""end_span"": 60, ""type"": ""Protein""}, {""token"": ""streptokinase"", ""start_span"": 63, ""end_span"": 76, ""type"": ""Protein""}]"
We have recently observed slow, non - Michaelis - Menten kinetics of activation of native cat plasminogen by catalytic concentrations of streptokinase.	"plasminogen	94	105	Protein"	"streptokinase	137	150	Protein"	"[{""token"": ""plasminogen"", ""start_span"": 94, ""end_span"": 105, ""type"": ""Protein""}, {""token"": ""streptokinase"", ""start_span"": 137, ""end_span"": 150, ""type"": ""Protein""}]"
This acylation reaction is 550 times slower than acylation of the preformed plasminogen - streptokinase complex by NPGB.	"plasminogen	76	87	Protein"	"streptokinase	90	103	Protein"	"[{""token"": ""plasminogen"", ""start_span"": 76, ""end_span"": 87, ""type"": ""Protein""}, {""token"": ""streptokinase"", ""start_span"": 90, ""end_span"": 103, ""type"": ""Protein""}]"
NPGB binds specifically to plasminogen but not to streptokinase.	"plasminogen	27	38	Protein"	"streptokinase	50	63	Protein"	"[{""token"": ""plasminogen"", ""start_span"": 27, ""end_span"": 38, ""type"": ""Protein""}, {""token"": ""streptokinase"", ""start_span"": 50, ""end_span"": 63, ""type"": ""Protein""}]"
These studies proved that inhibition of cat plasminogen activation by streptokinase occurs at the level of activator complex formation.	"plasminogen	44	55	Protein"	"streptokinase	70	83	Protein"	"[{""token"": ""plasminogen"", ""start_span"": 44, ""end_span"": 55, ""type"": ""Protein""}, {""token"": ""streptokinase"", ""start_span"": 70, ""end_span"": 83, ""type"": ""Protein""}]"
We conclude from our studies that streptokinase binding to both cat and human plasminogen occurs at the potential active site of the zymogen.	"streptokinase	34	47	Protein"	"plasminogen	78	89	Protein"	"[{""token"": ""streptokinase"", ""start_span"": 34, ""end_span"": 47, ""type"": ""Protein""}, {""token"": ""plasminogen"", ""start_span"": 78, ""end_span"": 89, ""type"": ""Protein""}]"
Consequently, it is probable that plasminogen activation in vivo is inhibited by binding of active site specific inhibitors to plasminogen.	"plasminogen	34	45	Protein"	"plasminogen	127	138	Protein"	"[{""token"": ""plasminogen"", ""start_span"": 34, ""end_span"": 45, ""type"": ""Protein""}, {""token"": ""plasminogen"", ""start_span"": 127, ""end_span"": 138, ""type"": ""Protein""}]"
Biosynthesis of GlyCAM - 1, a mucin - like ligand for L - selectin.	"GlyCAM - 1	16	26	Protein"	"L - selectin	54	66	Protein"	"[{""token"": ""GlyCAM - 1"", ""start_span"": 16, ""end_span"": 26, ""type"": ""Protein""}, {""token"": ""L - selectin"", ""start_span"": 54, ""end_span"": 66, ""type"": ""Protein""}]"
One of the endothelial - associated ligands for L - selectin is GlyCAM - 1, a mucin - like glycoprotein, which presents novel sulfated, sialylated and fucosylated O - glycans.	"L - selectin	48	60	Protein"	"GlyCAM - 1	64	74	Protein"	"[{""token"": ""L - selectin"", ""start_span"": 48, ""end_span"": 60, ""type"": ""Protein""}, {""token"": ""GlyCAM - 1"", ""start_span"": 64, ""end_span"": 74, ""type"": ""Protein""}]"
We have isolated additional cDNA clones encoding type II inositol polyphosphate 5 - phosphatase ( 5 - phosphatase II) resulting in a combined cDNA of 3076 nucleotides encoding a protein of 942 amino acids.	"type II inositol polyphosphate 5 - phosphatase	49	95	Protein"	"5 - phosphatase II	98	116	Protein"	"[{""token"": ""type II inositol polyphosphate 5 - phosphatase"", ""start_span"": 49, ""end_span"": 95, ""type"": ""Protein""}, {""token"": ""5 - phosphatase II"", ""start_span"": 98, ""end_span"": 116, ""type"": ""Protein""}]"
There are two motifs highly conserved between types I and II 5 - phosphatase and several other proteins presumed to be inositol phosphatases suggesting a possible role in catalysis.	"types I	46	53	Protein"	"II 5 - phosphatase	58	76	Protein"	"[{""token"": ""types I"", ""start_span"": 46, ""end_span"": 53, ""type"": ""Protein""}, {""token"": ""II 5 - phosphatase"", ""start_span"": 58, ""end_span"": 76, ""type"": ""Protein""}]"
The type II 5 - phosphatase also contains homology to several GTPase activating proteins although no such activity for 5 - phosphatase II was found.	"type II 5 - phosphatase	4	27	Protein"	"5 - phosphatase II	119	137	Protein"	"[{""token"": ""type II 5 - phosphatase"", ""start_span"": 4, ""end_span"": 27, ""type"": ""Protein""}, {""token"": ""5 - phosphatase II"", ""start_span"": 119, ""end_span"": 137, ""type"": ""Protein""}]"
Furthermore, we showed that membrane localization and the activity of 5 - phosphatase II toward its lipid substrate PtdIns ( 4, 5) P2 is reduced by eliminating 5 - phosphatase II isoprenylation in the mutant C939S relative to the native enzyme.	"5 - phosphatase II	70	88	Protein"	"5 - phosphatase II	160	178	Protein"	"[{""token"": ""5 - phosphatase II"", ""start_span"": 70, ""end_span"": 88, ""type"": ""Protein""}, {""token"": ""5 - phosphatase II"", ""start_span"": 160, ""end_span"": 178, ""type"": ""Protein""}]"
32PO4 attached to GSIII during bacterial growth as part of the modifying group could be removed by treatment with snake venom phosphodiesterase or by turkey erythrocyte ADP - ribosylarginine hydrolase.	"GSIII	18	23	Protein"	"ADP - ribosylarginine hydrolase	169	200	Protein"	"[{""token"": ""GSIII"", ""start_span"": 18, ""end_span"": 23, ""type"": ""Protein""}, {""token"": ""ADP - ribosylarginine hydrolase"", ""start_span"": 169, ""end_span"": 200, ""type"": ""Protein""}]"
GST constructs were purified to homogeneity by affinity chromatography and selectively released by thrombin treatment.	"GST	0	3	Protein"	"thrombin	99	107	Protein"	"[{""token"": ""GST"", ""start_span"": 0, ""end_span"": 3, ""type"": ""Protein""}, {""token"": ""thrombin"", ""start_span"": 99, ""end_span"": 107, ""type"": ""Protein""}]"
Lipoic acid metabolism in Escherichia coli: the lplA and lipB genes define redundant pathways for ligation of lipoyl groups to apoprotein.	"lplA	48	52	Protein"	"lipB	57	61	Protein"	"[{""token"": ""lplA"", ""start_span"": 48, ""end_span"": 52, ""type"": ""Protein""}, {""token"": ""lipB"", ""start_span"": 57, ""end_span"": 61, ""type"": ""Protein""}]"
Here, we report an unexpected redundancy between the functions of lplA and lipB, a gene previously identified as a putative lipoate biosynthetic locus.	"lplA	66	70	Protein"	"lipB	75	79	Protein"	"[{""token"": ""lplA"", ""start_span"": 66, ""end_span"": 70, ""type"": ""Protein""}, {""token"": ""lipB"", ""start_span"": 75, ""end_span"": 79, ""type"": ""Protein""}]"
In contrast to the R. rubrum enzyme, nitrogenase from A. variabilis was not affected by DRAG or DRAT.	"DRAG	88	92	Protein"	"DRAT	96	100	Protein"	"[{""token"": ""DRAG"", ""start_span"": 88, ""end_span"": 92, ""type"": ""Protein""}, {""token"": ""DRAT"", ""start_span"": 96, ""end_span"": 100, ""type"": ""Protein""}]"
Neither could inactive nitrogenase be restored by DRAG, nor nitrogenase activity suppressed by DRAT.	"DRAG	50	54	Protein"	"DRAT	95	99	Protein"	"[{""token"": ""DRAG"", ""start_span"": 50, ""end_span"": 54, ""type"": ""Protein""}, {""token"": ""DRAT"", ""start_span"": 95, ""end_span"": 99, ""type"": ""Protein""}]"
