A recombinant form of p67 expressed in bacteria was used to produce polyclonal anti - p67 antibodies.	"p67	22	25	Protein"	"p67	86	89	Protein"	"[{""token"": ""p67"", ""start_span"": 22, ""end_span"": 25, ""type"": ""Protein""}, {""token"": ""p67"", ""start_span"": 86, ""end_span"": 89, ""type"": ""Protein""}]"
The rat p67 sequence was highly homologous to a family of recently described human and mouse gamma - interferon inducible, guanine nucleotide binding proteins.	"p67	8	11	Protein"	"gamma - interferon	93	111	Protein"	"[{""token"": ""p67"", ""start_span"": 8, ""end_span"": 11, ""type"": ""Protein""}, {""token"": ""gamma - interferon"", ""start_span"": 93, ""end_span"": 111, ""type"": ""Protein""}]"
The cytokine interleukin 1 alpha ( IL - 1 alpha) is a critical mediator of the immune and inflammatory responses.	"interleukin 1 alpha	13	32	Protein"	"IL - 1 alpha	35	47	Protein"	"[{""token"": ""interleukin 1 alpha"", ""start_span"": 13, ""end_span"": 32, ""type"": ""Protein""}, {""token"": ""IL - 1 alpha"", ""start_span"": 35, ""end_span"": 47, ""type"": ""Protein""}]"
Immunoprecipitation of [ 3H] myristic acid - radiolabeled human monocyte lysates with IgG antibodies to the 31 - kDa IL - 1 alpha precursor recovered a protein with the physicochemical properties of the IL - 1 alpha N - terminal propiece ( 16 kDa, pI 4. 45).	"IL - 1 alpha	117	129	Protein"	"IL - 1 alpha	203	215	Protein"	"[{""token"": ""IL - 1 alpha"", ""start_span"": 117, ""end_span"": 129, ""type"": ""Protein""}, {""token"": ""IL - 1 alpha"", ""start_span"": 203, ""end_span"": 215, ""type"": ""Protein""}]"
Pheochromocytoma ( PC - 12) cells exposed to nerve growth factor ( NGF) acquire a sympathetic neuron - like phenotype.	"nerve growth factor	45	64	Protein"	"NGF	67	70	Protein"	"[{""token"": ""nerve growth factor"", ""start_span"": 45, ""end_span"": 64, ""type"": ""Protein""}, {""token"": ""NGF"", ""start_span"": 67, ""end_span"": 70, ""type"": ""Protein""}]"
This NGF - response is blocked by methylation inhibitors and can be mimicked by the farnesylated methylated small GTP - binding protein p21ras.	"NGF	5	8	Protein"	"p21ras	136	142	Protein"	"[{""token"": ""NGF"", ""start_span"": 5, ""end_span"": 8, ""type"": ""Protein""}, {""token"": ""p21ras"", ""start_span"": 136, ""end_span"": 142, ""type"": ""Protein""}]"
The implicated involvement of prenylation, methylation and a small GTP - binding protein in the NGF - response has been studied by directly measuring 3H - mevalonic acid ( MVA) - metabolites incorporated into proteins, protein carboxy [ methyl - 3H] ester formation and levels of [ alpha - 32P] GTP - binding proteins in NGF - induced PC - 12 cells.	"NGF	96	99	Protein"	"NGF	321	324	Protein"	"[{""token"": ""NGF"", ""start_span"": 96, ""end_span"": 99, ""type"": ""Protein""}, {""token"": ""NGF"", ""start_span"": 321, ""end_span"": 324, ""type"": ""Protein""}]"
This suggests that NGF also induces an increase in HMG - CoA reductase activity.	"NGF	19	22	Protein"	"HMG - CoA reductase	51	70	Protein"	"[{""token"": ""NGF"", ""start_span"": 19, ""end_span"": 22, ""type"": ""Protein""}, {""token"": ""HMG - CoA reductase"", ""start_span"": 51, ""end_span"": 70, ""type"": ""Protein""}]"
We have overexpressed the vitamin K - dependent gamma - carboxylase cDNA and monitored its ability to improve factor IX processing in Chinese hamster ovary ( CHO) cells.	"vitamin K - dependent gamma - carboxylase	26	67	Protein"	"factor IX	110	119	Protein"	"[{""token"": ""vitamin K - dependent gamma - carboxylase"", ""start_span"": 26, ""end_span"": 67, ""type"": ""Protein""}, {""token"": ""factor IX"", ""start_span"": 110, ""end_span"": 119, ""type"": ""Protein""}]"
These results demonstrate that the ability of CHO cells to modify glutamic acid residues to gamma - carboxyglutamic acid in secreted factor IX is not limited by the expression of the vitamin K - dependent gamma - carboxylase alone.	"factor IX	133	142	Protein"	"vitamin K - dependent gamma - carboxylase	183	224	Protein"	"[{""token"": ""factor IX"", ""start_span"": 133, ""end_span"": 142, ""type"": ""Protein""}, {""token"": ""vitamin K - dependent gamma - carboxylase"", ""start_span"": 183, ""end_span"": 224, ""type"": ""Protein""}]"
Purified vitamin K - dependent carboxylase can carboxylate as many as 12 glutamate residues in FIXQ / S, a peptide substrate based on amino acids - 18 to 41 of the human blood clotting enzyme factor IX.	"vitamin K - dependent carboxylase	9	42	Protein"	"factor IX	192	201	Protein"	"[{""token"": ""vitamin K - dependent carboxylase"", ""start_span"": 9, ""end_span"": 42, ""type"": ""Protein""}, {""token"": ""factor IX"", ""start_span"": 192, ""end_span"": 201, ""type"": ""Protein""}]"
Our studies in transgenic animal bioreactors sought to determine the rate limitations in posttranslational processing of recombinant human protein C ( rhPC) made in mammary gland of mice and pigs.	"protein C	139	148	Protein"	"rhPC	151	155	Protein"	"[{""token"": ""protein C"", ""start_span"": 139, ""end_span"": 148, ""type"": ""Protein""}, {""token"": ""rhPC"", ""start_span"": 151, ""end_span"": 155, ""type"": ""Protein""}]"
Human protein C ( hPC) is a complex plasma protein containing nine gamma - carboxylated glutamic acid ( gla) residues that bind calcium at about 1 to 3 mM.	"protein C	6	15	Protein"	"hPC	18	21	Protein"	"[{""token"": ""protein C"", ""start_span"": 6, ""end_span"": 15, ""type"": ""Protein""}, {""token"": ""hPC"", ""start_span"": 18, ""end_span"": 21, ""type"": ""Protein""}]"
A monoclonal antibody ( 7D7B10 - mAb) that binds an epitope in the gla domain of hPC in the absence of calcium was used to study the conformational behavior of immunopurified rhPC.	"hPC	81	84	Protein"	"rhPC	175	179	Protein"	"[{""token"": ""hPC"", ""start_span"": 81, ""end_span"": 84, ""type"": ""Protein""}, {""token"": ""rhPC"", ""start_span"": 175, ""end_span"": 179, ""type"": ""Protein""}]"
Immunopurified rhPC from lower expressing mice and pigs gave a calcium - dependent binding inhibition by 7D7B10 - mAb similar to that of hPC.	"rhPC	15	19	Protein"	"hPC	137	140	Protein"	"[{""token"": ""rhPC"", ""start_span"": 15, ""end_span"": 19, ""type"": ""Protein""}, {""token"": ""hPC"", ""start_span"": 137, ""end_span"": 140, ""type"": ""Protein""}]"
ATGB2, an Arabidopsis homologue of the GTP - binding protein Rab2, was found to bind GTP in vitro and to be a substrate for a geranylgeranyl: protein transferase ( GGTase) present in plant extracts.	"ATGB2	0	5	Protein"	"Rab2	61	65	Protein"	"[{""token"": ""ATGB2"", ""start_span"": 0, ""end_span"": 5, ""type"": ""Protein""}, {""token"": ""Rab2"", ""start_span"": 61, ""end_span"": 65, ""type"": ""Protein""}]"
Several other proteins were also identified by in vitro GTP binding, including Arabidopsis and tobacco homologues of Rab11, ARF ( ADP - ribosylation factor) and Sar proteins, as well as a novel 22 kDa Arabidopsis protein ( ATG81).	"Rab11	117	122	Protein"	"ATG81	223	228	Protein"	"[{""token"": ""Rab11"", ""start_span"": 117, ""end_span"": 122, ""type"": ""Protein""}, {""token"": ""ATG81"", ""start_span"": 223, ""end_span"": 228, ""type"": ""Protein""}]"
NlpH is located on the surface of B. afzelii, and the nlpH gene is found on a circular plasmid.	"NlpH	0	4	Protein"	"nlpH	54	58	Protein"	"[{""token"": ""NlpH"", ""start_span"": 0, ""end_span"": 4, ""type"": ""Protein""}, {""token"": ""nlpH"", ""start_span"": 54, ""end_span"": 58, ""type"": ""Protein""}]"
Metabolic labeling of Cos7 cells transfected with wild type HHL1 cDNA resulted in substantial incorporation of [ 3H] palmitate into purified HHL1.	"HHL1	60	64	Protein"	"HHL1	141	145	Protein"	"[{""token"": ""HHL1"", ""start_span"": 60, ""end_span"": 64, ""type"": ""Protein""}, {""token"": ""HHL1"", ""start_span"": 141, ""end_span"": 145, ""type"": ""Protein""}]"
Cys57 in HHL1 and probably Cys56 in RHL1 are not palmitoylated.	"HHL1	9	13	Protein"	"RHL1	36	40	Protein"	"[{""token"": ""HHL1"", ""start_span"": 9, ""end_span"": 13, ""type"": ""Protein""}, {""token"": ""RHL1"", ""start_span"": 36, ""end_span"": 40, ""type"": ""Protein""}]"
HSDJ, a human homolog of DnaJ, is farnesylated and is involved in protein import into mitochondria.	"HSDJ	0	4	Protein"	"DnaJ	25	29	Protein"	"[{""token"": ""HSDJ"", ""start_span"": 0, ""end_span"": 4, ""type"": ""Protein""}, {""token"": ""DnaJ"", ""start_span"": 25, ""end_span"": 29, ""type"": ""Protein""}]"
In transient expression of pOTC in COS - 7 cells, pOTC was synthesized and processed to the mature form with an apparent half - life of 2 - 3 min.	"pOTC	27	31	Protein"	"pOTC	50	54	Protein"	"[{""token"": ""pOTC"", ""start_span"": 27, ""end_span"": 31, ""type"": ""Protein""}, {""token"": ""pOTC"", ""start_span"": 50, ""end_span"": 54, ""type"": ""Protein""}]"
Coexpression of HSDJ or C394S resulted in slight retardation of the pOTC processing.	"HSDJ	16	20	Protein"	"pOTC	68	72	Protein"	"[{""token"": ""HSDJ"", ""start_span"": 16, ""end_span"": 20, ""type"": ""Protein""}, {""token"": ""pOTC"", ""start_span"": 68, ""end_span"": 72, ""type"": ""Protein""}]"
We previously demonstrated that long - term alcohol intake remarkably enhanced an endogenous ADP - ribosylation of a 58 kDa protein in rat liver and also identified the 58 kDa protein as phosphoglucomutase ( PGM).	"phosphoglucomutase	187	205	Protein"	"PGM	208	211	Protein"	"[{""token"": ""phosphoglucomutase"", ""start_span"": 187, ""end_span"": 205, ""type"": ""Protein""}, {""token"": ""PGM"", ""start_span"": 208, ""end_span"": 211, ""type"": ""Protein""}]"
Furthermore, PGM activities were significantly increased after long - term alcohol intake concomitant with increased ADP - ribosyltransferase activities toward PGM.	"PGM	13	16	Protein"	"PGM	160	163	Protein"	"[{""token"": ""PGM"", ""start_span"": 13, ""end_span"": 16, ""type"": ""Protein""}, {""token"": ""PGM"", ""start_span"": 160, ""end_span"": 163, ""type"": ""Protein""}]"
In view of the variety of roles of PGM in the liver, such as carbohydrate metabolism and Ca2 + homeostasis, it is tempting to speculate that increased ADP - ribosylation of PGM may play a role in long - term alcohol effects on hepatocytes.	"PGM	35	38	Protein"	"PGM	173	176	Protein"	"[{""token"": ""PGM"", ""start_span"": 35, ""end_span"": 38, ""type"": ""Protein""}, {""token"": ""PGM"", ""start_span"": 173, ""end_span"": 176, ""type"": ""Protein""}]"
Both gamma1WT and gamma1S74L expressed as a beta gamma complex were mixtures modified with farnesyl and geranylgeranyl groups.	"gamma1WT	5	13	Protein"	"gamma1S74L	18	28	Protein"	"[{""token"": ""gamma1WT"", ""start_span"": 5, ""end_span"": 13, ""type"": ""Protein""}, {""token"": ""gamma1S74L"", ""start_span"": 18, ""end_span"": 28, ""type"": ""Protein""}]"
All of the beta1 gamma1 functions absolutely required the isoprenylation of the gamma - subunit.	"beta1	11	16	Protein"	"gamma1	17	23	Protein"	"[{""token"": ""beta1"", ""start_span"": 11, ""end_span"": 16, ""type"": ""Protein""}, {""token"": ""gamma1"", ""start_span"": 17, ""end_span"": 23, ""type"": ""Protein""}]"
Aortas isolated from rats treated for 2 days with lovastatin ( 4 mg / kg body wt per day) showed a 3 - fold increase in tissue plasminogen activator ( tPA) activity.	"tissue plasminogen activator	120	148	Protein"	"tPA	151	154	Protein"	"[{""token"": ""tissue plasminogen activator"", ""start_span"": 120, ""end_span"": 148, ""type"": ""Protein""}, {""token"": ""tPA"", ""start_span"": 151, ""end_span"": 154, ""type"": ""Protein""}]"
Cleavage of the C - terminus of NEDD8 by UCH - L3.	"NEDD8	32	37	Protein"	"UCH - L3	41	49	Protein"	"[{""token"": ""NEDD8"", ""start_span"": 32, ""end_span"": 37, ""type"": ""Protein""}, {""token"": ""UCH - L3"", ""start_span"": 41, ""end_span"": 49, ""type"": ""Protein""}]"
NEDD8 is a novel ubiquitin - like protein that has been shown to conjugate to nuclear proteins in a manner analogous to ubiquitination and sentrinization.	"NEDD8	0	5	Protein"	"ubiquitin	17	26	Protein"	"[{""token"": ""NEDD8"", ""start_span"": 0, ""end_span"": 5, ""type"": ""Protein""}, {""token"": ""ubiquitin"", ""start_span"": 17, ""end_span"": 26, ""type"": ""Protein""}]"
To identify proteins that are involved in the NEDD8 - conjugation and de - conjugation pathway, the yeast two - hybrid system was used to screen a human heart cDNA library using NEDD8 as a bait.	"NEDD8	46	51	Protein"	"NEDD8	178	183	Protein"	"[{""token"": ""NEDD8"", ""start_span"": 46, ""end_span"": 51, ""type"": ""Protein""}, {""token"": ""NEDD8"", ""start_span"": 178, ""end_span"": 183, ""type"": ""Protein""}]"
Here we show that Yap1p is a target of the beta - karyopherin - like nuclear exporter, Crm1p.	"Yap1p	18	23	Protein"	"Crm1p	87	92	Protein"	"[{""token"": ""Yap1p"", ""start_span"": 18, ""end_span"": 23, ""type"": ""Protein""}, {""token"": ""Crm1p"", ""start_span"": 87, ""end_span"": 92, ""type"": ""Protein""}]"
Recognition of Yap1p by Crm1p is inhibited by oxidation, and this inhibition requires at least one of the three cysteine residues flanking the NES.	"Yap1p	15	20	Protein"	"Crm1p	24	29	Protein"	"[{""token"": ""Yap1p"", ""start_span"": 15, ""end_span"": 20, ""type"": ""Protein""}, {""token"": ""Crm1p"", ""start_span"": 24, ""end_span"": 29, ""type"": ""Protein""}]"
The dynamic role of GRP78 / BiP in the coordination of mRNA translation with protein processing.	"GRP78	20	25	Protein"	"BiP	28	31	Protein"	"[{""token"": ""GRP78"", ""start_span"": 20, ""end_span"": 25, ""type"": ""Protein""}, {""token"": ""BiP"", ""start_span"": 28, ""end_span"": 31, ""type"": ""Protein""}]"
The role of GRP78 / BiP in coordinating endoplasmic reticular ( ER) protein processing with mRNA translation was examined in GH3 pituitary cells.	"GRP78	12	17	Protein"	"BiP	20	23	Protein"	"[{""token"": ""GRP78"", ""start_span"": 12, ""end_span"": 17, ""type"": ""Protein""}, {""token"": ""BiP"", ""start_span"": 20, ""end_span"": 23, ""type"": ""Protein""}]"
