While betulin exhibited only moderate anticancer activity in other human cancer cells such as hepatoma SK - HEP - 1 cells, prostate carcinoma PC - 3, and lung carcinoma NCI - H460, with IC ( 50) values ranging from 20 to 60 microg / mL, it showed minor growth inhibition in human erythroleukemia K562 cells ( IC ( 50) > 100 microg / mL).	"betulin	6	13	Chemical"	"[{""token"": ""betulin"", ""start_span"": 6, ""end_span"": 13, ""type"": ""Chemical""}]"
We further investigated the mechanism of anticancer activity by betulin, using HeLa cells as an experimental model.	"betulin	64	71	Chemical"	"[{""token"": ""betulin"", ""start_span"": 64, ""end_span"": 71, ""type"": ""Chemical""}]"
Betulin ( 10 microg / mL) induces apoptotic cell death, as evidenced by morphological characteristics such as membrane phosphatidylserine translocation, nuclear condensation / fragmentation, and apoptotic body formation.	"Betulin	0	7	Chemical"	"[{""token"": ""Betulin"", ""start_span"": 0, ""end_span"": 7, ""type"": ""Chemical""}]"
A kinetics analysis showed that the depolarization of mitochondrial membrane potential and the release of mitochondrial cytochrome c occurred as early as 30 min after treatment with betulin.	"betulin	182	189	Chemical"	"[{""token"": ""betulin"", ""start_span"": 182, ""end_span"": 189, ""type"": ""Chemical""}]"
Importantly, Bax and Bak were rapidly translocated to the mitochondria 30 min after betulin treatment.	"betulin	84	91	Chemical"	"[{""token"": ""betulin"", ""start_span"": 84, ""end_span"": 91, ""type"": ""Chemical""}]"
Taken together, the lines of evidence demonstrate that betulin triggers apoptosis of human cancer cells through the intrinsic apoptotic pathway.	"betulin	55	62	Chemical"	"[{""token"": ""betulin"", ""start_span"": 55, ""end_span"": 62, ""type"": ""Chemical""}]"
Moreover, we showed that combination of E1A gene therapy and SAHA showed high therapeutic efficacy with low toxicity in vivo ovarian and breast xenograft models.	"SAHA	61	65	Chemical"	"[{""token"": ""SAHA"", ""start_span"": 61, ""end_span"": 65, ""type"": ""Chemical""}]"
SAHA downregulated Bcl - XL and upregulated proapoptotic BH3 - only protein Bim, whose expression was further enhanced by E1A in cancer cells.	"SAHA	0	4	Chemical"	"[{""token"": ""SAHA"", ""start_span"": 0, ""end_span"": 4, ""type"": ""Chemical""}]"
SAHA enhanced acetylation of histone H3 in Bim promoter region, while E1A upregulated Egr - 1, which was directly involved in Bim transactivation.	"SAHA	0	4	Chemical"	"[{""token"": ""SAHA"", ""start_span"": 0, ""end_span"": 4, ""type"": ""Chemical""}]"
We also established that doxorubicin treatment induces proliferation arrest and FOXO3a nuclear relocation in sensitive breast cancer cells.	"doxorubicin	25	36	Chemical"	"[{""token"": ""doxorubicin"", ""start_span"": 25, ""end_span"": 36, ""type"": ""Chemical""}]"
Induction of FOXO3a activity in doxorubicin - sensitive MCF - 7 cells was sufficient to promote Akt phosphorylation and arrest cell proliferation.	"doxorubicin	32	43	Chemical"	"[{""token"": ""doxorubicin"", ""start_span"": 32, ""end_span"": 43, ""type"": ""Chemical""}]"
We further show that down - regulation of caspase 3 via overexpression of RASSF1C reduces breast cancer cells ' sensitivity to the apoptosis inducing agent, etoposide.	"etoposide	157	166	Chemical"	"[{""token"": ""etoposide"", ""start_span"": 157, ""end_span"": 166, ""type"": ""Chemical""}]"
Use of DNA microarray and small animal positron emission tomography in preclinical drug evaluation of RAF265, a novel B - Raf / VEGFR - 2 inhibitor.	"RAF265	102	108	Chemical"	"[{""token"": ""RAF265"", ""start_span"": 102, ""end_span"": 108, ""type"": ""Chemical""}]"
RAF265, a novel B - Raf / vascular endothelial growth factor receptor - 2 inhibitor, was evaluated in the preclinical setting for its ability to inhibit the uptake of PET tracers in the A375M ( B - Raf ( V600E)) human melanoma cell line.	"RAF265	0	6	Chemical"	"[{""token"": ""RAF265"", ""start_span"": 0, ""end_span"": 6, ""type"": ""Chemical""}]"
Sunitinib induces apoptosis in pheochromocytoma tumor cells by inhibiting VEGFR2 / Akt / mTOR / S6K1 pathways through modulation of Bcl - 2 and BAD.	"Sunitinib	0	9	Chemical"	"[{""token"": ""Sunitinib"", ""start_span"": 0, ""end_span"": 9, ""type"": ""Chemical""}]"
Sunitinib is an oral multitargeted receptor tyrosine kinase inhibitor with antiangiogenic and antitumor activity that mainly targets vascular endothelial growth factor receptors ( VEGFRs).	"Sunitinib	0	9	Chemical"	"[{""token"": ""Sunitinib"", ""start_span"": 0, ""end_span"": 9, ""type"": ""Chemical""}]"
Very recently, sunitinib has been shown to be an active agent for the treatment of malignant pheochromocytomas.	"sunitinib	15	24	Chemical"	"[{""token"": ""sunitinib"", ""start_span"": 15, ""end_span"": 24, ""type"": ""Chemical""}]"
However, it is unclear whether sunitinib acts only through an antiangiogenic mechanism or whether it may also directly target tumor cells.	"sunitinib	31	40	Chemical"	"[{""token"": ""sunitinib"", ""start_span"": 31, ""end_span"": 40, ""type"": ""Chemical""}]"
Sunitinib markedly induced apoptosis of PC12 cells in a dose - dependent and time - dependent manner.	"Sunitinib	0	9	Chemical"	"[{""token"": ""Sunitinib"", ""start_span"": 0, ""end_span"": 9, ""type"": ""Chemical""}]"
Furthermore, in support of these findings, we found that sunitinib induced a reduction in the expression of the antiapoptotic molecule Bcl - 2 as well as dephosphorylation of the proapoptotic molecule BAD, which results in the activation of BAD in these cells.	"sunitinib	57	66	Chemical"	"[{""token"": ""sunitinib"", ""start_span"": 57, ""end_span"": 66, ""type"": ""Chemical""}]"
Consistent with these apoptotic effects, our results showed that sunitinib inhibited phosphorylation of Akt and mTOR and was followed by a reduction of S6K1, which is a well - known target of mTOR.	"sunitinib	65	74	Chemical"	"[{""token"": ""sunitinib"", ""start_span"": 65, ""end_span"": 74, ""type"": ""Chemical""}]"
Knockdown of VEGFR - 2 attenuated the sunitinib - induced effects, including apoptosis and inhibition of signaling pathways such as the phosphorylation of Akt as well as mTOR, and Bcl - 2, which confirmed that these effects could be mediated by VEGFR - 2.	"sunitinib	38	47	Chemical"	"[{""token"": ""sunitinib"", ""start_span"": 38, ""end_span"": 47, ""type"": ""Chemical""}]"
In addition, silencing of S6K1 induced apoptosis accompanied by a decrease in the phosphorylation of BAD and Bcl - 2, similar to that observed with sunitinib treatment.	"sunitinib	148	157	Chemical"	"[{""token"": ""sunitinib"", ""start_span"": 148, ""end_span"": 157, ""type"": ""Chemical""}]"
Thus, these results together suggest that sunitinib initially exerts its apoptotic effect through the inhibition of VEGFR - 2, which, when followed by reduction of its downstream effectors, including Akt / mTOR / S6K1, may lead to inhibition of the antiapoptotic molecule Bcl - 2 and activation of the proapoptotic molecule BAD in PC12 cells.	"sunitinib	42	51	Chemical"	"[{""token"": ""sunitinib"", ""start_span"": 42, ""end_span"": 51, ""type"": ""Chemical""}]"
Curcumin inhibits metastatic progression of breast cancer cell through suppression of urokinase - type plasminogen activator by NF - kappa B signaling pathways.	"Curcumin	0	8	Chemical"	"[{""token"": ""Curcumin"", ""start_span"": 0, ""end_span"": 8, ""type"": ""Chemical""}]"
Curcumin ( 1, 7 - bis ( 4 - hydroxy - 3 - methoxyphenyl) - 1, 6 - heptadiene - 3, 5 - dione), is extracted from the plant Curcuma longa.	"Curcumin	0	8	Chemical"	"[{""token"": ""Curcumin"", ""start_span"": 0, ""end_span"": 8, ""type"": ""Chemical""}]"
In the present study, we evaluated the effects of curcumin on human mammary epithelial carcinoma MCF - 7 cells.	"curcumin	50	58	Chemical"	"[{""token"": ""curcumin"", ""start_span"": 50, ""end_span"": 58, ""type"": ""Chemical""}]"
Cells were treated with curcumin and examined for cell viability by MTT assay.	"curcumin	24	32	Chemical"	"[{""token"": ""curcumin"", ""start_span"": 24, ""end_span"": 32, ""type"": ""Chemical""}]"
Western blot was performed to detect the effect of curcumin on the expression of uPA.	"curcumin	51	59	Chemical"	"[{""token"": ""curcumin"", ""start_span"": 51, ""end_span"": 59, ""type"": ""Chemical""}]"
Our results showed that curcumin dose - dependently inhibited ( P < 0. 05) the proliferation of MCF - 7 cells.	"curcumin	24	32	Chemical"	"[{""token"": ""curcumin"", ""start_span"": 24, ""end_span"": 32, ""type"": ""Chemical""}]"
Meanwhile, the adhesion and invasion ability of MCF - 7 cells were sharply inhibited when treated with different concentrations of curcumin.	"curcumin	131	139	Chemical"	"[{""token"": ""curcumin"", ""start_span"": 131, ""end_span"": 139, ""type"": ""Chemical""}]"
Curcumin also significantly decreased ( P < 0. 05) the expression of uPA and NF - kappaB DNA binding activity, respectively.	"Curcumin	0	8	Chemical"	"[{""token"": ""Curcumin"", ""start_span"": 0, ""end_span"": 8, ""type"": ""Chemical""}]"
It is concluded that curcumin inhibits the adhesion and invasion of MCF - 7 cells through down - regulating the protein expression of uPA via of NF - kappaB activation.	"curcumin	21	29	Chemical"	"[{""token"": ""curcumin"", ""start_span"": 21, ""end_span"": 29, ""type"": ""Chemical""}]"
Accordingly, the therapeutic potential of curcumin for breast cancer deserves further study.	"curcumin	42	50	Chemical"	"[{""token"": ""curcumin"", ""start_span"": 42, ""end_span"": 50, ""type"": ""Chemical""}]"
It is involved in a wide range of developmental and physiological processes, including serum calcium regulation.	"calcium	93	100	Chemical"	"[{""token"": ""calcium"", ""start_span"": 93, ""end_span"": 100, ""type"": ""Chemical""}]"
Selective inhibition of nuclear factor - kappaB by nuclear factor - kappaB essential modulator - binding domain peptide suppresses the metastasis of highly metastatic oral squamous cell carcinoma.	"nuclear factor - kappaB essential modulator - binding domain peptide	51	119	Chemical"	"[{""token"": ""nuclear factor - kappaB essential modulator - binding domain peptide"", ""start_span"": 51, ""end_span"": 119, ""type"": ""Chemical""}]"
The NBD peptide suppressed metastasis and tongue tumor growth in GSAS / N5 - inoculated mice, and was accompanied by the downregulation of the NF - kappaB - regulated metastasis - related molecules in engrafted tongue tumors.	"NBD peptide	4	15	Chemical"	"[{""token"": ""NBD peptide"", ""start_span"": 4, ""end_span"": 15, ""type"": ""Chemical""}]"
Our results suggest that the selective inhibition of NF - kappaB activation by NBD peptide may provide an effective approach for the treatment of highly metastatic OSCC.	"NBD peptide	79	90	Chemical"	"[{""token"": ""NBD peptide"", ""start_span"": 79, ""end_span"": 90, ""type"": ""Chemical""}]"
Mitochondrial apoptosis and FAK signaling disruption by a novel histone deacetylase inhibitor, HTPB, in antitumor and antimetastatic mouse models.	"HTPB	95	99	Chemical"	"[{""token"": ""HTPB"", ""start_span"": 95, ""end_span"": 99, ""type"": ""Chemical""}]"
METHODOLOGY / PRINCIPAL FINDINGS: Here, we propose a novel HDAC inhibitor, N - Hydroxy - 4 - ( 4 - phenylbutyryl - amino) benzamide ( HTPB), as a potential chemotherapeutic drug for solid tumors.	"HTPB	134	138	Chemical"	"[{""token"": ""HTPB"", ""start_span"": 134, ""end_span"": 138, ""type"": ""Chemical""}]"
The HDAC inhibition of HTPB was confirmed using HDAC activity assay.	"HTPB	23	27	Chemical"	"[{""token"": ""HTPB"", ""start_span"": 23, ""end_span"": 27, ""type"": ""Chemical""}]"
The antiproliferative and anti - migratory mechanisms of HTPB were investigated by cell proliferation, flow cytometry, DNA ladder, caspase activity, Rho activity, F - actin polymerization, and gelatin - zymography for matrix metalloproteinases ( MMPs).	"HTPB	57	61	Chemical"	"[{""token"": ""HTPB"", ""start_span"": 57, ""end_span"": 61, ""type"": ""Chemical""}]"
Our results indicated that HTPB was a pan - HDAC inhibitor in suppressing cell viability specifically of lung cancer cells but not of the normal lung cells.	"HTPB	27	31	Chemical"	"[{""token"": ""HTPB"", ""start_span"": 27, ""end_span"": 31, ""type"": ""Chemical""}]"
Upon HTPB treatment, cell cycle arrest was induced and subsequently led to mitochondria - mediated apoptosis.	"HTPB	5	9	Chemical"	"[{""token"": ""HTPB"", ""start_span"": 5, ""end_span"": 9, ""type"": ""Chemical""}]"
HTPB disrupted F - actin dynamics via downregulating RhoA activity.	"HTPB	0	4	Chemical"	"[{""token"": ""HTPB"", ""start_span"": 0, ""end_span"": 4, ""type"": ""Chemical""}]"
Moreover, HTPB inhibited activity of MMP2 and MMP9, reduced integrin - beta1 / focal adhesion complex formation and decreased pericellular poly - fibronectin assemblies.	"HTPB	10	14	Chemical"	"[{""token"": ""HTPB"", ""start_span"": 10, ""end_span"": 14, ""type"": ""Chemical""}]"
Finally, intraperitoneal injection or oral administration of HTPB efficiently inhibited A549 xenograft tumor growth in vivo without side effects.	"HTPB	61	65	Chemical"	"[{""token"": ""HTPB"", ""start_span"": 61, ""end_span"": 65, ""type"": ""Chemical""}]"
HTPB delayed lung metastasis of 4T1 mouse breast cancer cells.	"HTPB	0	4	Chemical"	"[{""token"": ""HTPB"", ""start_span"": 0, ""end_span"": 4, ""type"": ""Chemical""}]"
CONCLUSIONS / SIGNIFICANCE: These results suggested that intrinsic apoptotic pathway may involve in anti - tumor growth effects of HTPB in lung cancer cells.	"HTPB	131	135	Chemical"	"[{""token"": ""HTPB"", ""start_span"": 131, ""end_span"": 135, ""type"": ""Chemical""}]"
HTPB significantly suppresses tumor metastasis partly through inhibition of integrin - beta1 / FAK / MMP / RhoA / F - actin pathways.	"HTPB	0	4	Chemical"	"[{""token"": ""HTPB"", ""start_span"": 0, ""end_span"": 4, ""type"": ""Chemical""}]"
We have provided convincing preclinical evidence that HTPB is a potent HDAC targeted inhibitor and is thus a promising candidate for lung cancer chemotherapy.	"HTPB	54	58	Chemical"	"[{""token"": ""HTPB"", ""start_span"": 54, ""end_span"": 58, ""type"": ""Chemical""}]"
From 35 to 100% of the whole amount of ATP resynthesized via glycolysis is utilized for transport purposes.	"ATP	39	42	Chemical"	"[{""token"": ""ATP"", ""start_span"": 39, ""end_span"": 42, ""type"": ""Chemical""}]"
Presumably, glycolysis is one of the regulatory mechanisms of intracellular ratios of monovalent cations.	"cations	97	104	Chemical"	"[{""token"": ""cations"", ""start_span"": 97, ""end_span"": 104, ""type"": ""Chemical""}]"
UK infusion prior to 5 - fluorouracil increased tissue concentration of antitumor agent.	"5 - fluorouracil	21	37	Chemical"	"[{""token"": ""5 - fluorouracil"", ""start_span"": 21, ""end_span"": 37, ""type"": ""Chemical""}]"
Nonidet P - 40 had no effect on glycolysis in cell - free extracts from Ehrlich ascites tumor cells to which soluble mitochondrial ATPase was added.	"Nonidet P - 40	0	14	Chemical"	"[{""token"": ""Nonidet P - 40"", ""start_span"": 0, ""end_span"": 14, ""type"": ""Chemical""}]"
Quercetin increased the efficiency of pumping in EAT cells both in the absence and presence of the detergent.	"Quercetin	0	9	Chemical"	"[{""token"": ""Quercetin"", ""start_span"": 0, ""end_span"": 9, ""type"": ""Chemical""}]"
Differences in polyphosphoinositide metabolism have been reported for ras - transformed cells.	"polyphosphoinositide	15	35	Chemical"	"[{""token"": ""polyphosphoinositide"", ""start_span"": 15, ""end_span"": 35, ""type"": ""Chemical""}]"
Surprisingly, however, further phosphorylation of this protein on addition of phorbol ester was greatly reduced.	"phorbol ester	78	91	Chemical"	"[{""token"": ""phorbol ester"", ""start_span"": 78, ""end_span"": 91, ""type"": ""Chemical""}]"
Glutamine and glucose as energy substrates for Ehrlich ascites tumour cells.	"glucose	14	21	Chemical"	"[{""token"": ""glucose"", ""start_span"": 14, ""end_span"": 21, ""type"": ""Chemical""}]"
Energy metabolism of freshly harvested Ehrlich ascites tumour cells in the presence of 5 mM glucose and / or 0. 5 mM glutamine was studied.	"glucose	92	99	Chemical"	"[{""token"": ""glucose"", ""start_span"": 92, ""end_span"": 99, ""type"": ""Chemical""}]"
In the presence of both glucose and glutamine, the Crabtree effect decreased.	"glucose	24	31	Chemical"	"[{""token"": ""glucose"", ""start_span"": 24, ""end_span"": 31, ""type"": ""Chemical""}]"
Glucose decreased the rate of glutamine utilization by 34%.	"Glucose	0	7	Chemical"	"[{""token"": ""Glucose"", ""start_span"": 0, ""end_span"": 7, ""type"": ""Chemical""}]"
The short - term response of Swiss 3T3 cells to an activator of protein kinase C also appeared to be independent of growth state, since the 50% effective dose for PDBu inhibition of EGF binding to its receptor was approximately 7 nM for both growth conditions.	"PDBu	163	167	Chemical"	"[{""token"": ""PDBu"", ""start_span"": 163, ""end_span"": 167, ""type"": ""Chemical""}]"
In contrast, the response of cells to long - term treatment with PDBu was significantly different depending upon the initial growth state of the cells.	"PDBu	65	69	Chemical"	"[{""token"": ""PDBu"", ""start_span"": 65, ""end_span"": 69, ""type"": ""Chemical""}]"
In both growth states, PDBu caused loss of protein kinase C activity, which reflected a loss in protein mass as determined by immunoblotting with antiserum to protein kinase C.	"PDBu	23	27	Chemical"	"[{""token"": ""PDBu"", ""start_span"": 23, ""end_span"": 27, ""type"": ""Chemical""}]"
Further, the inhibition of EGF binding by tumor promoters following long - term treatment of Swiss 3T3 cells with PDBu also varied with growth state.	"PDBu	114	118	Chemical"	"[{""token"": ""PDBu"", ""start_span"": 114, ""end_span"": 118, ""type"": ""Chemical""}]"
The growth factor was found to reside in mast cell granules and was identified as heparin by sequential purification and enzymatic degradation.	"heparin	82	89	Chemical"	"[{""token"": ""heparin"", ""start_span"": 82, ""end_span"": 89, ""type"": ""Chemical""}]"
The enhancing factors are proteins related to the family of the transforming growth factors ( TGFs) by their molecular weight ( about 20 kd), their heat and acid resistance, and their sensitivity to dithiothreitol.	"dithiothreitol	199	213	Chemical"	"[{""token"": ""dithiothreitol"", ""start_span"": 199, ""end_span"": 213, ""type"": ""Chemical""}]"
Molecular events leading to enhanced glucose transport in Rous sarcoma virus - transformed cells.	"glucose	37	44	Chemical"	"[{""token"": ""glucose"", ""start_span"": 37, ""end_span"": 44, ""type"": ""Chemical""}]"
Transformation by Rous sarcoma virus results in a dramatic increase in the rate at which the transformed cells transport glucose across the cell membrane.	"glucose	121	128	Chemical"	"[{""token"": ""glucose"", ""start_span"": 121, ""end_span"": 128, ""type"": ""Chemical""}]"
The increased rate of glucose transport is dependent on the activity of pp60src, the transforming protein of Rous sarcoma virus.	"glucose	22	29	Chemical"	"[{""token"": ""glucose"", ""start_span"": 22, ""end_span"": 29, ""type"": ""Chemical""}]"
One of these mutants ( CU2) increases the rate of glucose transport only slightly and does not render the infected cells fully anchorage independent or tumorigenic ( although other transformation parameters are fully induced).	"glucose	50	57	Chemical"	"[{""token"": ""glucose"", ""start_span"": 50, ""end_span"": 57, ""type"": ""Chemical""}]"
Analyses of this sort may help to identify the cellular targets of pp60src whose phosphorylation is necessary for the increased glucose transport rate.	"glucose	128	135	Chemical"	"[{""token"": ""glucose"", ""start_span"": 128, ""end_span"": 135, ""type"": ""Chemical""}]"
Treatment of these T - cells with 5 - azacytidine resulted in the induction of DR surface antigen expression, the appearance of DR alpha mRNA, and the partial demethylation of the DR alpha DNA sequences.	"5 - azacytidine	34	49	Chemical"	"[{""token"": ""5 - azacytidine"", ""start_span"": 34, ""end_span"": 49, ""type"": ""Chemical""}]"
Slight variations are caused by drug treatment in tumor - bearing mice as compared with untreated tumor - bearing controls; the pattern of effects of the selective antimetastatic agents does not differ from that of the reference cytotoxic compound used, cyclophosphamide.	"cyclophosphamide	254	270	Chemical"	"[{""token"": ""cyclophosphamide"", ""start_span"": 254, ""end_span"": 270, ""type"": ""Chemical""}]"
In vivo glucose and alanine kinetics were examined by tracer methodology in a sarcoma - bearing rat model.	"glucose	8	15	Chemical"	"[{""token"": ""glucose"", ""start_span"": 8, ""end_span"": 15, ""type"": ""Chemical""}]"
The effects of 3 - mercaptopicolinic acid, a potent inhibitor of gluconeogenesis, was also examined on this model.	"3 - mercaptopicolinic acid	15	41	Chemical"	"[{""token"": ""3 - mercaptopicolinic acid"", ""start_span"": 15, ""end_span"": 41, ""type"": ""Chemical""}]"
In the absence of both GM - CSF and fetal bovine serum ( FBS), 70% of the DNA was fragmented after 3 days in culture, with a characteristic apoptotic ladder - like pattern on agarose gel electrophoresis, whereas this proportion had initially been < 5%.	"agarose	175	182	Chemical"	"[{""token"": ""agarose"", ""start_span"": 175, ""end_span"": 182, ""type"": ""Chemical""}]"
The latter effect persisted even with the late addition of CHX.	"CHX	59	62	Chemical"	"[{""token"": ""CHX"", ""start_span"": 59, ""end_span"": 62, ""type"": ""Chemical""}]"
Effects of doxycycline on in vitro growth, migration, and gelatinase activity of breast carcinoma cells.	"doxycycline	11	22	Chemical"	"[{""token"": ""doxycycline"", ""start_span"": 11, ""end_span"": 22, ""type"": ""Chemical""}]"
Tetracyclines are antimicrobial agents that can suppress MP activity in a variety of tissues, including gingiva, bone, and cartilage.	"Tetracyclines	0	13	Chemical"	"[{""token"": ""Tetracyclines"", ""start_span"": 0, ""end_span"": 13, ""type"": ""Chemical""}]"
Several reports have indicated that tetracyclines can suppress tumor MPs as well.	"tetracyclines	36	49	Chemical"	"[{""token"": ""tetracyclines"", ""start_span"": 36, ""end_span"": 49, ""type"": ""Chemical""}]"
Additionally, doxycycline diminishes the proliferation of this breast cancer cell line and also decreases its gelatinolytic activity, as determined by gel zymography.	"doxycycline	14	25	Chemical"	"[{""token"": ""doxycycline"", ""start_span"": 14, ""end_span"": 25, ""type"": ""Chemical""}]"
The latter phenomenon was accompanied by an increase in the mdr - 1 mRNA expression, cellular glutathione level, and glutathione S - transferase activity.	"glutathione	94	105	Chemical"	"[{""token"": ""glutathione"", ""start_span"": 94, ""end_span"": 105, ""type"": ""Chemical""}]"
When MDV was reactivated by treatment of lymphoblastoid cells with 25 micrograms of iododeoxyuridine per ml, the relative levels of the transcripts decreased.	"iododeoxyuridine	84	100	Chemical"	"[{""token"": ""iododeoxyuridine"", ""start_span"": 84, ""end_span"": 100, ""type"": ""Chemical""}]"
In vivo effects of insulin on tumor and skeletal muscle glucose metabolism in patients with lymphoma.	"glucose	56	63	Chemical"	"[{""token"": ""glucose"", ""start_span"": 56, ""end_span"": 63, ""type"": ""Chemical""}]"
The dynamic uptake of the glucose analogue [ 18F] FDG was measured in diseased nodes and upper arm skeletal muscle in both metabolic states.	"glucose	26	33	Chemical"	"[{""token"": ""glucose"", ""start_span"": 26, ""end_span"": 33, ""type"": ""Chemical""}]"
The [ 18F] FDG uptake in muscle and the whole body glucose use during euglycemic hyperinsulinemic clamp were compared with those of weight - matched healthy subjects studied under similar circumstances.	"glucose	51	58	Chemical"	"[{""token"": ""glucose"", ""start_span"": 51, ""end_span"": 58, ""type"": ""Chemical""}]"
RESULTS: In lymphomatous tissue, [ 18F] FDG uptake rates were similar in overnight fasting and euglycemic hyperinsulinemic clamp ( 38 + / - 10 versus 41 + / - 9 mumol / 100 g / minute, not significant), whereas glucose uptake in skeletal muscle was increased by insulin ( 1. 7 + / - 0. 2 versus 3. 8 + / - 0. 5 mumol / 100 g / minute, P = 0. 012).	"glucose	211	218	Chemical"	"[{""token"": ""glucose"", ""start_span"": 211, ""end_span"": 218, ""type"": ""Chemical""}]"
Both basal ( 2. 3 + / - 0. 2 mumol / 100 g / minute, P = 0. 061) and insulin - stimulated ( 8. 5 + / - 1. 9 mumol / 100 g / minute, P = 0. 055) skeletal arm muscle glucose uptake rates were higher in control subjects than in patients.	"glucose	164	171	Chemical"	"[{""token"": ""glucose"", ""start_span"": 164, ""end_span"": 171, ""type"": ""Chemical""}]"
Whole body glucose use was 55% lower in patients than in control subjects ( 17 + / - 3 mumol / kg / minute versus 38 + / - 3 mumol / kg / minute, P = 0. 002), consistent with insulin resistance in cancer.	"glucose	11	18	Chemical"	"[{""token"": ""glucose"", ""start_span"": 11, ""end_span"": 18, ""type"": ""Chemical""}]"
CONCLUSIONS: We found that insulin does not induce major changes in glucose uptake of lymphomatous tissue.	"glucose	68	75	Chemical"	"[{""token"": ""glucose"", ""start_span"": 68, ""end_span"": 75, ""type"": ""Chemical""}]"
Although insulin sensitivity of skeletal muscle was also reduced in patients with lymphoma, the net insulin effect may counteract imbalance between glucose uptake of tumor and muscle, offering a potential means to circumvent at least some metabolic abnormalities found in cancer.	"glucose	148	155	Chemical"	"[{""token"": ""glucose"", ""start_span"": 148, ""end_span"": 155, ""type"": ""Chemical""}]"
Effect of 1 - alkylpyrrolidine N - oxides on energy metabolism of cancer cells.	"1 - alkylpyrrolidine N - oxides	10	41	Chemical"	"[{""token"": ""1 - alkylpyrrolidine N - oxides"", ""start_span"": 10, ""end_span"": 41, ""type"": ""Chemical""}]"
