Briefly, sciatic nerves were removed and incubated for 7 days in the pre - treatment medium, which consisted of D - MEM ( high glucose) supplemented with 10% FCS, 50 mg / ml gentamicin ( Invitrogen Corp.), 2. 5 mu g / ml fungizone ( Invitrogen Corp.), 2 mu M forskolin ( EMD Biosciences Inc.) and 10 ng / ml recombinant heregulin - beta1 ( R & D Systems).	"glucose	127	134	Chemical"	"forskolin	259	268	Chemical"	"[{""token"": ""glucose"", ""start_span"": 127, ""end_span"": 134, ""type"": ""Chemical""}, {""token"": ""forskolin"", ""start_span"": 259, ""end_span"": 268, ""type"": ""Chemical""}]"
The spinal cord and other nerve blocks were washed and postfixed with 2% osmium tetroxide, and were dehydrated in ethanol and equilibrated in Epon.	"osmium	73	79	Chemical"	"ethanol	114	121	Chemical"	"[{""token"": ""osmium"", ""start_span"": 73, ""end_span"": 79, ""type"": ""Chemical""}, {""token"": ""ethanol"", ""start_span"": 114, ""end_span"": 121, ""type"": ""Chemical""}]"
To determine the ADAM22 mRNA distribution, in situ hybridisation analysis using 35S - labeled probe was performed.	"mRNA	24	28	Chemical"	"35S	80	83	Chemical"	"[{""token"": ""mRNA"", ""start_span"": 24, ""end_span"": 28, ""type"": ""Chemical""}, {""token"": ""35S"", ""start_span"": 80, ""end_span"": 83, ""type"": ""Chemical""}]"
Nutritional problems can persist even with adequate oral enzyme supplementation [ 9] and neutralization of gastric acid to improve lipase function [ 10], and may involve both impaired digestion and absorption of nutrients [ 11].	"acid	115	119	Chemical"	"nutrients	212	221	Chemical"	"[{""token"": ""acid"", ""start_span"": 115, ""end_span"": 119, ""type"": ""Chemical""}, {""token"": ""nutrients"", ""start_span"": 212, ""end_span"": 221, ""type"": ""Chemical""}]"
In one study using CF mice on different genetic backgrounds, a region on mouse chromosome 7 was shown to ameliorate intestinal blockage and the effect was in part due to a calcium - regulated Cl - channel which compensated for loss of CFTR function [ 16, 17].	"calcium	172	179	Chemical"	"Cl	192	194	Chemical"	"[{""token"": ""calcium"", ""start_span"": 172, ""end_span"": 179, ""type"": ""Chemical""}, {""token"": ""Cl"", ""start_span"": 192, ""end_span"": 194, ""type"": ""Chemical""}]"
The small intestine was flushed with phosphate buffered saline and immersion fixed overnight in 4% paraformaldehyde.	"phosphate	37	46	Chemical"	"buffered	47	55	Chemical"	"[{""token"": ""phosphate"", ""start_span"": 37, ""end_span"": 46, ""type"": ""Chemical""}, {""token"": ""buffered"", ""start_span"": 47, ""end_span"": 55, ""type"": ""Chemical""}]"
Tas2rs at this locus display in total 307 coding region single nucleotide polymorphisms ( SNPs) between the two BXD / Ty RI parental strains, C57BL / 6J ( quinine - sensitive) and DBA / 2J ( quinine insensitive); approximately 50% of these mutations are silent.	"quinine	155	162	Chemical"	"quinine	191	198	Chemical"	"[{""token"": ""quinine"", ""start_span"": 155, ""end_span"": 162, ""type"": ""Chemical""}, {""token"": ""quinine"", ""start_span"": 191, ""end_span"": 198, ""type"": ""Chemical""}]"
These studies, the first using a taste - salient assay to map the major QTL for quinine taste, indicate that a T2R - dependent transduction cascade is responsible for the majority of strain variance in quinine taste sensitivity.	"quinine	80	87	Chemical"	"quinine	202	209	Chemical"	"[{""token"": ""quinine"", ""start_span"": 80, ""end_span"": 87, ""type"": ""Chemical""}, {""token"": ""quinine"", ""start_span"": 202, ""end_span"": 209, ""type"": ""Chemical""}]"
The Tas2rs are found in two subclusters on either side of the polymorphic marker D6Mit13 ( red) and two genes encoding proline - rich salivary proteins ( Prp2 and Prh1; red).	"proline	119	126	Chemical"	"proteins	143	151	Chemical"	"[{""token"": ""proline"", ""start_span"": 119, ""end_span"": 126, ""type"": ""Chemical""}, {""token"": ""proteins"", ""start_span"": 143, ""end_span"": 151, ""type"": ""Chemical""}]"
If one ( or more) Tas2rs underlie the chromosome 6 QHCl taste sensitivity QTL, we would predict that one ( or more) Tas2r genes would exhibit one of three likely characteristics: ( 1) A Tas2r allele is a pseudogene, or is deleted, in D2 ( QHCL - insensitive), but not B6 ( QHCl - sensitive), mice; ( 2) Missense mutations in the single coding exon of a D2 Tas2r allele impact protein functions such as ligand binding or receptor coupling to downstream signaling cascades; ( 3) Mutations in noncoding or regulatory regions of a D2 Tas2r allele affects expression of the protein product.	"protein	376	383	Chemical"	"protein product	569	584	Chemical"	"[{""token"": ""protein"", ""start_span"": 376, ""end_span"": 383, ""type"": ""Chemical""}, {""token"": ""protein product"", ""start_span"": 569, ""end_span"": 584, ""type"": ""Chemical""}]"
Although polymorphic residues between B6 and D2 Tas2rs are found in all regions of the receptors, 23% of the amino acid changes seen are within the first two extracellular loops of the T2Rs ( data not shown).	"residues	21	29	Chemical"	"amino acid	109	119	Chemical"	"[{""token"": ""residues"", ""start_span"": 21, ""end_span"": 29, ""type"": ""Chemical""}, {""token"": ""amino acid"", ""start_span"": 109, ""end_span"": 119, ""type"": ""Chemical""}]"
The gustatory system of mammals is thought to detect thousands of chemically - diverse bitter - tasting substances [ 41].	"chemically	66	76	Chemical"	"substances	104	114	Chemical"	"[{""token"": ""chemically"", ""start_span"": 66, ""end_span"": 76, ""type"": ""Chemical""}, {""token"": ""substances"", ""start_span"": 104, ""end_span"": 114, ""type"": ""Chemical""}]"
As of yet there is no evidence for quinine activation of T2Rs from functional assays of these receptors in heterologous cells or membrane preparations, likely due to the lipophilic nature of quinine [ 23].	"quinine	35	42	Chemical"	"quinine	191	198	Chemical"	"[{""token"": ""quinine"", ""start_span"": 35, ""end_span"": 42, ""type"": ""Chemical""}, {""token"": ""quinine"", ""start_span"": 191, ""end_span"": 198, ""type"": ""Chemical""}]"
For example, a QTL for PROP avoidance has been suggested on chromosome 7 [ 16], and we observe a suggestive QTL for quinine taste on chromosome 8 ( Figure 2); in neither case are Tas2rs found at these loci ( data not shown).	"PROP	23	27	Chemical"	"quinine	116	123	Chemical"	"[{""token"": ""PROP"", ""start_span"": 23, ""end_span"": 27, ""type"": ""Chemical""}, {""token"": ""quinine"", ""start_span"": 116, ""end_span"": 123, ""type"": ""Chemical""}]"
In conclusion, we have found that sensitivity to the bitter - tasting substance quinine, as assayed by a taste specific brief - access test, is a polygenic trait in mice.	"substance	70	79	Chemical"	"quinine	80	87	Chemical"	"[{""token"": ""substance"", ""start_span"": 70, ""end_span"": 79, ""type"": ""Chemical""}, {""token"": ""quinine"", ""start_span"": 80, ""end_span"": 87, ""type"": ""Chemical""}]"
Briefly, after 24 hours of water deprivation, na i ve mice are given a single 20 - minute trial consisting of access to a single bottle of distilled water ( sipper tube training).	"water	27	32	Chemical"	"water	149	154	Chemical"	"[{""token"": ""water"", ""start_span"": 27, ""end_span"": 32, ""type"": ""Chemical""}, {""token"": ""water"", ""start_span"": 149, ""end_span"": 154, ""type"": ""Chemical""}]"
Mice were tested with 2 concentrations each of 4 different taste stimuli [ 1 and 3 mM QHCl, 1 and 3 mM DB, 3 and 10 mM PROP ( unpublished data), and 0. 01 and 0. 1 M sucrose].	"PROP	119	123	Chemical"	"sucrose	166	173	Chemical"	"[{""token"": ""PROP"", ""start_span"": 119, ""end_span"": 123, ""type"": ""Chemical""}, {""token"": ""sucrose"", ""start_span"": 166, ""end_span"": 173, ""type"": ""Chemical""}]"
"This was done to encourage sampling on "" non - water "" trials, as there is some evidence that mice detect distilled vs. adulterated water in brief - access taste tests based on olfactory clues; there is no evidence that mice can detect or distinguish among concentrations of a particular stimulus [ 37]."	"water	47	52	Chemical"	"water	132	137	Chemical"	"[{""token"": ""water"", ""start_span"": 47, ""end_span"": 52, ""type"": ""Chemical""}, {""token"": ""water"", ""start_span"": 132, ""end_span"": 137, ""type"": ""Chemical""}]"
A screen for proteins that interact with PAX6: C - terminal mutations disrupt interaction with HOMER3, DNCL1 and TRIM11	"proteins	13	21	Chemical"	"C	47	48	Chemical"	"[{""token"": ""proteins"", ""start_span"": 13, ""end_span"": 21, ""type"": ""Chemical""}, {""token"": ""C"", ""start_span"": 47, ""end_span"": 48, ""type"": ""Chemical""}]"
Little is known about the interactions of PAX6 with other proteins, so we carried out a systematic screen for proteins that interact with PAX6.	"proteins	58	66	Chemical"	"proteins	110	118	Chemical"	"[{""token"": ""proteins"", ""start_span"": 58, ""end_span"": 66, ""type"": ""Chemical""}, {""token"": ""proteins"", ""start_span"": 110, ""end_span"": 118, ""type"": ""Chemical""}]"
We used bioinformatics techniques to characterise a highly conserved peptide at the C - terminus of the PAX6 protein.	"C	84	85	Chemical"	"protein	109	116	Chemical"	"[{""token"": ""C"", ""start_span"": 84, ""end_span"": 85, ""type"": ""Chemical""}, {""token"": ""protein"", ""start_span"": 109, ""end_span"": 116, ""type"": ""Chemical""}]"
We propose that the interaction of PAX6 with HOMER3 and DNCL1 is a mechanism by which synaptic activation could lead to changes in neuronal transcriptional activity, and that some of the neural anomalies in patients with PAX6 mutations could be explained by impaired protein - protein interactions.	"protein	267	274	Chemical"	"protein	277	284	Chemical"	"[{""token"": ""protein"", ""start_span"": 267, ""end_span"": 274, ""type"": ""Chemical""}, {""token"": ""protein"", ""start_span"": 277, ""end_span"": 284, ""type"": ""Chemical""}]"
The defining feature of all PAX proteins is the presence of a 128 amino acid DNA - binding paired domain that has been highly conserved over evolution [ 1].	"proteins	32	40	Chemical"	"amino acid	66	76	Chemical"	"[{""token"": ""proteins"", ""start_span"": 32, ""end_span"": 40, ""type"": ""Chemical""}, {""token"": ""amino acid"", ""start_span"": 66, ""end_span"": 76, ""type"": ""Chemical""}]"
The PST domain, which encompasses the C - terminal 145 amino acids of PAX6, has been shown to act as a transcriptional activator [ 6].	"C	38	39	Chemical"	"amino acids	55	66	Chemical"	"[{""token"": ""C"", ""start_span"": 38, ""end_span"": 39, ""type"": ""Chemical""}, {""token"": ""amino acids"", ""start_span"": 55, ""end_span"": 66, ""type"": ""Chemical""}]"
The interaction between PAX6 and these proteins was disrupted by naturally occurring C - terminal PAX6 mutations.	"proteins	39	47	Chemical"	"C	85	86	Chemical"	"[{""token"": ""proteins"", ""start_span"": 39, ""end_span"": 47, ""type"": ""Chemical""}, {""token"": ""C"", ""start_span"": 85, ""end_span"": 86, ""type"": ""Chemical""}]"
We and others [ 31 - 33] noted that there is significant sequence conservation at the C - terminal end of the PAX6 protein.	"C	86	87	Chemical"	"protein	115	122	Chemical"	"[{""token"": ""C"", ""start_span"": 86, ""end_span"": 87, ""type"": ""Chemical""}, {""token"": ""protein"", ""start_span"": 115, ""end_span"": 122, ""type"": ""Chemical""}]"
( c) When 4 residues are added in the N - terminal direction, 2 beta sheets are now predicted.	"residues	12	20	Chemical"	"N	38	39	Chemical"	"[{""token"": ""residues"", ""start_span"": 12, ""end_span"": 20, ""type"": ""Chemical""}, {""token"": ""N"", ""start_span"": 38, ""end_span"": 39, ""type"": ""Chemical""}]"
Given the fact that the amino acid sequence of the PAX6 protein is identical in man and mouse, we reasoned that a mouse brain library would yield relevant interactors.	"amino acid	24	34	Chemical"	"protein	56	63	Chemical"	"[{""token"": ""amino acid"", ""start_span"": 24, ""end_span"": 34, ""type"": ""Chemical""}, {""token"": ""protein"", ""start_span"": 56, ""end_span"": 63, ""type"": ""Chemical""}]"
DNCL1 is a subunit of two motor protein complexes, dynein and myosin - Va, both of which are involved in intracellular trafficking of proteins and organelles in neurons [ 36, 37].	"protein	32	39	Chemical"	"proteins	134	142	Chemical"	"[{""token"": ""protein"", ""start_span"": 32, ""end_span"": 39, ""type"": ""Chemical""}, {""token"": ""proteins"", ""start_span"": 134, ""end_span"": 142, ""type"": ""Chemical""}]"
TRIM11 is a member of the tripartite motif protein family and contains a RING finger, a B - box zinc finger, a coiled coil domain and a B30. 2 domain [ 38].	"protein	43	50	Chemical"	"zinc	96	100	Chemical"	"[{""token"": ""protein"", ""start_span"": 43, ""end_span"": 50, ""type"": ""Chemical""}, {""token"": ""zinc"", ""start_span"": 96, ""end_span"": 100, ""type"": ""Chemical""}]"
This is consistent with the idea that they were pulled out because the encoded proteins interact specifically with the C - terminal peptide or PST domain of PAX6.	"proteins	79	87	Chemical"	"C	119	120	Chemical"	"[{""token"": ""proteins"", ""start_span"": 79, ""end_span"": 87, ""type"": ""Chemical""}, {""token"": ""C"", ""start_span"": 119, ""end_span"": 120, ""type"": ""Chemical""}]"
This suggests that HOMER3 and DNCL1 interact specifically with the C - terminal peptide while TRIM11 interacts with a more N - terminal part of the PST domain.	"C	32	33	Chemical"	"N	123	124	Chemical"	"[{""token"": ""C"", ""start_span"": 32, ""end_span"": 33, ""type"": ""Chemical""}, {""token"": ""N"", ""start_span"": 123, ""end_span"": 124, ""type"": ""Chemical""}]"
The Dncl1 and Trim11 clones that were pulled out of the library were full - length, but the Homer3 cDNAs lacked the N - terminal 70 amino acids.	"N	101	102	Chemical"	"amino acids	132	143	Chemical"	"[{""token"": ""N"", ""start_span"": 101, ""end_span"": 102, ""type"": ""Chemical""}, {""token"": ""amino acids"", ""start_span"": 132, ""end_span"": 143, ""type"": ""Chemical""}]"
Occasionally, partial suppression of growth on plates containing 5 - fluoro - orotic acid was observed, indicating low - level activation of the URA3 reporter; however HIS3 and LacZ activation were not observed.	"fluoro	69	75	Chemical"	"orotic acid	78	89	Chemical"	"[{""token"": ""fluoro"", ""start_span"": 69, ""end_span"": 75, ""type"": ""Chemical""}, {""token"": ""orotic acid"", ""start_span"": 78, ""end_span"": 89, ""type"": ""Chemical""}]"
However we were able to confirm that the C - terminal peptide is important for the interaction with HOMER3 and DNCL1 because interaction with the PAX6PST - CT construct, which lacks the final 32 amino acids, was completely abolished ( Figure 3, Table 1).	"C	41	42	Chemical"	"amino acids	195	206	Chemical"	"[{""token"": ""C"", ""start_span"": 41, ""end_span"": 42, ""type"": ""Chemical""}, {""token"": ""amino acids"", ""start_span"": 195, ""end_span"": 206, ""type"": ""Chemical""}]"
This is consistent with the library screens in which TRIM11 was isolated with the PST domain but not with the C - terminal peptide and supports the idea that the C - terminal peptide is not important for the interaction between PAX6 and TRIM11.	"C	110	111	Chemical"	"C	162	163	Chemical"	"[{""token"": ""C"", ""start_span"": 110, ""end_span"": 111, ""type"": ""Chemical""}, {""token"": ""C"", ""start_span"": 162, ""end_span"": 163, ""type"": ""Chemical""}]"
' Truncated HOMER3 ' is HOMER3 lacking the N - terminal 70 amino acids.	"N	43	44	Chemical"	"amino acids	59	70	Chemical"	"[{""token"": ""N"", ""start_span"": 43, ""end_span"": 44, ""type"": ""Chemical""}, {""token"": ""amino acids"", ""start_span"": 59, ""end_span"": 70, ""type"": ""Chemical""}]"
PAX6PST, PAX6 PST domain; PAX6CTP, PAX6 C - terminal peptide; PAX6PST - CT, PAX6 PST domain minus the C - terminal peptide; PAX6PST / Q422R, PAX6 PST domain with the Q422R mutation; PAX6PST / X423L, PAX6 PST domain with the X423L mutation, PAX6PST / 1615del, PAX6 PST domain with the 1615 del10 mutation.	"C	30	31	Chemical"	"C	40	41	Chemical"	"[{""token"": ""C"", ""start_span"": 30, ""end_span"": 31, ""type"": ""Chemical""}, {""token"": ""C"", ""start_span"": 40, ""end_span"": 41, ""type"": ""Chemical""}]"
HOMER3 - FL, HOMER3 full - length clone; HOMER3 - Tr, truncated HOMER3 clone lacking the N - terminal 70 amino acids.	"N	89	90	Chemical"	"amino acids	105	116	Chemical"	"[{""token"": ""N"", ""start_span"": 89, ""end_span"": 90, ""type"": ""Chemical""}, {""token"": ""amino acids"", ""start_span"": 105, ""end_span"": 116, ""type"": ""Chemical""}]"
The first mutation is a single nucleotide substitution 1627A > G that causes a glutamine to arginine amino acid substitution in the last codon of PAX6.	"G	63	64	Chemical"	"glutamine to arginine amino acid	79	111	Chemical"	"[{""token"": ""G"", ""start_span"": 63, ""end_span"": 64, ""type"": ""Chemical""}, {""token"": ""glutamine to arginine amino acid"", ""start_span"": 79, ""end_span"": 111, ""type"": ""Chemical""}]"
We performed yeast two - hybrid library screens with the C - terminal peptide and the whole PST domain and we identified three novel interacting proteins, HOMER3, DNCL1 and TRIM11.	"C	57	58	Chemical"	"proteins	145	153	Chemical"	"[{""token"": ""C"", ""start_span"": 57, ""end_span"": 58, ""type"": ""Chemical""}, {""token"": ""proteins"", ""start_span"": 145, ""end_span"": 153, ""type"": ""Chemical""}]"
HOMER3 is found in the PSD of neurons and directly binds to type I metabotropic glutamate receptors, which act via phospholipase C to stimulate IP3 - mediated release of Ca2 + from intracellular vesicles [ 35, 39].	"glutamate	80	89	Chemical"	"Ca2 +	170	175	Chemical"	"[{""token"": ""glutamate"", ""start_span"": 80, ""end_span"": 89, ""type"": ""Chemical""}, {""token"": ""Ca2 +"", ""start_span"": 170, ""end_span"": 175, ""type"": ""Chemical""}]"
HOMER3 is a member of the HOMER family of proteins that are constitutively expressed in the brain and play a role in post - synaptic signalling and receptor trafficking by forming multivalent links with various receptors and PSD scaffolding proteins [ 35, 39 - 41].	"proteins	42	50	Chemical"	"proteins	241	249	Chemical"	"[{""token"": ""proteins"", ""start_span"": 42, ""end_span"": 50, ""type"": ""Chemical""}, {""token"": ""proteins"", ""start_span"": 241, ""end_span"": 249, ""type"": ""Chemical""}]"
Since TRIM11 is implicated in protein degradation [ 46], it may play a role in PAX6 protein turnover.	"protein	30	37	Chemical"	"protein	84	91	Chemical"	"[{""token"": ""protein"", ""start_span"": 30, ""end_span"": 37, ""type"": ""Chemical""}, {""token"": ""protein"", ""start_span"": 84, ""end_span"": 91, ""type"": ""Chemical""}]"
The 1615del10 mutation also removes the last 5 amino acids of the C - terminal peptide [ 28].	"amino acids	47	58	Chemical"	"C	66	67	Chemical"	"[{""token"": ""amino acids"", ""start_span"": 47, ""end_span"": 58, ""type"": ""Chemical""}, {""token"": ""C"", ""start_span"": 66, ""end_span"": 67, ""type"": ""Chemical""}]"
All our data are consistent with the hypothesis that TRIM11 does not interact with the C - terminal peptide, but interacts with the PST domain between the homeodomain and the C - terminal peptide.	"C	87	88	Chemical"	"C	175	176	Chemical"	"[{""token"": ""C"", ""start_span"": 87, ""end_span"": 88, ""type"": ""Chemical""}, {""token"": ""C"", ""start_span"": 175, ""end_span"": 176, ""type"": ""Chemical""}]"
These alleles would be expected to encode truncated proteins or no protein at all if the mutant RNA is degraded by nonsense - mediated decay [ 52].	"proteins	52	60	Chemical"	"protein	67	74	Chemical"	"[{""token"": ""proteins"", ""start_span"": 52, ""end_span"": 60, ""type"": ""Chemical""}, {""token"": ""protein"", ""start_span"": 67, ""end_span"": 74, ""type"": ""Chemical""}]"
There is evidence that signalling and transport mechanisms that were initially characterized in the brain may also be conserved in the retina, suggesting that impaired PAX6 protein - protein interactions may also have implications for the retinal defects observed in individuals with PAX6 mutations [ 53, 54].	"protein	173	180	Chemical"	"protein	183	190	Chemical"	"[{""token"": ""protein"", ""start_span"": 173, ""end_span"": 180, ""type"": ""Chemical""}, {""token"": ""protein"", ""start_span"": 183, ""end_span"": 190, ""type"": ""Chemical""}]"
We also propose that some of the neural anomalies in patients with PAX6 mutations may be explained by impaired protein - protein interactions.	"protein	111	118	Chemical"	"protein	121	128	Chemical"	"[{""token"": ""protein"", ""start_span"": 111, ""end_span"": 118, ""type"": ""Chemical""}, {""token"": ""protein"", ""start_span"": 121, ""end_span"": 128, ""type"": ""Chemical""}]"
Protein sequences that were highly homologous to the C - terminus of human PAX6 were aligned using CLUSTAL [ 24].	"Protein	0	7	Chemical"	"C	53	54	Chemical"	"[{""token"": ""Protein"", ""start_span"": 0, ""end_span"": 7, ""type"": ""Chemical""}, {""token"": ""C"", ""start_span"": 53, ""end_span"": 54, ""type"": ""Chemical""}]"
All cDNA and amino acid numbering is based on the human PAX6 cDNA and protein reference sequences available from the Human PAX6 Allelic Variant Database web site [ 27].	"amino acid	13	23	Chemical"	"protein	70	77	Chemical"	"[{""token"": ""amino acid"", ""start_span"": 13, ""end_span"": 23, ""type"": ""Chemical""}, {""token"": ""protein"", ""start_span"": 70, ""end_span"": 77, ""type"": ""Chemical""}]"
PAX6PST contains the whole PST domain ( amino acids 278 - 422 of the full - length PAX6 protein).	"amino acids	40	51	Chemical"	"protein	88	95	Chemical"	"[{""token"": ""amino acids"", ""start_span"": 40, ""end_span"": 51, ""type"": ""Chemical""}, {""token"": ""protein"", ""start_span"": 88, ""end_span"": 95, ""type"": ""Chemical""}]"
Reporters are activated when the bait protein fused to the GAL4 DNA binding domain ( pDBLeu) interacts with the prey protein fused to the GAL4 activation domain ( pPC86), thus reconstituting GAL4 function.	"protein	38	45	Chemical"	"protein	117	124	Chemical"	"[{""token"": ""protein"", ""start_span"": 38, ""end_span"": 45, ""type"": ""Chemical""}, {""token"": ""protein"", ""start_span"": 117, ""end_span"": 124, ""type"": ""Chemical""}]"
To create a full - length Homer3 clone for pairwise tests, a cDNA clone ( IMAGE clone 3602414, accession number BE569374) containing the missing N - terminal 70 amino acids was identified by a BLAST search of the EST nucleotide sequence database and obtained from the Rosalind Franklin Centre for Genomics Research.	"N	63	64	Chemical"	"amino acids	161	172	Chemical"	"[{""token"": ""N"", ""start_span"": 63, ""end_span"": 64, ""type"": ""Chemical""}, {""token"": ""amino acids"", ""start_span"": 161, ""end_span"": 172, ""type"": ""Chemical""}]"
Medium - chain acyl - CoA dehydrogenase ( MCAD) deficiency is the most common inherited disorder of mitochondrial fatty acid beta - oxidation in humans.	"acyl - CoA	15	25	Chemical"	"fatty acid	114	124	Chemical"	"[{""token"": ""acyl - CoA"", ""start_span"": 15, ""end_span"": 25, ""type"": ""Chemical""}, {""token"": ""fatty acid"", ""start_span"": 114, ""end_span"": 124, ""type"": ""Chemical""}]"
The MCAD - deficient mouse reproduced important aspects of human MCAD deficiency and is a valuable model for further analysis of the roles of fatty acid oxidation and pathogenesis of human diseases involving fatty acid oxidation.	"fatty acid	142	152	Chemical"	"fatty acid	208	218	Chemical"	"[{""token"": ""fatty acid"", ""start_span"": 142, ""end_span"": 152, ""type"": ""Chemical""}, {""token"": ""fatty acid"", ""start_span"": 208, ""end_span"": 218, ""type"": ""Chemical""}]"
As a control analysis, anti - short - chain acyl - CoA dehydrogenase ( SCAD) antisera revealed no differences in levels of expression of SCAD protein between MCAD + / + and MCAD - / - mice ( Figure 3).	"acyl - CoA	44	54	Chemical"	"protein	142	149	Chemical"	"[{""token"": ""acyl - CoA"", ""start_span"": 44, ""end_span"": 54, ""type"": ""Chemical""}, {""token"": ""protein"", ""start_span"": 142, ""end_span"": 149, ""type"": ""Chemical""}]"
MCAD protein is only detectable under the MCAD protein - spiked ( positive control) lane.	"protein	5	12	Chemical"	"protein	47	54	Chemical"	"[{""token"": ""protein"", ""start_span"": 5, ""end_span"": 12, ""type"": ""Chemical""}, {""token"": ""protein"", ""start_span"": 47, ""end_span"": 54, ""type"": ""Chemical""}]"
MCAD - / - mice had a significant reduction in ability to dehydrogenate octanoyl - CoA and a modest reduction in activity toward palmitoyl - CoA compared to MCAD + / + mice ( Table 1).	"octanoyl - CoA	72	86	Chemical"	"palmitoyl - CoA	129	144	Chemical"	"[{""token"": ""octanoyl - CoA"", ""start_span"": 72, ""end_span"": 86, ""type"": ""Chemical""}, {""token"": ""palmitoyl - CoA"", ""start_span"": 129, ""end_span"": 144, ""type"": ""Chemical""}]"
Specifically, the dehydrogenation of octanoyl - CoA and palmitoyl - CoA substrates were reduced by 75% and by 30%, respectively, in MCAD - / - mice as compared to MCAD + / + controls.	"octanoyl - CoA	37	51	Chemical"	"palmitoyl - CoA	56	71	Chemical"	"[{""token"": ""octanoyl - CoA"", ""start_span"": 37, ""end_span"": 51, ""type"": ""Chemical""}, {""token"": ""palmitoyl - CoA"", ""start_span"": 56, ""end_span"": 71, ""type"": ""Chemical""}]"
MCAD - / - mice displayed lower serum glucose and elevated serum free fatty acid levels although neither result was significant, as compared to MCAD + / + mice ( Table 1).	"glucose	38	45	Chemical"	"fatty acid	70	80	Chemical"	"[{""token"": ""glucose"", ""start_span"": 38, ""end_span"": 45, ""type"": ""Chemical""}, {""token"": ""fatty acid"", ""start_span"": 70, ""end_span"": 80, ""type"": ""Chemical""}]"
Organic Acid and Acylcarnitine Analysis	"Acid	8	12	Chemical"	"Acylcarnitine	17	30	Chemical"	"[{""token"": ""Acid"", ""start_span"": 8, ""end_span"": 12, ""type"": ""Chemical""}, {""token"": ""Acylcarnitine"", ""start_span"": 17, ""end_span"": 30, ""type"": ""Chemical""}]"
