Glucose tolerance testing of 2 - mo - old male and female mice revealed no significant difference in blood glucose excursion between PGC - 1 alpha + / + and PGC - 1 alpha - / - groups ( unpublished data).	"Glucose	0	7	Chemical"	"glucose	107	114	Chemical"	"[{""token"": ""Glucose"", ""start_span"": 0, ""end_span"": 7, ""type"": ""Chemical""}, {""token"": ""glucose"", ""start_span"": 107, ""end_span"": 114, ""type"": ""Chemical""}]"
Given that older female PGC - 1 alpha - / - mice develop an increase in body fat stores, glucose tolerance and insulin responsiveness were further evaluated in this group.	"glucose	89	96	Chemical"	"insulin	111	118	Chemical"	"[{""token"": ""glucose"", ""start_span"": 89, ""end_span"": 96, ""type"": ""Chemical""}, {""token"": ""insulin"", ""start_span"": 111, ""end_span"": 118, ""type"": ""Chemical""}]"
To examine glucose homeostasis in response to high - fat diet, female PGC - 1 alpha + / + and PGC - 1 alpha - / - mice were placed on high - fat chow ( 43% calories from fat) for 6 wk starting at 8 wk of age.	"glucose	11	18	Chemical"	"chow	145	149	Chemical"	"[{""token"": ""glucose"", ""start_span"": 11, ""end_span"": 18, ""type"": ""Chemical""}, {""token"": ""chow"", ""start_span"": 145, ""end_span"": 149, ""type"": ""Chemical""}]"
Surprisingly, the PGC - 1 alpha - / - mice on a high - fat diet were significantly more glucose - tolerant and insulin - sensitive compared to the PGC - 1 alpha + / + mice ( Figure 9B).	"glucose	88	95	Chemical"	"insulin	111	118	Chemical"	"[{""token"": ""glucose"", ""start_span"": 88, ""end_span"": 95, ""type"": ""Chemical""}, {""token"": ""insulin"", ""start_span"": 111, ""end_span"": 118, ""type"": ""Chemical""}]"
Moreover, the PGC - 1 alpha - / - mice are more glucose - tolerant and insulin - sensitive than WT mice on a high - fat diet.	"glucose	48	55	Chemical"	"insulin	71	78	Chemical"	"[{""token"": ""glucose"", ""start_span"": 48, ""end_span"": 55, ""type"": ""Chemical""}, {""token"": ""insulin"", ""start_span"": 71, ""end_span"": 78, ""type"": ""Chemical""}]"
Immunolocalization of an astrocytic marker, glial fibrillary acidic protein, failed to show an increase in numbers of astrocytic processes in PGC - 1 alpha - / - mouse cerebral cortex ( unpublished data).	"acidic	61	67	Chemical"	"protein	68	75	Chemical"	"[{""token"": ""acidic"", ""start_span"": 61, ""end_span"": 67, ""type"": ""Chemical""}, {""token"": ""protein"", ""start_span"": 68, ""end_span"": 75, ""type"": ""Chemical""}]"
Microvacuolation of the neuropil and neurons of the PGC - 1 alpha - / - basal ganglia ( caudate and putamen) was also noted in association with a patchy increase in the number and intensity of glial fibrillary acidic protein - immunoreactive astrocytic processes ( unpublished data).	"acidic	210	216	Chemical"	"protein	217	224	Chemical"	"[{""token"": ""acidic"", ""start_span"": 210, ""end_span"": 216, ""type"": ""Chemical""}, {""token"": ""protein"", ""start_span"": 217, ""end_span"": 224, ""type"": ""Chemical""}]"
Previous studies using gain - of - function strategies have shown that the coactivator PGC - 1 alpha is capable of coactivating an array of transcription factors involved in energy metabolic processes including fatty acid oxidation, electron transport, and oxidative phosphorylation [ 6].	"fatty acid	211	221	Chemical"	"electron	233	241	Chemical"	"[{""token"": ""fatty acid"", ""start_span"": 211, ""end_span"": 221, ""type"": ""Chemical""}, {""token"": ""electron"", ""start_span"": 233, ""end_span"": 241, ""type"": ""Chemical""}]"
Studies with a beta 3 - adrenergic agonist confirmed that the peak oxygen consumption rate in thermogenic tissue is diminished in PGC - 1 alpha - / - mice.	"adrenergic agonist	24	42	Chemical"	"oxygen	67	73	Chemical"	"[{""token"": ""adrenergic agonist"", ""start_span"": 24, ""end_span"": 42, ""type"": ""Chemical""}, {""token"": ""oxygen"", ""start_span"": 67, ""end_span"": 73, ""type"": ""Chemical""}]"
Further analysis revealed that palmitate oxidation rates were reduced in hepatocytes isolated from the PGC - 1 alpha - / - mice, which would predispose to lipid accumulation.	"palmitate	31	40	Chemical"	"lipid	155	160	Chemical"	"[{""token"": ""palmitate"", ""start_span"": 31, ""end_span"": 40, ""type"": ""Chemical""}, {""token"": ""lipid"", ""start_span"": 155, ""end_span"": 160, ""type"": ""Chemical""}]"
Surprisingly, the reduction in fatty acid oxidation rates in PGC - 1 alpha null hepatocytes was not due to altered expression of PGC - 1 alpha / PPAR target genes involved in mitochondrial fatty acid oxidation.	"fatty acid	31	41	Chemical"	"fatty acid	189	199	Chemical"	"[{""token"": ""fatty acid"", ""start_span"": 31, ""end_span"": 41, ""type"": ""Chemical""}, {""token"": ""fatty acid"", ""start_span"": 189, ""end_span"": 199, ""type"": ""Chemical""}]"
In addition, we found that triglyceride synthesis was abnormally activated, and the expression of genes encoding SREBP - 1c and SCD - 1, key proteins in the hepatic lipogenic pathway, failed to be appropriately down - regulated in fasted PGC - 1 alpha - / - mice.	"triglyceride	27	39	Chemical"	"proteins	141	149	Chemical"	"[{""token"": ""triglyceride"", ""start_span"": 27, ""end_span"": 39, ""type"": ""Chemical""}, {""token"": ""proteins"", ""start_span"": 141, ""end_span"": 149, ""type"": ""Chemical""}]"
Indeed, the relative contribution of increased triglyceride synthesis rates to the steatotic phenotype cannot be fully discerned from our data, given that this response could reflect the direct effects of PGC - 1 alpha deficiency on target genes or a secondary compensatory response to hepatocyte fatty acid accumulation.	"triglyceride	47	59	Chemical"	"fatty acid	297	307	Chemical"	"[{""token"": ""triglyceride"", ""start_span"": 47, ""end_span"": 59, ""type"": ""Chemical""}, {""token"": ""fatty acid"", ""start_span"": 297, ""end_span"": 307, ""type"": ""Chemical""}]"
We conclude that reduced hepatocyte mitochondrial respiratory capacity, and possibly activation of lipogenic programs, result in hepatocyte triglyceride accumulation in the context of increased hepatic delivery of fatty acids such as occurs with fasting.	"triglyceride	140	152	Chemical"	"fatty acids	214	225	Chemical"	"[{""token"": ""triglyceride"", ""start_span"": 140, ""end_span"": 152, ""type"": ""Chemical""}, {""token"": ""fatty acids"", ""start_span"": 214, ""end_span"": 225, ""type"": ""Chemical""}]"
Moreover, female PGC - 1 alpha - / - mice were more glucose - tolerant and insulin - sensitive than PGC - 1 alpha + / + controls when consuming a high - fat diet.	"glucose	52	59	Chemical"	"insulin	75	82	Chemical"	"[{""token"": ""glucose"", ""start_span"": 52, ""end_span"": 59, ""type"": ""Chemical""}, {""token"": ""insulin"", ""start_span"": 75, ""end_span"": 82, ""type"": ""Chemical""}]"
However, we cannot exclude the possibility that the sensitivity of the immunoblotting was not high enough to pick up a small amount of mutant ( truncated) PGC - 1 alpha protein that could have some activity, given that it would contain nuclear receptor - interacting domains and the amino - terminal activation domain.	"protein	169	176	Chemical"	"amino	283	288	Chemical"	"[{""token"": ""protein"", ""start_span"": 169, ""end_span"": 176, ""type"": ""Chemical""}, {""token"": ""amino"", ""start_span"": 283, ""end_span"": 288, ""type"": ""Chemical""}]"
Mitochondrial respiration was assessed in saponin - skinned soleus fibers with succinate as substrate and in the presence of rotenone as previously described [ 44].	"succinate	79	88	Chemical"	"rotenone	125	133	Chemical"	"[{""token"": ""succinate"", ""start_span"": 79, ""end_span"": 88, ""type"": ""Chemical""}, {""token"": ""rotenone"", ""start_span"": 125, ""end_span"": 133, ""type"": ""Chemical""}]"
Following measurement of basal state 2 respiration, maximal ( ADP - stimulated) state 3 respiration was determined by exposing fibers to 1 mM ADP.	"ADP	62	65	Chemical"	"ADP	142	145	Chemical"	"[{""token"": ""ADP"", ""start_span"": 62, ""end_span"": 65, ""type"": ""Chemical""}, {""token"": ""ADP"", ""start_span"": 142, ""end_span"": 145, ""type"": ""Chemical""}]"
The integrity of the outer mitochondrial membrane was assessed by adding 8 mu M exogenous cytochrome c to ADP - stimulated fibers.	"cytochrome c	90	102	Chemical"	"ADP	106	109	Chemical"	"[{""token"": ""cytochrome c"", ""start_span"": 90, ""end_span"": 102, ""type"": ""Chemical""}, {""token"": ""ADP"", ""start_span"": 106, ""end_span"": 109, ""type"": ""Chemical""}]"
The solubility of oxygen in the respiration buffer at 25 degrees C was taken as 246. 87 nmol O2. ml - 1.	"oxygen	18	24	Chemical"	"O2	93	95	Chemical"	"[{""token"": ""oxygen"", ""start_span"": 18, ""end_span"": 24, ""type"": ""Chemical""}, {""token"": ""O2"", ""start_span"": 93, ""end_span"": 95, ""type"": ""Chemical""}]"
Insulin and glucose tolerance tests	"Insulin	0	7	Chemical"	"glucose	12	19	Chemical"	"[{""token"": ""Insulin"", ""start_span"": 0, ""end_span"": 7, ""type"": ""Chemical""}, {""token"": ""glucose"", ""start_span"": 12, ""end_span"": 19, ""type"": ""Chemical""}]"
Glucose and Insulin tolerance tests were performed as described [ 35].	"Glucose	0	7	Chemical"	"Insulin	12	19	Chemical"	"[{""token"": ""Glucose"", ""start_span"": 0, ""end_span"": 7, ""type"": ""Chemical""}, {""token"": ""Insulin"", ""start_span"": 12, ""end_span"": 19, ""type"": ""Chemical""}]"
Tail blood glucose was determined at 0, 30, 60, and 120 min after challenge using a B - GLUCOSE Analyzer ( Hemacue AB, Angelholm, Sweden).	"glucose	11	18	Chemical"	"GLUCOSE	88	95	Chemical"	"[{""token"": ""glucose"", ""start_span"": 11, ""end_span"": 18, ""type"": ""Chemical""}, {""token"": ""GLUCOSE"", ""start_span"": 88, ""end_span"": 95, ""type"": ""Chemical""}]"
Soleus muscle and liver were dissected and fixed overnight in 2% glutaraldehyde, 1% paraformaldehyde, and 0. 08% sodium cacodylate buffer.	"sodium	113	119	Chemical"	"cacodylate	120	130	Chemical"	"[{""token"": ""sodium"", ""start_span"": 113, ""end_span"": 119, ""type"": ""Chemical""}, {""token"": ""cacodylate"", ""start_span"": 120, ""end_span"": 130, ""type"": ""Chemical""}]"
Fatty acid oxidation and triglyceride synthesis experiments were commenced 2 - 3 h after the cells were plated.	"Fatty acid	0	10	Chemical"	"triglyceride	25	37	Chemical"	"[{""token"": ""Fatty acid"", ""start_span"": 0, ""end_span"": 10, ""type"": ""Chemical""}, {""token"": ""triglyceride"", ""start_span"": 25, ""end_span"": 37, ""type"": ""Chemical""}]"
Respiration studies were performed in the presence of 5 mM succinate in the presence of 10 mu M rotenone.	"succinate	59	68	Chemical"	"rotenone	96	104	Chemical"	"[{""token"": ""succinate"", ""start_span"": 59, ""end_span"": 68, ""type"": ""Chemical""}, {""token"": ""rotenone"", ""start_span"": 96, ""end_span"": 104, ""type"": ""Chemical""}]"
Respiration rates were expressed as nmol O2. min - 1. mg of protein - 1.	"O2	41	43	Chemical"	"protein	60	67	Chemical"	"[{""token"": ""O2"", ""start_span"": 41, ""end_span"": 43, ""type"": ""Chemical""}, {""token"": ""protein"", ""start_span"": 60, ""end_span"": 67, ""type"": ""Chemical""}]"
Upon removal, the muscle was suspended in a Krebs solution aerated with 95% O2 and 5% CO2.	"O2	76	78	Chemical"	"CO2	86	89	Chemical"	"[{""token"": ""O2"", ""start_span"": 76, ""end_span"": 78, ""type"": ""Chemical""}, {""token"": ""CO2"", ""start_span"": 86, ""end_span"": 89, ""type"": ""Chemical""}]"
Animals were then deeply anesthetized with 5 - 10 mg of sodium pentobarbital IP.	"sodium	56	62	Chemical"	"pentobarbital	63	76	Chemical"	"[{""token"": ""sodium"", ""start_span"": 56, ""end_span"": 62, ""type"": ""Chemical""}, {""token"": ""pentobarbital"", ""start_span"": 63, ""end_span"": 76, ""type"": ""Chemical""}]"
We would like to thank Deanna Young and Karen Hemker for help with mouse husbandry, Carolyn Mansfield for ES cell and mouse genotyping, Anthony Nardi for assistance with the studies to assess general activity and muscle strength, Bill Kraft for expert technical assistance with electron microscopy, Carla Weinheimer for performing cardiac catheterizations, Trey Coleman for performing the TAG assays, Krista Olson for expert technical assistance with the Langendorff method, and Mary Wingate for assistance with manuscript preparation.	"electron	278	286	Chemical"	"TAG	389	392	Chemical"	"[{""token"": ""electron"", ""start_span"": 278, ""end_span"": 286, ""type"": ""Chemical""}, {""token"": ""TAG"", ""start_span"": 389, ""end_span"": 392, ""type"": ""Chemical""}]"
SREBP - sterol regulatory element binding protein	"sterol	8	14	Chemical"	"protein	42	49	Chemical"	"[{""token"": ""sterol"", ""start_span"": 8, ""end_span"": 14, ""type"": ""Chemical""}, {""token"": ""protein"", ""start_span"": 42, ""end_span"": 49, ""type"": ""Chemical""}]"
TAG - triglyceride	"TAG	0	3	Chemical"	"triglyceride	6	18	Chemical"	"[{""token"": ""TAG"", ""start_span"": 0, ""end_span"": 3, ""type"": ""Chemical""}, {""token"": ""triglyceride"", ""start_span"": 6, ""end_span"": 18, ""type"": ""Chemical""}]"
Ethidium bromide staining of 18S ribosomal RNA is shown at the bottom.	"Ethidium bromide	0	16	Chemical"	"ribosomal RNA	33	46	Chemical"	"[{""token"": ""Ethidium bromide"", ""start_span"": 0, ""end_span"": 16, ""type"": ""Chemical""}, {""token"": ""ribosomal RNA"", ""start_span"": 33, ""end_span"": 46, ""type"": ""Chemical""}]"
The results are based on six female animals in each group, using succinate as a substrate in the presence of rotenone.	"succinate	65	74	Chemical"	"rotenone	109	117	Chemical"	"[{""token"": ""succinate"", ""start_span"": 65, ""end_span"": 74, ""type"": ""Chemical""}, {""token"": ""rotenone"", ""start_span"": 109, ""end_span"": 117, ""type"": ""Chemical""}]"
Mean values ( +/- SEM) are shown for state 2 ( basal), state 3 ( ADP - stimulated), and state 4 respiration ( presence of oligomycin).	"ADP	65	68	Chemical"	"oligomycin	122	132	Chemical"	"[{""token"": ""ADP"", ""start_span"": 65, ""end_span"": 68, ""type"": ""Chemical""}, {""token"": ""oligomycin"", ""start_span"": 122, ""end_span"": 132, ""type"": ""Chemical""}]"
To evaluate the oxygen consumption ( VO2) in response to the stimulation of BAT uncoupled respiration, the beta 3 - adrenergic agonist BRL 37344 was administered to littermate PGC - 1 alpha + / + ( n = 5) and PGC - 1 alpha - / - ( n = 5) female mice followed by measurement of VO2 by indirect calorimetry.	"oxygen	16	22	Chemical"	"adrenergic agonist	116	134	Chemical"	"[{""token"": ""oxygen"", ""start_span"": 16, ""end_span"": 22, ""type"": ""Chemical""}, {""token"": ""adrenergic agonist"", ""start_span"": 116, ""end_span"": 134, ""type"": ""Chemical""}]"
( A) Oil red O staining of isolated hepatocytes exposed to BSA alone ( BSA) or 50 mu M oleate complexed to BSA ( oleate).	"oleate	87	93	Chemical"	"oleate	113	119	Chemical"	"[{""token"": ""oleate"", ""start_span"": 87, ""end_span"": 93, ""type"": ""Chemical""}, {""token"": ""oleate"", ""start_span"": 113, ""end_span"": 119, ""type"": ""Chemical""}]"
( B) 3H - palmitate oxidation rates.	"3H	5	7	Chemical"	"palmitate	10	19	Chemical"	"[{""token"": ""3H"", ""start_span"": 5, ""end_span"": 7, ""type"": ""Chemical""}, {""token"": ""palmitate"", ""start_span"": 10, ""end_span"": 19, ""type"": ""Chemical""}]"
( C) State 2 and 3 respiration rates determined for hepatocytes isolated from PGC - 1 alpha + / + ( n = 3) and PGC - 1 alpha - / - ( n = 3) mice using succinate / rotenone as a substrate.	"succinate	151	160	Chemical"	"rotenone	163	171	Chemical"	"[{""token"": ""succinate"", ""start_span"": 151, ""end_span"": 160, ""type"": ""Chemical""}, {""token"": ""rotenone"", ""start_span"": 163, ""end_span"": 171, ""type"": ""Chemical""}]"
The bars represent mean TAG synthesis rates ( glycerol incorporation, see Materials and Methods) for hepatocytes isolated from PGC - 1 alpha + / + ( n = 6) and PGC - 1 alpha - / - ( n = 6) mice.	"TAG	24	27	Chemical"	"glycerol	46	54	Chemical"	"[{""token"": ""TAG"", ""start_span"": 24, ""end_span"": 27, ""type"": ""Chemical""}, {""token"": ""glycerol"", ""start_span"": 46, ""end_span"": 54, ""type"": ""Chemical""}]"
Female PGC - 1 alpha - / - Mice Are More Glucose Tolerant and Insulin Sensitive Compared to PGC - 1 alpha + / + on High - Fat Diet	"Glucose	41	48	Chemical"	"Insulin	62	69	Chemical"	"[{""token"": ""Glucose"", ""start_span"": 41, ""end_span"": 48, ""type"": ""Chemical""}, {""token"": ""Insulin"", ""start_span"": 62, ""end_span"": 69, ""type"": ""Chemical""}]"
( A) At 4. 5 mo of age, glucose tolerance testing ( GTT) was performed on female PGC - 1 alpha + / + ( n = 6) and PGC - 1 alpha - / - ( n = 6) mice maintained on standard chow.	"glucose	24	31	Chemical"	"chow	171	175	Chemical"	"[{""token"": ""glucose"", ""start_span"": 24, ""end_span"": 31, ""type"": ""Chemical""}, {""token"": ""chow"", ""start_span"": 171, ""end_span"": 175, ""type"": ""Chemical""}]"
Neuronal cells of all areas in the adult brain present Annexin A7 in the nucleus, whereas glial fibrillary acidic protein ( GFAP) - positive astrocytes exhibit both, a cytoplasmic and nuclear staining.	"acidic	107	113	Chemical"	"protein	114	121	Chemical"	"[{""token"": ""acidic"", ""start_span"": 107, ""end_span"": 113, ""type"": ""Chemical""}, {""token"": ""protein"", ""start_span"": 114, ""end_span"": 121, ""type"": ""Chemical""}]"
The N - terminal regions are thought to confer functional diversity to the annexin proteins [ 2].	"N	4	5	Chemical"	"proteins	83	91	Chemical"	"[{""token"": ""N"", ""start_span"": 4, ""end_span"": 5, ""type"": ""Chemical""}, {""token"": ""proteins"", ""start_span"": 83, ""end_span"": 91, ""type"": ""Chemical""}]"
Annexin A7, the first annexin to be described, was isolated as the agent that mediated aggregation of chromaffin granules and fusion of membranes and phospholipids in the presence of Ca2 + - ions [ 3].	"phospholipids	150	163	Chemical"	"Ca2 + - ions	183	195	Chemical"	"[{""token"": ""phospholipids"", ""start_span"": 150, ""end_span"": 163, ""type"": ""Chemical""}, {""token"": ""Ca2 + - ions"", ""start_span"": 183, ""end_span"": 195, ""type"": ""Chemical""}]"
First we examined the expression of Annexin A7 in ES cells ( Bruce4, established from C57BL / 6J mice) and the early stages of mouse embryonic development at the mRNA level by northern blot analysis and at the protein level by Western blotting and immunohistochemistry, respectively.	"mRNA	162	166	Chemical"	"protein	210	217	Chemical"	"[{""token"": ""mRNA"", ""start_span"": 162, ""end_span"": 166, ""type"": ""Chemical""}, {""token"": ""protein"", ""start_span"": 210, ""end_span"": 217, ""type"": ""Chemical""}]"
In the present study we explored the appearance of Annexin A7 during mouse development at the mRNA and protein level and focused on the central nervous system during embryogenesis.	"mRNA	94	98	Chemical"	"protein	103	110	Chemical"	"[{""token"": ""mRNA"", ""start_span"": 94, ""end_span"": 98, ""type"": ""Chemical""}, {""token"": ""protein"", ""start_span"": 103, ""end_span"": 110, ""type"": ""Chemical""}]"
Indeed, when we analyzed primary astrocytes from an AnxA7 - / - mouse for Ca2 + - dependent signaling processes, we found that they exhibited a significantly increased velocity of mechanically induced astrocytic Ca2 + - waves as compared to wild type [ 9].	"Ca2 +	74	79	Chemical"	"Ca2 +	212	217	Chemical"	"[{""token"": ""Ca2 +"", ""start_span"": 74, ""end_span"": 79, ""type"": ""Chemical""}, {""token"": ""Ca2 +"", ""start_span"": 212, ""end_span"": 217, ""type"": ""Chemical""}]"
For Annexin A11 it was shown that nuclear localization is mediated by its N - terminal region, which also contains a binding side for the S100 protein calcyclin [ 29].	"N	74	75	Chemical"	"protein	143	150	Chemical"	"[{""token"": ""N"", ""start_span"": 74, ""end_span"": 75, ""type"": ""Chemical""}, {""token"": ""protein"", ""start_span"": 143, ""end_span"": 150, ""type"": ""Chemical""}]"
Antibodies used in this study were mAb 203 - 217 directed against the core domain of mouse Annexin A7 [ 6] ( purified IgG, 1: 50) specifically recognizing both Annexin A7 isoforms [ [ 6, 10], and data not shown], a polyclonal antibody against mouse Annexin A7 [ 10] ( 1: 200), a polyclonal antiserum raised against the astrocyte - specific intermediate filament glial fibrillary acidic protein ( GFAP; DAKO, 1: 400), anti - beta - tubulin ( Sigma, 1: 1000), anti - Emerin ( novocastra, 1: 2000), and polyclonal anti - LAP2 alpha ( kindly provided by Ronald Foisner, 1: 5000).	"acidic	379	385	Chemical"	"protein	386	393	Chemical"	"[{""token"": ""acidic"", ""start_span"": 379, ""end_span"": 385, ""type"": ""Chemical""}, {""token"": ""protein"", ""start_span"": 386, ""end_span"": 393, ""type"": ""Chemical""}]"
The paraffin - embedded sections were first treated three times for 2 min in xylene to remove paraffin and then rehydrated step by step with descending concentrations of ethanol for antibody staining [ 35].	"xylene	77	83	Chemical"	"ethanol	170	177	Chemical"	"[{""token"": ""xylene"", ""start_span"": 77, ""end_span"": 83, ""type"": ""Chemical""}, {""token"": ""ethanol"", ""start_span"": 170, ""end_span"": 177, ""type"": ""Chemical""}]"
After five washes in PBG for 5 min each, the slides were incubated for 1 h with the secondary antibody at room temperature, washed three times in PBG and three times in PBS, 5 min each, rinsed in water and embedded in gelvatol [ 36].	"water	196	201	Chemical"	"gelvatol	218	226	Chemical"	"[{""token"": ""water"", ""start_span"": 196, ""end_span"": 201, ""type"": ""Chemical""}, {""token"": ""gelvatol"", ""start_span"": 218, ""end_span"": 226, ""type"": ""Chemical""}]"
Cells or cellular fractions were lysed in SDS sample buffer and homogenates were subjected to SDS - PAGE.	"SDS	42	45	Chemical"	"SDS	94	97	Chemical"	"[{""token"": ""SDS"", ""start_span"": 42, ""end_span"": 45, ""type"": ""Chemical""}, {""token"": ""SDS"", ""start_span"": 94, ""end_span"": 97, ""type"": ""Chemical""}]"
The membranes were hybridized with a random - primed [ alpha - 32P] - dATP - labelled full length annexin A7 cDNA probe and with a beta - actin specific probe for control in ExpressHyb solution according to the manufacturer ' s directions.	"32P	63	66	Chemical"	"dATP	70	74	Chemical"	"[{""token"": ""32P"", ""start_span"": 63, ""end_span"": 66, ""type"": ""Chemical""}, {""token"": ""dATP"", ""start_span"": 70, ""end_span"": 74, ""type"": ""Chemical""}]"
Expression of Er81 in DRG neurons of embryos containing integration of EWS - Pea3 in the Er81 locus ( Er81EWS - Pea3 / -) was abolished ( Figure 1E), and the expression level of the calcium - binding protein Parvalbumin ( PV) in proprioceptive afferents, which is decreased approximately 5 - to 10 - fold in Er81 mutants [ 14], was comparable to wild - type levels in Er81EWS - Pea3 / - embryos ( Figure 1F - 1H).	"calcium	182	189	Chemical"	"protein	200	207	Chemical"	"[{""token"": ""calcium"", ""start_span"": 182, ""end_span"": 189, ""type"": ""Chemical""}, {""token"": ""protein"", ""start_span"": 200, ""end_span"": 207, ""type"": ""Chemical""}]"
Calretinin and Calbindin, two different calcium - binding proteins expressed by subpopulations of DRG neurons in wild - type, Er81EWS - Pea3 / -, and TauEWS - Pea3 / + PVCre / + embryos ( Figure 7E, 7G, and 7H; data not shown) [ 31, 32], were induced in more than 95% of all DRG neurons of TauEWS - Pea3 / + Isl1Cre / + embryos ( Figures 7F and S5).	"calcium	40	47	Chemical"	"proteins	58	66	Chemical"	"[{""token"": ""calcium"", ""start_span"": 40, ""end_span"": 47, ""type"": ""Chemical""}, {""token"": ""proteins"", ""start_span"": 58, ""end_span"": 66, ""type"": ""Chemical""}]"
Terminal deoxynucleotidyl transferase - mediated biotinylated UTP nick end labeling ( TUNEL) to detect apoptotic cells in E13. 5 DRG on cryostat sections was performed as described by the manufacturer ( Roche, Basel, Switzerland).	"deoxynucleotidyl	9	25	Chemical"	"UTP	62	65	Chemical"	"[{""token"": ""deoxynucleotidyl"", ""start_span"": 9, ""end_span"": 25, ""type"": ""Chemical""}, {""token"": ""UTP"", ""start_span"": 62, ""end_span"": 65, ""type"": ""Chemical""}]"
Protein extracts were resolved by SDS - PAGE, and immunoblotting was performed using antibodies against Akt, p - Akt ( Ser473), CREB, p - CREB ( Ser133), Bax, Bcl - xl ( Cell Signaling Technology, Beverly, Massachusetts, United States), and Bcl2 ( BD Pharmingen, San Diego, California, United States).	"Protein	0	7	Chemical"	"SDS	34	37	Chemical"	"[{""token"": ""Protein"", ""start_span"": 0, ""end_span"": 7, ""type"": ""Chemical""}, {""token"": ""SDS"", ""start_span"": 34, ""end_span"": 37, ""type"": ""Chemical""}]"
Since the termination codon was introduced in exon 8 in the pro - protein domain, only the truncated form of the ADAM22 protein would be synthesized from this targeted allele.	"protein	66	73	Chemical"	"protein	120	127	Chemical"	"[{""token"": ""protein"", ""start_span"": 66, ""end_span"": 73, ""type"": ""Chemical""}, {""token"": ""protein"", ""start_span"": 120, ""end_span"": 127, ""type"": ""Chemical""}]"
Absence of mature ADAM22 protein in homozygous mutants was confirmed by Western blot analysis using the specific antibody, which recognizes the cytoplasmic domain of the ADAM22 protein ( Fig. 1C).	"protein	25	32	Chemical"	"protein	177	184	Chemical"	"[{""token"": ""protein"", ""start_span"": 25, ""end_span"": 32, ""type"": ""Chemical""}, {""token"": ""protein"", ""start_span"": 177, ""end_span"": 184, ""type"": ""Chemical""}]"
Myelin - formation detected by MBP ( myelin basic protein) staining of the mutant in the cerebellum ( Fig. 4H) and spinal cord ( Fig. 4L) was also indistinguishable with the wild - type littermate ( Figs. 4G, K).	"basic	44	49	Chemical"	"protein	50	57	Chemical"	"[{""token"": ""basic"", ""start_span"": 44, ""end_span"": 49, ""type"": ""Chemical""}, {""token"": ""protein"", ""start_span"": 50, ""end_span"": 57, ""type"": ""Chemical""}]"
